"angled across Stokes, who squeezes another single out off the bottom half of the bat"
"short ball, Woakes pulls from wide of off stump, loops h-i-i-i-i-i-i-i-i-i-i-i-i-i-i-g-h out towards deep midwicket - where it is superbly taken diving forwards! Not in control of that, Bishoo doing very well to hold on"
"full outside off, Stokes sends up a steepler... taken! Two in two balls for Holder, came off the toe of the bat again, Stokes heaving for the hills, went high but not very far and it's another decent catch at backward point"
"over the wicket, good length and Plunkett shows it a diligent straight bat"
touch short and helped away through backward square leg for one
"woof, how has that missed the stumps! A cutter from Brathwaite, maybe disturbed the surface, Plunkett was late on it but it bounced over the wicket"
"length ball, Plunkett shovels across the line and picks up one"
"full outside off, a bottom-handed larrup over cover brings Rashid two"
"pitched up and Rashid again punches firmly, through mid-off for one this time"
"on the stumps, bunted back down the ground"
"slower ball, Rashid picks it, gives it the big heave ho... and he has absolutely <i>moosed</i> this over deep midwicket for six! Sweet connection to put the cap on Brathwaite's wicketless ten overs"
Holder hits back of a length and beats the bat as Plunkett swings off the back foot
"short ball, swung into the leg side, is there two in this? No, Plunkett sends Rashid back and he is well short as Hope breaks the stumps!"
sprayed down the leg side for an extra
"banged in short, Finn can't reach it on the pull, that'll be another wide"
"leg side, Finn swishes and it comes off the pads through to Hope, whose throw to the non-striker's end is a tired one"
"pitched up and Plunkett nails a slog down the ground for six! A blacksmith biff from Plunkett, down on one knee and he sends it over the ropes for the 10th time today"
on the stumps and clumped into the leg side for a single
"pitched full on off, Finn bashes it through the leg side, there's not two on so he grounds his bat and waits at the non-striker's end... while Plunkett comes ambling halfway up the pitch and is run out by miles to draw a final line under proceedings"
down the leg side. The ideal line to the right hander... good carry at least
tapped to mid-on
"on the pads, a top-edge over the leg-side, and that flies all the way! Well, there is clearly oodles of bounce for Finn to exploit, if he can tighten his line.."
"as soft as they come! A lollipop of a catch to square leg, just a fence off the toes, half defensive, half attacking, and emphatically out"
zippy! Wide of off stump and exploding off the deck. Buttler hauls it back in with one glove high above his head
full and straight. <strike>The end of a successful over</strike> oh no it's not
"good pace once again, through to the keeper"
"Lewis, with his hurty arm, hasn't had much time for a sit-down"
flung well wide of off stump
squared up on a back-of-a-length line
"a pretty woeful attempted pull, beaten for pace and, especially, bounce, and the second lollipop catch of the innings. That came off the splice with no pace at all, as if he'd swapped his bat for a welly, and Woakes just strolled up in his followthrough. This is getting a bit grim for Windies"
more good bounce from a strong wrist
through to the keeper
"back of a length, attempted cut down to the third man, but too cramped to get the ball away"
"an emphatic appeal for lbw as Brathwaite topples across his crease to an undeniably adjacent delivery. No review, and rightly so, that was sliding down"
"clipped to midwicket, Stokes swoops to intercept"
"outside off, and climbing through to the keeper"
this one zips back sharply and just grazes past the pad. Beaten for pace
"cut, loosely, in the air, and inches short of a tumbling Adil Rashid at third man!"
angled into the off side
chopped out to point
nudged into the leg side
belted into the off side with a front-foot wallop. Moeen Ali intercepts well with a dive at mid-off
"pop a doodle doo! Yet another lollipop catch, clipped from back of a length to midwicket, the pace and bounce drawing Brathwaite out of his comfort zone and leaving West Indies utterly rudderless in a futile chase"
"chopped in the air once more, down to third man.... and it's dropped short once again! Plunkett galloped in but was never close"
inside-edged defence onto the back pad. It's all going off out there
"sharp lift from back of a length. Raps the gloves, and that is an uncomfortable length. Six of those an over won't be gratefully received"
"lifting sharply again, and another top-edged pull flies safe! Over the keeper's head, and that's the safest area of the field"
full and threatening. Defended earnestly into the off side
"on the back foot once again, defended to the on side"
"strikes the pad, angling down the leg side"
"good finish to the over, springboard bounce towards the top of off stump, and blocked to cover"
forward and blocked to the off side
"up onto the toes, a better-looking cut but straight to point"
"on the back foot, and blocked down the track"
crunched into the off side
"tucked off the toes, out to midwicket"
"half-forward, not quite trusting his technique to get right to the pitch of the ball. But safely steered away"
"on the back foot, drilled into the crease by Finn's heavy balls. So to speak"
angled defence to point
"a hopeless swish across the line, and Finn has a mouthful in his followthrough. That was pretty filthy. (The shot that is, can't vouch for Finn's verdict...)"
"leaning onto the front foot, pushed to cover"
"riding the bounce outside off stump, and angled down to third man"
another over seen off
"on the back foot, clobbered to cover with a cross-batted swish"
"in the air, but that is as good as it has got for West Indies, a bit of a long-hop outside off stump, a wide offcutter, and slammed between the fielders in the covers"
poked into the off side
"outside off, nibbling off the deck and beating the edge. That was wider on the crease and straightened appreciably"
"forward and pushed down the ground. A bit of swing through the air as well, but well met with a straight blade"
"on the back foot, lots of wind-up but not a lot of impact in that cut-cum-slash"
"flipped up and over the infield, one leg kicking back as he does so"
"that's a fine strike, on the back foot and rifled into the covers"
"very full, defended down into the crease, as Hope loses sight of the ball momentarily after impact"
"keeps a touch low, or comparatively low, as Hope hops into line to defend"
turned to midwicket
"fizzing through, that got up sharply outside off stump at 85mph. Not express, but his bounce will make that feel distinctly uncomfortable"
zipping through to the keeper
"very full length, and pumped into the covers once more"
"rising from a good length, and jabbed to cover"
"that is a beauty. Wide on the crease, bursts off the seam, beats the edge with extra lift to the keeper"
more trampoline bounce
"much fuller, targeting the blockhole and slapped into the covers. A maiden"
firm push to mid-off
"angled into the leg stump, defended"
"that's a beautiful strike, into the off side, just a nudge too full from Plunkett, and quickly dealt with"
jabbed to the off side
"clipped in the air, almost another lobbed catch to midwicket, but not enough legs on this one"
flashed to point off the back foot
"full length, angled into the pads, clipped to square leg"
"on the front foot, a compact drive to cover"
"short and sharp, another whistly pull, and once again no contact"
an inside-out drive through mid-on
"tight line, no way through there"
cut to backward point.
"bowled him! Full and straight from Plunkett, Mohammed appeared to drive inside the line, and had his off stump demolished!"
"keeps unexpectedly low, but passes harmlessly past the off stump"
"very full once again, drilled to cover"
"outside off, through to the keeper"
"Squelch! Carter doubles up, and ends up crawling off the square in agony. Oh blimey, that took the inside-edge, straight into his spuds. Chips for dinner tonight!"
through to the keeper to complete a wicket-maiden
"outside off, fenced to cover"
"on the pads, whittled into the leg side"
tapped into the covers for a simple single
"attempted pull, flicks off the pads down to fine leg"
"back of a length, targetting the top of off. Defended to cover"
"edged through third man, that'll do"
"on the pads, tucked out to midwicket"
"outside off, riding the bounce and fending the ball down to third man"
"pushed off the back foot, into the covers"
through to the keeper and no stroke offered
"keeps a touch low outside off, no stroke once again"
angled defence into the off side
full length and driven back to the bowler
"squirted down through third man, a productive region in these straitened times"
"a big wind-up, but an attempted club off a full length dribbles out to midwicket"
tapped to the leg side once again
"attempted cut, can't break through the cover ring"
"on the front foot, clunked to deep cover"
"slightly leg side, hits the thigh pad as Hope prods across the line"
"on the pads, chipped to square leg, another limp dismissal and Windies are cosying up to ignominy. Second for Plunkett and Hope's semi-competitive stay is over"
"nips back, takes the inside edge - two in two for Plunkett! He's on a hat-trick! A nasty ball to get first up, rearing off a length and it came back in to flick the shoulder of the bat, an excellent diving catch from Buttler completed Holder's dismissal"
"pitched up outside off, he leans on it and gently defuses the bomb"
"straighter line, shuffles across and works to leg"
"good length on off, Brathwaite shows some composure and blocks once more"
"round the wicket to Carter, drifting down the leg side and he gets it away on the sweep for four"
tossed up on off stump and pushed into the off side
"slides too close to leg stump once again and Carter clips it fine, past short fine leg and it runs away, bringing up the Windies' 50 in the process. Yay"
floated up and pushed back down the ground for one
"over the wicket to Brathwaite, who defends on the front foot"
"flighted, outside off and punched down the ground to long-off for Brathwaite's first run"
"good length, around off stump, Brathwaite shows it a straight bat"
"back of a length, turned to the leg side as he moves across his stumps"
"short again, sprayed down the leg side"
"back of a length around off stump, defended"
Brathwaite gets across on off stump and blocks again
"shortish, stays in the crease and works the ball towards midwicket"
on the stumps and defended to complete another maiden for Plunkett
"goes on with the arm, into the front pad - and given lbw! Carter <b>reviews</b>, was there some inside edge? Could also be a question of line, too... but what will the technology tell us? Not Hot Spot or Snicko here, of course, but the cameras seem to have picked up a deviation as the ball passed the bat, yes, looks like an edge on to the pad and Ruchira Palliyaguruge's <b>decision will be overturned</b>"
tossed up outside off and stroked into the covers on the front foot
"flighted, tapped away on the off side"
"drops a little short and Carter takes advantage, dropping back to hammer a cut behind square"
"angled in, worked against the turn through midwicket"
"Moeen goes over the wicket, pushed through and defended on the front foot"
"short of a length, tapped down into the leg side"
"slightly short and wide, Carter rocks back and slices a couple wide of third man"
"short of a length, punched square on the back foot, well stopped by point"
"closer to the stumps, 132kph/81mph and prodded into the covers"
"tight line from Finn, climbing off a length outside off, Carter watches it through"
"goes round the wicket, tucked up trying to cut a short ball and it flies past the edge"
"floated up outside the line of off, Brathwaite steps out and drives through the covers for a couple"
presses forward on off stump and blocks
angled in with the arm and worked to the leg side
"flighted, on middle and off, Brathwaite gets across to defend"
"tossed up and pushed through the off side coming forwards - that's it, West Indies have raised the number of the beast. Appropriate, the way this game has gone"
"goes round the wicket to Carter, who leans out to block on off stump"
"angled in back of a length, hits the thigh pad and plops into the leg side"
"bit of a sketchy prod in the channel, no slip in and Brathwaite gets one for a thick edge to third man"
"round the wicket, extra bounce and that takes Carter on the forearm as he pushed forward. Owee owe"
"short and nibbling away from the bat as Carter tries to punch off the back foot, perilously close to the outside edge"
"shortish, over the top of middle and off, tucked towards midwicket"
"good-length ball, comes forward and defends with a high front arm"
floated up wide of off stump and steered through point for one
"dragged down, touch too straight and Carter flicks off his hip, short fine leg cleans up"
tossed up outside off and punched through mid-off on the move
"back over the wicket to Brathwaite, who leans out and drives to deep cover for one more"
"slightly short, on the stumps and pulled behind square via a bottom edge"
"pushed through on off stump, Brathwaite defends with soft hands"
"pitched up in the channel, gets forward to drive and it takes a good stop from mid-off to prevent it running away"
"back of a length, punched down square into the off side"
"short length again, rising up to hit the leading edge and bobble back to the bowler"
"angled in with the arm from round the wicket, short of a good length and worked into the leg side"
"goes full now and Carter takes the opportunity to free the arms, chipped back past Finn's outstretched left arm - no real chance for the bowler there and it runs away between mid-on and mid-off for a couple"
"dug in short, Carter rocks on to the back foot and short-arm jabs a couple more to deep midwicket"
"this shoots on to rap the pads, surely that's plumb...? Not given by Gregory Brathwaite but England <b>review</b> and it's a quick one for the TV ump, bang in front of off stump and hitting middle halfway up, so the <b>decision is overturned</b> and Carlos Brathwaite is eventually sent on his way by his namesake. Small revenge for the World T20 final but Stokes has got his man first ball"
pitched up and drilled to the man at cover
"full toss wide of the stumps and Nurse is well forward, front leg bent as he clubs it through the covers this time for four"
slightly leg side as Nurse looks to work it away
touch shorter and Nurse shows it a straight bat
"slightly back of a length, around off stump, blocked down into the pitch"
"over the wicket, angled across and pushed into the covers"
"good length, rising outside off, defended and it nearly rebounds down on to the stumps"
"fuller, beats the bat this time as Carter aims an ill-considered swish in the channel"
"good length, slanted outside off, left alone"
"pitched up around off stump, cushioned into the covers coming forwards"
full on off and Carter strokes this along the carpet towards mid-off
"short of a length, tucked off the hip for one through square leg"
"pitched up, 138kph/86mph and driven into the ground, towards mid-off"
"fullish, slightly wider and punched back into the off side once again"
"cross-seam, Carter swings through the line, gets plenty hold of it and lofts over mid-off for a boundary"
"short outside off, slashed off the back foot through backward point"
"slides down the leg side, flick and a miss - but it's a wide"
"back of a length outside off, Nurse gets over the ball and forces one through cover point"
"goes back and across, struck hard into the covers but it's well cut off"
"full on the stumps, plopped down the ground - and taken by mid-on running back! It's an early bath for Nurse, too, as he fails to clear Plunkett on the edge of the ring. This is going to be an almighty shellacking for West Indies"
"length around off stump, maybe an offcutter and it passes the outside edge before bobbling through to Buttler"
"back of a length, hits the splice and rolls towards mid-on"
"fired across, into the tramlines"
"goes round the wicket, banged in short and swivel-pulled behind square"
stays round the wicket and Bishoo covers his stumps in defence
"length on the stumps, tapped into the leg side"
"fired across the bows, veering away and called wide"
sprays this one slightly leg side and that's another in the extra column
"overpitched, Carter leans into a princely straight drive, high elbow and he holds the pose as Stokes flings out a foot in vain, the ball races away for four!"
"good length, in the channel, Carter happy to let this one go"
"slides another behind the pads, leg-side wide... Stokes is beginning to tick a little here. Trust him to get wound up in the process of England securing a 200-run win"
"goes round the wicket, back of a length and holding its line to slide through past the bat with Carter squared up"
"cutter this time from Stokes, once again close to the edge as the batsman attempts to cut"
"bit of width, punched in front of square but Roy pounces on it and prevents a single"
"banged in, rib-tickling length and Bishoo fends at it, takes a blow on the gloves"
"round the wicket and angled in at 135kph/83mph, Bishoo stays back and blocks"
"short outside off, swing and a miss from the No. 10"
"loopy slower ball, tops to hit the toe of the bat as Bishoo reaches for a drive"
pitched up slightly wide of the stumps and Bishoo slaps a drive through backward point
"length ball around the line of off, Carter gets his head over it in defence"
"round the wicket, full outside off stump, driven back along the ground"
"length, little bit of width to swing the arm, Bishoo picks out point"
"targeting the stumps, shows it a straight bat in defence"
"dug in short of a length, over the stumps, he rides the bounce to block again"
"over off stump, Bishoo prods it away"
"good length, 141kph/88mph around off stump, defended again - maiden for Stokes"
"slower ball from Woakes, short of a length and sitting up... to be blocked"
"leg side, Carter misses with a glance and it clips the padding, runs through to Buttler's right"
"fullish, back-of-the-hand slower ball, Carter picks it and socks down the ground for a four to bring up West Indies' 100. Woot!"
good-length delivery on off stump and Carter shuffles into line to defend
touch short and steered towards point
"short, again taking the pace off, tapped down into the leg side"
"goes round the wicket and opts for chin music, Bishoo flinches underneath it"
"back of a length on the stumps, stabbed down towards midwicket"
"dug in, Bishoo sways across outside the line and swats one to fine leg"
"short of a length outside off, dobbed down into the covers"
"length ball, Carter turns it off his pads, short leg doesn't quite scoop it up cleanly but midwicket prevents a run"
"very short, trampoline bounce... over the batsman's head"
"hammers the middle of the pitch again, this time Carter pulls smoothly, wide of fine leg and they could take a second - but he elects to keep the strike *sigh*"
"round the wicket to Carter, who defends a short ball on the back foot"
"pitched up, and driven without timing back towards the bowler"
"slower cutter, short length and it beats the bat as Carter pulls, spins away off the turf and beats Buttler, too, scuttling away to the rope"
"dug in back of a length and he connects with a pull, Finn gives chase out towards deep midwicket... but his foot was deemed in contact with the rope as he slid to pull it in"
"bit of extra bounce, hits the shoulder of the bat as Carter presses out... but it loops short of backward point"
"pitched up around off stump, defended square on the off side"
"short of a length, outside off stump, play and miss backing away"
"short outside off and he pokes at it, steered down to third man for one"
"banged in short, Carter takes it on... and picks out deep-backward square leg! Carter won't get his fifty and West Indies probably won't get much further, their last recognised batsman holing out to give Finn a second wicket and leave England one away from sweeping the series"
short and steepling through to the keeper as Joseph attempts to hit Finn into the Atlantic. Missed
"short of a length outside off... and creamed through cover point, beautiful shot from Joseph! Back-foot punch, on top the bounce, right out of the middle. Woof!"
"goes straighter and Joseph heaves across the line, some lubicated gurgling emerges in the crowd as West Indies pick up a couple more"
"length, rising over the stumps, swing and a misses as Bishoo backs away"
"chipped, short of mid-on, but there's a mix-up between the batsmen and it should be a run out... but the throw to Plunkett is poor and Joseph can get back! Hales threw it hastily and too high when he could have underarmed it to the bowler. Not quite undermined his hundred, but sloppy, still"
stays back in the crease and blocks to leg
"length on middle and off, dabbed into the covers this time"
"pitched up and swatted, Bishoo coming across and he pings four in front of square"
"length in the channel, he prods at the ball and gets a thick outside edge down to third man"
"tossed up on middle and leg, Bishoo drives down the ground"
"slips in the googly straight away, Joseph gets an inside edge on to his pads playing back"
"tossed up and lofted over the leg side, big wind up but it's just a single"
"flighted, on middle and leg, played with the spin through midwicket"
"floats up a legbreak on leg stump, flicked to midwicket"
full and flighted and swished away off the inside edge for one more
"stand and deliver! Joseph plants Plunkett into the stand at long-on, a dismissive swing of the bat"
"pitched up and this is clubbed over the infield, four more through wide long-on this time... Rally?"
"length outside off, smeared over cover this time, again clears the ring"
"back of a length, booming golf swing but this time he fails to connect"
on the stumps and miscued through square leg as Joseph continues to hack away
"round the wicket to Bishoo, who calmly blocks out the final ball of the over. I might have enjoyed it if West Indies had taken this approach an hour ago..."
tossed up on the stumps and whipped through midwicket
"full on the stumps, Bishoo humps it to midwicket - and that is that! Roy tosses the ball into the Bajan skies and <b>England have won by 186 runs</b>"
