"tight line, solid defence, pushed back down the pitch"
"tighter line, tapped to mid-on"
"that's a good line, tight to off stump and carrying through to the keeper with some extra bounce. No stroke"
"outside off, bashed firmly to backward point, a loose wafty cut, but timed pretty well"
"thumped high, hard and straight through long-off. Beautiful pointy elbows, so sharp you could cut yourself on them"
"pushed firmly through wide mid-on, a very deliberate directional shot. Roy starting to dictate terms towards the end of that over"
a hint of outswing from a good full length. No stroke offered
"banged in short, and pulled slightly awkwardly through backward square leg. Got enough bat on it to keep control of the stroke though. Good pace, evidently!"
"onto the front foot, and drilled firmly into the covers"
"clipped off the front foot, out to midwicket"
"nudged into the leg side, just back of a length this time"
"rifled into the covers with a slightly tentative drive, more exploratory than authoritative.  But he found enough of the middle to beat the field"
"short, pulled, and so nearly carries to Jason Mohammed at short midwicket. He had to dive forward and to his right, but couldn't quite scoop the offering"
"in the air once again, Roy suckered by the extra bounce as he sought to clip on the up through midwicket. Flies into the gap, luckily for him"
"on the back foot, defended more calmly this time"
"onto the back foot, swished through the leg side. That was too short at Holder's pace, and sumptuously wafted away to the boundary"
pushed back down the pitch from a full length
stout defence from deep in the crease
"good line and length, probing away on off stump and demanding a respectful back-foot block"
short and hoisted over the leg side once again. I think pitching it up is going to be the key on this surface
"on the front foot, pongoed into the leg side with a distinct lack of ceremony"
"fuller, leg-sided but a hint of encouraging swing. Hales lifts his toes out of harm's way as the bat comes through to clip a single to fine leg"
"swung into the leg side again. Not quite as short as the others, but eased behind square"
"outside off, poked down to third man"
"on the toes, tucked out to the leg side"
stabbed behind square on the off side
"body behind the line, defending into the off side"
"on the toes, worked behind square"
calmly placed into the covers
patted back down the pitch. England sitting pretty so far
"that's well bowled, very tight to the stumps and eliciting a jabbed-batted defence on the back foot"
defended once more
"back of a length, and hauled into the leg side. No great timing, but placed well enough"
a pleasing echo of bat on ball as Roy defends with solid intent
"spanked straight to mid-off! Roy looked as though he was just getting the measure of this wicket, but he's picked the wrong ball to attack, and Joseph has the first breakthrough, courtesy of a lobbed chance into Holder's midriff"
"angled defence out to point, and Root is off the mark after a momentary hesitation"
"a probing full length, clipped slightly uppishly into the leg side"
"left alone outside off, more encouraging carry through to the keeper"
"nibble off the deck, and clatters into the back pad. No danger of lbw, given the lively bounce, but plenty to ponder"
"huge appeal as Root is again rapped on the pad, but that nipped back too far and Holder rightly declines the review"
defended back down the pitch
"full length, pushed back down the track"
"that one keeps improbably low, and Root is beaten outside off, lucky not to lose his off pole in the process"
"flicked in the air and <B>dropped!</B> That's a bad miss, I'm afraid. Chipped in the air, never in control of the shot, but Lewis at square leg made the ground diving forward, but couldn't cling on"
"outside off, through to the keeper"
"blotted into the leg side, a touch fuller this time"
"tight line and length, defended"
"driven on the front foot, down to long off"
"very full once again, and more good lift off the deck to strike Root amidships. Count em, don't rub em"
punched into the covers
patted into the covers and that's a good sharp single
good lift off the deck once more and Root is still not entirely settled in his trigger movements. Flinched into the leg side
"riding the bounce on off stump, and pushed to cover"
into line to defend. This is a good spell from Holder
fractionally leg-sided and worked out to midwicket
angled into the off side
"punched on the up, into the covers"
"galloping down the track and that's an unmitigated hack into the leg side. No timing or finesse. A bit of frustration, maybe?"
"that's more like the Root we know! Confidently onto the front foot, and drilled handsomely through the covers. Helped on its way, admittedly, by some poor work from Powell, who didn't read the bounce and let it through his grasp"
"bouncer, too short"
"crunched hard into the covers again, and another misfield, albeit less costly this time"
"on the back foot, defended down into the pitch"
battered with lots of bottom hand into the covers
"now that's a bit spawny. A nothing sort of cross-batted whoosh, and a delicate under-edge sails through fine leg past the keeper"
"<B>dropped!</B> Another spill, this time from Nurse in the gully. Perfect line and length, demanded the edge, and though he made good ground to his right, he couldn't cling on!"
nudged into the leg side
"inside edged defence, through backward square leg"
"heave ho! Can't bowl there, too short, sliding down the leg side, and Hales just leant back and placed it through backward square with a lofted pull. Easy pickings"
"pounded down the ground with a lot of inside-edge on the drive. Up comes the fifty. Hard-earned, but effective enough so far"
"up on the toes, and jabbed to cover"
""
"outside off, placed into the covers with a gentle cut"
"outside off, and Hales has a go, a (more or less) deliberate top-edge down to third man. One bounce and fielded"
punched on the up into the covers. Good line and length to launch his spell
zips through quicker and beats a loose cut
"bashed hard out through deep cover. Too short, too wide, too slow. That was a freebie"
"cracked off the back foot, back to the bowler"
thumped into the covers
"better line and length, a threat of turn towards the cordon as Hales punches off the back foot"
"defended into the covers, that's a decent line to launch his spell"
"tight line, full length, met with a flowing straight blade"
"smashed across the line, a fraction shorter. Midwicket tidies up"
dabbed back down the pitch
"back of a length, clipped firmly and on the up through square leg"
"too short, but the field is well placed. Deep backward square tidies up another measured pull"
"down on one knee, meeting the ball on the full with a dabbed sweep behind square"
pushed firmly into the covers
"a bit loose and wafty, a crease-bound drive, but the ball tweaks past the edge"
"swept, with huge power. Picked the length and leathered the bat across the line, all along the ground"
drilled on the up out to cover
"thumped hard into the covers, dragged back right on the edge of the rope, and there's a man down ... Evin Lewis tumbled over the boundary's edge, his spikes sliding on the concrete and he's gone down hard. This is a bit nasty"
"too short, too leg-sided, another freebie for England as Hales helps it round the corner through fine leg"
"on the back foot, tip and run into the covers"
short and pulled awkwardly into the leg side
"on the pads, clipped uppishly to midwicket"
clipped to the leg side
"pushed hard into the covers, off the back foot"
frees the arms with an emphatic drive into the covers
"a yawning pull out to deep midwicket, where Powell shows off some nifty footwork to keep the ball in play"
tapped out to deep midwicket once more.
"wide line on the back foot, bashed into the covers"
"well bowled, a touch of spin from wide on the crease. Hales thinks about being drawn into a stroke  but let's it go"
"outside off, cut uppishly to point, and that will be <B>drinks</B>"
"on the stumps, worked down into the leg side"
tight line from Brathwaite and Root presses out to steer into the covers
"slower ball, Root shows it a straight bat, blocked to extra cover"
"length, stays a touch low, Root swivels and gets his pull away down to fine leg for one"
"good length on fourth stump, stabbed towards point - 'Waaaaaaait!' bellows Hales"
"touch short, this one slides down the leg side"
"that's a better line and length, only 124kph/76mph and Hales gets a thick edge down to third man"
floated up on the stumps and Hales nurdles into a gap at square leg - they think twice about trying for two
pushed through a bit quicker and Root blocks on off stump
"flighted, on the stumps, worked into the leg side"
"fetch that! Hales has put this on to the roof of the stand at deep midwicket! The sound that made... Cleared the front leg, got down and slugged the life out of it, high and pulchritudinous and with the wind. Ends up in a gutter and they'll have to replace the ball"
"flatter on the stumps, Hales goes back in the crease and defends"
"flighted, Hales swats through midwicket again, in front of the man in the deep and they come back for two"
"length on off stump, Root defends watchfully"
"touch short, the ball sits up and is worked away through backward square leg for one"
"half-tracker from Brathwaite, taking the pace off, Hales waits and nudges through square leg"
"hits the deck hard this time, back of a length on fourth-fifth stump, dabbed to gully"
"short and over the stumps, defended down int the leg side"
"short of a length and worked to midwicket, the fielder is quickly in and they won't get a run"
"tossed up and <i>smashed</i> down the ground this time, six more over long-off! Brute power from Hales as he crunches his second maximum"
"lobbed up wide of the stumps and Hales bullies a drive through extra cover, that will run away, too, to bring up an impressive fifty on his return to the side; takes England past 100, too"
"dragged down, short and wide and this time Hales cuts, plenty of power in this and it again trundles through the untended acres at deep cover for four"
Hales steps across... Bishoo goes wider... bit of spin and that's off the cut strip. Oh dear
floated up and punched down the ground coming forwards
"pushed through outside off, Root steers a back-foot drive wide of the sweeper for a couple"
"gives this some air, slow and loopy outside off, slog-sweeps but fails to connect"
"over the wicket, pushed through outside off, tapped behind square"
floated up and Hales tries to work across the line unsuccessfully
"flat outside off, skidding past the outside edge as Hales prods uncertainly"
"tossed up and Hales uses the feet, gets to the pitch but pushes straight to extra cover"
"full on the stumps, nudged back down the track"
flatter and a touch straight and Hales works a single off his pads to deny Nurse a maiden
"short ball, Hales goes to pull and it zips under the bat - hit on the box? Certainly groin area... But Hales is okay"
back of a length outside off and again Hales fails to connect with a cross-batted swope
"banged in short, mistimed into the on side, dribbles off the cut strip"
Hales goes back and across and works the ball off his hip
"length outside off, gets one this time with a dab through backward point"
dug in short and this time Root doesn't connect with a pull
"pushed through outside off, steered into a gap at deep backward point"
"length on the stumps, Hales defends"
tossed up well outside off but Hales is across early and swings a powerful sweep flat through backward square leg for four
"tossed up and clobbered into the leg side, in the air but short of deep midwicket"
"pushed through and Root also goes for a swat across the line, quite top-edgey but again lands safely, between deep midwicket and deep backward square"
"dragged down, only a fraction short but Root is back and on it like lightning, pulling fiercely in front of the sweeper and this gets four"
"full on the stumps, Hales flips it aerially over square leg, they trot one - and then meet back in the middle to shake hands on the hundred stand. Bang tidy"
"length in the channel, drops back and stabs one through point"
"short from Brathwaite, pulled firmly but straight to backward square leg"
"on the stumps, maybe a slower ball, Hales smites a mighty blow... but it's almost all vertical, somehow landing safely out towards midwicket as three different fielders triangulate on the ball! They manage to run two, to rub in the insult"
Hales moves across and flicks one more safely off his legs
"short outside off, Root drops back and angles the bat on a dab to third man"
"floated up wide of the stumps and Root batters a drive, picks out extra cover"
"tossed up a little straighter, worked back down the ground"
"gives it some air, Hales doesn't move much and punches through mid-on"
"Root starts to skip down the pitch, Nurse goes flatter and the ball is worked to midwicket"
"pushed through outside off, drops back to cut one through backward point"
"floated up and clipped back down the ground, Nurse throws himself to his right to field"
"medium-pace seamers from Carter, length on off, dobbed back to the bowler"
"touch short, outside off, Root runs one down to third man"
fuller and whipped off the stumps through midwicket
"pitched up on middle and off, Root closes the face and works the ball through square leg, decent throw from the deep keeps them to one"
"back of a length outside off, dabbed towards point"
"short and Hales chops at it, gets a bottom edge past his stumps"
"goes down early and reverse-laps wide of slip, cute from Hales and it will runs away for four"
goes back and worked off the the pads
tossed up and swept along the carpet through square leg
tossed up and punched down the ground
"Hales swings for the fences... and clears them again! Long arms, long range and even though he is hitting into the breeze this time he still manages to deposit the ball beyond the boundary at deep midwicket"
"flat and quicker from Nurse, pushed to past the bowler"
mistimed back down the pitch
"moves across his stumps and looked to be attempting a reverse-paddle, then changed his mind and dabbed through short third man anyway"
makes room and stabs the ball through backward point
can't get this one away into the leg side
short and clipped off the hip for one
short and a touch too straight and Hales swings it meatily away through backward square leg to move ever closer to a hundred on his comeback
"tossed up outside off and Root rattles a reverse-sweep away to the third-man boundary, applause around the ground as he raises his fifty"
gets on the front foot and pokes one through point
tossed up and Hales throws the hands through an uppish drive past cover
on the stumps and worked into the leg side
"floated up on middle and off, Root is down early to sweep"
"flat offbreak and Hales goes back, gets a bottom edge into the pitch"
"short and slightly leg side and Root doesn't have to do too much to scootch it through deep backward square for four, beats the diving fielder on the boundary rope"
pitched up and clipped through midwicket coming forwards
"shortish, Hales backs away to cut but is cramped for room and misses"
shuffles across and punches one back down the ground
"length ball, steered into the off side, backward point makes a mess of it and they come back for two"
"full outside off, Root opens the face and glides one more to third man"
"round the wicket, dragged down short and Root swats it firmly through deep backward square for four more"
tossed up on off stump and Root taps towards cover
waits in the crease and nurdles to leg
flat on the stumps and Hales whisks it away through midwicket
"tossed up on leg stump, nurdled through square for another easy single"
"flat, outside leg, scuttles on to hit the pad"
"fullish, maybe a slower ball, Root steps out and looks to launch down the ground... instead he gets a thick edge wide of the keeper for four"
pitched up and bunted into the ground back to the bowler
"tailing in on the stumps, 125kph/77mph and flicked with the angle through midwicket"
"shortish, another cutter from Carter, Hales stays back and jabs through the leg side"
"full outside off, taking pace off, Root drives with an open face and gets a couple out towards deep backward point, a decent diving effort reels the ball in before the rope"
pitched up and Root guides this straight to backward point
Brathwaite floats the ball up and Hales tucks to the leg side
"pushed through, hits the front pad... and up goes the finger! Is Hales going to miss out on a hundred? He <b>reviews</b> straight away, perhaps believing he got some bat on it trying to sweep... Doesn't look like he hit it, though, so he's in the lap of Hawk-Eye... which says the ball wasn't straightening enough, would have missed off stump! So the <b>decision is overturned</b> and Brathwaite is denied a second ODI wicket"
"tossed up and Hales again goes for the aggressive sweep... scuttles through the legs of Hope, was there an edge on that? Given as a bye"
on the stumps Root works into the leg side
"flat outside off, Hales chops through point"
pushed through quickly on the stumps and Root can't get this one away
"short of as length outside off, Hales guides it through backward point"
"short and wide and cracked over gully, struck powerfully off the back foot and that will race away"
"tighter to the stumps, Root shows fast hands as he cuts from deep in the crease, just one this time"
"dug in short, Hales takes it on, big top edge... and it sails all the way over fine leg! Big release of emotion from Hales when he realised where it was going, punches the air, takes off the helmet to drink in the applause. If there was any doubt about who should be Jason Roy's opening partner, it's been dispelled. Fifth ODI ton for Hales, and fifth in the last 17-18 months"
"length ball, maybe a cutter from Joseph, Hales steps away and swings like billy-oh, fails to connect"
"on the stumps, swatted back down the ground for one"
"onto the front foot, driven into the covers"
half a stride down the pitch and launched over the legside infield
"reverse sweep, and that's brilliantly timed. All finesse, no power. And placement to the fore"
"another reverse, but the fielder is able to intercept this one"
"blam! Steps right across the stumps, climbs into a long-levered slog-pull, and that is flat-batted hard and fast over midwicket, embedding in the concourse"
clipped into the leg side. England are heading for a monster here...
a wild whoosh over the covers. No contact this time
outside off at a very sharp pace. But that's too wide for the umpire's liking
"slogged high in the air, takes a toe-end, and plops calmly into the hands of fine leg. That's the end of that. A well-deserved ovation for a fine comeback hundred"
"outside off, and dabbed out to point. But an overstep... so, a <strong>free hit</strong> for the new man"
"spang! That is Buttler at his best! Nothing to lose, so he wins everything. Oodles of wrists and bottom hand, drilling through the line of a decent yorker-length delivery, and right up and over the covers"
"width, and carved through point"
"short and leg-sided, helped round the corner with a languid pull, and it takes a fine save on the boundary's edge to intercept"
"well bowled, wider on the crease, tight to off stump, solidly defended"
"on the off stump, stabbed into the covers"
"short outside off stump, but Root can't get hold of his cut, and grunts his annoyance as the ball dribbles out to cover"
"a flinch at the crease, and a feint to leg, before springing across the crease to attempt the ramp. Couldn't connect this time, though..."
"smashes the stumps! Full and straight, Buttler attempted the ramp once more, but got no bat in the way, and was too far across his crease to preserve his timbers"
"bouncer to welcome the skipper, and he didn't see that coming from round the wicket. Takes his eye off the ball and is pinged on the shoulder"
"another good, straight, aggressive bouncer. Morgan flinches one off the glove and is grateful to take the single"
"round the wicket, defended into the covers"
"on the back foot, looking for the single but can't get through"
"onto the front foot this time, and driven firmly into the covers"
"tapped out to square leg, another short one"
"delicately played, soft hands to run the single through third man"
"banged in short once more, but that just balloons out of the batsman's reach"
"outside off, and no stroke offered"
"full and straight, tapped to cover. Good intent in this spell from Holder, who is not a quick bowler, but he has height and awkward bounce in abundance"
nudged off the hip out to backward square leg
forward and defended into the covers
"a good sharp delivery, beats a loose swish outside off"
"on the back foot, pushed to cover"
"mown through midwicket, a bit of a dirty swipe across the line. Once again, he loses his shape when he tries to murder the ball. Still, small gripes at 95 not out from 102 balls with the final ten overs to come ..."
"short ball, Root tries to play a late cut/dab and is beaten past the edge"
"back of a length, comes back in a little as Root flicks across the line, hits the thigh pad and runs wide of the keeper"
"dug in short, Morgan flaps at a pull, could be in trouble here... but it goes all the way, clearing deep square leg! Bishoo started to run in, thinking he was in business for a catch, only for the wind to pick up and take it into England fans sitting in plastic chairs beyond the boards"
"round the wicket, worked across the line"
"length outside off, cutting his fingers over it, Morgan bottom-edges a cut"
short ball and this is swatted into the leg side for a single
"bowled 'im! Morgan plays back, attempts to force down the ground, slight misjudgment of the line and it clips the inside edge before shuddering leg stump"
"tossed up on the stumps, Stokes twocks it down the ground to long-on - that's the England 250"
"slightly short and leg side, Root was down early to try and sweep, gets something on it and the ball runs fine for one... He's on to 97 now"
floated up and defended on the front foot
"skips down, not to the pitch, thrashes through the shot nevertheless - and he's belted this miles, halfway up the building beyond the boundary, a violent chasing for a six from his third ball!"
tossed up on the stumps and worked into a gap on the leg side
fullish and worked off the pads to midwicket for one more
"full, an offcutter from Joseph, Root sits on it and nudges square on the leg side, they scurry back for two, takes him on to 99..."
"short ball, Root swivels and swats it through square, again there's two - and there follows the bat raise, plenty of Brits on tour in Barbados to applaud Root's ninth ODI hundred. A whirring dynamo of a knock, but can he kick on?"
"no, he falls next ball! Joseph delivers it cross-seam on off stump, bottom-handed scoop from Root... but it's down the throat of long-on! Looked a tired shot, trying to whip across the line and got a big leading edge, Brathwaite steadies himself and makes no mistake"
"over the wicket, back of a length, fended through backward square leg for one"
"another for Joseph, pouches the caught-and-bowled! Tame dismissal, trying to flick into the leg side, just presented a catch back to the bowler, who now has a four-wicket haul!"
"tossed up on middle and leg, worked into a gap for a couple"
"flat on off stump, tapped away"
"full, Stokes heaves across the line, again picks up a couple more"
"full and flighted, swatted through midwicket on the sweep"
darted flat on off stump and Woakes taps it away defensively
"full on the stumps, punched along the carpet towards mid-on, they steal a single"
"pitched up on off, Woakes pokes into a gap in the covers"
"full and wide of the stumps, Stokes has to reach for it but still manages to blap the ball flat over cover for four"
"short ball, Stokes deals with it awkwardly, ends up falling over as he swivels and gets a top-edge... but it flies over short third man and will also bounce away!"
"makes room, thrashed flat through the leg side, wide of long-on, who puts in the dive but won't get there - three in a row for Stokes!"
"cross-seam from Joseph, outside leg as Stokes swings across the line and is hit on the pad... and Hope signals for the <b>review</b>. Think this is ambitious and, yes, replays confirm it did not pitch in line with the stumps, so Stokes will continue with the batsmen having run a leg bye"
pitched up and slugged flat towards mid-on for one more
"Nurse tosses the ball up outside off, pushed into the covers"
"flat and slightly leg side as Woakes swings and misses, hits the pads and deflects for a leg bye"
"round the wicket, flat outside off, a mighty heave from Stokes - almost swings himself off his feet - but fails to connect"
"tossed up and Stokes collars this, flayed over extra cover, that'll skip away"
"quicker, sliding through past the inside edge as Stokes sweeps, <i>just</i> misses leg stump and it runs away off Hope's pads, I think"
floated up and pushed through the covers coming forwards
"nicely bowled by Brathwaite, a legcutter that Woakes doesn't pick and fails to hit"
"pitched up and it's in the slot to drive, Woakes clears the front leg and cracks it over cover for his first boundary"
"short ball, taking the pace off again, it loops up over Woakes' attempted pull - called wide on height"
"length ball, backs away and swats down the ground"
"pitched up in the channel, Woakes gets across and drives one through the covers for the England 300"
"sprayed across the left-hander from over the wicket, Stokes can only reach it with the cue end, gets one to deep point"
"slower ball, sliding towards leg stump, Woakes scoops it over the leg side for one more"
"fullish outside off, Woakes slogs in the air but it bounces short of long-on"
