"over the wicket, puts it on a length around off stump, Gayle taps it back"
pitched up a little more and carefully blocked on the front foot
"hangs this in the channel outside off, zipping through and left alone"
"touch short of a length down the leg side, there's a sound on its way through... thigh pad, as Gayle flicks across the line"
"that's a good ball, 87mph and nipping away as it rises off a length, past the outside edge"
"fuller, outside leg stump but angling across again, Gayle calmly blocks to the leg side and sees out a maiden"
"short of a length, sliding down the leg side as Hope moves across"
"good length, 82mph on off, tapped down into the leg side and Hope is up and running"
"bit of shape back into Gayle, 84mph and scudding into the thigh pad as he defends from the crease"
"pitched up and curling away extravagantly, after it had passed the batsman, no attempt to follow it from Gayle"
"pitched up full on off stump, jabbed defensively into the covers"
"full tempter, 82mph and nipping away again, no stroke"
"nip-backer this time, Gayle doesn't seem to read it and leaves... Curran goes up for the lbw but without much support, hit above the knee roll, looked a touch high"
"back of a length, touching 88mph and angled in, Hope stays back and clips a couple through square leg"
"good length in the channel, holds its line a touch, leading edge from Hope but it runs away in front of square for a single"
"teasing length from Ball, bit of nip and bounce past the outside edge as Gayle has a swing and misses"
bit more width this time and Gayle chases the big shot again but mistimes it into the pitch
"that's a beauty from Ball, perfect length and curving away past the outside edge as Gayle threatens to topple forward. Juicy"
"fullish, this doesn't gets time to leave Gayle as he comes forward and pushes between mid-off and cover for one - off the mark from his 15th delivery"
"angled across the southpaw Gayle, who steers another single wide of mid-off"
"short of a length, on the body and tucked through backward square leg"
bit of shape in and Gayle gets an inside edge to the leg side
"pitched up and smacked on the front pad, right in front of the timbers - <b>but he got some bat on it!</b> That was stone dead, otherwise, but Curran had clocked the edge"
comes across and taps down into the off side
"full in the channel, 85mph and steered behind point, there's a tight one on offer, perhaps, but Gayle eventually realises the risk and Hope is sent back"
"another jaffa from Ball, fired in and hitting the seam, beats the bat again as Gayle feels for it"
"touch back of a length, Gayle tries to manufacture a slog, slightly cramped and it comes high off the bat before dribbling to mid-on"
"short and this time he clears the infield, slugged over the leg side, Moeen gives chase and prevents four"
"pitched up, 87mph and in the slot, <b>Gayle pounds it straight back down the ground for six!</b> Cold-blooded hitting from the <i>galactico</i>"
"and again, <b>ploughed mightily over deep extra cover!</b> More width on offer this time and he sends the ball spiralling h-i-i-i-i-i-i-i-i-i-i-i-g-h into the crowd"
"full and smashed, sailing down the ground, third six in a row - <b>BEAST!</b> Gayle has twitched into life, ramming Ball for 6, 6, 6 to finish the fifth over and serve England notice"
back to a more sedate pace as Hope pushes the ball away
pitched up and defended on the front foot
"fullish outside off, driven without timing towards mid-off"
"that's some impressive timing from Hope, driving on the up and he places it adroitly back down the ground, mid-off and mid-on give chase in vain"
"pitched up, bit of a half-volley but Hope pings his drive straight to mid-off"
"full length in the channel and Hope punches another drive to mid-off, slightly closing the face when he wanted to go through cover"
"slightly short, in the channel, Gayle steps away <b>and carves it into the crowd again!</b> Four sixes in a row for the 'Universe Boss', who is coming down hard on Ball's case... Not a bad delivery, really, but muscled off a length"
"short, swings hard again, will it go for six to third man...? No, not quite! Bounces just short of the rope and goes for four"
"full outside off, Gayle moves his front leg and <b>booms it back over long-off!</b> See Ball, hit Ball for Gayle at the moment"
"this time he follows him as he moves to leg, jammed for one off his pads"
"fired into the pads and Hope whips it away through midwicket, he runs the two almost before Gayle had completed one"
"that's a good ball, finishes with a dot, some respite for Ball as he whistles one past the outside edge"
"Curran tames the beast for a moment, full and swinging, defended"
"Gayle shimmies in the crease, full and straight, a slower ball from Curran, chipped down the ground - <b>and Plunkett holds a blinder!</b> First ODI wicket for Curran and it's the Big One, really canny bowling, Gayle losing control as he looked to clear the ropes again, back-of-the-hand delivery and Plunkett sprinted back from mid-off to hold it diving full length"
"pitched up outside off, tapped into the covers"
"slightly overpitched, on the stumps and Hope crisply strokes four back past mid-on, nicely played again - he's looking a bit more at home against the white ball than he did during the Tests"
"good length, angled in and blocked to the leg side"
"oof, beats the outside edge again, drawing him across in the channel"
"length ball, blocked on the back foot to gully"
"rising off a length, 87mph in the corridor, draws him forwards"
"dug in short, Shai rides the bounce and nudges to the leg side"
"good length, off-stump line, comes off the outer half of the bat towards point"
"short ball, rising towards the ribcage, KHope knocks it down to short fine leg"
"banged in, chest-height bouncer and it's cracked off the back foot to the deep square leg boundary"
pitched up and driven back towards the bowler
"full outside off, SHope steps out and pings a drive to mid-off"
"full, fourth-stump line, KHope strokes the ball wide of mid-off where Malan, on as a sub, dives to prevent it running away for four"
comes across and stabs into the covers
"back-of-the-hand slower ball from Curran, mistimed on the drive"
pitched up in the channel and steered into the off side again
"pitched up, driven fine of mid-off and they take the single"
"fullish, 87mph in the channel, KHope chops down on it"
"full of a length outside off and again pushed short of mid-off, who's back a bit"
fired down the leg side
"touch full, on-drive from KHope, cut off by mid-on but that get the single"
banged in short and SHope gets across to work it to leg
"fuller, on the stumps, flicked in the air through backward square leg"
"looped up outside off, SHope watches it through"
"floated up, not much turn to speak of, again lets it through to the keeper"
"flighted, comes forward to drive, picks out extra cover"
tossed up on the stumps and worked down the ground for a single
"flatter, just outside off, KHope pushes it back to the bowler"
"floated up and driven, placed wide of long-off and they come back for two"
"length outside off, stroked through the covers"
"short ball, on the body and swatted around the corner for a single as Billings hares around in the deep"
"pace in the channel, blocked square from the crease"
short and tucked into the leg side on the back foot
"back of a length over the stumps, clipped through midwicket"
"full, 84mph in the channel, SHope creams a drive in front of the cover sweeper but Bairstow is also quick over the ground and prevents four"
"floated up, drifting in on middle and off, defended"
"gives it some air, KHope comes out to try and whack it on the full, thick-edges into his front boot"
"deftly played, watches the ball closely and goes back to dab a legbreak fine of short third man"
"flighted, straightening on leg stump, clipped off the back foot through square - and SHope is into double-figures again"
"tossed up, straightening outside off, KHope defends"
"floats up the googly, spinning in as KHope goes back and chops a couple behind point"
"touch short outside off, blocked to backward point"
"full in the channel, clumped on the drive to mid-off"
pitched up and pushed down the ground for one
"pitched up, KHope drives, pops off the face... <b>and Plunkett takes another fabulous grab, one-handed and low to his left!</b> A breakthrough out of nowhere and West Indies have lost Hope for the penultimate time on this tour! Mistimed drive but it still went quickly, only for the big man to stoop and conquer"
back of a length and worked off the body
"short ball, climbing sharply and Samuels flinches out of the way on the back foot"
"slow and loopy outside off, tapped square for one"
"tossed up outside off, spinning through as Samuels leaves"
"gives it some air, enticed on to the front foot and he stabs a drive past extra cover to get off the mark"
"tossed up, opens the face and drives, Ball scampers after it and stretches to keep them to one"
"flighted, straightening on off, Marlon blocks"
tossed up straight and tapped away
"back of a length outside off, defended down towards backward point"
"superb fielding in the covers from Morgan, leaping to his right to stop a rifled drive"
"pitched up on middle and leg, 87mph and punched towards mid-on... Hope punches the air, as if he missed out there. Possibly distracted by someone behind the arm"
fired in straight and steered through point for one
"length ball, dabbed down to the off side and Hope yells 'No!' early enough that Samuels can throw on the brakes as Plunkett gives chase"
"full, sliding down the leg side"
"touch shot, 85mph and tucked to the leg side"
defended into backward point
"fuller at the stumps, driven to cover"
"floated up at off stump, driven wide of the diving cover to long-off"
"touch shorter, pushed to midwicket"
"goes for the cut, gets a bottom edge into the pitch which bobbles towards short third man"
"well bowled, this spins past the outside edge as Samuels pushes away from his body...not far from nicking that"
"starts with a full toss outside off, clipped down to long-on"
"good length outside off, pushed into the point area"
"fuller, he gets across the crease and works down the ground"
opens the face and finds backward point
drives a fuller delivery towards mid-off who is on the edge of the circle
"defended from outside off to the on side, Moeen gets across to cut it off"
"full, defended to cover"
this takes an inside edge into the front pad and runs back to Rashid
"full at middle leg, Samuels gets into a little tangle, bat caught behind pad"
left alone outside off
"this is very good from Rashid, full at off stump, defended towards point"
a touch shorter but all he can do is push towards cover...a maiden from Rashid. Very good.
pushed back to the bowler on the front foot
"wider outside off, drags him forward, defended to backward point"
"another dot ball, defended off the stumps to the on side...nine in a row"
this time it's wider outside off but again just prodded to cover
"a fraction shorter, he rocks back and punches out to the cover sweeper"
tucked off the pads and finds square leg...the innings has seized up for now
"very full, driven out to deep cover...100 on the board"
"excellent work at deep cover, Samuels punches a powerful drive through the covers and Roy makes a lot of ground"
"straighter, pushed to cover"
"full at middle, hint of turn, defended"
"clears the front leg, this is a touch fuller at middle and leg, driven down to long-on"
gets well forward and drives to deep cover...slightly better milking in that over
"plays back, pushes this straight but midwicket gets across"
"the line is outside off, tapped into the covers"
"full, floated up, defended"
"uses his feet, not quite to the pitch, pushed to cover"
"drives firmly towards mid-off - the fielder of the day, Plunkett, is there - doesn't make the direct hit, but Samuels would have been safe anyway"
flicked back to the bowler
"nicely bowled, he tried to use his feet, this gripped from around leg stump and he had to defend"
"appeal for lbw, the googly, thrusts his pad forward. Was he really playing a shot? Maybe drifting down"
goes back to a short ball and cuts through point
"fuller, at the toes, pushed down the ground"
"short of a length, he waits for this to turn a fraction and opens the face through the covers"
"plays with the turn, runs into the point area"
that's a drag down but Samuels' pull finds deep midwicket
"back and across, tucks a straight ball behind square"
"good length, outside off, pushed to the covers"
"no width to work with, on off stump, played back to the bowler"
a skip down the pitch but then finds midwicket with his flick
"tries to get forward, pushes to the covers...spin doing a fantastic job for England"
"full at middle, nice line, stretches well forward and plays to cover"
"on leg stump, spins a touch, worked into midwicket"
"slips onto the pads, tickled away fine of short fine leg"
"full at the stumps, driven to mid-off"
"full outside off, driven to deep cover"
"full at leg stump, looks to work it off the pads but misses and it bobbles to the off side"
uses his feet and drives to mid-off
"back and across, punched with a straight bat down to long-on"
"flatter and quick, driven off the back foot to cover"
"rare loose ball, angled into the pads, takes an inside edge fine past Buttler, Ball is able to get across to fine leg"
"wider outside off, reaches for it and angles it through point wide of the sweeper"
"touch short, played off the back foot to deep cover"
"back of a length at off stump, defended with an open face to point"
"nips back off the seam from short of a length, takes the splice as Samuels whips his bottom hand off the bat"
"on off stump, dropped behind square on the off side"
"good length outside off, a controlled outside edge down to third man"
"swing and a miss against a short ball, Buttler leaps to take it...thought I heard a noise, but not sure what it was"
"full outside off, a flat-footed drive which finds cover. Ball keeps the pressure on in his comeback over"
tucked off the pads to deep square leg
steered to backward point from outside off
"clipped into midwicket, diving save by Morgan but can't stop the single"
worked from outside off into midwicket
angles this with an open face to backward point
"a little shorter, played off the back foot and Moeen gets across"
"well bowled, short of a length, nips back and takes the outside edge down to third man"
"back of a length outside off, angled through point where the fielder - Roy - will feel he should have stopped it"
"length ball, pushed to the covers, he wants the single but it's not on"
"short at off stump, Hope opens the face and it runs backward of point"
"a slower short ball, outside off, Samuels lets it go through and gets the wide call...not sure Ball is too impressed by that. Probably fair enough from the side-on view"
"full at off stump, gives himself a touch of room outside leg and flays to deep cover"
driven on the up square through the off side
"back of a length at off stump, pushed into the covers"
"short at leg stump, pulled to long leg"
"<B>dropped!</b> At cover by Morgan. Would have been a blinder. Full outside off, Hope crunched his drive and Morgan flung himself in the air to nearly grab it one handed above his head"
angled behind point
"it's a boundary! This is not a drill. Dropped in short, Samuels clears the front leg and pulls through square leg"
"clears the front leg again, this is a full at off stump, takes an inside edge into his boot, I think, and bobbles away"
"full outside off, pushed back to the bowler"
"fuller, straighter, worked down to long-on"
"<B>down the pitch and gone!</b> The pressure tells, Samuels knew he had to get cracking, he advances down the pitch, the ball slides on rather than spins, beats the outside edge and a regulation stumping"
"full outside off, driven to mid-off"
"worked off the stumps straight of midwicket, Roy manages to slide and flick the ball back into the non-striker's stumps but Mohammed is home"
takes the outside edge to short third man
"a sharp, well-directed short ball which Mohammed doesn't know how to play. Ends up standing and takes a blow on the gloves"
"back of a length, forced back to the bowler"
"87mph, beats him outside off as he tries to slash this away square through the off side. Morgan seemed interested in the edge. No one else was. Well, there was a small mark on UltraEdge. Similar to the spike that was enough to give Samuels out at Bristol"
"short of a length, pulled to deep square leg"
"full at off stump, 86mph, defended to cover"
worked off the pads into midwicket
pushed out to deep cover
"length outside off, he finds cover"
opens the face and can't beat short third man
gets forward and drives out to deep cover
pushed down to long-on
"gets a good stride forward and drives to the sweeper, but no damage to England"
"well bowled, beats him outside off with one that nips away off the seam"
"angled in full at off stump, 85mph, defended to cover"
"the bat twists in hands as he drives, but he ends up getting four because of a rare mistake from Bairstow at deep cover...missed a one-handed pick up. The batsmen were running hard and shows the value of pushing the fielder"
"this is a powerful pull, whistles one bounce to deep square leg"
clipped off the pads down to long and that's more good hustling between the wickets
"full outside off, driven to deep cover where Bairstow gets a cheer for a clean piece of fielding. He manages a smile"
tossed up on the stumps and tapped to the leg side
"pushed through outside off, Hope dinks into a gap in the covers for one"
"touch short, skidding on and punched back to the bowler"
"flat outside off, Mohammed cuts off the back foot, they come back for two as Billings swoops and fires in a throw... <b>is this a run-out chance?</b> Well, it's going to be tight, Buttler had to take it in front and swing his hands back to break the bails, looks like Mohammed had <i>just</i> got his bat over the line! Rod Tucker has a flick through the angles available but can't give him out on the evidence available"
floated up outside off and pushed into the covers
"on the stumps, worked down the ground for one"
"length ball, pushed square and Roy misses with a throw to the striker's end... maybe would have been better to put pressure on Mohammed"
"cross-seam, 86mph and it skips on to hit Hope on the thigh as he tries to pull"
"outside off, goes back and runs one to third man"
"fired in straighter, tapped back to the bowler"
"length ball, 83mph on fourth stump, prodded square and they push for two into the deep"
"short and leg side, rising up as Mohammed pulls but gets a glove down into the turf"
"flighted, Hope comes froward to drive, hits it well but Morgan leaps to cut if off"
flat on the stumps and worked away into the leg side
"pushed through on off, Mohammed taps it away"
"tossed up, Mohammed dances out and swings lustily down the ground, <b>sails all the way!</b> Nicely done, first six since the Gayle storm earlier, clipped a yard or two over long-off"
fired in quicker and worked to leg
"flat outside off and dabbed behind square, Hope had to be sent back but he makes his ground, on his shirt front, as Rashid fires a high throw"
"length ball on middle and leg, glanced square for a single"
"good length, slower delivery on middle, Hope dabs it down into the off side and they hustle one"
"short, rising outside off, Mohammed rides it and guides one to third man"
"down the leg side, Hope swings it away fine, that's his first boundary as he moves to the brink of fifty"
"short ball, Hope has got the taste now, clubbing another four through backward square leg to bring up his half-century"
three in a row! Like London buses... Another back-of-the-hand slowie but it's misdirected and swatted on the back foot through backward square to finish the over with a third boundary
tossed up and chopped into the covers
"pushed through flat and wide of the stumps, cut firmly to deep point"
"too straight from Rashid, sits up and Hope adjusts rapidly to rock back and swing a pull away - that's his fourth four in four balls, having gone 77 deliveries without!"
"flighted, prodded through the covers"
"steps out, tries to hit down the ground... but it's not got the elevation <b>and Root takes a running catch wide of long-off!</b> Mohammed punches his bat in frustration, maybe got done in the flight and the shot skewed short of the rope"
"googly from Rashid, played off the back foot and worked firmly to midwicket"
"pitched up and driven, there's bat involved and <b>Buttler can't hold on leaping to his right!</b> Actually, I think that was a bump ball, as Hope chopped down on it... Still a good bit of work to stop it flying away"
"fired in on off, pushed towards cover"
"good length, driven on off stump and he still can't get it through the ring"
"fired in full, dug out back to the bowler"
"slower ball, outside off and Hope can only pat it to point"
"good pace, 84mph in the channel, Hope is a touch late and defends it into the turf, Buttler coming up to field - Curran responds with a maiden, following his leaky previous over"
floated up and pushed into the covers
sliding down the leg side
"drops short and Ambris is quickly back and heaves across the line, sends the ball skating to deep backward square for his first international runs"
tossed up on off and tapped towards extra cover
"flighted, reaches for a push, one to long-off"
"<b>dropped!</b> Hope charges out, slugs down the ground, Root is charging in... <b>but shells it diving forwards!</b> He made the ground but the ball burst through his fingertips, then he took it on the chin (literally), before hurling in a throw laced with frustration. Hope survives"
"full and flighted, worked into a gap"
"banged in, rising outside off, Ambris whirls and controls the pull, rattled away through backward square leg"
"full and straight, nudged calmly into the leg side for one"
"pitched up in the channel, Hope digs it out towards point"
"slower delivery from Curran, slightly leg side but he doesn't time the pull into the deep"
"another change-up, paddled into the leg side"
"short ball, Hope tries to pull but it's on him quickly, top-edged fine of mid-off and he gets a couple for it"
"length in the channel, steered down to third man"
oh my! Flashbacks for Ball...! <b>Hope has absolutely whammo-ed this into the crowd at deep midwicket!</b> Touch short and wide but Hope picked it up like candy from the proverbial and cleared the ropes by a distance
"full, Hope goes for another boomer down the ground, bottom-edged for one"
"fired in, Ambris prods one through the covers"
"length outside off, Hope carves over the off side... <b>but this one sails straight to the man on the boundary!</b> Billings steadies himself and holds on above his head and Ball finally gets some reward for his flogging. Fine innings from Hope but he goes tying to lift the scoring"
punched wide of long-off but they stick to one
"hits the pitch hard, Ambris taps into the covers and takes one"
"short, climbing outside off, Powell rides it and runs one to third man to get off the mark first ball"
"zippy outside off, Ambris has a little fiddle on the back foot in the channel and is beaten"
"length, 85mph and dabbed down into the off side, again they pinch the single"
"back of a length, bit of width and swatted away for one"
"hammered into the pitch, coming back in towards off stump, steered for one to backward point"
"pitched up in the channel, Ambris does well to lay a bat on ball but manages to squirt it away through backward point, third man can't get around and that'll be four more"
"full and straight, tailing into the pads, this time Ambris pings a leg glance away into a gap and gets another boundary to deep backward square"
"drags his length back, tapped down for one"
"length, maybe a slower ball, Powell pushes it in front of point for one"
"pitched up on the pads again and slapped square, Bairstow prevents this going for four in the deep"
"another slower ball outside off, Ambris pokes it into a gap and they come back"
"slower delivery in the channel, Powell continues to knock it around, dabbed to third man"
"out the back of a hand, Ambris waits on off stump and pulls to deep midwicket"
"moves back and across, Curran goes wide, another slower ball and Powell heaves at thin air... just on the tramlines"
"full and straight, another slowie, clipped through mid-on for one"
"slower delivery, aiming for the tramlines again, swing and a miss - but called wide"
"full in the channel, chopped through the covers"
"drags down another slower ball, leg side but Powell fails to get hold of it - tricksy and economical from Curran, just five off the over"
"short ball, taking the pace off, pulled flat through square leg"
that'll help! Dug in and <b>swung over the ropes...!</b> Powell connects and gets his first boundary with a meaty pull
"<b>bowled him with a full toss, off stump smashed on its back!</b> Plunkett roars, the ultimate comeback... big ole swing from Powell but he fails to connect and hears the crack of doom behind him"
"back of a length outside off, 83mph and driven on the back foot, misfielded by Morgan at extra cover and they get a couple"
"length on off, poked into the covers"
"short ball, Nurse plays a flamboyant, hopping pull and gets it behind backward square leg, YJB can't get around on the sliding dive - four!"
"fires in the attempted yorker, Ambris can't get under it, driven to long-on"
"slower delivery, wide of the stumps and Nurse is nowhere near laying bat on it"
"this one he gets hold of, <b>slugged down the ground for a Dorothy!</b> Sweet connection from Nurse and it sails over long-on"
"<b>dropped for six!</b> Plunkett the culprit... He looked to be steady under this but ended up shelling it beyond the rope, not what we've come to expect by his standards. West Indies warming up now!"
