"good length, flat and at the pads, he goes deep and taps it to long-on"
"shot. Tossed up flat at off stump, gets to the pitch, keeps the front foot slightly away to make room and lifts it cleanly over mid-off"
"good length, fired in at leg stump, opts for the sweep but that one skids on and gets the pad and rolls into the leg side"
"good length at off stump, skids and keeps low, pushed into the off side off the back foot"
"back of a length at off stump, punched straight to cover off the back foot"
"back of a length, angled across off stump, skids and beats him for pace once again and he can only shovel this to mid-off off the back foot"
"full, wide and swinging away, Walton chases but it's too wide"
"back of a length, swinging away from outside off, sliced to third man's right"
"full at middle stump, angling away. He brings down an angled bat on this to try and push it into the leg side, gets a leading edge that rolls to mid-off. He runs halfway down the pitch, but his partner hasn't repsonded and he makes the journey  back as the throw comes in"
"wow! Back of a length outside off, climbs into this and slams it on the up  over mid-off. That ball was climbing, but he's gone through the line with no half-measures and lifted it easily"
"good length, raps him in front of middle stump as he tries to whip one into the leg side. Appeals loudly, he thinks this is out, the umpire probably thinks it's pitching outside leg. Not given"
"good length at off stump, covers the line as it angles in and pushes it to mid-on"
"good length, outside off stump, a short stride as he drives it on the up to mid-off's left"
"good length, angled in at off stump, exposes the stumps and chops it to third man"
"'only big shots coming' says Sarfraz before this ball, and Walton brings his prophecy to life. This one is back of a length, it's angled in at off stump, he's deep in the crease and shovels this powerfully over long-on"
"full at middle stump, reaches out and slogs this into the leg side. Didn't connect - got the inside half - but Imad is providing enough pace to them at the moment. This finds the square leg boundary"
"full at middle stump, pushed to long-on off the front foot"
"<b>got him! Lewis has found square leg.</b> This wasn't a great ball. Short and at middle stump. Perhaps kept a tad low and perhaps beat him because of the pace on it. He was back and across the stumps, ready to dispatch this over square leg, but he's got the bottom and it flies at chest height to Hasan Ali who has his fingers pointed up and the ball clutched safely"
"good length at off stump, defended into the off side off the back foot"
"back of a length, angled across off stump, tries to dab this to third man, can't beat point"
"slower ball, good length at middle stump, beats him and thuds into his back leg as he tries to flick this"
"back of a length at off stump, opens the face and drops this into the off side off the back foot"
"137 kph, overpitched outside off, his stride converts it into a yorker and he digs it out"
"127 kph, rolls his fingers on this, good length ball, steered to short third man off the front foot"
"138 kph, in the blockhole outside off, tries to carve this past mid-off, but can't get enough power from that length. It's a <b>maiden over for Raees</b>"
"146 kph, back of a length, angled across off stump, opens the face and runs it down to third man"
"back of a length, flies across off stump and beats him as he goes for the pull"
"full ball outside off stump, crashes into the toe of his bat as he jams this out to mid-off"
"<b>dropped. Shoaib Malik has put him down at deep square leg.</b> This is a good looking shot, whipped off the hips as it bounces at him from back of a length. Malik has it covered with his feet, but he's hopping at the last moment because he is close to the boundary. In the end, it goes through this hands"
"bouncer, goes for the pull again. Once again, it looks glorious, but he hasn't middled it. It lands safely to Malik's left on the square leg boundary"
"good length across off stump, opens up and crashes this off the middle on the up, straight to mid-off"
"back of a length at off stump, punched to covers off the back foot"
"who is this guy, where has he been? Another gorgeous looking shot from Walton. This one is good length, angled across the off stump but he has watched this so nicely. And he is so well balanced. Stands his ground and sends it on the up over the long-on boundary"
"slower ball, cuts away slightly from off stump, he checks his waft and defends into the off side"
"<b>nearly chips this to Imad Wasim at covers.</b> Full toss outside off stump, his hands harden as he sees the line and length on this. Slices it uppishly and it drops short of Imad"
"back of a length at off stump, hangs back and pulls this to long-on, no timing"
"good length, angled across off stump, pushes it point's left and he puts in a dive to cut it off"
"googly, raps him on the pads as he pushes forward to try and defend this"
"good length, he's anticipating another googly, he's low to try and paddle this fine but it spins away, even as slip is running down the leg side"
"it is a googly this time. Full, and in his hitting arc. And so, he hits. Launched over long-on"
"<b>top edge lands safely.</b> He tosses it up again, this time it's turning away as Walton tries to find the long-on six again. Top edge, goes high and falls between cover and long-off who are convering behind the umpire"
"short and wide, slapped too sweeper cover's left"
"ooooh. Good length outside off, gets him to poke at it and spins it sharply past his outside edge"
"arm ball, catches his pads as he steps out to try and force this. Not out."
"good length, angled in at off stump, this time it straightens and beats the outside edge"
"good length at off stump, drops it into the off side with soft hands and steals a single in front of point"
"arm ball, back of a length, he wants to pull but has to offer a straight bat and drive this to long-on"
"good length at middle stump, straightens and gets the leading edge as he tries to close the face on this. Rolls back down the pitch"
"good length, flat at off stump, punched to covers"
"<b>Shadab has Walton caught at long-on..</b> Walton looks good and he's powerful, but his game plan was obvious and Shadab is a good spinner. He teases that powerful swing of his, by tossing it up at middle. But this one dips on the batsman and spins away, so Walton can only drag it off the toe of the bat to Malik, who is calmer this time, and safer too. Easy catch."
"good length, drifted in at off stump, slight turn away, defended into the off side"
"good length at off stump, spins and beats the outside edge as he fends at it off the front foot"
"tossed up at full off stump, driven to long-off"
"oh lovely. Fired in a little flatter at off stump, he goes deep in the crease and wants to close the face on it, but it spins rapidly past the outside edge as he's trapped on the back foot"
"good length at off stump, forward defence off the outside half"
"good length, fired in flat, steps out and swats across the line, cops it on the pads"
"good fielding by Rumman. Samuels steps out again, this time he's to the pitch of the ball and slams it powerfully past Imad at knee-height. That ball was travelling but Rumman is across to his right from long-off and puts in a slide to stop it"
"<b>dropped</b> Back of a length, just outside off stump, gets the outside edge as he tries to cut this, and Sarfraz drops it"
"back of a length at middle stump, punched to long on off the back foot"
"he's down the track again. Not to the pitch once more, has to offer the pad once more"
not sure who got played here. Samuels' running down the pitch makes Imad push one full and wide outside off to try and induce a stumping. But this time Samuels is to the pitch and punches it to the extra cover boundary
"full and angled into the pads, catches them too as he closes his eyes and his head falls into the off side on his attempted flick"
"good length, in the corridor, he walks into the push on the up to try and steal a single, the ball thuds into the bat quickly and he can't get it anywhere close to a single"
"good length, angled in and raps him high on the pads as he tries to whips this"
"good length at off stump, wants to force this through the off side but the bat turns in his hand and it bobbles to midwicket"
"<b>not quite, but we nearly see a wicket.</b> This is nipped back in from a good length, once again the bat and the body are not aligned as he tries to flick. Fortunately for him, there's an inside edge before it raps him in front of middle stump"
"<b>Jason Mohammed will have better days than this.</b> Good bowling from Hasan. Kept bringing it back in against a batsman who was looking to steal singles through the off side. Ultimately, he's tried to open the face and drive through the covers at this full, inswinging delivery that shatters the stumps via the pads"
"good length at the pads, glanced to short fine leg with soft hands"
"back of a length in the corridor, opens the face as he defends off the back foot"
"back of a length outside off stump, defended back down the pitch off the back foot"
"good length, in the corridor, driven on the up to sweeper cover"
"good length, angled across off stump, Samuels clears the front foot and reaches out for it. Opens the face, gets the bottom of the bat and gets it over the point boundary thanks to Wahab's pace"
"oooooooo hammered! Similar ball, similar shape from the batsman, hangs back, makes room, but this one is bang out of the middle of the bat and lifted on the up over long-off"
"<b>oh dear, what were they thinking?</b> This is full at off stump, he drives it on the up to Hasan's right. He sticks out his hand and stops it. It rolls a few yards away from the pitch on the right and for some inexplicable reason, batsmen around the world keep 'brain fade' alive and kicking. They try to steal a run. Hasan already has the ball as the non-striker is starting the run. He merely has to turn around and underarm that back to remove Simmons"
"<b>and now that's three wickets from Hasan's last three balls.</b> That inswing is his weapon and he's used it to good effect once more. Samuels, with the inertia of the sixes he hit last over, has made room again and is poking away from the body. But that's a big gap and enough for Hasan to knock the top of the stumps off a good length"
"good length at off stump, gets behind the line and dabs it to point"
"walks across to cut out the swing, and whips this full ball at off stump to midwicket"
"in the blockhole outside off, defended back to the bowler. He catches the ball cleanly this time, so there's no run out."
"full, swinging in at off stump, solidly behind it to defend back to the bowler"
"back of a length, spinning away from off stump, wants to whip this off the back foot to midwicket, gets a thick inside edge to long leg"
"good length, tossed up outside off, gets to the pitch and paddles this to long leg's right"
"good length, drifted in at off stump, Pollard doesn't believe in feet for a moment. Pushes with the hands,  beaten, inches outside off stump"
"feet present this time. A long stride outside off, but this is spinning away rapidly as he tries to crunch it through the covers"
"back of a length, spinning away from off stump, pushed wide of long-on off the back foot"
"perfection from Shadab. Good length, drifting and dipping at middle and off. Pitches, spins quickly past the outside edge as he pokes at it with no clue"
"back of a length, skids low outside off and he slaps this behind point classily. Sweeper runs to his left and puts in a slide"
"walks at him, meets the full slower ball right under his eyes and tucks it with soft hands in that awkward region between the two deep square fielders in the deep on the leg side. Good batting from the captain. He's looked proactive."
"full at off stump, driven to long-off"
"<b>Rumman stands halfway down the pitch, arms folded behind his back without a word. He must have been a good student.</b> This is at a good length at middle stump, Pollard rooted to the crease once more as he pushes away from the body. Breaches his defence and slams into the stumps. Feet, eyes, bat not congruent at all with that and Rumman's trademark celebration tops it all off."
"full at off stump, mistimed drive straight to covers"
"good length at the pads, nips down the leg side slightly. Catches the front pad and rolls to Sarfraz's left"
"Shadab is carving a highway past the right-hander's outside edge. Good length, dip, pitch, turn, beaten"
"<b>and that brings this.</b> Pushes it slightly fuller this time. Big man Holder's eyes light up as this is closer to him. Goes at it, tries to hit over midwicket. Gets a top edge that hangs up harmlessly a few yards in front of long-off who makes no mistake"
"back of a length at middle stump, this one goes straight on. Brathwaite watches closely from deep in the crease and glances it to square leg"
"Yep. Back of a length, climbs past the outside edge"
"full toss at middle stump, he lifts it over the bowler and <b>Shehzad does brilliantly at long-on.</b> This is bouncing and bobbling on the floor as he puts in a dive. But he adjusts his hands for the bounce last minute and parries this to long-off"
"googly, good length outside off, draws him forward and beats the outside edge"
"good length at the pads, flicks it to fine leg"
"short and wide outside off stump, lots of room, he uses it to cut straight to sweeper cover"
"outswinging yorket at off stump, jammed into the covers"
"back of a length at the mid-riff, backs away and slices to sweeper cover"
"oh good ball. Unfortunate. This is full at off stump, he gets very late <b>reverse swing</b> away from the right handed who has tried to flick this. Leading edge flies between backward point and short third man"
"low full toss, but it's a slower ball and he has to reach away from his body to tap this to short third man, who also seems to be beaten by a slower ball as he fumbles"
"<b>glorious.</b> Slower ball, back of a length at off stump, stands tall and slaps this over long-on. Off the middle, full swing of the bat."
"low full toss, tailing in slightly at leg stump, flicked to deep midwicket"
"inswinging yorker at leg stump, flicked off the toes to long-leg's left"
"full outside off stump, gets to the pitch and slices it square on the off side to find the fielder in the deep"
"yorker at leg stump, flicked straight to square leg"
"low full toss, tailing in at leg stump. Clears the front leg and punches this between long-on and deep midwicket. That ball is racing away towards the boundary as those two fielders converge on it. Deep midwicket puts in a dive eventually and long-on backs up"
"this is the Brathwaite we were commanded to remember not so long ago. Good length ball at middle stump, stands his ground, watches it closely and that is a perfectly executed slog over midwicket. Not a single blemish in that shot, and that's not something you say about a slog."
"good length, wide outside off stump. Not a great length, but there's enough pace to beat him as he reaches out and tries to bunt it through third man"
"this time, he knows what the line is going to be. He's still not reached it, but he's closer to this wide ball outside off. Thick outside edge flies to the third man boundary"
"wow, you don't want to hear that sound as a bowler. Back of a length at off stump, hangs back and bludgeons this wide of long-off"
"low full toss at off stump, once again this is right out of the middle. A slice. But straight to sweeper cover"
"<b>Wahab takes a wicket at the end of a painful spell.</b> If length won't do it, pace will. This is back of a length, angled in at leg stump and smashes it down comprehensively as Narine searches for room to slap it on the up"
"full toss outside off stump, nicely in the slot to club this through the covers, but the slight inswing messes with his connection and he finds the fielder there"
"inswinging yorker at off stump, can't get under this, squeezed out to long-on"
"this was in the slot, full outside off, and a better batsman might have fancied six runs. As it turns out, Badree swats away from the body and is beaten on the inside edge"
"back of a length outside off, swings wildly across the line, beaten again"
"and at long last, he goes for the single. Walks across the stumps, pushes it past Hasan who dives to his right. Brathwaite was running since yesterday."
"full and wide outside off, in the slot again, thick inside edge that slams into the ground and bounces wide of Sarfraz, to his left"
"good length at middle stump, defended back to the bowler"
"good length at off stump, driven on the up, past Pollard at covers...who digs his knees into the outfield as he tries to pull this back at the boundary. And misses. That will be four. <b>Pollard is down outside the boundary line. His left knee is hurting and the medical team is out quickly.</b>"
"full toss at leg stump, swept straight to short fine"
"full at middle stump, pushed back to the bowler"
"back of a length outside off, punched off the back foot to cover"
"good length at off stump, tries to force it on the up through the off side, inside half of the bat to find long-on"
"good length, angled in at the pads, flicked to deep square leg"
"back of a length, angles in and raps him on the thigh guard as he tries to glance this fine"
"good length, it's that angle again. This time it's an inside edge before it thuds the pads"
"<b>just clears Narine at mid-on.</b> This is a slower ball outside off stump, good length. He's picked the variation and uses the turn off the pitch to lift it over mid-on on the up. Safe shot to attempt"
"in the blockhole at leg stump, pushed to midiwicket off the toes"
"another slower ball, this one is full at off stump, driven firmly to mid-off"
"full at leg stump, flicked to deep midwicket"
"good shot. Poor ball, but good shot. Full and down the leg. Gets down on a knee and ramps it over short fine leg with good shape"
....aaaaaand repeat. <b>This time it's six.</b> Full at leg stump again but this time he has more swinging room in front of his pad. Utilises it and lifts this one over square leg
"short and wide outside off stump, back and across as he cuts this to Pollard who fields comfortably"
"full at middle stump, driven back to the bowler"
"good length at off stump, drives on the up with soft hands to steal a single at mid-off"
"<b>ooohh strikes him in the ribs.</b> Akmal is swivelling and taking his eyes off this back of a length ball. It's at an off stump line. He doesn't pick the pace and might be winded. Doesn't show it, of course"
"good length outside off, sliced on the up, straight to point"
"back of a length at off stump, mistimes the attempted pull, straight to midwicket"
"slower ball, pitches on the wide marker, cuts back in and is <b>very cruelly</b> called a wide after the batsman lets it go"
"back of a length at off stump, defended to backward point off the back foot"
"<b>shot!</b> Back of a length, slower ball, sits up nicely for him and no one moves as he spanks this square on the off side"
"good length at off stump, defended back to the bowler"
"good length at off stump, expecting the offspinner, this one straightens, inside edge onto pad"
"back of a length at off stump, makes room and slaps this square, Samuels puts in a dive at backward point"
"tossed up at leg stump, steps out and drives to long-on"
"full at middle stump, pushed towards long-off but Brathwaite runs and dives to his right at extra cover"
"good length at off stump, inside edge on the attempted sweep"
"full at off stump, makes room and tries to lift this over the off side, gets it off the inside half, straight to mid-off"
"back of a length at off stump, pulled on the up to midwicket"
"full and angling down leg, flicked to deep square's right"
"good length at leg stump, opens up his stance and slogs it to deep square"
"slower ball, back of a length at the pads. Watches it closely after shuffling across and rolls the wrists just enough to whip it past short fine"
"shooooot. Full outside off, leans into it and punches it wide of mid-off"
"good length at off stump, drops it into the off side with soft hands to steal a single"
"short and wide, cut away easily to sweeper"
"<b>chips it straight to midwicket.</b> Samuels has Akmal in his first over again. Very very softly too, just like the full toss wicket yesterday. This is slow and short, spinning in at him. He wants to tuck it into the leg side but there is no pace. Taps it straight to Williams"
"full at middle stump, puts a stride across the stumps and dangerously tucks it fine"
"short and wide, slapped to sweeper cover off the back foot"
"short, spins in sharply at off stump as he attempts a cut"
"waits for the turn this time, pushes it towards long-on off the back foot, but Williams is across quickly and dives to his left to block that"
"good length at off stump, pushed back to the bowler off the back foot"
"tossed up at off stump, driven to sweeper cover"
"oh good shot. Short at off stump, he shapes to pull but this has kept low. If he had gone flat-batted, that woukld've snuck under and taken his stumps. But he adjusts to bring a straighter bat and punches this wide of long-on"
"good length at off stump, pushed into the off side off the front foot"
"good length at off stump, wants to push this through the off side, but the googly gets him on the inside half and it rolls back to the bowler"
"good length at middle stump, back foot punch to long-on"
"back of a length, spins in sharply at leg stump, bat turns and it rolls to long-on as he tries to punch it through the off side"
"short at off stump, cut to sweeper cover"
"tossed up slowly at off stump, driven to long-of"
"good length at off stump, walks across the stumps and pushes it wide of midwicket"
"tossed up at middle stump, steps out and whips it off the inside half to beat midwicket. Not middled, allows Holder to run across from deep square and put in a long dive to save two"
"good length at leg stump, tucked behind square on the leg side"
"good length at middle stump, flicked to deep square"
"good length, angled down the leg side, past the attempted flick"
"good length outside off, chopped to short third man on the up"
"back of a length at middle stump, mistimed pull straight to deep square"
"slower ball, tossed up wide outside off stump, driven to point who puts in a dive and quickly throws it back to the bowler....who has a shy at the striker's end and misses"
"good length, uses the angle to flick it to deep square"
"full and wide outside off and <b>there's a huge appeal</b> from the keeper and bowler as this deviates past the attempted cover drive. Not out says the umpire. There wasn't a sound, but there was some movement after it crossed the bat"
"tossed up at leg stump, inside edge onto pad as he stays in his crease and tries to flick this to deep midwicket. Gets a single to short third man instead"
"short and wide outside off stump, shapes to cut, seizes his bat swing and dabs it late past short third man"
"full blooded cut to this short ball at off stump, finds sweeper"
"good length at off stump, back foot punch to find sweeper cover"
"good length at middle stump, tucked off the pads to midwicket's right. Shehzad is running, Babar is watching the ball. Midwicket fumbles low to his right after tumbling, so in the end there's no damage"
"full at off stump, driven to long-off"
shuffles across and whips this full ball to deep midwicket
"bouncer at middle stump, too short, ducks under it and takes the free run"
"slower ball, back of a length at off stump, through the pull shot early. It's aired towards deep midwicket, well short of him"
"handsome. Shuffles across, stands tall and slams this pull shot past long-on from outside off stump. Superb."
"good length at off stump, slices it to point"
"short at middle stump, pulled to deep midwicket"
"full at off stump, squeezed straight to covers, where Narine sees the need to shy at the non-strikers. He's the only one. Overthrows"
"good length, in the corridor, forward defence as it spins away"
"offspinner this time, back of a length at off stump, whips to deep midwicket"
"full at the pads, uses his wrists to work it to short fine"
"good length at off stump, driven on the up to long-off"
"back of a length at middle stump, driven off the back foot to long-on"
"short and wide outside off, premeditated shape to ramp it fine, changes his mind and cuts. Finds point"
"<b>lovely.</b> Good length, flat at middle stump, he's down on one knee and slaps this off the middle, full balance, over the midwicket boundary"
"back of a length outside off, mistimed punch, just evades extra cover's left to <b>bring up the fifty partnership</B>"
"good length at off stump, not to the pitch, pushes it back to the bowler"
"nice. Nice. Steps down the track again. This is at middle stump. To the pitch this time, enough room to bring the bat down and under that to lift it straight over the bowler"
"good length at middle stump, goes deep in the crease and pushes it in front of midwicket"
"<b>dropped.</b> Good length, wide outside off. He wants to drive this on the up. Thick outside edge that hits Walton on the chest as he fumbles this chance"
"good length at the pads, glanced to deep square leg"
"good length, tossed up at middle stump, forward defence"
"good length at middle stump, doesn't get to the pitch after stepping out, pushes straight to midwicket"
"short and wide outside off stump, cut straight to sweeper cover"
"good length at leg stump, not to the pitch after stepping out. An unceremonious swipe at it lands well short of deep square leg. They go back for the second. The bowler is not at the stumps. He's a couple of yards in front. Catches it and backhand flicks it on to the stumps....<b>Azam has just made it in</b>"
