"good length at middle stump, tucked to short fine off the back foot"
"slower ball, full outside off stump, driven to sweeper cover"
"slower ball, full outside off, throws his hands at it and gets a thick outside edge that runs past Narine at short third man...who goes around the ball rather than towards it, chases it and awkwardly keeps it in"
"good length at middle stump, whipped off the back foot to deep midwicket"
"slower ball, wide outside off, reaches out for it and maintains his balance as he slaps this on the up to beat sweeper cover by a long way. Brings up <b>his 6th T20I fifty</b>"
"back of a length outside off, opens the face and finds short third man"
"<b>walks across his stumps and throws it away.</b> Full at leg stump, walks across the stumps to tickle it fine, but he's shown too much of the stumps and is beaten down the leg side"
"back of a length at off stump, stands tall and punches it past the diving extra cover fielder. Sweeper puts in a slide after running to his right"
"good length at off stump, inside half on the forward push, straight to midwicket"
"good length at off stump, tucks it behind square on the leg side"
"tossed up outside off stump, driven to long-on"
"good length, pithches on middle stump and beats his glance down the leg side as he walks across the stumps"
"good length at middle stump, deep in the crease, tucked behind square"
"<b>doesn't finish the job.</b> Back of a length at off stump, stands up and goes for that trademark pull on the up. Gets it off the bottom and finds substitute Rovman Powell at midwicket"
"slower ball, full outside off, leans into it and controls the drive to sweeper cover"
"full at middle stump, pushed to long-on on the up"
"slower ball, low full toss outside off, taps it straight to mid-on"
"good length, angled in at off stump, watches closely and dabs it late to third man"
"<b>dropped.</b> Jason Mohammed puts it down at covers. Good length, outside off, he's creamed this cover drive on the up. It flies high to Mohammed's left and he fumbles a couple of times as it keeps falling down and eventually onto the floor"
"short ball at off stump, goes for the pull, misses, thigh guard and into the off side"
"low full toss at leg stump, makes room and taps it straight to extra cover"
"bouncer at the chest, whips it late to get it to the right of fine leg, who runs across and acrobatically keeps it in"
"in the blockhole at off stump, ugly swipe across the line, thick inside edge to deep square and <b>Malik is now the second-highest run-getter in T20s for Pakistan with 1621 runs. Umar Akmal is above him at 1690.</b>"
"<b>takes a suicidal run and survives.</b> Full at off stump, taps it straight to extra cover and takes off for a run where there shouldn't be one. Lewis shies at the non-strikers and misses as he he's ambling some 5 yards away"
"<b>and that's it.</b> Low full toss outside off, hangs low, makes room and lifts it over the off side infield to find the point boundary. And that's the <b>series, 3-1 to Pakistan</b>"
