"on the hip, tucked to square leg, and a good sharp single to launch the innings. Hales swoops but that was a confident call"
"good length delivery, angled across the left-hander, and driven with exploratory timing to mid-off"
"<B>gone!</B> This one pops off a good length as Munro looks to work one into the leg side. A huge looping leading edge, Buttler calls with the gloves, and England strike early! To be frank, that ball didn't actually do an awful lot, just a poor choice of stroke from a man who's been in a hurry all series"
"outside off, ploughing a furrow, and left alone"
another leave-alone outside off. Decent carry so far
<B>an inside-edged chop past the leg stump!</B> More unsettling bounce from Woakes who finds some nip on a good length. Awkward times for New Zealand already
"width outside off, a loose flash from Williamson, but he can't reach that one"
"that's a decent delivery, a bit of nibble at a decent pace, and Williamson removes his bat from harm's way at the last split-second"
"excellent line once again, and this one zips back into the right-hander a touch. Bounce and lateral movement on offer so far"
<B>spliced through the gully!</B> Fencing outside off as Wood finds extra bounce again. It's a difficult start for New Zealand
"very full from Wood, attacking the top of off as Guptill bides his time"
"inswinger on a good length, and that's a tremendous strike, just a push through mid-on as Guptill uses the bounce to his advantage this time. A good chase at long-on, but not such a good attempt to stop the ball..."
an angled dab into the off side. Interesting times
"pushed onto the back foot, defended to cover"
"banged outside off, and another yawning leave"
"slightly strays onto the leg stump, and jabbed from deep in the crease out to midwicket. Good running to keep the scoreboard ticking"
"good tight lines from Woakes, pushed onto the back foot and pushed to mid-on"
no stroke offered again as Woakes bends this back towards the off stump. Excellent pressure bowling
flicked off the pads this time and Hales gets down quickly at square leg to limit the damage
"good probing bowling, another leave-alone on a tight line"
"still no stroke offered as Wood goes fuller, almost a yorker-length on a fourth-stump line"
"pushed onto the back foot, an attempted forcing flick into the gap on the leg side, but can't find the angle"
"no stroke once again, Williamson happy to soak up the dot-balls, taking in his reconnaissance"
jabbed to midwicket to steal the single
"up onto the toes, tapped to point, and England continue to keep a tight leash on the scoring"
"leaning onto the front foot, pumped down the ground and finds space beyond the inner ring to come back for the third"
"banged in on a back of a length, a touch of outswing, but no temptation to have a slap through the covers"
"wider on the crease, angled into the base of off stump, stabbed into the covers"
deflected to the leg side
"on the back foot once more, pushed to mid-off. England not having to do much more than bowl in good areas at the moment"
another inside-edged cut through fine leg. The extra bounce still causing a few hassles
a rolled-wristed clip through the leg side
"the first sign of aggression from Williamson, as he combats a well-directed short ball with a fast-handed pull. Doesn't connect fully as backward square gathers"
"ooh, well bowled, short and sharp, aiming at the throat and fended away with a combination of glove and helmet, it seems..."
pulled a touch frantically out through the leg side
"flashed into the covers, a touch more intent in these shots, but not yet beating the field"
"tight leg-stump line, rising into the thigh pad and dabbed down into the crease."
"back of a length, angling into the off stump from a wide line, blocked into the leg side"
"stabbed down into the crease, again camped on the back foot as Woakes keeps a tight line"
"another dab into the off side, again on the back foot, Woakes isn't nibbling the ball much, but he's getting consistently awkward lift"
drilled into the covers but without much power. Is his thumb bothering him? Conceivably...
"blocked down into the ground, outside off stump"
"angled into the pads, Hales is once again put to work at square leg, but scrambles down quickly to intercept"
"full length, outside off, no way through there"
"on the pads as Williamson shuffles across to the off side, clipped hard to leg"
"much wider on the crease from Wood, but well directed in towards the off stump. Stoutly blocked to cover"
"squared up by the fuller straighter length, squeezed out to point"
"solidly forward, pushed into the covers"
forward and blocked once more. Another tight over ticks by
"wide on the crease, zeroing in on the stumps, dead-batted out to cover"
"driven, <B>in the air</B> but just wide of Woakes in his followthrough. Early into the stroke, and nearly paid the price"
"fuller, straighter, worked with a whip of the wrists to mid-on. Still can't beat the field"
"probing stuff from Woakes, angling into the off stump once more, Williamson plays so late, dropping the ball into the cordon from under his eyeline"
"flicked off an inside-edge, bobbles in Geoff in Canada: 'This game will. be over by the 10thn over if the Kiwis don't get a move on.'

the air off the thigh pad, but safely out to square leg"
"rare width, and biffed with lots of bottom hand out through point. A long chase and slide from Morgan just inside the boundary, and he does well to limit the damage"
"flicked off the legs once more, slim pickings so far..."
"there we go, <B>a boundary at last!</B> Played it so late with an open face, filleting the gap in the covers and finding just enough timing to reach the rope. Well done"
"clobbered into the covers, but <B>just short of the man</B>. Utterly nailed it, but so nearly holed out. That was more intent, the width was the key"
"<B>wide on the crease, and inside-edged onto the leg stump!</B> Wood's late hop in delivery stride does for the dangerous Williamson. He was looking to run the ball through third man, but his angles were all messed up by the change in line. That's a devastating blow for New Zealand"
flicked off the pads through fine leg
"wide of the crease once more, and a bottom-handed bunt up into the covers"
"outside off, through to the keeper"
"ooh, well bowled, angled across the left-hander and jagging back off the seam. Left alone as the ball scrapes over the off stump"
"leg stump, tucked to backward square"
clipped on the up and <B>just wide of short midwicket!</B> Finds the gap in the end though...
"stretching onto the front foot, drilled into the covers, but snaffled with sharp hands"
"<strong>that's a lovely ball!</strong> Tight to the off stump, grazing past the edge as Latham feels obliged to keep his counsel"
"a bit of a rank loosener from Stokes! Guptill was ecstatic to see that, and freed his arms with glee"
"firmly drilled into the covers once more, but there's a sweeper in place now to intercept the drive"
"on the pads, angled across the left-hander, but tucked into the gap"
"better line from Stokes, tighter and a touch fuller. No stroke this time"
"through the ball zips once more, as Stokes warms to his task with a tight off-stump line"
"rolls the fingers on this one, loops onto a full length, and punched into the covers. After a loose start, Stokes is starting to find his range"
"looking to launch the ball over the covers, doesn't quite get hold of it"
"looped onto a good length outside off, dabbed to point"
"well bowled, a nicely flighted wrong'un on middle and leg, Latham picks it well and pokes to cover"
back of a length but this one slides on as Latham lines up the cut and is a touch hurried in execution
"worked off the legs, another slider"
"bounce on a good length, pushed onto the back foot"
cracked into the covers
"aggression from Stokes, but that's too far over Guptill's shoulder"
"fuller and straighter, dabbed from deep in the crease to short cover"
"on the legs, nudged behind square, they might have lined up the second but for a slip"
"well played this time, a compact drive into the covers from a tight full line"
"clipped to leg, a touch too straight into the pads"
punched into the covers again
"tossed up, and grips a touch as GUptill leans forward to defend"
"slapped from the crease, can't beat the cover fielder"
"nudged off the hip, working with the turn, gathered at backward square"
"another slider from Rashid, and nearly a return catch as Guptill closes the face too early. Just wide of the stretching bowler in his followthrough"
"leaning forward, blocked into the leg side"
"punched with intent into the covers, just another single"
"a touch over-pitched to start, squeezed to point"
nudged into the leg side as Moeen comes round the wicket
closes the face once more. Midwicket gathers
"up on the toes, punched down the ground to bring up the fifty. A subdued round of applause from the crowd"
"well played, a deliciously late cut, zipping though third man and there's no stopping that"
"another open-faced dab through third man, not quite the same timing but effective all the same"
stabbed into the covers
chopped square
tickled round the corner to backward square
"<strong>there's the breakthrough!</strong> Beautiful flight from Rashid, late dip, a bit of turn, Latham is drawn into a hurried clip into the leg side, and lobs a simple chance to Ben Stokes at mid-on!"
"looped up from over the wicket, tucked towards midwicket"
"pushes through the googler, driven to cover from the crease"
"nicely bowled by Moeen, flighted and the ball spins sharply inside the bat as Guptil aims a cover drive and fails to connect"
"tossed up straight, worked down the ground for one"
"round the wicket, rips off a length <b>and tickles the off bail!</b> Chapman looks flummoxed but it's all over, red rover... Beautiful ball, turn again for Moeen and it skipped past the outside edge to flick the top of the stumps with Chapman squared up and poking at it in vain"
pushed through a tad straighter and worked of the pads to get going
"over the wicker to Guptill, spins in again, loops up wide of the keeper - no slip in but don't think there was any bat involved"
floated up on off and tapped into the covers
"flat on middle and off, Nicholls defends"
"full toss but he misses out, bunted to midwicket"
comes forward and drills one down the ground
"pushed through flat outside off, not much turn on the legbreak and Guptill flat-bats it for a couple towards deep backward point"
"flighted, gets forward to drive and finds a gap square for one"
gives this plenty of air and Nicholls is down early to paddle a sweep away for one more
"flat on off, defended back down the track"
"pushed through outside off, Nicholls strokes one through cover point"
"over the wicket to the right-hander, who defends on off stump"
"floated up and Guptill goes hard at the sweep, gets it past midwicket for a couple into the wide acres of this Hagley Oval outfield"
"sharp spin back into the batsman as he tries to cut, hits the splice"
tossed up full on the stumps and worked to the leg side
"looped up full and Nicholls showcases the sweep again, keeps it down for one"
"flighted, around off stump and stroked into the covers"
"tossed up, Guptill takes aim and... BOOM! First six of the day, and it's a sweet hit, driven inside out and it sails over wide long-off"
pushed through and dinked for one
"chipped, slightly aerial straight down the ground, mid-off has to cut it off"
"floated up and Guptill goes after it again, skewed low towards cover this time - <b>and has Stokes plucked a peach here?!</b> Guptill is hanging around but Stokes is confident and the <b>soft signal is out</b> from the on-field umpires; is there anything to overrule on the replay? No, looks like it went skimming straight into those big paws, and England have another! Guptill struck it pretty well but it picked out one of the best fielders on the park, big wicket"
"pushed through on off, shows it the forward defensive"
"angled in from round the wicket, tapped away"
"this slides in and clips the inside edge, runs between the batsman's legs"
Nicholls plants the front foot and shows it a straight bat again
tossed up and again met with a front-foot lunge
"touch shorter, Nicholls goes back and across and pushes the ball away square"
"offers him a big full toss to begin with, which De Grandhomme pats back to the bowler"
comes across and pushes a single through point
"big appeal for lbw, Nicholls done by the wrong'un and playing down the wrong line... but that pitched outside leg"
"loops up another googly, just about covers the line this time"
"comes down to try and take spin out of the equation, pushed to mid-off"
"tossed up a bit wider and the legbreak grips, hits the gloves as Nicholls thrusts his bat out to defend"
"angled in flat from over the wicket, tapped back"
pushed through and De Grandhomme works a single through mid-on
"nicely played by Nicholls, uses the feet and lofts a straight drive past mid-on, in the air but fine of the man and it bounces away for a much-needed boundary"
"tries to come down again, this time the length is shorter and Nicholls has to dead-bat it on the stretch"
tossed up and worked off the legs
"angled in on middle and leg stump, De Grandhomme tucks a single through midwicket"
"floated up, the legbreak pitches and straightens, into the front pad... Rashid aborts an appeal, maybe spinning too much"
"flatter, on the pads and clipped to short fine leg"
"floated up full, brings out the sweep again, there's a bit of extra bounce from the googly but <b>the top edge just clears short fine leg running back!</b> Rashid purses his lips and raises an eyebrow"
"tossed up and driven, Rashid dives across to his left to cut it off"
"dragged down a touch, goes to cut and fails to lay bat on it, rebounds out of Buttler's gloves"
"CDG looks to go large, slices a whack over cover... but this bounces short of the man running in and Rashid finishes the over empty handed"
tossed up and worked down the ground
"round the wicket, pushed through and defended on off"
angled in and worked to the leg side
"flat, good length, tapped back to the bowler"
"spinning a touch on off, Nicholls drops back and clips a single to long-on"
"over the wicket now, flicked to leg with the spin, short fine leg cleans up"
"lobbed up on middle and leg, worked down the ground"
"pushed through and played delicately, the big man guides a cut through backward point"
"go grand, or go home... and De Grandhom(m)e is doing both! <b>A filthy slog into the pristine Christchurch sky</b> and Tom Curran settles under a straightforward catch after trotting in from long-on. A huge homer but doesn't have the distance and CDG is a goner"
floated up and blocked coming well down
Nicholls shuffles across and pushes into a gap
"ooh, lovely bowling, this rags back and slides past the inside edge to hit the back pad"
"pushed through on middle and off, Nicholls blocks on the front foot"
"tries to run this off the face, Nicholls is sent back as short third man swoops"
"angled in flat from round the wicket, tucked to the leg side"
"top-of-off stuff, prodded back to the bowler"
"floated up, uses the feet and punches through mid-off"
floated up and tapped away defensively
"flighted, again Nicholls pushes it away from the crease"
comes down and works one to long-on
"tossed up on the stumps, Santner drives off the back foot and Rashid gets a hand on it, breaks the stumps... but Nicholls has his bat grounded"
"pushed through a touch leg side, flicked square for one to get Santner on the scoreboard"
"full on middle and off, comes across and defends"
tossed up and worked back past the bowler once again
Moeen gives this some air and Nicholls again shows good footwork to get out and thread one through a gap in the covers for three
"angled in straight, no such movement from Santner, who stands stock still and blocks"
"flat offbreak, defended on off stump"
"flighted, this time he skips down but drives to mid-on"
"flat delivery, this time Santner clips a drive towards extra cover"
floated up outside off and Santner picks a gap in the off side for one
"tossed up full, worked back to the on side"
"flatter on leg stump, flicked off the pads square for one"
"full, prodded back to the bowler"
"slips in the googly, Nicholls spanks a drive in front of square and Bairstow is somehow wrong-footed by it trying to collect one-handed, allowing NZ to run three towards deep cover"
"poor ball and <b>Santner puts away a rare shot in in anger!</b> Dragged down and pistol-whipped through midwicket, no one out there for protection"
"tossed up full, tapped to the lg side"
pushed through and speared past the man at cover for one
comes across and taps to the off side
flat and a touch straight and Santner moves into double-figures with a crisp whip through the leg side
"tossed up on off, prodded into the covers"
angled in quick with the arm and worked away through mid-on
"pushed through on off, Santner dabs one more in front of square"
"over the wicket, slightly short of a length and defended coming across"
"ooh, nice line, fades past the outside edge as Santner hangs back"
"banged in short, 129kph and trampolining through over the batsman - too hight"
"short and a touch leg side, pulled for one through backward square leg"
"fullish length, driven back to the bolwer half forward"
"length ball, on the pads and whipped in front of deep midwicket for a couple"
"touch fuller on off, gets him driving... and again there's a misfield in the cover region to gift the NZ total a run"
"flat and skipping on outside off, cut away in front of square for one"
"tossed up, Santner waltzes out - <b>and gives it some humpty down the ground!</b> A fairly effortless six, lofted on to the grass banks"
"ooh, nearly chipped to cover this time! Weight wasn't going forward, the ball landing <i>just</i> in front of Stokes"
""
pushed through and tapped square on the off side
"flighted, around off stump, Santner dabs into the covers"
"touch short, tapped down into a gap"
"short ball, zinging through above the batsman, gets away with this one"
"slung down outside off, 139kph and Santner blocks into the covers"
"back of a length, worked towards midwicket"
"touch short, 138kph outside off and Santner plinks towards point"
"banged in, splice-juddering length and he can only poke it to mid-off - just a single off the over"
"lobbed up from round the wicket, driven in front of the cover sweeper"
"slightly round-arm, punched for one to long-off"
pushed through and clipped to extra cover
"tossed up on off, Santner gets his drive down the ground for one"
given a bit more air and Nicholls presses forward to defend
"floated up and Nicholls raps a drive at extra cover, Stokes does well at the second attempt to prevent a run"
"back of a length, hauled through the leg side with a whip of the wrists"
"wide on the crease, a firm cut, using the angle, but can't beat the man at point"
"a crashing slap into the covers, once again finds the man directly"
"banged in short, the batsman definitely was angling for the wide, but nothing doing from the square leg umpire"
"a swish and a miss, extra fizz on that delivery from Wood and Nicholls can't connect with a hurried pull"
short and swung hard out through deep midwicket. That's another fine over for England's cause
"swished across the line, hauling the ball from way outside off"
"thumped hard into the covers, can't beat the fielder"
"down the track, hoisted high and handsome, and <B>way over the ropes at deep midwicket!</B> An ambitious tumble from one of the catch a million chaps, but to no avail"
drilled down to long-off
crushed into the covers
"slightly more round-arm in delivery, quicker and flatter, and cautiously fended away"
"outside off, pushed on the up into the covers"
"flicked off the hip with a waft of the willow, more of a short-arm jab than a full-blooded pull. In the air for a while but safe enough"
dabbed into the leg side for another scampered single
"back of a length, an uneasy pull as Santner is rushed into his shot"
hangs back in the crease and squeezes a drive into the covers
"weight coming forward, pushing another single into the covers"
"decent length outside off, and pushed into the covers"
"up on the toes, tapped firmly out to point and a sprawling dive to intercept"
"good tight line, but an equally well angled defensive push down to deep point, an easy two from a decent ball, and Curran is a bit miffed about that"
closes the face on a back-foot push to mid-off
"on the pads, and that's an excellently timed clip off the hip! Finds the gap, and that's a welcome boundary"
nurdled into the leg side again. Ten to go...
"outside off, flogged into the covers"
"on the back foot, outside off, prodded to point with an angled bat"
"slower ball, wide of the off stump, Santner has time to play his shot twice, but doesn't connect on either occasion"
picks out midwicket with another leg-side swat
"leaning into a fierce cover-slap, and up comes a very important fifty from Nicholls. He's carried New Zealand's innings since the departure of Guptill"
"tip and run to mid-off, and a direct hit pings off the non-striker's bails! They are going upstairs, but this is pretty clear-cut. On we go"
"whirling away on a very full, blockhole-targetting length, chiselled into the off side"
poked into the off side
"crushed through the covers! That was reminiscent of Lance Klusener, a back-foot battering ram of a shot, half cut, half drive"
worked to leg to keep the strike ticking
"width, and slapped square. Looking for two and finding it with ease"
"right under the eyeline, flogged into the off side"
"very full from round the wicket, clipped in the air through the vacant mid-on as Santner rolls his wrists on impact"
"thumped aling the ground this time, through the gap at mid-on"
"how on earth is that not a wide? Miles outside off, and the batsman seemed to retreat to leg before hand. Most curious"
clipped off the pads
"advancing down the pitch, Stokes spots him coming and drops his length back. A roundhouse biff to mid-on"
"well bowled, a tight line from round the wicket, beating a flat-footed slog from deep in the crease"
"over the wicket, outside off stump, Santner chases the ball but toe-ends his drive to short cover"
"back of a length, slightly leg-sided, helped around the corner to be mopped up at backward square"
"fuller length, outside off once more, deep point gathers another ambitious slap through the covers"
"cracked hard into the covers again, good hands to cut off the single as Santner swishes his bat in annoyance"
"a swing across the line, a <B>steepling top-edge</B> and Morgan in the covers pockets a simple chance. The end of a fine partnership, but New Zealand needed that pair to take this even deeper"
nudged to cover to keep the strike
tucked into the leg side
"slower ball, but misdirected. It dribbles down the leg side"
"anchored on the back foot, pushed to point"
clipped off the pads
"back of a length, a slower ball again, a horrid round-house hoick, and <strong>it's another top-edge!</strong> But this time Root at mid-on can't sprawl round to gather"
"<B>a direct hit from long-off!</B> This could be tight... nah, he's safely home. An initial over-throw lured them back for the second run, but all's well that ends well"
"another slower ball outside off, slapped off a cue-end to deep cover"
"low full toss, and <B>pumped down the ground!</B> Up comes the half century as Stokes flings himself in vain to try to cut off the four. He's rather winded himself as he lands ... actually, it's his back that he's feeling. That's not ideal"
cracked down the ground once more
"pops off a leading edge, but lands safely, short of wide mid-off"
"cracked with fierce intent into the covers, but the man is well placed and intercepts with ease"
"back of a length, an ungainly haul across the line to deflect the ball into the leg side"
"a premeditated shuffle across the stumps, and a clip to the leg side"
"low full toss, cracked to the off side"
"slower-ball bouncer, a flinched pull, clips the top of the bat, and no-one has a clue whether the ball has carried... aha, it's come off the lid, that's why there's the confusion"
"smashed hard into the leg side, flashing the wrists through the line of the ball, and past Wood at short midwicket."
"cracked to point and <B>dropped by Moeen!</B> That was a gimme, straight into the breadbasket... whoops. Can Santner make England pay?"
"well bowled, ignoring Southee's contortions in his stance, and rolling a slower-ball ducker past an ambitious flick to leg"
"hauled to leg, lots of bottom hand, but New Zealand kept quiet. Should have been a wicket, mind..."
"flogged through the line, getting himself outside off and pre-empting Curran's line. Top batting"
"full length once more, eased up the pitch"
"yahoo! Swinging from the hip, through the presumed line of the ball, but doesn't connect"
"no quibbles with that stroke! Santner picks this one alright, an attempted slower ball that comes out as a full toss, and it's battered hard and flat over the leg side"
flicked into the leg side again
"outside off, crushed square, but only as far as the sweeper. England just in danger of leaking themselves a stiff target, where at one stage they might have been envisaging less than 200"
"banged in short, and smashed hard out to deep midwicket ... slightly top-edged, Hales circles, and <B>clings onto a brilliant effort!</B> That wasn't easy, he had to make good ground, the ball was dying on him all the time, and he scooped it low to his right with a tumble. He's not the sharpest of England's fielders, but he did well there"
"width outside off, too much width"
