"<B>what a stunning take!</B> A slower ball long-hop from Woakes, Southee picked it well enough, thumped it hard and flat towards the midwicket fence, but Bairstow swoops round, one-handed, plucking it out of the air with his best Superman impression! It was the speed that made that special, nothing but a perfectly timed dive would do! And he had to be mindful of tumbling over the rope too. Unbelievably good"
"beaten outside off stump, well bowled, on a tight line"
"slower ball, full length, nudged to the leg side"
"squeezed on a full length, off inside edge and front pad"
"slower ball, down the leg side once more"
"low full toss, bunted into the covers. Six balls to go, and Woakes' fine day's work comes to an end, with the ball at least"
"full and straight, punched down to long-off"
"slower ball, following the right-hander as he attempted to give himself room on the leg side. Worked square"
"a rank leg-side long-hop. Looked like a back-of-the-hander, but went awry"
"heave ho! Smashed hard out to deep midwicket, and <B>Root drops it!</B> Probably over-shot the ball in his eagerness and couldn't recover his poise"
"right up to the toes, dug out back to the bowler"
"all over Red Rover! Smashing across the line, off a full length, got a lot of bat on the shot, but Curran had taken the pace off the ball, and Stokes at deep midwicket makes no mistake with fingers pointed skywards"
"touch back of a length, 129kph but holding its line a touch as Bairstow plays back and defends"
angled in and worked down into the leg side
"sliding in with the arm, 137kph and not much swing, tapped to the leg side again"
"bit of width, YJB slashes hard, clears the leaping man at backward point... and that's a boundary, England's first runs on the board"
"good pace and carry outside off, 136kph and left alone as he steps out"
"Southee darts out wide and arrows the ball in, defended coming across"
"over the wicket, slightly back of a length and pushed across outside off, Hales rocks back and blocks"
"pitched up and looking for swing, Hales steps out and lets it go"
"touch too full, there's some swing back in but Hales watches it on to the bat and pings a shot past midwicket, the ball just keeps running away..."
"fired across the bows, 137kph but quite wide and he leaves it well alone"
"length, Hales hacks hard and gets a thick outside edge down to third man for a single"
"fullish, 139kph in the channel, YJB steps on to the front foot and shoulders arms"
"beautifully bowled, full and nibbling away a fraction as Hales lets it go. Nothing but grief on offer to the batsman there"
drifts a little too straight and Hales clips him off the pads for one
"short of a length, 135kph around off stump, Bairstow shows it a straight bat"
"full on the stumps, short-arm punch through midwicket from YJB, picks up a couple"
"touch short and this is thumped on the pull, square leg gets a hand on it to keep them to one"
Hales comes across on off and pats it away
"short, 138kph but it's a little off target again and Bairstow times a square cut like a Swiss watchmaker for four"
"length ball, again a little width there, no swing and Bairstow raps it in front of point stepping across, picks up a couple more"
"goes round the wicket, trying to push the ball away on a length, tapped towards mid-off"
"short ball, angled into the body and Bairstow can't get bat on it trying to pull but they run anyway"
"pitched up, Hales doesn't bother to move his feet, just pumps the ball through cover point - four more!"
"full, tailing in, Hales chops it through his legs via the inside edge"
"fullish, outside off and YJB thrashes it to point on the bounce"
"drops short, pulled firmly through square for a single"
"plenty dobbly but not much wobbly so far, Hales hangs back and taps to leg"
"full, 127kph but sliding on to the pads and Hales just fillets it down to fine leg up for a boundary, thankyouplease!"
lets this one through outside off
"ooh, not far off from diverting the ball into his stumps, an extravagant drive from Hales and the ball ends up at short fine leg"
"bit of room to swing the arms and Bairstow cracks a cut, but Chapman does terrifically to leap and cut it off at point"
"pitched up and creamed through extra cover on the up, princely shot-making but it won't quite go all the way"
"touch short, 141kph angling across, slashed down to third man for one"
"banged in, flying through as YJB hangs back and lets it go over his head"
"pushed across from over the wicket, defended towards gully"
"dug in, 135kph/83mph and the ball sits up, Bairstow swats a pull past square leg for a couple"
"oh, that's dismissive... touch overpitched and YJB just leans into a bottom-handed belt back down the ground, bounds away for four"
"pushed into the pads with the arm, deflected square"
pitched up and tapped into the covers coming across
"length but straying on to the pads again, Hales clunks it past backward square leg for another boundary"
shuffles into line and lets it go
"medium-dobbers, 125kph on off stump, patted away"
pitched up and Hales plinks a drive towards extra cover
"short outside off, taken on the body as he attempts to pull"
back of a length outside off and guided down to third man coming across
"short, wide and <i>hammered</i> through backward point, beats the despairing dive and rattles to the fence once again"
"touch short, 135kph and it thuds into the pads, Southee is bellowing for the lbw... but it looked high? Hales took it on the thigh pad, and it's caused some pain"
comes across and plays a length ball down square
"length ball, aiming for the top of off, Hales shows it a straight bat in defence"
"short and a touch leg side, clipped away for four more... and there's polite applause for <b>the England 50</b>, which has come at almost exactly a run a ball"
"length, again on the pads and Bairstow wastes little time in creaming it away through midwicket for another boundary - again the locals politely show their appreciation"
"length ball, 126kph and tapped away"
"pitched up and <b>drilled back over the bowler's head for six!</b> A regal blow down the ground, YJB opening up his shoulders and dumping CDG into the crowd"
sliding in to the body and worked for one
again he gets too straight and Hales clips him off the legs
"ooh, slips this past the inside edge, rising off a length in the channel"
"tight lines, 135kph and there's decent carry, but no swing as Hales comes across and leaves alone"
"good length on off stump, prodded into the covers"
"goes a bit straighter, punched towards mid-on"
"touch short outside off, dabbed square from the crease"
"fullish, 136kph in the channel, Hales shifts on to the front foot and picks out mid-off - that's a maiden from Southee, though it already feels like too little too late"
"floated up and it's <i>absolutely battered</i> over cover, YJB launching his first ball from the left-armer to the rope with disdain"
lobbed up and poked through the off side along the carpet for one
darted in straight and Hales defends in front of the stumps
"lobbed up and blocked to the on side, Santner goes across to field"
"swept off leg stump, Hales takes him for a boundary now, powered away behind square"
"lobbed up full on the stumps, turned into the leg side"
"flighted, around middle and leg, Bairstow scoots out and chips one down the ground"
"pushed through outside off, Hales cuts one off the back foot"
"floated up nice and full Bairstow drives to the sweeper, in the air for a bit and the ball then spins in front of the sweeper, allowing YJB to hare back for a second"
"pushed through fuller on the stumps, defended"
"tosses up the legbreak, opens the face and runs to short third man"
"tossed up and spinning away, YJB leaves it be"
"ooh, this pops a little, hits the shoulder of the bat but plops safely away square on the off side"
angled in and flicked through the leg side
"worked into a gap, turning over the strike"
"flat delivery on middle and leg, nudged towards midwicket"
"dabbed into the covers, tip and run and they scamper through"
flat and quick and running behind square off the inside edge of the bat
"flighted, Bairstow leans on a little nudge square and they trot through, <b>that'll be fifty for Yorkshire's Jonny Bairstow</b> - indisputably in form now"
"nicely bowled, bit of turn and bounce as it slips through to the keeper"
tossed up and Hales prods at it unconvincingly
"pushes through the googly and, although Hales doesn't seem to pick it, they pick up three via a deflection off the pads"
"flighted, around off stump, tapped into a gap"
"shouts of 'catch!' as Hales sweeps in the air, but it won't carry all the way to deep square leg"
pushed through and steered square for a single
"tossed up on off, driven for one more in front of point"
gets a bit stride in and smothers the ball
"slightly quicker, tapped away playing back"
"lobbed up straight and Hales sweeps, gets it off the top edge but the ball safely clears short fine leg and they get a couple as Sodhi trundles after it"
"flighted, defended towards extra cover"
"rolls the arm over, full outside off and pushed square for one"
dragged down slightly and Hales cuts one more through point
"<b>into the bleachers!</b> Hitting against the spin but Bairstow is seeing it big, down on one knee and crumped into the crowd... where again the chance of a $50,000 catch goes begging!"
"goes again, <b>smashed over deep midwicket!</b> Bit of a drag-down and YJB rocks back to muller it into the picket fence"
comes forward and dinks down the ground
"floated up outside off, Hales leans on to the front foot and pierces the infield for a couple"
"nice and slow, driven down the ground from on leg stump"
"tossed up, again giving it some air and the ball bounces up to hit the splice"
"gets a touch straight and it's worked away square, into a gap for a couple"
"pushed through, defended back down the track"
"floated up outside off, stroked towards extra cover"
"quicker delivery from Santner, 94kph as Hales hops back and stabs the ball away"
"tossed up and driven, bobbles up on the spare pitch and beats the dive of the man at extra cover for a couple"
"floated up full and <b>Bairstow slams another maximum into the grass banks!</b> More tap for the bowler, and again it doesn't go to hand among the orange shirts"
"six more, blootered down the ground this time! Pushed through flatter but YJB still manages to get under it and lever the ball into the sightscreen"
"drops short, pulled into the leg side and they come back for two"
"CARNAGE! Full, in the slot, <b>YJB spanks it over long-on for a third six in the over!</b> Brutal, disdainful, painful -
 for the bowler and the gaggle of men in the crowd colliding with each other while trying to catch the ball"
"oh, nicely bowled, beats the bat to finish... That's what trying to play orthodox defensive shots gets you"
"short of a length, Hales ticks over with a pull for one"
"short and angled across, YJB leans back and misses with an attempted ramp"
angled across and Bairstow cuts a couple through point off the back foot
"dug in short, climbing through over the batsman"
"Boult keeps hitting the middle of the pitch, and Bairstow keeps hitting the boundary boards... Swatted around the corner on the pull, bounces away for four this time"
"better length, defended around off stump"
"short, again it boings through, too high for the umpire's liking"
"pitched up, YJB aims a slug down the ground, mistimed towards mid-on"
"tight wicket-to-wicket line, met on the back foot with a vertical bat"
"a touch of width outside off, dabbed through third man to rotate the strike"
"back of a length, hauled with power through backward square, and that's simple pickings. 99 ..."
"on the back foot, tucked down to third man, and Bairstow allows himself a quiet pump of the fist even before he sets off for the single. What a flying knock it's been!"
cracked hard through backward point
"outside off, and smashed hard to point. Just coming onto the bat nicely"
"kapow! Gives himself room on the back foot, smites the bat through the line like a claymore, and that's another monstrous boundary"
"gives himself too much room this time, and <B>Bairstow has smashed his own stumps!</B> He sized up the cut shot, but hammered his bat into his leg stump. You don't see that every day, least of all after such a brilliant innings"
"back of a length, Root rides the bounce and deflects through third man"
"bashed off the back foot, out into the covers"
back and across to defend into the leg side
"banged in short, and ducked"
"tweaked onto the leg stump, Root wants the single but Hales screams a loud 'no!' Had to scamper but made it home safely enough"
swept very effectively. Four more to the total as Hales closes in on his fifty
pushed onto the back foot and defended back down the pitch
"width outside off, Hales leans back for a cut, a bit outside-edgy but that races away, and up comes a very good fifty. He's been second fiddle for much of this innings, but no less important for that"
dabbed back to the bowler
"a yawning drive into the covers, another effective over as England move in for the kill"
nurdled out to the cover sweeper
pushed onto the back foot and blocked down into the crease
"full length, eased into the leg side with a well-timed roll of the wrists. No-one at mid-on so they return for the third"
"<strong>battered in front of square!</strong> That sat up and begged, round the wicket, in the slot, slammed with a short-arm pull"
onto the front foot to defend
"stands tall on the back foot, pushed back down the pitch"
leans back and chops through point
"outside off, from round the wicket, stretching forward and left alone on a good length"
big stride forward and pushed back past the bowler
"hurried on the back foot, flatter and faster, and defended"
"an expansive drive this time, opening the face and drilling through the covers"
"<B>smashed to midwicket!</B> Hales lines up the slog sweep, but picks out Williamson who wraps his fingers round a fizzing chance, and New Zealand have the beginnings of a sniff as the openers depart"
"outside off, short ball, through to the keeper"
"banged in short again, Root swivels into a pull and settles for the single to the midwicket sweeper"
"nudged in the air for a moment, off the pads and out through midwicket"
"beautifully struck, rising onto the toes, rolling the wrists, and slamming a pull in front of square"
"short, and through to the keeper"
"another short ball, another pull, top-edged a touch, but well short of fine leg, who gathered on the bounce to limit the damage to a single"
stabbed into the covers
"looped up outside off, Root doesn't really get to the pitch of the ball, but slaps hard through the off side, up and over the fielder and away to deep backward point"
"ambitious appeal as Santner raps Morgan's pads, but it was turning and bouncing. Not much value in a review"
"leaning forward, an inside edge onto the pads this time"
forward and pushed to the off side
"well bowled, round the wicket, luring the batsman forward, blocked into the off side"
"slapped with insolence over the covers, as Morgan reverses the hands and paddy-whacks a looping top-edge past the fielder"
more conventionally forward
"a swishing sweep, picking the length early and slamming it through the leg side"
"<B>brilliant catch on the boundary's edge!</B> Sodhi dropped it short, Morgan snatched at his pull and de Grandhomme circled well inside the rope, clinging on with two hands and keeping his shape to avoid tumbling onto the rope. It's still unlikely to change anything, but all New Zealand can do is take wickets"
poked into the off side
"back of a length, Root waits for the legbreak to bite, then dabs with the spin through third man. Subtle use of the angles"
"outside off, nudged behind point"
"shuffling feet at the crease, as Root slides himself into position to punch very square through point"
"round the wicket, defended into the leg side"
"on the toes, clipped out through midwicket, easy pickings"
"pushed onto the back foot, worked square as Root moves back and across to get behind the line"
tapped to square leg
nudged into the covers
"googly, punched on the up through the covers"
tossed up on off stump and defended
"on the pads, working the singles, ticking down the requirement"
"a swishing pull, out to deep midwicket"
"whoosh! Stokes gets underneath this one, a bit of air outside off, he drops to one knee, and slams a massive six way back onto the banks at long-on. England are into the 200s"
dabbed into the off side
"outside off, chopped into the covers"
"lots of air on leg stump, Stokes' eyes lit up for a moment, but it dipped late and he adjusted accordingly"
clipped to the leg side
"onto the front foot, tapped to point"
"finds the gap in the covers, and England are all but home"
"outside off, poked to point"
"down the track, meeting this one on the full, and chiselling another single to wide long-on"
"dropped a touch short outside off, cut out to cover"
"pushed onto the back foot, defended to the leg side"
"late cut, gathered well at backward point, but another single chipped off the total"
"makes room for a smash through the covers, but toe-ends his shot a touch. A long chase to haul it in"
"fully forward, blocked to the off side"
"on the legs, no wild swipe just yet, just another single off the hips to midwicket"
"flicked around the corner, another sharp single as Sodhi gathers at backward square leg but can't get his shy in in time"
tucked to the leg side
"head over the ball, punched into the covers, Santner's making England wait"
"up on the toes, trying to force his way through the covers, the end of a tidy spell in uncompromising circumstances"
"<B>toe-ended to point, and dropped!</B> Oh dear, that's a horror show. Down it goes, and Stokes looks suitably bashful"
"another hoick off a good length, another chance, <B>another drop!</B> Chapman rushing back at mid-off, can't get his bearings in time"
scores level...
"high and mighty, onto the grassy banks at cow corner, and <B>England claim the spoils!</B>"
