"79 kph, it is the googly and West Indies are all out. It rips back in, Gabriel plays the line, the ball spins back in, bounces extra and the ball takes the inside edge and bobbles to short leg. Another sharp catch from Ervine. That leaves Hope 90*"
"full and wide to start from Gabriel. Not much swing, left alone"
"good length delivery on leg, the ball seams back in, hits Masakadza on the pad, and then towards square leg"
"full and wide outside off, too wide to draw a stroke. Masakadza will be happy with that"
"the inducker. Full and wide outside off, but the ball seams in. Masakadza leaves, close to that off stump"
"full delivery outside off, maybe too full, driven away towards mid-off"
"good length on off, defended into the off side. A maiden to start"
"full around off, some seam movement back in, defended to mid-on"
"good length around off, moving back in, defended back"
"goes through the gully region for the first runs of the innings. Wild cheers from the crowd. Good length outside off, guided past gully for four"
"nails this. The adrenaline pumping through. Short outside off, way outside off actually, but he pulls and swats the ball over midwicket for four."
"full and wide, too wide, left alone, an ODI wide"
"full around middle and leg, played quietly towards mid-on for a quick single"
"a yorker outside off, Mire jams that back to the bowler"
"short and wide, some seam movement back in.  Mire doesn't hold back, chops towards point. Wanted to hit that on the up"
"good length delivery around off, defended towards mid-on. Nice and watchful"
"fullish outside off, Mire right behind the line to defend"
"139 kph, full delivery outside off, Mire watches the ball onto the bat and defends"
"off the outside half for a couple to third man. Good length delivery outside off, Mire plays the line, the ball squirts off the outside half"
"a bit of flight around off, defended back"
"slightly short, Masakadza hurries back and pushes the ball into the off side"
punched to extra cover from the back foot
"lots of flight on off, driven to mid-off"
"shortish around off, defended into the off side"
"loads of flight outside off, Masakadza gets forward and smothers the ball"
"loads of flight, ends up as a yorker, jammed out into the off side"
"short down leg, Mire doesn't bother with that. A free ball"
"wheeeee, that's a massive six in the last over of the day. Smile away. Chase gives this some flight, Mire runs to the pitch, doesn't quite get there but the ball is in his arc so he swings through the line, the ball goes waaay over midwicket, out the ground."
"flight around off, defended under his eyes. Boo"
"quick down leg, Mire looks to sweep, but the ball takes the pad and passes leg gully for some runs"
"short outside off, pushed into the off side. <strong>And that's stumps</strong>"
"back of a length just outside off, jumps onto the batsman. Defended, rather unconvincingly, off the back foot, towards short cover"
"short and wide outside off, <b>crunched!</b> Gets in position early, and pulls past midwicket for a boundary. Gets off the mark"
"adjusts his line, back of a length outside off and angled into the batsman. Driven straight back to the bowler"
"good length on off stump, gets inside the line of the ball and defends off the back foot"
"back of a length on off stump, angles into Masakadza once again. Mistimes the backfoot defense. Played down the wrong line as the ball goes down the leg side, raps him on the pad, but would've gone down leg stump"
"good length on off stump, can't get bat to ball as the delivery comes onto his body."
"back of a length outside off stump, tiptoes and drops his hands onto the ball, allows the single as the ball goes towards short cover"
"back of a length just outside off, opens the bat's face and allows it to come to him, glanced to third man"
"<b>induces the edge, but short!</b> full outside off, straightens slightly after pitching, tries the front-foot defense, but the ball takes his outside edge instead. Falls just short of first slip, and then bounces away past him"
"back of a length outside off stump, gets inside the line of the ball and defended off the back foot"
"back of a length outside off, tries to punch that towards mid off, but there's no feet movement. Mistimes it, as the ball hits the toe end of his bat"
"short outside off, defended off the back foot from top of off stump. Was rising onto him"
"short outside off, but not much bounce this time. Punched off the back foot, from in front of his pads, to mid on"
"full on off stump, tapped to mid on off the front foot"
"short and wide outside off, gets on top of the delivery and cuts between cover and point. The fielders have to give it a chase, and Jermaine Blackwood (who's very fast) does well to pull it back from near the ropes"
"good length on middle, the ball drifts down the leg side and the batsman can't flick it towards the leg side"
"back of a length outside off stump, the angle forces Masakadza to defend it from just outside off. Had to get onto his toes for that"
"good length outside off, defended off the back foot with ease"
"good length outside off, opens the bat's face and tapped towards gully. A fine dive to his right from the fielder positioned there to stop the ball"
"full and wide outside off, the batsman pushes at it but takes the wide edge off the bat, and flies past gully's right for four more. The batsman might just have opened the bat's face on purpose, though"
"full just outside off, firmly defended off the front foot"
"back of a length outside off, stays slightly low, along with some inward movement into Mire. Ball goes through bat and pad and through to the keeper. No footwork once again"
"back of a length on off stump, Mire does well to defend it back to the bowler. Was quick to identify the ball's line"
"short and wide outside off, punches the ball away from his body, but the bat's face is opened. The ball races past point for another boundary to end the over. Rather expensive this"
"full just outside off, driven down the ground past the non-striker but mid on is up to the challenge. Races to his right, and dives full length to stop the ball from going for four"
"full on off stump, rocks back and defends back through to the bowler"
"full on off stump, shuffles to the off side and punches the ball down the ground. Mid on has to move one step to his left and collects"
"<b>falls just short!</b> Full on off stump, but uneven bounce this time, the ball hits the top sticker area of the bat, and pops up. Falls just short of Roach. Spongy bounce"
"good length outside off, defended off the back foot"
short outside off and <b>that's dispatched!</b> Pulled emphatically past midwicket's left towards cow corner for another boundary to end an over. Masakadza getting a move on today
"full on off stump, firmly defended back to the bowler"
"back of a length just outside off, tentatively punched towards cover, but takes the inside edge, goes past the stumps behind square on the leg side. Scampers through for the run"
"fuller outside off stump, defended towards cover off the front foot. Was quick to get to the pitch of the delivery"
"back of a length outside off, the batsman had wound up early for the punch past cover, but the ball took ages to get to him. Finally tapped towards the off side."
<b>glorious!</b> It's a half volley outside off stump and Masakadza settles quickly onto the front foot and hits a crunching cover drive. Races away
"short on off stump, goes down the leg side"
"short outside off, goes for the big pull, but misjudges the pace completely. The ball goes under his bat, and through to the keeper"
"full outside off, defended off the front foot with ease"
"full outside off, punched down the ground but straight to mid off"
"short outside off, pulled, but straight to midwicket. The fielder has a shy at the non-striker's stumps, but misses. Would've been a close call if he would've hit"
"<b>And the slower ball works!</b> Mire's debut innings ends. Full outside off and Mire, rather frustratedly, slogs it towards the leg side. The elevation is there, but not the distance, and Kraigg Brathwaite at deep midwicket does well to settle under the ball early and falls to his knees as he completes the catch. Nice change-up from the experienced bowler"
"back of a length outside off, left alone"
"full outside off, can't time the drive well, and the bat turns in his hand. Dribbles away towards midwicket"
"full and wide outside off, left alone"
"full outside off, defended back to the bowler"
"back of a length outside off, shuffles to his left and tucked towards the leg side off the front foot"
"good length just outside off, prods forward and confidently defends off the front foot. Gabriel using the wide crease to get the extra angle in"
"full just outside off, Ervine considers playing at it, but realises he's in no position to play it well. Pulls out of a drive, and goes through to the keeper."
"not a genuine half-volley but Masakadza simply blasts this through the line. Races to the cover boundary. Not much movement, so it is a safe shot. Superb when it comes off"
"<b> lands short of first slip. </b> Looks to drive again on the up, checked his shot at the last moment. Looked like the ball stopped on him just a touch. This is a slow surface so it doesn't carry to the catcher. <strong>Lucky break for Masakadza</strong>"
"slower and fuller outside off, driven firmly to extra cover"
"snakes a length ball back into middle and leg, Masakadza gets a thick inside edge down to square leg"
beauty. Plays inside the line of the delivery and watches it through to the keeper. This was a length ball that zipped through from off stump
"on a length, just outside off, left alone. Hardly carries to the keeper this time"
"length ball that stops on him just a touch, Masakadza cautiously defends"
"yorker-length just outside off, Masakadza squeezes it back down the pitch"
"angles in a length ball from wide of the crease, Masakadza gets a good stride forward and defends solidly"
saved by an inside edge. Plays all around a full delivery angling in. Looked to work it through midwicket when he could've been better off playing through mid-on
stands tall and bunts this incoming length delivery with soft hands
solidly defends an incoming length ball to the off side
"floats a back of length delivery across the left-hander, who lets it go"
"full and just outside off, eased back to the bowler"
"excellent line and length. Full on the stumps, draws the batsman forward. Carefully defended back down the pitch"
steers an away-going length ball towards gully. Played this with soft hands
"back of length delivery slanting away, is trying to get the batsman poke with an angled bat. Ervine isn't the one to be perturbed or poke nervously at the moment"
"once again invites the drive by pitching this up outside off, Ervine is happy to leave"
"sees the ball in his arc and he's muscled this over long-on. Too full, drifting into middle from wide of the crease and he simply got to the pitch of the ball and let the bat swing do the rest"
"immediately shortens his length. This is too short, slapped to sweeper cover"
"much better from Bishoo. Lands this a touch ahead of length on middle, hint of turn as Ervine lunges forward and defends"
"tossed up but this one pitches on leg stump and spins back in further, Ervine misses an attempted tickle"
"nicely tossed up on the stumps, defended with soft hands"
"nice flight, lands this on middle, he gets a good stride forward and turns this with the spin to the leg side"
"angles a length ball on the stumps from wide of the crease, bunted back down the pitch"
punched to the diving gully fielder. This angled back in and cramped him for room as he shaped to cut
"lands this a touch ahead of length on off, this one nips away just a hint. Masakadza is half-forward as he defends"
shows the full face of the bat and drives this full-length delivery back to the bowler
crisp drive down to deep cover
stands tall and defends this incoming length ball with soft hands
"nice flight and drift in from wide of the crease, Masakadza gets forward and defends"
"too short, he uses the depth of the crease to steer this into the gap at deep point. Enough time to come back for the second as Kraigg Brathwaite had to come around from deep cover"
right forward as he defends
driven with the spin to the bowler
"much fuller and outside off, defended back to the bowler"
"loaded with risk but when it comes off, it is effective. Full on middle, Masakadza plays a predetermined paddle to fine leg"
"full and just outside off, eased into the gap at cover for an easy single"
nicely forward as he solidly defends this incoming length ball
looks to flick a full incoming delivery but misses. Even a hint of bat on that and it would've raced to the fine leg boundary. <strong>Holder lucky to get away with a wayward delivery</strong>
"hint of movement from length outside off, left alone"
"snakes back in from wide of the crease, looks to flick but gets a thick inside edge to deep backward square leg"
"jags back in from length outside off, defended"
"tossed up on off stump, Ervine lunges forward and blocks"
delightful flick. Chips down the track and whips this away over midwicket. Didn't quite get to the pitch of the ball but the momentum allowed him to complete the stroke
"sharp turn back in from outside off, hits him high on the thigh pad as he looks to work this to the leg side"
"defends carefully with soft hands, lands short of short leg"
this is a full-blooded sweep but smashes into the boot of short leg as he looks to take evasive action. Lobbed up briefly towards short fine. <b> Would've been a remarkable catch had it been taken </b>
steps out and eases the tossed up delivery down to mid-on
"much fuller and just outside off, defended"
"slower and fuller on the stumps, squeezed back to the bowler"
whips this incoming delivery on middle and leg to mid-on
driven firmly to mid-off where Kemar Roach dives and parries it to mid-on. <strong>Saved a couple of runs at least</strong>
carefully defends this incoming length ball from around the stumps
"angles in a length ball that straightens a touch, defended solidly"
"full on off stump, carefully defended with soft hands"
"full outside off stump, the batsman settles down on one knee and sweeps square"
"full on middle and Ervine decides to sweep as well. <b>It's in the air,</b> but falls just over the short fine-leg' fielder. Not timed as well, and top edged too, but just enough muscle in that for the ball to go for four"
"back of a length on off stump, races down the ground but can't get to the pitch of the ball, bunted down the ground"
"fullish outside off, tries to cut it, but takes the top part of the bat. <b>Slightly in the air</b> but falls just short of point"
"good length outside off, punched past point and cover for an easy single. Goes deep into the crease"
"short outside off, gets inside the line of the delivery and pulls to the fielder at deep backward square"
"full outside off, and punched to mid off"
"back of a length outside off, tries to punch down the ground, but opens the bat's face at the last moment. Goes down to third man ."
"short and wide outside off, nice carry through to the keeper. Left alone"
"full and wide outside off, goes for the expansive drive, but the ball goes slightly away after pitching. That means Ervine misses the shot, and the ball goes juuuuuust past his outside edge. Holder has his hands on his head"
"good length just outside off, driven down the ground"
"full outside off, driven down the ground, sharp legspin"
"full on off stump, Masakadza biffs the ball to long off before the ball could spin away. Got to the pitch of it"
"full outside off, gets his front foot forward, and works it towards midwicket"
"pitched up just outside off and <b>that is slogged!</b> Gets down on one knee, and smacks it in front of square on the leg side. It's in the air, but the sweeper-fielder who is just behind square, has no chance. Bishoo getting some hammering here"
"full on leg stump, but Ervine was ready for it. Adjusts into the reverse-sweep, and gives the ball a nice swipe. Goes past point-region for four more. No chance for the left-hander's third man"
"full on off stump, squeezed away to mid on"
"short on off stump, rises onto his body, as he fends the ball towards the leg side. If there was a short leg for that delivery, he was a goner"
short outside off and this time he has the width to pull it along the ground for a single
"full outside off stump, the angle takes the ball away from Ervine. He lets it go"
"back of a length on middle and leg, Ervine lets that go through to the keeper but the delivery was very close to top of off stump. A good leave in hindsight, but rather close"
""
"full on off, driven to mid off along the ground. A good diving effort to stop the runs"
"<b>And spin does the trick!</b> Full on off stump and Masakadza comes forward for the defense. But extra spin on offer this time, and it takes a small edge off his bat. Dowrich does well to hold on to it. Feather touch, but good enough for the wicket. His watch has ended"
"full outside off, defends it first ball. Rather tentative, but gets the job done"
"full on off stump, lesser rip this time, gets inside the ball's line and plays it back through to Bishoo"
"tossed up full on middle and leg, defended"
"full on middle, pushed back and almost past Bishoo, but the bowler does well to stop the ball from going past him"
"back of a length on middle, rocks back and punches the ball to mid on"
"short outside off, Ervine ducks as the ball goes past his helmet"
"full on off stump, tries to defend but takes the inside edge instead"
"full just outside off, defended with soft hands from top of off stump"
"full outside off, tries to defend again but opens the bat's face at the last moment. Dribbles away to second slip, who has to dive to his left to stop the ball"
"full just outside off stump, Ervine shoulders his arms. It was on the fourth-stump line and the batsman calculated the distances well"
"short on off stump and this time it's got more pace. Ervine does well to get out of the way, ducking and shuffling his way towards the off side. Sharp take from Dowrich"
"full just outside off, driven down the ground to mid off"
"full on middle stump, gets to the pitch of the delivery and taps the ball along the ground to long on for a single"
"<b>And Taylor lasts only seven balls!</b> good length on middle stump and Taylor tries to play a reverse paddle sweep. First slip anticipated that shot and was already running to his right when Taylor makes contact. The shot isn't well timed, and sort of loops up instead. The fielder has to move a few steps to complete a very sharp catch. Zimbabwe in trouble"
quicker ball to welcome Williams. Full on middle stump and goes straight through. Well defended by the new batsman
"pushed wide outside off stump, forces the batsman to cut, but straight to the fielder at point"
"full on middle stump, too close to the body for a flowing drive, takes the bottom edge, and flies to the leg side. Unconvincing shot"
"full outside off, slashes at it and it takes the outside edge. Goes past slip for two more, as the infielders have to give it a chase"
"quick and full on middle and leg, misses the clip off his legs, and raps him on the pad. <b>Gabriel appeals,</b> but the umpire reckons it would've gone down leg. Replays confirm"
"back of a length just outside off, goes deep into the crease and punches back to the bowler"
"full on off stump, hurries onto Williams, who does well to keep the ball away from his pads. Bunted away to midwicket"
"good length on middle and leg, goes down the leg side but the batsman follows through with the shot, can't make contact though. Dowrich does well to dive to his right and collect the ball"
"full outside off, driven straight to cover"
"full on leg stump, tucked around the corner from near his toes"
"full on middle and leg, this time he connects with the sweep well. Goes straight to the square fine leg fielder"
"good length on middle, straightens after pitching and the batsman is playing the wrong line. Sneaks through between bat and pad, but a slight inside-edge saves the batsman from the lbw"
"full on middle, prods forward and taps the ball back to the bowler"
"good length just outside off, plays in front of square on the off side and calls early for a quick single. Big gaps in that region"
"full toss just outside off, pinged straight down the ground but Bishoo can get his body behind that shot. Gets away with the loose delivery"
"full on middle stump, tries to play the on drive, but the ball hits the outer edge of his bat, flies through towards mid off instead"
"full on leg stump, tapped to the fielder at midwicket. Minimal foot movement, while Gabriel continues to attack the stumps"
"full outside off, tentatively pushed to point. Looks for the single, but the fielder quickly throws it in"
"short on middle, <b>and that's a ridiculous shot played by Williams.</b> The height and pace challenges him, and he ducks to get out of the way, but his bat is hovering in the air, and it takes the inside edge. Goes through to fine leg for one"
"full on middle, almost a yorker and the batsman comes slightly forward, effectively yorking himself. Tries to flick the ball square but the inside edge off the bat through to his pads"
"full on leg stump, slightly awry line and that's tucked off his toes to backward square for two more. <b>That's 100 for Zimbabwe, and also lunch.</b>"
"tossed up outside off, driven firmly to mid-off"
"on the flatter side, sharp turn back into middle and leg, tucked wide of square leg"
"too full on the pads, worked wide of midwicket as they jog the single"
"laces this through cover. Lovely touch, lovely timing. Right to the pitch of the ball as he played the stroke"
"mistimes a drive to mid-off this time. Looked to hit it hard, didn't get it anywhere near the middle"
"much more authority in the drive, straight to mid-off though"
"floats this full on middle, Ervine defends from the crease when he could've perhaps looked to play forward"
"has he nicked this through? Muted appeal. Yorker-length outside off, Ervine looks to squeeze this through gully. Sound was that of the bat hitting the ground"
"touch fuller outside off, left alone"
"short and there's enough width as well for him to cut, but Ervine prefers to watch this through to the keeper"
"full and swinging away from outside off, left alone"
bunts this good length delivery on off with soft hands
"too much flight, just around leg stump, worked to long-on"
"fired flat around leg stump, paddled down to fine leg. Neatly done"
"gives him the charge but he wasn't quite to the pitch of the ball. Looked to loft, goes off a thick inside edge to long-on"
"full and much closer to the stumps, defended with the bat close to his pad"
"too short, on middle and leg, whipped into the gap at midwicke"
"sharp turn back in to beat his forward prod. Big appeal and West Indies have reviewed. <b> Shane Dowrich said 'not out.' Blackwood at short leg shoulted 'That's close, brother. That close!'. </b> And so Holder reviews. Coming back to the delivery, this was nicely tossed up outside off, hit the surface and deviated back in to beat the inside edge and hit Ervine on the flap of the pad. </B> Umpire's call and so since on-field wasn't out, this can't be given. </b>"
"<strong>hint of reverse?</strong> Full outside off, this comes back in a wee bit. Defended from the crease"
"reverse swing has done the trick. Super lazy from Williams. Perhaps he was influenced by the deliveries that kept coming back in. This time, Roach got this length ball to move away from outside off, Williams had a waft at that and got a thin nick through to the keeper. West Indies are chipping away"
"floats this full on the stumps from wide of the crease, blocked carefully"
"angles a length ball on off stump, this one keeps a touch low, defended from the crease"
bunts this carefully from the crease to the off side
"looks to force this through cover, gets an inside edge and they scamper through for a single."
"fired full on the stumps, paddled down to fine leg. Craftily done. He took it on the full"
"touch short and drifting in, he makes room and punches this down to mid-on"
"shapes to cut but tries to pull out of the stroke, the ball skews off the outer part of the bat to short third man"
"fired full, once again he isn't afraid to get across the stumps and paddle it down to fine leg"
"full on middle from wide of the crease, defended"
"<b> Dowrich misses a stumping. </b> Bishoo has all the reasons to be disappointed. He cleverly shortened his length and got the ball to break away as Raza shimmied down the pitch. Once he realised he wouldn't get to the pitch of the ball, he tried to pad it away but the ball spun away to brush the outside of his elbow and deflect off the keeper's glove to slip."
"length on middle, defended from the crease"
steps out and works this tossed up delivery with the spin to midwicket
"width outside off, driven firmly on the up to the man at the edge of the ring at cover"
"gets this length ball to nip back in from outside off, punched back to the bowler"
"slower off-cutter on middle, Ervine picks it off the hand and blocks"
"gets this to nip away from outside off, watched through to the keeper"
"too short, he uses the depth of the crease to ease this into the gap at deep cover"
steps out and turns this with the spin to midwicket
sliding down leg and he brings out a powerful sweep that beats short fine leg. That should break the shackles
gets a good stride forward and turns this with the spin to the leg side
"skiddy delivery at length on off stump, keeps a touch low, defended from the crease"
"tossed up on middle, hint of turn back in, he lunges forward and smothers it"
"length outside off, gets this to nip away just a bit, defended from the crease"
