"lunges forward and blocks. Nice loop on this delivery, ball wasn't far from the outstretched hands of the silly point fielder"
"full and drifting into middle and leg, blocked again"
"spins back in sharply from outside off, he is right back inside the crease as he blocks"
"steps out to whip this over midwicket, turns out to be a flat hit. Didn't get underneath the ball properly"
"tucked away around the corner towards fine leg. Short and sliding down leg, he just had to lend bat to the delivery"
clean strike. Steps out and heaves this with the spin into the vacant deep midwicket region.
"on the shorter side again, whipped to deep square leg"
"sharp turn into middle and leg, keeper collects it cleanly down leg as batsman misses the tickle"
"tossed up on middle, defended back to the bowler"
"pushed through quickly outside off, he gets a long way forward and blocks"
"fired in flatter on the pads, he's well forward in defence"
he'll be livid at missing out on a boundary opportunity. Smashes this cut but straight to point
"drifting into the pads, defended to the man coming in from short fine leg"
lunges forward and jabs with the bat well in front of the pad
sharp turn from outside off but there's enough time for him to defend off the back foot
slow turn beats his nurdle. Spins back in to hit the pad
gets his pad outside the line of the stumps and defends
"quicker one on middle and leg, turned to square leg"
"viscous turn. Kept coming back in and cramped him for room, rolls off a thick inside edge to square leg."
"steps out to smother the spin, gets the inside part of the bat, rolls to short leg. Alert enough to get back into the crease though"
"fired full on off, he lunges forward and blocks"
makes room and cuts this short ball straigt to point
"sliding into the pads, picked away into the gap at midwicket, back for the second quite comfortably to raise the <strong>50 partnership</strong>"
defends a full delivery from the crease. Did well to wait for the turn and then negotiate it
"sliding into middle and leg, tucked to square leg"
nice stride forward and he defends
steps out and works this full delivery with the spin to long-on
"sharp turn back in from outside off, turned with the spin to midwicket"
goes back and across as he tucks this with the spin to square leg
"flatter trajectory, goes back and across as he defends"
steps out and works this with the spin to long-on
"lands this at length on middle from around the stumps, defended from the crease."
"back of a length outside off, uses his wrists to play this square towards midwicket"
"good length on middle, defended off the back foot. Quicker delivery, that came onto him quicker than he expected"
"full on middle, gets his foot out of the way and bunts the ball back to Cremer. Tight bowling"
"<b>Commentator's curse!</b> Just as I said he was tight, he pitches one short and wide outside off. Kyle Hope jumps onto the loose ball, and pulls in front of square. Goes for four near the long-on boundary. <b>That's also Kyle Hope's highest Test score.</b>"
"back of a length on middle, opens the bat's face and tries to run it fine. Goes to point"
"good length on middle, steps back and punches to cover"
"full on middle, tapped towards the fielder at short leg"
"full on middle, goes straight through. Tries to defend it expecting the spin, but misses"
"full on off stump, charges down and drives straight to mid off"
"full on middle and leg, the batsman isn't sure where this will go, he steps really forward and defends. Bat-pad, and lobs almost into the hands of short leg"
"full on middle and leg, much more convincing his defense this time"
"<b>Close!</b> But survives. Backward short leg came into play there. Good length on leg stump and he rocks back to work the ball off his hips, but the bat's face closes and it flies just past the fielder near backward short leg. The hosts groan"
"full outside leg stump, turns into the right hander but he pads it away"
"full on leg stump, shoveled down the ground. Goes to long on for one"
"back of a length outside leg stump, tries to use the rough that's there. Good bounce but no shot offered"
"full on middle and leg, defended, It was an attempted googly, but it gets the bat-pad instead"
"full on leg stump, tapped down the ground towards midwicket for a single"
"short outside leg stump, tucked around the corner for a single. This new angle and line isn't working as well for him."
"full on leg stump, steps forward and tentatively defends with soft hands. Soft ensures the ball stays along the ground"
"full on middle, flicks the ball off his toes towards midwicket"
"back of a length on middle and off, steps back and punches towards cover. Not timed well"
"full on off stump, charges down and effectively yorks himself. Shovels the ball back to Raza"
"full on off stump, defended off the front foot. No real spin"
"back of a length on off stump, waits for the ball to come to him and then taps it behind square. They look for one, but choose not to go ahead with it"
"full on middle and leg, gets his feet out of the way and defends this towards the off side. The footwork allows the spin to be negated"
"full on middle, defended easily by Hope"
flighted full on middle stump. Thinks of driving but checks his shot at the last moment. There's a short cover positioned for the drive
"full on middle, works this towards the leg side in front of square. The gap there allows for the single. Charged forward to minimise the spin's effect"
"tossed up full on middle, offers the bat's full face. Defended nicely"
"full on middle, prods forward and sees Cremer's last ball for the day off. Defends with soft hands"
"good length on middle, offspin, Hope moved to the off side to work it fine down the leg side, but he can't execute the shot"
"full on middle, waits for the ball before defending it back to Raza"
"back of a length on middle, steps back and whips this off his pads towards midwicket"
"back of a length on middle stump, defended off the back foot"
"good length on middle, straightens after pitching. Carefully defended by Brathwaite"
"full outside off stump, bunted back to Raza, and <b>That's stumps!</b>"
"<strong>turn right away</strong>! Drifts in, and breaks away sharply past the outside edge"
"this skids on outside off, no shot"
"darted short and outside off, forced off the back foot to cover"
"good length, drifts in towards off, makes the batsman play, and breaks past the loose waft"
"shorter and outside off, chopped off the back foot to cover"
"dangled up outside off, non-turner, driven off the front foot but he can't get it past cover"
"full and angling in towards off stump, Brathwaite shuffles across off stump and drops the ball defensively to short midwicket"
"back of a length and outside off, punched off the back foot to the covers"
Hope gets on top of a shortish ball outside off and plays it up to cover
"<strong>shooter</strong>! Variable bounce. Jarvis puts it on a length outside off, scoots under the ball and rolls through to the keeper. <strong>Raises a puff of dust from the surface</strong>"
"full on middle and leg, Hope nudges it past the right of midwicket"
"full and nibbles in at off stump, tapped straight to short midwicket with minimal footwork"
"<strong>another one that beats the outside edge</strong>. Tossed up and drifts in on off, draws a prod from Brathwaite and zips past the bat. But the batsman seems unflustered"
"skids in with the arm on off, poked out to cover"
"lobbed up on off stump, smothered off the front foot"
"pushed through flatter on middle, defended back off the front foot"
"tossed up and breaks away slightly outside off, Brathwaite plays with soft hands, ensuring the ball does not carry to slip"
"floated up on middle, no turn, dead batted"
"good length and outside off, tapped to cover"
"pitched up outside off, left alone"
back of a length and cuts back in to rap the thigh pad after beating the inside edge
"full and angling in to leg stump, glanced to fine leg"
"full and angling in at off, flicked away to the straighter of the two short midwickets"
"full on middle and leg, clipped straight to square leg"
"flighted on off, dabbed square on the off side with soft ands"
"half-tracker outside off, Hope picks the length early. He ventures deep in the crease and nails a pull over midwicket for the first boundary of the day"
"looped up on off, defended"
clipped off the pads to square leg
"sliding into off, defended"
"shorter and outside off, punched back down the pitch"
"back of a length on middle and leg, tapped to square-ish short midwicket"
"pretty full and outside off, Brathwaite aims to drive but does not meet the pitch and drags it off the inside half to midwicket"
"full and angling in on middle, defended"
"pitched up on off, blocked"
"back of a length and angling in towards off, blocked to the leg side"
nip-backer from Jarvis. Pretty full and swerves back in to beat the inside edge and ping back thigh. Not given by umpire Reiffel. The tracker suggests this was <strong>bouncing over the stumps</strong>
blocked off the front foot
"full and outside off, driven through the covers off the front foot"
"lobbed up on off, defended"
"fired on off, jabbed back to the bowler"
""
"skids in to off, defended off the back foot"
"full and outside off, patted to the covers"
"another nip-backer from Jarvis. Back of a length, starts outside off, and snakes back in. <strong>Raises a puff of dust from the surface again</strong>. Jammed onto the pad off an inside edge"
"full and outside off, wobbles away, no shot"
"yorker, tails in on leg stump, dug out"
"pitched up and outside off, driven through the line to cover"
"full, angling in, and <strong>straightens past the outside edge</strong>"
"tossed up and drifts in, prodded behind square off an inside edge"
turn and bounce! Drifts in on off and <strong>bursts past the outside edge</strong>
"tossed up on off, defended"
"back of a length and skids in on off, played back to the bowler"
"flighted on middle, non-turner, smothered off the front foot"
"arm ball, short and flat, clipped to square leg off the back foot"
"full and angling in towards off, played back down the pitch"
"full and reverse-swings in, the batsman finds the gap between the two short midwicket fielders"
"really full on off, presses forward and jams it to mid-on"
"full and swerving in, reverse again, <strong>prodded in the air to the right of short leg</strong>"
"starts outside off and shapes back in, defended to short leg with more conviction"
"back of a length and angling in on off, punched back down the pitch"
""
""
""
""
""
""
"full and at off stump, tip and run to mid-off. Good, urgent single"
"Jarvis ventures wide of the crease and angles it in the channel outside off, ignored"
"rising short ball on the leg stump, cramps the batsman for room, he does well, fending it behind square on the leg side"
"<strong>Jarvins pins Kyle Hope in front</strong>! Nice and full, reverse-swings in to ping the front pad below the knee-roll in line with middle, as Hope falls over the flick. That's pretty plumb and the umpire raises his finger. Reward for an excellent spell from Jarvis. This would have carried onto cannon into middle and leg stumps"
"full, angling in at off, then cunningly nips away to beat the outside edge"
"pitched up on off, driven right back to the bowler"
"length ball, slides in on middle, defended"
"pushed through very full outside off, bunted down to long-off"
"tossed up outside off, spins sharply, as the batsman is beaten on the outside edge"
"pushed through outside off, poked to point"
"low full-toss on off, he can't get under it, and ends up slicing it to mid-off"
"pushed through on middle, defended"
"back of a length and outside off, punched into the covers"
"back of a length and skidding into the thigh, picked off to fine leg"
"dug in short and down leg, Brathwaite shuffles inside the line and lets it pass"
"full and nibbling in on middle, tapped back down the pitch"
"full and tails in, Brathwaite shuffles across off, checks his flick, and dabs in front of short midwicket"
"pretty full and swerves in on middle, hastily squeezed to midwicket"
"flatter and slid in on middle, Brathwaire presses forward and smothers it"
"full and skids into middle and leg, defended off the back foot to short leg"
"very full and straight, right in the flicking radar of Brathwaite. He twirls his wrists and sends the ball away past the right of short midwicket. He<strong> brings up a solid fifty</strong>"
"similar line and length, this is clipped straighter to mid-on"
"full and drifts in from wide of the crease, dead batted"
"slid in full on middle, Hope answers with a dead-bat defence"
"full and holds its line outside off, ignored"
"pitched up and outside off, Brathwaite presses forward and check-drives to cover"
"short and wide outside off, slashed to backward point"
"full on middle, driven to mid-on off the front foot"
"nice and full outside off, defended to cover"
"full on off, chipped in the air, past the bowler to mid-on"
"flat skidder outside off, chopped to cover"
"flat and holds its line outside off, no shot"
short and wide outside off - hint of extra bounce - the batsman flaps a cut in the air but wide of short cover
"skids on outside off, left alone"
"fired outside off, left alone"
""
"very full on off, crisply flicked in the gap between the two short midwickets"
"full on off, stoutly defended"
"full and wide outside off, flashes a drive to cover"
"on a length and outside off, punched on the up to mid-off"
""
"pitched up and holds its line in the channel, ignored"
"looped up on middle, driven off the front foot to cover"
"dropped short and outside off, Hope skips back and lays into a pull. Smacked over midwicket"
"length-ball legbreak outside off, punched off the back foot through midwicket"
"really full on the stumps, squeezes a drive to the right of mid-on"
"short and turns away outside off, chopped hard to cover"
"slow, short, spins away outside off, solidly punched to cover off the back foot"
"full and angling into off, defended to mid-on off the front foot"
"on a length and outside off, presses forward and jabs the ball to cover"
chipped in the air to the right of square-ish short midwicket
"full and outside off, dabbed with soft hands to gully"
"floated full on a fifth-stump line outside off, ignored"
left alone outside off
"tossed up on middle, patted to the leg side"
"shortish legbreak outside off, punched to cover"
"full on the stumps, jabbed back to the bowler"
"faster and flatter outside off, turns away, no shot"
"tossed on middle, driven to short cover off the front foot"
turned to backward square leg
"tight line on off, blocked to cover"
"pitched up on off stump, driven past the right of mid-on"
"short and outside off, Hope latches onto the width, cracking a cut to the left of point"
"full and <strong>scoots low outside off</strong>, beats Hope"
"just short of a good length and outside off, punched in the gap at cover"
"slower offcutter, defended to the leg side"
""
"flighted on middle, Hope stays leg side of the ball and drives to cover"
"flatter legbreak outside off, the batsman lets it pass"
"darted short and outside off, shovel-pulled away to mid-on"
"starts on middle and breaks away, lovely delivery, Hope reads the turn and dead-bats it"
"dangled up outside off, forward and driven through the line to mid-off"
"back of a length and slanted in at the top of off, stoutly defended"
"pitched up and outside off, driven straight to cover"
full and wide - possibly wider than a set of stumps outside off - no shot
Brathwaite gets on top of a short ball outside off and punches to cover
tucked around the corner to deep square leg
"leg-stump half-volley, whipped away through square leg again"
"<strong>Dropped by Hamilton Masakadza at slip</strong>. This is the perfectly-pitched legbreak from Cremer. Breaks away outside off, Brathwaite wafts and snicks it to the right of Masakaza. He dives to his right but the ball pops out of his right hand as his elbow hits the ground"
"full and outside off, pushed to mid-off"
""
"back of a length on off, jabbed back to the bowler"
"floated up on off, defended back"
"full and outside off, driven through the line to long-off"
"full and outside off, driven to short cover diving to his right"
"full and outside off, squeezed back down the pitch to mid-on"
"shortish and angling into off, worked away through backward square leg"
"good length and holds its line outside off, no shot"
"hip-high short ball on off, camps back and swats it away behind square"
"full and nibbles in from outside off but does not threaten off, left alone"
"dangled up on middle, backs away and drives to mid-off"
"skiddy legbreak outside off, punched to midwicket"
"full on the stumps, drilled away straight of mid-on. The ball rolls away to the boundary"
""
"<strong>Chakabva drops it</strong>. Second drop in three overs. Pitches on middle and leg, breaks away, takes the edge, but the keeper spills it"
""
"back of a length on middle from around the wicket, pulled to deep midwicket"
"short on middle and leg, forced to midwicket off the back foot"
"fired on leg stump, defended to short leg off the back foot"
"fired on middle and leg, defended"
"skids on off, blocked"
"half-tracker on leg stump, Hope goes deep in the crease and pulls it away to the right of deep midwicket. Pings the square-leg boundary"
punched with the break to cover
"tossed on off, defended off the front foot"
"full on the stumps, driven to mid-on"
poked to short leg
"nice dip on off, smothered off the front foot"
"slower legbreak, grips and spins away outside off, wafted to backward point"
"skids into leg stump, defended watchfully to leg slip"
"full on middle, laces a drive to mid-on"
""
""
""
"flat and straight on middle, swatted away to deep midwicket"
"tossed up just outside off, he lunges forward and defends"
"sharp turn and bounce from the rough outside off, Brathwaite leaves. Chakabwa collects it at shoulder height. Rode the bounce well"
clears his front leg and eases this with the spin to short cover. Nice flight again
"too full and drifting into the pads, worked with the angle to deep midwicket"
"slow turn but sharp turn, this keeps a touch low as well, solidly defended"
"nicely tossed up on middle, Hope stretches forward a long way and smothers the spin"
"length ball that reverses back in from outside off, carefully defended to the leg side"
"touch fuller and just around off again, this one deviates in a wee bit. Brathwaite defends solidly"
squeezes this full-length delivery around off to short cover. Bat face turns in his hand as he jabs at the delivery
"slower and fuller outside off, he stretches forward and defends this gently back down the pitch"
"looks to play a full-blooded flick but ends up checking his shot at the last moment, down to wide mid-on as he scampers a quick single"
"floats this full and just outside off, defended from the crease to the off side"
"drifting into middle and leg, enough time for him to use the depth of the crease and turns this to short midwicket"
"slow turn, this keeps a touch low. Defended from the crease"
gets a good stride forward and smothers the spin nicely
shuffles across and bunts this sharp-spinning delivery to the off side
"drifts in a quicker delivery on middle, gets across just a wee bit and blocks"
"slow turn from middle, defended off the back foot without a trace of worry"
"back of length delivery outside off, defended with soft hands"
"leans forward, nearly smells the leather, as he defends this full delivery back to the bowler"
"slower and fuller outside off, this one cuts back in but not enough to get him playing. Left alone"
"short and sliding into his rib cage, he shuffles across, uses the pace of the bowler and deflects this to the fine leg boundary. <strong>A leg slip, if positioned there, would've been in business</strong>"
defended back down the pitch from the crease
defends this length ball from the crease
gets a good stride forward and blocks
"shapes to pull, mistimes it into the midwicket region as the ball skidded on to him faster than expected"
right back into the crease as he turns this shortish deliver to the leg side
eased with the spin to mid-off as they jog the single
lunges forward and eases this towards short cover
"too much flight again, Brathwaite steers this to short cover"
"shapes to sweep but the ball misses the bat and hits him on the pad. Since this was bowled from around the wicket and pitched on leg, would've missed the stumps as well as it spun back in"
turned with the spin to short midwicket
"bowled full on the stumps, he's well forward as he blocks"
"slides one across the right-hander, who stretches forward and blocks. Plays it with low hands, deadbats it"
once again nicely forward as he blocks one
"hint of spin in, he is on the back foot as he defends"
eased with the spin to the off side
"sharp turn from length on off stump, he's back and across in dabbing this back to the bowler"
sees the width and goes after that one but drives it straight to cover
misses out on a juicy short ball. Rocks back and slaps this straight to cover.
"eased with the spin to the bowler, who runs across to short mid-off to cut that"
"drifting into middle and leg, he leans forward and bunts this back"
gentle 'hit me wherever you please' delivery. He rocks back and pulls him into the acres of open space at deep square leg. A combination of heavy outfield and long boundary means they don't get four
goes back into the crease and defends a shortish delivery
"fired across the right-hander from around the stumps, defended back down the pitch"
"sharp turn back in from around the stumps, defended from the crease"
driven back to the bowler
back and across as he defends a shortish delivery back to the bowler
"beaten by the drift and turn, skews past slip as he pushes forward"
makes room and eases this flighted delivery back to the bowler
crunching drive but straight to the cover fielder
"whips this short ball straight to mid-on, sends his partner back. Hope was three steps down the pitch"
gets across the stumps and watches the ball slide on to the bat in defence
squeezes this full delivery back to the bowler. Made room to drive but didn't get underneath the flight
"slow turn from middle and leg, turned to short fine leg"
gets a good stride forward and defends this gently towards short leg
turns this wide of short leg. Plays it with soft hands and with the spin again
"fuller and straighter, dabbed back to the bowler"
"hint of bite back in from off stump, defended from the crease into the leg side"
"nice and full on off stump, defended with soft hands again"
"googly this time, bounces from the rough on middle, safely tucked to short fine leg"
"skiddy delivery on off stump, Hope gets on top of the bounce and turns this to the leg side"
"sharp turn from off stump, he whips this across the line towards short mid-on"
gets a good stride forward and smothers the spin of this tossed up delivery
driven with the spin to short cover
"short turn from off stump, he walks across the stumps and blocks it"
"this is another horrendous delivery. Tripe down leg, Brathwaite opens up the leg side and powers this pull to the deep backward square leg fence"
"slow turn from middle and leg, defended to short midwicket"
tickled with the spin to short fine leg for a quick single
gets across the stumps and shows the full face of the bat in defence
gets a good stride forward and blocks
"punched into the gap at extra cover, two easy runs"
draws him forward and then beats him in the air and off the pitch as he looks to defend. Got that to jump
"spins away from outside off, left alone"
rocks back and slaps this short deliver to cover
slaps this short ball wide of extra cover as they scamper a quick single
"drifts in a full delivery on the stumps, blocked back"
"quicker delivery outside off from around the stumps, left alone. Excellent judgment this time"
whips this short ball straight to square leg
"indecision in footwork has cost Brathwaite. This is excellent from Raza, who gets this ball to spin back in sharply from the rough outside off stump. Brathwaite looks to play back and across but this one came back in to hit him on the back leg. The ball didn't have much distance to travel from the point of impact. Would've been umpire's call even if he would've reviewed"
whips this short deliver on middle and leg to square leg
right to the pitch of the ball as he laces this into the gap at cover point
shapes to drive but gets it off the inner part of the bat to short midwicket
""
"squared up by sharp turn, he jabs at it and gets a thick outside edge to third man"
driven firmly with the spin but straight to extra cover
"in-drifter that straightens after pitching outside off, left alone"
"fires one in full from around the stumps, squeezed to cover"
eased with the spin to the man at extra cover again
lunges forward and lets it go. This one jumped off the surface but spun away
"too much flight, he gets to the pitch of the ball and drills this into the gap at extra cover. Back for the second quite comfortably"
whips this down to wide long-on
"nicely tossed up outside off, he eases forward and bunts this gently"
worked with the spin to short midwicket
right back into the crease as he works this to the leg side
right to the pitch of the ball as he defends this back to the bowler
"straightens after drifting into middle, he's squared up just a wee bit as it rolls to the off side"
picks the gap delightfully. There's backward point and cover point. He rocks back and then opens those wrists up nicely to pick the gap. Lovely timing
waits for the ball to spin away and then lends direction to steer this past short third man. Cleverly done
eased with the spin to mid-off
"squared up by the length of this indrifter, somehow manages to defend this"
"whips this from outside off, hits short leg as he looks to take evasive action"
