"Two slips. Loose ball, short onto his body on middle stump, tucks the ball towards short leg and takes off for the single"
"back of a length just outside off, lets the ball go through to the keeper. Good carry"
"pitched full outside off, firmly driven through cover for four. In the slot, and Powell was quick to get bat to ball. Minimal movement of the feet, but good contact"
"full just outside off, left alone"
"back of a length just outside off, straightens slightly. And while Powell shouldered his arms comfortably, the ball came in just a little. Goes just past his off stump"
"full outside off, tries to drive but the away swing takes the ball past his bat's outside edge. That's the first over"
"full on middle and leg, clipped off his hips towards mid wicket. Early call for the single. Late swing on offer, and the batsman did well to get behind the line of the ball"
"back of a length just outside off, goes through to the keeper. Brathwaite not interested to offer a shot"
"good length on that nagging fourth-stump line, left alone"
"very full on off stump, Powell comes forward to try and defend at it, but it's a really quick delivery. Zips past his outside edge, but before that it clips the outside of his front pad. Loud appeal! Turned down. <b>Zimbabwe are reviewing.</b> Pitched in line, impact in line, but the ball was missing the off stump oh-so-slightly. Comfirmation: Not out."
"full outside off, shoulders his arms"
"full on off stump, defended back past the bowler off the front foot"
"full on off stump, gets behind the line of the ball and defends with soft hands. Almost like pushing the ball into the ground, but while dropping his gloves at the same time"
"full on middle and leg, goes down the leg side. Brathwaite tried to whip that off his hips, but couldn't get bat to ball"
"back of a length outside off stump, goes straight through to Regis Chakabva, the keeper"
"full on middle stump, Brathwaite falls over the ball, but does enough to defend it off the front foot. Moved towards the off side early. Almost hurt him there"
"full just outside off, defended towards mid on off the front foot"
"full just outside off, defended off the front foot. The ball dribbles away towards the fielder at midwicket"
"pitched full just outside off, lets the ball go, late swing into the left hander, though"
"back of a length just outside off, shoulders his arms once again. Very good carry through to the keeper. It's a hard deck, this"
"full outside off, left alone"
"full on middle and off, crunching drive back to Mpofu, he dives to his left, and stops what may have been atleast two."
"full outside off, left alone"
"back of a length on middle, defended off the back foot"
"back of a length on off stump, gets inside the line of the ball and pushes it towards mid on"
"back of a length outside off stump, swings slightly away from the batsman's body. Shoulders his arms."
"good length just outside off, much closer to the outside of off stump. The batsman lets that go through to the keeper"
"pitched short outside off, the ball's angling away from the right hander, and he simply lets it go past him"
"pushed fuller just outside off, gets onto the front foot and punches the ball back to the bowler"
"back of a length just outside off, slower delivery to end the over. Tucked off his hips to midwicket. But there's a fielder positioned there"
"full ish just outside off, Powell decides to leave that"
"full just outside off, Powell sees it through. No shot offered, the keeper collects from chest high"
"good length but drifting to leg stump, tucked to fine leg for a single. <b>First run after 25 dot balls</b>"
"back of a length on middle, gets himself slightly into a tangle, but fends it off his chest. Went deep into the crease for that shot"
"back of a length outside off, lets it go"
"good length on middle, shuffles towards the off side and works the ball off his feet towards backward square"
"<b>Beautiful!</b> Back of a length on middle and off, and goes juuuust past the top of off stump. He shouldered his arms, but calculated the direction of the ball well. Well left"
"good length on off stump, prods forward thinking of playing a shot, but shoulders his arms eventually"
"full on leg stump, tries to flick that off his pads over midwicket, but misses the shot. It was a loose delivery, but couldn't make the necessary contact. Jarvis escapes with the bad ball"
"back of a length just outside off, left"
"full on off stump, a perfect straight drive. Gentle push through the line of the delivery and that races past the non-striker's right for a boundary"
"full outside off, lets that go through to the keeper"
"full on middle, tapped towards midwicket off the front foot"
"back of a length just outside off, bunted towards mid off"
"full on middle, played past midwicket's left and calls quickly for the single"
"full outside off, tries to play the straight drive once again, but the bat turns in his hand. Was through the shot too early."
"back of a length just outside off, shoulders his arms"
"bowls from a slightly wider angle, comes into the left hander after pitching back of a length. Lets the ball go through to Chakabva"
"full just outside off, pinged off the front foot straight to short cover"
"first real short ball of the day, pitched on middle and sends Brathwaite scampering. Got into a tangle once again, as he tries to play it down the leg side. No contact"
"full outside off, and this one straightens after pitching. <b>A peach!</b> Brathwaite prods at the shot, trying to defend the ball off the back foot, and it takes the outside edge. <b>Straight to Chakabva's gloves</b>, who makes no mistakes. Jarvis strikes"
<b>Starts off with the short ball.</b> pitched on middle stump and goes past the batsman's leg side. Didn't trouble anyone
"full just outside off, left alone. Straightens slightly after pitching."
"full on off stump, driven down the ground to get off the mark. Goes past the bowler and mid on puts in the dive to his left as well, but in vain. Four to end the over."
"short outside off, forces Powell to tiptoe. Defended off the back foot"
"short and wide outside off, enough width to cut or slash at it but Powell resists the temptation. Lets it go through"
"full just outside off, defended with soft hands. No real foot movement though"
"full and wide outside off, very wide in fact. Just inside the rail-tracks. Left alone"
"delivered from wide around the wicket, good length just outside off, gets onto the back foot and defends it firmly with soft hands"
"full and wide outside off, Powell is disinterested"
"good length just outside off, gets inside the ball's line and defends. Quick shuffle of the feet from Hope to negate that delivery"
"back of a length outside off, the ball swings into his body, and despite him shouldering his arms, the ball doesn't take the top of off stump. Goes just over the stumps, and through to Chakabva."
"back of a length just outside off, worked off his hips from the depth of the crease towards the short mid-wicket region"
"back of a length on middle and off, worked towards the leg side with ease but straight to the fielder positioned at midwicket"
"full on middle and leg, allows the batsman to tap that towards the leg side. Goes past midwicket, who gives it a chase. Square leg cleans that up. Got into position early for that shot"
"back of a length on middle stump, the batsman walks to the off side and turns the ball off his hips to fine leg for a single"
"back of a length just outside off, the batsman sees the first ball through as he defends it towards mid on. The bat turned slightly while playing the shot, went squarer than he wanted to"
"short just outside off, worked off his hips towards backward square. Wanted the single, but the non-striker was not interested"
"full on off stump, spongy bounce and the batsman was through with his on-drive too early. It was in the air, and mid on almost did enough to take the catch, but falls just short of him. Meanwhile, there was a confusion between the two batsmen as well. Powell was late to hear the call for the single"
"short on leg stump, swivels and pulls along the ground, but straight to fine leg"
"back of a length just outside off, worked towards midwicket off the front foot"
"slower ball on middle stump, Hope pounces onto that in a flash. Raises his front foot to make room for the bat's full swing, and pulled over the square-leg umpire's head for four. Fine leg, who was pretty square in the first place, had no chance"
"back of a length on off stump, defended off the front foot. Firm shot"
"full and wide outside off, shoulders his arms. Not much happening for Mpofu from around the wicket"
"back of a length just outside off, left alone"
"back of a length once again outside the off stump, Powell pokes at that off the front foot, takes the outside edge and goes towards point"
"good length outside off stump, Powell lets that go once again."
"full and wide once again, Powell is not chasing anything that is that wide. Lets it go. <b>Time for drinks.</b>"
"oh no. Fine start after the break. A full delivery outside off, on a fourth-stump channel. Kyle Hope plays the line, but the ball holds its line, <b>takes the outside edge</b> and goes through the keeper and a wide slip. Quite straight to a regulation slip."
"fullish delivery around off, defended back"
"nice lines. Outside off, the ball seaming back in, worked away into the midwicket region"
"shortish delivery outside off, the ball comes back in, Hope stands tall and defends into the off side"
"130 kph, overpitched on middle and leg, driven to mid-on"
"full delivery outside off, Hope gets forward and defends into the off side, towards short cover"
"the lines have been very good this morning. 132 kph, full on a fourth-stump line, defended to mid-on."
"130 kph, full delivery outside off, driven towards short cover"
good length on a fourth-stump line. Not much Powell can do but defend
"slight width, and Powell has had enough of plodding about. He gets underneath the length and lofts the ball over extra cover for four. No one there, very safe shot"
"fullish around off, defended back, 122 kph, may have been the offcutter, pace off the ball"
"full and very wide outside off, left alone nicely enough"
"132 kph, a yorker outside off, jammed out towards gully"
"short and wide, too much width, slashed to backward point"
"drags that length back just enough to allow the ball to hold its line enough. Hope plays the line, and misses the ball. But Cremer is coaxed into reviewing. <strong>Was there a nick?</strong> Mighty close to the bat. There is a spike as the ball passes the bat on UltraEdge, and that should be plenty evidence to overturn this decision. Mire's maiden Test wicket. And what a ball to do so, pulled that length back, and what it did was leave Hope tentative - whether to come forward or go back. Eventually, he poked at the ball from the crease, which has trouble all over it. Well bowled."
"a nervy start. Overpitched outside off, the ball moving back in, skewed off the inside half towards midwicket"
"good length around off, Hope stands back and defends back"
"126 kph, that's too full. Overpitched outside off, driven away towards short cover, where Ervine dives to his left"
"full delivery outside off, 128 kph, defended to mid-off"
"good length on middle and leg, pushed away towards mid-on. Solid is Powell"
"on a length around off, 131 kph, pushed back to the bowler"
"nice and full around off, defended back. Very disciplined from Zimbabwe, very impressive"
"good length around off, defended into the mid-off region"
"short and wide outside off, Powell stays back and carves a cut to point"
"full delivery outside off, 130 kph, defended into the off side"
full and far too wide outside off to draw a stroke. Hope happy to let it go
"fine shot. Slightly short outside off from Mire, and Hope reads the length early, goes back and punches the ball through cover for a couple. Slow outfield, the rain has something to do with it"
"full around off, defended into the off side"
"full and wide outside off, another leave, bounces in front of the keeper, 129 kph"
"full on a fourth-stump channel, 129 kph, defended back. Terrific bowling"
"good length outside off, 129 kph, Powell stands tall and pushes the ball to mid-off"
"good length down leg, worked down to fine leg for one. Strays in line, a terrific ball to a right-hander though"
"well-adjusted. On a length, fourth-stump line, guided towards point"
"126 kph, full and straight, Hope brings his bat down at an awkward angle, and the ball skews to cover"
"short, Hope picks the length early, goes back and pulls through square leg for four. Well played, it's a loose delivery considering the pace of the surface and the line, and he didn't let it go"
"127 kph, full outside off, driven nicely to mid-off"
"129 kph, overpitched outside off, driven to cover"
"132 kph, fullish around off, driven to mid-on. Slightly too full"
nice and full again. Pitches in line but Powell's bat comes down straight and sends the ball to mid-on
"fuller than a good length - quite the ideal length on this pitch, outside off, left alone"
"full outside off, driven to mid-off"
"full and straight, 130 kph, Powell gets a thick inside edge down to fine leg. That one almost sneaked through"
"126 kph, slightly leg side-ish, worked away into the leg side, in front of mid-on for a quick single"
"quick around off, great length, defended back ably enough"
"full and wide outside off, swings away, left alone"
"full delivery outside off, 128 kph, left alone from Hope"
"good length delivery around off, defended nicely. Head over the ball, eyes on it"
"on a length on off, defended back."
"generous turn to begin. Pitches on leg, spins prodigiously down leg. Good take from the keeper"
"full outside off, very loopy. Powell badly misread the length of that, full outside off, worked to mid-on for one from the back foot. Should have been forward to that"
"overpitched on middle, Hope gets forward, opens the face of the bat and guides the ball to extra cover"
"too full outside off again, driven to mid-off"
"quick down leg, spinning down, nudged down to fine leg for one"
"a thick outside edge down to third man for one. Flight outside off, Hope gets forward, a thick outside edge trickles down to the fielder."
"quick outside off, too wide. That's a freebie, one of very few this morning. Hope eases forward and gently drills his drive through cover"
"short down leg, should have been put away, but Raza misses a flick"
"nice and full around off and middle, defended into the leg side"
"short on leg, an easy flick earns Hope one. Not much spin for Raza, maybe because there are not many revs on the ball"
"quick outside off, Powell goes back and drives towards cover"
"short and wide, should have been put away but Powell's cut finds point. Another poor ball"
"80 kph, tossed up on off, Hope opens up his stance and bat face but finds cover with his drive"
"lots of flight on middle, driven to a deep mid-off for an easy run. Don't like that position, he should not be giving one without Hope going over him"
"the googly on middle and leg, Powell reads it and defends"
"82 kph, <strong>big appeal, no says the umpire</strong>. Looked like it struck him well outside the line. Flat and wide outside off, Powell missed a sweep. Umpire's call on impact"
pushed into the off side region for a run towards point
"lots of flight outside off, inviting the drive, Hope does but finds cover. That's well bowled."
"shortish outside off, Powell goes back and drives to the sweeper cover from the back foot"
"too many easy singles. Quick on leg, punched to long-on"
"84 kph, tossed up outside off, driven crisply to cover"
"gets past slip for a run. Quick outside off, Powell goes back, gets a thick outside edge which dies in front of slip, the ball goes through, third man has to clean up"
"<strong>spin! Lots of it.</strong> Quick down leg, the ball misses the flick and the keeper's gloves down leg, and goes down for a couple of byes"
"good technique from Hope. Down leg, nudged down to deep square leg, kept his hands soft on the handle and played the ball down"
"80 kph, quick outside off, may have been the googly, defended back"
"oh nicely bowled. Pitched on leg or outside, Hope goes back and plays into the leg side"
opens the bat face and drives towards sweeper cover
"short on middle and leg, Powell hurries back and works the ball into short leg's body"
"flight outside off, 80 kph, smothered back"
"overpitched, lots of flight, driven away to long-on for one to end the session"
"Back of a length on middle stump, plays down the wrong line trying to play straight, and raps him on the pad. <b>Loud appeal from Jarvis.</b> Turned down by the umpire. There was an inside edge"
"good length on middle stump, defended back to Jarvis off the back foot"
"full on off stump, driven square but not timed well. Straight to cover"
"good length on leg stump, tries to clip it off his hips, but misses the shot. Hits him on the pad, and another loud appeal but not out. Pitched a couple of inches outside leg stump."
"full on middle, angling away from the left-hander, and driven on the up. Craig Ervine, at cover, dives to his left to stop what would've been a certain boundary. Mid on intercepts the block, and throws back in. Quick single"
"back of a length just outside off, tiptoes on the back foot and defends with soft hands"
"full outside off, looks to drive it, but the bat turns, goes to mid on instead. Early call for the single."
"back of a length on leg stump, sharp legspin, defended off the back foot from front of middle stump."
"full on middle, defended"
"overpitched on off stump, sharp legspin and hurries Shai Hope into defending that off the back foot. He had gone deep into the crease to play the shot, but the ball hurried after pitching"
"full on off stump, defended off the back foot"
"tossed up full on middle and off, keeps the infielders interested as Shai Hope steps back and defends, ensuring his hands stay soft"
"full on middle, prods forward and defends"
"back of a length outside off, Powell plays an uncharacteristic slog-pull. <b>Takes the top edge</b>, and flies over second slip's head for a boundary. Jarvis won't mind that"
"full on middle stump, goes deep and defends off the back foot"
"back of a length on off stump, steps forward and defends it firmly. Straight to mid off"
"back of a length on middle, worked behind square for a single"
"back of a length on middle and off, brings out the back-foot defense"
"full outside off, pushes it towards the off side but goes straight than he would've wanted to play that. Goes to cover in front of square"
"back of a length on middle, turn takes the ball down the leg side, and Powell just about gets out of the way. Takes the keeper's glove and goes to leg slip's hand"
"full on middle, keeps Powell guessing, defended somehow"
"full on off stump, worked towards the leg side for a single. Played with the turn"
"tossed up full outside off, goes straight through and Shai Hope shuffles to his right to get behind the ball's line"
"full on off stump, plays the square drive. Cremer is giving the ball a real rip"
"good length on off stump, nagging line, forcing Powell to play at it. Defended to short cover"
"not fast enough, but short on middle, Powell quickly gets into position to pull and it goes one bounce to the deep-square boundary. Almost a four, if it wasn't for Waller, who dived acrobatically to his right to stop the ball from going past him. Saves three runs"
"back of a length on middle stump, defended back to the bowler"
"good length just outside off, defends it with ease. The ball dribbles away to mid on"
"short outside off, gets up onto his toes and pushes the ball square off the back foot. Dissects cover and point, and allows for more runs"
"full on off stump, punched back to Jarvis"
"good length just outside off, turns into the left-hander, whipped from top of off stump to square leg. There's a fielder placed there"
"back of a length on middle stump this time, Powell goes very deep into his crease, and turns the ball square - past the square leg fielder - for two"
"good length on middle and off, moderate spin into the left hander's body, defended with soft hands"
"tossed up, full on middle and leg, played with the turn down the ground, Cremer tries to stop it but fails. But mid off does well to intercept"
"full on middle and leg, almost a yorker, dug out well"
"full on middle, gets his front foot in front and taps the ball back to the bowler. Safe cricket"
"short and slow on middle stump, that spongy bounce once again, defended off the top of his toes"
"full toss outside off, driven with ease past cover for four more. Powell goes into his forties. The batsman was quick to pounce onto a rare bad delivery"
"pitched full on middle stump, turns the ball towards the deep midwicket fielder for a single"
"full on middle and leg, clipped off his legs to mid on. It goes straight to the fielder, but the call for the single was early. They scamper through"
"full on off stump, driven straight to the fielder positioned at cover"
"full on off stump, clipped off his toes to mid on."
"back of a length on middle stump, tapped back to the bowler"
"full outside off, entices Powell to drive and he obliges. It's slightly in the air, as the ball goes past the bowler and Shai Hope, for a single. Played it too straight than what he intended"
"back of a length on middle, turn and bounce on offer, rocks back and tries to pull the ball square but too close to Hope's body for any power to be generated. Goes to mid on's right"
"full on middle and off, played square to the fielder at cover. Uses the bat's open face"
"back of a length on middle stump, turns away from the right hander, but this time Hope is ready for that shot. Pulled square, past midwicket, allowing for the double"
"full on middle and off, driven firmly down the ground to the fielder at mid off"
"back of a length outside off stump, the around-the-wicket angle brings the ball into the left hander, defended"
"short and wide outside off, punched off the back foot to the diving point fielder. Sikandar Raza had to dive to his right to stop the single"
"good length on middle and off, tapped back to the bowler off the back foot"
"short on middle, rocks back and pushes in front of square on the leg side. Calls early for the single"
"yorker on middle and leg, squeezed out by Shai Hope"
"full on middle and leg, worked in front of square on the leg side, but straight to short midwicket"
"clipped off his legs, uppish, to the deep square leg fielder"
"full on off, legbreak, left alone"
""
""
"lots of flight outside off, drilled to extra cover"
"drops short does Cremer on middle and leg, Hope rocks back, picks the length early and swats a pull over midwicket"
"short on the hips, Powell helps himself to a run through square leg. Can't bowl there"
"goes full, around off, went slightly wide of the creases did Mpofu. Defended watchfully"
"too full, gentle pace, 126 kph, defended towards cover. Lovely languid drive"
"an offcutter outside off, Hope shoves his bat behind the front pad to avoid playing. Let himself get beaten"
"135 kph, a change-up in pace, full around off, jammed away towards mid-on"
"full and wide outside off, left alone, too wide to draw a stroke"
"tossed up full on middle, clipped off his toes to the sweeper-fielder on the leg side"
"driven on the up, goes to cover, who misfields"
"full on off stump, brings his front foot forward and defends, but it's a bat-pad. Falls just in front of short leg"
"full on middle and off, defended once again"
"full on middle, goes back and defends off the back foot. Sharp turn"
"<b>ooh, what turn for a second-session pitch.</b> Full-ish on middle and leg, turns further down the left hander's leg side. Powell tries to get out of the ball's way"
"back of a length on middle stump, gets his front foot in the air and pulls behind square. Greenidgesque."
"good length just outside off, comes forward and defends"
"short and wide outside off, Powell pokes at it, <b>and takes the top edge of his bat once again!</b> Goes just past the diving wicketkeeper, and through for four. <b>That's fifty for Powell.</b> He almost thought of letting that ball go, eventually deciding to play the upper cut. Wasn't connected well, and perhaps, it's Mpofu's pace that even foxed the keeper"
"good length on middle, goes down the leg side"
"back of a length on middle and off, goes back and taps the ball to midwicket. Calls early for one"
"back of a length just outside off stump, punched off the back foot to cover"
"back of a length on off stump, goes the other way this time, gets onto his back foot and punches the ball towards cover-region. The first wrong'un employed by Cremer"
"back of a length just outside off, tapped to point and says 'no!' to the call for one"
"flighted outside off stump, it's full, and driven to the sweeper-fielder on the off side."
"full on middle, Powell dances down the wicket and tries to slog it over midwicket. Takes the inside of the blade, and flies fine to the fielder at fine leg"
"full on middle and off, driven down the ground"
"back of a length on off stump, turns away from the right-hander, who plays it off the back foot towards point. Opened the face of the bat"
"full just outside off, tapped along the ground off the front foot. Straight to short cover"
"full on middle stump, spins into the left-hander's body, keeps his eyes on the ball and defends firmly"
"full on middle and leg, dances down the ground and drives furiously, but straight back to Williams, who does well not to lose a finger or two"
"full on middle, turn takes the ball down the leg side"
"back of a length on middle and off, punched to short midwicket"
"back of a length just outside off, tries to work the rising delivery towards the leg side, but goes one-bounce straight to the fielder at short leg"
