"length ball, left alone outside off"
"length ball on off, blocked"
"short of a length outside off, gets on top and blocks to point"
"short of good length around off, jumps and keeps it out to cover"
"length ball angled in at leg stump, straightening around middle, flicked through midwicket"
"back of a length, keeps a little low, flicked to square leg"
"gets on top of a shortish delivery and tries to forcefully play across the line into the leg side but gets no room. Had he missed, the ball would have hit the stumps"
jumps and flicks a short one to square leg
"shortish, zero room as he looks to pull, misses as the ball gets over off stump"
"short outside off, jumps and blocks"
"short, angling into him, swivels and keeps it down as he pulls through midwicket"
"short of a length, straightens around the fifth-stump channel, left alone"
"short of good length outside off, jumps and punches to cover"
"good length, angling in towards off, defended down the pitch"
misses a flick and gets hit on the high part of the pad as he jumps
full and clipped to square leg
"what sort of a follow-through is that! Flicks a length ball over midwicket and then kicks the backfoot up sideways to his right and holds pose. Like it's some sort of a circus stunt. Boy, this guy never ceases to entertain!"
"and when you offer up deliveries such as those, it's double the fun. Short, wide, and he slaps it over point"
short of a length down the leg side
"back of a length, keeps low, jumps and flicks to midwicket"
"fullish on leg, flicked to midwicket"
gets on top of a shortish one and scythes it to point
tucked off the pads to fine leg
"short, wide, reaches out and slashes and gets a bottom edge that lands just to the right of Gayle at first slip"
"back of a length a set of stumps wide, blocked from the crease"
"<b>huge shout for lbw</b>, not given. Naib walked across and tried to flick but missed and got hit on the pad. May have missed leg stump with that angle"
"short of a length, shuffles across and blocks"
"full and wide, too much room, and a big swing of the arms from Shahzad as he thumps it over long-on"
"full on middle and leg, too easy again as he clips away to deep midwicket. Resounding start for Afghanistan"
"short and wide, doesn't bounce as much as he swings and misses"
"length on middle, defended to point with an open face"
"short, well-directed bouncer as he ducks away"
"there's the opening they were looking for. He's paid the price for sticking his bat out well away from his body. Shortish, feels for it loosely without getting behind the line and some late away movement results in an outside edge to third man"
"back of a length, flicked to midwicket"
"short ball that rushes into him and gets too big on him, pulls hurriedly and luckily for him lands past square leg running back"
"short, wide, left alone"
""
pushed into the off side off the front foot
"length on off, pushed between cover and extra cover"
"beautifully done. Arches back to evade a short delivery, in fact so far back, that when he ramps it over the keeper, it's closer to the fine leg region. #Flexiblespine"
blocked from the crease
"short of a length, flicked with the angle to square leg"
shuffles across and blocks a length ball
"back of a length, flicked from front of middle to deep backward square leg"
jumps back and nudges into on side
"sticks his bat out at one that gets too big on him outside off, rips past the edge"
"yorker on off, dug out"
"back of a length outside off, blocked"
backs away to a back of a length delivery and blocks
"back of a length on the stumps, jumps and defends"
"short, wide, slashed to point who gets down to his right and fields"
nudged to midwicket
"short, rolls his wrists over a pull to deep midwicket"
"length on middle, blocked"
"short of a length, defended in front of off"
"short of a length, backs away and swings and misses"
"short, wide, again he backs away a long way and ends up skewing off the toe-end to third man"
solidly blocked off the backfoot towards extra cover
"short, jumps and punches to mid-on"
"fullish, wide, slashes through extra cover. Wants a second but is sent back"
"short of a length, flicked to the on side"
"back of a length, blocked to mid-off"
"short, not much pace at 128ks, and that allows him to get on top of the bounce and pull it over midwicket"
"banged in short and angled in, pulled to deep fine leg"
"another ramp from Shahzad. Short, wide, and he reaches out with an arched back. Third man cuts it off this time though"
flicked off the pads to deep fine leg. <b>Fifty for Shahzad</b>. Does the <i>Champion</i> dance to celebrate the milestone
jags away and left alone outside off
"back of a length on middle, blocked to midwicket"
drills a fuller one to cover
full and turned away to midwicket
angles in a length ball that's flicked through square leg
"good length and in at middle stump, defended off the back foot"
"short of a length outside off, chopped through the open cover region. Evin Lewis gives chase from point and pulls it back in"
no stopping this. A full ball wide outside off to Shahzad and he plonks half a stride before crashing this through extra cover
"full on middle stump, pushed to long-on off the front foot"
"short ball climbs up slowly, he swivels to hook along the floor to deep square"
"full on leg stump, flicked to deep square"
"short of a length at off stump, punched to mid-on off the back foot"
"short ball outside off, sliced to point with an open face"
"length outside off, blocked on the front foot"
"good length outside off, looks to flick through midwicket and can't connect"
"full and wide outside off, shuffles and sweeps. Beaten on the under-edge"
"full outside off, defended on the front foot"
"yorker outside off, jammed back down the pitch"
"shot. Full ball outside off, driven past Samuels at cover who looks to be in discomfort - doesn't give chase. Lewis has to do it from point. Nice balance from Rahmat on this"
"short ball down leg side, can't get bat on the flick"
short of a length and in at off stump. Drops it in front of point with soft hands but he can't steal the single
"full on the toes, deflected to fine leg with a closed face"
"good length outside off, defended on the front foot"
"short ball on middle stump, comfortably steered to fine leg with a hook"
"short and wide outside off, looks to cut and under-edges into the off side"
"good length at off, steps out and gets an inside edge onto pad"
"short of a length on leg stump, whipped to deep square off the back foot"
"full ball at off stump, shuffles a long way and goes for the reverse sweep from behind him. Gets a glove on it and onto pad"
"length on leg stump, nudged through square leg from the crease"
"full at off stump, steps out and flicks to long-on"
"length outside off, reaches out off the front foot and steers it to third man's left"
<b>chips it over mid-off</b> but he has miscued that. Looks to cream this full ball inside-out over extra but he's through the shot early
"short ball at off stump, ducks, looks to evade, then changes his mind and swats it away one-handed, with his left hand"
"slower ball, back of a length at off stump. Defended down the pitch"
"short and just outside off, chopped to sweeper's left"
"short ball on off, waits for it to arrive and pulls in front of deep square"
"short of a length outside off, tapped to extra cover off the back foot"
"back of a length at middle, pushed to silly mid-on off the back foot"
"short of a length at leg stump, nudged through square leg off the back foot"
"full at leg stump, flicked through square leg"
"short ball down leg side, can't connect with the pull"
length ball spins into the pads and hits him as he looks to glance
another short ball down leg and he goes deep in the crease before tickling this fine
"low full toss on middle stump, punched to long-on off the front foot"
"good length at off stump, defended on the front foot"
"low full toss outside off, driven straight to extra cover"
"short of a length at leg stump, tapped into the leg side off the back foot"
"good bouncer, but Rahmat just manages enough bat on it to get it over the keeper. Climbs at him at an off stump line and he's caught rooted to the crease as he takes this on"
"short of a length at middle stump, defended off the back foot"
"full outside off, driven straight to extra cover"
"tossed up at middle stump, steps out and pokes to short mid-on"
"back of a length at middle stump, flicked to deep square"
"back of a length at off stump, punched to extra cover off the back foot"
"good length outside off, skids onto the pad as he pushes onto the front foot. He's outside the line"
"short of a length outside off, backs away and cuts towards extra cover"
"short of a length at off stump, defended off the back foot"
<b>edge and over the keeper.</b> Backs away to try and make room against this bouncer. Woeful position as he looks to cut. But it looks like it's his day. This comfortably evades the keeper
"yorker at middle stump, jammed into the covers"
"backs away and this time he manages to get the middle of the bat. Once again, he's not in great position. The short one lifts into him as he moves into the leg side, but he manages to waft and get this over point"
"short of a length and in at leg stump, pushed to midwicket's right off the back foot"
"bouncer slants down leg side, he lets it go"
"full at leg stump, clipped through midwicket"
"full on off stump, defended on the front foot"
"full at middle stump, skips down and pushes to long-on"
"full on middle stump, flicked to deep square"
"full outside off, expansive drive to sweeper off the front foot"
"good length outside off, plants the front foot forward and clips to deep square"
"<b>oh this looks close.</b> Not out says umpire on the lbw appeal. Tossed up wide outside off, looks to sweep and he's yorked. Nurse unhappy but it looks the correct decision"
"back of a length outside off, tapped to sweeper cover on the up"
"legcutter, floated full outside off. Looks to lift it over extra cover and is beaten"
"slower ball, short and wide outside off. Mistimed cut straight to point"
"short ball outside off, pulled to long-on"
"short ball outside off, nudged to midwicket off the back foot"
"short of a length at off stump, punched to mid-on off the back foot"
"full at off stump, gets behind the line and hoicks it to the midwicket boundary. Ugly heave to full effect. There's no one deep"
"good length outside off, defended on the front foot"
"length on leg stump, steps out and flicks to deep square"
"good length outside off, defended on the front foot"
"back of a length on middle stump, tapped to short mid-on"
"length on middle, steps out and flicks to short midwicket"
bouncer too steep for him. Can't get away from it this time and is beaten on the periscope ramp
"slower ball outside off at a length, defended into the off side"
"slower ball, short of a length outside off. Opens the face and runs it to third man"
"good length on off stump, blocked on the front foot"
"nicely placed. Short ball at the chest, swivels and nails the hook. Full balance, full control. Gets it wide of fine leg"
another bouncer. This one's dug in too short and climbs well above the batsman
"back of a length on leg stump, taps it on the up towards mid-on"
"good length on middle stump, defended on the front foot"
"length on off stump, defended on the front foot"
"length on off, blocked down the pitch"
"good length on leg stump, pushed to short midwicket off the front foot"
"length on off, nudged back to the bowler off the front foot"
"length on middle, steps out and flicks to short midwicket"
"short of a length outside off, punched to sweeper cover off the back foot"
tossed up. Right up. That could possibly be in the 50s. And it's short and on the pads. He taps it to short fine
another loopy length ball. Shahzad has time to change his expression from shock to disgust before pushing into the leg side
"<b>and he's got him!</b> Oh this is...comical, really. Shahzad is sulking like he's been mankaded after facing bodyline bowling for four hours. But the truth is, it's just extremely slow bowling that has completely suckered him. Another loopy length ball from Gayle. Shahzad lines up, then decides to step out. Yorks himself and chips it straight to mid-off. Gayle is bemused. Shahzad shrugs...then pulls out a big celebration just outside the dressing room that hasn't caught Phil Simmons' imagination...absolute Under-14s stuff this!"
"length on middle stump, flicked to midwicket"
"tossed up on middle stump, driven down to long-on"
"back of a length on middle stump, punched through mid-on off the back foot"
"good length at middle stump, flicked to deep midwicket"
"tossed up at off stump, driven to long-off"
"short of a length on leg stump, dabbed through square leg off the back foot"
"short of a length at middle stump, whipped to deep square off the back foot"
"length on middle stump, can't get the paddle sweep past short fine"
"tossed up at off stump, steps out and drives to mid-off"
"back of a length just outside off, defended off the back foot"
"tossed up on middle stump, driven to long-on"
well played. Gayle's keeping it slow so Samiullah has no choice but to completely swing from under this with a sweep. He does it well and lifts it over short fine
"length on leg stump, nudged to short fine"
full and fast down leg side. Can't get bat on the sweep and keeper can't gather it either
"tossed up at off stump, skips down to drive to long-on"
"length, shifts back and flicks through midwicket"
"pitched up on off, driven back"
"short of a length, flat, tucked to fine leg"
"full outside off, blocked off the front foot"
"fuller, presses forward and eases it through the cover"
"length, shuffles and flicks with the turn to backward square leg"
"flighted on middle and leg, clipped through square leg"
"length, not much turn, tucked to the on side"
gets down and across to sweep but it's not full enough and he mistimes it to short fine leg
leg-side lines again and he flicks to square leg
"full outside off, driven down to long-on. <b>Fifty for Rahmat</b>"
"tossed up outside off, flicked to midwicket"
stands tall and punches to long-on
"flighted outside off, driven into cover"
"appeal for lbw, not given. Looped up outside off and beating the flick to spin in, nit the pad and lob towards first slip. Must have spun too much"
""
gets down to sweep from outside off and gets hit on the pad. Impact outside off
shuffles across and blocks a length ball
"pitched up on middle and off, clipped to wide long-on"
"throws it away by needlessly stepping down for a glorious shot. Good innings, nonetheless, but he'd be kicking himself for not finishing it off. Blindly skips down to a flat length ball and doesn't get anywhere close to the pitch. Swings and makes no room, leaving the keeper to complete a straightforward stumping"
"lots of flight, driven wide of long-on"
stays back and flicks this length ball to square leg
"pitched up outside off, driven to long-on"
"floated up outside off, clipped to deep midwicket"
jumps up to a short one and blocks to cover
"tries to flick a short of a length delivery that drifts down the leg side. No wide signal, so that must have brushed the pad"
"short, gets too big on him outside off, forcing him to scamper out of the way"
"full toss, flicked through square leg"
"short of a length, angles in, jumps and tucks through square leg for a quick second"
"short, gets on top of the bounce and pats it towards third man with an open face"
shifts back and flicks between long-on and deep midwicket. Picked the gap well and equally well-done on coming back for the second
"flat length ball, turned away to midwicket"
"pitched up around leg, driven down to long-on"
"looped up on middle, dabbed towards midwicket"
now he gets down for a big sweep and gets an inside edge onto the pad
"lots of flight and dipping late, clipped away"
"short of a length, attacking the stumps, jumps and blocks"
"length ball, whipped away to fine leg"
"length ball, tails in late, Shenwari is sure of his off-stump and leaves confidently"
"full on the fourth-stump channel, and that's a pristine drive, through the left of extra cover. Perfect placement and brilliantly-timed"
"length ball, left alone outside off"
"short, gets on top of the bounce and nudges through square leg"
"fullish length on leg stump, not quite enough room, and he gets down to sweep without much timing to backward square leg"
"that's outta here! Nabi hastening Afghanistan's pursuit of victory. Backed away early to xpose all three stumps. Gayle fired it in around leg stump and he stepped down, gave himself more room before whacking it over long-on"
"goes again, and goes bigger! This one's monstrous and goes, sits on the roof. A length ball that slides towards leg stump and he steps down, gets to the pitch and hammers it straight over"
and that's it! Back-to-back sixes to finish this off. Important moment in Afghanistan's history and progression as a top side. Comes down the track and goes big down the ground. Skews it off the outside of the bat but the power on that shot will do
