"loopy on the middle and leg, spins in, catches the pad and rolls away behind square on the leg side"
"quicker, faster, and sliding into the pads, Vohra drops down to one knee and smokes a slog-sweep over the square-leg boundary. Bam!"
"back of a length, Duminy finds turn again and catches the batsman on the crease. Hits the thigh and would have missed the leg stump"
"shorter and sliding away outside off, jabbed to the covers off the back foot"
"very full and darted onto the pads, picked off to short fine leg"
"79ks, tossed up and<strong> spins back in sharply with extra bounce</strong>. Cramps the batsman for room. Awkwardly fended off to the leg side"
"back of a length and angled in on middle, punched off the back foot to midwicket"
"back of a length and angling across off stump, Vohra has a mighty whoosh at it... and only collects fresh air. He attempts a leg-side slog and loses his shape"
"back of a length, slower offcutter, sticks in the pitch, bounces, Vohra closes the face early and pops a leading edge to cover"
"full and veering into the pads, picked up and lifted over midwicket"
"full nip-backer from McClenaghan, de Kock is late onto it as the ball skids off the pitch. He squirts an inside edge onto the pad and weathers an lbw appeal"
McClenaghan hits a hard length on off - neither driveable nor pullable - patted to the off side
"back of a length and outside off from wide of the crease, punched through the line to extra cover"
"back of a length on middle,<strong> nearly 145ks</strong>, Vohra dares to step down the track and only drags it off the inside half past the right of mid-on"
"back of a length and angling away just a shade outside off, possibly a slower ball, de Kock waits on it before dabbing it to the leg side with soft hands"
"keeps it on a back of a length, the line is outside off, Vohra rides it down to deep third man"
"De Kock clears his front leg, backs away outside leg, this is fuller and nipping away outside off. De Kock throws his bat at the ball but does not make contact"
"slower ball, back of a length, climbs over middle stump as De Kock swings early and misses again"
"tossed on off stump, Vohra ventures down the track, manufactures a half-volley and lofts it straight of mid-on. Lovely swing of the arms"
"fuller and just a shade outside off, Vohra aims for another loft again, this time he slices it over mid-off. This goes all the way"
"Vohra hits a hat-trick of boundaries. Duminy loses his line, length, and his head. Back of a length and sprayed wide outside off, swatted across the line to the midwicket boundary"
"<strong>Make that four boundaries in four balls</strong>. Tossed up wide outside off, this was pushed away from his swinging arc, but Vohra collapses his back leg and laces it inside-out over extra cover"
"shorter and spins back in on off, Vohra stands tall and punches it down the ground to long-on. <b>Vohra has hit 27 off 11 balls from Duminy</b>"
"back of a length and breaks away outside off, de Kock ventures deep in the crease and chops it away to sweeper cover"
"slower offcutter outside off, back of a length, steps away and flat-bats it down to long-off"
"De Kock makes room and steps out, McClenaghan chases him, cramps him for room, and hits the thigh pad"
"another slower offcutter outside off, 127ks, de Kock does not read it. He slogs waaaay too early and is beaten lavishly"
"De Kock manufactures swinging room by backing away outside leg again. Banged in short and outside off, he stretches out and carves it up and over backward point"
De Kock makes room again. McClenaghan hits the blockhole and keeps de Kock quiet
"slower cutter, 119.8ks, slides down leg. Re-set the radar, Mitch"
"back of a length and outside off, offcutter it is, swatted away away in the air, did that carry to short midwicket? <b>The soft signal is out</b>. TV umpire called in. Rohit bends low at short midwicket and wraps his fingers around the ball. Excellent low catch from the Mumbai captain. De Kock just could not time the ball tonight. He simply dragged it away"
"flighted on middle, full, backs away and drives it to sweeper cover, where Pollard puts in a sliding save to his left"
"full and drifts in on middle, nurdled to square leg"
"slower through the air and breaks away outside off, big swing and a miss"
"pushed through on off, presses forward and bunts to point"
"full and spins away outside off, dragged across the line and against the turn to wide long-on"
"back of a length and skidding into the pads, picked off through midwicket"
"back of a length and spins away outside off, skewed off to the leg side"
"fired on a back of a length and just a shade outside off, Baz brings out the reverse-swat right away and finds the gap between slip and short third man. What a way to get off the mark"
"back of a length on off, spins away, defended"
"looks like a googly, comes in to catch the pad and roll away fine on the leg side"
"good length outside off and breaks away, <strong>big-turning legbreak</strong>, beaten past the outside edge"
"googly? Good length, spins in, bounces, lobs it to the leg side"
"flighted on the leg stump, hint of extra bounce, beats the sweep and rolls away to short fine leg off the thigh pad"
"full and on off, played back to the bowler"
"dragged down outside off, goes on the back foot and chops to sweeper cover"
"very full on middle, rolls his wrists and sweeps to deep square leg"
"full, drifts in at off, then spins away sharply to leave Baz overbalanced. Kishan whips the bails off but Baz drags his back foot in time"
"good length and <strong>rips away outside off</strong>, beats the outside edge again"
"very full and outside off, shovelled with the bottom hand to long-on"
"pushed through on leg stump, Baz rolls his wrists and reverse-sweeps it away to the off-side sweeper"
"nice and full outside off, Vohra stretches out, uses his reach and nails a slog-sweep over the short leg-side boundary. Launches it over midwicket"
"a bit too full for the sweep, Vohra is beaten and has been given out lbw by umpire Erasmus. Did that pitch in line? Vohra chats with Baz and calls for a review. Think it pitched just outside leg and pinned the front pad. Ultra Edge does not detect an inside snick. The tracker suggests it pitched on leg stump and would have clipped the outside of the leg stump. Vohra has to go. Over to Kohli to rescue RCB again"
"full legbreak, spins away outside off, driven down to wide long-off"
"Markande tosses it up on middle, full, played back to the bowler"
"short and on off, Kohli drops the ball to backward point and sets off for a risky single. Baz jams his bat into the ground and loses his bat. <strong>A direct hit from Duminy could have had McCullum</strong>"
"Baz charges down the track, Hardik darts a chest-high full-toss, spliced up and over the keeper. Hits the ad boards on the flush. That's six. The crowd finds its voice again"
"full-toss on middle stump, Baz ventures across off stump, goes low, and <strong>scoops the free-hit ball over the keeper's head</strong> like a boss for six. <b>13 runs off one legal ball</b>"
"back of a length on middle, climbs over the stumps, as Baz swings hard, loses his shape, and misses"
"Mid-off had just dropped back to the boundary before this ball, and Baz swats this knuckle ball away to the left of Suryakumar. He waits for the slower ball and forces it away"
"slower one, again, short, wide, flat-batted to the off-side sweeper now"
"wide of the crease, chest-hunting ball, angling in, Kohli rides the bounce and works the ball away through square leg"
"full on off stump, this is a Kohli special. He backs away outside leg, collapses his back leg and drives it inside out over extra cover"
"low-arm slider, clipped away through backward square leg"
opens the face and dabs it straight to short third man
"skidding in on middle, inside-edged away behind square"
"tossed up and drifting down the leg side, Baz goes low and paddles it away, Bumrah at short fine leg bends to his right to stop the ball"
"good length, drifts in on middle, sticks in the pitch, Kohli spoons it in the air but to the right of short cover"
"floated up outside off, Kohli comes down the track, nay runs down the track and belts it straight past the bowler and the umpire"
"back of a length and skids back in, cramps the batsman for room, turned away to the leg side"
"too full on leg stump, Kohli stretches out but misses the sweep"
"half-tracker on off stump, keeps low, Kohli adjusts and swats it away to wide long-on"
"another half-tracker on middle, Baz sizes it up and thumps a pull to the left of the leg umpire"
"tossed up on the leg stump, full again, Baz stretches out, uses his reach to meet the pitch and sweep it flat and hard between deep backward square leg and deep midwicket"
"full and slides in on middle, Kohli pokes the ball to cover"
"tossed up on the leg stump, Kohli flies down the track and sends the white ball flying into the stands beyond midwicket. Muscled away"
"low-arm slider on the pads, 97ks, worked away through backward square leg"
"back of a length and breaks away outside off, Baz, having pressed forward, goes back and dabs to cover"
"back of a length on off, fizzes off the pitch, and beats Baz's pull"
"full on middle, spins away, dabbed into the covers"
"back of a length and angling in from wide of the crease, Baz rides the bounce and guides it to deep third man"
"chest-high short ball on off or just a shade outside, Kohli is rushed for pace. He splices a pull over midwicket. Pandya runs in from the deep but the ball drops in front of him"
"Baz backs away outside leg, Bumrah follows him, guided down to third man again"
"this a gem of a delivery from Bumrah! Back of a length, angling in from wide of the crease, sharp angle from Bumrah. Then straightens away outside off, past the outside edge. <b>Ultra Edge detects a nick. Mumbai, however, did not go for a review</b>. How costly will that turn out to be?"
"back of a length and outside off, Kohli shovels it away to wide long-on"
"Kohli steps out even before the bowler delivers, Bumrah drags his length back further, spliced over the bowler's head"
"short and angling across off from over the wicket, flayed away to deep third man"
"slower offcutter, bounces over middle, Baz does not read the change-up. He slogs early and misses"
"<strong>Hardik Pandya nails the stumps at the non-striker's end</strong> with an excellent direct hit. Back of a length and outside off, Baz jumps away outside leg and flat-bats to mid-off inside the circle. Baz and Kohli chance a single. Pandya gathers the ball quickly and hits the stumps to catch Baz short. He did not even ground his bat. Flat and accurate throw from Pandya"
"short and outside off, guided to backward point"
"slower cutter outside off, glided away to third man"
"back of a length, slower ball outside off, Kohli delays his punch and finds cover. McClenaghan's offcutters are sticking in the pitch"
"back of a length and just a shade outside off, helped off the face to third man"
"Kohli forays down the track, knuckle ball, bounces and beats Kohli outside off"
"slower one outside off, offcutter, bounces, spooned into the covers"
"back of a length and wide outside off, Mandeep slashes and misses"
"back of a length and angling in at off stump, Mandeep rolls his wrists, and pulls it away in the gap at square leg. <b>First boundary after 21 balls for RCB</b>"
"slower offcutter outside off, back of a length, kicks up, the batsman checks his punch and pushes to the covers. Only 25 runs off the last four overs"
"good length and holds its line outside off from wide of the crease, shovelled with the bottom hand to long-on"
Mandeep rides the bounce of this short ball outside off and glides it down to deep third man
"back of a length and outside off, muscled away to deep midwicket"
"slower ball outside off, Mandeep picks it up and smites it into the stands beyond midwicket. Nice, clean swing of the arms"
"really full and outside off, not quite a yorker, jammed back to Bumrah"
"off-stump yorker, squeezed to deep midwicket"
"Mandeep holes out to deep midwicket and slaps his bat on his helmet. Slower ball outside off, Mandeep goes low for a slog-sweep but ends up miscuing it to Suryakumar"
"Kohli holes out off the next ball, to wide long-on. Pandya hits a back of a length outside off, Kohli does not get on top of the bounce ends up splicing a catch to Pollard"
"back of a length on middle, kicks up, Sundar hangs back and pokes to the covers"
"back of a length and outside off, shuffles across and hoists it to deep square leg"
"slower offcutter, nips away outside off, Sundar hangs his bat out and is beaten by the change-up"
"Sundar is the third batsman holing out in the 18th over. Back of a length and outside off, Sundar swings across the line but can't clear deep midwicket. He picks out Rohit"
"off-stump yorker, jammed out to short fine leg"
"slower cutter outside off, he swings early and does not connect"
"wide of the crease, another slower cutter, another swing and a miss. The crowd has been hushed into silence"
"full-toss on the hips, swatted away to deep midwicket"
"Southee tees off but he can't clear the short boundaries at the Chinnaswamy either. Back of a length and outside off, Southee drags this slower ball to Cutting at long-on. Fine overhead catch from the Australian"
"wide yorker, sneaks under the bat. De Grandhomme searches for a quick single but he has been sent back. Kishan can't throw down the stumps"
"back of a length and angling away outside off, run away through point"
"back of a length and angling across off, chopped to third man"
"short and angling across off, a mighty swing meets thin air. They sneak across for a bye"
"slower offcutter on of, Colin waits on it and then launches it hiiiiiiigh over midwicket. Huge six"
"short and angling across off, toe-ended away to wide long-off"
"full-toss above the waist, Colin sizes it up and smacks it over square leg for another six"
"The free-hit ball has also been sent to the boundary. Slower offcutter outside off, Colin reads it, winds up, and hoists it over the long-off boundary"
"full outside off, and shaping away from the batsman. Tries an expansive drive, but struck straight to point"
"full outside off again, and driven by Suryakumar off the front foot. The ball was swinging away, and the batsman did well to reach at it. Finds Kohli at cover though"
"too wide, and Suryakumar's seen enough! Big stride towards the off side, and thumps this drive between cover and extra cover. Glorious"
"<b>lovely!</b> On a good length outside off, and just about shaping away from Yadav. He tried to defend off the back foot but didn't account for the swing. Just past his outside edge"
"<b>dropped at first slip!</b> Tough chance. Good length on off, and that's squared the batsman. Tried to defend towards the leg side but takes the leading edge to slip. Vohra the guilty man"
"<b>another duck for Kishan!</b> Third duck in four innings. Full on off stump, and swings into Kishan's pads. He tries to drive towards mid on, but there's a big gap between bat and pad. The ball sneaks through and crashes into off middle stump. Perfect start for Bangalore"
"good length on middle, but going down the leg side. Clipped off his hips to square leg"
"good length on middle stump, and cramps Sky for room. Mistimes a shot off the back foot to short fine leg. Looked rather uncofrtable"
"full outside off, and angling further away. Duminy's happy to shoulder his arms and collect the extra run"
"good length outside off, and once again shaping away. Tries to punch it off the back foot but it goes past his outside edge"
"good length outside off, and enough width to free his arms. Stands tall and cuts it hard past the infield. No stopping that!"
"good length on off, and Duminy taps it off the back foot with soft hands. It's going to point, but enough time to scamper across for the run"
"<b>whipped!</b> Full on middle stump, and Suryakumar uses his wrists to flick it over square leg. No one square in the deep either"
"full outside leg stump, and it's the offcutter on this occasion. Goes down Duminy's leg side though"
"full on middle stump, and Southee's still getting that beautiful shape into the left-hander. Driven off the front foot to mid off. Says no to the run"
"<b>crunched!</b> Full on off, Duminy gets onto the front foot, and drives it through cover. Full followthrough of the bat, and once the ball clears the infield, it's only has one place to go"
"good length on off stump, and Duminy tries to chop it down fine to third man. Hurries onto him and he's too slow to get his bat to ball. Through to keeper"
full on off and angling across Duminy's body. Tries to drive but goes across his bat's blade and through to the keeper
"good length on off, and Duminy misses again! If this were baseball, he'd be struck out. Tried to defend it towards cover off the back foot"
"full on middle stump, and that's been pushed off the front foot towards cover. Sky doesn't want the run"
"<b>given lbw!</b> Suryakumar's reviewing. Full just outside off, and he tries to paddle it towards the leg side. But he got his front leg across the stumps, and that's plumb if you miss the shot. The ball stayed slightly low, and replays say 'umpire's call'"
"back of a length on off and that's nipped in sharply! Cuts the batsman in half, and the ball goes between bat and elbow. QDK dives to his left and takes a one hander and appeals for caught behind. The umpire says not out. <b>QDK wants to review</b> and yes! That's come off the inside shoulder of the bat. Big deflection"
"<b>hits him just under his throat!</b> Pollard doesn't react. Short on off, and Pollard takes a step forward before choosing not to duck. The ball's well directed and I can't believe Pollard shows no emotion"
"good length on middle stump, and that's been worked off his hips to backward square leg"
"good length on off, and angling sharply into his body. Tries to flick it towards short fine leg, but can't get bat on ball. Hits his thigh pad instead"
"goes short again to finish the over, but wait, he's got to bowl that again. Too short on off stump, and it's too high even for the tall West Indian"
"good length outside off, and Pollard tentatively pokes at it. Tapped towards point and the fielders come swooping in"
"good length on leg stump, and seam movement for Siraj. Angling across Duminy, and he defends it with soft hands off the back foot"
"good length just outside off, and Siraj takes the pace off this time. Duminy rides the bounce and fends it towards the leg side"
"good length outside off stump, and that's been pulled along the ground to deep midwicket. Umesh Yadav's sliding effort helps RCB clean up well"
"good length on off, and Duminy stays on the back foot and cuts it behind square to the man in the deep"
"slower ball, but short outside off. Pollard thinks about pulling but chooses not to go through with the shot. Good choice. Earns him an extra run"
"back of a length outside off, and Pollard comes prancing down the wicket before flicking it off his pads to midwicket. No one there, so Siraj is forced to go chasing behind it"
"full on leg stump, and Duminy's on drive takes a leading edge! Falls short of cover though"
"<b>lifted over mid off!</b> Full just outside off, and that's pure muscle. Checks his drive, but hit off his bat's sweet spot"
"back of a length outside off, and Pollard tries to pull this over to the leg side. The ball stays slightly low and goes under his bat"
"good length outside off, and enough width for Pollard to chop this cut to third man. The fielder's pretty square in the deep"
"back of a length on off, and punched off the back foot. Thick outside edge and dribbles away to point"
"back of a length outside off, and seaming slightly away after pitching. Pollard tries to pull again, but that shot's been eluding him all evening. Goes over his bat and through to QDK"
"overpitched outside off, and that's been drilled to McCullum at mid off. Could be a run out, but it's not a direct hit! Oh dear, no one's backing up either. Chahal and Siraj try hard to stop the ball near the boundary, but it's a futile attempt by both men. Free runs for Mumbai to end the Powerplay"
"<b>crazy spin!</b> Good length outside off, but sharp legspin after hitting the surface. Pollard just stayed on the back foot and let it go"
"good length on off, and once again spinning away from Pollard. Tries to play a late cut, but takes the edge. QDK can't hold on! <b>Dropped</b>"
"good length on off, and Pollard shuffles across to the off side and works it off his pads to backward square leg"
"<b>goes between keeper and leg slip!</b> Full on leg stump, but the legspin takes it down the leg side. QDK can't grab onto it either, and leg slip is too far away"
"good length on leg again, and once again spinning too much. More extras"
"fixes his line. Full on off, and Duminy's forced to defend off the front foot"
"full on off stump, and Duminy's on the back foot. Fended with soft hands"
"good length on off, and the batsman shuffles across to his left before blocking it towards the leg side. Sees the over out with caution"
"<B>soft dismissal!</b> Edged to QDK. Good length outside off, and Pollard tries to play the late cut. The ball just about seams away after pitching and that induces the edge. Comfortably taken by the keeper and Siraj is ecstatic!"
"good length outside off, and angling into Hardik. Cut off the back foot to point for a quick run. Off the mark"
"tries the offcutter, but misses the line. Full on leg stump, and going past Duminy's pads"
"good length on leg stump, and Duminy's leg-side flick comes off his bat's shoulder. The ball runs down to fine leg"
"full, and very wide outside off. Attempts a front-foot drive but can't connect. The ball's just inside the tramlines"
"good length outside off, and that's been punched off the front foot to cover. Plays that while shuffling down the ground"
"good length on middle stump, and Duminy's quick to gauge the length. Swivels and pulls this along the carpet to the deep backward-square boundary. The extra ball hurts Siraj"
"good length on leg stump, and that's been fended off the back foot towards midwicket"
"good length on off, and once again spinning wildly after hitting the surface. Hardik's in no place to punch it towards cover"
"<b>drilled</b> by Pandya. Full on off, and he gets his front foot out of the way before tonking this past Chahal. The bowler does well not to get his hands to it"
"full on leg stump, and Pandya misses the on-drive. Hits his back leg and dribbles away towards short fine leg"
"full on middle, and Duminy takes a big stride forward to drive towards mid on"
"good length on off, and spinning away. Pandya gets onto the back foot and cuts to the man in the deep"
"full on off, and spinning into Hardik. He gets down on one knee, and slog sweeps. Takes the top edge, but lands safe behind square"
"good length on off stump, and pushed off the back foot towards point. Dangerous single, but Hardik does well to scamper across to the other end"
"full on middle, and that's just a bit too full for Hardik. Clears his front leg and muscles it over midwicket. Two men in the deep, but bisects both of them"
"full just outside off, and that's been driven firmly off the front foot. Chase for de Grandhomme at deep point, but he does well to clean up"
"full outside off, and that's in Hardik's arc. Gets down on one knee, and slogs it over deep midwicket. Sweeeet!"
good length on off and turning into his body. Worked off his hips to square leg for a walking single
"full on leg stump, and that's been driven past midwicket to the man in the deep. Nice crunching sound off the bat"
full on off stump and Duminy carefully defends off the front foot
"full on off, and Duminy comes dancing down the wicket. Drives to midwicket, but the fielder slides across the surface to stop it from going past him"
"full outside off, and Duminy sweeps it to the man in the deep. Hands the strike back to Hardik"
<b>peach!</b> Full on off and Pandya tries to defend off the front foot. But the ball grips the pitch and spins across his blade. Could've easily taken the outside edge
"good length on off, and cut off the back foot with the ball turning away from him. He'll keep strike"
"good length on off, and driven past the non-striker to long on for a walking single"
"full on off, and delivers the cutter this time. Duminy does well to judge the pace and pushes it past Hardik to long off"
"back of a length on off, and too close to Hardik for the cut. Played straight to Kohli at cover point"
"good length outside off, and angling into Hardik. That allows him to pull to deep midwicket"
"full on off, and that's been driven off the front foot. Straight to CDG though"
"offcutter on middle stump. It's angling across his body, and Duminy cuts to deep point. He wants the second run, but that could be dangerous! QDK quickly takes the bails off, and we need the <b>third umpire.</b> He's gone! Bat on the line, but you know what they say, that crease belongs to the umpire. (adds a dollar to the cliche jar)"
"good length on middle, and it's the wrong'un! Comes sharply into his body and Hardik uncomfortably defends off the back foot"
"good length on off, and wild spin once again off the surface. Cuts this legspinner to deep extra cover. Gives his brother the strike"
"good length on off, and turning into Krunal's pads. Nudged off his pads to square leg"
"full outside off, and Hardik judges this well. Spinning away from him, and too wide reckons the umpire. Shoulders his arms to the spiner"
"<B>beaut!</b> Good length on middle, and spins across the batsman's body. Tried to defend off the front foot, but he's no where near the ball"
"<B>big appeal!</b> But not given. Full on off, but Hardik misses the sweep. Would've missed off stump, reckons umpire Erasmus"
