"good length on leg, and Krunal shuffles across to the off side and paddles this fine. Virat was lurking at leg slip but just past his outstretched right hand. He's not happy"
"short on off, but that's taken Hardik by surprise. Tried to pull, but it hits him hard on his right shoulder. That's gonna hurt. <b>The physio's out</b> and his brother comes to check on him as well"
"<b>more extras!</b> Good length on middle stump but swings down the leg side. QDK can't hold on to it, and that goes to the fine-leg boundary"
"good length on middle, and Pandya misses on drive. Inside edge onto his pads, and that's why the umpire says no to the lbw appeal"
"good length on middle, and that's been mistimed to square leg"
"full outside off stump, and that's been driven away from his body. Excellent work from Mccullum at cover"
"offcutter on leg stump, and Krunal's deceived for the pace. Tried to pull but through his shot too early. De Kock can't grab onto it either, so Krunal manages to steal a run"
"good length outside off, and wide enough to cut it off the front foot. Man at deep extra cover though. <b>Time out</b>"
"full on middle stump, and that's been clipped off his toes to deep backward square. Only a single"
back of a length on middle stump. Krunal stays on the back foot and punches it past the bowler's left. Man at long on though
"misses the cut! Was wide outside off, and Hardik will be disappointed on missing out. Could've placed that anywhere behind square on the off side"
"good length outside off, but it's the offcutter. Cramped for room, and manages to only muscle it towards cover. The mistimed shot actually allows them to take the single with ease"
"full outside off, and that's been lifted over cover! In the air for a while, and drops between the three people in the deep. The ball changes direction after pitching, so Vohra's on all fours trying to stop the ball. Comedy of errors. Kohli won't find it funny though"
"good length on leg stump, and Krunal backs away towards the leg side. Tries to fend it but takes the inside edge towards deep midwicket"
"<b>into the second tier!</b> Full on leg stump, and Krunal takes a big step forward and muscles it over deep midwicket. It was the offcutter, and the batsman pounced onto that in a flash!"
"tries to be too cute! Good length on off, and the attempted late cut doesn't come off. Well taken by QDK"
"slower ball, but overpitched on off. Drills it to cover and gives Hardik the strike"
"<b>Lucky!</b> Hardik'll take it. Good length on off, and his punch towards mid off takes the bat's inside edge. Short fine leg has no chance"
"good length outside off, and Hardik smothers it to cow corner. Calls nice and early for the second run"
"good length on middle stump, and Hardik flicks it fine with the ball going down the leg side. Short fine leg is too square!"
"good length on off stump, and Krunal's leg-side pull takes a leading edge towards long off!"
"Siraj and wides. What a love story. Good length, but way outside off. Goes to QDK on the bounce"
"full outside off, and driven down the ground to long on. It's mistimed from Hardik"
"offcutter on leg stump, and Krunal comfortably flicks it to short fine leg. Calls early for the single"
"almost a yorker outside off, and Hardik does well to dig it out. The ball's going towards Krunal, and Siraj can't field it despite the effort"
"full toss on middle stump, and Krunal's leg-side push doesn't come off. Appeal for lbw by Siraj, but Erasmus thinks that was bat first. Yep, he's spot on"
"<b>sliced inside out!</b> Full outside off, and that's been muscled over the infield. Too much for wide long off to do"
"slower ball, on off stump. It's angling across his body, but Krunal's leg-side heave is mistimed. Goes to long off instead"
"<b>de Grandhomme saves a certain four!</b> Great sliding effort at long off. The full ball was crunched past Southee, but his fellow New Zealander saves RCB three"
"slower ball, on a good length on off stump. Mistimes his pull down the ground to long on"
"yorker on middle stump, and Hardik does well to squeeze it down the ground. Kohli at long on"
"experience showing here! Yorker on middle stump, and all Krunal can do is dig it back to the bowler"
"slower ball outside off, and Krunal lifts this inside out over cover. Deep extra cover does well to race across and intercept"
"full toss on leg stump, and Krunal can't put it away. Hits his front leg as they scamper across for the run. Another run added to the extras. <b>They're reviewing </b>. Where's the impact?! Oh wow, it's an inside edge. Excellent from umpire Erasmus, who had given it a run in the first place anyway"
"yorker just outside off, and Hardik does well to squeeze it past Krunal. But where's his bat?! It flew off his gloves and landed near the keeper. Sweaty evening"
"<b>that defied the laws of Physics!</b> Full on leg stump, and Krunal got down on one knee to ramp it over fine leg. Takes the leading edge, and goes to...wait for it...point."
"full and wide outside off, and Hardik can't connect with the drive. Through to QDK on the full. Excellent ball given the game situation"
"full outside off, and all Hardik can do is muscle a drive to wide long off. <b>His 2nd IPL fifty</b>"
"knee-high full toss outside off, and Cutting muscles a pull to cow corner. De Grandhomme saves some more runs in the deep with a sliding effort"
"<b>Is that the game?!</b> Full on off, and Hardik drills it straight to long on. Dives forward and takes an excellent tumbling catch. What a change in attitude though. Kohli took a similar catch two nights ago, but didn't show any emotion that evening. Today he's ecstatic"
"full outside off, and Cutting drags the slog towards the leg side. Deceived by the slower ball, but enough power behind that shot to beat deep midwicket"
"full outside off, and the expansive drive takes the inside edge. Goes to square leg"
"back of a length outside off, but Southee takes the pace off it. Pulled to cow corner, but these are consolation runs"
excellent yorker! Ricochets it onto his toes while trying to squeeze this out
"<b>ends with a sixer!</b> But it doesn't matter for RCB. Full outside off, and Cutting slogs this over long off to finish the game on a semi-high. <B>Royal Challengers Bangalore win by 14 runs!</b>"
