"excellent running effort to catch that at deep cover but it's jut out of his reach! Rana didn't pick that googly, he miscued that with a leading edge and it went very high, Umesh ran a long way to his left, put in a dive but can't blame him for not taking that"
""
"tries to sweep that one from waaayy outside off against th turn and QdK can't hold on to it, bye"
goes down on a knee as the ball turns in and he paddle-scoops that fine and high to the fine-leg boundary
tries the wide yorker and it's gone a bit too wide
uses a strong bottom hand to drill that through the covers. Have to settle for one
"Chahal gets to the ball but it's gone for four! It was full outside off, Rana jammed his bat in to steer it just behind square to make Chahal run to his left from third man. He rolled to get his hands on the ball, but it went through"
"<strong>gone first ball on his 30th birthday</strong>! The crowd has come alive, I tell you. Siraj banged it in and Russell went hard at it with a swing of the arms, got only a top edge and de Kock ran a long way back to complete a superb catch"
"sends a wide on the off side, outside the tramlines"
gets the wide yorker right this time and Lynn jams his bat in for a single to deep point
"Southee has a shy at the stumps from point, he can see only one of them and he misses as Lynn is miles away, he finally makes it and then even comes back for the overthrow. DK drove that straight to point and took off, Lynn wasn't sure and was nearly stuck on the pitch but DK was a long way down before Southee misses. No back up, little more mix up and that's two runs"
"two full to DK, he brings out the cover drive and drills that along the ground, just wide of deep cover. Four!"
the big back lift sees the low full toss with a wobbly seam outside off and he whacks it straight down to beat long on. Strong arms and shoulders coming into play
"full and wide, drives that away to deep cover for one"
"We have a <strong>direct hit</strong> and the third umpire comes into play, but he's safe. DK closed the face of the bat to tuck the ball to leg with soft hands and said 'two' repeatedly as Vohra rain in from the leg side, they can back just in time"
"it's a slow and short cutter, short enough for DK to pivot on the back foot and pull it fine behind square. It's beaten depe fine leg too. The captain is not wasting any time here"
chips the fullish ball down to long on
"low full toss lofted down the ground, long off runs to his right and they come back for the second easily"
"slices that one high on the off side and it lands beyond backward point, wide of sweeper cover for two"
"oh my, how did he hit that! It was a short of length ball, mid off was in and DK lofted it straight over his head for a six!"
"lands it short this time, and DK pulls it square for two more"
"he's hitting those drives and pulls so well, tries a reverse paddle now and misses"
"<strong>what a catch by Kohli</strong>! DK lofted it straight down yet again, Kohli's eyes spot it and he sprints across full speed in front and to his left from long on. Puts in a full-length dive just in time and gets both his hands under the ball"
little full towards the pads and it's worked to leg for one
"<b>Gill hits the winning runs</b>, takes his helmet off immediately and swings his bat in the air with his right arm, such passion! Gets a hug from Lynn. Short and wide, he stays on top the ball and cuts it square and fast"
