"fullish outside off, eased off the front foot to sweeper cover"
"digs in the bouncer, climbs too high to worry Masvaure, who just sways perfunctorily to let it pass"
"length ball close to off stump, defended to extra-cover"
"full, angling down leg. Misses the flick and Hasan lets out a big appeal for lbw, but it's angling too far down leg"
"yorker close to off stump, opens his bat face and steers it down to third man"
"back of a length outside off, punched to sweeper cover"
"nice length on off stump. Comes forward, lets the ball come to him, and clips it gently to the right of midwicket"
"back of a length close to off stump, punched to the left of backward point"
"length ball turning into middle and leg, clipped to backward square leg"
"flighted ball outside off, driven to long-off"
"flat, angling down leg, too quick for Murray to connect with the paddle sweep"
"quickish length ball on off stump, defended to midwicket"
"length ball on middle, and tapped back to the non-striker"
"full on off, and he's lifted it over the non-striker! Looks like it's going to clear mid-on, but the ball dips late, and therefore Asif must jump forward to take the catch. <B>Breaks a 78-run partnership</b>"
"welcomed with a yorker. Aimed on off stump, and Moor does well to keep the ball away"
"full on off, and tailing into Moor's body. Tries to drive, but the ball is inside-edged onto his pads"
"back of a length outside off, and the cut has been mistimed to third man. Gets off the mark"
"full on off, and he leans into a straight drive off the front foot. But strikes it straight to Hasan"
"length ball on leg stump, and blocked off the back foot"
"good length on leg stump, and Moor whips it off his pads to the leg side"
"good length on off, and angling across Moor. Pushed to cover"
"good length on middle, and pushed to mid off off the front foot. They take off for a single"
"full on off, and driven away from his body. But finds cover once again"
"back of a length on leg, and the batsman sways away from the ball's line and lets this go to Sarfraz. <B>Maiden over</b>"
"length ball outside off, and he blocks it off the back foot. Rides the bounce to defend"
"back of a length outside off, and Murray pulls this over midwicket. Mistimes his shot, but manages to clear the infield. <b>His highest ODI score</b>"
"back of a length outside off once again! Murray attempts the pull once more, and this time it's been drilled to mid on. Falls just short of the fielder there"
"full outside off, and pushed to cover point for a quick single"
"good length on off, and it's too close to the batsman for the late cut. He gloves it - past the diving keeper's right - to third man for a single"
"full on off, and that's been <b>drilled</b> past midwicket! Slogs across the line, and muscles this between the two fielders on the leg side"
"full on off, and flicked off his toes to the fielder at deep midwicket"
"full on off, and defended off the front foot"
"length ball outside leg stump, and turned off his pads to the leg side. Wants a single, but the fielder comes swooping in to cancel those thoughts"
"full on middle and leg, and that's been tapped away to the fielder at midwicket"
"yorker on off, and he does well to dig it away to the off side"
"yorker on middle again, but Murray has a swipe at this - across the line - and mistimes a shot to midwicket"
"tossed up on leg stump, but angling down the leg side"
"flatter on middle, and he rocks back to get inside the crease. Punched to mid on"
"<b>pushed over the boundary!</b> Fakhar the guilty man. Full on off, and he slogs across the line. Fakhar was near the mid-wicket boundary, but his one-handed attempt is dropped, and eventually parried over the ropes"
"good length on middle, and zipping straight through. The ball stays low, and Murray does well to keep this out"
"<b>middle stump!</b> One too many, and Murray falls three runs short of a maiden half-century. Tossed up full on off, and Murray goes down on one knee to slog-sweep behind square. You-miss-I-hit stuff from Nawaz"
"low full toss on middle stump, tapped past the non-striker to long on for a single"
"good length on off, and he goes onto the back foot to punch"
"length ball outside off, and that cut shot has flown to Shadab at point! Tries to take a flying catch to his right, but the ball pops out of his hands. Goes down as a <b>dropped chance</b>"
"full on middle, but angling across Chigumbura. Defended to cover"
"slower ball, on a length on middle stump. Chigumbura looks to defend off the front foot, but the ball angles across his bat and goes into Sarfraz's gloves"
"attempted yorker on middle, but eventually is a full toss. Driven down the ground to mid off"
"full on middle and leg, and defended off the front foot. Intercepted by Amir on the followthrough"
slower ball on middle stump. Pushes this length ball away to cover. <b>Just one off the over</b>
"length ball on middle, and he shuffles across to the off side, whipping away to square leg for one"
"tossed up on off, and driven with the turn to long off for a single"
"tossed up on leg stump, and that's been driven inside-out to the bowler"
"flighted outside leg stump, and he paddle-sweeps this fine down the leg side! Sarfraz is not pleased"
"good length outside off, and cut with the spin to point"
"full on middle, and Chigumbura comes forward to push this back to Nawaz"
"good length on off, and he rides the bounce to defend. Played to mid off"
"yorker on middle, and Moor does well to dig this out of the blockhole. Played back to Junaid"
"full on off, and driven away from his body to cover"
"slower ball, on a leg stump. Whipped off his pads to the vacant midwicket region for a jogging single"
"slower ball on middle stump, and Chigumbura looked to tee off for a big shot, but he eventually check-defends to the off side"
"full outside off, and that's been <b>crunched</b> over long off! Such sweet followthrough of the bat as he drives this for half-a-dozen! What a crack"
"tossed up on middle, and driven to cover"
"flighted on leg, and worked away to the fielder at long on for a single"
"full outside off, and he's through his drive too early. Off the bat's top half, and goes almost into cover's hands"
"<b>appeal for lbw!</b> But not given. Length ball on off and he came down the ground to defend. Misses the shot as the ball hits his front leg. Impact was in front of off stump, so wonder what the umpire was thinking there"
"full on off, and thumped down the ground to long off"
"good length on off, and he goes onto the back foot to defend and see the over out"
"back of a length, close to off stump, defended into the covers"
"low full-toss close to off stump, driven to extra-cover"
"shortish outside off, steered down to third man"
"length ball angling into off stump from wide of the crease, defended back towards the bowler"
"back of a length on off stump, gets on his toes and clips to midwicket"
"fullish on off stump, driven to mid-off"
"back of a length outside off, googly. Stays a bit low and Chigumbura inside-edges his attempted back-foot punch past leg stump"
"shortish outside off, flat-batted to long-off"
"tossed up outside off, driven to sweeper cover"
"flat googly turning into leg stump, goes back and whips to deep square leg"
"another googly, tossed up and turning in towards off. Presses forward to defend into the on side"
"shortish outside off, stabbed to backward point"
"shortish, angling into the body. Looks to tuck it into the leg side and gets a blow on the glove instead"
"short, a bit of width, cracked away nicely, placed it well to the right of third man"
"yorker on off stump, jams his bat down on it and gets an inside-edge that rolls into his feet"
"short, angling into the body, gets up to chest height and he swivels nicely and plays a controlled pull out to long leg"
"short, some width again, and now it's Moor's turn to pick up a square-cut boundary. Hits it further in front of third man than Chigumbura did"
"length ball angling into off stump, defended to extra-cover"
sharp turn outside off from a good length. Presses forward to defend and it rips past his outside edge
"tossed up wide of off, driven to the left of long-off"
"beauty. Gets it to dip and spin away sharply, a little wider outside off, to beat Moor as he drives away from his body"
"googly, pitches on a good length and he hits it back to the bowler off the inside half of the bat. Wanted to drive into the covers"
"fuller, plays a checked drive into the covers"
"quickish length ball turning away from off stump, gets back and across to defend with soft hands"
"full, angling into middle stump, clipped away through square leg"
"length ball outside off, defended into the covers"
"slower ball, cuts in from off stump and is probably missing leg stump. Misses the flick and prompts a big lbw appeal"
"Length ball, nips in from outside off. Misses the flick and is hit on the pad again. Outside the line, I guess, and maybe an inside edge too. Not much of an appeal"
"another slower ball but this one is short, and he holds his shape nicely and pulls it just beyond the rope at deep midwicket"
"low full-toss outside off, driven to sweeper cover"
"another legbreak that beats the outside edge. He's been getting them to dip and turn in his last two overs, this one's on a wide-ish line and forces Chigumbura to reach away from his body"
"fuller, driven to the right of sweeper cover"
""
"quickish legbreak on off stump, a touch short, goes back to punch through cover point"
"googly, too short and the wide line telegraphed it too. Goes back to punch to sweeper cover"
"floated up full on middle and leg, clipped past the diving bowler to long-on"
"short, turning down leg, pulled to long leg"
"half-tracker on off stump, pulled hard to the right of long-on and the fielder has to dive to save the boundary"
"shortish outside off, stabbed into the covers"
"back of a length close to off stump, punched towards extra-cover, who moves quickly to to stop it"
"back of a length on off stump, punched to long-off"
"full, almost in the blockhole, on middle stump. Driven to long-off"
"tossed up full on off stump, driven to extra-cover"
"flighted ball on off stump, driven back to the bowler"
"length ball on off stump, presses forward, lets it come on, and defends into the gap to the left of extra-cover"
"quickish length ball on off stump, defended into the point region"
"tossed up full on middle stump, driven to long-off"
"full on off stump, pushed to short cover"
"long-hop turning in from outside off, and Moor clatters it over the midwicket boundary"
"slants it wide of off, Moor leaves it alone"
"shortish on middle and leg, pulled along the ground to deep square leg"
"back of a length outside off, punched to extra-cover"
"length ball on off stump, goes back and clips it back to the bowler"
"loopy and slow outside leg, sweeps to long leg for one"
