"full outside off, and driven away from his body. Played to cover, but intercepted by the infielder"
"back of a length outside off, and he pulls this to the deep midwicket fielder. Slower ball from Chatara again"
"good length on off, and Babar wants to cut this fine. But the ball's too close to his body, and he finds point instead"
"full on off, and he comes down the ground to drive. Steers it to long off"
"wide outside off, but Malik came dancing down the ground, and <b>thumps</b> it over the non-striker's head. Long on has no chance!"
"full on off, and pushed to long on with soft hands"
"wide outside off, and Babar can free his arms. Cuts it hard to the fielder square on the off side"
"good length outside off, and this is sliced over point's head for a single. Man in the deep"
"good length outside off, and he drops his gloves onto his ball, pushing it to short third man for a single"
"low full toss on middle, and pushed to mid on"
"<b>yorked!</b> Aimed on middle stump, and Malik gets his bat down to keep the ball away. But the ball hits him near his toes, and the umpire raises his finger. <b>Malik smiles, indicating it hit his bat first</b>"
"full on middle, and clipped off his toes to the fielder at midwicket"
"good length outside off, but angling into his body. Worked off his hips to the fielder at midwicket"
"good length outside off, and fended off the back foot. Well stopped by the bowler on his followthrough"
"<b>soars into the long-on boundary!</b> In the slot outside off stump, and Asif has a golf swing at this delivery. Punished"
"full on leg, and he tries to whip it away to mid wicket, but a leading edge takes the ball to cover instead"
"good length outside off, and cut away off the front foot. The ball rolls away to third man, but Babar puts in the hard yards, and manages to come back for two. <B>Eighth fifty for Babar!</b>"
"full, but wide outside off. Babar throws his hands at it, and crunches this to the fielder at deep extra cover"
"full outside off, and beautifully driven off the front foot. Timed so well, but goes straight to the fielder at cover"
"full on off, and he uses his wrists to caress this shot to long on. They walk across for one"
"back of a length outside off, and soaring over Asif's shoulder and into the keeper's gloves"
"<b>beats long on!</b> Full outside off, and Asif's big backlift allows him to tee off for this shot. Swings across the line, and connects well to earn six"
"good length outside off, and he misses the uppercut over shord third man. Through to Murray"
"short and wide outside off again, and Asif can't get bat to ball once more. Looks to cut it over point, but can't connect with the shot"
"full outside off, but Asif goes down on one knee to drive very square. Finds the fielder in the deep though"
"low full toss outside off, and this drive has been squeezed to deep extra cover. <B>Pakistan cross 300</b>"
"aims for a yorker on off stump, but Asif manages to dig this away to long on"
"good length outside off, and that's been <b>crunched</b> to the cow-corner boundary. Picks the slower ball early,and swings across the line. Lands just before the ropes"
"full outside off, and that's been <b>lifted inside out over cover!</b> Another slower ball, but Babar had no trouble picking the pace"
"back of a length outside off, and this time Babar carves it over point with soft hands! Chase for the infielder to the boundary, but he manages to parry the ball back as they come back for three. The umpires want to have a look whether the fielder touched the boundary or not"
"low full toss outside off, and this has been sliced to the fielder in the deep. Tried to go for the big shot over cover"
"low full toss outside off, and that's been walloped to the extra cover boundary. What great timing, but the man's there in the deep"
"<b>ouch!</b> Asif Ali is down on his knees. Looks like he's hurt his rib cage. Short ball on middle, and Asif couldn't pull this away. Took his eyes off the ball, and has paid the price for it"
"full and wide outside off, and Asif reaches out to try and carve it behind point. But the batsman misses this slightly quicker delivery and goes into Murray's gloves. Appeal for caught behind, but the umpire isn't interested"
"<b>sliced to third man!</b> Wide outside off once again, and this time Asif manages to reach out and drive away from his body. But the bat turned in his hand, and Asif miscues this straight to the fielder at third man"
"good length on off, and he flat-bats a pull to wide long on"
"good length on middle, and Sarfraz rides the bounce, before turning it around the corner for a single"
"knee-high full toss on off stump, and Babar whips this to the cow corner boundary for two. <b>Only four runs off the over</b>"
"full outside off, and tapped to point for a quick single"
"full outside off, and that's been <b>check-driven</b> over cover! Good use of the bottom hand to lift it over the infield. Classy"
"full on off, and Babar walks across the line before swing through to the cow-corner boundary! Off the bat's sweet spot, and the ball goes way beyond the fielder manning the ropes"
"knee-high full toss on middle, and this has been flicked over square leg! Almost goes for a six. Fourteen in three balls now..."
"slower ball, but short outside off. Babar simply settles onto the back foot and slices this over point. No real timing off the bat, but still enough to take the third run"
"full toss on off, and worked to the wide long on fielder. <B>Nineteen off the over</b>"
"short ball on off, and he rides the bounce, before nudging to square leg for a single"
"back of a length outside off, cut away to third man for a single"
"back of a length outside off, and that's been ramped to third man for a walking single"
"full outside off, and that's been creamed to the extra-cover boundary! Small backlift, but goes hard onto his shot, and smacks this four to get to his <b>nineties</b>"
"slower ball bouncer on middle, and Babar pulls over square leg with ease. Once it crosses the infield, the ball races away to the boundary. <B>Babar on 95</b>"
"full outside off, and he opens his bat's face to run it down to short third man. Keeps the strike for the final over"
"short ball outside off, but Babar waits for the ball and runs it down fine to the third-man boundary! <B>Eighth ODI hundred for Babar Azam</b>. The second fifty came off just 17 deliveries"
"steered past short third man for four! Classy. Yorker outside off, and Babar sticks his bat out to run it fine"
"yorker, but too wide outside off. Left alone by Babar"
"full, and wide outside off. Babar stretches out and drives to wide long off"
"wide outside off once again, and the umpire has no choice but to spread his arms wide"
"back of a length outside off, but Sarfraz plays a late cut to third man for one. Gets Babar back on strike for the final two deliveries"
"slower ball, but wide outside off. He muscles this cut to cover"
wide yorker to end the innings. He sticks his bat out and steers this to point for a single. <B>Pakistan finish on 364 for 4!</b>
"back of a length, starts just outside leg and straightens in slightly. Masakadza misses the flick and is hit on the thigh pad"
"back of a length, close to off stump, blocked into the off side"
"well left. Full, pitching on middle and off and continuing with the angle across. Watches it well, sees there's no swing back, and raises his bat over his head"
"back of a length on leg stump, tucked away to long leg"
"ooh, nearly. On the fuller side of a good length, slanting across and inviting the cover drive before curling back in late. Goes for the drive and inside-edges past leg stump"
"back of a length, a little wider outside off, lets it come on and dabs to backward point"
"back of a length on middle and off, defended to short extra-cover"
"good ball, slanting away from off stump from a good length. Kamunhukamwe was unsure whether to play or leave, and ends up edging it just wide of the diving slip fielder"
"short, a little too far from the body to connect with the cut, maybe, or Kamunhukamwe was late on the shot"
"well bowled. Fuller, slanting across to off stump, defended to short extra-cover. Not much of a stride forward"
"shortish, wide-ish, Kamunhukamwe slashes and misses. His back foot didn't really get across"
"back of a length on off stump, defended to cover point"
"back of a length, straightens slightly towards off stump. Wanted to punch through the covers, ended up dragging it back to the bowler"
"back of a length on off stump, this one's slanting away from wider on the crease. Defended into the covers"
"back of a length on middle and off, punched back towards the bowler"
"too full, too straight. Masakadza pulls his front leg out of the way and clips it away neatly, wide of mid-on"
"ooh, overambitious. An in-between length, angling away into the fifth-stump channel, and Masakadza is caught in an in-between position, weight on the back foot and looking to drive with an angled bat through cover. The ball beats his outside edge"
"back of a length on off stump, defended into the covers"
"play and miss. Length ball slanting away from off stump, and he goes for the drive and ends up playing inside the line"
"this one straightens in towards off and middle, and Kamunhukamwe stays leg-side of the ball and punches to short extra-cover"
"shortish, close to off stump. Gets on top of the bounce and chops it to backward point"
"back of a length close to off stump, defended to cover point"
"hooked for six! Junaid looks to surprise him with the bouncer, and it's a good one too, getting up to shoulder height around middle stump, but he deals with it brilliantly, opening up quickly and swivelling to swat it high over the long leg boundary"
"back of a length outside off, punched to cover point"
"length ball on off stump, continues to leave Masakadza with the angle. Left alone"
"ooh, beauty. This one's a little wider and Masakadza has a little poke at it. Beaten by the angle and the length - he wasn't able to get a big enough stride forward to it"
"back of a length on middle stump, punched to midwicket"
"length ball, straightens in towards middle stump to cramp Masakadza slightly, defended back to the bowler"
"back of a length close to off stump, punched to extra-cover"
"back of a length once more, a touch wider of off. Looks to drive on the up to mid-off but extra-cover moves quickly to intercept"
"back of a length, slanting across to off stump. Stays slightly leg-side of the ball to guide it down to third man"
"ooh, nearly a caught-and-bowled! On the fuller side of a good length, on middle stump, and Masakadza is into his drive too early. Hits it in the air, just over the bowler's head, and it comes quickly so Junaid ducks under it, wisely"
"back of a length on leg stump, goes back to tuck it to square leg"
"length ball on the pads, clipped to square leg"
"shortish, close to off stump, defended to cover point"
"back of a length on off stump, defended into the covers"
"back of a length close to off stump, punched firmly to mid-off"
"back of a length on off stump, punched back to the bowler"
"fullish, angling across to off stump and straightening a tiny bit. Wants to defend down the pitch, ends up playing it to midwicket off the inside half of the bat"
"shot! That's a Masakadza special. Jumps a couple of steps down the pitch and across his stumps, and flicks this good-length ball from off stump, against the angle, over backward square leg. It's lodged itself on a corrugated tin roof over one of the stands there"
"full on off stump, driven to the left of extra-cover, with a high left elbow"
"back of a length on off stump, punched to cover point"
"back of a length on off stump, defended into the covers"
"back of a length, angling across to off stump. Uses his wrists to play that back to the bowler. Didn't really get back and across, stayed leg-side of the ball"
"back of a length on off stump, lets it come and defends to cover point"
"back of a length on off stump, punched to extra-cover. Both these left-armers have bowled with terrific control"
"once again, back of a length on off stump. This time Kamunhukamwe makes himself room, goes deep in his crease, and punches it away between backward point and cover point"
"back of a length on leg stump, goes back to tuck it to square leg"
"slower ball, slanting away from off stump. Masakadza looks to defend and the ball leaves him like an offcutter and beats his outside edge. Bounces once more before reaching Sarfraz"
"fuller, outside off, driven with a lot of bottom wrist to extra-cover"
"back of a length on off stump, waits on it and dabs to third man"
"shortish, angling across to off stump. Hops to ride the bounce and defends, inside-edges into his pads"
"shortish, close to off stump, angling away from wide of the crease. Rocks right back and stabs it to the right of third man. Timed beautifully and it just races away"
"back of a length, down the leg side, misses the flick and there's a bit of an appeal for caught behind as Sarfraz tumbles to his left. Probably flicked his thigh pad on the way"
"length ball, straightening towards top of off, punched to short extra"
shot. Takes a big step forward and across to whip this from outside off to the right of mid-on. Alert fielding keeps it down to one
"back of a length outside off, lets it come on and steers it to the right of third man"
"back of a length, angling into off stump, defended back down the pitch"
"back of a length on off stump, looks to get on his toes and force it away through the infield. Straight to cover point, though"
"length ball on off stump, and that's a pretty unique shot. Clears his front leg, opens himself up, and just muscles it over long-off with a lot of bottom hand"
"length ball outside off, and that's been tapped to cover"
"full just outside off, and he tries to drive to cover. The ball angles slightly away, and goes past his bat's outside edge"
"good length outside off, and punched square off the back foot. Beats point, and a couple more for the Zimbabweans"
"full just outside off, and he tries to drive straight. The ball hits his inside-edge, and ricochets onto his pads"
"good length outside off, and steered to the cover fielder for one"
"yorker on middle, and he does well to dig this down to mid on"
"full outside off, and pushed to cover"
"flatter on middle, and punched down the ground to long on"
"length ball on middle, and he shuffles to the leg side to make some room. Then carves a cut to point"
"length ball on off, and that's been punched down the ground to long off. <B>Fifty partnership!</b>"
"tossed up just outside off, and crunched through to the fielder at deep extra cover"
"full on middle, and he opens his front leg to free his bat's movement. But the straight drive is swiftly blocked by Nawaz"
"back of a length on off, and tapped off the back foot to cover"
"full just outside off, and that's been driven square with the bat's open face. Man in the deep"
"<b>golf swing!</b> Comes down the ground, and meets this delivery on the full. Swings the bat through the ball's line, and the connection is excellent! Over long on"
"full on off, and he offers the bat's full face to drive straight. Stopped by Hasan though"
"good length outside off, and tapped to cover point for a quick single"
"full on middle, and worked away to midwicket. They want a single, but Masakadza sends his younger partner back"
"good length outside off, and carved off the back foot to cover point"
"full on leg stump, and he misses out on the sweep. Goes down the leg side, so Zimbabwe earn an extra run"
"full on middle, and driven down the ground to long on"
"length ball on leg stump, but going down the leg side. Another freebie"
"good length on leg stump, and he goes onto the back foot to defend"
"full on leg stump, and he's down on one knee to sweep! Picks this from middle stump, and places this angled sweep very fine past the infielder"
"full on off, and pushed away to the fielder at cover. Mistimed"
"good length on off, and he backs away to pull. Drags it too straight, and it's gone <b>straight to mid on!</b>"
"good length on off, and the block takes the bat's inside edge. Ricochets onto his pads thereafter"
"back of a length on middle, and Masakadza is pretty surprised! Goes for the pull anyway, and he top-edges it beyond fine leg"
"<b>sends two stumps flying away!</b> Squares Masakadza up. Length ball on off, and the ball angles slightly away after pitching. Masakadza tries to drive straight, but the ball goes past his outside edge, and uproots off- and middle-stump. A funny celebration too - Hasan chooses not to do the blast celebration, and instead asks his friend Shadab to celebrate for him. Remember, Hasan pulled a neck muscle the last time he tried to do that."
"back of a length outside off, and he runs it down to third man. Gets off the mark"
"attempted yorker on leg stump, but the ball goes down leg. Wide, says the umpire"
"full on off, and Masvaure comes forward to defend"
"full on middle, and he comes forward to defend once more"
"full on off, and angling into the right hander. Defended to the leg side"
"tossed up on middle, and hits his front leg while the batsman tries to work it towards midwicket. Big appeal for lbw, but not given by the umpire. The angle would've taken it down leg stump"
"full on leg, and this time it's been pushed to midwicket for a quick run"
"full just outside off, and defended off the front foot to mid off"
"full outside off, and he comes forward to defend down the ground"
"tossed up on leg stump, but he gets behind the line of the ball, and drives back to the bowler"
"full on leg, and going down the leg side. Sarfraz dives to his right and stops the ball, but the umpire calls it a wide anyway"
"full just outside off, and he drives inside the line of the ball. Expected the ball to come into him, but the ball jagged away, and went past the outside of his bat"
"full on off, and Masvaure digs this away to the square-leg fielder. <b>He's overstepped</b>"
"yorker on leg stump, and Murray manages to get his toes out of the ball's way. The ball, however, raps him on his front leg, but the ball trickles away to square leg"
"full on middle, and that's been whipped off his toes to the vacant cow corner region. Chase for the fielder from midwicket"
"good length on off, but tailing into Murray's body. Defended to midwicket, and off they go for another run"
"full on off, and he raises his back leg to go through the line of the ball. Driven to mid on"
"full just outside off, but slower in the air. Defended with soft hands. <B>Drinks as well</b>"
"good length outside off, and the ball stayed low! He tried to cut, but the ball snuck under his bat, and Sarfraz does well to hold on"
"full on off, and he takes a big stride forward to defend. Sarfraz says, <i>'bohut acha</i> (very good)' to his bowler"
"full on middle, and worked away to the leg side for a walking single"
"good length outside off, and the ball's spinning into the left hander. Tries to cut it away, but misses the shot completely"
"full on middle, and driven down the ground to long on for a walking single"
"tossed up outside off, and he opens his bat's face to run it down to point"
"back of a length on leg stump, and that's been paddle swept to fine leg"
"tossed up outside off, and that's been driven expansively. Struck with some ferocity, but straight to long off"
"tossed up on middle, and that's been whipped off his toes to the fielder at deep midwicket"
"full just outside off, and defended to mid off"
"tossed up on off, and the wrong'un comes into Murray. Mistimed to mid on"
"full outside off, and spinning away from the batsman. Sticks his bat out, and defends to point"
"full and wide outside off, and he comes down the wicket to drive. Played to the cover fielder"
"length ball outside off, but spinning in sharply. Worked off his hips to square leg"
"uses his feet, and <b>lifts it</b> over the bowler's head! Played with the turn to the long-off boundary"
"full just outside off, and worked away to the on-side off the front foot,. Played to mid on"
"good length just outside off, and he goes onto the back foot, before nudging this to square leg"
"length ball outside off, so Masvaure checks his shot. Punches past short mid on to the fielder in the deep"
"full outside leg stump, and spinning down the leg side. He misses out on the sweep and the ball hits the keeper's pads"
"full outside off, and spinning into Murray this time. Fended back to the bowler"
"tossed up on off, and he tries to drive straight. The ball turns away, and induces the bat's outside edge. Flies away to square leg thereafter"
"good length on off, and worked away to the leg side. But the ball turns away, and takes the top of his pad and goes to short third man"
"full outside off, and spinning further away. He sticks his bat out, but the ball goes past his outside edge"
"turn and bounce! Full outside off, and spinning away from Murray once again"
"tossed up outside off, driven to extra-cover"
"back of a length, turning into middle stump, punched to long-on"
"length ball on off stump, defended back to the bowler"
"shot. Fullish on off stump, clipped away crisply to the left of deep square leg"
"tossed up outside off, defended to extra-cover"
"a touch closer to off stump, driven to extra-cover"
"flat length ball on middle and off, goes back to punch it back to Shadab"
"loopy full-toss on off and middle, swept down to long leg"
"shortish outside off, pulled to the left of midwicket. Was looking for the single to long-on but the fielder in the circle moved quickly to cut it off"
"quickish length ball on off stump, Murray defends without really striding forward, just collapsed his back leg"
"shortish outside off, pulled to long-on"
"beauty. Floated across towards off stump and he comes forward to defend, playing for the turn. Continues to slide on with the angle and beats the outside edge"
"shortish outside off, jabbed to sweeper cover"
"length ball on off stump, clipped to midwicket"
down the track and Nawaz gets it to drift away from off stump a bit. Driven back to the bowler
"back of a length on off stump, punched into the point region"
"back of a length on off stump, looks for the punch to long-on but doesn't get any power on it, cramped for room. Midwicket moves across to field it"
"a bit more room, rocks back and forces it past backward point"
"googly, tossed up outside off. Looks to drive into the covers, ends up hitting it back to the bowler"
"fuller outside off, driven hard into the covers and extra-cover, diving right, can only half-stop it and slow it down"
"length ball turning in towards off stump, nicely defended down the pitch. Masvaure's been getting into good positions against spin so far"
"length ball turning down leg, tucked away to long leg"
"flat slider angling into off stump, defended back down to the pitch"
"tossed up wide of off stump, presses forward for the push to sweeper cover"
"tossed up full on off stump, driven down to long-off"
"looks for the cover drive, ends up hitting it back to the bowler. Dangled it up slowly and got it to drift into the left-hander"
"quicker, angling into off stump, goes back to work it through square leg"
"nice length outside off, gets forward for a push into the covers"
"lovely length again, dips and turns in towards off stump. Nice checked drive to long-off"
"tossed up full, wide of off, driven to long-off"
"shot. Tossed up on middle stump and he makes himself room and chips it inside-out, over extra-cover, against the turn"
length ball turning in from middle and leg. Gets forward and works it through square leg
"full on off stump, driven back to the bowler"
"ooh, <b>dropped</b>. Flicks this full one against the turn, with a lot of power, and it doesn't quite stick as Malik moves to his left at midwicket to take this chest-high chance"
"back of a length outside off, chopped into the backward point region"
"a bit of flight outside off and Murray goes after it, sinks onto his back knee to slog-sweep over the midwicket boundary"
"down the track, gets inside the line of this full one angling into his legs, and chips inside-out to long-off"
"length ball turning in towards off stump, defended back to the bowler"
length ball on off stump. Looks to use his wrists and play it down to long-on but midwicket moves quickly to his left to cut it off
"fuller, driven down to long-on"
"back of a length, sliding into the pads, worked away through square leg"
"tossed up on off stump, clipped to midwicket"
"tossed up on middle stump, clipped away to deep square leg"
"flat legbreak just outside off, goes back and whips to midwicket"
"fuller, angling slightly down leg, and Murray plays that very well, gets his head over the ball and glances it away to the right of short fine leg"
"googly, didn't pick it. Dips sharply wide of off stump and he drags his intended cover drive to midwicket"
"tossed up wide of off again, driven down to long-off"
"length ball on off stump, sliding on with the angle. Goes back to slap it to cover point"
"flighted ball on off and middle, driven back firmly to the bowler, who fumbles it and lets the ball roll into the covers"
"down the track and Junaid Khan <b>drops</b> a straightforward chance. Doesn't get close enough to the pitch to loft it safely, and it goes hiiiigh in the air, towards long-off running in off the rope. He's sliding forward to catch it near his waist, and the ball just slips through his grasp"
"back of a length, sliding into leg stump, worked into the square-leg region"
"shortish, pulled through midwicket"
"goes on the back foot to a flat length ball, works it away to deep midwicket"
"length ball on middle stump, clipped to straight midwicket"
"back of a length, angling across to off stump. Defends with soft hands into the cover region to pick up a quick single"
"length ball on off stump, defended into the point region"
