"back of a length on middle stump, punched down to long-on. Just a single for Stokes"
"Archer bags a first-ball duck in the final. Pressure can make you do strange things. Another legcutter variation, full on middle, Archer does not spot it. He swings for the hills, deflects this slower ball off the pad onto the stumps"
"yorker just outside off, jabbed to the left of extra-cover. Stokes keeps the strike as Williamson swoops down on the ball"
"mighty full and outside off, not quite a perfect yorker, jabbed more or less straight to Williamson at extra-cover"
"Whacked over midwicket. Lord's raises itself to a massive roar. Boult ditches the yorker. Slower ball, full and outside off, in the slot. Stokes drops down to one knee and smokes a slog-sweep over midwicket"
"It's all happening at Lord's. Full-toss on middle, smeared away to deep midwicket. Guptill attacks the ball and sets himself up for a direct hit. It might have well been a direct hit had Stokes not inadvertently deflected it away with his outstretched bat, diving forward to save himself from being run-out. The deflection ensures the ball tickles away to the boundary. It's six runs in the end. Wouldya believe it? It's ridiculous"
"middle-stump yorker, Stokes backs away outside leg and stabs it down to long-off. Santner hunts down the ball at long-off and throws it to Boult, who takes the bails off in ice-cool fashion. Stokes had to go for the second, he had to be on strike, but Rashid is caught short by a long way. Gone for a duck without facing a ball"
"<strong>Holy Moly! It's a freaking tie</strong>. We're not done yet. We will have a Super Over to decide the winner of the 2019 World Cup. This is a full-toss on middle, Boult searches for the yorker, but can't get it right, hacked down to long-on. The fielder hares in, gathers the ball. Stokes tears back for the second, Wood dishes out a desperate full-length dive, but the throw is to the bowler's end and Wood is caught metres short"
