"wide outswinger on a fullish length, and Guptill gets down on his back knee and has a proper old slash at that. He's nowhere near connecting, and the umpire signals wide"
"back of a length, close to off stump, a bit of shape away. Gets back and across and defends towards cover point"
"fuller this time, curves away from the fourth-stump line, left alone"
"back of a length, straightens towards middle stump. Gets on his toes to ride the bounce and defend back down the pitch"
"back of a length outside off, doesn't quite come onto the bat for the horizontal-bat slap. Hits it hard into the ground and it rolls slowly into the point region"
"first runs off the bat, and it's a boundary. Back of a length again, not too much width, and a bit of extra bounce. Looks to punch off the back foot and it hits high on the bat, near the outside edge, and runs away quickly to the left of Ben Stokes at backward point"
"back of a length, a little closer to off stump, left alone"
"length ball, straightens a little towards top of off, defended to midwicket"
"similar length, a touch too straight, worked off the hip to fine leg"
"back of a length on off stump, gets behind it to tuck it towards square leg. He wants one - the fielder is pretty much on the edge of the circle - but Nicholls sends him back"
"length ball, nips back a little towards middle stump, worked away to the left of long leg"
"got him, what a beaut! Or did he edge that at all? Squared him up in defence with late movement from the shorter side of a good length, on a tight off-stump line. Replays show the ball has sneaked past the outside edge and <b>hit the pocket of Guptill's trousers</b> on the way to the keeper. England trust in Marais Erasmus' not-out decision and decide not to review, wisely so."
"length ball on off stump, blocked back to the bowler"
"back of a length on leg stump, tucked off the hip to square leg"
"slants this one across, pitching just outside off on a fullish length. No swing back in, and Nicholls ignores it"
"ooh, this one does come back in, and Kumar Dharmasena doesn't wait too long to raise his finger to Woakes' lbw appeal. <b>Nicholls reviews</b>. Lovely length, fullish but not full enough to bring out a proper front-foot stride, and Nicholls is stuck on the crease, playing down the wrong line, looking for the straight-bat defensive push to mid-on. Beats the inside edge, and hits back thigh pad. The ball pitched on a middle-and-leg line, and straightened, but the bounce would have <b>taken it over the stumps</b>, according to ball-tracking. Wow!"
"length ball, straightening towards middle and off. Gets in half a stride this time and defends, with ball hitting the inside half of the bat"
"a touch shorter on off stump, worked away with the swing through square leg"
"back of a length, this one keeps going with the angle, pitching on middle and finishing just outside off stump. Gets nicely back and across to defend into the covers"
"back of a length, a bit of nip back towards off stump, defended into the on side off the back foot"
"digs this in short, rising shoulder high outside off, and Guptill stays leg-side of the ball, lets the ball come to him, and deliberately slices underneath the ball to uppercut over the boundary fine of third man"
"back of a length outside off, left alone"
"wham. A shimmy out of his crease this time, and he converts Archer's length ball into a half-volley, and extends his arms through the line to drive it back past the startled bowler, at shoulder height"
"length ball, angling into middle and leg, tucked away to fine leg"
"length ball on leg stump, stays on the back foot and pushes to the left of midwicket, with a straight bat, for a quick single"
"fullish, slanting across into the fifth-stump channel, left alone"
"shortish outside off, jumps up to ride the bounce and chops it down to third man"
"fullish, angling into middle stump. Guptill comes forward and plays a little uncertainly, looking to clip through the leg side while playing for a bit of outswing. Doesn't swing, and a thick inside edge runs away towards long leg"
"shortish outside off, jumps up again and jabs to backward point"
"length ball slanting away from off stump, gets a stride forward and punches towards backward point"
length ball attacking the top of off stump. Gets back and across to defend into the covers
"back of a length on off stump, uses his wrists to tuck it into the short midwicket region and they immediately set off for the single, with the bowler having to run across and field it himself"
"back of a length, fairly close to off stump, hops across to push into the cover point region"
"length ball on middle and leg, clipped away through backward square leg"
"length ball on middle and off, defended towards mid-off"
"good ball, a bit of movement in from just short of a length. Pitches on about leg stump and straightens from there. Looks to work it through the leg side and the ball beats his inside edge and hits thigh pad"
"similar ball, back of a length and straightening towards middle and leg. Tucked away to the left of midwicket this time"
"length ball, swings back in late, towards middle and leg, as Nicholls looks to push forward and defend. Inside-edge onto pad, and runs away wide of second slip"
"Given! And Guptill consults with his partner for an age before reviewing with a couple of seconds left on the clock. Length ball, nips back in off the seam, and Guptill, looking to drive on the up through mid-off, is beaten on the inside edge. Hits the bent back leg, just above the flap of the pads. Impact is in line with middle and off, and the ball is hitting middle stump two-thirds of the way up. Why did he review that if there was no edge? Chris Woakes gets the first wicket of the World Cup final, with a lovely delivery that went off the seam in the opposite direction to how he usually swings it"
"greets him with a fifth-stump outswinger, and Williamson gets on the front foot and leaves it alone"
"again the line is fifth stump. A good-length ball with a bit of late outswing, and Williamson won't be tempted into playing at it"
"length ball angling into off stump, defended off the front foot into the point region"
"ooh, lovely. This one's not as full as the previous ball, and it's pitched in the fourth-stump channel. Williamson is unsure whether to play or leave, and he kind of ends up halfway between the two as the ball straightens past his outside edge"
"shortish, and there's some extra bounce at 145kph. Straightens into Nicholls from a middle-and-leg line, and the ball beats the inside edge of his defensive bat and hits him on the stomach"
"back of a length, close to off stump. Jumps back and across to defend, and the ball straightens and hits the inside half of the bat and rolls gently between his legs. He has no idea where the ball is, but Williamson calls for a quick single and he immediately responds"
"short ball, rising to shoulder height in the corridor outside off, Williamson leaves it, swaying his upper body out of the way"
"ooh, that's massive outswing, most of it after passing the edge. Lovely length, fourth-stump line, and Williamson is half-forward to defend, and the ball swings past the edge and then swings some more before reaching the keeper"
"bouncer, rising steeply and without apparent effort over middle and off. Ducks his head and shoulders hurriedly out of the way"
"length ball close to off stump, defended with soft hands into the cover point region. Thinks of the quick single, but the fielder rushing in makes him decide against it"
"length ball slanting across to off stump, defended to mid-off. Not much footwork there, just played that from the crease while staying nice and compact"
"this one isn't compact at all. Back of a length, widish line outside off, and he has a big slash at it away from his body and misses"
"back of a length, straightens into the fourth-stump channel, gets back and across for the straight-bat punch down the pitch"
"overpitched, but Nicholls can't find the gap with his drive. Hits it to the right of mid-off, not far enough to beat him, and sets off for a quick single. Has to stretch at the end to beat Roy's throw at the non-striker's end. Doesn't hit the stumps and he'd probably have been just in anyway"
"good-length ball with a bit of outswing, just outside off stump. Gets forward, head over ball, and defends with soft hands"
"back of a length outside off, left alone"
"length ball close to off stump, gets behind it and defends back to the bowler"
"this isn't the easiest pitch to bat on. Back of a length, straightens into Nicholls from a leg-stump line with a bit of extra bounce. Beats the inside edge of his attempted flick and hits him on the thigh pad"
"length ball wide of off stump, looks like the offcutter, but it pitches too wide to make Williamson play"
"length ball angling into off stump, leans forward and meets the ball right under his eye to tuck it gently to the right of midwicket"
"appeal for lbw, and Nicholls shows the umpire his bat. Bounce may have taken it over the stumps too. Pitches just short of a length on middle or thereabouts, and straightens in past the back-foot defensive. May have kissed inside edge through to thigh pad"
"length ball on middle and off, defended back to the bowler"
"back of a length, nips in a little but down the leg side. Williamson thinks of a flick, but decides to lift his bat over his head in the end"
"back of a length outside off, chopped down to third man"
"a bit of movement in from outside off. Nicholls shuffles across to work it leg side, but the ball beats his inside edge and hits his pad"
"rare gimme ball. Short and wide, and Nicholls slaps it away to the left of backward point"
"and Woakes goes wide again, fuller this time. Gets on the front foot to slap to the newly stationed deep point fielder"
"back of a length, nips back slightly towards off stump, goes on the back foot to defend back to the bowler"
"length ball, fifth-stump line, left alone"
"fullish on off stump, met with a checked drive to mid-off"
"length ball close to off stump, gets forward for the push to the right of extra-cover. Woakes' throw at the keeper's end has no one backing up inside the circle, and they run an overthrow"
"back of a length, nips in off the pitch as Nicholls goes back and across to try and work it leg side. Hits his thigh pad again"
"short, gets up to about chest height outside off stump, pulled away to the right of deep square leg"
"full outside off, drives firmly but straight to short extra-cover"
"full and on the pads, flicked away to the left of deep square leg"
"length ball close to off stump, defended into the point region"
"full outside off, lets it come on and plays a checked drive to short extra-cover"
"back of a length, ends up slanting a fair way down the leg side, past the attempted flick off the hip"
"ooh, lovely delivery, the nip-backer from a perfect length, against the slope. Height the issue, though, as Williamson steps across to defend and is beaten on the inside edge"
"a bit fuller on off stump, driven firmly back to the bowler"
"length ball close to off stump, shuffles across and dabs to backward point"
"fullish, angling into off stump, defended to short extra"
"length ball outside off, his weight isn't fully forward as he looks to drive through the covers, ends up slicing it towards third man"
"short and wide, and he gets across to cut, but straight to backward point"
"ooh, offcutter on off stump, on a fullish length. Comes forward, initially looking to drive down the ground, and catches up with the offcutter a little late with a twirl of the wrists. Runs away through square leg off the inside half of the bat"
"shortish outside off, chopped to third man"
"another offcutter, back of a length outside off. Stops on Williamson and he chops it away to deep point"
they've taken a bunch of singles and Plunkett's had to keep changing his angle as a result. Sends down a full one on the pads and Nicholls puts it away with a flick to the backward square leg boundary
"full, wide outswinger, and Williamson chases it with a big drive and misses. Harsh call of wide, maybe"
"wide-ish line again, more outswing, but this one's shorter. Williamson has an uncharacteristic jab at it away from his body, and misses"
lovely. Angles this into the fourth-stump channel and swings it away from a good length. Left alone
"full-toss, about half a stump high, angling into off stump and curving away late. Williamson flicks it back to the bowler - may have initially been aiming through midwicket"
"shortish, a bit of width, punched to deep point"
"fullish, swinging down leg, misses the flick and the ball rolls off the pad to fine leg. 153kph!"
"shortish, angling down leg. Looks to flick initially, and then decides against it"
"short, angling down leg but not as far. A little shorter than the previous ball too, and Williamson swivels to hook it fine, to the left of the keeper. I suspect it came off glove, but Williamson won't mind that"
"short and slanting into the hips from round the stumps, Nicholls sizes up this one on the back foot. Swivel-pulled away to the left of deep square leg. Has the sliding Stokes done his half at the boundary?"
"good length and outside off, blocked off the front foot"
"much fuller and outside off, driven through the line to mid-off"
"pitched up and outside off, another fluent front-foot drive, but can't get it past extra-cover"
"back of a length and angling into the pads, picked away between long leg and deep square leg"
"pitched up and holds its line outside off, Williamson leans into a charming front-foot drive but finds mid-off at the edge of the circle"
"good length and skids back in against the angle from over the wicket, 148ks, Nicholls is late onto it and is pinged on the thigh pad"
"shorter and angling away outside off, Nicholls rides the bounce and guides it to point"
"shortish and darts back in at off stump, Nicholls hops and jabs it away just wide of short midwicket to pick up a single"
"wide of the crease, back of a length and angling in at off, <strong>149ks</strong>, Williamson goes back and across, defensively pushing the ball down to mid-on"
"wide of the crease, even shorter at the body, Williamson leaps and fends a single to the right of mid-on"
"good length and tight on off, Nicholls replies with an equally tight front-foot defence, getting right behind the line and showing off his straight bat"
"tossed outside off, no turn either way, Williamson stretches out and drives a single down to long-off"
"pushed through on off stump, Nicholls goes well to jump across the stumps and paddle-sweep a single down to fine leg"
"Rashid dangles up a legbreak outside off, Williamson does not allow it to turn, venturing down the track and driving smoothly to long-off"
"slides on leg stump,looks like an attempted wrong'un, Nicholls brings out the sweep again. Rolls his wrists and strokes it to long leg"
"flighted on middle, Williamson doesn't get quite get underneath the length. Slices it in the air over midwicket"
"skids on outside off, spins away late, Williamson reads it and dabs with the break through point"
"chest-high short ball, slanting in from over the wicket, Williamson controls a pull to Rashid at long leg"
"short and angling across off, 145ks, Nicholls rides the bounce. He opens the face and delightfully punches it to the right of backward point, then beats deep third man to his left and sweeper to his right in the deep"
"back of a length and much straighter, Nicholls sits back and tickles a single through the square-leg region"
"wide of the crease, back of a length and holds its line outside off. There's a wide slip in place, but Williamson dabs it away past him and finds deep third man"
"<strong>lifter, rising steeply at the throat of Nicholls</strong>, on middle, the batsman leaps off his feet. Keeps his eyes locked on the ball and fends it off to cover"
"back of a length and skidding away outside off, Nicholls has an almighty swish with his feet rooted to the crease. The ball sneaks under his bat-swing"
"flighted on off stump, Williamsom stretches out, gets close to the pitch. In the previous Rashid over, he sliced under it, this time he nails it against the break in the air over mid-on's right. Four"
"full, drifts in towards off stump, breaks away, Williamson adjusts, opening the bat-face and dinking it to point"
"tossed up slower and higher on off, Williamson is forward to smother it"
"fuller and straighter, Williamson rolls his wrists and sweeps it flat to the right of deep square. Archer tidies up in the outfield"
"back of a length, flatter and outside off, Williamson jumps back and punches off the back foot to the covers"
"looks like a wrong'un, but it's short on middle, allowing Williamson to punch it down to long-on off the back foot"
"slightly overpitched and outside off, Williamson leans into it and drives with an open face. Carsessed through the covers. Bairstow slides to his right at the edge of the boundary and hauls the ball in. Top work in the outfield"
dug in short and skidding in to <strong>strike Nicholls on the thigh pad</strong> as he falls over the leg-side flick
"Nicholls jumps across off, gets closer to this short ball outside off and laces it away square of Rashid at deep third man"
"hip-high short ball outside off, swatted off the back foot to deep midwicket"
"shortish and slanting in around off from over the wicket, Williamson allows the ball to come onto him. Then opens the face so very late, and pats it away towards point"
"on a length and straightens a bit outside off, <strong>rare false stroke from Williamson</strong>. He aims to drive on the up, instead slices a thick outside edge past slip. It rolls down to deep third man"
"on the pads, Williamson picks it away to left of deep square leg. Archer is the boundary-rider there"
"tossed up slower and outside off, Nicholls uses his feet and scoops a drive to mid-off down the ground. Hundred up for NZ"
"flighted and turns in on off stump, Williamson quietly bunts to short midwicket's right. <b>Rashid isn't quite ripping the googly today</b>"
"here comes Nicholls: down the track, takes this full ball from middle stump and drills a drive to long-on"
"good length, starts on off and spins away a wee bit, jabbed back to the bowler"
"full on off, Williamson jabs it back to Rashid"
"on a length and angling across off, Nicholls stands up tall and punches serenely with a high elbow but can't get it past short cover"
"full and straight, tapped to mid-on. Nicholls and Williamson take on Archer's arm for an urgent single"
"pitched up and holds its line outside off, Williamson opens the face and creams it away, but Morgan swoops down on the ball at short cover"
"Plunkett thinks he has Williamson. Umpire Dharmasena does not budge. <strong>Morgan wants a  review</strong>. Good length, angling in towards off from over the wicket, kicking up and nipping away outside off. Williamson is undone by the cross-seamer as he drives at it fairly away from his body. Replays indicate that the ball moves away just enough, scratches the outside edge and Buttler gobbles that up. Plunkett returns to the attack and claims the prize scalp of Williamson. That's why England pick him ahead of Moeen"
"fuller and on middle, defensively pushed to mid-on"
"pitched up and holds its line outside off, Taylor inches forward and pushes it to cover"
"flighted on off stump, Nicholls bends forward and defends to cover"
"pushed through on leg stump, down the track and whipped firmly to long-on"
"wrong'un, full on middle, Taylor picks it off the pitch and turns it away through square leg"
"looks like another wrong'un, sliding across off, draws the outside edge and rolls down to third man"
"on the pads, picked away fine of short fine leg"
"on a length and breaks away outside off, Taylor stabs it away to the left of Rashid"
"short and wide outside off, lashed away straight to backward point"
"back of a length and angling across off, wristed away through backward square leg"
"good length and slanting in just outside off, Taylor presses forward and prods it to cover"
"much fuller and skidding in at off, Taylor gets into a tangle and pokes to cover once again"
"looks like another cross-seamer, but this does not bounce much. Short, outside off, but sneaks under Taylor's cut"
"back of a length and skidding in at off, Taylor gets forward, loosens his grip, and fends it back to the bowler"
"tossed on middle, Nicholls steps out, drives to long-on, and <strong>raises a solid half-century in the final</strong>"
glanced away through square leg for one
"flatter and on the pads, swept flat and hard to deep square leg"
"Taylor jumps down the track, gets too close to the pitch, and stabs it back to Rashid"
"Taylor jumps down the track once again, this time he bunts a single down to long-on"
"tossed up and spins in on middle, Nicholls leaves his crease and works a single into the midwicket region"
"fullish and on off stump, Nicholls solidly plays back to the bowler"
"even fuller and on a fourth-stump line, stabbed away off the toe-end straight of mid-on"
"pitched up and outside off, drilled away through the covers. Just one man in the deep on the off side. Stokes who is sweeping the boundary runs across to his left and cuts it off"
"back of a length and holds its line outside off, Taylor glides it down to deep third man"
"<strong>What a double-strike from Plunkett!</strong> Back of a length and swerves back in after starting just outside off. <b>It's the cross-seam variety once again</b>. A crease-bound Nicholls aims to punch through the covers off the back foot, but is cramped for room. He winds up dragging on. The leg bail is tipped off. Plunkett has taken down both Williamson and Nicholls"
"fullish and outside off, forward and driven down to mid-off"
"tossed on middle, Taylor aims leg-side and leading-edges it through cover-point"
"down the track comes Taylor, Rashid holds this one back. Taylor quietly knocks it away to the leg side"
"shorter and breaks in on middle, punched away through backward square off the back foot"
"flat and full on off, eased down to long-on for one"
"tossed slower and higher on middle, driven to Rashid's left towards long-on"
"wrong'un, chipped in the air but does not carry to short midwicket"
"good length and nibbling away outside off, Latham covers his off stump and shoulders arms"
"<strong>Plunkett hits that in-between length again</strong>, slanting away outside off, Latham looks to force the ball through cover and ends up inside-edging it onto the pad"
"shortish and angling across off, forward and tipped to short cover. Taylor sends Latham back"
"slightly overpitched and outside off, Latham leans into a handsomb front-foot drive, but Plunkett stops it with his boot"
"full and straight, driven away, but short midwicket throws himself to his left to intercept the ball"
picked off the hips towards long leg off the back foot
"short and dragged down outside off, forced to sweeper cover off the back foot"
"was that the googly? Skids in on middle, defended from a full length"
"pushed through on off, tapped back to Rashid"
"tossed outside off and breaks away, Taylor uses his feet and <strong>chips a drive in front of short cover</strong>"
"Taylor shows his ace early, ventures down the track. Rashid drags his length back and slips in a wrong'un. Chopped hastily onto the ground, it bounces over Buttler's hand, and <strong>Taylor gets away</strong>"
"faster and flatter on the stumps, patted down to long-on"
"short on off, whipped behind the leg umpire off the back foot"
short and angling into the body. Taylor hops and clips a single through square leg
"short and outside off, Latham has a slash.. and misses"
"fullish and on off, tapped back past Stokes"
Picked away through backward square leg once again
"short, wide, there's the release...or not. Flashed straight to backward point"
"fullish, on the pads, clipped to the right of midwicket"
a bit of flight on off stump and Latham is down the track to clip to long-on
"on the pads once more, clipped to deep midwicket"
"flat length ball pitching on middle and spinning towards middle, goes deep in his crease to whip to deep square leg"
"nice length, bowled pretty quick on off and middle, Taylor can't get a big enough stretch out to drive. Clipped watchfully to straight midwicket"
"tossed up a bit wider, gets forward for a push to short extra-cover"
"back of a length, fairly close to off stump, opens his bat face and dabs to backward point"
"short, gets up to about shoulder height outside off stump. Pulled round to deep square leg"
"not quite short enough for the pull, on off stump, but Taylor's quick hands come to his rescue and he swipes it along the ground to deep midwicket"
"ooh, good ball. Offcutter, angling into the fourth-stump channel and nipping away. Half-forward, looks to play the angle towards wide mid-on, ends up getting a thick outside edge down to third man"
"shortish, angling into Taylor's body, tucked off the hip to the right of fine leg. May have just come off the hip, in fact"
"slower ball, back of a length and wide of off stump. Called wide after Taylor misses the cut"
"this one nips away from the right-hander in the fifth-stump channel. Taylor leans over the ball for a push into the covers, ends up edging thickly down to third man"
"and he strikes first ball, and Taylor can't review because his old pal Martin Guptill used up New Zealand's only one. Length ball angling in from wide of the crease, and Taylor, shuffling across his crease, misses one as he plays around his front leg looking to work the ball square on the leg side. To me it seemed to bounce a fair amount, and it struck him above the knee-roll. Would that have hit the stumps? Marais Erasmus thought it would have... <b>Ball tracking says it would have missed the top of leg stump</b>."
"back of a length on off stump, defended into the extra-cover region"
