"<strong>he's prised him out!</strong> Dhanajaya has fallen to the trap. This was angled into the body from wide of the crease, he couldn't resist playing the pull but the pace is too quick for him to get control. Ends up top-edging it and Olivier, at fine leg, runs across to his left and settles underneath it to take a superb catch. Poor batting, poor execution right at the stroke of lunch."
"fuller outside off and driven handsomely through covers for a boundary, what a way to resume"
"short of length outside off and cracked away through point, Maharaj puts in the chase"
"a nippy bouncer around off, bowled slight wide of the crease, Lakmal does well to sway away from it"
"short of length outside off, taps it towards covers"
"short of length outside off, goes for the pull but manages only a semi-forehand, just gets it over Rabada at short midwicket"
"another short one, goes for the pull, gets a glove and ends up lobbing it in the air, de Kock sprints it to his right but the ball evades him"
"short again, pulls it over square leg this time, not in the control at all as he takes his eyes off at the point of contact"
"length around off and chips it straight to Markram at short extra cover, who takes it around face height. That's the third wicket for Steyn and Sri Lanka are 142 for 7"
"short of length, around fifth stump but doesn't bounces much, left alone by the batsman"
"bouncer this time, well-directed, Embuldeniya ducks under easily though"
"short of length outside off, hangs his bat out but luckily doesn't get an edge"
"short of length outside off, looks to duck but realises it's quite wide outside off"
"short of length at the batsman, he has taken his eyes off and looks to duck, struck on the helmet but looks okay"
"short of length down the leg side, pulls it towards fine leg but denies the single"
"short again, in the body, defends it from the back foot"
"length around middle and off, moves across and turns it towards square leg"
"bouncer again, but too high this time, sails over the batsman, called a wide"
"length ball on the pads, tucked away towards fine leg, takes the single, leaving Embuldeniya to face two balls"
"short of length, just outside off, Embuldeniya looks to defend but gets beaten"
"short of length in the rib cage, dabs it towards fine leg, but they deny the single. So Embuldeniya will have to wait for his first Test run"
"length around off, works it towards backward square leg but doesn't take the run"
"short of length outside off, swivels to pull it between two deep square legs gets a boundary, great timing and placement"
"short of length outside off, rises on the toes and defends on the off side"
"fuller, slower one outside off, looks to put bat on it, misses, awkward bounce to de Kock who does well to get behind it"
"bouncer, aimed at the batsman who ducks under"
"length around off and smashed in front of square for four, gets to his fifty, but that means Embuldeniya will be on strike in the next over"
"a bouncer as expected but down the leg side, Embuldeniya was once again looking to duck"
"length around off, stays leg side of the ball and defends it towards the bowler"
"length around middle and leg, defended down the wicket once again"
"short of length at the batsman, once again he takes his eyes off the ball and gets hit on the chest guard, this is not the way to play short stuff"
another bouncer but this one is high enough for Embuldeniya to duck under without getting hit
"short of length outside off, gets behind it and defends it on the off side"
"length around off, lofts it towards long-off, not the best of the timings, both batsmen were almost crossing each other midway before Perera sends his partner back"
"length around off, defends it towards covers"
"fuller outside off, backs away and looks to loft it over extra cover, ends up slicing it instead, Hamza is halfway at deep extra cover, makes good ground to his left before pouching it"
"back of length on middle, stabbed away from the crease"
"beauty! Just nibbles around off stump, zips past the outside edge as he plays inside the line"
drops his wrists and gets out of the way of this short ball
stands tall and punches this into the gap behind point
"pokes at a lifter outside off, beaten for pace"
bunts this down the ground for an easy single
"angles a length ball across, he opens the bat face to steer this wide of fully. <strong>Off the mark in Tests, finally.</strong> Has taken some painful blows along the way. Two hits on the helmet."
looks to tickle this length ball fine but misses. Swerved away so late that de Kock had to put his left glove out and then dive to stop that.
"banged in short, he looks to pull, top-edge and over the slips to the third man boundary"
hops back and blocks
jabs this into the gap at point
mistimes a drive to mid-off
"takes his eyes off this bouncer and gets rapped on the glove. Living dangerously, <em>he's going to have bruises all over his body tonight at this rate</em>"
hops back and blocks this length ball on the stumps
"beauty! Another short ball on middle, somehow manages to get his gloves out of the way."
beaten as he attempts to glide this short ball over point
right onto his toes as he blocks
stays besides the line to defend this 138kph length ball
"right into the blockhole, jams his bat down to squeeze it past the bowler"
"length on leg side, misses the tickle. Thuds into de Kock's gloves"
beaten on the pull as he tries to fetch one from outside off
"short ball, quick, Rajitha scrambles to block"
jabs this by getting besides the line
jumps across and defends this bouncer
worked off his hip to fine leg
"short of length on off, kept out"
squared up by one that leaves him late. Cracking delivery!
hops to the leg side to defend this length ball on off to the covers
"attacks the stumps but strays down leg in the process, tucked to long leg"
"this time he works this to the left of short leg. <em>Uppish, wasn't in control but gets away</em>"
"too short and down leg, misses as he attempts a glide down leg"
"opens the bat face slightly as he hops back, squirted wide of gully"
"excellent bouncer aimed at the arm pits, Lakmal looks away and tries to get the bat out of the way as he tries and blocks and is hit on the elbow"
"hurried by this super sharp short ball. Caught between a short-arm jab and a leave, ball thuds into the top part of the bat and lobs to the off side"
"too much width, he punches this on the up, the timing so sublime that the cover point fielder gave up the chase very early. Beautiful"
"<B> No gully, and four! </B> Edged and into the gap between third slip and point. Steam coming out of Steyn's ears"
gets on top of the bounce and blocks
"jabs hard, lobs into the off side but no one to catch that close, at silly mid-off"
tucks this behind square for an easy single. Long leg comes in to stop
"looks to get besides, manufacture room and upper cut, but is beaten for pace"
"right into the blockhole, kept out"
punches into the gap at extra cover as they scamper a run
"too short and down leg, avoided without much fuss"
"angles a short ball across, defended with soft hands"
"awkward fend to a bouncer, briefly in the air but lands short of short leg."
"length around off, stays back and pushes it towards backward point"
"short of length around middle, fends at it and gets struck near the armpit"
"<b>Elgar has put it down.</b> It was a short of length outside off, Rajitha fends and spoons it towards gully, Elgar cannot hold on to that"
"short of length at the batsman who takes his eyes off once again and gets hit on the helmet. Physio is out and is tending to him, he looks fine. A change of helmet it seems."
"short of length outside off, in the corridor, left alone"
"short of length around off, stays back and drops it towards point, steals a single"
"short of length around middle and leg, pushes it towards covers"
"short of length around middle this time, stays back and defends it back"
"length around middle and leg, angling away from the batsman, pushed towards point"
"a bouncer from Rabada, but down the leg side, Embuldeniya stays away from it"
"almost a yorker around off, does well to get his bat down in time, on the full and off to the shoe"
"fuller again, just outside off, looks to push at it, gets beaten"
"short of length but down the leg side, looks to tuck it away, misses"
"short of length on middle and leg, tucks it away in front of square, scampers back for the second"
"short of length on middle and leg once again, looks to work it on the leg side, misses and the ball lobs towards silly point off the thigh"
"short of length in the rib cage, gets on his toes and drops it down"
"short of length down the leg side, helps it towards the left of the keeper for one"
"short of length outside off, some room as well, Embuldeniya goes for the cut but misses out"
"length around off, Rajitha is stuck in the crease, pushes at it and gets beaten. Wasn't far from off stump either"
"short of length outside off, pushes at it, the ball hits the outer half and bounces well in front of the point fielder"
"<strong>and a run-out finally breaks the stand!</strong> Short of length on middle and leg, Rajitha drops it towards short leg and looks to set off for a single but Markram collects it and breaks the stumps with a direct it. The batsman tried to get back but the throw beat him"
"fuller around off, pushes it towards extra cover for a quick single"
"length around off, stays the leg side of the ball, steers it towards backward point"
"a bouncer but way outside off, stays away from the line"
"short of length around middle and off, Embuldeniya bends his back and looks to dab it over slips, fails to connect"
"short again, outside off this time, steered towards backward point"
"fuller around off, stays back but smashes it hard but silly point comes in the way and takes a blow on his right leg, Markram there"
"short of length outside off, once again takes his eyes off and looks to duck, but this is well away from him"
"short of length at the batsman, who looks to pull it away, misses"
short of length at the batsman who backs away and ends up pushing it back towards the bowler
"sliding down leg, worked to fine leg"
"slips in a yorker, just whizzes past the off stump as he tries to squeeze this into the off side"
"gloves it to the keeper? Nah, not quite. Umpire reckons it brushed the shoulder. Good bouncer"
"looks to belt it over the bowler's head, no timing. To the bowler on the bounce"
"full toss angling away, throws his bat at it and gets a thick edge that races wide of point."
beaten on the pull. Looked to clobber it high but got no bat. Too much pace to try that
ducks under this bouncer on middle
"looks to sway out of the way but dangles his bat out, almost as if to play an upper cut. Misses"
beaten as he has a waft at a length ball outside off
"full and straight on the stumps, he's squared up anticipating a bouncer but somehow manages to get behind the line and block"
"beaten as he wafts outside off, top bowling"
drops his wrists and gets out of the way of this bouncer
"beaten high and dry, superb full delivery. Suckerpunched him nearly. <em>Goes to the batsman and fist-bumps him.</em> <strong>This was 147kph</strong>"
"makes room to loft over cover, ends up mistiming it and Steyn does well to move to his right from mid-off to pluck that."
"short of length on the pads, tucks it away towards fine leg and gets off the mark"
"back of length around off, stays back and defends it on the off side"
"length around off, leaving the  batsman after pitching, left alone by Markram"
"short of length outside off, rises on his toes and punches it through covers for a couple"
"short of length around, stays back and defends with a straight bat"
"short of length outside off, punches it through covers again, two more for Markram"
"fuller but way outside off, left alone, dies on its way to the keeper"
"length outside off, wide again and moves further away after landing"
"short of length around off, leaves the batsman once again after landing, no shot attempted"
"short of length outside off, leaves it alone once again"
"length, in the corridor, lets it go through the keeper, nice carry to Dickwella"
"length around off, once again a hint of swing away, Elgar covers his off stump and watches it all the way into the keeper's gloves"
"length around off, punched towards extra cover, a good stop by the fielder, jumping to his left as it bounces off the practice pitches"
"short of length around middle and leg, flicked away but straight towards short midwicket"
"short of length outside off, punched off the back foot past the mid-on fielder for four"
"short of length around off, pushes it towards square leg for a quick single"
"back of length outside off, punches it from the back foot through covers, flicked just inside the boundary line by the chasing fielder"
"short of length outside off, in the corridor, shouldered arms"
"length around middle and off and leaving the batsman, Markram was looking to push at it, gets beaten"
"back of length but way down the leg side, Markram looks to whip it away but cannot reach there"
"fuller around off, comes forward and pushes it towards sweeper cover"
"length around off, once again moving away from the left-hander, left alone"
"fuller outside off, once again left alone by Elgar"
"short of length this time, keeps coming in with the angle and puts Elgar in a tangle, dabs it on the leg side"
"length around off, in the corridor, left alone"
"length again, once again sixth stump line, comes forward and shoulders arms, hardly any swing for Lakmal"
"fuller but way too outside off, some movement away from the batsman as well this time, left alone"
"length around off, transfers his weight back and lofts it over midwicket, the ball stops inside the boundary lone, just after landing"
"short of length outside off, angling away, left alone"
"length around off, comes forward and defends it right under his eyes"
"fuller but way outside off, left alone by Markram"
"short of length on middle and leg, tucked away towards square leg, a diving stop but the fielder to his right to keep it a dot"
"once again on the pads and this time Markram hits it squarer, gets a couple of runs to deep square leg"
"length ball around off and middle, Elgar looks to turn it on the leg side, gets an outside edge that falls well short of second slip and goes towards the third man boundary"
"back of length around off and middle, defended back towards the bowler"
"length but down the leg side, flicked away towards fine leg"
"length but sixth stump line, Elgar is not chasing that"
"length ball on fifth stump this time, shouldered arms once more"
"short of length outside off, Elgar pushes at it but gets beaten, this one was bowled wide of the crease"
"length outside off, left alone by the batsman this time"
a touch fuller and much closer to the batsman who comes forward to defend and gets beaten as the ball just wobbles away
"fuller around off and swinging in to the batsman who misses the flick and is rapped on the pads, looked like an inside edge was involved"
"loose delivery and punished! Gets onto his toes, uses the width and flays this into the gap at point"
"in the good-length channel outside off, gets it to nip away, left alone"
edged but falls short of gully.
"straightens this off a length on middle, tucked with a straight bat to shortish midwicket"
half-stop at cover prevents the boundary. Nice high elbow as bat met that half-volley
"nice and full just around off stump, defended."
"lifter off a length on middle and leg, worked wide of square leg"
"nice and full, forcing the batsman to drive, but Elgar happy to leave"
"attacks the stumps with a full delivery, defended to the leg side."
"gets this to straighten off a length on off, he gets onto his toes and defends"
gets this to bend back in late but he defends with soft hands with bat close to the pad
squirts this full delivery on off into the off side.
"length outside off, left alone"
"width outside off, slashed to deep point. Fernando misfields on the slide to allow the second"
checked his shot but the timing is so good that it beats mid-on. So good to watch. Just a punch but didn't go through fully.
"nice and full outside off, hint of away movement as he authoritatively defends."
"goes full, moves away late but he tucks this nicely to mid-on"
"<strong>ugly poke, great catch!</strong> Swing, bounce from a length around the fifth stump, Markram goes on a fishing trip but is late on the stroke, gets a thick edge and the second slip fielder takes it well with his palms facing upwards. Had to move to his left but did really well. Relief for Sri Lanka"
"back of length outside off, left alone"
"poke and a miss. Goes for it away from the body, <strong>so close to the edge</strong>"
"squirts it off a thick outside edge past gully, streaky runs"
invites the drive by pitching it up again but Elgar is happy to leave
"pulled but not in control, rolls to deep square"
gets on top of the bounce and defends.
"leans into the drive and caresses this into the extra cover region. Good work by Kusal Perera to give it chase and them come up with a dive like he would at the pool to cut that off. All to save one run, good commitment"
"slips this down leg, misses."
easy pickings as he flicks this leg-stump half-volley to long leg
"full and wide outside off, left alone"
reaches out and then carves this into the gap at cover. Feet glued to the crease but the power in his wrists and hands helps squeeze that away for runs
reaches out to drive this wide of cover for a single
squared up by the length but manages to defend
"full, nibbling away outside off, left alone"
gets besides the line to punch this into the covers
"slants one back in towards middle and leg, Amla late on it but defends nonetheless"
flicks this wide of square leg for an easy single
gets half-a-stride in and blocks this length ball going away
"length but way outside off, left alone"
"length, just outside off, forcing Amla to play at it, and beating him as it moves just away after pitching"
"length on the pads, flicked away towards the left of the fine leg fielder"
"length around off, angled in towards the batsman who dabs it towards short midwicket"
"short and wide and Elgar cuts it between cover and point, more like a steer than a cut to be honest as he gets on the top of the bounce"
"short one outside off this time, Elgar drops his hands and sways away"
"tossed up around off, Amla comes forward and looks to defend, wasn't to the pitch of the ball, a thick outside edge goes past the slip, lead has gone past 100 now"
"length around off, waits for it before dabbing it towards slip"
"tossed up around off once more, comes forward and defends"
"length around off, Amla hangs back and pushes it towards covers"
"length around middle and leg, goes back and turns it towards square leg"
"fuller on the stumps, lunges forward and offers a dead bat"
"fuller around middle and leg, clipped away towards deep square leg"
"fuller and going across, in the corridor, Amla comes forward and leaves it alone"
"length but way too outside off, goes almost parallel to the ground after pitching as once again Amla shows no interest"
"length around off, goes back and punches it towards cover"
"fuller around off, comes forward and defends"
"length in the corridor, left alone, some extra bouncer there for Fernando"
"length around off and middle, flicked towards short leg"
length on the stumps once more. Flicks it on the right of the fielder under helmet this time
"length around off, comes forward and blocks"
"fuller on the stumps, uses his feet and drags it towards long-on"
"length on the stumps, pushes it towards square leg"
"fuller on the stumps, pushed down the wicket"
"short of length outside off, Amla gets on his toes and punches it exquisitely through covers, the backward point fielder puts in the slide but cannot prevent the boundary despite reaching there"
"short of length outside off, some room there this time and Amla cuts it ferociously past the gully fielder for four more"
"length around off, dabs it towards gully, no run this time"
"length, wide outside off, Amla goes for the cut again but misses this time"
"length, much closer to the off stump this time, Amla goes back and across and blocks"
"short of length outside off, left alone"
"tossed up around off, comes forward and defends"
"length on middle and leg, turns it towards square leg to get to the other end"
"tossed up around off, comes forward and defends"
"length on the stumps, uses his feet but not to the pitch of the ball, chipped uppishly towards square leg"
"skips down again, to the pitch of the ball this time, flicked towards wide long-on"
"length around off, Elgar stays back and defends it carefully"
"<strong>hits it straight to gully</strong>. Short of length outside off, Amla goes for the cut but fails to keep it down and a good catch by Thirimanne at gully, Amla was looking all set, a soft dismissal of sorts"
"length around off, punches it towards backward point"
"length around off, in the corridor, left alone"
"short of length outside off, looks to defend, a thick outside edge takes the ball towards third man, off the mark"
"fuller outside off, drives it between the stumps and the non-striker, Fernando tried to stop it with his foot but too far away, Bavuma though was quick to dive back"
"length around off, pushed to cover"
toe-ends this sweep back down the pitch as he premeditates a sweep in front of square
"tossed up on middle, defended back"
"nice flight to draw him forward, smothered"
eases it with the spin to mid-off to shouts of <em>niyamaai niyamaai</em>
"fired full, he goes back and across, blocks"
"drifting into middle and leg, tucked wide of square leg"
"off a thin inside edge, but <b> doesn't carry to Dickwella! </b> Was looking to punch on the up but this kept low and also cramped him for room."
"excellent angle across, left alone. Close to the off-stump channel"
"width on offer, but Bavuma doesn't bite the bait"
"touch ahead of length and slanting away again, excellent leave"
punched into the gap at point for an easy single
"looks to tuck it square, hurries onto him and thuds into the top part of the bat."
check-drives to cover. Nice dip that time
"<strong>big appeal and given, don't bother reviewing!</strong> Looks to sweep by getting outside the line, but the ball drifts in a long way to beat the bat and pin him on the pads. The only question was if it would've missed off, but this has been given out on the field, at max this will come back as umpire's call. Replays confirm there wasn't any glove on it, even though the ball was very close to this. Ball tracking also confirms this would've gone on with the angle to hit middle of middle. Another huge scalp and Sri Lanka re chipping away. Hawkeye confirms this would've hit off-stump"
"nice flight, lands on middle, kept out"
punched to cover
draws him forward and beats him with zip and turn
lunges forward and bunts this down to short mid-on
driven on the up to extra cover
looks to drive but lets it go in the end
goes right back into the crease and blocks
"too short, way over the batsman's head, avoided."
"slants this one down leg, avoided again"
"slants one full on the stumps from wide of the crease, worked into the leg side"
"<strong>has he dropped this at slip?</strong> Oh dear, tough tough chance. Kusal lets this through his hands even as he bent low to grab this. Drew Elgar forward, poked at it with an angled bat, flew low but he got both hands to this. Don't think he needed to dive at all. <b> Big opportunity missed </b>"
driven through the line to extra cover
"lands this full on off, defended as he covers the spin"
"sharp turn from middle, defended back"
"steps out but gets too close to the ball, squeezed past the bowler"
lunges forward and turns it with the spin to short midwicket
"nice flight, worked with the spin to the leg side"
"has a big slash at a length ball slanting away, misses."
gets besides the line to bunt it into the off side
stands tall and bunts this short of length delivery to extra cover
"touch full on middle and leg, tucked into the leg side"
"reaches out to slash that away, races to the boundary. Looked like he got the toe-end, Faf is looking at that part of the bat, but gets the result he desired"
cuts him into two halves with one that ducks in off a length. Superb
works this wide of midwicket
"steps out and eases to cover as they scamper a very risky single. A direct hit at the bowler's end may have made it interesting. Okay, replays confirm Faf would've been saved by the dive anyway"
"dip and turn to take the inside edge, lobs high but there's no one at leg gully. Streaky run"
goes back and across to tuck this down to deep backward square leg
rocks back and punches this into the gap at extra cover. Races away
"slow turn on off stump, defended"
"length, just around the fourth stump, left alone by Elgar"
"short of length around off, some extra bounce to hit Elgar high on the bat as he looks to defend it, the bottom hand comes off the handle"
"fuller around off, comes forward and blocks"
"length, in the corridor, left alone"
"length around middle and leg, pushes it towards square leg"
"length once again, in the corridor and shouldered arms"
"length around off, defends it from the back foot"
"tossed up on a length on the stumps, comes forward and pushes it on the off side"
"skips down again, not to the pitch of the ball, pushes it towards point"
"use of feet once more and works it towards short midwicket, du Plessis was halfway down but Elgar sends him back in time, and he was in before the fielder at short midwicket fires the throw in"
tucked away behind square leg for a single
"<b>caught and bowled!</b> Tossed up around off, Elgar comes down the track but the ball drops at him and he ends up hitting it to the left of the bowler. Embuldeniya takes a sharp catch around waist height"
