"short and just a shade outside off, Root glides it behind Neesham at point"
"full and swings back in on middle, flicked in the air... but does not carry to Taylor at short midwicket"
"back of a length and wide outside off, Root slashes and edges it behind to Latham"
"banged in short and slanting in from outside off, Bairstow flashes...and misses"
lifter angling down the leg side as YJB ducks under it. Wide called
"splice-jarring length, the line is outside off, stabbed to cover"
"short and outside off, punched to the covers"
"overpitched and outside off, YJB laces it away but Williamson throws himself to his left at extra-cover to intercept the ball"
"chest-high short ball on middle, Root pulls along the ground to <strong>Guptill at leg-gully</strong>"
Root jumps on top of a short ball outside off and slices it away to deep third man
"full and wobbling in at middle, Root is caught playing around his front pad and falls over the flick. This seems to be heading down the leg side"
"Root loses his patience. He runs down the track, has a wild leg-side mow, and just collects thin air"
"Root searches for the release and instead edges de Grandhomme behind. Routine catch behind the stumps for Latham. Good length and swings away wide outside off, Root chases a drive, plays a long way away from the body and tickles it to the keeper. Credit to Henry too - he gave up just one run off 18 balls to Root"
length ball slanting across to off stump. Waits on it and dabs to third man to get off the mark
"length ball, a bit of inward nip towards off stump. Good stride forward to defend"
"another good length ball on off stump, and Bairstow blocks it back down the pitch, towards the non-striker"
"back of a length, angling across to off stump, stabbed towards backward point with an open face"
"length ball on middle stump, stays leg-side of the ball and steers it past the diving backward point fielder. Third man has a long way to run to his left, and they hurry through for two"
"full now, and Morgan plays around it while attempting to flick. No lbw appeal, because it pitched outside leg. Morgan's back foot is staying resolutely on leg stump, and possibly moving away as well. Moving from middle stump to leg stump, in fact, as replays show"
"bouncer now, over leg stump. Morgan ducks under"
"bouncer, homing in on Morgan's front shoulder. An ungainly whipped hook, manages to keep it down in front of fine leg"
"full, angling into middle stump, punched to mid-on"
"down the track and CdG floats a slower ball wide of off stump. Reaches out to try and launch it over mid-off, doesn't middle it, and it lands juust beyond Williamson's reach as he turns around and gives chase"
"slower offcutter outside off. Comes forward to try and dab behind point, ends up playing inside the line and getting beaten"
"down the track again and CdG bowls back of a length this time, looking to cramp Morgan. Jabbed into the covers"
"shortish, a bit of width, can't get that square cut past backward point"
"short ball on leg stump, leg-stumpish, pulled round to long leg"
"loopy slower ball, ends up as a full-toss on middle stump. Looks to whip it away but can't get it past short fine leg"
"shortish, tucked off the hips to fine leg"
"length ball outside off, and that's a beautiful shot from Bairstow, bat meeting ball on top of the bounce and whippy wrists forcing it past the cover fielder to his right"
"bowled 'im! Back of a length, close to off stump, too close to be trying to force away square on the off side. Jumps up to ride the bounce, jabs at it with an angled bat, and inside-edges onto his stumps. Ferguson now has more middle-overs wickets than any other bowler at this World Cup. He's gone past Mitchell Starc"
"shortish, too straight, whipped off the hip to fine leg"
"shortish on middle and leg. Morgan is leg-side of the ball again, hops to ride the bounce and block it back to the bowler"
"back of a length on off stump, jumps and punches to deep point"
"fullish, angling across to off stump, driven to sweeper cover"
"length ball, fifth-stump line, left alone"
"down the track and de Grandhomme hits a shorter length than Stokes wants. He ends up in no-man's land, looking to defend, and the ball straightens past his outside edge"
"looks to step out again, and de Grandhomme slides down the leg side in an attempt to cramp him for room with a full one"
"shortish, fairly wide of off, and Stokes plays and misses, looking to punch it square. Sticks in the pitch a little and nips away off the pitch"
"back of a length on off stump, blocked back to the bowler"
"down the track again and again de Grandhomme's length is shorter than Stokes would like, angling into him. Stretches out and blocks it back to the bowler"
"in the blockhole on middle stump, jabbed back to the bowler"
"back of a length on leg stump, stays leg-side of it, hops, and defends back to the bowler"
"that's a brute of a bouncer at 145kph, and it nearly decapitates Morgan as he falls over backwards, onto his backside, to evade it. The umpires are checking for something... Having a word with Morgan, checking if he's okay, basically. It <b>grazed his helmet</b> as it went through, and Morgan took his eye off the ball"
"full, too straight, misses the flick but picks up leg byes to the left of fine leg"
"back of a length on leg stump, stays leg-side of the ball and blocks it back to Ferguson"
"another bouncer, slanting across over middle stump this time, and Morgan can keep his eye on it and sway away. The bouncer is too hot to handle for Tom Latham, however, and it eludes his gloves as he jumps up, arms outstretched"
"back of a length on off stump, chopped to cover point"
"fullish, angling into middle stump, blocked back to the bowler"
"back of a length on off stump, stands tall and chops it away on top of the bounce, but this is a slow pitch and he can't really hit it square. Drags it to extra-cover"
"down the track again, and though he doesn't get close to the pitch of the ball, this time it's short enough for him to whip it away through square leg, with a strong swivel at the hips"
"back of a length on off stump, blocked back to the bowler"
"length ball, a bit of inward movement towards middle stump. Defended solidly towards midwicket with the straightest of bats"
"back of a length on middle stump, defended to mid-on"
"and he strikes first ball! Or he will have, if this catch is deemed to be clean. What a bit of work on the point boundary from Lockie Ferguson! Wide length ball, carved away in the air, and Lockie sprints in from the boundary, throws himself forward, and grabs it two-handed, perfectly clean, a couple of inches off the ground. The soft signal was out, but the soft signal doesn't matter at all, because the replays were so conclusive. We've seen some outstanding catches at this World Cup. This is among the top three. Or four. Or five. Or one."
"back of a length, angling into the legs, tucked away through square leg"
"length ball outside off, nice stride forward for a push into the point region"
"fullish, slanting away into a sixth-stump line. Go ahead, drive me, says Neesham. Stokes leaves it alone"
"again he angles across into that wide line, dangling it up pretty full. Again Stokes ignores the bait"
"ooh, what a delivery! Neesham was so delighted that it seemed initially like he was celebrating a wicket. Back of a length, slanting away before nipping back wickedly off the seam. Stokes doubles over as he jabs down on the ball, which beats his inside edge and soars over off stump"
"length ball on off stump, clipped to deep square leg"
"length ball outside off, opens his bat face to guide it to third man"
"length ball close to off stump, Buttler uses those wrists to work it to deep square leg"
"full, angling into middle stump. Holds up on the pitch a little, and Stokes is aware of the possibility and defends with the full face showing, to mid-on"
"back of a length on off stump, lets it come and defends"
"a bit fuller on middle stump, clipped to deep square leg"
"full, angling away into that wide line again. This time he gets a big stride forward and across to drive to the left of deep point. They run a second, and there's a brief recourse to the third umpire to see if Stokes beat the throw home to the keeper. He had, comfortably"
"full on off, driven to mid-off"
"length ball, straightens a touch towards off stump as Stokes comes forward to defend. Hits the inside half of the bat, high up, and ricochets into front pad"
"length ball slanting across towards off stump, gets half-forward to block down the pitch"
"down the track and Neesham bowls a back-of-a-length ball slanting across Stokes, who punches crisply to deep point"
"length ball outside off, nice stride forward for the checked drive to the right of deep point"
"length ball wide of off stump, left alone"
"length ball angling into middle stump. Stokes plays the checked drive to mid-on, and it hangs in the air briefly. The ball's stopping a lot now"
"back of a length, close to off stump, waits on it and dabs to backward point"
"length ball angling into middle and leg, clipped towards midwicket"
"back of a length outside off, punched to extra-cover"
"extra bounce, and was there an edge? No idea, but Latham puts it down, standing up to the stumps. Length ball outside off, and the bounce sneaks it past - or grazes - Stokes' outside edge as he looks to push into the covers with an angled bat. We'll need to see replays"
"back of a length, angling into middle stump, worked away through square leg"
"back of a length outside off, this ball on this pitch comes on to the bat too slow for Stokes to slap it through point, ends up hitting it to cover instead"
"down the track and that's serious power. Gets fairly close to the pitch of one angling away from him, and the angle allows him to free his arms. Flat-bats it hard past the bowler's right hand, making umpire Dharmasena take cover"
"shortish, down the leg side, can't connect with the flick off the hip"
"down the track again and Neesham shortens his length, bowls it at Stokes' body. Pulled off the hip to deep square leg"
"slower length ball outside off, Buttler gets a nice stride forward to drive, and short extra-cover dives left to stop it"
"back of a length, legcutter in the fifth-stump channel. Punched to deep point"
back of a length close to off stump. Looks for the push into the covers and it holds up on the surface and rolls through square leg off the inside edge
"fullish, angling into middle and leg. Looks to flick, closes his bat face early, and the ball goes rolling to mid-off off the leading edge"
"back of a length outside off, dabbed down to third man"
"length ball on off stump, punched to short extra-cover"
"ooh, what a delivery. Length ball, pitching outside off and nipping in like an offbreak. Comes forward to drive through the covers, leaves a gap between bat and pad, and it sneaks through and doesn't miss off stump by much. Ricochets off Latham's glove into the fine leg region"
"fullish outside off, not full enough for the big drive over the covers, and he slices it off the outside half of the bat, in the air, but safely short of third man"
"back of a length angling across to off stump, worked away through square leg"
"back of a length on off stump, worked with the angle to the left of midwicket, who makes a diving stop but lets the ball get away from him briefly, allowing the single"
"fullish outside off, shuffles across and blocks to short extra-cover"
"length ball slanting away from off stump, punched on the up to the off-side sweeper. Buttler's timed the ball better than pretty much anyone else today, so far."
"back of a length, close to off stump, dabbed to backward point"
"back of a length outside off, a bit of width to free his arms and drive to the right of mid-off"
"flat, angling away from off stump, and it goes on with the arm after pitching. Looks to cut, can't connect, may have been playing for turn"
"lovely length, slanting across to off stump, not much turn, blocked back to the bowler"
"flat length ball speared across towards off stump, stays back, opens up, and punches to long-on past a diving short midwicket"
"back of a length on off stump, goes back to work it towards deep square leg"
"floated across to off stump, a little slower than the previous balls. Waits on it and punches to long-on"
"loopy full ball on middle stump, clipped to long-on"
"back of a length, angling away from off stump, punched to deep point"
"back of a length on off stump, punched to the right of mid-off"
"ooh, in the air, but in the gap too. Short, not a whole lot of width, but Buttler gets off his feet, rides the bounce, and carves it away to the right of backward point. Guptill's the fielder there, though, and his athletic dive and one-handed stretch make it look like a chance when it probably wasn't"
"not short enough to pull, inside-edges onto the pad instead"
"fullish outside off, reaches out to drive to mid-off"
"back of a length, fourth-stump line, punched to the right of the cover sweeper"
"length ball close to off stump, stays on the back foot for a punch into the covers"
"flat, looks to bowl the lbw ball, ends up spearing it down the leg side"
"shortish outside off, slapped away to sweeper cover"
"length ball on middle stump, goes back for the punch to long-on but Guptill intervenes with a dive from short midwicket"
"on the pads, worked the other (left) side of Guptill towards deep square leg"
"nice length, flat one angling into middle and leg. Defended with bat well in front of pad - he knows the threat of lbw given how few balls he actually turns"
"length ball on the stumps, defended into the on side"
"down the track, and he ends up reaching for the fullish one slanted across him. Sliced in the air, on the bounce to the left of third man"
"down the track again and Henry shortens his length, pulled to the right of deep square leg"
"length ball wide of off, goes deep in his crease to carve to the left of third man"
"full outside off, gets forward for the drive to deep point to bring up the half-century stand"
"back of a length outside off, lets it come on and guides it down to third man"
"ooh. Back of a length, angling into off stump. Looks to work it with the angle into the leg side, closes his bat face early, and pops a leading edge back towards the bowler. Doesn't carry to him, though, despite a dive forward"
"skidding into the hips, back of a length, tucked away to the left of Neesham at short fine leg"
"shorter and sliding across off from round the wicket, jabbed away to the left of Neesham at point"
"non-turner on off stump, driven down to long-off off the front foot"
"tossed on the pads, knocked to backward square leg"
"pushed through on middle and leg, bunted down to long-on"
"slider on off, shortish, Buttler goes deep in the crease and whips it to midwicket"
"short and slanting in at off stump, Stokes stands up tall and punches to midwicket"
"back of a length and holds its line outside off, Stokes rolls out a back-foot punch to the off-side sweeper"
"slower variation from Henry. Back of a length, 121ks, cuts in, beats the inside edge as well as the off stump"
"Buttler plays around his front pad, trying it work it over the leg side, and falls over. Umpire Dharmasena shakes his head. Not given out lbw. Williamson challenges the on-field not-out decision. This seems to be heading down leg, though. Nicely pitched up, veers back in to ping the front pad below the knee-roll in line with middle and leg. Yup, that's missing leg stump and Dharmasena (finally) gets it right"
"short and angling into middle, punched past the right of Neesham at short midwicket. Ferguson swoops down on the ball in the outfield. Stokes is wary of it and sends Buttler back"
"shorter and outside off, punched through the line to the left of Neesham at short cover"
"short, wide, wider than a set of stumps outside off. Buttler brings his fast hands into play and rifles a cut behind point. Bam!"
"back of a length and outside off, Buttler has to reach out for the ball again, <strong>spliced in the air</strong> over point as this does not come onto the bat"
"short and angling in at the body from round the wicket, Stokes swivels on the back foot and pulls down to fine leg"
"pitched up and outside off, driven off the front foot to short cover"
"Ferguson runs in hard, hits the deck harder, back of a length on off, stabbed back to him"
"short and climbing in at off stump, Buttler hops and fends it off towards short midwicket"
"shortish and outside off, punched to the right of short cover"
Stokes runs at Neesham and is cramped by a short ball just outside off. Stokes aims to bosh it through the covers and instead sends an inside edge past leg stump to fine leg
"short and outside off, slower ball, Stokes leans back and smears it away to sweeper cover"
chipped in the air over the non-striker's head as this length ball on middle stops on Buttler and messes with his timing
"looks like a legcutter from Neesham, 115ks, Buttler checks his drive and chips it beautifully in the air straight of mid-on for four. <strong>Rousing stroke from Buttler</strong>"
"back of a length and outside off, Buttler clatters it through the line but finds cover"
"banged in short and slanting in just a shade outside off, Stokes leaps and rides it out to point"
"more short stuff from Ferguson, dug in outside off, Stokes rolls out the swivel-pull. Cracked hard onto the ground and the ball skedaddles away to the fence"
"back of a length and homing in at top of off, Stokes' tight defensive technique intervenes"
"full-toss, slanting in at leg stump, bunted to Henry at long-on"
"overpitched and outside off, shovel-driven with the bottom hand down to long-off"
back of a length and angling into a front-foot punch to mid-on
"just short of a good length and outside off, Buttler gets on top of it and laces it to sweeper cover"
"looks like the offcutter from Henry, grips and bounces outside off, Stokes arches his back and gets out of the way of harm"
"back of a length and on the hips, tucked away to deep midwicket"
"short at the hips, nudged through square leg for one more"
"back of a length and angling in on a fourth-stump line, no movement in the air or off the seam, forced down to long-on"
"<strong>There goes Jos the Boss</strong>. Third man is in the deep, but it does not matter as long as you can scoop the ball fine of him. Fullish and outside off, Buttler, premeditated, jumped a long way across off and Buttler-ed it away to the boundary. Buh-bye, Henry"
"mighty full and angling across off from over the wicket, stabbed back to the left of Ferguson"
"dug in shorter and fizzing away outside off, Stokes rises on top of the bounce and punches the ball to short cover"
"back of a length on middle, 145ks, Stokes jabs it right back to Ferguson"
short and shoved down the leg side. Is the pressure getting to Ferguson and NZ?
"short on the hips, Stokes picks it away to deep midwicket off the back foot"
"rapid bouncer outside off, 147ks, Buttler thinks about a hook, but bails out belatedly and rocks out of the way. Prancing delivery from Ferguson"
"slower full ball on middle, barely 125ks, tapped down to long-on"
"slower legcutter outside off, 112ks, Buttler smears it away to sweeper cover"
"full around off from round the wicket, whisked away but <strong>Taylor swoops down on the ball </strong>at short midwicket"
"full and angling into the pads, picked away between long leg and deep midwicket"
"<strong>terrific inswinging yorker</strong>, Stokes topples over and falls on the floor. But he manages to stab it out to the leg side"
"Neesham searches for another inswinging yorker, he misses it marginally, Stokes can't flick it away and wears it on the pad"
"slower, short ball outside off, Stokes sizes it up and smites it off the back foot to sweeper cover"
"short and angling across off, punched to Williamson hanging back at mid-off. Williamson can't throw the stumps down from the edge of the circle"
"a bit too full and outside off, Buttler drills it away straight of Henry at long-on"
"lifter, angling across off, 143ks, Stokes watches it before ducking under it"
"another top yorker on off, this time from Ferguson, jabbed down to mid-off"
"Buttler is a freak. Really full on middle, slower ball at 112ks. Buttler had jumped across off, but he delays his scoop and gets it away fine of long leg"
"full and wide, Ferguson cranks up to 148ks, Buttler reaches out for the ball and scythes it down to deep third man"
"fullish on off from over the wicket, struck to short cover off the front foot"
"pitched up and on off stump, Buttler clears his front leg and launches it like a bazooka. Up and over midwicket. <b>Buttler raises cool fifty under pressure</b>"
shorter and climbs steeply outside off as Buttler has a crack at it...and misses
"very full on middle, Buttler responds with a jabbing drive to mid-off"
"full-toss on off, stabbed down to long-on and <strong>Stokes gets to a half-century of his own</strong>. He barely celebrates"
"pinpoint leg-stump yorker, Buttler manages to dig it out to cover"
"slower ball on leg stump, shortish, Stokes swivels into a pull and drags the ball to long leg"
"full-toss outside off, Buttler gets his hands low once again and hoists it up and over a leaping extra-cover.<strong> Low hands, high impact from Buttler</strong>"
"Boult tears across from square-ish third man, slides on his knees and cuts it off. Outstanding work in the deep from Boult. This was the slower variation from Ferguson. Full and outside off, carved away. This was destined to reach the boundary until Boult intervened"
"lifter outside off, gets big on Buttler, who aims to force it through the off side. No dice. Beaten"
"It's <em>that</em> man Lockie Ferguson who breaks the stand and the game open for New Zealand. Buttler holes out to Southee, the sub, at sweeper cover. Slower variation once again from Ferguson, 123ks, full and outside off. He asks Buttler to manufacture the pace for himself. Buttler just skews it in the air. Southee initially misjudged the flight of the ball. He moved to his left, then to his right, then sprinted in to grab a pressure catch sliding on his knees"
"short and zipping away outside off, Ferguson ramps the pace and beats the outside edge. Stokes aims to dink it down to third man, but  nah you can't touch it"
"good length and angling in at off stump, gently dabbed to point"
"slower ball, full on middle, Woakes can't quite get underneath it. Hit straight of long-on"
"back of a length and angling in to catch the pad. Stokes has an almighty leg-side mow, loses his shape and does not make contact. Off the pad and wanders away towards point"
slower and wide outside off - wider than a set of stumps outside off - slashed away to sweeper cover
"slower ball outside off, Woakes stays leg-side of the ball and slices it down to deep third man"
"pretty full and slanting in at off stump, Stokes brings his bottom hand into play and shovels it away to the right of deep midwicket. Almost looked like the left-hander's version of Dhoni's helicopter. Muscled away"
"<strong>Two in two for Ferguson!</strong> Is this the game? Banged in short on off stump, rushes Woakes for pace, and draws a top-edge as the batsman sets up for a hook. The ball drops from the London skies, a nervous Latham makes a fairly simple catch looks difficult. He keeps his eyes on the ball and clings onto it in the end"
"short and angling across off, spliced to Williamson at the edge of the circle at mid-off"
"delightful offcutter from Ferguson, 122ks, grips and sneaks in, beating the inside edge"
"another slower ball on middle, picked away straight to midwicket"
"back of a length and angling into middle, Plunkett sizes it up and slugs it over midwicket. He absolutely middled that, Plunkett"
"Ferguson finishes his spell with another magical slower ball outside off, Plunkett does not spot it. He swings waaaaay too early, loses his shape, and watches the ball float to Latham"
"muscled away between deep midwicket and deep square leg. Boult searches for a yorker, but misses his length marginally. Stokes gets under it and launches it over the boundary like a boss"
"near-yorker on leg stump, squeezed away behind square. Henry hunts down the ball at long leg"
"length ball on middle, clubbed away to the right of long-on. Santner swoops to his right and collects the ball. He made a similar superb stop at the edge of the boundary against India. NZ are switched on under pressure. Stokes stands between them and WC glory"
"short and angling across off stump, Plunkett aims to bosh it over the leg side. He can't touch it and that's a dot"
"full-toss on leg stump, Plunkett pumps it in the air, but it does not carry to Santner at long-on. He tears across to his left and collects the ball"
"middle-stump yorker from Boult, squeezed down to long-on. Santner in the thick of the action once again. He hunts down the ball and keeps it to one"
"slower legcutter, finishes on leg stump, hauled away to the left of deep midwicket. Nicholls moves swiftly to his left and gathers the ball in the outfield"
"<strong>inch-perfect leg-stump yorker,</strong> floors Stokes, clipped to deep square leg. Neesham gets Stokes off the strike"
"Legcutter from Neesham, 114ks, Plunkett aims to launch it over long-off. Nope, he can't clear Boult at the boundary. This was full and outside off, Plunkett got underneath it and swung it in the air... but was done in by the lack of pace"
"Is that six? Yes it is! Crazy scenes at Lord's. Boult nearly pulls off a hokey-pokey catch at the edge of the midwicket boundary. He catches the ball near the boundary, but well the momentum takes his over the ad boards. His foot is on the ad board as he relays the ball to Guptill. Fine margins. It could have been a match-winning catch. Instead, it's a six. Stokes manufactures some swinging room, full on the stumps, Stokes belts it in the air..."
