"bouncer angling in and rising over off stump, Neesham ducks under"
"back of a length, angling into middle and off, defended into the covers"
"back of a length, angling into the batsman, who's standing on leg stump and not really going across his crease. Looks to work it leg side and misses, and the ball hits his thigh pad"
beauty. Angling into the fourth-stump channel and holding its line. Neesham again stays leg-side of the ball and looks to jab at it. The ball sneaks past his outside edge
"length ball outside off, with a bit of extra bounce. Slapped away to deep point"
"full-toss, about stump high, angling into leg stump. England are looking to deny Neesham any room here, they know he's looking to stay leg side of the ball, so they're angling it into his body. Is a little surprised by that ball and looks to jab it away, but can't put bat to ball and is hit on the thigh pad"
"back of a length outside off, chopped into the point region"
"too full on the legs, and Neesham clips it away neatly, leaving deep square leg sprawled on the floor after chasing to his right on the boundary"
"full, angling down leg, Neesham steps across and misses the flick"
"short ball, sits up at chest height outside off, and Neesham pounces on it. Opens up at the hip and pulls it away between mid-on and midwicket. Top shot"
"full, on middle stump, gets his front leg out of the way and drives with a straight bat to the right of mid-on"
"full outside off, driven crisply to short cover"
"length ball angling into off stump, gets nicely behind it to block it back to the bowler"
"bouncer rising over off stump, and Neesham gets out of the way, bending at the knees and pulling his head and shoulders away from the line"
"short outside off, pulled to the right of deep square leg, and now he pulls off a good diving save. Woakes the fielder"
"fullish outside off, not quite up there for the cover drive. Straightens a bit and beats the angled bat of Latham"
"back of a length on off stump, blocked back to the bowler"
"shortish, not too much width outside off to free the arms, jabbed to backward point"
"back of a length, straightens in towards middle stump. Probably another of those cross-seam balls. Jabs his bat down and the ball hits the inside half of it and drops a short distance away on the leg side. Latham calls quickly for the single, and Neesham responds immediately"
"slower length ball on off stump, lets it come on and dabs towards backward point"
"wow. That's back of a length, gets up to waist height on middle stump, and this is more of a flick than a pull from Latham, picks it up and dumps it one-bounce, over the backward square leg boundary"
"full now, on middle stump, clipped gently into the leg side, asking Archer to run in a fair distance  from mid-on"
back of a length on middle stump. Stays leg-side of the ball and jabs into the backward point region
"shot of the innings. Length ball angling into  a fourth-stump line, and he takes a small step forward, and transfers his weight perfectly into a checked push to the right of extra-cover that leaves deep point attempting a futile sprint to his left"
"excellent response. Similar length, but a touch shorter, and it straightens off the seam to beat the outside edge as Latham looks for another front-foot push"
"back of a length outside off, dabbed down to third man"
"back of a length, again it nips away slightly off the seam in the corridor. Neesham watches it well and plays late, dabs to backward point"
"good bouncer, only gets up to about neck height over off stump, and Neesham has to duck in a hurry to get under it"
"length ball on off stump, stays leg-side of the ball and jabs it away to deep point"
"ooh, that's not a great shot. Not short enough to pull, and it's too close to off stump to be playing across the line like that. Wasn't too far away after he missed"
"back of a length close to off stump, dabbed towards third man"
"length ball slanting away from off stump, punched off the front foot to deep point"
"length ball angling away from off stump, opens his bat face and glides it fine of third man"
"back of a length, pretty close to off stump, and Neesham plays that really well. Stands tall and forces it away to the right of extra-cover. Didn't have much room to free his arms, but he's easily beaten deep point to his left"
"boundary, wicket. There's that Plunkett cross-seamer that doesn't quite come onto the bat as expected. Fullish on off stump, but it sits up a little off the pitch, and Neesham just doesn't time that attempted loft over mid-on. Comes off the bat with a weird clunk, and Root takes a straightforward catch at mid-on. Three wickets now for Plunkett. What a final he's having."
"back of a length outside off, steered down to third man"
"back of a length outside off, de Grandhomme is off the mark with a chop to the right of third man"
"that ball is the definition of 'hard length'. It's pitched outside off, and de Grandhomme swivels into a pull, but it hits the bat jarringly high, and rolls gently to midwicket instead of pinging away to the boundary"
"full now, on middle and leg, clipped away with terrific timing to the right of deep square leg, where Bairstow makes a super diving save"
"back of a length, nips back in off the seam. Looks to dab into the off side for one, but ends up inside-edging into his thigh pad"
"fullish, close to off stump, jabbed to the left of extra-cover"
"back of a length, nips away like a legcutter in the corridor. No footwork from de Grandhomme, pokes at it and the feet follow after the ball has gone past his outside edge"
"bouncer over off stump, and de Grandhomme, who had initially shuffled across to get into position to hook, decides in the end to duck"
"slower ball on off stump, clipped towards deep midwicket"
"short ball angling away from off stump, pulled to deep midwicket. That's the extra fielder on the boundary - and two successive balls have been hit there, once by the right-hander and once by the left-hander"
"lovely slower ball, back of a length close to off stump. Again there's no feet from de Grandhomme, pushes at it and misses"
"ooh, well bowled. Fuller now, another legcutter, pitching on off stump. CdG looks to whip through midwicket, and at the last moment checks himself, and the ball squirts along the ground to short cover off the leading edge. End of a fantastic, and possibly match-defining 10 overs from Plunkett"
"length ball on leg stump, clipped to the left of mid-on"
"another legcutter beats the leaden-footed de Grandhomme's outside edge. Back of a length, in the corridor, and he simply pushes at it with his hands"
"ouch! Follows up with a slippery short ball on off stump. Gets up above the right shoulder, and de Grandhomme <b>top-edges his hook into the top of his helmet, just above the badge</b>, and the ball pops up in the air but safely to the left of backward point. Out comes the physio to check on de Grandhomme"
"full, angling away from off stump, driven to the right of mid-off"
"full on off stump, driven firmly and straight to mid-off, and they chase the quick single anyway. Makes it safely to the danger end in the end"
"slower ball, full, ends up outside leg stump, and Latham swings too early through the attempted flick"
"bouncer over middle and off, Latham ducks low to evade it"
"full on the pads, clipped to long leg"
"slower length ball on off stump, lets it come and dabs behind point with an open face"
"ooh, that's a difficult bouncer to deal with. Wide of the crease, angling into the stumps, and in the end it only probably gets up to shoulder height, and de Grandhomme ducks awkwardly. Hits his left shoulder and ricochets beyond the reach of the keeper trying to leap up to his left with one glove extended. Evasive action, so it counts as leg byes"
"drifts onto the pads and he clips it away towards long leg. They see it's Rashid fielding it and immediately decide on running two. The throw isn't the strongest, and Buttler has to leave his post by the stumps to collect it on the bounce"
"slower ball, back of a length outside off, chopped down to third man"
"shuffles across to off stump and Wood slants his short ball wider. Has to fetch the pull from outside off, from shoulder height, and he hits it uppishly, but fortunately for him without too much power, so it doesn't carry anywhere near deep midwicket coming in off the boundary"
"slower ball, fullish and on middle stump, clipped to the left of mid-on"
"slower ball, shortish, just outside off. Swings too early into the pull, and the ball hits him on the back and ricochets towards third man. Third blow to his body today?"
head-high bouncer over off stump. Stays leg-side of it and tennis-smashes it into the midwicket region
"slower bouncer outside off, and de Grandhomme sways out of the way. Not sure he picked the change of pace. Signalled wide, though, and that brings up New Zealand's 200"
"digs it in short outside off, extra bounce imperils the flat-bat slap, and he top-edges it, but the ball doesn't balloon far enough for Stokes, running in from point, to be able to catch it"
"he's hit on the back for the second time this over. Another slower short ball outside off, and again he swings too early on the pull. Runs away to third man for a leg bye"
"attempts the yorker this time, ends up bowling it down the leg side, past the attempted flick"
"third wide of the over. Bouncer, Latham ducks, but it's the line that's the issue - outside leg - rather than the height"
"back of a length on off stump, gets back and across and tucks it into the square leg region"
"slower length ball, angling away from off stump. Looks to step across and swipe it away through midwicket, but the angle only allows him to play it to mid-on"
"hits that hard length and slants it away from off stump. Can't drive, can't pull, so he ends up playing an in-between diagonal bat swat, and can't put bat to ball"
"what a shot. A touch too full this time, on leg stump, and he clears his front leg slightly and whips it up and over wide long-on"
"another blow to the body. Slower short ball, swivels through the pull too early and is hit on the stomach"
"bouncer, gets over shoulder height and he hooks a little uppishly, but into the gap to the right of fine leg. de Grandhomme wants the second, he's sent back, and a more accurate throw to the keeper might have ended his innings. As it happened, Buttler had to run towards the silly point area to collect, and then he spun around and threw the stumps down, and the batsman was juuuust in"
"bouncer, CdG ducks under it"
"back of a length on off stump, opens up and whips it away to deep midwicket"
"low full-toss on the stumps, and de Grandhomme gets his feet out of the way to whip to the left of deep midwicket"
"slower ball, full, on off stump, clipped towards deep midwicket"
"shortish, angling into the body. Looks to step across outside off and whip towards fine leg, but all he manages is glove onto thigh pad, and the ball lobs up gently and drops a few feet short of the keeper"
"looks to make room this time, can't get any power on this full slower ball on the stumps, jabs it along the ground to mid-on"
"slower bouncer over off stump, swivels too early through the pull and misses"
"full, slanting away from off stump, slower ball, driven to the right of mid-off"
"slower ball, back of a length on off stump, gets across to clip to the left of fine leg"
"back of a length on off stump, looks to work it wide of mid-on, initially, but adjusts once the ball straightens off the seam. Off the leading edge towards backward point"
shuffles across early and Woakes slants a slower length ball wider outside off. Swiped away to deep square leg
"another slower ball, on the fuller side of a good length on off stump, and de Grandhomme's struggle ends. Looks to whip it over mid-on, plays too early, and balloons a leading edge to mid-off instead"
"slower length ball on off stump, clipped to deep midwicket"
"slower length ball on off stump, clipped away into the backward square leg region. They think of two, but the fielder is off the boundary in a flash to close down the ball"
"shortish ball on off stump, gets on his toes to dab towards backward point"
bouncer rising fast and steep over leg stump. Latham has no option but to duck
"slower ball, ends up as a full-toss wide of off stump. Slapped to extra-cover on the 30-yard circle"
"low full-toss outside off, jabbed towards mid-off"
"slower short ball over off stump. Looks to pull, and ends up dragging it to fine leg off the toe end"
"appeal for lbw as Latham looks to shuffle across and whip it leg side. Probably pitched outside leg, I reckon, but England have reviewed. The batsmen sneaked a risky leg bye, and Latham would have been out at the non-striker's end, by a number of feet, had Woakes hit direct, but he missed. <b>Yup, it's pitched well outside leg stump</b>."
"slower length ball close to off stump, slanting away, swatted away to deep midwicket"
"slower bouncer wide of leg stump, and it's run away for five wides. Latham had no option but to leave it, and the ball bounced a second time before reaching Buttler, who'd sidestepped to his right to get behind the ball, only for it to beat him with turn"
"gone, a third wicket for Woakes. England haven't allowed the lofted hits over mid-on/mid-off/extra-cover, and this slower ball, which ends up as a low full-toss outside off stump, is also a hard one to put away. Hits low on the bat as Latham looks to go over mid-off, but he only succeeds in spooning it to the fielder. He goes for 47 - a scrappy innings, which could prove valuable for New Zealand if this pitch remains two-paced"
"whoops, high full-toss, and Woakes will get a warning for this. Slanting across the left-hander, ends up hitting Santner's left shoulder as he aims to swat it away into the leg side"
"another slower ball, full and angling away from off stump. Santner swings early, looking to slog over midwicket, and misses"
"full, close to off stump, driven along the ground to mid-off and they chance the quick single. A direct hit from Wood could have had Santner in trouble at the non-striker's end"
"boom! A rare ball in the slot, angling into off stump, and he clears his front leg and wallops it over midwicket, one bounce and over the rope. Most of England's other 'full' balls have been off-pace, and/or too full to get underneath"
"slower bouncer over leg stump. Shuffles across and looks to hoick it towards fine leg, misses"
"in the blockhole on off stump, makes room and stabs to extra-cover. Another risky single - they have to take all of them - and another failure to hit the stumps. Santner has to slide home, and he may have hurt himself in the process. Seemed a little worse for the wear initially, but he looks okay"
"slower bouncer, and Henry misses the attempted tennis-swat over square leg. Wided for height"
"top of off. Well, usually fast bowlers look to hit top of off on the bounce, and Archer's simply hit it on the full. Looks to clear his front leg and slog it away, but can't put bat to ball"
"slower yorker, angling into middle and leg. Looks to make room, can't find any, stabs it back to the bowler"
looks to make room again and Archer follows him with a blockhole ball. Jabbed to mid-off
"ha. Kind of sums up the latter half of New Zealand's innings, this ball. Santner ducks under a slower bouncer over leg stump. Then he thinks of stealing a bye and decides against it. Archer is just so deceptive, you can't blame Santner for it"
"gone first ball? No? Marais Erasmus doesn't think it's out, but that looked pretty close, and New Zealand <b>have reviewed</b>... It's the trademark Boult inswinger from left-arm over, past Roy's attempt at a straight-bat drive to mid-on. No inside edge... Pitching on around middle stump, and it's <b>umpire's call on leg stump</b>! Roy survives. Just. What saved him, I think, was that he was playing with a straight bat. If he'd gone further across with his front leg and played across it, the umpire might have been more inclined to give it out"
"full again, more off-stumpish this time. Pushes at it with firm hands and it runs down to third man off the outside half of the bat"
"fullish, fourth-stump channel, straightens slightly. Left alone"
"back of a length, holds its line outside off, defended off the back foot"
"looks to flick, ball swings past his inside edge and hits his pad, but this one's clearly missing leg stump"
"ooh, this one swings in from about middle and off and was probably headed for leg stump. Bairstow plays a hurried flick and the ball squirts off the inside half of his bat to that short square leg fielder"
"nice and full, slanting in on middle, flapped in the air...but does not carry to short midwicket"
"<strong>Henry chops Roy into half</strong>! Good length, angling in, swinging back in up the slope, <strong>beats the inside edge and the off stump</strong>"
"whoa, another cracker! On a length, comes in with the angle from over the wicket. Henry tricks Roy into playing for the angle, but it snakes away like a fast legcutter. <strong>Opens up Roy and beats the outside edge this time</strong>"
"Roy dashes down the track, Henry pulls his length back. Quietly bunted to mid-on"
"shorter and just a shade outside off, forced to mid-off"
"a bit too full on middle, Roy leans into this overpitched ball and drives with the full face of the bat, nutmegging YJB. <strong>Caressed straight of mid-on</strong>. Well, that was an eventful over"
"fuller than a good length, angling away outside off, moving past the tramline, off-side wide from Boult"
"<strong>Boult lets rip a full inswinger</strong>, YJB plays around his front pad and flicks to short midwicket"
"shorter and swings back in, Boult catches YJB in a tangle. Pings the back thigh and wanders away to cover"
"pitched up and angling across off, Boult encourages YJB to drive. He doesn't move his feet and <strong>drags an inside edge past leg stump</strong>"
"Whoa, pitches around leg stump and <strong>hoops back in sharply</strong>. Near-yorker length, Roy is in a tangle, nutmegs him and fizzes through to the keeper. Was there a woody sound there? No that didn't hit the furniture"
"Roy gives himself some swinging room, Boult goes shorter and outside off. Roy stays leg-side of the ball and clatters it away between covers and point. That's some riposte"
"back of a length and on the stumps, Roy stands tall and punches the ball straight of mid-off"
"good length and angling in from over the wicket, but does not threaten off stump. Left alone in the channel"
"fuller, angling in towards off, then straightens away late. That's how he got Rohit in the semi-final. That's how he has got a lot of wickets this World Cup. This <strong>does too much to scratch the outside edge</strong>"
"full on the pads, picked away through square leg"
"good length, angling in, straightens around off, Bairstow pokes off the outside edge behind point"
shorter and angling into a leg-side clip to short midwicket
"length ball on middle, Roy races down the track, aims to biff it over mid-on. He just about skies it over the fielder running back"
"pitched up and swinging into middle, clipped away to midwicket"
"back of a length, <strong>hoops back in on middle</strong>, thumps the back thigh and rolls to the slip cordon"
"on a length and outside off, Bairstow senses a scoring opportunity. He drags himself forward and drives on the up between point and the covers. Pinged off the middle of the bat"
"Boult responds with a well-directed bouncer on leg stump, forces the batsman to duck under it"
"swinging full-toss outside off, Bairstow latches onto this loose ball and creams it between covers and mid-off this time"
"shortish and around off stump, Bairstow carefully defends back to Boult to close out the over"
"on a length and angling in on a fourth-stump line, punched on the up to mid-off"
"regally punched on the up once again, this time Roy pierces the gap between covers and mid-off. He rocks forward and cracks it away"
"much fuller from Henry, angling in towards off and then nibbling away late to beat the outside edge. Roy gets away with the drive"
"<b>this is trademark Henry</b>! New Zealand finally have their man. Nice and full, angling in towards off stump, this is what Henry does with the new ball. He makes you play. And this ball straightens away late. Roy feels for the moving ball and nicks it off. Not too dissimilar to how Rohit was dismissed in the semi-final. Nice catch from Latham - bending forward to grab a low chance"
"good length and slanting in at off, Root pats it to point"
"much fuller and sliding in at off stump, Root covers up in defence and keeps it out"
"pitched up and angling across off, driven fluently off the front foot to mid-off"
"shorter and swinging back into the hips, deflected away to short square leg"
another inswinger but Boult sends it down the leg side
"good length and swings back in at middle, Bairstow sizes it up and drives it straight of Ferguson at mid-on. Nicely done by Bairstow"
"back of a length and angling across off, Bairstow stretches out and glides it away towards point"
"back of a length and slanting away outside off, too wide to draw a stroke from the batsman"
"fuller and closer to off, but not close enough to make Bairstow play"
"full and wobbles away against the angle, Root lets it go outside off"
"good length and angling in at off stump, Root gets right behind the line and blocks back to the bowler"
"full and homing in at off stump again, Root is right forward to deal with it"
Root walks down the pitch and forces a a single between mid-off and the covers. He finds some breathing space at the other end
"perfectly-pitched ball, angling in from off, seams away from Bairstow's bat. He drives, but how did that miss the edge?"
"good length and nibbles away just outside off, Bairstow does not bite this time"
"pitched up and angling away outside off, driven to the right of short cover and left of mid-off"
"shorter and zipping away into Latham's gloves, left alone in the channel"
"shortish and angling away just a shade outside off, fended off in front of short cover"
"fuller and angling across off, Bairstow shovels it with the bottom wrist but gets it only as far as Boult"
"hip-high short ball on off stump, Bairstow stays deep in the crease and hauls a pull to the right of the square-leg umpire"
"shorter, angling away, swinging after passing the batsman, who had let it go"
"good length and angling in at middle, Root taps it defensively to mid-on"
Root gets on top of a short ball outside off and punches crisply to cover
"good length, nibbling in at off and then swings away outside off.  Root does well not to chase the moving ball. He plays inside the line and allows himself to get beaten"
"full and slanting down the leg side off, grazes the pad and Latham dives behind the stumps to collect the ball"
"short and darts back in at top of off, stabbed back off the back foot to Henry"
"full, swings in at middle to mess with Root's leg-side flick. Chipped in the air to square leg"
"good length and wobbles away at 120ks, left alone outside off"
"good length and just a shade outside off, YJB is too early into a drive and <strong>spoons it in the air.</strong>.. but it does not carry to Williamson at mid-off"
"good length and nibbles away outside off, no shot this time"
"on a length and on a fifth-stump line outside off, run away towards point"
back of a length and angling into a defensive little push to mid-on
"What have you done, de Grandhomme? He has <strong>shelled a fairly straightforward return catch</strong>. Neesham has his hands on his head. Pitched up at off stump, Bairstow is early into it and chips a drive. The bowler can't close his hands around it. Pops in, hits the mid-riff, and pops out. What a moment in the game"
"shorter and outside off, run away to point"
"back of a length and outside off, punched through the line to mid-off"
"on a length and angling in at off, Root hangs back and defends"
"on a length and outside off, Root stretches out and drives off the inside half to mid-on"
"back of a length and curves in from over the wicket, Root chops at it but the ball sneaks under his bat"
"yorker, tails in at leg stump from over the wicket, Root is opened up as he scoops a leading edge to cover. <strong>That's three maidens in a row</strong>."
YJB breaks the sequence of dots by tucking this length ball on middle into the midwicket region
"looks like an offcutter outside off, really full, jammed to mid-off"
"full and wobbles in at off, driven back to the bowler. De Grandhomme throws himself to his right to stop the ball"
Root walks down the track and works this with the angle through midwicket. Latham needs to be whisked in to stop the batsmen from leaving the crease
"back of a length and angling into off, Bairstow shuffles across off and works to short midwicket"
"short and angling in at middle, stands tall and punches a single down to long-on"
"full and slanting in on middle, forward and driven to mid-on"
"on a length and outside off, YJB yanks his bottom hand off the bat and splices to mid-off"
"good length, angling in towards off and bends away in the channel. YJB shows restraint in shouldering arms"
"overpitched on middle, too straight, Henry searches for the big inswinger. Bairstow loads up and flicks it powerfully through midwicket"
"just short of a good length and outside off, YJB throws his bat at the ball and inside-edges it past leg stump and into the fine-leg boundary. Fifty up for England"
back of a length and angling into a gentle push to the right of short midwicket
"back of a length and just a shade outside off, jabbed back to the bowler"
back of a length and angling into a smooth push down to Boult at long-on
"full and outside off, Root stretches out for a drive and caresses it away to the left of short cover. Sweeper cleans it up in the outfield"
