"nice and full on the stumps, hint of movement away but Thiri has the line well covered"
gets this to move away appreciably off the seam but Thiri is solidly behind the line of this length ball.
"beauty! Nibbling around fourth stump, had to play at that. Beaten"
"just keeps bowling at the same spot. Just a touch ahead of length, closer to the batsman, and around off stump. <strong>Pokes and misses</strong>"
defends this length delivery from the crease.
works this short of length delivery wide of midwicket. Hopped back and played it confidently even as it was rising.
"shapes to drive but is uncertain, ends up hanging his bat out to get an inside-edge onto the pad."
"beauty! Gets him to play by angling it in from round the wicket, Thiri beaten as he pokes at one that squares him up. He's playing for one that moves away."
"this is much fuller, Karunaratne rooted to the crease as he squirts it to the off side."
gets besides the line and bunts this length delivery into the off side
lovely wrist work. Too straight this time and he works this through the vacant mid-on region.
"around the off-stump channel, much fuller, left alone"
"back of length on off stump, defended into the covers."
nudges this off the pads into the gap at square leg.
"much fuller and angling away, invitation there to poke but Dimuth says no thanks."
"fuller and closer to off-stump, defended"
leans to caress this full delivery to mid-off
"this one zips off a length but keeps a touch low, defended nonetheless"
"pulled away imperiously in front of square. Fetched it from outside off, and was in total control."
"uses the width to steer this wide of point, Bavuma with a long chase to pull it back in"
"beautifully punched on the up. Just a hint of width and he hopped back to ease it into the covers. Solid so far, runs chugging along very nicely."
defends this length ball with his bat close to the body.
"loose shot, chases this wide delivery but fortunately for Sri Lanka's sake, he misses. <strong>This close to being nicked off</strong> Got to say though that this was there for the cut"
"has he taken him? Yes, but that lobbed off the pad. Sharp turn though and that will encourage Kesh"
"turns sharp but the length is on the shorter side, tucked towards midwicket"
"slow turn from off stump, defended with the spin"
goes right back into the crease and works it towards Rabada at deep midwicket
"slider on off, he goes back and across to block"
steps out and whips this with the spin to long-on and <strong>that's tea</strong>
"length around off, goes back and flicks it towards square leg"
"length around off and middle this time, defends it back towards the bowler"
"length around off, comes back a little bit to sneak in between the bats and the thigh, passes over the stumps"
"length around off and this one has gone the other way, Karunaratne was pushing at it, gets beaten. This is the Philander magic"
"length around off, 131kph, Karunaratne was looking to defend, gets beaten again as it moves away from the batsman"
"fuller outside off, comes forward and leaves it, swing back after it passes the stumps"
"length around off, moves after off the seam to beat the defensive push"
"back of length on the body, gets on his toes and dabs it down towards short leg"
"length around off and middle, gets behind the line and defends with a straight bat"
"a touch fuller around off, comes forward and defends it with soft hands, towards cover"
"banged in short but down the leg side, too high as well, Thirimanne ducks under easily"
"<b>no one goes for it</b>. Fuller outside off, flashes hard at it, a thick outside edge flies between du Plessis and Elgar at head height, at second and third slip. They are standing way too close it looks like but still was Elgar's catch"
"length on middle and leg, flicked away uppishly past the square leg fielder for a brace"
"length around off, defended on the off side"
"length on the pads, goes for the flick, misses but will get a leg-bye"
""
"length around fourth stump line, Thirimanne leaves it alone, comes back a little but not enough to hit the off stump"
"length in the corridor, left alone once more"
"fuller around off, comes forward and defends"
"short of length, angling into the batsman, pushes it towards mid-on"
"a touch fuller around off, Karunaratne was on the back foot, defends it down the wicket"
"short of length on the body, tucked away behind square on the leg side"
"another down-the-leg-side bouncer from Rabada, Thirimanne is not bothered"
"short of length around off, gets on his toes and defends it towards extra cover"
"fuller around off, defends it towards point"
"length around off, stays in the crease and defends it back towards the bowler"
"length around off, defended down the wicket with a vertical bat once more"
"length, on middle and leg this time, flicked away towards fine leg"
"length around middle and leg once again, flicks it towards square leg"
"length on middle and leg, dabs it towards short midwicket"
"fuller around off, throws his bat it, not often you see such a shot from Karunaratne, gets beaten"
"length around off, defended towards cover-point"
"fuller on the stumps, flicks it towards short midwicket"
""
"length around off, some extra bounce, plays it well, taking off the bottom hand and steering it towards point"
"length around off, comes forward and defends"
"fuller on the stumps, drives it back straight towards the bowler"
"short of length on the pads, looks to flick but misses, gets hit above the knee roll"
"a touch fuller around off, comes forward to defend, gets surprised by the extra bounce even though he defends it fine taking off the bottom hand"
"length around off, Karunaratne shoulders arm but it comes just back in to hit the batsman on the back pad. A big appeal for lbw denied. South Africa want to review it, the impact is outside off but he was not playing a shot. But it hasn't come back in enough and was missing the stumps by quite some distance. <b>South Africa lose the review</b>"
"crisp flick, fuller on the stumps and flicked away through midwicket for a boundary"
"fuller around off, comes forward and blocks"
gets half a stride in and defends confidently
"yorker-length on the stumps, turned towards short midwicket"
gets on top of the bounce and fends carefully
shows the full face of the bat and bunts this away-going length delivery into the off side.
"<strong>big booming drive, as if he's doing so at the SSC! </strong>Rabada goes round the stumps and angles a length ball on the fourth stump, Thiri is tempted and goes after that one but is clearly late on it, gets a thick edge and Faf dives across to his right, in front of Amla at first slip, to pouch this superb catch."
steers this length delivery to backward point
crisp little drive but straight to mid-off
right behind the line of this length ball on the stumps as he defends.
"huge appeal and gone! There's the second. Dimuth refers upstairs. This is short of length on middle, nips back in and skids through to beat the inside edge as he plays all around it. Looked good to smash leg stump. Replays tell us this would've clipped the bail on leg stump <b> so the umpire's call will stay </b>"
minute deviation off the deck will cause much trouble to batsmen when Philander is on. This one just about leaves him enough to whizz past the edge after drawing him forward. Cracker first up.
walks into the shot and then bunts this back towards the bowler.
shimmies down the pitch to counter the movement as he drives to mid-on
"slips in a full ball, almost yorker length, on the stumps, squeezed out."
"gets on top of the bounce and bunts this wide of point, there's an overthrow at the striker's end as they take an extra run"
"slants this full delivery into the stumps, defended back"
"has an ugly waft at the delivery, ends up getting a thick inside edge that flies past off-stump t the fine leg boundary. <strong>On another day, he would've chopped on</strong>"
"confidently punched into the gap behind point, races away. Deliberately opened the bat face late to pick the gap."
hops back and defends with soft hands
"hustles him with a length ball on the stumps, tucks this wide of short leg"
hops back and across as he bunts this back towards the bowler
"too early into the pull, much before the ball arrived. Beaten"
"too short on the stumps, ducks under this without any hassle"
"has he nicked him? Yes, he has. Poor from Kusal Mendis, why would you look to glide a quick bowler off a short ball? This one climbs on him, looks to deflect this over the cordon but is late on the stroke and de Kock takes an excellent catch on the leap. Sri Lanka are unravelling very quickly after a glimmer of hope at the start. Got to show more desire than that, Kusal."
"quick bouncer again, raps him on the glove as he looks to nudge this into the leg side."
"driven on the up into the gap between cover and mid-off, good running"
"<strong>leading edge, flies into the gap past gully!</strong> Looks to go with hard hands, bat facing mid-on but the ball swerves away late to take the outside edge."
nips back in off a length to hit him on the back thigh.
stands tall and bunts this into the off side.
goes right back and across to defend this back to the bowler.
"punched on the up to backward point, Maharaj swoops in quickly but they scamper a single"
"mistimes a short-arm jab to midwicket, looking to take the bowler on."
works this behind square to fine leg
"<strong>Oh, dear. Goes after the pull, top-edges it but gets away.</strong> Rabada is too fine at long leg. Comes around to cut it off but even a dive wouldn't have got him close to the ball. Lucky break"
"right on top of the bounce as he gets onto the toes, defended."
"pulled away, down to Maharaj at deep square"
"shapes to hook but realises this is a touch too step, tries to bail out and gets into an awkward position, but no damage done."
"starts the over with a short one around off, Fernando sways away from it"
"short of length around off, stays back and tucks it towards square leg"
"short of length around off, defends it towards covers from the back foot"
"fuller around off, comes forward and pushes it towards extra cover this time"
"short of length around off, 140kph pushed towards point, was in the air for a while"
"fuller around off at 141kph and and lofted over mid-off, no fuss about that, all hands"
"a bouncer at the batsman in excess of 140 kph, ducked under"
"lands just in front of de Kock, short of length around off, Fernando was looking it steer it away, the ball hits him on the glove but doesn't carry"
"length outside off, steered towards gully"
"short of length around off, goes for a pull but doesn't time it well, on the bounce towards short midwicket"
"short of length around off, 136kph, gets behind this and blocks"
"short one again, around middle and leg this time, swivels to pull it towards square leg"
"length around off, sweeps it towards backward square leg"
"fuller around off, comes forward and pushes it towards covers for a quick single, Steyn with the throw, misses the stumps. Had he hit, it would have been out. The batsman had jammed his bat before the crease and dropped it. No part of his body was grounded behind the crease"
"fuller down the leg side, sweeps it fine and hard and collects a boundary"
"fuller around off, comes forward and blocks"
"a touch flatter at 81kph, defended on the front foot once again"
"fuller around off and middle, 87kph, dead-bats it again"
"short of length and going across the left-hander, who pushes at it and gets beaten"
"short of length in the rib cage, drops his bottom hand and tucks it towards fine leg"
"another short one but angling down the leg side, Fernando shoulders arms, a mild appeal for caught-behind but it brushed the body on its way"
"short of length around off, waits for it and looks to steer it late, past the slip cordon maybe. Gets beaten"
"another short one, down the leg side, moves inside the line and leaves it alone. Looks like it once again brushed his shirt"
"short of length around middle and leg, dabs it towards backward square leg"
goes for the sweep but Markram at short leg come in the way
"fuller around off, pushes it towards covers"
""
"short of length, pulls it towards short midwicket"
"short of length, flicks it towards fine leg for a single"
"short of length around off, gives himself some room and steers it towards point"
"length ball down the leg side, worked towards square leg"
"short of length outside off, punches it off the back foot towards sweeper cover"
"length around off, stays back and defends"
"length on the stumps, a reverse sweep towards third man, a bit of chase for Philander"
"fuller on the stumps, pushed back towards the bowler"
"length around off, comes forward and defends"
"length around off, spinning in, stays back and blocks"
"fuller around off, comes forward and defends"
"flatter on the stumps, some spin back in, defended from the back foot again"
"use of feet and smashed along the ground, Maharaj gets a hand to it and deflects it towards mid-off"
"length around middle, defended with a straight back"
"short of length outside off, punched off the back foot through covers"
"and he finds a touch of extra lift outside off first up, Fernando hopping to counter it in defence"
"flying through in the channel, outside off, and the batsman has a good look and lets it go"
"Fernando presses half forward in defence to a fuller one, sending the ball to Markram at short leg, on the bounce"
"Rabada hits a length, just outside off, and Fernando offers solid defence. There's been no early swing or seam movement so far"
"Rabada keeps things tight on off stump, and this time Fernando's defensive push goes to gully"
"nicely full and honing in on the off stump to test Fernando's defence, which holds firm"
"angled across on a length, Perera stepping forward to push to cover"
"speared down the leg side, precious little swing for Steyn"
"first runs of the morning for Fernando, who steps forward into a drive and angles his bat to get the ball past point, and they're back for a third"
"decent nip from Steyn at 143km/h, and Perera hops to flick off his hip and down to fine leg"
"Fernando checks his drive at the very last moment as Steyn continues to pitch it up, very nearly spooning the ball into the gully. He stopped the stroke just in time"
"nice end to the over from Steyn, aiming for the top of off to test Fernando's defence. Probing stuff so far from South Africa's quicks, despite the lack of swing"
"landing on leg stump on a full length, and Perera nudges it into the leg side"
"pitched up again, but outside off stump this time and Perera slugs the ball in the air down the ground. The ball plugs in the soggy outfield, so they're kept to three. Brave shot"
"Rabada pulls his length back a touch, and Fernando is half forward as he defends from the crease"
"Rabada sprints in and targets Fernando's pads with a full ball, the batsman nudging to midwicket to ooh's and aah's behind the stumps"
"Rabada has got his radar right early this morning, and once again he makes Fernando play on an off stump line"
"nicely full again, and Rabada hops in his follow through to stop Fernando's drive, one-handed"
"Steyn is giving nothing away either, hitting a length on or around off stump to draw a defensive push from Perera"
"just a hint of shape back in to the left hander through the air, but it's easily dealt with"
"Perera's taken by surprise by one from Steyn that spits off a length, taking his bottom hand off the bat as he pushes defensively at it"
"metronomic start from Steyn, and Perera presses half forward to a length delivery on middle and off"
"Steyn aims for the magic ball, full and zipping in to Fernando's pads, but he gets some bat on it to collect a single to fine leg"
"Steyn fires down a rising delivery outside off that Perera meets with a slightly ungainly hack, but he places the ball well enough to collect another single"
"Rabada errs ever so slightly in line, slipping one down towards Perera's legs, and he collects an easy single to fine leg"
"as the sun peeps out briefly from behind the clouds, Fernando has a good look and lets a full ball go outside off"
"out of nowhere, he's <b>beaten on the outside edge</b>! It was the line, really, that prompted the miss, perfectly in the channel outside off"
"has this tailed in a touch? Rabada might be getting a little reverse swing, but it does too much and hoops down the leg side, flicking the boot on the way to the boundary"
"Fernando is elegantly forward to drive a full one to short extra cover, keeping his elbow nice and high as he does so"
"<b>beaten again!</b> Rabada really bent his back on this one, the ball zipping through at 146km/h and bursting past Fernando's outside edge"
"close! Rabada is at a very deep mid off, and had he been orthodox this would have been popped straight to him. Steyn pitches it up, and Perera takes the bait with a lofted drive. Fortunately for him, he mistimed it horribly"
"and Fernando is the antithesis, all watchful defence as Steyn hits a length on off stump"
"fuller this time, and a touch wider too as Fernando stretches forward to defend"
"Steyn lowers his pace to 135km/h and finds some away shape as a result, but Fernando spots it and covers the swing as he defends"
"Fernando presents the full face to keep a full one out, resolute stuff"
"just a little wider of off this time, testing Fernando's judgement. He chooses to push out defensively at it, taking the bottom hand off the bat as he does so"
"Rabada shoots one across Perera's bows, on a length, and he's on his tip-toes to defend into the leg side"
"nudged off the toes, and an easy single to fine leg"
"full outside off, but Fernando won't be tempted into a drive, defending to point"
"outside off, and wide enough that Fernando doesn't need to play at it"
"some shape back in to the right hander, but he's solidly behind it to defend"
"Fernando's got his forward defence in good working order, and also his on drive. One of the hardest shots to play, against the world's top ranked Test bowler, and Fernando plays it sublimely to pick up four and <b>bring up the fifty stand</b>"
"<b>scythed through point!</b> Fernando is all elegance, Perera is more about power and flair, hopping to slash a cut at a short ball, hitting it in the air but wide of any fielder"
"Steyn adjusts his line, aiming closer to off stump, and Perera defends"
"fuller this time, and again Perera is forward to defend"
Perera lets this one go outside off
"hint of shape away from the left-handed Perera, who is half forward to defend"
a chopped cut sends the ball hard into the turf and bouncing into Rabada's hands at point. Missed opportunity for runs there
"Rabada offers width outside off on a full length, and Fernando rolls his hands over a drive that's intercepted at point. Good looking shot for no runs"
"a tempter, slightly wider outside off, but Fernando opts for patience and lets it go"
"Rabada digs this one in, and though there's no great pace in the pitch Fernando is still a little rushed as he ducks underneath it, dropping the hands too"
Fernando shoulders arms once more to one wide outside off
"Rabada shoots down a surprise yorker, and once again the ball tails in slightly through the air, but Fernando watches it closely and trusts his forward defence to keep it out"
"another attempted yorker, but this one slips out as a low full toss that's nudged to fine leg"
"full and aimed at off stump, and Fernando defends to extra cover"
"<b>edged, and gone!</b> Fernando's judgement had been so good so far, but it's failed him this time as he follows a cross-seamed delivery that nips away a touch off the track. The ball was full and in the channel, but where previous deliveries have shot straight through this one left him and he couldn't withdraw the bat. He could have left it alone without any danger"
"yelps of excitement from the slips as Steyn bursts a back of a length delivery past Dickwella, who drops his hands as the ball shoots past him"
"<b>two wickets in three balls for Steyn!</b> A full ball just stopped very slightly in the surface as a flat-footed Dickwella pushed at it with hard hands. He was too early into the shot and popped the ball straight back at Steyn, who plucked it out of the air one handed"
"full just outside off, and the ball keeps slightly low to hit the bottom of Dhananjaya's bat"
"pressed to mid on with a drive, and that brings a breakthrough over to an end"
"seaming across the left hander, but from a leg stump line and it's nurdled to leg"
"Perera is forward this time, driving to short extra cover"
"Rabada tests Perera with a short ball, with deep square leg in position, but he rolls his wrists on the stroke and also gets it well in front of square to collect four"
"Rabada switches to around the wicket, and zings down a very zippy bouncer that Perera hustles to get underneath of"
"a punchy drive to mid off brings a single, and a slightly wild return throw offers the chance for a second run"
"another short one, and again Perera ducks underneath it"
"Steyn offers up a half volley just outside off to invite the drive, but Dhananjaya's drive goes straight to mid off"
"just short of a good length this time, and Dhananjaya doesn't like it, taking his bottom hand off the bat to fend to fine leg"
"Perera jumps to cut a short one, and bottom edges it through to de Kock, on the bounce"
"short and rising on a leg stump line, Perera swiveling through a pull and also managing to keep it down, straight to fine leg"
"in the channel, outside off, and Dhananjaya raises his hands over the ball to leave it alone"
"and again, just a hint of away shape and Dhananjaya wants nothing to do with it, shouldering arms"
"and it is indeed short to start, but passing harmlessly past Perera's armpit down the leg side"
"Olivier bangs it in in his own half, and Perera ducks under a ball that leaps over him but dies on its way through to the keeper"
"back of a length, and headed down the leg side as it flicks Perera's thigh pad. A good stop from de Kock saves runs"
"width offered outside off, but Perera mistimes his cut and it goes nowhere"
"this time Perera goes after the short one, but he controls the shot by rolling his wrists over it. There are two men out on the leg side so the lofted pull is definitely not on"
"short, and rising on a middle and leg stump line, Dhananjaya standing tall to meet it and pull but picking out square leg with his shot"
"pushed through the channel outside off at a decent clip, and Perera defends"
"<b>inside edge past the stumps!</b> Steyn fired this one down much fuller, aiming for middle stump, and Perera was a little late getting his bat down to it, the ball taking the inside edge and flying just past the stumps down to the boundary"
Perera is rooted to the crease as he punches a length delivery softly to cover
"full and straight, and this time Perera's defence holds firm"
"short and wide, and Perera holds nothing back as he flings his hands through a rasping cut. He hit the ball in the air, but fiercely hard and over a leaping Bavuma"
"straighter from Steyn, and Perera opts to defend"
"short of length outside off, 135 kph, pulls it away towards deep midwicket"
"another short of length outside off, bounces only knee height this time, adjusts to pull it towards square leg for one"
"short of length, rising towards the rib cage of the left-hander, stands tall and drops it down"
"once again short of length, a rising delivery towards the batsman, defended from the back foot"
"short of length around off, angling in towards the batsman who chops it towards the point fielder"
"similar length once again but this one is on middle and leg, tucks it towards square leg"
"brings out the reverse sweep straightaway, length outside off and spinning in, played towards third man"
"length outside off, a little bit of turn, keeps low as well, de Silva looks to defend and gets beaten"
"use of feet this time, not perfectly to the pitch of the ball, but manages to clear mid-off, collects a brace"
"flatter and quicker on the stumps, defended from the crease"
"a touch fuller around off, comes forward and blocks again"
"length ball on the pads, comes forward and glances it gently towards short fine leg"
"short of length but down the leg side, doesn't bounce as high as Perera expected. He actually ducked"
"short of length, angling across the left-hander this time, sways away. Good bounce and carry this time"
"length ball on the pads, looks to play straight but the ball hits the inner half and rolls towards fine leg"
"short of length outside off, was looking for a pull initially but it's too high, drops the idea in the end"
"short of length around off, jumps and pushes it towards point"
"short again, down the leg side, away from the batsman as he stays inside the line of the ball"
"this is a freebie. Short and wide outside off, Perera rocks back and cuts it hard in front of square for four"
"length around off, spin back but slow, Perera gets time to go back and work it towards square leg"
"length but down the leg side, turn and bounce, pads it away towards fine leg"
"length ball, just outside off, Maharaj is aiming at that little it of rough, defended solidly on the front foot"
"uses his feet this time and pushes it back towards the bowler, who fires in the throw back but Perera was quick to undo his steps"
"length around off and Perera goes for a reverse sweep, doesn't get it exactly right, ends up hitting it low, just past de Kock, gets to fifty with that brace, his second of the match"
"length outside off, stays back and steers it towards gully"
"back of length outside off once more, de Silva was much more in control this time, rises on his toes and dabs it down"
"short of length outside off, was shaping up for a pull but it just keeps rising, left alone in the end"
