"length around off, right on the money, moves across and defends it towards square leg"
"length around off, a bit of shape away, half a step forward and defended on the leg side"
"a bit of confusion. A touch fuller from Lakmal this time, just around the off stump, pushes it towards the left of mid-on, and sets off, Elgar looks back at the fielder and says no just in time"
"length outside off, moving away after landing, left alone"
"short of length outside off, stays back and defends, the ball hits the outer half and rolls towards covers"
"length, fifth stump line, gets behind the line and defends right under his eyes this time"
"length around off, a little bit of extra bounce as Elgar comes forward and defends"
"fuller around off, pushes it towards covers"
"fuller, wide outside off, Elgar pushes at it and misses, an appeal for caught-behind but the noise was of the bat hitting the turf"
"but this time there is no doubt. Length ball, bowled closer to the stumps, holds its line. Elgar looks to defend but ends up playing inside the line of the ball, a faint edge and a regulation catch for Dickwella"
"length outside off, goes away with the angle, left alone. Not much bounce or carry on that occasion"
"<strong>a huge appeal for lbw</strong>, but Aleem Dar is unmoved. A bit of discussion if Sri Lanka want to review, yes, signals Dimuth. But looks like he was a bit too late. It was a length ball around leg, Amla comes forward and looks to defend, misses and is rapped dead-front, replays show it would have been out had Sri Lanka acted fast"
"length ball, pushes it towards short midwicket"
"length around off, defended from the back foot"
"<b>beaten!</b> A touch fuller outside off, Markram goes for a drive but it not to the pitch of the ball, pushes at it and gets beaten"
"back of length outside off, punched towards covers for a quick single and South Africa are off the mark"
"length outside off, in the corridor, left alone. Dickwella collects it near head height"
"back of length around off, Amla gets on his toes and defends"
"length outside off, some room there, Markram goes for the cuts, but fails to keep it down, lands just short of the point fielder"
"fuller on the stumps, looks to flick it one the leg side, a bit of leading edge down the ground"
"length ball on the pads, tucked away towards deep square leg for three, he too is off the mark"
"fuller down the leg side, swinging further down"
"length around middle and leg, stays behind and defends on the leg side"
"once again pitched up on the pads, a hint of inswing, clipped towards fine leg"
"length outside off, moving the ball away from the batsman, left alone"
"length around off, going other way this time, taps it towards short midwicket"
"length, fifth stump line and leaving the batsman, comes forward and shoulders arms"
"length outside off, stays beside the line and blocks"
"short of length on middle and leg, flicked towards fine leg"
"fuller around off, comes forward and blocks"
"length around off, comes forward and pushes it towards mid-off"
"short of length, goes for the punch but too close for that, chops towards point"
"length outside off, angling further away, goes for the cut but cannot connect"
"length ball on the pads, goes for the flick but misses as the ball keeps low, a leg-bye to fine leg"
"back of length on the stumps, a bit of hint back, Markram gets behind the line and blocks"
"a touch fuller this time, Markram standing at off stump, takes half a step forward and blocks"
"that's a superb catch at second slip. Amla hasn't moved, Sri Lanka are celebrating but the umpires converge to discuss if it carried. <b> The soft signal from umpire Kettleborough is not out. </b> Coming back to the delivery, this is short of length that nips away from outside off, got it to lift off the deck, Amla was looking to play initially but then changed his mind and tried to withdraw his bat at the end, but it was too late. It took the edge and it was superbly grabbed at second slip. It was such a clean catch that <b> Michael Holding on air said 'I'm walking back to the Caribbean if that's given not out. </b>. Fortunately, sanity prevails, there's conclusive evidence to overturn the decision and Amla is walking back."
"slants this back into middle and leg on a length, nicely tucked off the pads past square leg for a couple"
gets on top of the bounce and defends this with soft hands.
"gets this to lift off the deck from outside off, left alone"
"this one goes to him on the bounce. Short of length and angling in, Bavuma tucks this gently to leg gully."
"back of length outside off, good carry to the keeper as Bavuma leaves"
mistimes this off-drive but manages to beat mid-off nonetheless
"nice and full delivery angling away, just around the off-stump channel, left alone"
"stands tall and punches this beautifully through extra cover. That's too short, and it sat up nicely for a batsman of Markram's class."
"this is a corker of a delivery! Would've troubled any top order batsman. It's full, gets this to bend back in really late, Markram plays all around it, misses and this beats the inside edge to hit the pad and sneak through the gap to crash into the stumps. Wow, this is absolutely magnificent. The kind of delivery that will give a bowler oodles of confidence. South Africa are on the mat."
"gets this to skid through on a length on middle and leg, defended with soft hands to the leg side"
tucks this with the angle towards fine leg. They'll come back for the second.
"length on off stump, defended from the crease."
"full and angling in from wide of the crease, Bavuma prods outside the line to get a thick inside edge towards square leg"
"gets this to nip away from outside off but the length is on the shorter side, left alone"
"once again goes short of length, hint of movement from around the fourth stump, Bavuma defends"
"full and moving away from outside off, he plays and misses"
looks to jab at this delivery but pulls out at the last moment.
"slants one full, but it's far too wide for Faf to have a poke at that"
"squared up by the length, squirts the thick outside edge to gully. Superb bowling, uncertain whether to go forward or back. Also not sure if Faf knows which way this is swinging."
"angles one full on off, defended from the crease"
"full and angling across again, left alone"
welcome runs. Pokes at the away-going delivery to get a thick outside edge between third slip and gully.
bunts this into the cover point region and scampers across for a quick single
"full and angling in from wide of the crease, defended with soft hands."
"full, nips away from outside off, left alone."
tucks this wide of square leg for an easy single
"beautiful length, probes away outside off, he plays inside the line as this zips through to the keeper"
"late on the stroke as he goes back and across to block, no damage done as it rolls off the toe end to gully. Hurried onto him this time"
gets a good stride forward and bunts this into the covers for a quick single.
"slants a full delivery across the right-hander, left alone"
edged but doesn't carry to second slip. Once again jabs with an angled bat
"full on middle, shows the full face"
"movement in the air as he slants this full, squirted to gully"
gentle push into the off side for a quick single
"driven back but not timed all that well, just beats mid-off and they get a single"
"short of length, wide outside off, goes for the cut but doesn't middle it, toe-ends it into the ground"
"length outside off, sixth stump line, left alone"
"<strong>fell short of the first slip</strong>. Length outside off, around fourth stump, du Plessis hangs his bat, gets an outside edge but doesn't carry"
"fuller this time, in the corridor. Du Plessis goes for a big booming drive and misses"
"length outside off, swing in after going past the batsman, left alone by du Plessis"
"fuller outside off, and moving away from the batsman, left alone once again"
"length ball, just leaving the batsman, left alone"
"length around off, comes forward and drops it towards covers for a quick single"
a surprise bouncer but du Plessis does well to bend down and let it sail over his head
"short again, outside off this time, du Plessis was ready and pulls it in front of square for a couple"
"length but down the leg side, tickled away towards fine leg"
"length around off, comes forward and defends, a quick single as the ball rolls towards square leg"
"and gets that bounce straight away, length around off, nips back sharply, Bavuma was forward looking to defend but it keeps rising and hits the batsman near the armpit"
"but he follows it up with a leg-stump half-volley, flicked in front of square for a boundary"
"length outside off, comes forward and pushes at it, beaten"
"pitched up this time, wide outside off, Bavuma goes for the drive but the late away-movement takes a thick outside edge that falls short of third slip and races away towards the boundary"
length around off and coming back in. Defended back towards the bowler
"fuller outside off, comes forward and defends with an angled back towards point"
"length around off, and almost squaring up the batsman as the ball holds up on the wicket, a thick outside edge towards gully"
"back of length outside off, stands tall and punches it towards cover-point"
"length outside off, keeps coming in with the angle, left alone"
"short of length outside off, goes back and punches it past the gully fielder for four. Was in the air for some time but lands safely"
"fuller around off, comes forward and drives it towards mid-on"
"fuller once again, a big stride forward and driven towards covers"
"length around off, stays back and defends down the wicket"
"fuller on the stumps, 137kph, pushed towards square leg"
"length outside off, once again good carry with Dickwella collecting it near his face, left alone though by the batsman"
fuller on the pads and flicked away past square leg for four
"fuller again but way down the leg side, was bowled at 143kph. A good take by the keeper, diving to his left"
"back of length outside off, defended on the off side"
"gentle length ball on off, defended"
"full and swinging away from outside off, left alone"
prods outside the line as this rolls off a thick inside edge to fine leg
goes back into the crease and bunts this to the wide slip fielder on the bounce
"<strong>nearly rolled back onto the stumps!</strong> Faf plays outside the line, this one jags back in a little, he plays with hard hands. Lots of oooohs and aaaahs at the moment"
squared up by the length but manages to bunt it back to the bowler.
"floats this full on middle, defended to short midwicket"
"length ball that moves away from outside off, left alone"
"driven into the gap between cover and point, Rajitha oversteps in his quest for extra pace."
right on top of the bounce as he defends
"touch fuller, just outside off, left alone"
"invites the drive by pitching it up outside off, left alone."
"helped along to the fine leg boundary. Too short and angling down, Bavuma controlled this very nicely"
"looks to cut but misses. This climbed on him, zipped through even though there was width"
"length on off, defended back"
left alone again
"touch short, moving away from the fifth stump or so, left alone"
"gets this to angle in full on the stumps, turned to midwicket"
"bunts this gently into the off side, wide of cover"
"beautiful bowling, he bowls this around a length on off, gets it to move away a little to draw him into a push and <strong>manages to beat the outside edge</strong>"
"imperiously driven into the gap between cover and mid-off. There was too much width, Faf planted forward and blasted this through the line"
"hurried into this back foot defence, hits the top part of Faf's bat. Immediately calls for a new bat."
"length outside off, not much deviation off the deck, left alone"
another delivery outside off that's left alone
"loose drive, away from the body. Thick edge past gully. Streaky"
lunges forward and stabs this into the off side
"works this past mid-on, lovely wrist work. <em>'Nice net bowling at the moment, not much to put pressure on the batsmen' says Michael Holding on air.</em>"
flicked uppishly but into the gap at square leg. Huge gap there
"width outside off, punched into the gap at sweeper cover. Runs coming far too easily at the moment"
"beaten on the drive, late movement does the trick this time"
driven straight to short cover off a full delivery
"touch full outside off, left alone"
"driven hard, but driven straight to mid-off"
"full and wide outside off, there for the drive but Bavuma is late on it"
two men back for the hook but Bavuma bisects them with this pull shot. <strong>Superbly executed</strong> The intention was to always keep it down. Lovely
"square driven! Too much width, he leant into it and crashed it away. Runs leaking big here"
"nice and full on the stumps, defended back"
"<strong>what a ball first up!</strong> Drifted in and spun away sharply to square him up and beat the edge by a whisker. Faf opened up, completely surprised by that. <strong>So close to a wicket first ball</strong>"
"touch short, he goes back and across to tuck it into the leg side"
skips out and then lunges forward to defend this away. Lovely loop from the bowler.
steps out and lofts him over mid-on. Didn't get to the pitch but went through with the stroke
"steps out to go over mid-off, gets a thick inside edge to mid-on however"
"paddled as he takes it on the full, fine leg comes around to cut that off"
presses half-forward and bunts it into the of side
"Has he tickled this down leg, there was a definite noise as this went past the bat. Umpire Kettleborough says no, and <strong>Sri Lanka have reviewed immediately.</strong>. Length ball slanting down, Faf late on this flick, but as it passes the batsman, the pad isn't anywhere near. Replays confirm a spike as ball passed the bat, so the decision will be overturned and Sri Lanka's lunch will taste much better than it would've otherwise. Terrific end to the session. Sri Lanka's morning all the way."
"length around off, angling across de Kock, who pushes at it, gets a thick outside edge which races past the gully fielder"
"length, but down the leg side, flicked away fine for another four"
"length around off, comes forword and defends it with a vertical bat"
"length outside off, angling away from the batsman, left alone"
"length outside off, leaving away from the right-hander, left alone"
fuller but further away from the batsman who is happy to leave it alone
"pitched up around off, comes forward and drives it through covers, not much power behind it"
"short one this time, Bavuma was looking to withdraw his hands but fails to do so in time and the ball hits him on the gloves but dies in front of Dickwella"
"almost a yorker around off stump, de Kock does well to get his bat down in time, an inside edge towards fine leg"
"length outside off, comes forward and leaves it alone"
"that has carried to Dickwella, an appeal for caught-behind and Richard Kettleborough raises his finger after some thought. But <strong>de Kock has reviewed</strong> it immediately. Short of length outside off, de Kock moves towards the off side, before deciding to leave at the last moment, but replays show the ball hit the left arm on its way to the keeper. Also, it looked like the take from the keeper wasn't clean but all that doesn't matter"
"fuller around off, comes forward but was a bit late on the defence, gets an inside edge on to the pads"
"length around off, taps it towards the right of the cover fielder for a quick single"
"length in the corridor, comes forward before leaving it alone"
"length around off, stays beside the line and defends"
"length around off, comes forward but once again leaves it alone"
"a low full toss on the stumps, pushed towards mid-on"
"length, in the corridor, a little bit away movement, shouldered arms by de Kock"
"length around off, comes forward and a gentle punch towards extra cover"
"fuller and angling in this time, de Kock pushes it at, the ball hits the inner part of the bat and goes towards fine leg"
"short of length outside off, cuts it towards sweeper cover for one"
"fuller on the stumps, drives it towards mid-on"
"length outside off, in the corridor and left alone without any fuss"
"length but angling down the leg side, goes for the flick but cannot get to it, an optimistic appeal for caught-behind, not out"
"length outside off, pitching around fifth stump and moving away, left alone"
"short of length outside off, stays back and steers it past the gully fielder, moves to 46 with that boundary"
fuller around off and smashes it away but ends up hitting straight to the extra cover fielder who fails to collect cleanly and concedes a run
"back of length outside off, punches it towards deep point"
"back of length around off and middle, pushes it towards mid-on"
"<strong>is that a run-out at the bowler's end?</strong> It was fuller on the off stump, de Kock drives it back towards the bowler who gets his foot in line, and the deflection hits the stumps at the bowler's end. Bavuma was out of his crease but dives back promptly but was he quick enough? It's touch and go. Did he manage to get some part of his bat behind the line when the bails were dislodged, doesn't look like and the third umpire thinks that's out. An unfortunate manner to be dismissed"
"a bouncer around off stump, swivels to pull it down towards deep square leg"
"fuller around off, drives it towards covers to get off the mark with a single"
"length outside off, de Kock punches it past the point fielder for a couple"
"fuller around off, punched back towards the bowler who makes half a stop and the ball dribbles towards the stumps, although it goes past without disturbing them but Philander was in"
"looks to work this square, deflects wide of the keeper off the thigh pad"
looks to flay this away-going delivery on the up through point but is beaten
gets a good stride forward and defends this length ball back down the pitch
"slants a length ball across, punched to deep point"
"bowls full outside off to draw him into the drive, left alone"
"this is full on off, gets it to nip back in this time, defended back"
driven firmly to mid-off
"slashed away over point, down to the sweeper."
"slants a length ball across, defended with soft hands into the gully"
"nice and full, much closer to the stumps, defended back with a straight bat"
"width on offer, slashed to deep point"
"dug in short, but this is down leg, left alone. Keeper collects on the bounce."
"defends this full delivery back to Lakmal. Left a big gap between bat and pad, no alarming inward movement there so it was all good"
"touch full, around the fourth-stump, defended"
works it off his hip to deep square leg
gets a good stride forward and bunts this length delivery to cover.
"full and angling away, defended with his bat close to the pad"
squirts this into the gap between point and gully
"driven back hard, the bowler stops it with his boot"
"looks to cut but is cramped for room, looks to bunt it nevertheless but this one took off to just rap him on the glove. Winces in pain"
mistimes the drive on the up to cover. Got it off the toe end
"full and angling away, tempts the batsman to go for it, but De Kock leaves"
eases this down to third man
"lifter outside off, left alone"
rocks back and pulls into the gap at deep square
goes back and across as he turns this into the leg side
"reverse swept quite beautifully. What fear? Slow through the air, so there's no fizz and de Kock executes this superbly"
lunges forward and turns this gently into the leg side
tucks this behind square as they jog the single
"drawn forward by the flight, but he gets this to dip and spin away to beat the forward prod"
"slants a full delivery across, driven to cover"
"shortens his length but the line is down leg, de Kock looks to tickle fine but misses"
"cramped for room as he looks to punch behind point, rolls towards gully"
"driven firmly, just wide of cover and they scamper a single"
gets well forward and defends to the off side
turns this full delivery on middle and leg to square leg.
"length on middle and leg, turns it towards square leg"
"length around off, goes for a pull, inside edge on to the pads"
"length around off, stays back and defends"
"fuller on the stumps, comes forward and blocks"
"length outside off, stays back and watches it go into the keeper's gloves"
"pitched up on the stumps, drives it gently towards mid-on"
"short of length, some room outside off, cuts it away towards deep point"
"length around off, comes forward and defends"
"length around off, comes forward and pushes it towards covers"
"short of length outside off, was looking to shape up for a pull but it's too quick and also not that short. The ball hits the bat instead of the other way around and balloons straight up, Rajitha accepts a dolly. The umpires are checking if some part of his foot was behind the line and yes, there is that tiny part of the heel behind the bowling crease"
"length outside off, away from the batsman, left alone"
"length around middle and leg, pushed towards square leg for one"
"length outside off, comes forward before shouldering arms"
"short of length outside off, some room as well, Maharaj goes back and cuts it away for four"
"fuller outside off, Maharaj defends it on the back foot"
"tossed up around off and middle 76kph, comes forward and blocks"
"back of length outside off, punches it towards mid-off"
"flighted on the stumps, comes forward and defends"
"length around off, comes forward to defend, gets an inside edge on to the pads"
"length outside off, looks to drive it on the up, mistimes it down the ground"
"fuller around middle and leg, flicks it away towards fine leg"
"fuller around off, comes forward and defends"
"a sharp short delivery outside off, Maharaj does well to sway away and drop his hands down"
"length, sixth stump line, shouldered arms"
"and almost a replica of the last ball, length, way too outside off, left alone by Maharaj"
"fuller on the pads, clipped away towards square leg"
"short of length outside off, cuts it away past the cover fielder for another four in that region"
"length around middle and leg, some turn there but Maharaj is watchful and defends on the back foot"
"length around off, once again plays back to that, gets an inside edge through his legs towards fine leg"
"length outside off, not much room this time, Maharaj though goes for the cut again, gets a thick outside edge past the slip fielder"
"fuller around off, comes forward this time and pushes it towards extra cover"
"length around off, comes forward and smashes it between the stumps and the non-striker for four"
"short of length outside off, goes for the cut but misses"
"angling down the leg side, too far away for de Kock to get any bat on that, Dickwella dives across to make a stop"
"a high full toss around off and middle, worked away towards deep square leg"
"nippy, extra bounce from short of length, Maharaj takes his eyes off as he looks to defend, gets rapped on the gloves"
"short of length outside off, punches it towards extra cover"
reverse sweeps this to cover.
"struck on the pad as he tries the reverse sweep again, deflects off the pad towards backward point and they take a leg-bye"
cut away wide of point for a quick single
"nice flight, lands this on a length around middle and leg, tucked to deep square"
"too short, he makes room and cuts it into the gap between point and short third man, they take a couple"
"plays the short-arm jab over midwicket, towards the shorter side but Sri Lanka can't prevent the second"
"flayed on the up through extra cover, good work in the deep"
"length on middle and leg, worked nicely off his hip towards fine leg"
"squirts this to gully. Played all around it, this one straightened off a thick edge."
"hustled for pace with this short of length delivery, somehow manages to nudge it towards square leg as he's pushed back into the crease"
beaten as he's through with the pull even before the ball arrived
"<strong>ripper of a bouncer</strong>, Maharaj is on the hop as he takes the bottom hand off the grip as this comes furiously at him, rolls off the glove to gully."
"tossed up on middle and leg, worked to midwicket"
"rocks back and slaps this into the cover boundary, a very short one that side. Enough width, too short. Deserved to be punished."
gets well forward and defends back
it's the wrong'un which he cuts to deep point
"he's heaved this into the stands at deep midwicket. Too much flight, he picked the length and went through one bounce. Super"
eased with the spin to mid-off for a quick single
"skids one across from wide of the crease, defended back"
he's picked the bones out of this. Swivels around and pulls one bounce to the deep square leg fence
sways out of the way of this short ball angling away
squirts this full delivery into the covers. This tailed away late
"full, just around off, defended."
"this is a jaffa and he's got him! Maharaj reviews immediately, which means he believes he didn't nick it. Got this to angle in and leave him late to square him up, Maharaj pokes at the delivery and spontaneously looks back as this passes the bat. Dickwella grabs it and throws the ball up in celebration, Aleem Dar agreed. We'll need a few replays. <b> Ultra-edge confirms a spike </b> so Maharaj will have to get on his bike. What an inspired bowling change, Vishwa continues to impress."
"slower ball, a full toss which slipped out of his hand perhaps, bunted into the off side."
"angles in a length ball from wide of the crease, defended back"
right behind the line of this length ball as he defends
whips this length ball on middle and leg to midwicket
"dug in short, Rabada looks away and avoids this without a hassle"
gets on top of the bounce and defends this into the leg side.
pulled all along the ground to deep square
"chipped, but short of mid-on."
