"starts on a good line just outside off, back of a length and rising through as Gayle shoulders arms watchfully"
"top of off, no signs of swing, Gayle dead-bats towards mid-on coming across"
"length, a touch leg side and straightening to hit the thigh pad and run behind square for the first run of the day"
"fuller, hung out in the channel, Campbell presses on to the front foot and lets it go"
"slightly back of a length, room to free the arms but he chops a cut straight to backward point"
"just a touch full and this comes sweetly off the bat face as Campbell steps out to drive, <b>pinged back fine of mid-off</b> and that will be the first boundary of the innings"
"some swing, <b>this straightens to rap Gayle on the back leg...!</b> Think it was going over, just a strangled appeal from the England players"
pitched up and zipping through as Gayle steps out and leaves
"back of a length, thudding into Gayle's (presumably diamante encrusted) box. Oof... The big man gives it a rub and prepares to go again"
"dug in very short, whistling through as Gayle rocks back - wide on height"
"flies in and hits a length, touch leg side and Gayle squirts his first run away to backward square leg"
"shortish and pulled off the hip, timed nicely but fine leg will run around to prevent four"
"nipping back, Wood looking sharp again, this clips the back thigh pad as Campbell fails to get his bat down in time"
"slower ball, Gayle waits for it and dabs square on the off side for one"
"full and driven coming forwards, mid-off runs across to his right and they take the single"
"another cutter from Woakes, extra bounce as Gayle starts to come down and then shoulders arms"
"full outside off, the big man reaches away from his body and steers to third man"
"coming back, good pace and <b>Campbell is inches from playing on!</b> Instead, he gets four... but he didn't know much about it"
"taking the pace off, paddled away into the leg side off the back foot"
"length ball, holding its line outside off, Campbell lets it go"
"whizzed down a touch fuller, worked away off the pads for one"
"full on middle and off, Wood taking pace off now as Gayle defends"
"beaten in the channel, length ball zipping through past the dangled bat"
"pitched up and pushed towards cover, a gentle giant hand-selecting which sheep he would like to eat first"
"lickety-split, 143kph/89mpg in the channel and Gayle lets it go"
"length ball, straightens a touch, <b>thudding into the pads...</b> Not given! Maybe high again? <del>Looked to have pitched in line</deL> Scratch that, it pitched outside leg. No review from England"
touch shorter and tucked to the on side
"bit of width and Campbell throw the hands, <b>slashes up and over slip for four!</b> As we saw in the Tests, he does not like to be pinned down"
"back of a length and tucked off the hip, Gayle declines the run, though... and Campbell slips, but makes it back as the throw comes in"
"on the stumps, tapped away to the off side"
"pitched up and <b>bludgeoned back down the ground</b>, Woakes gets a hand on it but won't prevent it going for four!"
"length ball, maybe taking the pace off, Gayle defends"
touch short and rising to hit the splice of the bat as he blocks towards point
"dug in back of a length, Gayle rocks back and swats lazily off his hip"
"round the wicket, speared in and fenced away off the back foot down to third man"
"testing lines, this draws Gayle into pushing outside off as the ball comes in with the arm, past the outside edge"
"slightly short, 90+mph and jabbed down towards backward point"
"tight lines from Woakes, Campbell clamps down on it"
"86mph rising around fourth stump, defended from the crease"
short of a length in the channel and Campbell dabs it through gully for one
"offcutter from Woakes, angling across the big southpaw, who glides another to third man"
"Fore! <b>Swung into the crowd at deep midwicket!</b> No mucking about, just picks up the length and Happy Gilmores it waaaaaaayyyy back for the first six of the day!"
"taking the pace off, Campbell waits on it and taps into the covers"
"short of a length, Gayle tries to follow suit and open up a can up whup-ass... Fails to lay bat on it. <b>Clocked at 147kph/91mph</b>, that one"
"shortish, clips the leading edge, <b>but clears cover running back!</b> Extra spit from the deck, but the chance loops beyond Morgan scampering back"
"lobs back up, <b>but Wood can't quite get there in his follow through!</b> Tucked up by the pace, trying to flick to the leg side"
fired in straight and blocked into the off side
"bit of width, 144kph/89mph and Campbell steers into a gap"
"pitched up, Gayle strokes a crisp drive but picks out mid-off"
"full, rolling his fingers over it, right up in the blockhole but Campbell can only bunt it to midwicket"
"bowled into the pitch, Campbell backs away and slaps to mid-on"
"short ball with the pace off, wheeled away leg side... <b>straight to deep square leg!</b> Bit of snarl from Woakes, as Campbell hoicks one to the boundary rider and is on his way after another appetite-whetting cameo"
fullish on the stumps and worked away to leg
"slower ball on off stump, Gayle dabs into the covers and takes on the arm... Just makes it home at the non-striker's end"
"good length outside off, shaping away a touch and Hope lets it go"
fired in over off stump and Gayle defends it carefully
shuffles into line and angles the bat to steer through backward point
"full and driven, just a checked shot using the bowler's pace, <b>all timing down the ground</b> and that'll be Hope's first boundary!"
"<b>wrists!</b> Clipped nonchalantly over midwicket and away... Not afraid to step down, possibly having spotted the slower ball, lovely bit of timing again"
good length on the stumps and defended
"back of a length, 141kph/88mph, climbing to hit the splice as Hope blocks again"
"round the wicket, lobbed up on middle and leg, worked around the corner for one - <b>polite applause for the West Indies 50 around the ground</b>"
"pushed through from over the wicket, going on with the arm and Hope jabs at it, gets a thick, low outside edge for one"
tossed up and pushed back down the track
"nicely flighted, not much turn and Gayle defends"
"nicely bowled, this grips a touch and spins through to the keeper as Gayle plays the wrong line"
floated up and blocked into the covers coming forward
"pitched up from over the wicket, Hope punches through cover-point off the front foot"
"cutter from Plunkett, defended into the covers"
"<b>dropped!</b> A filthy hack from Gayle, steepling towards point as he tried to go over midwicket... <b>but Roy shells it after seemingly watching it all the way into his hands!</b> He got there on the run, but the ball hits the wrists and goes to earth"
""
"stroked through the covers, nicely timed by Hope coming forwards but there's a sweeper out there"
"good length, steered towards backward point coming across"
"cross-seam delivery, pitched up and Hope throws the kitchen appliances at it, <b>sliced hard through backward point</b> - finishes Plunkett's first over with a boundary!"
"tossed up from round the wicket, Gayle defends"
worked off the pads for one
Hope uses the feet but clips straight to midwicket
"pushed through on the stumps, dabbed towards mid-on"
"quicker outside off, Hope goes back and defends"
"tossed up and played with the spin, gets him a single through square leg"
Hope comes across on off and defends
"shortish, 131kph/80mph and this is poked towards backward point"
"in the channel, taking the pace off, Hope lets it go"
"cross seam in the channel,<b> Hope gives this the charge and slaps through mid-off</b>, Stokes fails to cut it off and then gives chase in vain!"
short of a length and worked behind square
pitched up outside off and dabbed through backward point for one more
"hello, the Boss is in the house!<b> Carved meatily down the ground for six!</b> Gayle finally breaks the shackles, <a href=http://stats.espncricinfo.com/ci/engine/stats/index.html?class=11;filter=advanced;orderby=sixes;template=results;type=batting target=_blank>hitting his 477th international six</a>, to go past Shahid Afridi at the top of the list"
goes back this time and defends on off
pushed through and played into the covers
"quicker and flatter, Gayle presses out again"
"darted in on off stump, blocked"
"goes for an expansive drive, clips the inside edge and runs square"
"short of a length, 131kph/80mph as Hope drops back and works it away"
"dug in short, Gayle doesn't fancy this one, ducks the challenge"
"good length on off, 84mph and he settles for defence"
"short and sitting up, maybe a cutter, Gayle sits back and swivels on a pull through backward square"
"banged in back of a length, Hope defends down into the on side"
"on the stumps, clipped wristily away through midwicket to the boundary rider... Hope was looking for two, but Gayle wasn't keen"
"pushed through flat on off stump, Hope dinks one down the ground to long-on"
"round the wicket, tossed up and defended on the move"
"flatter, gripping a touch to hit the outside edge as Gayle drops back and pokes at it, the ball runs square into a gap for one"
tossed up and worked down the ground
"quicker ball, skidding on outside off, into Buttler's gloves"
pushed through and met with Gayle's woodchopper defending on the front foot
"on the back foot, tucked to the leg side"
"back of a length, tight line, tapped to mid-off"
"back of a length on a wider line, firmly punched out to deep cover as Plunkett takes a tumble in his followthrough"
"back of a length, leg-sided, a wide was there for the taking, but Gayle taps it nonchalantly to midwicket and accepts the single"
steered out to point
"straight-batted push back down the pitch, past the bowler. Sedate stuff"
"big turn from back of a length, Hope forced back into the crease to waft to the leg side"
"<B>Ab-so-lute-ly MASSIVE!</B> Full blooded and straight as a die, an arcing golf-swing followthrough, right under the ball with maximum power and it clangs onto the far side of the roof of the media centre!"
"width, and <B>clunked through backward square!</B> Hope is on the rampage now."
high-elbowed block to the leg side
"back on a fuller length from round the wicket, pressed calmly into the off side"
nudged into the gap to keep the strike
"on the back foot, tucked to the leg side"
"width, pumped on the up out to deep cover. Lovely elegant flow of the blade"
"opens the face, dabbed through third man, up comes West Indies' 100"
"outside off, bit of skid off the deck on a wide line, beats a late gliding cut"
"wide line, angled bat, dabbed through third man"
"a flambeed pull out through the leg side, miscued a touch"
eased down to long on
"<B>here we go!</B> A sashay down the track, right to the pitch of the ball, a heave-ho through the leg side, and Gayle turns on his heel and starts marking his guard once more"
"dragged down the pitch by a wide one, and the umpires are <B>checking the stumping</B>. Nope, his foot is safely anchored"
"up on the toes, dabbed to the off side"
"slides on outside off, beaten on the nurdle"
"tucked to midwicket, decent tempo now between this pair"
flicked out to deep midwicket
"clears the front leg, round-house wipe to the leg side, but not quite timed"
short and ducks under it with little fuss
"makes room once more, slapping the slower ball to short cover"
"back of a length, squeezed to cover"
stabbed to the off side
pressed into the off side
tapped to point off the back foot
"<B>smoked through midwicket!</B> Down on one knee, battered fast and flat in front of square and though Bairstow is there, he can't get close as the ball bounces an inch short of the rope"
nudged into the off side once more
"turning into the pads, square leg gathers"
"fuller length, tighter line, skidding on to a defensive prod"
"banged in short, pulled off the eyebrows as Gayle ducks into the stroke, he was rather hustled by that one"
"nudged to the leg side, an easy single"
"very full, tailing across the left-hander from wide on the crease, towards the off stump. Blocked"
"firmly thumped on the up, back at Stokes who gets a good hand on it to intercept"
"slower ball, rolling the fingers on a back-of-a-length delivery. Pulled off the hip to fine leg"
"bouncer, on a wide line, but gets away with it"
pulled out to the leg side
"looped up, driven calmly down the ground to long-off"
"outside off, cut to deep cover"
"turning into the pads, worked to the leg side, and another<strong> fine fifty from Hope</strong>, his fastest yet in ODIs, and he's been turning his starts to hundreds of late too"
"<B>smoking!</B> Think Brett Lee at The Oval in 2009 for distance! Absolutely in the slot, and monstered over the stands at midwicket, and into the neighbouring parish! Out comes a new ball, no point hunting that one down, it's embedded in a taxi bonnet somewhere. Now then ... penny for Jason Roy's thoughts..."
"fuller length from round the wicket, an inside-edged drive to square leg"
"open-faced drive from a full length, gathered at deep cover"
"slower ball, rolling the fingers on an offcutter, dabbed to cover"
"opens the face, glides through third man, and the <strong>Universe Boss has his comeback fifty!</strong>"
"closes the face, and tucks one off the pads"
"wide line, another finger-roller, chopped down into the crease"
"hurried pull, as this one skids on a touch, and hauled behind square"
"back of a length, cut firmly out to the point sweeper"
"<B>pounded over midwicket once more!</B> Length from Plunkett, a slower ball to boot. There's nothing juicier this side of the Jerk Chicken stand, and Gayle chows down with gusto!"
"bouncer, but too short this time"
"<strong>Plunkett hasn't learnt his lesson!</strong> Another offcutter in the slot, and Gayle beasts this monstrously over deep midwicket, and <strong>out of the ground again!</strong> A third replacement ball comes into play."
"fuller length this time, right under the feet for a back-foot drive to cover"
"opens the face, excellent pounce from Roy at backward point. That's one run he's recouped at least ..."
dabbed down to the gully
"a swish and a miss, Gayle twirled into another monster pull but the ball hopped over his blade"
"<B>chopped down into the crease, and over the stumps!</B> Stokes persists with the short line, into the body, cramping the pull"
"yorker length, slower ball, poked to cover"
"slower ball, Gayle waits on the back foot for a nudge to the leg side"
"sliding past the leg stump, but that may have clipped the pads to spare Stokes the wide"
"on the back foot, punched to cover"
"<B>flipped off the pads, and just out of Moeen's reach!</B> Stretching at short midwicket, but not quite tall enough"
"fired across the left-hander, too wide to lay a bat on"
"attacking the tramlines with an angle across the left-hander, but just the wrong side once more"
"heaving into the line outside off, but can't line it up properly"
dabbed into the covers
"onto the back foot, nudged to the leg side"
"banged in short, Hope ducks into his hook, and <strong>nails it through backward square!</strong>"
worked down to third man
dabbed down to third man
punched on the up to the off side
"<B>flogged on the up, over long-off!</B> In an innings peppered with stunning boundaries, this is among the best, for all that it's a one-bounce four ..."
"<B>dug in, a leading edge, and Rashid is in the action at last!</B> Trying to work this into the leg side, the ball climbs into the splice, catches in the breeze and loops all the way down to the third man rope. Here endeth a fine stand ... and England have their opening!"
angling away from the left-hander
"short and aggressive, swaying inside the line"
"<B>a wild and effective slash down the ground!</B> No messing from Hetmyer, just putting his bat through the ball and that dribbles over the rope at long-off"
"wide line, avoiding Gayle's arc of contempt, and toe-ended to the off side"
"crunched to cover, good areas from Wood, wide and full, demanding the drive, rather than the swipe"
"<B>a wild full toss from Wood and smoked over long-off!</B> Whoops, that one slipped, aiming for the yorker, getting it horribly wrong. <B>A Free Hit coming up!</B>"
"<B>TONK!</B> Now now, there's no point bowling there, regardless of free hits and bluffs and whatnot. Pongo-ed over the stands at midwicket, again! <B>Replacement ball No.4 ...</B>"
"width, but that's gone wrong too. This is getting messy from Wood"
"<B>too full, too dismissive!</B> Hetmyer's turn to unleash some lashes, right under a full-blooded mow into the stands at long-on!"
"better this time, yorker-length, on the pads, tucked to mid-on"
"slower ball, and beats another swoosh"
"on the back foot, dabbed to the leg side"
"round the wicket, a good slower ball angling into the bat. A fumble from Buttler ruins the overall vibe"
sliding past leg stump. We'll have that one again
"splatted to mid-on, and <B>inches short of Moeen!</B> Banged in short, a firm downwards pull. Nearly!"
"hoicked out to the leg side, up comes the 200, with oodles more in prospect"
"banged in short, too short again"
"down the track, a pirouette on a good length, and <B>launched over deep midwicket once again!</B> Plops into the crowd this time, so a clear mishit..."
"<B>a smeared top-edge, three men chase back to the rope, but it's plopped over the line as well!</B> Lordie, that wind does its job again... it's like watching <a href=http://www.espncricinfo.com/nzveng/content/story/342543.html target=_blanK>Alastair Cook at Wellington in 2008 after all!</A>"
"fuller length, into the toes, drilled into the leg side"
"outside off, back of a length, dabbed down to the off side"
"well bowled, attacking the inner edge of the tramlines, Hetmyer leaves alone, hoping for the wide but that earns a round of applause from Buttler"
"<B>a massive wipe, and up goes the finger!</B> Woakes was convinced of the edge, but Hetmyer <B>reviews</B>. If there was a noise, it <B>wasn't bat</B>. <strong>Not out!</strong>"
"too wide once more, another huge wind-up. Good thinking from Woakes, but the wrong side of legal that time"
"attempted yorker, comes out as a very straight full toss. Flicked to mid-on, but the Boss is having none of the quick single"
too wide again ... I guess an extra ball and run is preferable to a smoking over midwicket...
"walks across the stumps, pre-meditating the tighter line, and flicked classily into the gap at midwicket!"
"over the wicket, slips in the googly straight away, past the bat as Gayle hangs back"
"another wrong'un, outside leg and spinning to hit the outer half of Gayle's bat as he prods forward"
"tossed up outside leg and Gayle paddles this past short fine leg, Moeen dives but won't get there... on to 98 now"
"floated up on off, prodded watchfully into the covers for one"
"very full and wide, driven to extra cover, who's back on the edge of the ring"
"finishes with another Bosie, clips the leading edge as Gayle tries to work across the line... won't get his hundred just yet"
"back of a length, over off stump and Hetmyer jabs it down wide of midwicket for a quick single"
"short and wide, slapped away dismissively through point for one - <b>the Boss has his hundred</b>, of course he does! Saunters up to the other end and takes off his helmet, then balances it on the bat handle as he raises both aloft. Cricket's greatest hype man lives up to his own hype once again"
"backs away and slogs to the edge of the ring, <b>pouched at mid-off!</b> Slower ball from Woakes and Hetmyer couldn't get much on it, the ball dipped on Roy but he held on to this one"
comes across and works to leg
"short ball, taking the pace off and it bounces more than expected, Pooran has to drop the hands and get his mug out of the way"
pitched up and clipped off the toes to midwicket
"Rashid continues to toss up googlies outside leg, tapped back to the on side as the bowler fields"
"floated up on leg stump, paddled to the man on the edge of the ring"
"skidding on, Gayle goes back and punches down the ground"
"flighted, outside off, and Pooran heaves down the ground - <b>picks out long-off!</b> A duck on debut for Pooran, who got in a bit of a tangle trying to launch Rashid, didn't have the legs to clear the boundary rope"
"tossed up, legspinner in the slot and <b>bosh!</b> Bravo cracks his first ball sweetly over long-on! Finds his range immediately"
"pushes through a googly, past the outside edge as he goes back"
short and wide and Gayle rocks back to cut one through point
"pitched up, slower ball outside off and dabbed towards point"
"full on leg stump, easily clipped through backward square using Woakes' pace"
"angled across in the channel, Bravo strokes through cover"
"taking the pace off, Gayle mistimes a cut"
"fired into the tramlines, just the right side as Gayle looks expectantly for the wide call"
"nicely flighted googly, spins across the forward prod and hits the back pad"
drops back and cuts for one in front of square on the off side
"another wrong'un, outside leg and Gayle top-edges a sweep, disappears up and over the keeper for one"
tossed up and jabbed into the off side
"slider from Rashid, punched down the ground from in front of off stump"
lobbed up and poked away
"pushed through and dabbed down to the off side, Gayle declines the a tight single"
"flighted, Bravo is down on one knee, flowing swing of the bat - <b>and plonked into the stands at deep midwicket!</b> That went sweetly, hitting with the wind"
"floated up on off, tapped away"
nudged into the leg side
"pushed through and Gayle prods into the off side, has to hurry as Morgan turns and fires a throw at the non-striker's end... he was practically hobbling through the crease but made it home"
flat on off stump and punched to extra cover on the back foot
"tosses up a googly, Gayle goes back on leg stump and paddles it away through midwicket"
"Bravo steps away, he's followed by a flattish legbreak that he can only swat down the ground for one"
"tossed up and spinning in, Gayle pulls through square leg"
"flighted, possibly a googly and Bravo gets a leading edge, falls short of the man on the edge of the ring at short third man"
strays too far down the leg side and Bravo pancake flips it up and over the infield to fine leg
"pushed through, this sneaks up on Bravo and he fends it away playing back"
"flighted, outside off stump, <b>walloped back over long-off!</b> Languidly smoked down the ground, a scotch-and-cigar stroke for six!"
"tossed up on the stumps, FETCH!!! <b>Gayle's spanked another one out of the park!</b> Plants the front foot and mows Mo over the stand at deep midwicket"
"flatter outside off, Gayle chops through cover off the back foot, comes back for two and then nearly collides with Buttler"
cut away into a gap
"more humpty, <b>Bravo clears cow corner again!</b> Tossed up straight and fair blootered into the leg side!"
"goes again, <b>on to the roof!</b> A 98-metre six over midwicket, that's not coming back either! Bravo's fourth six from 20 balls faced so far, making his demotion to No. 6 seem a little odd"
lobbed up and worked for one to the leg side
"pushed through, Bravo wheels around and pulls to long-on"
"flighted legbreak, Gayle happy to nurdle another single"
"googly, outside off and Bravo is beaten going back"
"loops up the googly, nice and slow outside off and <b>Bravo swings and misses</b>, trying to give it the old heave-ho over midwicket"
"on the stumps, dragged through the leg side - decent over from Rashid"
"shortish outside off, Bravo gets a bottom edge swinging hard, bobbles through to the keeper"
"outside off, goes deep in the crease and cuts for one"
"slower ball, Gayle attempts to make room and swats one down the ground"
"goes full, fast and wide of the stumps, Bravo gets a toe-end as he stands stock still and swings"
"slower ball, foxes the batsman as he heaves hard and nearly over balances"
full and wide and Bravo again fails to connect with a mighty yahoo
"<b>dropped!</b> Gayle top-edges a googly, but Woakes has to charge in off the rope and <b>can't quite get there!</b> Not sure he got a hand on it, actually. Rashid stands with his hands on his hips"
"goes for the big'un, <b>but Bravo holes out to deep midwicket!</b> Woakes holds on to this one, steadying himself on the rope as the ball seemed to hold up in the wind"
"flattish delivery on the stumps, Gayle punches it down the ground"
"tosses up the legbreak on off, soft hands from Holder and they pinch one in front of backward point"
"lobbed up outside off, Gayle works to the on side and Rashid hares after it"
"should have given him the single... <b>Gayle smears the ball flat at hard over midwicket</b>, that's his 12th six of the day! Rashid so close to escaping that over intact"
"slower ball on off stump, poked back to the bowler"
"pitched up, Holder step out and whips one through mid-on"
shortish and swatted away through the leg side hanging back
"shortish cutter outside off, 132kph/81mph and Holder plays this delicately, dabbed between two fielders through backward point for four!"
"pitched up and smoked over cover! <b>Belted on the up by Holder</b>, inside out and smooth as you like"
worked away off the pads
tossed up outside off and Holder doesn't connect properly with a reverse-sweep
"flighted, Holder sweeps and gets a top edge that loops safely as short fine leg runs back"
"skipping on, <b>over the stumps</b> as Gayle pokes at it and is beaten!"
worked away off the back foot
pushed through and Holder chops one more through the covers
"floated up full on middle and off, Gayle steps back and chips over extra cover, stands a watches it... but Roy dives to prevent four running round from long-off, and they only manage a single in the end!"
"goes full and wide and Gayle swings without moving his feet, fails to connect"
"pitched up, again goes full and wide and he can't do anything with it"
