"slower ball, <b>and dragged on! </b> Big wind up but he only manages a thick inside edge into the timbers! Gayle walks slowly from the crease, to an ovation from the Kensington Oval crowd. Been some vintage hitting (though shame about the running) and he's set West Indies up for a formidable total"
slides this one down the leg side
"hits a length on off stump, Brathwaite settles for a late dab behind square to get off the mark"
"flicked away into the leg side and they come back for two, with a pair of willing runners now in the middle - <b>just the fifth two of the innings</b>"
"slower ball, Holder waits in the crease and clips through backward square"
"dances down, turn for Rashid, <b>and Buttler completes the stumping!</b> Well, just about, having missed with his first swing of the arms...! But I don't think Holder got back in time as Buttler had a second crack. They do just check, but there's no reprieve, Buttler gets away with his lackadaisical first attempt"
"tosses up a googly, <b>Nurse mullers it into the stands first ball!</b> They're still swinging, hitting with the turn and sent flat into the crowd at deep midwicket"
"looped up, slow and spinning away, Nurse gets the shoulder of the bat on it"
"strays down the leg side, called wide"
"floated up full on off, Nurse goes downtown... <b>Sails all the way</b>, into the sightscreen! That's the 21st six of the innings!"
"better length, defended on off"
"heaved through the leg side, gets it into a gap and it bounces away for four!"
"worked into the leg aside and they'll come racing back, the throw is fired in but Buttler can't take it cleanly"
"<b>slogged straight up</b>, Buttler calls for it! Stokes gets a measure of revenge for 2016, as Brathwaite completely fails in his latest attempt to swing him out of the park"
angled in and nudged for one
"low full toss, 138kph/86mph and Bishoo bunts it straight back to him"
"slower ball, over the top of off as Bishoo goes across and swipes unsuccessfully"
"full, taking pace off, poked into the off side for one - just four off the penultimate over"
"tossed up on the stumps as Bishoo reverses the hands, picks out point but they scamper through"
flighted and clipped into a gap
"<b>reverse-slapped over deep point!</b> That equals the record for the number of sixes in an ODI innings! Extraordinary shot from Bishoo, on a day of extraordinary hitting"
"full and straight, he reverse-swipes across the line again, hit on the pad - and the finger goes up! Bishoo <b>reviews</b>, though, and he seems to have hit it. There's a delay with UltraEdge, which then shows wobbly lines everywhere, but the pictures are pretty clear that he got some bottom edge on it and <b>the decision is overturned</b>. Bishoo doesn't get his run, though, and has to return to the striker's end"
dragged down and plinked back past the bowler
"down on one knee, <b>smoked into the stands at wide long-on!</b> Finishes with the 23rd six, to break the ODI record for an innings!"
looped onto a good length and blocked
"clipped off the toes to midwicket, and England are up and running"
"outside off, nudged to point"
skids on from a flat trajectory and Bairstow is hurried on the back foot
looking to drive but the ball isn't quite there for the stroke. Squeezed to the leg side
"boshed on the up to long-off. That's an excellently burgled over from Bishoo. Fast, full, flat, accurate"
"<strong>good wheels!</strong> He's a big unit and that swung from a full length, at a good lick. Left alone"
"short and wide, cracked on the up through point for the <B>first boundary of the innings!</B>"
outside off with good pace and late swing. Left alone
banged in short. Good aggression but too short for the umpire's liking
"<strong>good leave!</strong> A very tight line from Thomas, and left on length as much as anything else. Grazing over the off stump"
"speared into the pad, can't quite time the clip to leg but another single to the cause"
"outside off, stabbed to point"
"a quickstep down the track, and <B>pumped over long-off!</B> No messing from Bairstow, flat and hard, thumping the boundary rope on the half-volley"
"on the back foot, flicked to the leg side"
"down on one knee, <strong>and make that 24 sixes for the match!</strong> And once again it's clean over midwicket, the right-hander's version this time. If Windies can clear the ropes at will, then England can do likewise!"
"a muscular short-arm pull ... at thin air. Too full and straight for the stroke, and skims past the timbers"
a straight-arm pump to long-off
worked to the leg side
"fast and straight, solid connection in a hopping leg-glance, out to no-man's land at backward square"
"good wheels there! <strong>145.2kph apparently</strong>, and very straight, deflects off the knee-roll as Bairstow shapes to leg"
"<strong>sizzling lifter,</strong> but too short and wide this time!"
flinched to the leg side
"worked off the pads, out to square leg once again. Thomas trusting in pure stump-targetting pace for the moment"
"<B>too straight this time</B>. In the slot for a sweetly timed nudge off the hips, and away through midwicket"
punched on the up into the off side
"back of a length, just a touch too short to be effective. Roy rocks back, <B>slaps through the covers</b> and times it to the rope"
"<B>dragged from outside off!</B> Not perfectly timed, but placed to perfection into the gap at cow corner"
"fuller, straighter, a punch to mid-off"
"full face, nudged on the up to the off side"
cut into the cordon
"a knee-high full toss, but he gets away with it, as a flick ends up going straight to short midwicket"
"outside off, back of a length, and <B>spanked back through the covers!</B> That's outrageous stroke-making, who cares about the pace...<B> 148kph!</B>"
worked out to point
swishes through to the keeper
"<B>pounded through the leg side and up comes the fifty!</B> This is ridiculous hitting as well, stiff forearms and pure timing, clean through midwicket"
"back of a length, crunched on the up to point"
<B>a roundhouse pull through backward square!</B> Zoinks. This is lively
flipped to the leg side
"back of a length and too straight, Roy rocks inside the line and helps the ball round the corner with a crouching pull"
"<B>oooh, nearly!</B> Roy is a touch early on a clip to leg, and squeezes the ball with a full face just wide of the scrambling midwicket"
"angled bat, blotted into the off side as Holder uses the crease well"
"<strong>too short, too straight, too easy!</strong> Hauled out through backward square. The runs, they are a-flowing"
toppling forward to block with a full face this time
"into line, and defended back down the pitch"
"wide on the crease, punched into the off side"
"drilled into the off-side, a fumble from Thomas gifts the single"
"effortless clip through mid-on, angles like the rebound off the baulk cushion in snooker"
"line and length, worked down to mid-on once more"
singles will suffice where available. England jog another to mid-on and continue to cruise along
flipped to the leg side
"advancing to meet a length delivery, stubbed into the covers with a straight bat"
angled into the off side
down the leg side
flipped to the leg side once again
"<strong>that's sweet batting!</strong> Inside-out drive, just pressing his wrists through the on-side, and timing it off the face of the bat through wide long-on"
whipped wristily to leg once again
"fired down the leg side, shouts of 'catch it' but that was mostly to hoodwink the umpire. He wasn't fooled"
"full face, pushed to long on"
"another pilfered boundary off the hip ... just too short, and coming onto the bat too sweetly to be intercepted"
worked into the gap once again at backward square leg
"fired down the leg side, but clips the pad on the way"
"pull down the leg side, misdirected and too short. Helped round the corner as Brathwaite winces"
"full-faced push through mid-on. Ten overs gone, and England very much in the hunt"
"battered on the up through the covers, that's dismissive walloping, and though the boundary is intercepted, <strong>he can't be denied his fifty!</strong> Just 30 balls, and he's been motoring from the get-go"
"<B>rapped on the gloves!</B> That just popped from a good length, as Holder uses his height well with a cutter. Roy removes a glove and gets a bit of treatment, but he's okay"
"angled bat, pushed out through backward point"
"bottom-handed tonk to mid-off, very full length"
"<B>banged in short, a top-edged pull, and snaffled by the keeper!</B> That's the breakthrough that West Indies desperately needed! Bairstow has played his part, but played the wrong line that time, just a thin deflection and a good leaping take from Hope"
"Root nurdles his way off the mark immediately, eased through backward square"
"open-faced drive, down to third man"
"fired into the pads, Roy walks inside the line and flicks another perfectly timed clip through backward square"
pushed on the up to long-on
"outside off, chopped down into the gully and over the outstretched arm of a toiling Gayle ... frankly I'm astounded he's bothered to take the field ... I'm sure his hammies were aching earlier ..."
"short and sharp, hits the seam and Roy grimaces after being suckered into a rash swipe"
tucked to midwicket for the hundred. Just 12 overs to reach that mark... which means they are comfortably ahead of the rate for now
"short, a top-edged pull, but <B>lands safe at midwicket!</B> Roy's lack of timing saves his bacon on this occasion!"
"clipped to the leg side, much fuller and straighter"
"back of a length, tapped to midwicket, more sharp singles. Root wanted two, but not this time"
"up on the toes, cut down to third man"
"flicked to midwicket, singles sufficing for England"
"back of a length, attempted flick off the back foot, but not timed on this occasion"
"opens the face, looking for a glide to third man, not this time"
"pushed back into the crease, clipped to mid-on"
worked to leg once more
"back of a length, squeezed to third man"
"slower ball on a good length, tucked to midwicket again"
"outside off this time, and <B>slashed fiercely through third man</B>. That's the way to fling the bat"
"on a good length, straight-bat jab to cover"
"short and wide, cracked on the up to deep point where the boundary is clawed back in with a sprawling dive"
"full-faced defence, back down the line of the ball. Not a lot of air on offer yet"
"<strong>filth from Bishoo, but class from Roy!</strong> Far too short and wide, but what looks initially like a toe-ended pull fairly roasts across the outfield and away past midwicket!"
drilled into the off side
pulled to the leg side. England continue to cruise
"tight line, pushed back onto the stumps and clipped to square leg"
"attempted nudge to leg, tight lines again"
"reverse swept, England jog the easy single, and miss out on the easy two as Pooran muffs his long barrier"
eased out to deep point
"<B>so close!</B> Roy rocks back for the cut but is beaten by the sharp pace, misses off stump by a whisker!"
"worked into the off side, a decent opening over"
"Holder drops a little short and wide, clouted off the back foot for one to the sweeper"
"short of a length, 128kph/80mph and the ball gets up on Root, hitting the splice as he tries to work across the line"
"fuller, whipped straight to midwicket"
"short ball, pulled from off stump through backwards square, just one to the sweeper"
"chance, <b>but Thomas can't get to it running back!</b> Top-edged hack across the line from Roy and it goes swirling up behind the keeper, the big fella is circling from short third man - but can't get near it diving full length!"
fired down the leg side
stays back and dabs into a gap behind point
"flat outside off, Root plays this very late, almost crouching in front of the wicket... Roy declines the run to short third man though"
punched through the covers for one
"swing and a miss from Roy... <b>Was it a stumping chance?</b> Hope didn't take the ball cleanly, but I'm not sure Roy lifted his back foot"
"<b>battered through the covers</b>, this is going to race away! All muscle as he forces this in front of the sweeper on the rope"
"flat offbreak, punched for one through mid-off"
Root comes across and steers one square
"full and sliding on to the pads, just a tickle of inside edge"
pitched up and driven through the covers coming across
"short of a length, Root swats at it and gets a thick outside edge down to third man - <b>50 stand between these two</b>"
"angling in with the arm, worked towards midwicket"
"<b>dropped...?</b> Tough to call it that, but Holder did get a hand to this in his follow-through. Just an uppish punch from Roy, hit the fingertips and disappeared to long-on"
"length ball, worked away off the pads"
dabbed to short third man
pushed through and slapped through the covers for one off the back foot
"tossed up and Roy throws the bat, basically gets a thick inside edge to long-on"
"dragged down and Root heaves into the leg side, bounces out to deep midwicket"
"fired in on the pads, tickled around the corner to short fine leg"
"slightly short and Root swivels on it, again picks out a man in the deep at backward square leg - five singles off the over"
"pitched up, 142kph/88mph and driven without timing to mid-off"
"full and a touch wide, stroked through the covers for one"
"short ball, 145kph and Roy likes that, rocks on to the pull and sends it rasping to the fence at deep midwicket!"
"full, outside off, <b>Roy hoons it down the ground</b>, almost goes all the way! A bottom-handed slap over mid-off, bounces once on its way to the rope... And Roy is into the 90s"
short of a length and dropped into the leg side
"full on off, Roy punches the single coming across"
"crunched down the ground, <b>goes to his hundred with a six!</b> Hit straight back over the bowler's head! Exuberant celebration from Roy, his seventh ODI ton, and from just 65 balls - <a href=http://stats.espncricinfo.com/wi/content/records/211608.html target=_blank>his fastest for England</a>"
Roy goes back and punches to long-on
"slides down the leg side, Root seizes on it and paddles the ball fine for four"
tossed up and poked through the covers
"flatter, goes back and mistimes a pull"
"makes room, hoicked over extra cover, <b>that's going all the way, too!</b> Roy is roving, and we know he can go big, as the holder of England's record ODI score"
Root punches down the ground
"<b>dropped!</b> Roy gets a life, poor bit of work from Pooran at deep midwicket, <b>shelled it despite getting two hands to the ball running around</b>, it then skittered into the rope, to compound the error"
goes back and swipes into the off side
"swing and a miss, Hope whips off the bails... He seems confident, it goes upstairs to the TV umpire! He had certainly stretched out of his ground, but did he get back? <b>Just a bit of boot behind the line</b>, concludes Bruce Oxenford, so Roy survives another chance"
tossed up and chopped through the off side
floated up and tapped away
tossed up and punched down the ground
"sliding in towards middle and leg, Root clips it off his pads - they think better of pushing for two"
"wheeling away on the stumps, glanced to short fine leg where Gayle fields"
lobbed up and poked into the covers
gets a touch leg side again and Roy just needs to get a tickle on it to send the ball past the creaking Gayle at short fine leg for four
pushed through quickly on the stumps and worked out to deep midwicket
"floated up outside off, Roy punches through cover"
"flighted, straightening on off as Root goes back"
"punched off the back foot through point, <b>bringing up the 100 stand between these two</b>"
"<b>dropped!</b> Brilliant effort this time, from Bravo, but he couldn't cling on! Hard, flat reverse-sweep from Roy, Bravo was going to his left and just got a hand to it"
"floated up full, Root rolls out the slog-sweep and gets it away for four"
tossed up on the stumps and tapped back
"back of a length, cracked through cover off the back foot"
"length ball on the stumps, Root nudges it to midwicket"
"sprayed a touch leg side, 129kph/80mph and Root glances it firmly wide of fine leg, Oshane Thomas collapses like a felled oak but does well to cut it off and keep them to two"
"short ball, plays a jabbed pull straight to midwicket"
dug in and he swivels fully on this to send the ball through square leg for one - <b>England raise their 200 in the 26th over</b>
back of a length and Roy rolls the wrists on a pull to deep midwicket
"tossed up, goes back and plays late through cover"
"flights his legbreak on the stumps, Root is across and paddles the ball fine for a couple - England's sixth two, as many as West Indies managed all innings"
tossed up and he stretches out to stroke through cover
"flighted, spinning away, dabbed to short fine leg"
"<b>another appeal for a stumping...</b> but looks like he'll be okay again. Big swing across the line, Hope did the business behind the wicket, but Oxenford is again happy his foot is back"
"slashes an edge towards short third man - <b>well taken diving forwards!</b> Roy swishes his bat, angry with himself, but he's got to go. He's had a few lives but that was a fine, pace-setting knock. Bishoo with the breakthrough, one West Indies desperately needed, with Bravo snatching up the chance just above the turf"
shortish and shoveled off the hip to fine leg
pitched up on fourth stump and met with a firm front-foot block
"bit of width, slapped away through backward point, fizzing down to third man for his first run"
"short outside off, Root cushions a back-foot shot through point for one more"
"fuller, comes forward and drives through cover-point"
"back of a length, 78mph and Root works it off his hip"
"tossed up and straightening on off stump, Root defends"
"pushed through, whipped away to the leg side but they elect not to push for two as deep midwicket hares in"
"angled across from over the wicket, Morgan goes back and punches down the ground"
"flighted, some spin outside off, Root plays it away square off the back foot"
"floated up outside off, Morgan reverses the hands and swats it past short third man, the ball spins and skips puckishly away from the fielder for four!"
tossed up and tapped back down the track
"hits a length on off, Root blocks back to the bowler"
"<b>dropped!</b> Short and wide, Root cuts straight to backward point, <b>but Nurse drops a clanger!</b> Straight in and out... Not what the doctor ordered for West Indies"
steers this to backward point along the carpet
"short ball, 142kph and Root pulls smoothly through backward square leg"
"length ball on off stump, Morgan shows it a straight bat"
"full and straight, 141kph/87mph and whipped away through midwicket for one"
"short of a length, bit tight to cut and Morgan sends it to backward point"
"dug in back of a length, Morgan drops back and shows it a straight bat"
comes across and slaps through cover
"drifts on to the pads, Root skims it away fine for four - <b>brings up his half-century</b>, at just under a run a ball"
goes back and across and steers this for one
"back to tight lines from Holder, defended on off - just six off the over, West Indies need to string a few of these together"
"short ball, wheeled away into the leg side"
"touch back of a length, Morgan closes the face and turns wide of mid-on"
"banged in at 149kph/90mph, Root pulls and gets a top edge... <b>but it clears the keeper and goes for four!</b> Oshane Thomas sighs and walks back to his mark"
"goes for another short ball, bit wider and Root ramps it in calculated fashion high over backward point and away for four more!"
pitched up and drived to mid-off
"length outside off, 137kph and Root stabs it through the covers"
"<B>so nearly the breakthrough!</B> Back of a length, a flimsy ramp from Root, carried all the way down to Nurse at third man who <B>drops</B> the chance, tumbling forward! Deary me..."
"banged in short, wide line, launched out to deep midwicket with a round-house pull"
"same line, same length, same shot. Same result. A haul to deep midwicket, and they jog back for the second"
"a touch of width outside off, carved to deep point"
eased out to deep midwicket
another pleasing cross-batted thump to deep midwicket
"back of a length, clocked to mid-off"
"swept but not timed, dribbles to square leg"
"into position early for the sweep once more, and placed out to the leg side"
"pushed back onto the stumps, clipped to midwicket"
"squeezed into the off side, aborted thoughts of a single"
"back and across, clipped to the leg side"
"worked off the pads once more, bread-and-butter single"
"nudged to fine leg, another single"
a touch more expansive this time! A big swish and a miss outside off
easy drive into the covers
"on the hips, tapped behind square. Runs everywhere"
"outside off, slashed on the up through third man ... <B>and poor old Nurse is in the firing line again!</B> Can't get a hand to a sprawling dive, and Root marches on!"
full face of the bat in defence
chopped into the off side
clubbed back past the bowler
"head over the ball, solid defence"
"too short, too leg-sided, and <B>humptied over the leg side!</B> The kitchen sink, stove, fridge and underfloor heating went into that one"
"sliding onto the back foot, swished to long-off"
"too much width, Morgan slashes hard through third man, and suddenly after a brief lull, they are motoring again"
"slower ball, but sliding past the pads"
"back of a length, swished to short cover, and England take on the arm of Allen in the covers, to good effect"
<B>squelch!</B> Root lines up a pull but gets that one painfully wrong. Wears it in the midriff like a man
half driven into the off side
"flowing drive, out to deep cover"
"banged in short, Morgan latches onto another pull, behind square for another single"
"outside off, chopped to backward point"
"back of a length, <strong>dumped on the up through the covers</strong>! Had to put a lot of bat through the bat to put some oomph into Campbell's slow-progressing pie, but he did so with aplomb!"
"flogged on the up with disdain, back over the bowler's head! Maker's name stuff"
flashed out to deep midwicket. Another ten runs chewed up in a blink of an eye
cracked through the leg side
"very full, into the toes, eased down to wide long-on"
"reverse-swept from Morgan, and beats backward point ... surprise, surprise, it's the hapless Nurse ... who needs a doctor"
"back of a length, and <B>manhandled over wide long-on!</B> It's a power grab"
cracked back to the bowler
"another paddywhack from Morgan, reversing his hands and dinked through third man, too fine for anyone to intercept"
"on the hips, clipped to deep midwicket, and it's a <B>37-ball fifty for the skipper</B>, and it hasn't even seemed a particularly rapid knock"
"back and across, a solid block on the back foot"
"flicked to the leg side, <strong>up comes the 300 </strong>in easy peasy time"
clunked to midwicket
open-faced drive to short cover
"back of a length, nicely glided into the gap in the covers"
fully forward to block
"width, and chopped to backward point. A better over for Windies, but they need a wicket fast"
"forward, and blocked"
"flashed down to long-on, with another roundhouse pull"
"dabbed out to point, and another simple single"
"on the hips, nudged backward of square"
"a hint of spin on a full length, Root plays it from the pitch with a clip to the leg side"
"tossed up, dipping into the toes, and slog-swept behind square"
"low full toss, clipped calmly to midwicket"
"down on one knee, and <strong>battered mercilessly into the stands!</strong>"
tapped into the off side
swished to the leg side for another single
pushed onto the back foot and blocked
makes room for another dab to backward point
fired out wide of off stump
"another non-dot, into the off side"
"crashed through the covers, another single to the deep-set field"
"up on the toes, blotted out to cover"
"<B>slapped straight to mid-off!</B> A tame end to a fine innings, but Morgan has done his bit for the cause. Just through the shot a touch early, and Holder clings on low to break what must surely still be a match-sealing stand"
banged in short and defended
"squared up on the back foot, and blocked back down the pitch"
a calm punch into the covers
barely hits the cut strip with that one
"wide of off stump again, but biffed firmly on the up to cover"
"on the pads, and flicked to the leg side"
"fired into the pads, Stokes is trapped on the crease, but that's sliding down"
"<B>so close!</B> Angling into the left-hander, sliding on with the arm, and just past off stump!"
full-faced block to tighten the screw a touch on the new batsman
"tapped into the covers, and well blow me down, Root is on 93 ... when did that happen?"
"clipped off the pads, good firm calling and they book the second run as soon as the ball is struck"
"wide full toss, and <B>flashed through third man!</B> Not remotely where Stokes intended, as he drills a drive in the direction of cover. But that'll do ..."
"short, wide, slapped over the covers to the sweeper"
"banged in short, and round-house-pulled to deep midwicket"
short and leg-sided. It's looking futile now
tonked to the leg side. 25 from 30 is the requirement
full-faced drive into the off side
"back of a length, flogged to midwicket. Root rumbles onwards"
"wide line, outside off, a <B>Test-match leave from Stokes!</B>"
bottom-handed biff into the covers
driven into the covers
"full toss, Stokes picks his spot to pick off the single"
"well, that was random. An inelegant chip into the leg side, as Stokes was bamboozled by some barely perceptible lift off the deck. Landed safe though, so on we go"
driven into the off side
"on the up, pushed to cover"
"attempted pull by Stokes, but can't make proper contact. He's not quite found his range today ..."
"<B>that's better from Stokes!</B> In the slot for a full-faced drive, through the covers"
"tucked off the hip to the leg side. Stokes steals the strike again! It probably won't matter to Root, but ..."
