"127kph, chest high short ball, he's back and pulling from high to low getting it down behind square"
"127kph, angled into leg, he's clipping this neatly off his pads, lovely timing and they run three"
"122kph, fuller wider of off, he drives away from his body to cover"
"120kph, wide of the crease, angled in but another half volley, he drives fluently straight to mid off"
"123kph, full length again, hint of shape, he mistimes a drive to mid off"
"<strong>dropped by de Grandhomme running back from square leg!</strong> Short ball, got big on him, he took on the pull, spooned a top edge forward of square, de Grandhomme got to it but spilled it running with the flight. He would have expected to catch that despite moving at full speed"
"back of a length outside off, he's back and defending"
"128kph, short ball, chest high, he's back and pulling through forward square"
"short ball, wide of off, he's cutting to backward point"
"bouncer, outside off, 129kph, he drops the hands and the knees to get under it"
"129kph, shorter length, wide of off, it doesn't get up, he drops the hands inside it"
"76kph, floated very high outside off, he reaches out and slaps it through point to the sweeper"
"beaten outside off, this was pushed through and turned wide of off"
"drifting into leg, he skips out and works this close to midwicket's right and they pinched one"
"82kph, pushed through, drifting in and sliding on, he cuts from close to off"
"flatter and straighter again, he's back and staying leg side to punch to cover"
"fired in, 83kph, on off, he's back exposing the stumps but defending"
"125kph, short and wide, he <strong>cracks a cut shot through point!</strong> Brave shot with the variable bounce but he nailed it getting on top of the bounce"
"120kph, shorter length, tighter to off, he stands up and defends with the full face"
"129kph, shorter outside off, he checks a pull shot straight to the man at a square midwicket"
"127kph, back of a length wide of off, he's jumping back and defending away from the body"
"127kph, bouncer, angled across him, he sways inside the line"
"130kph, short ball on off, he is back and across defending with a vertical bat"
"82kph, drifting into middle, he defends from the crease"
"drifting down the leg side, he misses out trying to glance"
"advances and <strong>smokes it flat over Santner's head!</strong> This was tossed up, he was down quickly and he hit this powerfully. He enjoys taken on the spinners"
"drifting into leg, it takes on the pad but was sliding well down"
charges again and smashes this along the ground straight at Santner who fields well. That was nailed. He wasn't near the pitch of it
"good length, some bounce and turn, he defends from the crease"
"118kph, good length fifth stump line, hint of shape, he leaves"
"118kph, fuller length and tighter line but he leaves again"
"115kph, shorter and wider, he's back and cutting behind point wide of the sweeper and they run well for two"
<strong>edged short of Taylor at a floating slip.</strong> He drives firmly but this shaped late and found the edge but it was well short of Taylor who is wide at a third slip
"good length, on off, he defends from the crease"
"114kph fuller on off, he defends again from a compact position"
"89kph, darted into leg, he's back and taking on the thigh guard trying to clip it away"
"87kph, short drag down, he pulls behind square to the man in the deep"
"shorter and wider, he is back and waiting to run it delicately fine of backward point, Wagner pouts in a hug effort with the chase. He never stops"
"fuller on middle, he works this off the front foot to midwicket"
"tossed up outside off, he caresses this past cover, the man in the deep is stretched and they take two"
"80kph, good length, he's back and tucking this towards midwicket and they run one"
"120kph full away swinger, he plays a textbook check drive to mid off"
"<strong>An lbw shout!</strong> Not out the call. New Zealand <strong>review</strong>. Good length outside off, shaping away and then nipping back. He did not offer a shot. It just brushed the pad. Ball tracking had it missing off by a ball width. New Zealand lose their second review"
"good length wide of off, he leaves"
"118kph, full and too straight, he pings this off the pads to deep square"
"117kph, chest high short ball, he rolls the wrists on a pull shot hitting it to the sweeper"
"good length on off, he defends from the crease"
Burns gets a good stride forward to smother any turn. Gets a bit of an inside edge to square leg and pinches a single
safely blocks a length ball on off stump
"waits on the ball that little bit longer, his body opened up and in perfect position to tap the ball on off stump, on top of the bounce, to square leg for a single"
shifts back and turns a quicker delivery on middle behind square leg
"full on off stump, keeps it out"
"<b>oooh, close!</b>. Labuschagne hangs back, waiting to manipulate the ball perhaps into the legside again, but this one skids through quicker off the pitch and nearly topples him. The man in form, of course, is able to bring a straight bat down in time"
works a back of a length ball to midwicket
reaches away from his body to guide a good length ball outside off through point
lets a length ball go outside off
gets right behind a length ball on off stump
sweet cover drive as he gets onto the front foot to deal with a pitched up delivery outside off.
pushes a full ball on off stump to mid-on
"full and outside off, he drives to cover"
opens the face and spears a full ball on off stump away to the sweeper
"steps out and gets too close to the ball, which he eventually digs out straight to the bowler. Santner pretends to appeal, even looking at the ump to make it look legit"
works it away to deep midwicket
stays back to carve a good length ball coming for his off stump away to the left of cover. Half a chance he could've been bowled there
"full on off stump, Burns is forward with a block"
"full and outside off, drives to cover"
"digs it in and Labuschagne thinks about going after it, but it's just way too high"
"appeal for lbw from the keeper, nothing from the bowler though, CdG prolly knew it would be heading down. Labuschagne's clip off his thighs doesn't quite work out that time"
"good length, outside off, no shot"
<b>leading edge</B> past point as de Grandhomme gets some late away swing. It's not as useful as originally thought though with the umpire signalling no ball
"full on off stump, excellently defended"
"<b>finds the gap between gully and second slip</b>. And the audacious thing he is he was actually looking for it. He let the back of a length ball go past him before planting the angled face down on it, making sure the ball went down to ground straight away"
"full and outside off, defends"
"he's been fancying Santner. He's been fancying everyone! Last over there was the glide through the cordon, here there's the more imperious, steps out of his crease and boof over extra cover. Absolutely flipping brilliant. <b>Goes past 1000 runs in 2019</B>"
"allows the quicker, flatter delivery to come down and then calmly sends it scurrying to deep square leg"
"full on off stump, defends"
"lovely shot again, this one from Burns. He waits for the short ball to pass him before executing the perfect late cut, sending it away past Wagner, who despite a whole-hearted effort, has no chance of catching up"
"slows it down, but it doesn't really seem to matter. The length is still short and Burns is able to manipulate it for a single to square leg"
"pushes it through on off stump, Labuschagne punches it to cover"
"length ball on middle, nudges it to midwicket"
chops a shortish delivery outside off to gully
"back of a length and outside off, no shot"
"full on off stump, blocks"
no shot again with de Grandhomme plying away outside off
"full on off stump, defends"
gets forward to block a fuller delivery on off stump
"good length on off stump again, Labuschagne is ready with a defensive bat"
"<b>lashes it over third man</b>. He picks up the short ball so early. He's up off his feet, his everything set on the upper cut, and he absolutely nails it"
<b>whippyyyyyy</b>. He takes a full ball on off stump and with the power in his wrists sends it away to deep square leg. Easy as pie
carves a short ball outside off to the right of the sweeper and Raval does well to track it down
"full and outside off, eases it through to the sweeper"
turns a fuller ball on middle to short midwicket
"<b>leading edge</b> as Labuschagne continues to do that thing where he takes balls around off stump and tries to dump them at midwicket. This one though straightens enough, and kicks up as well, to draw a false shot"
""
flicks a full one on the pads to deep midwicket
lets a good length ball go outside off. Little bit of nip away off the pitch as well. We're in that time where the pink ball might start to do a bit again
another wise leave alone from Labuschagne
opens the face and slices a back of a length ball down to third man
goes for the bouncer and Labuschagne bends his knees and sways out of the way
"<b>ouch</b>. A throw at the bowler's end, umpire Dar is getting out of the way, Santner's trying to back up the throw, and they both collide. Dar is down, the problem is the knee. Both the NZ and Australia physios are tending to him but he does look in a lot of pain. In case anyone's wondering, Labuschange defended a good length ball down the pitch and Burns thought the ball had gone wide enough of the bowler for a single. Nope. Southee's there and Burns needs a big dive in the end"
pulls a bouncer from outside off away to deep midwicket
taps a short and wide delivery down to third man
"good length, outside off, no shot"
<b>beats the edge</b> which shouldn't be happening when the ball is practically a one-day wide. Burns lets himself get sucked into the ball
"back of a length and outside off, taps it towards point"
"<b>inside edge</b> with Burns still getting into the shot even though the good length balls is already onto him, nipping into the right-hander"
"full on off stump, with a tinge of away swing, Labuschagne does well to keep a straight bat"
"bouncer down leg, he pulls it down to long leg"
"back of a length on off stump, chops it to backward point"
"good length on middle, Labuschagne clips it into the vacant midwicket region, excellent placement to pick up two"
"pulls, making sure to get on top of the short ball outside off and roll the wrists, and finds a single at deep square leg"
"<b>fifty!</b> and he gets there with a firm push through the covers. Gets a hug from his partner and warm applause from the crowd. Good innings, although he did seem to fight his urges all the way through it"
"good length, outside off, no shot"
"nicely done again! This time Burns is alive to the quick single, dragging his partner on after Labuschagne plays a soft-handed block with the ball barely leaving the side of the pitch"
"good length, outside off, lets it go"
shovel-pulls the short ball going down leg to fine leg
"looks for the pull, and the ball is there for it, short and wide, but he ends up bottom edging to the keeper"
"bouncer, this one rising up properly to his throat. Burns knows that well enough and ducks under it"
"short again from Wagner, no interest from Burns"
"fuller ball outside off, he blocks to cover"
slower short ball this time and Burns adjusts to the lack of pace and bunts it back down the pitch
"good length ball on off stump, Labuschagne blocks"
flicks a flatter delivery on leg stump to fine leg
nudges the ball off middle stump straight to fine leg again and throws his head back in disappointment
"beats fine leg this time with a sweep as Santner bowls fuller, but still targets middle and leg stump"
"full and outside off, taps it to midwicket"
works a full ball from outside off to the right of midwicket
bouncer on middle from around the wicket. Too high for the batsman to think about a shot
rises up to the short ball outside off and basically lets it hit his bat which is pointed towards the vacant mid-on region.
"<b>that's on him</B>! Wagner scoops a whole load of venom out of himself and douses it into this short ball and it comes hunting for Burns. The batsman goes for the pull, but mis-hits to midwicket"
"that's a slower ball, he digs this one into the middle of the pitch too, but because it's the variation, it doesn't bounce as much and Burns has to change from a horizontal bat shot to a vertical bat block"
"continues with his bouncer plan, but that one's too high says umpire Llong"
"looks for the yorker on middle, he works it to midwicket"
"curls into him and because he's taken the pace off as well, he makes Burns reach in front of his body as well to play a shot to midwicket"
chops a shortish delivery outside off to gully
"full on off stump, pushes it down to long-on"
"good length, on off stump, defends"
whips a shortish delivery on leg stump to long-on
"good length on off stump, defends to midwicket where Nicholls sprints in and sends through a direct hit. Labuschagne's back though"
punches it down the pitch
"full and outside off, eases it through the covers and jogs through for a fifty. Very easy on the eye, excellent judge of length, unbelievable hunger for runs"
"127kph, shorter length, he's back and defending a ball that's climbing, knocking it down"
"<strong>mis-hit pull shot to forward square!</strong> Wagner gets him again! This was banged in, cramping him for room, he tried to pull, he clothed it, completely mis-hit it straight to Santner who took an easy catch at forward square"
"132kph, back of a length on middle, he's back and across and defending towards midwicket"
"130kph, shorter length over leg, he lets it go. It goes straight over leg"
"109kph, fuller slower ball, swinging in, he clipped to deep square"
"132kph, bouncer outside off, he leaves it outside off"
"118kph, good length angled into off, he pushes to mid on with the full face"
"126kph, good length wide of off, he leaves with a big stride forward"
"126kph, good length sixth stump, he leaves"
"124kph, back of a length outside off, he's back and defending to cover-point"
138kph wide half-volley and <strong>he thrashes it through cover!</strong> It was wide and he just threw the hands through the line and the timing was supreme
"<strong>Even better back past the bowler!</strong> 127kph long half volley, he pounds this straight back between Southee and the stumps. Some start from Smith"
"102kph, knuckle ball slower ball, swinging in, yorker length, he defends"
"124kph, chest high short ball angled in, he pulls, rolling it down through square leg to the sweeper"
"130kph, bouncer over middle, he ducks well"
"130kph, bouncer over leg, he ducks under it"
"131kph, low full toss, he flicks this off his toes, Santner's midfields at forward square and allows a single"
"112kph short slower ball outside off, he runs a cut shot to gully but can't beat the man"
"130kph, short into the ribs, he's back and across and defending into the leg side"
"126kph, bouncer down leg and he shows no interest"
"127kph, bouncer over off and it's too high and called wide"
<strong>struck on the pad but it pitched outside leg!</strong> Not out the right call after a good appeal. No reviews for New Zealand. That shot low as he went back. It might have missed off on the angle too
this climbs off a length and hits him on the glove! Cannoned into the bottom index finger and jammed it against the handle
"130kph, short ball, chest high, <strong>he controls the pull shot past leg gully and times it well enough to beat fine leg!</strong> Brave shot and he controlled it really well with excellent timing"
"128kph, short into the ribs, he's back and defending it around the corner"
"129kph, short ball outside off, he pulls with a short arm jab to midwicket"
"112kph, short and wide, he cuts firmly to deep point"
"129kph, shorter length, he's back and across and defending"
"134kph, good length, angled across, he raises the bat above his head to leave"
"131kph, shorter ball, into the arm pit, he rises on his toes to knock it down"
"133kph, short ball he backed away and tried to hit a tennis shot down the ground! It was like an attempted Rafa Nadal cross court two-handed forehand from above his shoulder! He miscued it completely"
"129kph, short down the leg side, he can't catch up with it"
"<strong>caught at gully! A brute that flies off the gloves!</strong> 128kph, from around the wicket, banged in, it reared at him, he jumped and fended, punching it off the gloves into the gully, Nicholls does well, low to his left to take the catch"
"127kph, bouncer first up, he ducks well"
"131kph, back of a length angled into off, he defends from the crease"
"124kph, bouncer, over leg, it stays a touch lower but he ducks under it well"
"127kph, fuller and wider, he leaves"
"132kph, shorter length outside off, he's back and pushing this to point"
"<strong>nearly pops to short leg!</strong> He is deep. Another climbing short ball, he rides it, it comes off the handle and pops up but falls short of short leg"
"133kph, bouncer, he hooks and just rolls it short of leg gully! Very similar shot to how he fell in the first innings"
"132kph, chest high short ball, he's back and pulling forward of square to the sweeper"
"132kph, bouncer, over off, he ducks under it"
"130kph, back of a length on off, he is back and across and defending well"
"126kph, short ball, he's back and pulling firmly with control to the man in the deeper"
"128kph back of a length outside off, he's back and across and defending"
"126kph, back of a length on off, he's back and defending"
"<strong>cracking pull shot behind square!</strong> 126kph, chest high, he swivelled on it and flushed it, rolling the wrists, nailing it between the sweepers"
"125kph, bouncer, much higher, he ducks"
"128kph, good length fifth stump wide of off, he leaves"
"<strong>caught at deep square!</strong> Wagner sucks him in again! Another short ball, he took on the pull shot, he hit it flat and hard but straight to Raval who is about 30 metres from the rope for that exact shot and he takes the catching rolling to his right! Wagner is a marvel."
"129kph, short down the leg side, he flicks and just misses"
"128kph, short into the ribs, he rides it and glances in the air but wide of leg gully"
appeal for caught behind but was it off the arm? Yes according to Nigel Llong. Brutal short ball. No reviews. He ducked into it and took it on the forearm. Did it hit the handle before flying to Watling? Maybe not. Hard to tell
another brutal short ball and again he cops it on the arm! Just ducked straight into it
"128kph, bouncer, over leg, he ducks under it"
"short into the ribs, he tries to glance it, it comes off glove but drops down to leg gully"
"123kph, short ball, it balloons off the surface, he rises with it and defends with the full face"
"short into the ribs, he glances in the air<strong> but fine of leg gully and away for four!</strong> Brave shot"
"127kph, short into the ribs, he tucks it away getting down on the bounce to leg gully"
"127kph, bouncer over off, he drops the hands and gets under it"
"125kph, bouncer, too high over leg and rightly called"
"<strong>caught at leg gully! That was always going to happen</strong>. He had been riding his luck glancing fine of leg gully and short of him. This was short into the hip, he played away from the body, and glanced it straight to him. Easy catch for de Grandhomme. It was like catching practice."
"128kph, back of a length on leg, he defends from the crease"
"127kph, short ball, he stands up and wears it straight on the arm! Wagner claps him"
"105kph, slower ball full toss, he clips it off the pads, but Latham makes a great save"
"128kph, yorker, he digs this out and it a bit unsure where it goes"
"bouncer, over leg, he ducks under it"
"130kph short ball, he again just stands there and cops it on the arm!"
"128kph, bouncer, over leg, he ducks under it"
"<strong>Bowled him!</strong> Good length angled from around the wicket. It was a scrambled seam, Paine pushed from the crease but played down the wrong line, it just wobbled in a touch, beat the inside edge and lit up the top of middle!"
"good length angled down leg, he misses, this wasn't far from leg stump"
"126kph, bouncer, he ducks under it"
"128kph, fuller outside leg, he tries to glance, it just misses leg"
"128kph, short of a length on leg, he's back and defending"
"130kph, thigh high full toss, it surprises Wade as he bunts it away"
"106kph, slower ball outside off, he drives nicely to cover but can't beat the man"
"130kph, good length, fuller, angled into off, he's squared up in defence on the front foot"
"bouncer 130kph, over leg, he did not move but fortunately it seamed down leg and missed his body"
"111kph, slower ball bouncer, outside off, it doesn't bounce that much"
"134kph, bouncer over leg, again he stands still and lets it fly over his shoulder"
"shorter leg, he parries this away off the hip and it pops up short of leg gully"
"126kph, good length top of middle, he stands up and defends"
good length on the top of middle and he defends on the back foot
"fuller on middle, he prods forward and defends"
"125kph, bouncer, over middle, too high and it's called wide"
"128kph, back of a length on middle, he defends off the back foot"
"126kph, good length, top of middle, he defends from the front foot"
"low full toss, <strong>he flicks this away neatly and powerfully behind square!</strong> That was a nice shot. More like the Wade we know"
"130kph, bouncer into the body, he dugs into it, it bounces off his back fine of leg gully for a leg bye"
"129kph, angled in seaming away, <strong>beats him</strong> as he's squared up"
"128kph, short into the ribs, he's back and working this behind square for a single"
"<strong>nearly caught at short leg!</strong> 127kph, length ball, he prods forward gets an inside edge, it comes of pad, pops up but short of Latham!"
"128kph, full on leg, he leans out and defends"
bouncer over leg and he ducks
"fuller on leg, he pushes this away to mid on"
"120kph, good length on middle, he defends from the crease"
"121kph, bouncer outside off, he ducks under it"
"122kph, angled into leg, it catches the pad and rolls away. No real appeal as it was tailing"
"123kph, angled down leg, he glances this fine of fine leg and they get an easy two"
"123kph, bouncer over leg, he ducks under it"
"125kph, bouncer, higher over middle, he ducks easily"
"126kph, back of a length on middle, he defends from the crease"
"128kph, shorter length, jams his left middle finger! That hurt. It dropped down safely after hitting the glove but he was hurt then. He waved away any treatment that was coming on"
"short ball into the hip, he just stands there and lets it hit his hip!"
"130kph, fuller length, angled into the hip, he expects it to hit him but it misses the thigh and flies behind to Watling"
"123kph, back of a length, nipping into the thigh guard"
"over-pitched drifting into middle, he clips this beautifully with the angle between midwicket and mid on, nice timing and placement"
"123kph, back of a length on off, he is squared up, edges but short of wide slip"
"122kph, back of a length on off, he defends from the crease"
"122kph, good length wide of off, he leaves"
"good length, wide of off, he leaves"
"129kph, bouncer over leg, he ducks under it"
"129kph, another short ball down leg, he stands there tucks the shoulder in as it flies past his back"
"130kph, short ball, into the body, it runs off his body as he lets it hit him and it runs fine to the boundary but it's a dead ball. Nigel Llong deemed it wasn't evasive action"
"fuller down leg, again, he stands there and doesn't move"
"128kph, fuller on leg, he clips this off his toes to forward square"
"130kph, bouncer over leg, he ducks"
"good length top of middle, he defends"
"full and straying down leg, <strong>he glances this neatly fine to the rope.</strong> Poor delivery and it was put away"
"106kph, slower ball dragged short and wide, he <strong>stood up and smashed it through cover-point!</strong> That was filth and it was dispatched"
"123kph, good length, middle and off, he defends on the front foot"
"fuller outside off, he drives on the front foot to cover"
"121kph, short outside off, he drops his knees and sways back"
"130kph, short into the body, he lets it hit the elbow and it flies to Watling"
"99kph, slower ball, it swings but it's a full toss, he blocks it to mid off"
"length slower ball, he just leaned his body down and let it hit him in the arm"
"130kph, full on leg, he clips this away easily to fine leg"
"131kph, short ball into the ribs and he rises with it to knock it down awkwardly"
"<strong>caught down the leg side!</strong> Another for Wagner. Back of a length down leg, he shuffled back and across to glance, got a little tickle of the face of the bat and it was an easy catch for Watling"
"122kph, good length shaping back a touch but he leaves it"
"120kph, over-pitched and <strong>he climbs into a glorious cover drive!</strong> Magnificent stroke. He got a huge stride in and thumped it past cover"
"123kph, length ball wide of off, he leaves"
"122kph, good length angled into off, he defends"
"123kph, <strong>over-steps</strong>, full and wide and he slashes a square drive up and over backward point! Just a freebie and Wade thrashed his hands at it"
"<strong>caught at deep square!</strong> A chest high short ball at 120kph, he takes on the pull shot with a man out, which he didn't do against Wagner, hits it flat but not out of the middle and straight to Raval running in from deep square. Good catch from Raval again"
"124kph, good length on off, he defends on the front foot"
"131kph, full into the pads, it pitches outside leg before hitting him on the pad"
"129kph, short ball down leg and he nearly catches up with it trying to glance"
"130kph, back of a length into the hip, he defends awkwardly off the hip"
