"128kph, back of a length, on off, he's back and defending with soft hands to cover and they pinch a single straight away"
"129kph, some shape, good length outside off, he pushes half forward with an open blade to gully"
"129kph, fuller outswinger, fifth stump, he checks a drive straight to cover"
"127kph, good length, hint of away shape, fourth stump, he defends on the front foot"
"127kph, back of a length, fourth stump, he presses forward and defends off the sticker of the bat"
"good length, wide of off, he leaves"
"145kph, shorter into the ribs, he's back and glancing this off the gloves down to fine leg"
"144kph, fuller and wider of off, he leaves this"
"143kph, back of a length well side of off, this flies off a length! Watling takes it above his head after Burns left it alone"
"142kph, <strong>beaten</strong>, good delivery, wide of the crease, angled in and straightening from a length, flew past the edge"
"144kph, good length wide of off, he leaves alone"
"good length, angled into off, he defends on the front foot"
"128kph, full and shaping into leg, he works this just past the forward square leg for a couple, nice placement"
"127kph, back of a length, leg stump, he tries to work off the hip but misses out, it comes off the thigh guard"
"130kph, good length, top of middle, he defends half forward"
"129kph, back of a length angled way wide of off"
"128kph, yorker, hint of shape in, he defends on the front foot"
"over-pitched, he drives nicely with a bottom hand jab through cover, it's the long boundary down there, deep pockets here, they run an <strong>all run four</strong>"
"141kph, <strong>bouncer flies way over the batsman and the keeper!</strong> Too high and called wides. It went way down leg too. Watling stood no chance"
"146kph, good length but way wide of off"
"142kph, good length, nipping back sharply off the seam, <strong>beats</strong> the inside edge! Watling dives to his left full length to knock it down"
"138kph, too full and straight, he <strong>tucks this off the pads behind square!</strong> That's a gift to Test openers. Nicely done by Burns"
"142kph, back of a length angled in and he gets an inside edge onto the back thigh and it balloons into the off side"
"143kph, full angled into off, he pushes firmly on the front foot"
"<strong>edged and just short of second!</strong> Good length wide of off, he prodded at it away from his body but with an angled bat so it went down and fell short of second, it went through him to get a single"
"131kph, good length, outswinger wide of off, he leaves this"
"133kph, good length, no shape, angled into off, he defends on the front foot"
"129kph <strong>beaten by a beauty!</strong> Back of a length angled in, pitching off and seaming away, squared him up but beat the edge"
"good length, away swing, he strides forward and defends off the sticker of the bat"
"125kph, good length, wide of off, he defends on the front foot, it runs off the angled bat to gully"
"128kph, yorker on off, he digs this out, jamming the bat down"
"147kph, good length, angled into off, he defends on the front foot"
"145kph, fuller, he's half forward getting a thick inside edge that runs behind square"
"146kph, shorter into the hip, he's jumping back and working this to square leg"
"147kph, good length, top of off, he defends from the crease to mid off"
"147kph, good length, top of off, he defends from the crease"
"147kph, over-pitched <strong>and punished through cover!</strong> He was hanging back a touch but this was a long half-volley and he just pushed the hands through it and crunched it through the large gap"
"good length on off, he defends back to the bowler and Southee gathers and pings it straight at Burns! Hits him on the pads. He hadn't moved out of his crease"
"good length on off, he defends on the front foot"
"good length, 130kph, fifth stump line, he defends on the front foot with soft hands"
"126kph, back of a length wide of off, he's back and rising on his toes to defend towards point"
"128kph, wide of the crease, angled in and shaping away but it's wide of off and he leaves"
"wide of the crease, 128kph, good length, angled in but wide of off again"
"144kph, half volley and <strong>thumped in the air through the gap at cover!</strong> This was too full, Warner didn't move his feet much but just thumped it in the air with supreme timing"
"144kph, shorter into the ribs, he's back and glancing this fine to long leg"
"140kph, bouncer over off, he ducks under it"
"142kph, good length wide of off, he leaves this alone"
"144kph, fuller outside off, he leans into a drive and caresses it through cover for three"
"145kph, back of a length, he's back and pushing to cover and they pinch a single"
"fuller, swinging into off, he pushes this firmly to mid off"
"132kph, good length wide of off, he leaves this alone"
"131kph, full and wide and he <strong>square drives past point!</strong> This was way too full and wide. He reached out and placed it past point"
"130kph, back of a length, fourth stump, he's squared up and defending"
"129kph, back of a length wide of off, he leaves this"
"back of a length, 132kph, he's back and defending"
"129kph, fuller on off, he defends on the front foot back to the bowler"
"132kph, good length, angled back in, he defends on the front foot back to the bowler"
"133kph, fuller and wide of off, he leans into a drive to mid off"
"134kph, very full outside off, he drives but mistimes it to mid off"
"136kph, fuller on off, he defends on the front foot"
"131kph, good length shaping back, he shoulders arms and is taken on the top of the pad, there's <strong>an appeal</strong> but it's not out. Going well over."
"122kph, fuller and wide, he tries to drive but mistimes it, dragging to cover"
"121kph, good length, on off, he defends on the front foot to gully"
"122kph, a bit of swing but it shapes down the leg side"
"120kph, good length, swinging in, he defends with sift hands, it runs behind him but well wide of the stumps"
"fuller, 123kph, shaping in, he drives inside out straight to a close cover"
"122kph, good length, wide of off, he leaves"
"134kph, fuller, shaping in, he pushes to de Grandhomme at mid on and takes him on, it's not fielded cleanly"
"<strong>leading edge just short of close cover!</strong> 135kph, angled into middle, he tried to work to mid on and sliced a leading edge but it landed safe"
"130kph, full on middle, he pushes this wide of mid on and calls immediately for one"
"138kph, good length angled wide of off, he leaves"
"135kph, fuller outside off, he mistimes a drive to mid off"
"135kph, taking on the pad but this might have pitched outside leg and they aborted the appeal"
"good length, wide of off, he leaves watchfully"
"120kph, good length, swinging in, he defends on the front foot back to the bowler"
"124kph, good length, wide of off, he leaves"
"good length 121kph, wide of off, hint of shape back but it's wide enough to leave"
"125kph, back of a length on off, he's back and across and knocking this to square leg for a single"
"<strong>Given LBW!</strong> No review. He had a long chat with Warner but walked off. Fuller length, hinting to shape away but it hit the seam and darted back to hit the pad below the knee roll. He was only half forward. Looked pretty good, <B>but HawkEye says the ball would miss leg stump!</b> Burns should've reviewed..."
"back of a length on middle, and going down the leg side. Gloved towards short fine leg"
"good length, on leg stump. Flicked off his hips to square leg"
"full on middle, and clipped off his toes to the midwicket boundary. Ferguson runs around the boundary to intercept"
"full, outside off and angling further away. He lets it go through to the keeper"
"good length on off, and going across Labuschagne. He opts to let it go but not before a Smith-esque leave"
"back of a length on middle, and he rides the bounce to pull to cow corner. They scamper back for a second"
"full, and wide outside off. Swinging into the left-hander from around the wicket, and he mistimes a front-foot drive back to the bowler"
"full, outside off, and pushed off the front foot to cover"
"full, wide, from around the wicket. Left alone"
"full, outside off, and tapped off the front foot to mid-off. Williamson sprints across to stop the ball from sneaking through"
nearly a yorker! But Warner manages to prod forward and wedge the ball back rather safely
"good length on off, and pushed away"
"full, just outside off, and he gets onto the front foot before comfortably pushing it to the off side"
"length ball, just outside off. Shaping in slightly, but no so much to bother the batsman. He lets the ball through to the keeper"
"full, outside off stump, and angling further away. Left alone"
full and fast but very wide outside off. Patiently shoulders his arms again
"full, just outside off. This time Labuschagne must play at the ball, so he presses forward to defend with soft hands"
"full, outside off, and he plays a square drive away from his body. Sliced through the gap between backward point and point. <B>Team fifty</b>"
"full, outside off stump, and he presses forward to defend, but the ball whizzes past his outside edge"
"full, on off stump. Seaming in, and defended"
"full, just outside off, and check-driven to Latham square on the off side for a quick run"
"full, outside off, but swinging away from Labuschagne. He's happy to let this one go"
"full, just outside off, but aimed at the stumps. He presses forward to defend the ball back to the bowler"
"full, just outside off, and he takes a tiny step forward to drive. Struck to Williamson at mid-off"
"fullish, outside off, some extra bounce before going through to the keeper"
"full, and fast on off stump. Warner's hurried onto the front foot, but he brings his bat down to edge a shot to point. <B>Minimal footwork</b>"
"full, on off stump, and Warner pushes with the bat's closed face to mid-on. Big shout of 'no' for the single"
"good length ball, angling into his body. Tries to work it off his hips, but it is gloved to the leg side instead"
"full, just outside off, and he leans into a front-foot drive. Goes past short cover, but intercepted by mid-off"
"full, outside off, and angling further away. Left alone"
"full, on off stump, and <B>he crunches a drive</b> past the diving fielder at mid off! Glorious first boundary for Labuschagne"
"full, from around the wicket. Seaming into his pads, and defended back"
"full, outside off stump. Presses forward to push the ball away towards cover"
"full and wide outside off. Plays a drive away from his body, but it rolls safely along the ground to the fielder in the deep. Santner, at cover, got a fingertip to it as well"
"good length outside off stump from over the wicket. Seaming away, and left alone"
full outside off and swinging away. Batsman leaves and keeper scurries across to intercept the delivery
"full, just outside off, and he shuffles across before driving straight past the non-striker. Finds mid-on though"
"<B>wild</b> first delivery. Loopy, outside leg stump, and he goes for the sweep. Warner misses the shot, keeper misses the grab, and fine leg has some running to do in the deep"
"full, on off, and skidding through. Defended back"
"length ball, wide outside off, and he plays a cut which is too close to his body. <B>Flies off the edge</b> past first slip for four. Dangerous shot, but he maximises the reward on this occasion"
"good length, just outside off, and holding it's line. Fended with soft hands to the off side"
"full, on leg stump, and pushed past short midwicket to mid-on. Gets off strike"
"full on middle stump, from around the wicket. Giant stride forward to defend"
"back of a length, outside off, and he rides the bounce to block the ball away to the off side. They scamper across for one"
"good length, just outside off, and Labuschagne covers his stumps before shouldering his arms"
"length ball on middle, but angling down the leg side. He looks to flick but gets no contact. Through to the keeper"
"full, outside off stump, and left alone"
"good length on off, and angling in. He gets behind the delivery and defends"
"length ball outside off, but angling inwards. Labuschagne shuffles across the cover his stumps before shouldering his arms"
"starts off another over with a wild delivery. Full, and very wide down the leg side. Warner misses the sweep, and the keeper does well to manage a glove to it. Slows down the ball's pace and Warner smiles at the missed opportunity"
"full, on leg stump, and pushed to the leg side"
"fullish, on off, and he rocks back to defend towards the leg side"
"good length, just outside off stump. Cut off the back foot to the off side"
"full, on off, from around the wicket. Presses forward to defend to the leg side"
"full outside off, but grips and turns away thereafter. Defended away to the off side"
"back of a length, on off, but doesn't bounce as much. Warner blocks off the back foot"
"good length, outside off stump, and fended away off the back foot to cover"
"full, on off, from around the wicket. Sharp swing into the batsman's pads, and he flicks it to the leg side"
"full on leg stump, and swinging further down leg. Warner wants to clip it leg-side but can't get bat on ball"
"full, outside off and swinging inwards. Driven to extra cover for a single. Sweaty hands.... asks for new gloves"
"full, just outside off from over the wicket. Firmly blocked off the front foot"
"full on middle stump, and gently pushed past Warner to mid-on. Gets the left-hander back on strike"
full on off stump. Presses forward to defend. Flies off the outside edge towards short cover
""
"length ball, angling in. Flicked off his waist, and stopped by the man under the helmet on the leg side"
"tossed up, wide outside off, and he frees his arms on this occasion. <B>Slaps through the covers</b> for a four"
"tossed up, outside off, and driven to wide mid-off. They scamper across for one"
"full outside off stump, and swinging further away. Left alone"
"good length, on the fourth-stump line outside off stump. Left by Labuschagne"
"full, outside off, and seaming away. Left alone"
"full, on off stump. Defended with soft hands"
"good length, on middle, and tapped to midwicket. Wants the single, and they've completed it even before Ferguson come run across and intercept"
"overpitched, very wide outside off, and he drills a grounded shot to deep point"
"full, just outside off, and pushed off the front foot to mid-off"
"nearly a yorker, just outside off stump. Dug away to the off side"
"overpitched outside off. Warner's in two minds, but eventually brings his bat down late to defend"
"<B>he's claiming it! What a ripper.</b> Warner falls short of the Don's 6996, atleast today. Another overpitched ball outside off, and Warner brings his bat down to squirt it away. But he's toe-ended a full toss to the bowler's right and he dives forward with his right hand stretched out to take a one-hander just an inch from the ground. Out goes Warner, in walks Smith"
makes Smith play first ball. Defended
"back of a length, outside leg stump, and he gets out of the ball's line swiftly"
"back of a length, on off, and flying over the batsman's shoulder. Umpire Dar calls it a wide"
full outside off stump. Swinging away and left alone by the batsman
"good length on off. Bit of seam movement away off the deck, but fended off the back foot comfortably"
"good length, on off stump, and seaming away. Left alone"
"good length, outside off stump, and left alone. The ball stays low"
"nearly a yorker on off stump, but dug back to the bowler with soft hands"
"full, outside off stump and defended. Ball hits the bat's inside half and rolls away to the leg stump. <B>Break</b>"
"126kph, full toss outside off, he is surprised a touch and miscues to mid off"
"129kph, good length on leg, he's back and across and working this behind square"
"129kph, full and wide, he frees the arms to drive neatly past cover, doesn't try to over hit it and gets three"
"129kph, good length fourth stump line, hint of shape back but he leaves it well"
"132kph, good length, top of middle, he's back and across glancing fine and the wide leg slip fields well on the bounce, moving to his right"
"133kph, back of a length pushed way wide of off"
"138kph, good length, fifth stump line, he leaves"
"138kph, wide of the crease, good length angled in but it's wide of off and he leaves"
"139kph, good length, wide of off, he's happy to leave"
"142kph, full toss, he stands up and <strong>punches this neatly straight of mid on!</strong> He controlled that well"
"137kph, good length, wide of off, he leaves this watchfully"
"141kph, good length, nipping away but it's well wide and he leaves again"
"132kph, fuller outside off, he jams the bat down and pushes to mid off"
"131kph, good length, top of off, he's back and across and working to midwicket"
"fuller on middle, 132kph, he steps back and across and works this with the shape wide of mid on"
"131kph, good length, angled across and <strong>beating the bat.</strong> Labuschagne was playing for inswing and it just held it's line to go past the edge"
"fuller outside off, fourth stump line, this shapes in a touch and he defends to mid off"
"127kph, fuller and wider, he <strong>slashes this safely through backward point!</strong> That wasn't in control"
"138kph, angled down the leg side, he tries to glance but misses"
"140kph, fuller length outside off, he's back and defending with soft hands to cover"
"139kph, back of a length wide of off, he leaves early and comfortably"
"140kph, fuller, outside off, he drives back to the bowler"
"139kph, fuller angled into off, he whips from off stump to wide fine leg"
"138kph, rising short ball, he rides the bounce and knocks it down off the back foot"
"128kph, fuller, shaping into off, he is back and defending towards mid off"
"135kph, good length, fourth stump, hint of shape, he's a long way back and across to defend"
"135kph, good length, shaping back to off, he is back and across and defending"
"134kph, fuller and wider, he throws the hands at it and slaps it to cover"
"132kph, back of a length, fifth stump, he's back and across and working this forward of square for a single"
"135kph, fuller, outside off, shaping back, he pushes on the back foot towards point and the second of two gullies comes across"
"136kph, shorter length outside off, sixth stump line, he's back and across and defending with the full face"
"<strong>he prods and misses</strong>! Strange shot. Short ball, wide of off, he went back and across and prodded away from his body as it nipped away. Just didn't catch up with it"
"139kph, good length, fourth stump, he's back and across, squared up in defence"
"141kph, back of a length, fifth stump line, he's back and across and defending"
"139kph, full and straight, he pings it off his pads but Raval makes a great diving save to his left and then fires at the stumps as Smith has to dart back"
"139kph, back of a length outside off, he's back and across to defend off a thick outside edge to gully"
"133kph, good length, shaping into the top of off, he defends on the front foot and it slices to a gap at cover-point"
"131kph, angled wide of off, shorter length, he's happy to leave"
"134kph, bouncer, over off, he ducks under it"
"134kph, short ball <strong>rears at him</strong>, he fends it off the glove and it <strong>pops up but falls safe</strong>. Great delivery. That climbed at him"
"good length, angled wide of off, he leaves this alone"
"131kph, short ball over leg, he moves inside the line to get out of the way"
"<strong>beaten</strong> by one that swung miles! 117kph, floated out but it shaped and bounced wide of off, he prodded on the front foot but missed it by a long way"
"good length, wide of off, shaping wider, he leaves"
"118kph, good length away swinger, wide of off, he leaves"
"119kph, good length outswinger, wide of off, he leaves"
"119kph, overpitched and Labuschagne <strong>climbs into a cover drive threading the gap past cover!</strong> Superb placement, played it late. Great shot"
"124kph, good length wide of off, he defends on the front foot away from his body"
"129kph, back of a length outside off, he's back and across and defending to mid on"
"135kph, short ball into the ribs, he's back and across and pulling without much timing behind square"
"135kph, good length angled wide but he leaves"
"135kph, good length, angled across and he leaves again"
"111kph, slower ball inswinger, he's awake to it, dropping the bat down to defend"
"131kph, full and shaping into off, he works this off the front foot to mid on"
"119kph good length shaping wide of off, he's back and leaving"
"123kph, fuller wide of off, he tries to drive and drags this to midwicket"
"120kph, good length outside off, he mistimes a drive back to the bowler"
"122kph, good length outside off, he pushes this with control to cover"
"good length shaping wide of off, this climbs and <strong>beats the edge</strong> as he plays inside the line"
"121kph, good length wide of off, he defends on the front foot"
"133kph, good length angled across wide of off and he leaves"
"132kph, good length, on off, he defends on the front foot"
"135kph, fuller and wider, he drives on the up but nails it straight to cover"
"136kph, short and wide, he is back and cutting to deep point"
"131kph, good length angled well wide of off, he leaves"
"138kph, back of a length wide of off, he's back and forcing this to cover"
"119kph, fuller on a fourth stump line, he drags a drive through square leg to the man in the deep"
"121kph, fuller on off, he is back and across and driving to mid on"
"121kph, full outside off, he is forward and defending with soft hands"
"119kph, good length swinging wide of off, he leaves"
"117kph, shorter length, he's back and across and nudging this behind square"
"good length, fourth stump line, he defends on the front foot"
"134kph, fuller, shaping into off, he is back and across and whipping this to midwicket"
"130kph, fuller wide of off, he reaches out to drive but picks out mid off"
"135kph, bouncer, over off, he ducks under it"
"133kph, shorter outside off, nipping away, he's squared up but glides this away off the back foot through point"
"good length, angled across, he leaves this"
"129kph, good length, he's back and defending"
"fuller outside off, some late shape he drives with a flourish to mid off"
"120kph, fourth stump, fuller, he drives this straight to mid on"
"119kph, top of off, he gets back and across <strong>and tickles it fine for four!</strong> It was still just outside off, but that's too straight to Smith and he glanced it well with nice footwork"
"shorter length, wide of off, he's back and across and defending"
"sixth stump line, 117kph, he's happy to leave"
"length ball, 118kph, wide of off, he leaves this alone"
"tossed up high outside off, he drives straight to mid off"
"drifting into off, hint of turn, he's back and working this to midwicket"
"shorter and darted into leg, he's back and whipping this to deep backward square"
"flighted wide of off, hint of turn, he pushes a defensive stroke, playing away from his body"
"flatter and shorter, he's back and defending"
"shorter length, he's back and punching this to cover"
"121kph, good length away swinger, fifth stump line, he leaves"
"121kph, very full wide of off, with shape, he gets down on one knee to mistime a drive to cover"
"119kph, good length outswinger, he leans into a glorious drive on the up but pings it straight to cover"
"118kph, too straight and <strong>he glances fine!</strong> Twice in two overs he's got too straight. This was leg stump, no fine leg, easy pickings"
"fuller on a fourth stump line, he drives beautifully back at de Grandhomme who just gets a hand down to save a boundary"
"good length wide of off, shaping away, he leaves"
"full, outside off, and driving with the bat's open face to extra cover"
"good length, on off, and guided off his hips to square leg"
"full, on leg stump. Presses forward to defend it back to Santner"
"good length, on off, and flicked off his hips to the leg side"
"good length, outside off. Punched off the back foot to cover"
"full outside off, and turning away after hitting the deck. Covers his stumps and shoulders his arms"
"good length on off, and he swivels before working the ball into the gap near deep mid-wicket. Wagner gives the ball a mighty chase"
"good length, outside off stump. Seaming away but left alone by Smith"
"full, just outside off stump. Presses forward to defend towards the off side"
good length on off. Angling into his pads. He shuffles across - exposing leg stump - before guiding a flick to fine leg
"<B>timing!</b> Good length, outside off, but he walks into the ball's line before caressing a controlled cut-shot through the gap past gully"
"good length, outside off. Seaming away and left alone"
good length outside off. Angling into the stumps. Makes room and flays a cut to cover
"full, outside off. He <B>whips</b> the ball after getting to the pitch of the delivery... and finds the gap between mid-on and midwicket"
"full, outside off stump. Defends at it very far away from the body. Disappointed with his own shot choice"
"tossed up outside off. Turning away, but driven to mid-off"
"overpitched just outside off stump. No turn this time, and fended back to the bowler"
full outside off stump. Defended with the bat's open face once again
"<b>soft appeal for lbw</b> but not given. Length ball on off and angling into the stumps. Attempts the flick but misses. Ball hits the top of his knee roll, but likely too high. May be missing leg stump too"
"<B>bigger appeal for lbw</b> but not given again. Fuller ball, outside off, and angling in. Labuschagne's too late to come forward but impact outside the stumps may have saved him his wicket. Rapped him on the back pad"
good length on off. Labuschagne shuffles across and defends with the straight bat
