"132kph, back of a length on off, he's back and across to defend"
"134kph, back of a length on off, he tucks this off the body with timing but it's sharply fielded on the bounce by Latham at short leg"
"<strong>glorious straight drive!</strong> 125kph, slightly over-pitched, he presents the full face and drives with precision between the stumps and mid on. What a shot"
"123kph, shorter into the ribs, he's back and riding this around the corner, he calls for two early but it's not there"
"127kph, short and wide, he <strong>controls a late cut through backward point and the man in the deep can't stop it!</strong> Santner got to it but the ball bounced off his hand into the rope as he dove"
"full outside off, he square drives firmly to deep cover-point"
"fuller on off, he drives with the angled to mid on"
"126kph, full on middle, he whips it forward of square on the front foot to the man in the deep"
bouncer angled down leg and he ducks neatly
"130kph, short ball outside off, he rises on his toes to defend from a side on position"
"127kph, slower ball full toss swinging in, mid on is wide, <strong>he punches an easy drive through straight mid on!</strong>"
"133kph, bouncer over middle and off, he ducks"
"131kph, short ball, he swivels on a textbook pull shot behind square to the sweeper"
"132kph, shorter into the ribs, he's back and knocking this around the corner wide of leg gully"
"115kph, good length, on off, he stands up and pushes to mid off"
"113kph, fuller and wider, he hammers a drive firmly to wide mid off but it's nicely saved"
"114kph, fuller and straighter, he <strong>drives later, with control, doesn't over hit and finds the straight mid off boundary.</strong> Lovely shot"
"119kph, fuller, on off, he drives back to the bowler"
"118kph, good length on off, he pushes firmly on the front foot"
"116kph, wobbler wide of off <strong>and he flashes and misses at a drive</strong>. Loose shot"
"128kph, short ball on off, he's back and pulling neatly through midwicket, nicely timed, the man in the deep has to work hard on the rope"
"128kph, shorter length, angled into off, he's back and defending to midwicket"
"short ball outside off, he's back and checking a pull shot along the ground forward of square to the sweeper"
"132kph, angled down leg, shorter, he gets inside it trying to glance but misses"
"130kph, short ball, climbing down leg, he withdraws inside the line"
"131kph, bouncer, well directed, Head ducks late and awkwardly but he gets under it"
"118kph, fuller outside off, he hammers a drive to mid off"
"118kph, full and angled into off, he <strong>waits and whips with ease through midwicket!</strong> Wonderful stroke. So easy"
"117kph, fuller outside off, he chips this in the air but finds the gap between midwicket and mid on for a couple"
"118kph, good length wide of off and swinging wider and he leaves"
"120kph, good length fifth stump, he's squared up on the front foot defending and Labuschagne is yelling 'well bowled, no run!'"
"117kph, good length, fourth stump, he defends on the front foot"
"131kph, short into the hip, he's jumping back and working this in the air off the hip behind square to the sweeper"
"124kph, short into the body, he gets inside it, to paddle a pull fine of long leg and he sprints back for two"
"<strong>Bowled him! Brilliant from Wagner!</strong> Around the legs from around the wicket! That's hard to do. 130kph, fuller length and some significant swing into the right hander, Labuschagne shuffled across the crease to trying to glance it fine, he exposed leg stump and Wagner hit it flush!"
"131kph, bouncer over middle, he ducks under it"
"131kph, good length, angled across, he defends with an open blade and runs it past backward point"
"129kph, shorter length, he's jumping back and bunting this <strong>just past short leg</strong>. It wasn't far away."
"118kph, fuller outside off, he's half forward pushing to mid off"
"117kph, back of a length outswinger, he's defending from the crease to gully"
"116kph, good length outswinger wide of off, he leaves"
"116kph, good length, a touch of nip away, he defends prodding this to gully"
"117kph, good length, wide of off, he leaves"
"115kph, back of a length, fourth stump line, touch of shape, he defends from the crease"
"ooh almost chopped on. Back of a length going across him, tempted him to cut, but gets a bottom edge that clangs into thigh pad"
"banged in short but down leg, can be easily left alone"
"back of a length on leg stump, moves inside the line and tucks it to fine leg off his pads"
"back of a length outside off, defended to cover on the back foot"
"length, angling into him on the stumps, patted back down the pitch from the crease"
"straight and on a length, gets behind it to defend it back to the bowler"
"length well outside off, left alone"
"swing and a miss! wobbling on a full length on a fifth stump line, tempted him into driving. But he doesn't connect"
"some movement for CdG, who's keeping his line well outside off and coming in"
"<b>run out chance missed at the striker's end</b>. Grandhomme has been getting some movement, and this one came back in more sharply. Head patted it towards point and set off for a non-existent run. Was almost halfway down when Nicholls swooped in from gully. Had time to aim at the stumps but missed. They take the overthrow"
"length on the stumps, defended on the front foot"
"length outside off, left alone"
"back of a length but well outside leg. Head tries to pull it off his hips, but it's too far down leg and he misses. Not the most advisable shot to play perhaps"
"fuller, swinging across him, clipped off his toes to midwicket"
"banged in short, going across him, he sways out of the way"
short ball but down leg again and this time Head just stays still and watches it go to the keeper
"back of a length, on target, he hops on the back foot and defends it to the bowler's right with a straight bat"
"banged in short, on target, but short enough that he can duck under it in time"
gets some swing into the right-hander but strays on the pads and is picked off through midwicket
"nice line outside off, and moving away, left alone"
"sticks to a full length on a fifth stump line, swinging away. Left alone"
"ooh, that was much closer to off stump and Paine left it again. Hits it on the seam and gets good carry as Watling collects in front of his face"
"back to a full length outside off, left alone"
"fuller and closer to off stump, defended to cover"
"<b>dismissed</b>. Short outside off, and Head gets into position early, going on the back foot and smoking a pull that forces Aleem Dar at square leg to jump out of the way"
"short again but cramping him for room this time on leg stump, and Head tries to move inside the line to pull but can't connect"
"back of a length just outside leg again. Tries to move inside the line to flick again, but misses again"
"length on the stumps this time, moves back and across to defend it towards extra cover"
"fuller and swinging across him, bowled it slower. Head deals with it reasonably well, digs out a drive towards mid-on"
"back to the short ball outside leg line, and Head has a swing at it, but doesn't connect with the pull"
"big appeal but New Zealand won't review. Southee indicates from slip that height might have been in issue. Length ball, pitched on off and nipped in a touch to defeat his attempted nurdle to strike him on the knee roll. Replays show it would have gone over the stumps"
"fuller outside off, stroked to extra cover"
"bit of wobble again, into the right-hander this time. it's very full though and he clips it gently to mid-on"
"full and well outside off, left well alone"
"length ball outside off, Paine's not interested in getting bat near it"
"shape away from the batsman, but well outside off and left alone again"
"floated up, but drifts on the pads and Head spots it early to sweep it fine and raise <b>his fifty</b>. Good knock, despite a few moments of lapses in concentration. But he had to see off some penetrative bowling"
slightly short and he rocks back to slash this through point
"length, drifts on middle and leg and spins away, defended off the back foot by going deep in his crease"
"tossed up, but drifts on the pads, clipped to midwicket"
"length on the stumps, punched to mid-on off the back foot"
"flatter, skids on, he goes back and jabs it to the bowler"
"length ball well outside off, left alone"
"length ball on a sixth stump line, he's not going anywhere near it"
"fuller outside off, driven firmly but straight to cover"
"sharp movement into him! He's been bowling on a fifth and sixth stump line and Head is comfortable leaving those, but this is slightly closer and comes in very sharply. He's left it alone but it bounced over the stumps"
full and wide outside off and Head reaches for it and makes good connection with the cut. Valiant effort by deep point to dive and try to save the boundary is unsuccessful
"back of a length and closer to off, he defends on the back foot towards mid-off"
"and Paine's had enough of leaving balls, this one is wide outside off and in the slot, he goes on the front foot to smear a cover drive that bisects the field and finds the boundary"
"tossed up outside off again, inviting the drive. Too full though and Paine gets some nice meat on the cover drive, but can't beat the in-field"
"tossed up outside off, he takes a few steps forward and drives, but cover dives to his right to field"
"length outside off, pushed back to the bowler"
"floated up on a length, gently clipped to mid-on. He's alive to the possibility of a single and they take a quick run"
"length ball drawing him forward, but he doesn't quite get to the pitch and a thick edge rolls towards gully"
"<b>driven straight to cover!</b> Head is going to be disappointed with that shot. Southee had been testing his patience with the wide line outside off. This one was similar and Head couldn't rein his shot in, went for the drive, but it wasn't quite a half-volley and he didn't keep it along the ground, ends up getting it on the bottom half of the bat and driving straight to the man stationed there, possibly just for that shot."
"full ball on off, driven to mid-off confidently"
"full, shaping away from him, he gets on the front foot to defend outside off. Gets a thickish edge that rolls to gully"
"length ball on off, was a bit late in going on the back foot, ends up jabbing it to gully"
"full on off, shaping into him this time, driven back to the bowler but not timed well."
"length ball outside off, left alone"
"<b>big appeal and New Zealand have opted to review</b>. Went with the arm but might have just struck him outside the line? He was pushing forward in defence but playing for the turn when there wasn't any. No inside edge. <b>And impact is in fact outside</b>, so New Zealand have lost a review. That skidded onto him and Paine played down the wrong line."
"tossed up outside off, fuller one, steered to point"
"full and strays down leg, flicked to deep square leg"
"good length, drawing him forward. Takes a big stride out to defend this outside off"
"drawing him on the front foot to defend, but Cummins gets nicely to the pitch of this and steers it to point"
shortens his length a bit and Cummins goes deep in his crease and pushes it to short extra cover
"tight line outside off, but he can leave it confidently enough because it's not coming back in and is bouncing over the stumps"
"fuller on off, defended to the bowler's left"
too full outside off and stroked nicely between point and cover. Nice timing from Paine and he'll get three for that
"fuller around off, defended solidly into the offside with a big stride out"
"digs it in short, good surprise ball. Cummins spots it and ducks safely under"
"<b>big appeal for caught behind</b> but the umpire is unmoved. There was a definite noise there, but perhaps it was ball flicking pad. Southee bowled the off-cutter that time and it snuck through between bat and pad. <b>great decision by the umpire</b> because that missed the bat and clipped his thigh pad on the way to Watling."
"good line and length, makes the batsman lunge forward to defend."
"given some air outside off, defended on the front foot into the offside"
"gets this straighter, but the batsman is equal to it, defending down the pitch"
"pulls the length back a bit, and he goes deep in his crease to cut this to point"
"tossed up very invitingly outside off, that hung in the air for a long while and allowed the batsman to line it up nicely and smear it through cover"
another one dangled outside off and Cummins gets to the pitch with a stride and opens the face to drive through cover
"given some air, good line and length outside off. He stretches forward to defend"
"tossed up on middle, Paine clips to mid-on on the front foot, and sets off for a run. Cummins is very late to respond but he ends up diving in to just about make it in safely"
"<b>beauty!</b>. Tossed up, dips on him, has him coming forward to defend, grips and spins past the bat"
"fuller outside off, driven through point"
"tossed up, too full ends up as a full toss, he can't slap it through the gap, but they get a single to extra cover"
"tossed up on the stumps again, comes on the front foot to smother it"
"124kph, short ball outside off, he leans back and drops the hands to let it pass"
"126kph, short ball outside off, he frees the arms and pulls nicely through midwicket, they push for three but Cummins sends Paine back after some confusion"
"129kph, good length wide of off, he leaves"
"126kph, high bouncer, he swivels on the hook and rolls it off the bottom edge into the ground to leg gully"
"128kph, short into the ribs, he pulls off the body in the air but safe behind square to the man in the deep"
"130kph, good length, on off he defends on the front foot"
"76kph, leg break wide of off, there's more turn, he leaves"
"shorter, he's back and cutting and Santner makes a very good diving stop"
"full toss on leg stump, he clips this with control to deep backward square"
"75kph, flatter on leg, he defends to midwicket"
"looped up outside off, he drives straight to cover"
"lovely leg break on middle, he prods forward, gets a thick edge that runs behind square"
"130kph, bouncer, over middle, he ducks under it"
"130kph, shorter length on off, he's back and defending with the full face"
"132kph, shorter on middle, he tries to work to leg but it drops down off the leading edge onto the pitch"
"131kph, shorter length, on off, he's squared up but defending well enough"
"back of a length, 131kph, on off, he stands tall and defends"
"131kph, back of a length, fourth stump, climbing, he leaves"
"tossed up very full outside off, he square drives to deep point"
"full and drifting in, yorker length, he defends back to the bowler"
"lovely flighted leg break on middle, he defends on the front foot"
"77kph, tossed up on middle, he pushes gently to mid on"
"drifting into leg, a bit of turn, he jabs a defensive stroke"
"tossed up, he tries launch down the ground, he drags it in the air but wide and short of mid on"
"128kph, fuller shaping into off, he drives neatly to mid on"
"131kph, back of a length outside off, he's squared up but defending it well to a gap at point"
"129kph head high short ball, he takes on the pull, mistiming it flat through square leg but well short of the sweeper in the deep"
"105kph, knuckle ball slower ball, drifting into leg, he drives firmly to mid on"
"129kph, fuller outside off, he drives but mistimes it dragging it to mid on"
"131kph, good length, angled in, nipping away, but it's wide enough to leave"
"tossed up on leg, he works this off the front foot to midwicket"
"wider, not that short, it spins, he tries to cut but misses"
"77kph, similar length wide of off, he late cuts this time but can't beat backward point"
"tossed up on leg, he defends to midwicket"
"tossed up, some spin, pitching on middle, he defends"
"shorter and wider, he watchfully leaves"
"130kph, good length, fourth stump angling in, he makes a decisive leave"
"128kph, good length angled into off, he defends to mid on"
"130kph, bouncer, over off, he ducks under it well"
"129kph, angled down the leg side, he tried to glance but misses"
"104kph, slower ball angled into leg, he glances this straight to leg gully"
"133kph, shorter length on off, he stands tall and defends on the back foot"
"73kph, leg break, full outside off, he drives firmly through cover, straight of the sweeper in the deep"
"76kph, shorter leg break, he cuts straight to backward point"
"tossed up on off, he drives back to the bowler"
full toss and he just bunts this cover
"looped up on off, he pushes gently to mid off"
"looped up on middle, he pushes back to the bowler"
"81kph, tossed up wide of off, some spin and bounce but he leaves"
"big ripping delivery, spinning sharply off a crack and beating the bat"
"rolled out wide of off, he leaves"
"tossed up outside off, he defends on the front foot"
"slid through flatter on off, he's back and defending"
"fuller on middle, he pushes to mid on"
"tossed up outside off, he defends"
leg break spinning wide of off and he leaves
"fuller on off, he defends on the front foot"
"tossed up on off, he defends"
"short and wide, he's back and cutting to deep point"
"shorter length, wide of off, he's back and cutting to deep point"
"flatter on off, a hint of turn, he defends on the front foot"
"pushed through wide of off, he leaves"
"looped up outside off, he reaches out to defend"
"wide half-volley, he square drives on the front foot to deep cover-point"
"looped up wide of off, he leaves"
"shorter length, some bounce and turn, he's back and defending, surprised by the bounce"
"leg break wide of off, he leaves"
"flatter on off, he's back and forcing to cover"
"shorter leg break, he tries to cut but misses"
"drifting into leg, he defends to midwicket"
"flatter on off, he's back and defending"
"top spinner, bouncing, he's back and knocking this around the corner"
"tossed up outside off, he defends to cover"
"floated wide, he slices a drive past backward point and <strong>it runs away to warm applause!</strong> Finally a boundary"
"pushed through wide of off, he leaves"
"pushed through wider again, he leaves"
"floated up fuller, he defends"
"tossed up on off, he defends from the crease"
"leg break, wide of off, he leaves"
"shorter and wider, he's back and cutting to deep point"
"slower leg break, he's back and forcing to cover"
"very full, he just pushes this to cover"
"full outside off, he drives neatly to mid off who is deep and they pinch one"
"75kph, looped up on off, he defends again"
"floated up wide of off, he leaves"
"good length, spinning and bouncing, he defends off the sticker, just prodding away from his body"
"shorter down leg, he swivels and pulls nicely behind square, de Grandhomme dives on the rope to make the save"
"big spinning delivery, rips past the edge outside off. Beat the bat by a long way"
"floated wider of off, he leaves"
"tossed up full and he crunches a cover drive, bouncing it over the man in the ring but there's a sweeper in the deep"
"looped up on leg, he pushes to midwicket"
"fuller on middle, he drives inside out to cover"
"looped up on off, he pushes gently to mid off"
"shorter length, he's back and cutting but straight to backward point"
"drifting outside leg, he clips this nicely wide of midwicket for a single"
"75kph, fuller on leg, he pushes to mid on"
"drifting into off, he defends on the front foot"
"drifting into leg, he pushes to midwicket"
"tossed up on off, he defends to the bowler"
<strong>beaten</strong> playing back to one that rushed him outside off and bounced and turned. That was 93kph
"flatter on off, he defends out infront of his body"
"82kph, floated up outside off, he defends on the front foot"
<strong>play and miss</strong> at a wide leg break that spins sharply away
"tossed up high, a half volley, he drives hard to cover"
"another wide half volley, he square drives to deep cover-point"
"<strong>Bowled him around his legs! Raval has a wicket in Tests! Brilliant piece of bowling.</strong> Great reward. This was drifting down leg, Cummins went down to sweep fine but didn't cover the line, it got under the bat, pitched outside leg, turned and hit leg stump! Shane Warne would have been happy with that"
"length ball, nice turn, but he goes deep in his crease and works it to fine leg"
"nicely tossed up outside off, but he comes on the front foot and slaps it past cover"
"drags it down a little short, and Paine goes back to punch this but can't beat cover"
"<b>does that count as a drop?</b>. Too close to cut even though Paine was going back and across, and he gets an edge that goes past the keeper and to first slip's left. But Taylor there, was going to his right. In fact, it brushed Watling's glove on the way too, but that was too quick for the keeper to catch"
"length on off, blocked into the offside"
"length ball, on leg and spinning across, patted down towards short leg"
"drifts on the pads, and rolls off the pad to leg slip"
"fuller outside off, goes to drive and gets a thick inside edge that goes to square leg"
"good flight, on a length outside off, doesn't turn in much. Starc goes well back and reads it off the pitch, defends tentatively"
"fuller on off, flicked backward of square"
"<b>slog sweep connects</b>. Too full and in his arc, he goes down on one knee and sends it to the midwicket boundary"
"better length, makes him come on the front foot to defend"
played down the wrong line while going to defend and gets an outside edge that trickles to short third man
"fullish length, bunted back to the bowler off the toe-end"
"length ball on off, comes on the front foot and nudges it wide of mid-on"
"tossed up on off, went to drive, but doesn't time it. The bowler fields"
"quicker one, skidded on into him, but Paine got his bat down in time to jam it towards point"
"drifts down leg, Paine went down to paddle but misses it. Watling thinks there was glove on it, and Santner's also appealing. Nothing from the umpire."
"fuller on the stumps, defended with a lunge forward"
"connects with the paddle-sweep this time, got down early and helped the ball fine"
"tossed up on off, he stretches forward and defends"
"fuller on off, defended on the front foot"
"length ball, spinning into him from outside off, he goes back and tucks it off his pads to midwicket"
"<b>smacked</b>. One bounce into the deep midwicket fence. Tossed up and Starc has had enough of blocking, brings out his favourite slog sweep and connects sweetly"
"tossed up a bit wider of off, he drives to cover"
"some sharp turn and bounce from a length on the stumps, Paine has to adjust late and tap it down with soft hands from chest high almost"
"flatter on a length outside off, punched back to the bowler, not timed"
"fuller and quicker on off, gets his bat down in time to bunt it back to the bowler"
"room outside off and dragged it down short, Starc goes back and cuts, but doesn't time it. Through point"
"short and wide outside off, chopped to deep cover"
"flat on a length outside off, worked to midwicket"
"<b>another one</b>. This was almost a lazy shot. Went forward and reached for the ball, his long reach means he gets to it and lifts it over mid-on's left and into the boundary"
"length ball down leg, easily tucked to fine leg"
"length ball angling into him, pushed back to the bowler's left"
"tempts him with a fullish one wide outside off, but Starc makes good connection, stroking a drive through cover"
"<b>lovely shot</b>. Not too short and not too wide outside off, but Paine is in position early and cuts it backward of point"
"a bit fuller and closer to off, coming in with the angle. Paine lets it go, covering the angle, knowing that it will bounce well over the stumps"
"length ball angling into him, defended towards cover"
"good length on the fourth stump, makes Starc lunge out to defend"
"length ball outside off, he goes on the back foot and cuts it through cover"
"tossed up on the stumps, driven off the inside half of the bat to mid-on. Paine wants a run, but Starc sends him back."
"fuller angling into him, driven gently to mid-off and this time the quick single is on, and they take it"
<b>smoked</b>. This was on the cards. Starc gets one in his slot and launches into a lofted on-drive that goes all the way over long-on
punched on the front foot into the offside
bangs it in short and forces Starc to evade it at the last moment as it whistles past his helmet
"length ball, wide outside off, he goes for the drive, but doesn't connect well, and the ball rolls to mid-off"
"short of a length and into him, Starc goes well back and defends solidly to point"
"<b>dropped by Raval at mid-on</b>. Not a dolly of a chance, but a catchable one. Full outside off, and Starc goes for the drive again. Doesn't get underneath the ball enough and hits it to mid-on. Raval has to move forward and to his right, but gets low enough to gather the ball with two hands. Can't hold on."
"beaten. Length ball outside off in the channel and he tries to cut, but misses."
"length ball outside off, watchfully lets it go"
"full outside off, bowled it slower I think, and Paine had to adjust and stroke his off-drive. Paine has been taking some risky singles to that area and sets off again. Williamson moves to his right and lets loose a throw that just misses the stumps. Paine would have been gone if he had hit. <b>run out chance missed</b>"
"short ball outside off, lets it go"
"high full toss, almost waist height, and Starc is perhaps caught off guard. Drives it back to the bowler. Has a brief look at the square leg umpire too"
"short outside off again, Starc plays it beside his body and steers it down, but second slip fields"
"another full toss, lower this time. Slapped it back with a horizontal bat, but Wagner got a hand up and blocked the ball"
"yorker singing into him, gets an edge onto pad as he flicks it to fine leg."
