"good length on off stump, pushes it safely to cover"
prevents a middle-stump seeking missile from its target
"sees an escape past the leg-side strangler as Taylor whips a ball off his knees towards the fine leg boundary, but leg gully dives to his right just in time"
"<b>lovely batting</b>. Australia have committed to this bang it in plan, and they do have the bowlers for it. But has the ball itself gone too soft for it to succeed? Taylor hasn't so far been rushed facing the short ball and here he just waits for it, taps it into the vacant area to the right of the bowler and skips along for a single"
<b>sweet timing on the off drive</b>. And all he does is present a straight face after judging the length and line right. Simple stuff
"full and straight again, Watling keeps it out, no trouble"
"back of a length on off stump, blocks it"
"<b>huge noise</b> as he goes chasing after a wide one, but it's <b>bat hitting the ground</b>. Starc always has this thing, his left-arm angle and his sheer pace makes even the very good batsman suffer blips in concentration and play waaaaay away from the body"
"full, straight, clips the pad and it runs away down towards the fine leg boundary"
"<b>ooooh, that's a snorter</b>! Cummins, who has so far almost exclusively bowled full and looked for bowled and lbw against Watling, rips one in and it rears up at the nose. Watling sees the danger and sways out of the way"
"<b>softened him up</b>! Or that's what everyone says anyway when a batsman is bowled after facing a short ball. Watling is slow in getting forward here. He has the right idea, the ball did need to be played. But Cummins has cranked it up. A 142 kph length ball kicks just a bit higher than he thinks it will, comes at him just a bit faster than he is ready for and it thuds into the bat even as he is still getting into the shot and ricochets onto the stumps. Spectacular bowling from Cummins. Just pure effort. Pure pain-barrier breaking effort"
bouncer first up at 142 kph and he gets under it.
"good length, outside off, taps it in front of point"
carves it through cover. He loves it full and he shows just why. Crisp drive through the gap
"<b>falls short of second slip</b> and it's Smith lurking there! Australia keep coming hard at the batsmen. The short ball angled across de Grandhomme surprises him. He looks to guide it behind point, but it bounces way more than he expects. Eventually adjusts to the problem and is still lucky the nick doesn't carry to the fielder"
<B>another bouncer</b> and Taylor is terribly late on the hook shot
"makes it rise up to Taylor's chest again, but this time Taylor is able to get up along with it and blunt it safely past silly point's left"
"<b>nails the pull shot</b>. It helps when they come up to just around the waist. Taylor climbs all over it, rolling his wrist and placing it between long leg and deep square leg"
"looks to pull against the angle and the banged in ball zips past his right shoulder, across him, beating him"
another pull shot and the 145 kph short ball lobs over to deep square leg
gets out of the way of another sharp short ball angled into the body
gets up off his toes to knock down the back of a length ball on off stump to short leg
"another bouncer but this is off target, down leg, and Taylor can easily get away"
"bangs in it. Ducks under. Rise, rinse..."
takes on the short ball and smacks it to deep square leg. Firmly hit pull shot but there's protection
"it's pinched up! A ball has been PITCHED UP! And de Grandhomme has hammered it down the ground. Of course, he is on the back foot, and it's his hands and his instincts that drive him into the shot, but boy has he timed it well. Screams away to the right of mid-off"
even the legspinner starts short! And Taylor rocks back to pull it hard to the right of deep midwicket
loops it up outside off and Taylor lashes it to deep point
"good length, outside off, no shot"
"tosses it up but de Grandhomme is happy to play it along the ground, refusing to pick up the bait and instead taking a single behind point"
waits for the legbreak to turn and then swats it on top of the bounce. Taylor does all this looking for a boundary but his late cut is stopped by backward point
another cut shot and as good as he is with it - here he makes room for it - he can't beat the field
"weeeeelll, it wasn't full. De Grandhomme has time to rock back and punch down towards a deepish mid-on"
"<B>through the gate</b>! Taylor's lucky not to be bowled here! Massive turn on the offbreak and its just about the perfect one, tossed up, drifting away from the right-hander, daring him to cover drive against the turn. Taylor goes for it and then heaves a sigh of relief"
"flighted delivery on off stump, defends"
"again teases him to play away from his body, Taylor gets sucked in again, and this time the ball doesn't turn, just kicks up past the top edge and beats him going straight on"
"delves into the sweep shot, but it deflects off Wade at short leg and goes over to midwicket"
shifts back to a good length ball outside off - and this one doesn't turn either. Blocked safely enough
"full toss outside off, spears it through cover"
"good length, outside off, leaves it alone"
"too short and too wide, Taylor has the right idea with the cut shot, but he can't reach it"
"short, quick and straight and Taylor, as much as he wants to attack it, has to stick to defence"
"full and outside off, drives to cover"
"shortish and outside off, he mis-hits the cut to point"
"goes back to block, but he ends up with an outside edge that slides past first slip. Lyon isn't getting as much spin as the batsmen fear and he's preying on that"
"tosses it up on off stump, de Grandhomme tries to whip it down the ground with the turn, no luck"
nudges it through midwicket
<b>there's another one off the outside edge</b>. All of this is the result of his changes of pace. The quick ones go straight on. He still gives them a good rip though and thanks to that big turning offbreak earlier in his spell both Taylor and de Grandhomme are playing for spin. Single to third man after the batsman hurries into a block while being stuck in the crease
"slower through the air this time and as a result it dips before de Grandhomme can reach it on middle stump, grips the pitch and then kicks up almost to the batsman's face"
""
"good length, outside off, no interest"
"loops it up on off stump, Taylor drives to deep point"
another sweet square drive with Labuschagne tossing it up wide outside off
"short and outside off, chops it to backward point"
"full on off stump, he hits to short cover"
slices a full and wide delivery out to the sweeper
"loads up the sweep again, but the ball is a bit too far in front of him for that shot and he can't quite reach there in time."
"<b>beats the outside edge</b> as he presses forward, lured in by the slower pace and the better flight."
shimmies out to slap a tossed up delivery to cover - or through it and he thinks he almost has until the fielder dives to his right and prevents a single. Head even hits the stumps direct
"full on off stump, Taylor keeps it out."
"full and outside off, defends"
"<b>everybody saw it coming</b>. And it's all because of that one ball in his first over. That one giant monster of an offbreak that sneaked through bat and pad and nearly bowled Taylor has created demons. He doesn't know how much Lyon is turning the ball and as a result he's often been playing inside the line of the ball. Here too, a tossed up delivery, all tempting like, draws Taylor towards it. He tries to block it out but the ball dips, turns only just, juuuust enough to take the outside edge and land safely in Smith's hands. Masterful stuff from Lyon."
"139kph, back of a length on off, he stands up and defends from the crease"
"137kph, shorter length rising outside off, he defends off the gloves into the off side"
<strong>magnificent pull shot!</strong> Chest high short ball and made it look pedestrian. He stood tall and thumped it with ease over midwicket. It made a pure sound off the bat
"141kph, back of a length but some width, <strong>he punches off the back foot behind point!</strong> Back to back from CdG. Had a lot of time there too"
"142kph, bouncer over leg, he just gets inside the line to let it go"
"<strong>caught at second slip!</strong> Everyone waited for Aleem Dar. He took an age to give it. Then did. Then de Grandhomme reviewed after discussing with Santner. Was this off the helmet rather than glove? It was a brute of a bouncer straight at his face, he thrust the gloves up in hope. Did it touch the glove onto helmet and then to Smith at second? Nothing on hot spot. RTS seems inconclusive. It definitely came flush off the helmet. But there's no conclusive evidence for Marias Erasmus to overturn Aleem Dar's onfield decision. So it stays out!"
"drifting in, he gets an inside edge and it runs between his legs to fine leg for one"
"fuller, outside off, he's back and defending"
"shorter length, some bounce, he stands up and punches back to the bowler"
"82kph, angled into leg, he defends to short leg"
"over spinner, on off, he defends on the front foot"
"tossed up outside off, he defends on the front foot"
"141kph, angled into leg, he works this forward of square for a single"
"136kph, bouncer, he tries to pull awkwardly and gets taken on the body! He played that poorly"
"142kph, angled down leg, he tried to glance but missed"
"145kph, angled down leg, he glances this to fine leg off the thigh guard"
<strong>beaten</strong> by a 145kph delivery that just nipped away off the seam outside off. That was a beauty
beaten again just fending at this from the crease wide of off
"back of a length, outside off, he's back and pushing back to the bowler"
"tossed up outside off, he pushes to mid off"
"<strong>bottom edge runs fine of Smith slip!</strong> No chance to catch this. It was shorter, he cut hard and it went off the toe straight down past Smith and away"
"good length, on off, he defends"
"floated up wide of off, he's not tempted"
"85kph, tossed up he chips a drive towards mid off but it falls short"
"141kph, good length, on off, he defends solidly on the front foot"
"back of a length on off, he's back and defending to cover"
"142kph, back of a length, on middle, he stands up and defends"
"143kph, back of a length over off, he ducks"
"142kph, good length, angled into off, he defends on the front foot"
"141kph, yorker length, angled into off, he defends well"
"tossed up on off, he's back though and defending"
"floated higher outside off, he pushes this on the front foot to cover"
"flatter outside off, he's squared up and defending"
"lovely drift wide of off, he defends and <strong>gets an edge but it's wide of slip</strong>, it's a long chase for Neser but he does well"
"85kph, tossed up on off, he leans out and defends"
"flatter and pushed through on off, he is back and forcing back to the bowler"
"88kph, looped outside off, he defends with an open blade to backward point"
"nice leg break outside off, he pushes to point"
"tossed up outside off, he square drives firmly to deep cover-point"
"quicker leg break down leg, Paine doesn't glove cleanly"
"full toss, he hammers a drive back at the non striker's stumps! Did Labuschagne get a touch? They are appealing for run out. Doesn't matter. Southee got his bat down"
"fuller outside off, he's back and defending outside off"
"looped up outside off, he's back and cutting but missing"
this one spins and bounces sharply and takes him on the back thigh but it's outside the line
"tossed up outside off, he prods a defensive push past silly mid off"
"looped up outside off, he tries to sweep but misses and was taken on the pad"
"84kph, nice shape, he leans forward and defends"
"shorter length, some bounce, he's back and defending"
"shorter length but spinning back, he's back and defending"
"fuller on off, he defends with the spin to short leg"
"nicely shaped leg break, he's forward and defending with soft hands"
"<strong>bowled him through the gate with a classic leg break!</strong> Beautifully bowled. Tossed up into the footmarks outside Santner's off stump, he drives against the turn, it spins sharply through the gate and crashes into off stump! Shades of the King in that one"
"another ripping leg break, shorter, pitches middle and beats the edge on the back foot"
"shorter length well wide of off, he leaves"
"shorter length, he's back and defending"
"<strong>sliced to backward point and an easy catch for Neser!</strong> Lyon tossed it up, Southee's eyes lit up, he skipped down and tried to launch, he didn't quite get there, sliced across it as it didn't turn as much, it sliced high to backward point and Neser cruised around to take the catch easily"
"<strong>prod and miss</strong> at a 124kph, delivery that wobbled away wide of off. He was playing for inswing. No foot movement."
"126kph, good length, inswinger on off, he's back and defending"
"123kph, shaping into leg, he glances this off his pads to fine leg"
"126kph, good length, wide of off, hint of shape away but he leaves"
"125kph, good length, wide of off, he leaves this alone"
"wide of the crease, 125kph, angled into off, he pushes firmly to mid on"
gets across his stumps and tucks the back of a length ball on middle through midwicket
"is drawn into playing away from his body, but with the lack of pace, he is able to adjust and roll his wrists on the cut shot, keeping it down to gully"
"again, those hands push away, following the back of a length ball outside off stump. Blocks it to cover"
thaaaat's better. Spots the ball being pitched short and outside off and doesn't think about playing at all
that time he does need to play with de Grandhomme hitting an off-stump line. It's still short though - which is weird for de Grandhomme - and Burns blocks it
"hits a better length this time, fuller and outside off, Burns lets it go"
well judged leave again. That over got progressively better from both batsman and bowler. Burns lets a good length ball outside off go and then gets some glove love from his partner
around the wicket to Warner who ignores a good length ball way outside off stump
"<b>plenty of swing</b> into the left-hander, but it is early to spot and Warner is good enough to adjust, playing with a straight bat to mid-off"
"pitches it up, looking for the top of off stump, Warner stands in between that unholy yet glorious union"
"a touch overpitched, and it is very neatly dealt with. Warner can hit the ball brutally hard but here he knows he just has to hit the gap - which is between the bowler and mid-off for this half-volley"
"adjusts his length, hitting the shorter area of the pitch, and Warner nudges it to midwicket off the back foot"
back over the wicket now and a good length ball is let go outside off
<b>onto him quickly</b>. Burns is forced back and the ball hits the splice of his bat as he blocks in front of middle stump
"full and outside off, he drives to cover"
ignores the good length ball outside off
"plugs away in that off-stump corridor, Burns is showing good patience"
"leans into the cover drive, the front foot towards the line of the ball outside off and the middle of the bat being pinged"
"<b>nearly plays on</b>! Not sure Burns is supposed to be forward to this, but it's CdG, so he lunges and is surprised by a little bit of kick off the pitch. The ball goes knockabout, hitting inside edge, then the ground and nearly bounces up onto the stumps"
flicks off the pad down to fine leg
""
"full and outside off, with a hint of away swing, Burns doesn't care for it"
"goes wide of the crease for a pitched up ball on off stump, Burns drives to cover"
"angles it into the right-hander, looking for lbw, and Burns is careful to keep his front pad away and present the straight face. New Zealand aren't rolling over here"
opens the face as he tries to steer a shortish delivery outside off to third man. Gully is in the way of that grand plan
"<b>beats the edge</b>! CdG is getting some help off this pitch! He's hitting it hard and getting extra bounce, certainly more than either of these Aussie batsmen are giving him credit for as Warner goes for a cut and misses"
"fuller ball, outside off, no shot"
goes back and blocks a shortish delivery on off stump
"<b>he's past Bradman</b>! Test match run number 6997, and it's a simple little dab towards point and some quick running to boot"
"full on off stump, defends"
"good length, outside off, bat plays no part in this play"
"full and outside off, Warner lets it go"
shifts back to push the shortish delivery to cover
"good length, too wide, no need to play"
<b>and now 7000 Test runs</b> with a juicy half-volley outside off that is sent screaming away behind point
"shifts back around the wicket and immediately hits a better area, the ball full on middle and nibbling off the pitch as well. Warner is careful to bring his front pad back so he doesn't play around it while presenting a straight bat"
"<b>nearly an edge</b>! He shouldn't be playing at those, but the angle draws him to lunge at a ball well outside off and the nip away off the pitch leaves him hanging. Warner's angry with himself for that. Tame, nothing sort of shot"
"and he's kept on zero still, a very good ball, on middle and off stump, shaping away from the right-hander. Burns blocks"
"back of a length on off stump, nudges it to midwicket"
"squeezes it through the gap past the right of cover. Doesn't entirely time it, his bat is pushing in front of his body and the away swing from CdG gets the outside edge"
lunges out to meet a ball outside off and slides it down to gully
"he's reaching again - and his hands are gripping that bat hard as well, partly why he's early into the shot - and and inside edge results off a full ball outside off"
"good length, on and around off stump, defends"
"<b>good leave</b>. Southee continues to hit the deck and get a little movement. Warner covers the line as he waits for the ball and finally when he judges it to be outside off, he sticks the bat up high into the sky"
"full on off stump, gets firmly forward to block"
"the teaser this time. Pitched up and wide outside off. Go on then. have a drive, I dare you. Warner doesn't. He knows Australia are in the box seat and he's not gonna let anything diminish that advantage"
"<b>cuts him in half</b> and <b>might have stayed low too</b>. Variation brought about by a cross-seam delivery and those aren't good signs for batsmen prepping for the second innings. Warner is entirely surprised by the pitch's shenanigans, having to hurry into his defensive stroke and realising the length ball angled into him sneaks under his bat"
"good length on off stump, defends"
"<b>spears it in, looking for lbw</b>. Warner is falling over as he plays the flick, there's that much effort behind this ball from Southee. Big inside edge saves the batsman"
nudges a length ball off his pads to long leg
"sets his mind to leave the short ball angling across him, but then as soon as it goes past, he practices the upper cut"
"tempts Warner to think about the upper cut again, but he's staying patient"
"good length ball on and around off stump, Warner covers it well and lets it go to the keeper"
"nips into the left-hander, but it starts on his pads so allows Warner to pick it away to the fine leg boundary"
"<b>ooooh, de Grandhomme may have BOUNCED Warner out</b>. Wouldn't that be something. New Zealand have reviewed it. So what have we got here? First off, it is the surprise of the summer. CdG has a mean bouncer. It keeps climbing on the left-hander. He is well off his feet as he tries to catch up with the ball. <b>Replays indicate that there may not be any contact with bat or glove</b>. Definitely some shoulder though, which deflects the ball to Southee at second slip. The HotSpot cameras again can't track a ball which is going that high but Snicko does not show any spikes as ball passes glove. So Erasmus says stick with the on-field call. Pretty much exactly the same thing happened when de Grandhomme himself was ruled out, only that time umpire Dar had given it out. Adding to all this, soon as NZ started celebrating, Warner seemed to be walking off. But maybe he was just switching off and walking to square leg to regroup"
starts with a half-volley outside off and Burns smears it through the covers. Good shot
gets some cut back into the right-hander but Burns is able to get behind it
"good length, outside off, hits a crack and rolls through to the keeper"
"fullish on off stump, defends well"
"good length, outside off, lets it go again"
"keeps it tight on middle and off, Burns is almost squared up as he blocks"
leans into the drive and finds mid-off
stays in his crease to deal with a length ball coming in for his middle and leg stump
"full and wide outside off, no shot"
"goes for the short ball again, but it doesn't get up at all. Warner's set up for the pull but the ball zips underneath the bat and draws out a wry smile"
waits on the shortish delivery outside off and places it between cover and point for a quick single
"good length and outside off, lets it go"
"full on middle, Warner protects his stumps stoutly"
he is definitely getting a tinge of inswing to Warner. And the left-hander is definitely wary of that. The bat never goes too far from his body as he keeps defending and keeps it straight
turns a fuller delivery on leg stump to midwicket
chops a back of a length outside off to cover
"looks for a yorker, doesn't quite get it right, Warner is away with a flick to long leg"
full and outside off from around the wicket. Burns defends
looks for the cut - and there's plenty of room for it - just that the ball doesn't bounce high enough and he under-edges it down by his own feet
"full and outside off, he defends"
"thinks about defending a good length ball outside off but then realising he doesn't need to, he doesn't"
"back of a length and outside off, no shot"
"full and outside off, defends"
pushes to mid-on
"full and angled into him from around the wicket, Burns is partly falling over as he flicks the ball away to deep midwicket"
"back of a length and outside off, blocks"
"<b>direct hit would have had Warner</b>! He has only one stump to aim at, and he's only a few inches from nailing it. Bad shot from Burns - reaching well away from his body - bad call too - he doesn't expect Santner to be that quick to cut the angle and Warner had basically given up"
"full and outside off, defends"
"<b>ripper</b>. Wagner goes to his trademark barrage, a ball that is dug in and rising steeply up to the nose of the batsman. Warner sways out of the way and as he springs back upright he leans over and looks straight at Wagner, his mouth in the shape of an 'O'"
"another short ball outside off, Warner gets out of the way again"
"a hat-trick of bouncers to end the over, Warner drops his wrists and then again practices the upper cut."
"125kph, wide outswinger, way wide, he leaves it alone"
"127kph, back of a length, angled into off, he defends from the crease to mid on"
"125kph, over-pitched and he plays a <strong>lovely square drive getting it behind point!</strong> He waited nicely on this and played it later, placing it past the man"
"125kph, good length fourth stump, he defends off the inside edge from the crease and it runs square"
"very full and tailing in late, it hits the pad but it's outside the line of leg"
"127kph, over-pitched again, <strong>and again he slices a square drive wide of gully!</strong> This wasn't as wide, he went inside out, but it wasn't intended to go that fine. It came off a thick edge. Still went along the ground"
bouncer down leg and he raises the bat and gets his hands inside the line
"back of a length into the hip, he tucks this with control wide of leg gully to fine leg"
"126kph, sprayed way wide of off. That one slipped out"
"131kph, back of a length outside off, he's back and defending with the full face"
"127kph, fuller outside off, he jams a drive to cover"
"129kph, over-steps, short ball, he swivels and pulls forward of square to the sweeper"
"127kph, bouncer, way down leg, he ducks"
"130kph, over-steps again, short down leg, he tries to pull but misses"
"back of a length, top of off, he's back and defending this to the gap at point and they pinch a single"
"125kph, back of a length, shaping back to off, he's back and defending"
"123kph, good length wider of off, he leaves"
"<strong>huge lbw appeal</strong> but not out is the call. No review. It was just outside the line. Great delivery. This hooped back late, trapped him on the crease but it hit his back leg well outside the line and it wasn't even hitting according to Hawkeye"
"129kph, good length, back of a length, he's back and defending"
"123kph, fuller and wider, he mistimes a drive back to the bowler"
"<strong>caught at mid off!</strong> A mistake from Warner. This was a length ball and he tried to pull, it got big on him and hurried him, he spooned it off the splice and it floated to mid on with Blundell coming in to take the catch. Warner lost control of the bat after he hit it, such was the surprise"
wide half-volley and <strong>he cracks this through the vacant point!</strong> Lovely shot. it was a long volley but he put it away. Far more conviction than his previous two boundaries
"shorter length, climbing, he rides the bounce, getting up and knocking it down"
"125kph, good length wide of off, he leaves and it <strong>shoots low through to Watling</strong>. That stayed down"
"130kph, shorter length wide of off, he's back and playing away from his body, knocking it to gully"
"132kph, shorter again, wide of off, he gets over the bounce and glides it awkwardly to gully"
"short ball outside off, it didn't bounce and he didn't see it! It missed his hands and his head as it flew wide of him. He did drop the hands late"
"126kph, fuller outside off, he leans into a nice checked drive placing wide of mid off and running with the stroke"
