"full outside off, tries to blast it through the covers but misses"
"another leg cutter way outside off, makes him reach, managed to do so and push it into the covers for one"
"leg cutter, short this time, he has a massive heave but gets it off the splice, falls in no man's land"
"full outside off, he swings hard and gets an outside edge past short third-man but the fielder catches up and pulls it back on the boundary with a slide"
"length around middle, has an almighty swing but gets a top edge that goes high into the night sky, Rashid runs back, keeping his eyes on the ball throughout, settles under it and takes it calmly before tossing it back in the air in celebration, Made it look easy, it wasn't"
"length around middle, he switches over and reverse sweeps it over short third-man, excellent connection as it bounces away into the boundary"
"googly and through him! Pitched outside off, the idea was right as he went for the slog sweep, the execution was poor as he missed it completely"
"quicker one middle, Mustafizur swings across the line and misses but no says the umpire"
"flat and quick around off, swings it away to deep square leg for one"
"googly, squares him up and beats the outside edge"
"length around off, he latches on to it, swings it away to the on side and clears long-on"
"slower one, half way down, completely deceived him as he swung hard but way too early"
"short one and that's a ferocious pull shot, bisects deep midwicket and deep square leg, one bounce and into the fence"
"Mustafizur going to go down fighting, comes down the track and swats the length ball up and over the off side"
<strong>well hit but straight to deep point and that's a comprehensive win for Afghanistan!</strong>
