"back of a length at off stump, neatly worked through straight midwicket"
"length delivery, hint of seam movement, pushed towards mid-on and it's a well-judged run"
"short of a length outside off, punched from the back foot to cover"
"straight down the ground, was in the air but flew past the bowler above his right hand...driving through the line of a full delivery"
"that's a lovely piece of timing, just a hint of width outside off and he places it effortlessly between point and cover"
"straighter delivery, 132kph, played to midwicket"
"full outside off, and he finds the gap through the covers with a confident front-foot drive...this looks a belting pitch"
"full, wider outside off, he goes for the drive again and this time it flies off a thick edge to third man"
"back of a length, outside off, punched square into the covers where there is a fumble and it races across the oufield"
"heaved into the leg side, just short of a length on off stump, it didn't come out of the middle, went wide of midwicket"
"on a length outside off, 125kph, pushed into the covers"
"another one through the off side, the ball is racing off the bat at the moment, just a punch at the top of the bounce and it finds the gap wide of cover"
"starts with a slower ball, pushed across outside off, left alone"
"short of a length, pulled towards midwicket who can't stop it cleanly"
"back of a length outside off, driven to deep cover"
"<B>dropped</b>, he gets underneath another slow ball, goes high in the air, swirls in the strong wind, mid-on tries to steadies himself but it bursts through his hands. Thikshila de Silva the fielder"
drives and it flies off a thick outside edge over backward point
"across the crease, pushes into the off side"
"very full and straight, he does well to clip this wide of short fine leg...that was only marginally off target"
"slower ball, he plays forward and gets a thickish inside edge to the leg side"
"full at off stump, jabbed towards mid-off, he pushes the fielder who fumbles the gather...not good signs for Sri Lanka"
"angles into the pads, Smuts missing his flick but it's heading down leg side"
"a big appeal for lbw as he pulls and misses, gets taken on the back leg, the umpire rules it's too high. The ball skidded through. It was another cutter"
"well bowled, gets the yorker in, squeezed out to the off side"
"plays back, works a straight delivery out to deep midwicket"
"and he's gone...sweeps at a very full delivery, gets struck in front of middle and off. That looked pretty good first up. Much-needed for Sri Lanka"
"back of a length, he pushes to the off side"
"fuller, he comes forward, drives to extra cover"
"short outside off, he can't find the gap as he goes back in the crease and cracks it square to cover"
"well bowled, skids on at middle and leg, no room for AB to work with and he pushes back to the bowler"
"pushed across on a length outside off, driven to deep cover"
"short of a length, driven off the back foot to the sweeper and he's off the mark"
"lovely placement, drives a full delivery from off stump wide of mid-off. Very elegant. Just pushed at the ball"
"slower ball, gets a leading edge as he aims to work to the leg side and it runs to mid-off"
"back of a length at leg stump, whips it off the pads to deep square"
"an attempted slower gets dragged very short and wide outside, he can barely reach it but manages to get a toe which bisects short third man and backward point"
goes back in the crease and whips to deep midwicket
"drives through the off side, placed wide of the sweeper"
pushed down the ground to long-on
"full outside off, a whirling drive to deep cover"
"dragged down short, pulled to deep midwicket along the ground"
some power in that stroke as he drives off the back foot to deep cover
"short at off stump, a flat-bat pull down the ground to long-on"
"full outside off, driven to long-off"
"short outside off, waits a fraction longer and places it wide of deep cover"
comes forward and pushes to the covers
"short outside off again, finds the cover sweeper as he drives off the back foot"
"short and wide, gets away with this as it spins and takes the toe end as he tries to pull but only gets a toe end into the leg side"
"inside edge, just past leg stump, trying to drive through the off side"
this is a nicely controlled drive to deep cover
sprayed wide outside off
"back on the stumps, he gives himself a touch of room and drives square through the off side"
stays outside leg stump and that's his first boundary as he drives it square through point and this time as enough to beat the sweeper
cut to deep cover and that's good running
"driven strongly through the covers, this time to the right of deep cover who has to get his skates on...de Villiers finding his stride"
"full outside off, eased down the ground"
"shorter, driven from the back foot to long-off"
"short outside off, comes from near the bottom of the bat to deep cover"
rocks back and pulls through midwicket
dragged from well outside off through the leg side to deep midwicket
"very wide outside off, de Villiers takes one hand off the bat as he reaches for it and slices to deep cover"
"brings out the reverse dab, sends this from outside off fine of short third man"
"very slow, 86kph, outside off, de Villiers nearly through his shot and takes an inside edge into his boot"
opts for the leg side with a slog-sweep from outside off which goes to deep square
flicked off the stumps through the leg side
"has he been run out after a misfield? A bottom-handed flick through the leg side, there's some poor fielding from deep midwicket. They easily make the second, then chance a third. Hendricks is safe as he gets the dive out. The bat did nearly bounce, but the shoulder remains on the ground. The umpire having a lengthy look, but it seems fine. Front of the bat in the air, but the top of the bat is grounded. This is taking ages. He's safe"
drives solidly to long-off and de Villiers makes the second without breaking sweat
"comes down the pitch, it becomes a big full toss, comes off the bottom of the bat and loops over midwicket"
"full and straight, pushed down the ground"
"short outside off, cracked to deep cover"
gets down on his back knee and drags a sweep through square leg
"there he is! That's what the crowd want to see. Two steps down the pitch, holds his shape, and lofts straight down the ground"
"nearly gets into a tangle as he goes for the reverse sweep, manages to get it to backward point from around middle and leg"
nearly squeezes under the bat as this takes the toe end...good yorker
"poor ball, but he gets away with it, full toss down the leg side, trickles behind square"
"he's off now...moves across the crease, goes onto his back knee, and scoop-sweeps a length ball over deep backward square. Miles back"
"this is a fuller ball, the bottom hand whips through the shot and it goes like 'a well-known bullet phrase' to deep midwicket"
punched down to long-on
"swing and a miss, that's a win for the bowler. A cutter outside off, de Villiers aims another blow down the ground but doesn't make contact"
"aims to sweep, the ball is outside leg, takes the pad"
"sharp stumping! Nicely bowled, spins across the right hander as he drives and Chandimal has gone for the stumping. He's confident. The foot drags out...Chandimal actually misses the first swipe at the stumps, but still the foot doesn't go back! He's out. That's some slow-motion cricket (and not just on replay)"
"full, wide outside off, driven firmly to cover"
"drives, gets a thick inside edge into his pad and loops to the leg side"
"low full toss, a one-handed sweep to deep square"
"full outside off, he comes forward and defends. Good finish from Sandakan"
gets across outside off and flicks this behind square on the leg side...a better throw would have had Miller in trouble
"short, pulled through square leg and wide of the man...that's his fifty off 35 balls. He's back."
"fired down the leg side, big wide"
"full outside off, not much timing in this shot and it dribbles towards long-off. De Villiers was looking for a second"
"big wicket! Miller tries to paddle this from outside off, gets a top edge which falls into the lap of deep backward square"
"full at off stump, driven just wide of the bowler to his left"
driven to long-off to get off the mark
"full outside off, 127kph, bunted down the ground"
"moves right across to the off side, the bowler follows him, he drives to the off side...dives for his crease and takes a blow from the throw for his efforts"
driven to deep cover
"full, wide outside off, sliced to deep cover"
"low full toss, flicked to long-on...quiet over with one ball left"
"that's an excellent over, de Villiers connects well with this slower ball outside off but he picks out cover on the edge of circle"
"round the wicket, full outside off, a slower ball, lofted in the air bit short of long-off"
"that's into the crowd...will help lift things. A slower ball, dragged down, de Villiers sees it early, plays back, and pulls it mightily over the leg side"
"length ball outside off, 125kph, struck sweetly but straight to deep cover...de Villiers frustrated he didn't find the gap"
"excellent fielding in the deep...tucks a length delivery from off stump into midwicket. Good return from the deep, bounced in so it skidded to Chandimal, and this will be tight. Chandimal gathers and only has to move inches. Behardien is a foot short"
"stays round the wicket, full toss outside off, driven to deep cover"
"a sliced drive, the ball is full outside off, finds the sweeper"
"he's gone now! With a juggle. Sri Lanka fighting back. A low full toss outside off, tries to place it square through the off side but just picks out point who doesn't well to palm it in the air and hold it at the second attempt"
"full at middle and leg, flicked to long-on"
"nice deft touch, deflects this fine of third man with a late dab"
"slower ball, wide outside off, driven to deep cover"
"full, at leg stump, glances off the pad to long leg...there was a little tickle on it as well"
"finishes with another slower one outside off, 103kph, which is pushed to the covers"
dot ball as he flashes and misses at a length ball outside off...leg-cutter
"that's a clever shot, gets across his stumps and sweeps from outside off wide of short fine leg...AB would be proud of that"
"good comeback from the bowler, 93kph at off stump, can't get any timing"
"drags it short, pulled in the air but lands short of deep square...then almost bounces over the fielder! That would have been embarrassing. Mangaed to stick his right hand up in time"
moves outside leg stump and heaves a length delivery to deep square
"bottom edge on a slog-sweep, runs to short fine leg...a very good finish from Gunaratne"
"over the wicket, a slower ball, gets underneath it and with enough bat to clear the straight boundary even though it wasn't off the middle"
"round the wicket, swing and a miss at a length ball...he'll be annoyed he didn't connect"
"into the stands again! Little gem of an innings...take advantage of some width, drives this over square cover. Impressive power"
"and another! He's being fed length outside off, he likes it there, frees his arms and sends this straighter over deep cover this time"
"<b>dropped</b>, it's a shambles! This is miles into the air as he heaves to the leg side. No one seemed to claim the catch and in the end it was Kulasekara who tried, and made a horrid mess of it"
"finally gets his yorker in, can only squeeze it to backward point"
"round the wicket, back of a length and fended away, they scamper through for one"
"short and rising at the body, Upul Tharanga - opening in place of Dhanajaya de Silva - works it to leg"
Ngidi drops short again and this is pulled through square leg for a couple
"smashed through point, that's whistled to the fence! Short and wide and Dickwella backs away, opens the shoulders and crashes the first boundary of the innings"
tighter line and dabbed into the off side
"shortish, 138kph outside off stump, Dickwella drops back and steers one through gully"
"pitched up outside off, smooth-looking cover drive from Dickwella but he's standing watching it as Tharanga comes running down, sends his partner back as AB slides to field but can't hit the non-striker's end with his throw"
"length on the stumps, worked off the pads wide of mid-on"
"oh, nearly another mix-up! Tharanga defends into the off side, sets off but then sees Paterson swooping after it and has to scramble back to his ground"
"full on off, punched hard towards mid-off but it goes quickly to the fielder and there's no time to run"
"slightly full, golf swing from Tharanga, lofted over mid-on and it skips away for a boundary"
"four more, this was short and pulled square, didn't quite get hold of it but the ball still outruns Phehlukwayo to the fence"
"back of a length over the stumps, dropped down into the turf"
"good length, wide of the wicket, ungainly swing and a miss from Dickwella but Mosehle can't collect it cleanly"
"pitched up and swung over the leg side by Tharanga, slightly agricultural and it bounces short of deep square"
"short of a length, 137kph, Dickwella stabs at it - and inside-edges past his stumps! Mosehle was wrong-footed and the ball flies quickly to the rope"
"dug in slightly wide of the stumps this time, attempted cut and this takes the bottom edge, goes to the keeper on the bounce"
"short and pulled, doesn't quite get hold of it and square leg cuts the ball off"
"on the pads, Tharanga glances in the air... and Ngidi <b>can't hold on!</b> Paterson is denied his first wicket for SA, a tough chance for the diving Ngidi at short fine leg, he used his long arms to good effect and seemed to get both hands to the ball before dropping it"
"angled across, 135kph and tapped square"
"full in the channel, Dickwella has opened up his stance and punches through extra cover"
"shovelled over the leg side, four more to Tharanga! Paterson was too straight again and this was swatted to the boundary"
"four more, sliced through gully! Tharanga stepped away to leg, drove away from his body and thick-edged to third man"
"shortish, down the leg side, Tharanga can't connect"
"length ball on the stumps, whipped to leg again, did it carry to midwicket? I don't think so... Hendricks was diving full length but couldn't get his hands under it and the ball bobbled away for one"
"slower ball, Tharanga is duped - and lobs a catch to mid-on! Big yell of delight from Parnell, he's made the breakthrough... The batsman was through his shot early, just flipped it up towards the ring"
"stays over the wicket, fullish outside off, punched into the covers"
"short and pulled, goes swirling into the night sky... and Tahir <b>drops it!</b> Went waaaaaaay up as Chandimal hacked across the line but Tahir, running up from third man, never looked like being in position to take it"
"full and driven, struck well, the bat flowing through, Ngidi does well to cut it off on the dive at cover point - but it looks like he's injured himself in doing so"
"pitched up outside off, pushed wide of mid-off and they scamper through as the throw comes in"
"slashed up and away, four to deep point! Another slower ball from Parnell but it ended up being a long-hop, Dickwella backed away and cut the ball firmly from off stump"
"bowled him, leg stump out of the ground! Chandimal plays around a straight one, Tahir is on the money right away and immediately sets off on a winding, fist-pumping celebratory run. Every time's like the first time"
"scuttles in and places the ball on the stumps, de Silva pushes into a gap"
"length ball, not much turn and played to leg"
"tossed up, de Silva punches back on the leg side, Tahir chases after it"
"think this was the googly, extra bounce and it comes back to hit de Silva on the thigh"
"touch short, rocks on to the back foot and pulls a single to deep midwicket"
"shortish, angled across from over the wicket, 140kph and glided down towards third man on the back foot"
"short of a length, rising up outside off, worked to leg but Parnell fields"
"bit of width, swishes away from his body and gets one more down to third man"
"dug in short, de Silva pulls and gets a big top edge - <b>dropped</b> by Paterson on the run! Parnell denied again, looked a pretty simple catch at fine leg but grassed"
"another bouncer, gloved on the pull, <b>Mosehle can't grasp this one!</b> The ball flies away through the gloves and away to the boundary this time. The look on Parnell's face..."
"short of a length, Dickwella pulls, gets another top edge -  and this time <b>PARNELL DROPS IT!!!</b> Three in a row, an unwanted hat-trick. Parnell jumped to grab it above his head, mistimed the leap and put down another straightforward chance"
floated up and pushed into the covers coming forwards
tossed up and prodded back to the bowler
"on the stumps, de Silva works across the line and gets it into a gap for two"
"flighted, comes across, poked into the covers again"
"tossed up and he skips out, launches down the ground, goes high but not all that far and de Villiers can't get there despite running in to Superman on his stomach from long-on"
"pushed through on the stumps, nudged off the pads for one"
"shuffles across, worked away off the pads"
"round the wicket, full on off stump, here comes the Dickscoop! Superbly well played, straight over the keeper's head and away to the boundary rope"
"short outside off, good pace and bounce and Dickwella flashes at it, big appeal from Phehlukwayo and Mosehle... but not given by umpire Bongani Jele!"
short and wide and  cut away to the fence! Dickwella carries on his merry way
"goes full and straight, bunted back down the track"
"short outside off, Dickwella throws the bat, gets a thick outside edge and that will run away for four more! Eventful over from Phehlukwayo"
"Tahir trundles in and plops the ball on a length, de Silva goes down and paddles to leg"
"lovely stuff from Dickwella, gets across on off stump and laps the ball fine, using the pace and it races away"
"pushed through flatter on the stumps, goes back and steers to point"
tossed up and pushed through mid-on coming forwards
"length ball, de Silva moves across and paddles, in the air briefly but they get one fine on the leg side"
"flat, non-turning legbreak outside off, Dickwella chops through point on the back foot"
short of a length and pulled through square leg to the sweeper
"good pace outside off, swing and a miss from de Silva"
"cuts him in half this time, back of a length over leg stump as de Silva advances and is beaten on the inside"
"fullish, chipped over mid-on, not in control but it lands safely"
"round the wicket to Dickwella, full on the stumps, dug out down towards long-on"
"short ball, takes the pace off and de Silva can't time his cut, gets a thick bottom edge to short fine leg and only one from it"
dragged down and pulled flat through the leg side
"stays round the wicket, bit of a half-tracker and Dickwella heaves it over the leg side, Paterson dives for it coming in off the rope - but it just lands short!"
"pushed through, swings hard and it plops into the leg side"
"flat delivery on off stump, Dickwella reverses the hands and swats it away through backward point, nicely played and that's four"
"tossed up on the stumps, comes forward and nudges this through mid-on for a couple - raise of the bat from Dickwella, that's his maiden T20I fifty"
floated up and worked off the pads for one more
"pitched up and driven, lofted but well short of long-off, they scamper the single"
"shortish, on the stumps and he can't really get hold of the pull"
banged in short and Dickwella cracks a pull in front of deep midwicket for a couple
"fired in full, he gets out his scoop again, flipped like a pancake over the leg side, doesn't quite have the timing on this one and fine leg cleans up"
"short outside off, flail and a miss"
"slower ball, Dickwella paddles up and over his shoulder again, just one to fine leg"
"fired flat on leg stump, Dickwella misses with a reverse-sweep and his backside prevents him from being bowled behind his legs"
"tossed up and clipped off the toes through the leg side, superb timing and it races to the deep midwicket boundary"
"skips out to swing across the line, gets hold of this, into the crowd! Dickwella is flowing nicely, no need to try and hit the cover off, just get your timing right"
"fired down flat, worked away to the leg side"
"shouts of 'catch!' as de Silva heaves over midwicket, bounces away to the sweeper coming in"
"pushed through and sliced off the back foot, towards point... but again it lands short of Parnell!"
"short ball, de Silva pulls and gets an edge, wears it on the body, then appears to obstruct Phehlukwayo as he tries to collect in his follow through. Not much in it, but Phehlukwayo gives it the teapot having failed to collect the ball with Dickwella scrambling"
"round the wicket, short and this spits to hit the glove as Dickwella tries to pull"
"full and slightly leg side, goes for the trademark paddle but misses this time"
"Dickwella advances early, back-of-the-hand slower ball from Phehlukwayo, nicely bowled and it sits up, almost out of reach, swatted straight back to the bowler"
"back of a length, a wide cutter this time and Dickwella misses it but they run a bye to the keeper"
"another dot ball, superb over, this... full pace, short of a length, de Silva swings and misses"
"tosses up the googly, pitches outside leg and then hits the pads... Tahir appeals, but never going to be given. Dickwella didn't connect, so the dot is valuable"
"flighted, goes for the leg-side heave... and picks out the catcher on the fence! Dickwella falls after an impressive knock but SL are slipping behind the rate here. Wasn't to the pitch and needed a better connection to clear deep midwicket, in the end a comfortable catch for the captain, Behardian, a few yards in"
"floats up a full toss wide of the stumps, mistimed and dragged down through midwicket for one"
"pushed through quicker on leg stump, clipped square for a single"
"tossed up, nice and slow, entices de Silva out of his crease - and he's stranded, Mosehle completes the stumping! This over could be the decisive one, teasingly flighted legbreak and de Silva was reaching for it, reaching for it, couldn't get to it as he aimed down the ground. Gone"
"flat and fast, beats Mendis's outside edge playing back! So close to a third wicket in the over... Tahir still finishes with a very handy 3 for 18"
"swings hard to leg, sweet connection, is it going all the way...? Yes, but Heino Kuhn, the sub fielder, pulls it back in in mid-air! He had to release the ball, fractions of a second before his foot landed on the rope, but it was a brilliant piece of work above his head on the square-leg boundary, turning a six into one!"
"angled across, gets a thick outside edge to third man"
"short and wide, big swing and a miss"
"back of a length, Seekkuge heaves to leg, gets a h-u-u-u-u-g-e top edge down towards third man - and Tahir had overrun coming in, it clears his head and bounces away! Oh dear, Immy. Undoes some of his good work with the ball"
"short and leg side, Seekkuge connects well, swinging the ball high over fine leg for six! SL are still alive"
"goes for the bouncer, maybe a slower ball - called wide on height"
"full toss on the stumps, Seekkuge and destroy! This has come right out of the screws, it's coming down with snow on it, miles back in the stands at deep square leg. Nothing Kuhn can do about this one"
"shortish, outside off, pulled flat down the ground to long-off"
"strays on to the pads, Seekkuge swings to leg and gets it away, bounces towards the rope at deep backward square!"
"mistimed into the off side, they try to steal one... and Paterson throws down the stumps in his follow through! Magnificent reactions from the bowler and Mendis was half a yard short"
"full length, Gunaratne goes low outside off, tries to paddle and hit on the pad - big appeal but never hitting and they steal a leg bye"
"full and straight, big swing from Seekkuge but gets a bottom edge back down the track"
"another full bunger, can't get under it, punched down the ground to long-off"
"full length outside off, big ole hack from Seekkuge, gets it past backward point and they go haring back for a third as Tahir throws to the keeper and Mosehle has a shy at the non-striker's end"
"length ball, taking the pace off and Gunaratne heaves to the leg side, doesn't time it"
"back of the hand, sits up as Seekkuge advances - and he's put this into the stands at long-on! Another mighty bosh from the allrounder, sends it towering into the Cape sky"
"goes wide, aiming for the tramlines, swing and a miss... but called wide"
"full and wide, this is better directed... and Seekkuge loses his bat swinging across the line! Hang time out towards midwicket, but willow rather than leather"
"in the channel, another big swing and miss from Seekkuge! Phehlukwayo has strung together two dots"
outrageous! Scooped over the keeper... Phehlukwayo went full outside off and Seekkuge got down on one knee and ramped it for four!
"pitched up on off stump, Gunaratne goes across, gets low... and scoops over short fine leg! Smoothly done and the equation swings even further in SL's direction"
"pitched up, comes forward and <i>hammers</I> a drive, picks out deep cover for one"
"pitched up, good discipline from Paterson, big swing from Seekkuge and he gets an inside edge on to his pads"
"goes for the short ball, swings across the line, the top edge flies away over the keeper! And Gunaratne then grabs a stump, thinking the game was over...! Are SA appealing? Had the ball crossed the boundary? The umpires have told Gunaratne to calm down, puts the stumps back in and we are going to continue"
