"some turn for Jaddu, and its quick turn. He could have been a force had there been a better total. Dhawan is surprised by the deviation and his flick shot doesn't cover it"
worked away to short fine leg
"gets low for a late cut, but finds short third man"
comes down the track and blocks a good length ball from outside off stump with a slightly closed face so that it becomes a single to long-on
"98kph, fired in on middle and leg, pushed to long-on"
"back of a length and on leg stump, turned away through midwicket"
"shortish on off stump, blocked to cover and a loud call of 'No' sends Warner back"
"past short fine leg's give, but Tambe at deep square leg is there as extra cover. Simple little flick shot"
"that's excellent placement. Pace on the ball and Dhawan relishes this kind of pace. Medium pace. Especially when there's width. Delays the cut shot just enough to beat point inside the circle, and puts enough power on it to beat deep third man"
picked away to deep square leg
"short and wide, Warner makes it worse by clearing his front leg and lacing the ball to sweeper cover"
"speared in on middle, Warner goes for a big heave and inside edges to deep midwicket"
"chops it past backward point and Bravo has a lot of work to do on the boundary to cut that off. Lovely shot from Dhawan, waited on it nicely"
and now he shows off his strength on the front foot. Dhawan jumps down the track and clips it through to deep midwicket to bring up his half-century. Gets a hug from his partner
"99 kph, stopped just inside the deep square leg boundary. Good flick shot from Dhawan, but Kulkarni bent down and fllicked the ball just before it trickled away."
"no one's stopping that and that gives Sunrisers a 10-wicket victory! Lovely late cut from the captain. Jadeja was darting them in, so Warner simply waits leg side and dabs it past the keeper."
