"quick short ball outside off, rises to shoulder height, and Dhoni top-edges his pull over the keeper"
"down the track, and that is a stunning hit. Gets to the pitch of it and uses his wrists to whip it over the long-on boundary and into the sightscreen"
"back of a length outside off, Dhoni knows third man is inside the ring, and he dabs it cutely to his right, and it looked like four all the way before Brathwaite came hurtling in from deep point and tumbled to his left to cut it off at the rope"
"short slower one outside off, pulled to deep square leg"
"what a catch that is! Dhoni slogged at this flattish length ball, didn't hit it too well, didn't hit it too badly, and it could have gone for six if Sam Billings, running to his right, had not leaped across to pluck it out of the air, above his head, and go tumbling to the ground and come up with the ball still stuck in his hands"
"full outside off, dragged to long-on with a lot of bottom hand"
"googly wide of off stump, and that's the perfect ball for a leggie to bowl to Perera, but what do you do when he fetches it from wide outside off and slogs it high and clean over long-on"
"is that a missed stumping? It was the quick googly, and it snuck between Perera's legs as he missed the flick, and Samson fumbles, but Perera hadn't stepped out of his crease"
"length ball on the stumps, and Perera clears his front leg and sends it soaring over deep midwicket"
"wide googly again. Perera slogs across the line, toe-ends it and it's racing away behind the wicket before Pant dives to his right from short third man to stop it"
"slower ball close to off stump, Perera slogs too early, miscues it in the air, wide of extra cover, and the fielder runs to his right, catches it, and looks up to see the umpire signal no-ball. Big no-ball too."
"full, on the pads, clipped away crisply to the square leg boundary"
