"back of a length, on middle stump, not a bad ball at all. Vijay switches his hands on the handle, steps away from leg (off) stump, and swats it away fine, to the third man (fine leg) boundary"
"length ball on the pads, stays on the back foot to flick through midwicket"
"slower short ball outside off, Stoinis can't connect with his cut"
"short outside off, pulled away to deep midwicket"
"full outside off, and Vijay lofts it over extra cover. Bounces down in the gap between sweeper cover and long-off. The former, true to his name, does the sweeping up"
"short outside off, Vijay looks to make room and slap it away. Can't put bat to ball. His weight was moving away from the ball as he played the shot"
"ooh, that was close. Sees Vijay making a bit of room and spears it wide of off - that seemed right over the tramline. Dharmasena doesn't signal wide"
"short ball gets the big wicket. Given the size of the square boundary, it's pretty difficult to drag the pull from wide of off stump, and he can only hit it as far as Chahal on the square leg boundary"
"short and wide, and Head has made a mess of this on the boundary. Slapped away fiercely to the right of backward point, and Head, running to his left on the boundary, can't make a routine diving stop, lets it slip under him. Pretty good first ball in the IPL for Behardien"
"full-toss on the stumps, shows the full face to push to long-on"
"low full-toss on middle stump, whipped to long-on"
"full-toss outside off, and Behardien punches it away to the right of the diving extra cover fielder. AB moves quickly to his left from long-off and cuts it off"
"full on middle stump, clipped to deep midwicket"
"shot! Full, angling into leg stump, and Stoinis steps across smartly, sinks down low, and uses the pace to scoop it over short fine leg"
"fullish, close to off stump, beats the bat as Behardien tries to loft that inside-out over the covers"
"bouncer, angling into the batsman and cramping him for room. Hooks weakly in the air, falls well short of deep square leg"
"full-toss wide of off stump, that's a horrible delivery, and Stoinis sinks low and slashes it away to the right of backward point and a long way to the left of sweeper cover"
"slower bouncer, and Stoinis, leaning back, can't connect with the attempted ramp over the keeper"
"length ball on off stump, swiped down to long-on. Didn't middle it at all"
"yorker on middle stump, clears his front leg and drives to long-off. End of an excellent, possibly match-winning spell from Watson"
"full-toss on the pads, and he whips it away but too close to deep square leg. Chahal moved quickly to his right, too quickly, and almost overran the ball, had to stop and reach out against his momentum to stop the ball"
"full on leg stump, and that is smashed. Makes himself room and uses his hands and wrists brilliantly to drive that to the left of extra cover with a lot of power"
"down the track and this is a length ball, stays inside the line and lofts it over the long-off boundary, he's just cleared the rope. Phew!"
"slower ball, back of a length outside off. Stoinis was shaping to shuffle across and scoop. Changes his mind to stab through the off side, but by then it's too late. Beaten!"
"full-toss on off stump and he makes room to slap to the left of sweeper cover and pick up two. He didn't time it at all, and his top hand came off the handle, but he keeps strike"
"full-toss on off stump and all he can do is pull to deep midwicket and pick up two. That was quick, and he didn't have enough swinging room to get any power on the shot. Royal Challengers win by one run."
