"short of a length outside off, not the right length, very nicely timed off the back foot through the covers"
"touch fuller, outside off, left alone"
"goes for the yorker, it's a low full toss which is clipped to mid-on"
"another bouncer, travels over his back as he ducks"
"full on the pads, sweetly flicked wide of mid-on and that's the hundred stand. A superb effort from this pair"
"short of a length outside off, defended to the covers, Anderson turns very quickly in his follow through in a sign of frustration"
"much fuller, outside off, left alone"
"length outside off, defended to point"
gets forward to a full delivery and defends to the bowler
he's across the crease and defends a good length delivery to the off side
"nice shape on this one, full outside off, moves away and is left alone"
"drags this short and wide, square cut wide of point as he moves into the 70s"
"that's the spot, full at off stump, straightens a touch and defended to cover"
"full, wide outside off, left alone"
"wide on the crease, back of a length and this climbs through to Baristow who takes it above his head"
"good length at middle and off, defended"
"full, on the stumps, Hope brings the bat down in a bit of a hurry"
"another good shot off the back foot, punched past cover for a brace"
"this jags back off the seam from short of a length, beats the inside edge and flies off the thigh into the slips"
this slides off the face through backward point as he gets forward
"full outside off, defended to cover"
"full and straight, shapes away late on Hope but he plays it solidly back to Anderson"
"very wide outside off, left alone...called wide"
"straightens the line somewhat, good length, left alone"
"short outside off, climbs through to the keeper"
flung very wide outside off and called again
"87mph, closer to off stump, left alone"
"short of a length, he's across the stumps and defends"
"wide outside off, Brathwaite not interested...it's hasn't been particularly good bowling from England since lunch"
"back of a length at off stump, defended"
"good length at off stump, defended to cover"
there's the inswinger. closes the faces and works to long leg
"a (rare) bouncer from Anderson, Brathwaite ducks and Bairstow has to reach well to his left as this keeps swinging"
"another inswinger, short of a length, takes the thigh pad to the off side"
"short outside off, gets over the top of it and cuts to point"
"another big inswinger, started too straight and it glances off the pad wide of Bairstow down to fine leg"
"short of a length at off stump, defended"
"again it's short of a length, he's pretty comfortable defending on the back foot"
"touch fuller, but wide outside off, left alone"
this one goes two bounces through to Bairstow...might have been a slightly slower ball
"speared down the leg side, Stokes also going for the inswinger...excellent take from Bairstow"
"gets this one fuller and straighter, defended to mid-off"
"pushed across outside off, left alone"
"full at the stumps, defended to the bowler"
"good length at off stump, Brathwaite shuffles across and defends"
"there's the short one, it's outside leg stump and he ducks underneath"
"full, down the leg side"
"full at the pads, clipped through square leg"
gets inside the line of a short-of-a-length delivery and tucks it wide of mid-on
"there's an ask about a top edge down the leg side as he pulls at a short ball, but it's not especially convincing"
"full outside off, left alone"
comes forward and drives a full delivery to cover
"a lively short ball outside off, Hope has to be alert to get his bat and gloves out of the line"
"and he ends the over with a yorker outside off, jabbed back to the bowler"
"over the wicket, defended on the back foot"
"fuller, wider outside off, defended"
gets across onto off stump and plays it straight
"this one goes straight on outside off, pushed into the covers"
left alone outside off
tapped away off the back foot
"banged in short, drifts unthreateningly over the batsman's shoulder"
"wow, that's spanged him clean on the lid! A fierce wicket-to-wicket bouncer, Hope took his eye off the ball and got turned inside-out as the ball hit the back of his helmet. Stokes, to his credit, checks if the batsman is okay. Might need new headgear but he's upright"
"fuller length, leg-sided, flinched to short midwicket"
"back of a length, and tapped to point"
slides down the leg side
"on the pads once more, and tapped to square leg"
"big stride, and pumped through the covers. Tremendous"
"a hint of turn, but watched onto the bat on the back foot, and played to leg"
a bit of a smear across the line. Connects but not effectively
"punched back to the bowler, stretching onto the front foot"
"more turn, but slowly into a defensive nudge to leg"
beats the inside edge and bobbles off the pad. Cries of 'catch it!' but always safe
"banged in short, ducked"
"back of a length, fenced to backward point"
forward and blocked to cover
"very full, straining for the breakthrough, pushed assertively to backward point"
"short, but unthreatening. Hope ducks"
"up on the toes, stabbed to cover"
"turned inside out to combat the spin, and defended on the back foot"
solid stride and blocked
"waits on the back foot, and blocked into the off side"
tapped to the leg side
"blocked once more. Tight lines, but slow turn"
"fuller length, attacking line. Defended on the back foot"
into line to defend
"outside off, full length, left alone with barely a break of stance"
stretching across the crease in a bid to connect with a short and wide one. Careful now ...
"short and sharp, lifting through to the keeper. Brathwaite rides the elevator as the ball goes by"
"on the pads, and tucked to the leg side"
"defended on the back foot, another maiden"
shuffles back and across to block in front of off. Good attacking delivery
"slightly off-line this time, and flicked through square leg"
a firm push into the covers
"on the pads, tucked into the leg side"
"static at the crease, waiting for the ball to hit the bat, and pushed into the covers"
"huge appeal! What's happened here? It's ended up in the hands of slip, and it is going to be <B>reviewed</B>. There was sharp turn, past the inside edge on two occasions, as it deflected through the gate, onto the pad, and away to the catcher. No bat involved. On we go..."
"up on the toes, tapped into the off side"
"outside off, stabbed into the off side"
"banged in short, but leg-sided. Easily avoided"
"on the back foot, met with a solid bat and pushed to cover. You. Shall. Not. Pass!"
"full length, almost a yorker, but well dug out"
"ooh, late nip off the seam, and Hope is lured into a loose flash outside off. Decent over. Stokes is trying to make something happen. Still a long way to go until the new ball..."
"back of a length, attempted back cut. Under-edged and bounces to slip"
clipped through the leg side. Two more to the total
punched back to the bowler
"extra air this time, swished past silly mid-on for another single"
"on the back foot, hoicked to the leg side. Good connection but silly stands firm"
"on the pads, chipped to the leg side"
"on the back foot, meeting the round-the-wicket line with a dead bat"
"round the wicket, again, too wide, and chopped firmly through the off side. Meaty connection"
""
"round the wicket, defended on the leg stump"
"back over the wicket now, left alone outside off"
"up on the toes, tapping the ball back to Stokes who has a shy in his followthrough, because why not?"
"onto the front foot, and drilled sweetly through the covers. That'll make him feel better!"
"swished hard through the leg side, where Cook at backward square pulls off a very fine tumbling stop. He's not been stationed there for many a moon..."
clipped on the up to mid-on
"stands tall, pushed into the gap at midwicket. The runs keep trickling out"
chiselled down to long-on
"crunched into the covers, a very fine pounce to intercept at short cover"
"whoops, an attempted leg glance, turned inside-out and finds a thick edge through gully"
tight off-stump line but back of a length. Defended back down the pitch
pushed into the off side
"good nut! Tight line, climbs off the pitch, fizzes past a flinching edge"
"wider line, an easier leave-alone"
"on the toes, flicked to the leg side"
"pounded down the ground to mid-off, where an awkward bounce almost eludes Root"
shuffles across the crease to defend to leg
"outside off, a freebie, and gleefully latched onto. Cut fiercely in front of square to bring up the 150 stand. Brawling!"
"onto the front foot, defended once more"
"back and across, and ... <B>dropped!</B> Such a tough chance, needed to nestle in the gut of Stoneman at short leg really, but these athletes today, stomachs like washboards, it just trampolines away to safety..."
stabbed into the off side. Half a chance in that over!
"firm defence, blocked into the off side"
tight line on off stump. Blocked to the off side
"edged,<strong> but through the gap at third slip!</strong> There's the half-chance that England needed, but the fielders weren't in position. Good delivery from Broad, full and attacking the edge. Nothing going for England right now"
"pushed onto the front foot, worked to the leg side"
"lovely confident strike! Straight back down the ground, past Broad's outstretched hand"
"flicked into the leg side, off a full length"
"good areas first-up. Met with an aggressive thwack, back through the line"
"good turn from middle to leg, helped round the corner"
"stretching onto the front foot, not quite getting that right as a streaky leading edge flies through the leg side. Up comes the 200!"
more confident defence this time
"in the slot and out of it again! Brathwaite brings up a brilliant, battling hundred with a wonderful wipe for six over long-on! He's ecstatic, and quite rightly so. He's giving his side a real puncher's chance in this contest!"
"onto the front foot, and stoutly blocked"
"well, well! This one scoots through low and Hope does very well to keep it out. Toe end of the bat"
defended on the back foot to the leg side
"outside off, defended"
"fuller, he gets forward and plays with bat in front of pad"
flicked off the pads to midwicket
"pushed with a straight bat into the leg side, can't beat short midwicket"
tucked off his hip to long leg
"full outside off, takes the outside edge as he plays forward but along the ground to the slips"
"edged, through the gap! Good length ball outside off, Hope feels for it a little and it flies between Root and Westley. Would probably have been short of a conventional third slip"
"this time he beats the edge, hits the pitch hard back of a length"
works a straight delivery to the leg side
opens the face and taps a length ball into point
"that's cracking shot, a big stride forward and drives through the big gap at cover...that's his Test best"
flicked off the pads to deep square leg
"pushed outside leg stump, padded away"
stretches well forward and defends
defended to the leg side
"tickles this fine, not far from a diving leg slip...may have flown past Cook on the full. Yes, it did. No hand to it"
"what a wonderful shot! Plenty of flair in this, a one-legged pull through square leg. Touch of Greenidge in that"
"and there's his maiden hundred! Short-of-a-length ball, tucked off the his body down to long leg. Magnificent effort"
"full outside off, driven to mid-off"
"steers a length ball behind point with a nice piece of timing, Crane does that chase - he's on as 12th man"
this nips back from short of a length and is worked to the leg side
"full at off stump, hint of late shape, pushed to mid-on"
turned to short leg
takes the pad to backward square leg
defended to the off side
leans forward and defends
"full and straight, slides off the face to the off side"
padded away to short leg
"very full, pitches beyond the popping crease, scuttles through to the keeper"
"this has some extra bounce on it as it tails back in at Hope, takes his bottom hand off the bat"
"a very elegant back foot drive as Stokes drops short outside off, doesn't quite reach the deep point rope"
"onto the front foot and drives strongly, in the air just wide of cover to bring up the 200-run stand. An epic effort from these two"
"full outside off, left alone"
through to the keeper
props forward and defends
worked off his pads behind square
"big appeal for lbw, given not out and Root eventually calls for the <b>review</b> although his heart didn't seem in it. Brathwaite back in the crease, but looks like he's been hit outside off stump again. Yep, he has."
"on leg stump, worked to backward square leg"
"tickled off the pads again, this time a little finer and Malan has to bring out the dive"
"touch short, flicked to midwicket"
"significant spin from outside off, played off the back foot wide of slip and Stokes dives to cut it off"
comes down the pitch and clips to long-on
pushed off the back foot back to the bowler
leans well forward and drives gently to cover
defended off the stumps to midwicket
"back and across, the line is outside off, defended"
flicked into midwicket
"a shorter delivery, worked around the corner wide of leg slip"
"goes for the sweep, rebounds off short leg and deflects wide of short fine leg...Malan chases it hard, dives and flicks it back. Does very well to save a couple"
well forward and defends
tapped back to the bowler
"a shorter delivery, defended into midwicket"
"full outside off, defended"
"beats him with out that goes on straight outside off, it's quite to be playing at but he's well across his crease"
bottom hand comes into play and works back to the bowler
"back and across, defends from a line outside off"
"a quicker delivery, spins down the leg side. Good take from Bairstow"
opens the face and steers this into the point area
flicked firmly to the leg side and finds midwicket
padded away to short leg
"goes back to a shorter ball, skids on and takes the pad"
"glances off the pad again, Cook dives at leg slip"
"full at off stump, well forward and defends"
"gets a bit loose now, tempted by a little more air, goes for the drive and it takes a thick inside edge through square leg"
finds the outside edge as he plays back but it shoots to ground before reaching Stokes
worked off the back foot to deep midwicket
pushed into the off side
uses his feet and drives to mid-off
"full outside off, this time he picks out cover"
flicks a straight delivery wide of short leg
defended to short leg
gets forward and shovels a full delivery down to long-on
defended on the back foot
"plays with the turn, wide of leg slip to short fine leg"
"tosses this one wider outside off, driven into the ground and it bounces to cover"
runs off the face into point
"full at off stump, late shape away, he adjusts to it and defends towards point"
"full at middle, defended into midwicket...getting a little squared on"
"outside off, good length, defended to cover"
"full, outside off, left alone"
"touch shorter outside off, played from the back foot"
"short of a length, defended to the left of Anderson and it gets across from his follow through"
"and he's greeted with a lovely straight drive from Hope, a full half volley which he presses forward into and drills it back past Broad"
"good length at off stump, defended"
"back of a length outside off, holds his bat inside the line as it goes through to Bairstow"
"a well-judged leave, perhaps on length as well as line, almost carries over off stump"
"full at off stump, loses his shape a touch as he drives and it runs wide of mid-on"
"length ball at off stump, 84mph, defended to midwicket"
"full outside off, curves away, left alone"
this one finds the outside but it runs along the ground to gully
"short of a length outside off, left alone"
"another reasonably tight, but good, leave outside off...ball didn't really bounce, either"
watches this go through outside off
"full at the stumps, gets well forward and drives straight of mid-off who is stationed quite wide"
"another one goes straight of mid-off, not as sweetly timed as Hope's effort, comes from low down on the bat, Moeen can haul it in. Scores are level"
"back of a length outside off, 83mph, defended down towards gully"
"onto off stump, defends a length ball to point"
onto the front foot and drives a full delivery to mid-off
"back of a length, the way Hope chops down on this suggests it kept a little low"
"good length at off stump, defended"
"full at off stump, pushed back down the pitch"
flicks a straight length delivery through square leg and that's the <B>lead for West Indies</b>
"short of a length outside off, pushed to mid-off"
"poor ball, short and wide outside off, square cut to deep point. Ask for and got"
"and again, poor delivery, short outside off and it's a repeat offering from Brathwaite as he dispatches wide of point"
"better, full length, tighter to off stump, left alone"
"full outside off, good carry to Bairstow who takes it in front of his face"
"some late movement away outside off, he watches it closely and withdraws the bat"
"on the stumps, makes him play, slides off the outer half of the bat through gully"
"full outside off, pushed to mid-off"
worked off the stumps towards mid-on for a scampered single
tucks a straight ball off the stumps to long leg
"hello, this one is fired down the leg side, and there's a persuasive appeal for caught behind. Umpire Ravi isn't persuaded, but Joe Root has heard enough to go for a <B>review</B>. But it's off the pad, so on we go..."
"full and straight, well dug out with a straight blade, back to the bowler"
"on the hips, shovelled to square leg"
"on the pads, and that is the shot of a man who is seeing it like a planet. Clipped on the up, through midwicket. Shot!"
"too full, right in the slot, pumped down the ground through long-on! Desmond Haynes couldn't have dispatched that any better"
"another good connection with the on-drive, but picked up at mid-on this time"
"on the toes, clipped to the leg side"
"misdirected again, turned off the pads to fine leg"
"tucked to the leg side once more, Broad persisting with the angled attack into the stumps"
into line once more
defiantly thwarting Broad's fuller length
"keeps a touch low on off stump, squeezed to cover"
"tight line, defended once more"
lifting a touch on off stump and pushed to point
"good carry this time, trampoline bounce on a good length outside off"
"crashing drive into the covers, but a good interception"
stabbed into the covers
"sliced drive! In the air for lo-ong time, but dies just short of Stoneman at cover... another nearly but not quite moment"
blocked into the off side
"bowled him! The breakthrough finally arrives, and it's one that maybe keeps a touch low as Brathwaite prods forward but is bowled through the gate. The end of a truly epic Test innings. And one that could yet set up a series-squaring win. It's been that good"
an extra spring in Broad's step as he hammers out a good line and length on off stump
"a touch leg-sided, and tapped to midwicket"
swished down to backward square to get off the mark
forward and pushed into the off side
"squared up on a leg-stump line, deflected to short leg"
"wide of off stump, no stroke offered"
"punched out to point, up on the toes"
"through to the keeper, no stroke offered"
worked into the off side
"very full, squeezed back to the bowler who gathers in his followthrough"
"on the pads again, a bit of a stock delivery at the moment. Flinched to the leg side"
back of a length again
"much fuller from Broad and this one zings past the outside edge, holding its line as Chase played for the nipbacker"
"nice! A flowing drive, leaning onto the front foot to meet a fractional over-pitch. Nails it through the covers"
"outswinger, back of a length, ignored as it zips through to the keeper"
"angled in, grazes past the off stump as Chase leaves alone"
"wide of off stump, left well alone"
"in the air...! But short of mid-off, as it takes the leading edge and pops into no-man's land"
"on the back foot, tucked round the corner"
punched into the off side
that's a sharp bouncer ... Chase takes the lift to the fourth floor as the ball whistles past his nose
back on a fuller length. Firmly behind the line
"through to the keeper, wide of off stump"
"reaching onto the front foot, blocked"
"driven, off an inside-edge, to midwicket"
"outside off, no stroke offered. West Indies' just beginning to hunker down for the close, you sense"
"outside off, and an inside-edge! Caught in no man's land on the back foot, and very lucky not to chop that onto his stumps as he made a late decision to play at it"
"that's more decisive! Onto the front dog, punched through the covers, and Moeen chases well at extra cover to cut off the boundary"
"on the pads, worked square"
"down the leg side, a lot of balls have been headed that direction today"
confidently onto the back foot to block to point
"edged and gone! Stokes makes the breakthrough, good lift outside off, drawing a hard-handed push, and Cook tumbles backwards at slip to cling on!"
"banged in short, well ducked"
"wallop! Stand and deliver, thrashed through the covers! Stokes is utterly non-plussed"
"up on the toes, defended with a hop"
"back into the crease, tucked to leg to rotate the strike"
turned to leg once more
"outside off, a hint of outswing"
"short and sharp, tight to off stump and well left"
defended into the off side
"wide of the crease, attacking the stumps, tucked to leg"
"on the pads, again, turned behind square"
forward to defend
"flick-walloped off the pads, to backward square leg. Not sure he'd be able to play that again if asked. Remarkable improvisation and timing"
hops onto the back foot to block
"up on the toes, defended into the crease"
forward and blocked back to the bowler
"full and attacking the pads, chiselled into the leg side"
"bending towards the slip cordon, left well alone"
stands tall in defence. Pushed back down the pitch
"they won't be needing a nightwatchman if Blackwood keeps seeing it like this! An open-faced spank over the covers. Because he can, that's why!"
"attempted leg glance, doesn't make contact"
"down the leg side, swinging merrily, and an attempted wallop doesn't quite come off"
"banged in short, no stroke this time"
"a wide half-volley, tempts the loose drive, no contact"
"on the back foot, pushed out to point"
"up on the toes, and tucked to the leg side"
"banged in short, too short"
"crunching drive, into the covers"
"on the back foot, defended outside off"
pushed to cover
pushed into the off side once again
down the leg side
worked out to midwicket to keep the strike
"defended on the back foot, Stokes scuttles in his followthrough to gather"
through to the keeper from wide on the crease. Good leave
punched firmly into the off side
"back and across, pushed to the off side"
"well bowled, very full, tailing in late, and somehow it gets deflected through the cordon and all the way to third man. Stokes is audibly miffed"
well left on a good length
"drilled back to the bowler, still looking to be confident on the front foot"
"width, and thrashed! Attaboy Jermaine, keep spanking those boundaries. This one fizzes through point"
"held back in the flight, Blackwood checks his stroke and punches to cover"
huge stride forward to smother the spin
pushed firmly through the vacant cover. Sensible batting
"a freebie to finish. Short and leg-sided, and flogged through backward square"
"<b>what a start, gone first ball!</b> In the channel outside off, just a little nibble, grazes Hope's outside edge and Anderson's gets it right straightaway"
"<B>and another, edged to second slip!</b> Anderson has his fifth, it's two-on-two-balls. Back of a length outside off, Dowrich pushes at it and sends a thick edge to Joe Root"
"full outside off, brings him forward and he defends into the gully area"
"good shot, short of a length outside off, Holder drives off the back foot and it runs through backward point"
"full outside off, left alone"
"full at off stump, he drives to mid-off...phew, that's some first over"
"short of a length outside off, decent carry through to Bairstow at chest height"
"<b>dropped at mid-on!</b> That's a dolly, as easy as Gabriel's on the first day. Moeen the man. Blackwood club it off a good length, got no timing, it spooned in the air and somehow Moeen has shelled it. Oh dear"
"now he slashes at cut shot, edges short of Cook at first slip who takes a blow on his knee and is left hobbling"
"short of a length at off stump, pushed firmly to the covers...Blackwood isn't going to block it"
"that's a good short ball, Blackwood gets into a tangle as he fends it to the leg side...no one in at short leg"
"full and wide, Holder has a flat-footed flash and doesn't make contact, Bairstow tumbles in front of first slip can't glove it cleanly. What a crazy opening couple of overs"
"edged! Over Stokes at a gully (don't swear, Ben!). Short of a length outside off, he's aiming to work this to the leg side, it's a big outside edge which flies over a leaping Stokes"
this is fuller and zips past the outside edge with some late movement
"that's a good one, this one nips back off a good length and cuts him in half to beat the inside edge"
"fuller at the stumps, worked to the right of mid-on"
"back of a length outside off, defended late and it runs to gully"
"a strangled appeal for lbw as he plays around a full, straight delivery but it's angling down the leg side"
"a short ball, he ducks"
works a full delivery off the stumps into midwicket
"full at off stump, defended"
"that's nicely bowled, gets it full outside off, brings the drive from Holder and there's enough late movement for it to beat the edge"
defended on the front foot to point
drives a full delivery to mid-off
"good length outside off, 80mph, defended to cover"
"an appeal for lbw as he swings across the line of a straight delivery, but it's high on the back leg"
"a very short bouncer, Blackwood barely has to duck and it's called a wide"
"full at off stump, defended"
worked out to deep square
