"round the wicket, full at off stump, defended on the front foot"
"very full, wide outside off, Cook opens the face and steers it through backward point"
"good length at off stump, strides into the ball and blocks to mid-off"
"full, wide outside off, 85mph and left alone"
"beats him as Cook tries to drive, just nibbled off the seam on a full length"
"gets well across the crease, onto the front foot, defends a full delivery to cover"
starts with a very wide delivery which Dowrich takes in front of first slip...must have been close to a wide
"full, well outside off, 87mph and carries at shin height to the keeper"
"that's the right area, good length at off stump, brings Stoneman forward and the thick edge wide of third slip"
digs out a full delivery square through the off side
"full and straight, pushed firmly to mid-on"
"angled across outside off, on a good length, nudges 90mph and it's left alone"
"short and wide, dies on its way to the keeper"
solidly onto the front foot and pushes into the gap at cover
"a short delivery on leg stump, 84mph, doesn't appear to be too much pace in the pitch, Stoneman fends it round the corner taking his bottom hand off the bat"
"round the wicket, full outside off, defended to point"
"wide outside off, left alone"
drags the length back but again too wide to interest Cook into playing
"short of a length, angled across Stoneman who pulls his bat inside the line"
"a fuller delivery, at off stump, trapped off the inside edge into the pads and it trickles to the off side"
pushes a full delivery to mid-off...89mph. No signs of swing
"back of a length at off stump, defended towards backward point"
"this one is shorter, he waits on the back foot and defends into the covers"
"fuller at middle and off, 87mph, a hint of Stoneman being squared up a little as he defends"
"full outside off from round the wicket, 82mph, Cook again well forward as he defends"
"that's a good one, drags the length back and it's on off stump then straightens off the seam to beat Cook's edge"
"nicely put away, short of a length outside off, Cook steers it wide of backward point off the back foot and it just has the timing to beat the chase...Blackwood can't quite flick it back"
"full outside off, left alone"
this one comes back in at Cook but started wide enough to leave alone
"full at off stump, defended to the covers"
"full at off stump, takes a thick inside edge to the leg side as Stoneman gets forward"
"straighter delivery, worked off the pads and it's cut off by the fielder stationed behind square"
"a short ball, over off stump at 85mph, Stoneman drops his hands and sways out of the line"
"this one zips across outside off stump from short of a length, kept going further away on the way to the keeper"
"fuller, on the stumps at 89mph, takes the thigh pad as he aims to work to the leg side"
"short of a length, pushed down the leg side"
"good length outside off, Cook comes forward and it slides off the face wide of third slip"
"good length outside off, defended"
"fuller, a touch of swing on that one as it moves away from Cook, left alone"
"gets a little closer to off stump, left alone"
pushes this one down the leg side as he tries to make Cook play
"back outside off stump, full, defended on the front foot to cover"
"short of a length at off stump, nudged to the leg side and Cook needs to get the big strides out. Close with a direct hit"
"<b>edged to third slip!</b> Gabriel gets the huge breakthrough. Excellent line at off stump, just back of a good length, makes Cook play and it's a sharp, low grab by Kyle Hope"
"good delivery, full at off stump, defended back down the pitch"
"good length, nips back off the seam takes a thick inside edge into the pads"
a bouncer at 91mph but it's a little off target as he flings it down the leg side
"short of a length, takes the thigh pad to the leg side...good over from Gabriel"
"well bowled, almost a yorker at off stump, squeezed off the outside edge along the ground to third slip"
"full, very wide, left alone"
that's a nice piece of timing as he comes forward into a full delivery and pushes through the big gap at cover
"well bowled, beats the outside edge with a full delivery which nips away off the seam"
"straighter, worked off the pads to midwicket"
"back outside off stump, a little too wide, through to the keeper"
"edged! But doesn't carry to third slip. Back of a length at off stump, Westley coming slightly across the ball but he manages to get the ball to ground"
"88mph, back of a length outside off, think Westley is beaten this time although he did try to play inside the line"
"full, straighter, takes a thick inside edge into the leg side"
"slides this one past the outside off, across the left hander, with some seam movement"
"back of a length at off stump, 91mph, defended on his toes"
"full and straight, he comes slightly across the ball but pushes it safely into the covers...another very good over from Gabriel"
"back of a length outside off, angles in at Westley who leaves alone"
"fuller, outside off, left alone"
"short and wide, cracked through the covers off the back foot without much timing"
"<B>full, straight and lbw!</B> Very similar to first innings at Edgbaston. Roach rewarded for getting the ball full, Westley went for a drive and it beat the inside edge to hit the back pad"
greets the England captain with a short ball which he sways out of the way of
"shows how to play with a straight bat, full ball at off stump, pushed to mid-off"
"full outside off, 76mph, left alone"
"a touch closer to off stump, in the channel, left alone"
"in the air, but finds the gap! Full outside off, Stoneman goes for the drive and it skews through backward point"
"very full, pitches on the popping crease outside off, left alone"
a shorter ball which loops through outside off
"short of a length at off stump, defended to the covers"
"on a good length outside off, defended to cover"
"striding forward, meeting the ball on the front foot outside off"
"good delivery, nibbling away late and beats a half-cocked prod"
"crunching drive! Full length, swinging into the middle of a fierce blow through the line. High elbow, knee bending. Sumptuous"
"back of a length, outside off, no stroke"
defended with an angled bat into the off side
"nibble dibble! Well now, that's got Holder interested! Big jag back into the left-hander, and Stoneman is grateful for some extra bounce as that clatters into his knee roll. Going over, but plenty to ponder"
"left alone again, a touch uncertainly, but much more safely as the ball bursts through to the keeper"
"tight line, left alone"
"banging out a good length, outside off stump. No stroke once more"
through to the keeper once more
"on the pads this time, a fraction too straight and clipped sweetly through the leg side"
"good wheels, but sliding down the leg side"
"too wide outside off, and through to the keeper"
"full and straight, stabbed back to the bowler"
"width outside off stump, a touch of late swing, left alone"
"on the pads, tucked to the leg side"
"that's another loose stroke and England are three-down! Full length from Roach, just a hint of movement back into the left-hander, there's a yawning gap between bat and pad, and he's only gone and grazed an inside-edge to the keeper!"
"superb line and length, jagging from a full length, and edged just short of slip."
"outside off, have a dart, I dare ya ..."
back of a length and defended into the off side
"well bowled again, angled defence into the off side. Point gathers"
"pulled from just back of a length, out to midwicket"
plugging away on a good length. Tricky times for England
"well bowled again, beats the edge from a full length as Root hangs his bat roughly on the line of off stump"
"compact drive, but not enough power to elude the grasp of mid-off"
watchful in defence
sliding the back foot into line to defend once again
"very wide of off stump and Root throws caution to the wind and the bat at the ball. Misses out, and just as well"
"very full, punched into the covers, slightly outside-edged but effective enough"
outside off and through to the keeper
"through to the keeper once more, immaculate line"
probing away on off again
"ooh, nearly nearly! Root strides forward, drives aggressively, and so nearly inside-edges onto his own timbers! Just enough jag from a full length to keep England wondering"
"zips through on a good length, good lift as Root leaves alone"
"up on the toes, deflected down to third man"
through to the keeper again
"tight line, attacking the pads, defended with a vertical bat on the back foot"
angled defence into the off side
"outside off, through to the keeper"
"pounding out a good length, a fraction wider this time, and the keeper gathers"
"tighter line, same probing length, stabbed defence back down the pitch"
poked to point off the back foot
"banged in short, swinging down the leg side, and belatedly signalled by umpire Ravi"
"up on the toes, blocked back to the bowler"
"through to the keeper, a stride across the crease to cover the stumps from late movement"
punched to cover off the back foot
"edged and <B>dropped!</B> Oh good grief, what a moment! That could have been West Indies officially in control of this Test. Outside off, a hard-handed poke, Powell watched it into his hands and straight out again. Root was already walking off the pitch!"
outside off and through to the keeper
"on the back foot, tight defence"
tucked into the leg side
tight line into the left-hander's pads. Poked back down the pitch
"uneasy push-drive into the leg side, walking into the full length"
"in the channel outside off, through to the keeper"
"stride forward, raised bat"
solidly onto the front foot and blocked
looped up and clipped to leg
"round the wicket, driven into the covers on the front foot"
"flicked hard off the pads, and through the leg side"
"down on one knee, excellent timing and placement, sweeping through backward square"
"driven, but not quite to the pitch of the ball. Worked back up the pitch"
curling back into the left-hander from a full length. Well watched onto the bat
"and again, just a bit of shape through the air to keep Malan honest"
"good follow-up, this one just keeps going across Malan's bows. He's clearly in two minds as he hauls his bat inside the line"
"plays at this one, with a jab off the gloves outside off stump"
banging out a good length outside off stump
"tighter line, left alone"
"sharp turn from a full length, defended on the back foot"
"big stride forward, blocked back down the pitch"
"too straight this time, flipped off the pads into space behind square"
stout defence on off stump
"on the pads again, but midwicket prevents any damage as Chase strays too straight"
flicked with intent but can't breach the defences at short midwicket
"good nut! Tight line, holds its line... Malan squares up and is lucky not to graze an edge"
dabbed into the cordon with an angled bat
"stabbed into the off side, good tight line again"
"back of a length, tucked to leg"
through to the keeper once more
"striding forward, blocked into the off side"
worked off the pads to backward square
"driven, and finds the gap this time. Not perfectly timed, but pierces the covers"
forward and blocked into the off side
"driven again, with much more power and intent. Never mind the lunchbreak, if it's there to hit he'll hit it, clean through mid-off"
chiselled to deep midwicket
"defended into the off side, and that will be <B>lunch</B>"
"that's a poor start to the session, short outside off - and a no-ball - and Root square cuts it over cover"
"gets this fuller, outside off, some swing away and left alone"
"good length outside off, defended to cover"
left alone outside off
"fuller, 77mph, through to the keeper"
"back of a length, punched to cover"
"hung wide outside off, left alone"
"short of a length at off stump, defended on the back foot"
"another one short outside off, firmly put away with a cut through point"
""
"full at the pads, clipped to the leg side"
"full at off stump, defended on the walk a little to cover"
"goes for the yorker, it's far off target, Root gets it off a toe end...92mph, decent wheels"
"drags this short outside off, trying to push it across Malan, reaches Dowrich on the second bounce"
"back on the stumps, worked to the leg side"
"full, wide outside off, left alone"
"<b>through him!</b> He switches to round the wicket and it brings immediate reward. It's full outside off, Malan goes for the drive and gets an inside edge into off stump"
"stays round the wicket, good length outside off, Stokes get forward and defends"
"some movement into Stokes, a fuller delivery, worked to mid-on"
"outside off, left alone"
pushed down the leg side
"low full toss outside off, comes off a thick edge as he drives and scuttles to second slip"
"aims to work a full delivery to the leg side, gets a leading edge to the covers"
"full outside off, some shape back at Root as he leaves alone"
"good line, just outside off, defended to backward point"
"full outside off, left alone, the batsmen need to focus again after that break"
"this one is very wide outside off, and called wide...those calls have been inconsistent in this series"
"back of a length at off stump, defended to mid-on"
"full outside off, Stokes leaves it alone"
"switches to over the wicket, full at off stump, punched back to the bowler"
"good length outside off, sliced to point"
"nearly has a nibbled! Good length on the angle across, Stokes pushing away from his body"
"beaten! Another good one, full outside off, some shape away and it skims past the edge as Root comes forward"
"nice curve away from a full length, left alone"
"back of a length at off stump, defended"
"a full toss outside off, this time he doesn't miss out and drives to the cover rope"
"over-adjusts, pushed down the leg side, Root misses his flick"
"another full toss! This time Root losses it, but fortunately for him it's not straight...scoots under the bat and past off stump"
"good length outside off, shoulders arms...Stokes still not off the mark"
"fuller, he comes forward and defends to mid-off"
"back of a length, flicked from outside off into midwicket"
"in the air, but over midwicket! Full on the pads, was a sweetly-timed flick by Stokes but not a million miles from the fielder. Was travelling, though"
"good length at off stump, defended"
"pushed across outside off, through to the keeper"
"decent delivery, some significant move back in at Root as he leaves it alone...good carry, too"
"again, late movement, it's fuller this time and Root gets an inside edge between his legs...dodgy times"
"that's a wild one, flung down the leg side...but you'll accept a few of them from Gabriel for the good ones"
"back outside off stump, full length, this one moves away"
drives this full one back to the bowler
"drags this down short and it's a fantastic shot from Root as he swivels on a pull, taking the ball from outside off - at the small matter off 88mph - and placing it behind squre"
"over the wicket, very wide outside off, and called again"
and now this one is down the leg side
"this one slants across outside off, quite wide but Stokes has a push at it"
"wide and wild, again, and out go the umpire's arms...Holder's lost his radar this over"
"that's a good one, back of a length at off stump, some extra bounce and seam movement which squares Stokes up and takes the back leg"
"full at middle and off, defended to the bowler"
gets forward and drives to mid-off
"good length at off stump, played to the leg side"
"short outside leg stump, Root rocks and timeless this effortlessly through midwicket with a straight-bat flick"
"this one is short outside off, driven from the back foot to the cover sweeper"
"short again, pulled and finds midwicket"
tucks this into the leg side
"tries to get it fuller but Root again able to drive off the back foot, to cover this time"
"and it ends with a short one as well, pushed off the back foot to cover...he'll need to get it significantly fuller"
"delivered from wide on the crease, full at off stump, defended to mid-on"
"back of a length, punched back past the bowler and straight of mid-off"
that's hammered! He reaches forward and drills a full delivery straight of mid-off
"has he edged that? Clearly not...was very full and wide, Stokes drives and he hits the ground. Well, blimey! The replay suggests it's could have come straight off the top edge. But was the noise all bat on ground?"
"round the wicket, left alone"
"outside off, left alone"
pushed off the back foot to mid-off
"short outside off, cut to point"
"fuller, at off stump, that's the spot and Root defends on the front foot"
""
that's a good 'un! A bit of drift then lovely spin away from Root to beat the edge
"brings out the sweep from outside off, gets it through square leg, Gabriel goes old-school on the boundary and stops it with his boot"
"round the wicket, hits the deck hard outside off, edged down into the gully"
"low full-toss, outside off, drilled to cover"
"edged and <B>dropped!</B> That's terrible from West Indies' cordon. A fizzing, lifting edge from Roach, into Stokes' splice, and through the hands of Brathwaite at second slip, it flicked his thumb as he picked it up late. You can't be handing out second chances like that..."
"that's how to punish the mistake, fiercely onto the front foot and drilled through the covers"
"well bowled again, Stokes is squared up on the back foot to defend"
solidly into line on the back foot
"back of a length, too short to threaten, and punched calmly off the back foot to deep cover"
"outside leg, worked firmly into the gap at midwicket"
"sharp spin from outside off, Root back-cuts to point"
"teasing turn and extra bounce, Root tries to drive off the back foot but is beaten"
pushed to cover
"swept through midwicket, and Root has equalled a world record!"
"squared up on the back foot, aggressive line and length from Roach, cramping Stokes for room from round the wicket"
solidly into line on the back foot once more
"back of a length and clobbered. Off the toe of the bat if truth be told, but his long levers made up for the lack of timing through the covers"
"front foot this time, and attractively punched through cover"
"full length once more, attacking the stumps, and takes an inside-edge onto the pads"
"edged,<strong> and through the vacant third slip!</strong> Roach is exploding with frustration! Such a feisty spell and he's got nothing to show for it. He moved that slip into the covers only a couple of balls earlier"
"outside off, tight line, left alone this time"
"up on the toes, riding the extra bounce outside off"
"a languid punch to long-on, no threat from that length"
"down on one knee, dabbed behind square"
"fully forward, angled defence into the off side"
swept again. Bishoo is being punished on the short ball and now on the full. Through square leg this time
tight line once more
"drilled through the covers, reaching onto the front foot and pounded"
"half a thought about a flick across the line into those acres of space, but Stokes resists"
"on the pads, the keeper chases and strikes with his shy"
"a flowing back-foot drive, gathered at point"
"wider on the crease, left alone outside off"
"back of a length, straightens towards off, and punched to mid-on"
"fuller length, better length, defended under the eyeline, on the back foot"
leaning forward to defend again
flicked to the leg side
"edged and gone! SIlence abounds in Headingley as Root lines up the sweep, but nibbles a toe-end into the hands of Blackwood at slip! Yet again, he's reached fifty but failed to kick on. And England remain unable to assert any dominance on the day"
good leave on a tight line. Tossed up as Bairstow shoulders arms. We've got a contest!
"outside off, left alone"
"back of a length, swinging away. No stroke offered"
"width, and hammered past backward point. Shot"
"outside off, through to the keeper from round the wicket"
left alone once again
"onto the front foot, punched into the covers"
"tip and run, picks the gap and through they shuttle"
"on the pads, and that has snuck under the thigh pad, right into Stokes' lower thigh. Ouch"
"squared up on leg stump, clipped to midwicket"
"full length, outside off, driven with a full face to mid-on"
"width, and crunched square of the wicket, down into the ground and over point. He's flying now"
"nip from a good length, climbs into Stokes' gloves. Well bowled"
chiselled back up the pitch
"strong stride, onto the front foot, blocked"
"drilled hard, to short cover"
"forward, defended"
cut to point
"on the back foot, attempted steer into the covers, under-edged into the pitch"
"cramped for room on the cut, worked out to point"
"another hard-handed drive, another edge! Bairstow isn't convinced, it was claimed very low at second slip, but the <strong>soft signal is out </strong>as they are sent upstairs for the verdict... it's very tight, one of those ones that might have been overruled in the old days, but there is 'nothing conclusive' to overturn it today, as Holder's fingers envelop the ball, so off he goes!"
"left alone outside off, and no stroke offered"
"on the back foot, solidly blocked down into the pitch"
"on the pads, clipped fine for Roach to gather at fine leg"
punched into the off side
"striding forward, driven to cover"
gentle turn outside the left-hander's off stump
"through to the keeper once more, just enough turn to keep the batsman thinking"
"good areas, lifting from outside off into the keeper's gloves"
"squared up on the back foot, blocked"
striding forward and defended again
"pulled, but not convincingly! Stokes was aiming through midwicket but this spirals off the top edge and clears the cordon! Streaky, but effective"
defended off the back foot
"ooh, well bowled. Now you see me, now you don't ... just darting off a good length, past the outside edge"
"looped into the toes, attempted yorker, more or less dug out"
"banged in short, but down the leg side. Moeen isn't tempted"
"on the pads, tucked to the leg side, and that will be <B>tea</B>"
"back of a length at off stump, gets an inside edge into his crease"
"short outside off, goes for the cut and bottom edges into the pitch"
"fuller, outside off, left alone"
pitches in the footmarks and loops through to the keeper
"full outside off, stretches forward and drives to mid-off"
"full at the stumps, flicked towards mid-on and can't quite beat Gabriel"
"length ball outside off, steered to deep point"
"that's a gem! Full, wide outside off and it drives it handsomely wide of mid-off to take him to his fifty"
"angled across, left alone"
"and now he goes straight! That's even better. Full outside off, hits right through line but without much of a follow through and pings it perfectly down the ground"
pushes this from outside off wide of mid-on
"short of a length outside, off alone"
"and now Moeen drives, sweetly square through point as he's offered a hint of width...expensive over"
"full outside off, left alone"
"a touch wider, through to the keeper"
"fetch that! Just a fraction short outside off, Stokes pummels it wide of mid-on with a crunching front-foot pull"
"better delivery, good length outside off, takes a thick outside but into the ground then escapes through the cordon"
"he walks at the bowler this time, then leaves alone at the last minute as this nips away off the seam. Nice delivery"
"he gets right across the crease, clips a full delivery down to long leg"
"this spins significantly from outside off, beats Stokes' drive and goes to first slip's right who palms it away"
"full at off stump from round the wicket, defended to cover"
worked off the pads into midwicket
"this slides on towards off stump, Stokes a little cramped for room as he plays to the covers"
"plays a neat paddle-sweep, was a straight delivery, gets it very fine with enough pace on the ball"
driven down to long-off
"slides across outside off, Stokes holds his bat inside the line"
left alone outside off
"another crisp pull from Stokes, wasn't that shortly really, finds deep square leg"
"good delivery, full outside off, comes in late at Moeen who gets an inside edge into his pads and the ball isn't that far from bouncing back into the stumps"
"wide outside off, left alone"
"low full toss outside off, Moeen reaches for it and skews towards gully"
defended on the back foot
"fuller, he gets forward and defends to cover"
"nearly finds a way through, somehow this shoots towards fine...ah, it's an inside edge which beat leg stump"
"short outside off, he rocks back and cuts to deep cover"
"very full, blocked"
"good length, on the stumps, defended"
"full, very wide, gather in front of first slip but not called"
"he slashes over the top of this one, was wide outside off, perhaps didn't quite bounce as he exepcted"
left alone outside off
"that's brilliant, he steps across his crease and whips a full delivery from pretty wide outside off wide of mid-on...toying with the field"
"drives at this one, takes a thick inside into the midwicket area"
"nearly drags this one, a short ball on leg stump, Moeen goes for the pull and it drops down near leg stump...Stokes alert to call him through"
"he opens his shoulders and pops Chase over the long-on boundary, a full delivery, he stayed in his crease and just swung through the line"
"left alone outside off, went on with the arm"
"full at middle and leg, defended"
"and this time he goes over the off side, a touch more width and Moeen deliberately sent this in the air over cover...England race past 200"
"shorter and quicker, tucked off his pads into midwicket"
"very full outside off, driven to the cover sweeper"
"width outside off, driven from the back foot to cover"
once again he walks across the crease and flicks a full delivery from outside off to mid-on
"full on leg stump, clipped off the toes through midwicket"
"through the off side again, another handsome cover drive, big stride forward and a flowing bat. He's motoring"
