"on the pads, clipped to long leg"
"short outside leg stump, he's over the top of it and pulls to long leg"
"very wide on the crease, short outside off, driven off the back foot behind point"
"straighter, good length, defended to mid-on"
"that's wafty outside off from Root, he saw some width and aim to play it square...the ball kept a little low and went under the bat"
"edged? Nope...late swing. But Root was beaten, playing off the back foot to a short-of-a-length delivery"
"good length outside off, and pushed to cover"
"short and wide, chopped to backward point"
"sharp turn from middle to leg, Root hops inside the line and picks off the single"
"outside off, turn and bounce once again. No stroke"
"big turn, but slightly too wide to tempt a shot"
"up on the toes, cut hard to backward point"
"edged and <B>dropped!</B> Oh dear, so much pressure being built up by the bowlers, and this time it's Root once again with the let off! A forcing stroke off the back foot, straight at Kyle Hope's face at the first of two gullies, and the rebound nearly reached the second too!"
"outside off, ploughing that furrow"
"up on the toes, punched to cover"
"wide on the crease, attacking off stump, fenced to gully"
"good stride into line, crunched through the covers. That's better from Root"
"on the back foot, fenced to point"
"round the wicket, more big turn. This is a very good line to the left-hander. Attack that if you dare!"
"shorter and wider, Malan lines up the cut, but it turns <B>big!</B>"
"fuller and straighter, blocked"
"in the slot for the cut this time, but can't beat point"
"well bowled again, sharp turn on off stump"
"and again, drive that and it's an edge every day. Left alone, astutely"
"solid stride, pushed to cover"
"wide on the crease, solid block as the ball angles into off stump"
"on the pads, in the slot, tonked through midwicket. Easy peasy"
"wider line, no stroke"
"up on the toes, punched to the off side"
"clipped from back of a length, intercepted by a diving mid-on"
left alone as the spin takes it wide of off stump
"over the wicket now, interesting ploy. Blocked into the off side"
"heading wide, going wider."
"down on one knee, and paddle-swept through backward square"
"back round the wicket, and forced to play by a tight combination of line and length"
punch-drive to mid-off
a stride into line and left alone
"sumptuous drive. A swinging half-volley, and pumped through the gap"
drilled into the covers once more
"outside off, through to the keeper"
too short and too wide. Holder's not hit his straps in this over - conceding as many runs in this over as he did in his first spell
"outside off, chopped down into the crease"
"round the wicket, on the money, blocked into the off side"
"wider line, left alone"
just plopped onto a roughly decent line and length. Ignored
"straighter line, tucked to square leg"
"over the wicket to the right hander, flicked with the spin to backward square"
"well bowled, more air on this one, dips late and bites past a loose crease-bound poke"
"wicket to wicket line, poked to the cordon off the back foot"
a swish and a miss. Root thought it was in the slot but it cramped him just a touch
"fuller length, swinging onto the boots and Root clips it with supreme timing through midwicket"
sturdily into line and blocked
through to the keeper
solidly into line on the back foot
fully forward and drilled to cover
"speared into the blockhole from round the wicket, and duly blocked"
"sharp turn, as Dowrich gathers way outside off"
"on the pads, free runs this time, just a single through square leg"
"up on the toes, punched to point"
forward and turned off the pads to backward square
"looped up, on the toes, clipped behind square"
"back onto the stumps, clipped very fine, and Holder continues to leak boundaries. If only he had another specialist bowler to turn to?"
"pinned in front of the stumps and up goes the finger! That came from nowhere, Holder sheds the powderpuff balls of most of this spell, and spears in a faster, straighter one that Root is exceptionally late on... but hold on, it's <strong>missing leg!</strong> Wow. That looked plumb to the naked eye... Root knew better ..."
"wide outside off, and left alone"
"up on the toes, meeting the tighter line with a straight blade"
"outswinger on a good length, driven hard to short cover"
"outside off, left alone"
solidly forward and blocked to the leg side
"hurried through on the back foot, and defended"
clipped into the leg side
"big hang-time outside off stump, and smashed through point. Gabriel gathers at deep cover"
"sharp turn down the leg side, deflects through fine leg"
"round the wicket, another huge shout as Malan is pinned on the crease, and West Indies are <B>reviewing</B>. Probably sliding down, but who knows after that last one ... yep, clipping leg. Unlucky for Holder. If Umpire Ravi had given it it would have stayed out"
"on the back foot, pushed into the off side"
"on the toes, clipped into the leg side"
big jag off the seam from back of a length.
"up on the toes, squeezed out to point"
"big swing, Dowrich fumbles"
"more sharp spin from outside off, left alone"
drawn forward into a punch to short cover
"good leave on a tighter line, just outside off"
straightens on a middle and off line. Malan defends on the back foot
"big stride, hits a crack, nutmegs the keeper!"
through to the keeper again
tightens up on off stump
"back of a length, tucked to square leg"
"short and wide, a bit harsh on the put-upon Dowrich, who is having a tough time at the moment"
forward and drillled past gully
well left outside off stump and through to the keeper
"on the pads, tickled fine, the sweeper does well with his size 12 to cut off the four"
"outside off, fenced through third man. The runs are just beginning to flow with the close approaching"
defended on the front foot to mid-on
"outside off, through to the keeper again"
"full length, attacking the off stump, and guided back down the pitch"
"outside off, through to the keeper"
"width outside off, crunched to deep point"
"good start, full length, threatening to turn, smothered on the front foot"
a wristy drive to deep cover
"short and crushed through midwicket. That was a dirty long-hop. But, a bit like my cat spraying all over my Wisdens after I've failed to feed her for an hour, that may have been a dirty protest from the bowler"
forward and pushed to mid-on
tucked off the hip to square leg
"wide outside off, turns inside the edge of a loose cut"
"bouncer. Well intended, but too short to threaten Root"
"short, wide, leg-sided, eludes Dowrich, and that's six runs from no balls so far ..."
"tighter line, blocked on the back foot, and it's a no-ball! Eight runs from no deliveries..."
"through to the keeper, and an ironic round of applause for the legal delivery!"
"outside off, and left alone once more"
leaning forward and clipped to the leg side. Looking for the single but Root is having none of it with three balls of the day remaining
"short and wide, Malan sets himself for the cut and leaves well alone"
"forward to meet the fuller length, and driven off a slight inside edge to long-off. England lead!"
"watchfully pushed to mid-on, and England close on an effective 2 for 3..."
"full outside off, left alone"
"good length outside off, takes the outside edge but goes to ground and scoots through the gap between second slip and first gully"
across his crease and pushes a length delivery point
"fuller, he gets forward and drives back to the bowler"
"not so much in control of this one, playing away from his body at a wider delivery, skews into the gap in the cordon against takes <b>him to fifty</b> for the second time in the match"
"back of a length, 80mph, defended on the back foot to cover...positive start for England"
"outside off, left alone"
"in the channel outside off, Malan holds his bat inside the line and the ball doesn't carry on the full"
"outside off, through to the keeper"
"full at off stump, it's a no-ball and nicely driven straight of mid-off. Lovely piece of timing to get Malan going for the day"
"back of a length, gets an inside edge into his pads and it bobbles to the off side. The pair alert for the run"
"good delivery, outside off with a touch of seam movement and Root has a little nibble away from his body"
"on the stumps, defended to mid-on"
"good length outside off, 83mph, defended down into the crease"
"well down the leg side, Malan has a flick and misses"
"and again, shoved down past the pads"
gets across the stumps and works this delivery to square leg
"full, wide outside off, left alone"
"angled across, he doesn't play"
"a short delivery and that's a lovely stroke from Root, rolls his wrists and pulls it behind square"
"full length outside off, plays this late and it runs off the face to gully"
"back of a length outside off, a hint that this didn't quite bounce as much as it might, played towards gully"
"beats him! That's a good spot, full outside off, brings him forward trying to drive"
"and again! Another beauty on a full length, skids past the outside edge as Root presses forward"
"and now a yorker to end the off, shapes in at off stump, dug out towards gully...apart from the boundary, an excellent over"
"round the wicket now, full outside off, skews off an inside edge to the leg side"
"full outside off, left alone"
worked into the leg side from outside off
"wider, left alone, not much bounce from a fullish length"
"gets this a little closer to off stump, offers to come in with the angle, leaves it alone"
"he comes forward and drives this full delivery, shoots towards backward point where there's an good stop"
"full outside off, pushes forward into the covers"
"full outside off from over the wicket, left alone"
"88mph, again it's outside off and isn't played"
"full at leg stump, clipped off the pads to long leg"
"full and straight, lovely piece of timing wide of mid-on as he clips it off the stumps with a turn of the wrists...runs away from the fielder down the hill. <b>That's the hundred stand</b>"
"nice delivery, full outside off and shapes back, good leave"
"short outside off, left alone"
"fuller, he keeps his bat inside the line, close to his pad"
comes across his crease and then leaves a full delivery
"makes him play this time, squirts off a thick outside edge towards backward point"
"shorter, wider and harmless"
"well bowled, this nips off the seam to beat the edge although there is a small appeal...plenty of daylight between bat and ball. That would have been like Flintoff and Auckland in 2002 to give that (of course we have DRS now)"
"speared down the leg side, keeps moving as it reaches Dowrich who can only palm it away to fine leg with an out-stretched glove"
"pushed way outside off, gathered in front of second slip and called wide"
"tight run! Malan had to get the dive out...he pushed a very full delivery almost straight to mid-off. Holder collected and threw, one stump to aim out. But Malan's dive could well have saved him even with a hit"
"full at off stump, 85mph, defended to point"
"short of a length outside off, pushed off the back foot to the covers and a well-judged single. Gabriel not impressed"
"length ball outside off, steered to backward point with an open face"
"just over square leg! The ball angled in at Malan, he flicks it away off his body and just gets the elevation to beat a leaping fielder. Gabriel goes to his knees"
"goes full and straight, aims for the yorker, it's a low full toss which is sweetly timed through square leg"
"wide on the crease again, full outside off, driven to mid-off"
"has a bit of a fiddle outside off and this, beats the edge, and then practises the leave"
"back of a length outside off, punched to cover"
another straight delivery which is beautifully turned around wide of mid-on in familiar style...long chase from Holder and a very forlorn dive
"back of a length outside off, driven to deep point"
"full outside off, considerable movement back as it passes the stumps"
gets a stride forward into a full delivery and blocks to cover
"<b>he's gone, at the second grab!</b> This is a huge moment. A short ball outside off, Root is cramped for room as he tries to play it down through gully. Can't get over the top of the ball, picks out Shai Hope at gully who needs to grabs to hang on"
"pushed across full outside off, left alone"
"good length, through to the keeper"
"full at off stump, defended to mid-on...another no-ball, but he probably won't mind one more delivery at the new batsman"
"full and straight, pushed firmly back to the bowler"
"round the wicket, short of a length, defended to cover on the back foot"
"there's the movement! A full delivery outside off, shapes away late from Malan to defeat the drive"
"<b>dropped!</b> Oh, no, West Indies! Another full delivery, wide outside off, shapes away a touch again. Malan drives, gets the edge, Dowrich dives across in front of first slip who then grasses the chance"
and now he's beaten! Good length outside off
"full at off stump, pushed to the leg side"
"full outside off, defends it late towards gully. Outstanding first over from the captain"
"on the toes, clipped to midwicket. Good length to launch his spell"
"that's the spot! Right up to the left-hander's bat, and tweaking into the pads. Dangerous length"
"flogged across the line to mid on, but no way through"
"appreciable turn, helped round the corner but the man on the 45 is well placed"
flicked to mid-on
"dropped short, and walloped gratefully over the leg side. That's a rank pressure-loosener. And Holder probably has a wry internal smile"
"round the wicket, tight line to the left-hander"
pushed into the covers
"tight line outside off stump, well left once more"
"well bowled again! Just nipping around on a full, tight length. Malan tries to drop his gloves but can't help flinching towards the ball"
"wider line, an easier leave this time"
probing away. Another maiden for the diligent Holder
"turning down the leg side, left alone"
"stands tall on the back foot, punching with the spin"
"solidly onto the front foot, neutering the spin with a dead bat outside off"
"flicked off the toes, right across to off stump for that stroke as backward square gathers"
a compact drive to cover
"looped up, and blocked to midwicket. Tight over"
through to the keeper from round the wicket. Holder keeping it tight again
"back and across, clipping into the leg side"
firmly onto the front foot. Textbook forward defence. Head right over the ball
"short-arm jab through midwicket. Just a fraction back of a length, but Stokes was onto it in a jiffy. Fizzed to the rope"
clipped firmly once again but midwicket intercepts this time
keeping it tight on middle and off. Blocked to mid-on
"swivelled out to deep midwicket, a flurry of bat across the line"
"looped right up, blocked on off stump"
"attacking the toes, dug out on the crease line"
"tidy line, outside off and threatening to go straight on. Stokes goes back to defend"
"outside edge, playing for the turn but it eludes the lurking slip"
"attempted biff off the back foot, can't time it. Bishoo is keeping it pretty tight for now"
"a touch of swing back into the pads, Malan works with the angle and pushes to midwicket"
"up onto the toes, tucked into the leg side"
"through to the keeper on a wider, outswinging line"
pushed back onto the stumps to defend with an upright stance
"punched to cover, Holder giving nothing away"
"very full, very straight. Blocked for another maiden"
"a loud appeal, but a hopeful one, as Bishoo turns one into the pads, but it's outside the line. Would have been clipping, mind you"
tucked to the leg side
"working with the spin, on the back foot"
"spanked. That's lovely, reaching for the ball, head right over it on contact, and crunched through wide long-off"
"worked to the leg-side, using the spin to rotate the strike"
"on the pads, easy pickings as Malan rushes through quickly and makes one into two."
"over the wicket, across the bows, through to the keeper"
"punched firmly to mid-on, right behind the line"
driven with a compact stance to mid-off
"right behind the line once again, punching back to the bowler"
into line to defend once more. Holder giving nothing away
"a fraction wider, but not so wide that Stokes dare free his arms. Poked towards gully to tot up another maiden"
turned into the leg side
"drifting towards the pads again, worked behind square"
punched urgently out to point
nudged off the straight and narrow to midwicket
forward and blocked to mid-off. Good from Bishoo. Tight lines
"ooh... a tip and run to midwicket, might have been close had the pick-up been true, but it was a fumble"
flicked off the pad but only as far as square leg. Holder finding some useful nip from his gangling height
solidly met on the front foot with a diligent block
"outside off, through to the keeper"
"leg-sided, a rare freebie, and tucked comfortably down to backward square"
swinging through to the keeper
tight and straight once more
"stands tall, pushed down the ground"
fizzed through
"over the wicket, targeting the off stump with a touch of tweak. Knocked into the leg side"
clipped back to the bowler from a full length
"nudged off the pads, short leg is lurking"
"more air this time, outside off, and drawing a yawning drive into space at deep cover"
"that's a good line, tight to the off stump and demanding a defensive prod"
"well bowled again, a good two stumps tighter than he was for much of his spell yesterday. Blocked"
"ooh, hello. An ambitious wipe across the line. Misses, but the keeper has an enquiry all the same"
tucked into the leg side
"firmly onto the front foot, punched to cover"
"outside off, crunched into the gap in the covers. Good shot selection to ease some of the pressure in a tight over"
"tight to off stump, turned into the leg side"
"flicked on the up, out to deep midwicket. Stokes slips as he turns so they keep it to one"
"hauled across the line, out to wide long-on"
defended down into the crease
"oops, that's a half-tracker, and short leg wears it. Body on the line for the cause"
blocked to see out the over
"looped up and driven, from round the wicket. Tight line"
"on the back foot, biffed back to the bowler"
"through to the keeper, drawn onto the front foot and beaten"
"loopy line and length, left alone outside off"
big stride forward. Smothered
"tonked. Full length, and clobbered through midwicket with a mowing sweep shot. Nailed it"
"tossed up from over the wicket, flicked to square leg"
"clipped to mid-on, and Stokes drops his bat in his urgency to get through for the single! Never in doubt"
"short, and flogged over midwicket. These are freebie runs now"
solid stride onto the front foot
"good ball, turns back in sharply from outside off, and inside-edged through backward square. A bit lucky"
"better block, presenting the full face of the bat on a middle and off line"
forward and blocked
"big stride, head over the ball"
"tossed up, into the toes, good delivery, demanding a block"
"well bowled again, nipping and climbing as Stokes leaves alone"
"sturdy block, big stride, back leg curled round as an extra line of defence"
"wide line, battered hard over extra cover, and he slips again as he runs. Forgotten to put his spikes on?"
"flicked off the toes, a round of applause for the 250"
forward and blocked to the off side
"turned with the spin, out to square leg"
"sharp turn from outside off, clipped off the pads. An extra catcher comes in at leg gully"
firmly forward to block to cover
"tapped into the off side, and that completes a dogged session from England."
"round the wicket, full at off stump, defended"
pushed way down the leg side and Dowrich does well to gather it
"and this one is dragged way outside off, left alone"
"short on the legs, Malan takes it nicely off the pads with a swivel-pull and beats long leg"
"full outside off, left alone and it wobbles as it reaches the keeper"
"outside off, left alone...not the best first over with a new ball"
"good length angled across, left alone"
"a touch fuller, carries through at ankle height to the keeper"
"full outside leg, takes the pad as Stokes looks to whip through the leg side"
"back of a length at middle, defended"
"that's a good ball, short of a length and hammers into Stokes thigh pad as it turns him around"
"that's a good bit of timing, but not a great piece of fielding, a short-of-a-length ball punched at the top of the bounce just straight of mid-on and Holder went down in installments"
"wide outside off, left alone"
"full and wide, he goes for a booming drive away from his body and gets an inside edge to the leg side"
"good length but too wide, left alone"
"full outside off, pushed back to the bowler off the inside half of the bat"
"fuller, still too wide to bring a stroke"
"wider, still, outside off...in danger of wasting the new cherry"
a short delivery outside off which Malan tries to pull but is through his shot
"short again, outside leg stump this time, pulled quickly to long leg where Roach makes a tumbling save...that's the fifty stand"
"back of a length at off stump, dropped into the covers...good strike rotation"
"full outside off, 88mph, left alone"
"good length at off stump, 90mph, defended to mid-off"
"fuller, he presses forward and it slides off the face to deep point"
"that's a gem! Roach says round the wicket, it's not a full half volley, Stokes makes a huge stride forward and drives it magnificently wide of mid-off"
"full and wide, too wide to tempt Stokes this time"
"closer to off stump, keeps it full, left alone"
"and again, full outside off, he shoulders arms"
walks forward into another crisp cover drive and pings it firmly to the fielder off the front foot
"83mph, full length outside off, left alone"
angled across full outside off
"full at off stump, defended into backward point"
"taps this off the inside edge, trickles through his legs to the on side and that's a very hard-working <b>fifty</b> off 162 balls"
"good length outside off, shoulders arms"
"wider outside off, zings through to the keeper"
leaves alone
"that's one his better-timed shots of the day, comes forward and square drives through the covers"
"closer to off stump, Malan steps forward and leaves alone"
"straighter, shapes in late and deflects off the pad behind square"
"short of a length outside off, defended at the top of the bounce to cover"
"thrashes this through the off side, given some width, straight to deep point"
"that's a loose drive, well away from his body as he went after some width...didn't move his feet much"
"very wide outside off, and this one is called"
"crunched down the ground, a very full delivery, he doesn't bother moving his feet much, swings through the line, strikes the ball into the pitch and it skips straight back past the bowler"
"this is even better! A full delivery at off stump, Stokes unfurls a textbook on drive straight of mid-on"
"loses his shape a little this time, mistimes a club towards mid-on as Gabriel sends down a low full toss"
"well across his crease and pings another sweet on-drive, but straight to mid-on this"
"back over the wicket, and that's a good one! Pitches just outside off, nips back off the seam to beat Stokes' inside edge. Nearly took off stump"
"short of a length, seam movement again to beat the inside edge and take Stokes' back leg"
"good length outside off, gets forward and this comes off the middle to cover"
"round the wicket, a length ball wide outside off, Malan opens the face and steers behind point"
left alone outside off
"a little closer to off stump, to the keeper"
"makes him play, angled in at off stump, Malan is well across his crease"
"fuller, defended on the front foot and it runs into midwicket"
beats him with a very full that pitches in the footmarks and zigs away from Malan's outside edge
"full outside off, 85mph - he's kept his pace up well - left alone"
"length delivery at middle, defended"
"he finds the middle of the new bat straightaway, filthy delivery short and wide outside off, slammed away in front of the point sweeper and that's <b>fifty</b>. A top innings"
full outside leg and it's clipped sweetly through square leg
"short of a length on the pads, pushed with a straight bat to deep midwicket"
"through the off side, a handsome square drive as Gabriel offers width...13 runs off the over, the match is swinging considerably"
"short of a length, pushed to mid-on"
"full and wide, he goes for the drive but the bat face closes at the last moment"
"short of a length, finds mid-on again"
"late movement outside off, Stokes nibbles away from his body and almost nicks to the keeper"
"full outside off, defended"
"shapes in from outside off, onto the front foot and defends to the leg side"
"round the wicket, wide outside off, left alone"
cut to backward point
"full at off stump, defended coming forward"
driven through the off side to the cover sweeper
"left alone, some gentle turn"
on the back foot and pushes down the ground to long-on
drags a length ball to the leg side and finds midwicket
gets forward into a full ball and drives back to the bowler
"late movement into Stokes off a good length, started wide outside off, he got himself well outside the line...taken high above the pads"
"slips down the leg side, started too straight"
pushed a length delivery into the big gap at cover
"full at off stump, defended to mid-on"
"wow! That is a superbly judged catch from Brathwaite on the long-off rope! Stokes gave it some serious welly, but got more height than distance. Even so, it looked as though it was six all the way, but Brathwaite balanced on the edge of the rope, pocketed the chance as it plopped from the heavens, and managed to avoid over-stepping. Top effort!"
"welcome to the crease! A lovely teasing offbreak, climbing past the edge"
clipped calmly into the leg side
"spinning sharply down the leg-side, and Bairstow's nudge off the hip gets him off the mark"
turns and keeps low as Malan shoulders arms
