"that is the ball that got Abhinav in the first innings. Low full toss on middle and leg, but this Abhinav gets bat on it, and takes four past midwicket. <strong>Deficit under 70 now</strong>"
"just short of a good length, around off, nips back in. Defended"
"wide on the crease, on a length, pushes it off the front foot, gets a single in front of point"
"short of a length, outside off, holds its line, left alone. Wade collects it chest high"
"short of a length, this one goes with the angle and stays low. Abhinav does well to keep it out"
"on a length, at the stumps, pushed to mid-on"
"short of a length, angling in, stays low, hits him on the thigh pad. Half a shout but they know it is sailing over even though it has stayed low"
"short of a length, wide outside off, steered past gully for two"
"on a length, angling in, defended off the front foot"
"wide on the crease, angles a length ball in, Rahul defends solidly"
"goes wide on the crease again, angles it too far down the leg, and is tucked away for one past square leg"
"dig in short, Abhinav looks like he wants to duck, but the ball stays low. Goes rib high, but Abhinav recovers well to play it with the bat. Keeps it down"
"goes for that lbw ball again, but bowls too far down leg, and is clipped away for a single"
"on a length, just outside off, defended with an open face"
"slightly short of a length, Abhinav goes back and punches it to short cover"
"drifting in, but still a touch short. Abhinav defends off the back foot"
"short again, punched off the back foot, but Warner at point saves three runs with a full-length dive"
sharp turn from outside off and short of a length. Uppishly flicked to short midwicket
"sharp turn from again, turns past the inside edge and is headed down leg. No shout for lbw"
"short of a length, pushed in front of point. A good call for a single. That is good intent"
"short of a length, outside off, left alone"
low full toss from wide on the crease. Pushed wide of mid-off for a single. Alert running again. India's highest opening partnership this series
"short of a length, down the leg side, Starc lucky to get away with it. Wade dives to right to collect"
"short of a length, into the ribs, no short leg. Mukund keeps it down"
"<strong>top-edged six</strong>. Is this the luck India need? Abhinav has no clue about what has happened. Brutish short ball into the ribs, he just pulls it with hope, and the top edge flies over fine leg"
"slightly short, and Rahul goes back to punch this square on the leg side for one"
"offbreak, just outside off, left alone"
defended off the front foot outside off
sharp turn from just outside off. Left alone
"fuller, flatter, middle and leg, defended back to him"
<strong>how has that missed the off stump?</strong> Abhinav doing his best to replicate Kohli's second-innings effort in Pune. Leaves alone an offbreak just outside off. The ball doesn't turn. It passes the off stump as close as you can without actually giving it a peck
"fired down the leg side, lucky to not concede runs"
"flighted outside off, pushed wide of point for one"
"flighted on middle and leg, flicked to midwicket"
goes back <strong>but this is a shooter</strong>. He does well to keep it out
"flighted outside off, he leans forward to defend"
"<strong>another ball that stays low</strong>. Abhinav goes back because of the length, and he does really well to keep this out"
"turns sharply from outside off, and Warner from leg gully dives to his right to save four byes"
Rahul goes back to work a length ball to leg for one
inside edge onto the pad as Abhinav defends off the front foot
"pushes in front of his body, gets it past short cover for a single"
"full, just outside off, Rahul smothers the turn"
"sharp offbreak that stays low a touch, and Rahul does well to not only keep it out but also get a single to square leg. <b>Deficit under 50 now</b>"
"short of a length, just outside off, defended off the back foot"
"fuller, just outside off, pushed to cover. Wants a quick run, sent back"
steers a length ball to deep point for one
"bowled him. I said Hazlewood on a cracked pitch with uneven bounce is going to be a handful. He shows it here. Just short of a good length, just outside off, gets the seam movement, hits him plumb in front, but the ricochet flattens the off stump too. He was lbw first but these are recorded as 'bowled'"
"positive start from Pujara. Length ball, straight, and he has worked it away past square leg"
"on a length, outside off, pushed with an open face to deep point for a single"
"sharp turn, appeal for lbw as he beats the inside edge but it has hit him outside the line"
"good running from Rahul, he just drops and runs, and there is no man at cover"
"fuller than that rough patch, and Pujara drives it through cover for two"
<strong>natural variation</strong>. An offbreak that doesn't turn enough. Pujara gets <strong>a thick edge</strong>. It hits Wade's outer pad and lobs up safely. Could have gone anywhere
"<b>bat-pad</b> but doesn't carry to forward short leg. After that last ball Pujara stays back, and this one jumps at him, takes the inside edge, but luckily it doesn't carry"
"too full, pushed to the left of Lyon who fields it with his left hand and throws it back to Wade with the left hand. Powerfully too"
"short of a length, straight, Rahul works it to square leg for one"
"nicely played. Gets some width on a shortish ball, and steers it to deep point for one"
"length ball, just outside off, seams back in. Defended off the front foot"
"wide on the crease, angles one in. Rahul defends off the front foot"
"digs one in short, chest high. Rahul fends it uncomfortably. Manages to keep it down"
"fuller, just outside off, pushed to mid-on"
"nicely played. Plays a length-ball offbreak late, works it between the two short legs"
"<strong>dropped by Smith</strong>. Natural variation. Doesn't turn as much as he expects, and goes off the outside edge. Low chance to his left, but Smith can;t hold on. Nearly sticks there. He has got up early, I think"
stays back to work this short ball to leg for one
"down the wicket, takes this on the half-volley, gets a single to long-on"
"<b>nearly gone again</b>. Down the wicket, not to its pitch, plays with hard hands, and it reaches the diving short midwicket on the half-volley"
stays back to defend a quick delivery
"short of a length, at the stumps, defended"
"short of a length, just outside off, defended"
"drives at a wide length ball, it runs off the outside half of the bat for two"
"on a length, straight, defended to mid-on"
"short of a length, just outside off, pushed to deep point"
"kicks at him off a length. Pujara defends off the front foot, and is hit high on the bat"
stays back to defend a length ball
slightly fuller than that rough patch. Defended off the back foot
"tossed up wide, but fuller than that threatening length, and he drives it through point for two"
"stays low. Rahul looks to go back to work, and gets the toe of the bat onto the pad"
stays back to defend a length ball. Lyon yet to hit that spot this over
"full, outside off, pushed to mid-off"
pushes at a wide length ball with hard hands. Wide of gully it goes for four. <strong>Deficit under 30</strong>
slight seam back from a length ball outside off. Pujara defends off the front foot
"on a length, on off, defended back to him"
"Pujara looks to sway out of that short ball, the ball seams back in and hits his glove and bat handle. Lucky it falls safely"
"on a length, just outside off, defended back to him"
"kicks at him a touch. Looks like a cutter. Off a length, it hits the bat high. It stays down, though"
"on a length, Rahul stays back and defends"
"sharp turn and bounce, hits him on the thigh pad, and carries to short leg. Too high for lbw, no edge either"
"<strong>shooter</strong>, Rahul stays back, watches it closely, and keeps it out"
"Rahul attempts the sweep and gets outside the line. Beaten, draws half a shout but he is safe"
"flighted outside off, defended with an open face"
"well played again. Rahul goes back to this sharp offbreak, lets it turn, and plays at the last moment to guide it past short leg"
"<strong>half-volley to gully</strong>. Loose push away from the body, and the outside edge doesn't carry"
"gets the loose ball and cashes in. Too full, too straight, and Rahul loves it. Glances it for four. Perhaps Hazlewood tried too hard for the lbw there"
"on a length, just outside off, solid front-foot defensive"
"looks to ramp this short ball by swaying out of its line. The ball cuts back in, and that means he is in a tangle. Beaten"
"short of a length, just outside off, defended solidly. Rahul playing a beautiful innings here"
"short of a length, straight, and Rahul works it past square leg for one"
"flat length ball, stays back to defend"
"full, flat offbreak. Straight at the stumps, and Rahul defends"
"full and straight again, and Rahul defends again"
solid front-foot defensive as Lyon loops this again
too short from Lyon and Rahul whips it off the pads. Pujara gets only one ball from Lyon this over
"nicely played by Pujara. Actually he doesn't play it. This one turns and bounces from outside off, and he gets his gloves out of the way and lets hit his thigh pad"
"good running. This one is short of a length and kicks at him. Rahul keeps it down, and also steals a run on this tip-and-run"
"short of a length, steered away, but can't beat gully"
"wide on the crease, full, into the pads, and whipped away past midwicket for two"
"short of a length, outside off, steered to gully"
"full, too straight, worked away for a single to deep square leg"
"yorker, middle stump, Rahul's bat face closes, and it rolls off the leading edge to cover"
"slightly short, and Pujara picks the length early to pull it to deep square leg"
"too full, pushed wide of cover for a couple. Good running. Rahul pushes Pujara, and he responds"
"tossed up outside off, Rahul forward and across to smother the turn"
stays back to defend an offbreak that skids through. The bat comes down in time
"closer to the umpire on release, gets some drift. Rahul has to stretch to defend"
"down the wicket, beaten in the flight, flicks it uppishly and wide of short leg"
"on a length, on off, defended to mid-off"
"lovely shot. This is full and wide, and he reaches it on a half-volley with his long reach, and crashes it wide of cover. All along the ground. India feeling it now. Crowd getting into it too"
this one stops at him as he looks to drive. Hits the inner half of the bat
"length ball, too straight, clipped past midwicket, 'push' is the shout, and they take a second too"
"on a length, just outside off, leans into a defensive shot"
"<strong>fifty for Rahul</strong>. What a wonderful innings on a pitch that everybody has struggled to bat freely on. All right-hand batsmen have struggled, and the left-hand ones are not scoring fast. Rahul on another plane. Steers this length ball to cover. The crowd rises. He needs to carry on, though"
"how late is he playing. Stays back, watches a length ball closely, and even if it stays low, he works it past short leg"
"slightly short, Pujara works it off the back foot, but he finds the shin of the short leg"
half a shout for lbw but this is turning too much
"another half shout as Pujara is beaten on the defence, but he has got outside the line"
"picks the length early, stays back, works it past backward short leg for one"
"<strong>gets the inside edge</strong>. Soft hands from Rahul, and it is also wide of Warner at leg slip. He puts in a dive to save runs"
"short of a length, and punched to long-off for one"
"oh what a ripper. Smith dropped one earlier, but this is a stunner. Australia needed something like this to pull themselves back into this contest. Full outside off, Rahul drives, gets a thick edge, this is flying wide of slip, but Smith flies to his right, and takes this behind himself. This is one of the best catches given the situation of the match. The Aussies all gather around their leader. The man. Steven Smith"
"cover drive first up, gets a single to deep cover"
"slightly short, Pujara cuts, in front of point, Lyon puts in a dive, but can't control it completely. They get two. <strong>Scores level</strong>"
"short of a length, off the back foot, into the shin of the short leg"
"fired down the leg side, Wade does well to prevent byes"
"flighted outside off, driven back, and a Lyon misfield allows them a single"
"stays back to steer a length ball, but can't get it past point"
short from Lyon and he has been picked away for one
stays back to defend a length. Not in that rough patch
"bowls the right length now, draws a forward-defensive from Kohli"
turn and bounce from a full length. Kohli does well to not follow it with hard hands. Is hit on the thigh pad
"full, down the leg side, swept away fine"
"nice ball. Some dip, on middle and off, defended back to him"
no turn as he looks to drive a full ball. Hit on the inside half of the bat
"nice dip, middle and off, defended back to him"
"tossed up outside off, and Pujara leaves it alone"
"wide on the crease, Pujara drives at a widish ball, and it goes uppishly through the vacant mid-off region"
defends a length ball from deep inside the crease
"flighted, outside off, defended off the front foot"
good bounce from just outside off. Hits him high on the bat as he defends
"flighted outside off, defended to mid-on"
down the wicket to defend this to short midwicket
"flat and short, and Pujara picks it early to pull it away. There could be two, but they get only one. Kohli talks to Pujara, and the chirp from behind the wicket goes, 'He is getting angry again.'"
"natural variation. Length ball outside off. He defends, and gets an inside edge for a single. No turn there"
"flat, short, goes back to defend"
some turn there but Kohli right behind it as he defends off the back foot
"flighted outside off, and Kohli leaves it alone after getting a stride in"
"<strong>sharp turn</strong>. Wider on the crease, flatter in the air, draws a forward-defensive from Kohli, and then turns sharply past the bat. O'Keefe appeals but not given. Rightly so"
"this one doesn't turn, but unlike Pune, Kohli is right forward to defend"
"too full, defended easily to short midwicket"
"slightly too short, and he goes back to defend"
"too full, and Pujara down the wicket to drive it to long-on for one"
"flat, Kohli goes back, plays this uppishly, just past short leg. An optimistic shout of 'catch it'"
"<b>leading edge</b>. Pujara looks to work this to leg, the ball stops on him, but there is no silly point"
defended easily this time
"flatter, shorter, punched to mid-on"
"goes back to play a length ball, gets a single in front of point"
"full, just outside off, defended back to him"
"too full, Pujara plays it late, dropping it into the leg side for one"
flighted outside off. Teasing him. Kohli doesn't drive
solid front-foot defensive to end the over
right forward to smother the turn. Too full from Lyon
"down the wicket, beaten in the flight, is hit on the pad, but he has got outside the line"
"short again, and punched away off the stumps"
stays back to defend a length ball. Letting it turn and then playing it
"too full, driven to long-on for one"
"flighted around off, defended back to him"
"starts off with a loosener. Half-volley, on off and middle, and Kohli clips it away for four through midwicket"
"short of a length, outside off, pushed past cover for one"
Pujara forward to defend a length ball to mid-off
"wide on the crease, Pujara defends a length ball off the front foot"
"wide length ball, Pujara plays it with an open face for a single to deep point"
Kohli right forward to defend this length ball outside off. Stretching well in front
"flighted outside off, driven to long-off"
"too full, on the pads, clipped to short midwicket"
goes deep into the crease to work a flat ball past square leg. Calls for the second and gets it
"flighted outside off, driven to long-off"
"too full, Pujara defends to midwicket"
"flat, on a length, middle and off, draws a defensive shot from Pujara"
"short of a length, into the ribs, Kohli moves inside the line and glances this fine of fine leg for a couple"
"<strong>shooter</strong>. Given out lbw immediately. And Kohli has reviewed immediately. Must have hit it. replays show it is very close on whether it hit the pad first or bat. Toe of the bat is close to the ball when the ball hits the pad. This is all too close. It is taking a lot of time to ascertain. Remember the on-field decision is out. Look to me it has grazed the pad before hitting the bat. Only just. The Ultra Edge shows an impact at around the same time. Umpire Kettleborough says 'there is no conclusive evidence to confirm it's bat first'. So we are going to Hawk Eye. And it shows 'umpire's call' on impact. Given on the field, and that call stays. 'No conclusive evidence to say he hit it first.' Those are the words that seal this decision"
"on a length, outside off, defended"
"full, angling in, defended to mid-on"
"short of a length, just outside off, left alone"
<strong>another big appeal for lbw</strong> as this one seams back in from around off. Seams to much. Going down here
"short ball again, and even though it stays low Pujara pulls this up and over for a four through midwicket"
"on a length, outside off, defended off the front foot"
down the wicket to defend a length ball
"short again from Lyon, and he has been pulled away"
"offbreak outside off, left alone"
"flat, short, punched away wide of midwicket"
"full, on the pads, clipped away for a single"
"on a length, on off, defended solidly off the front foot"
"offcutter at 139ks. Short of a length, just outside off, left alone"
"on a length, middle and off, seaming to hit the pad but headed down leg"
"on a length, just outside off, defended"
<strong>another big lbw appeal but still going down</strong>. Hazlewood seaming it in from a length just outside off
"shimmies down the wicket to defend. Wade says, 'Got him to do what we want him to do.' Yes the forward defensive is what Australia want"
stuck on the crease to a length ball. This one doesn't kick but this is where Lyon wants him
draws the forward defensive again. Hits him high on the bat
"tossed up outside off, he kicks it away to draw half a shout"
"flatter, shorter, Pujara goes to pull, but it stays low. <strong>Lucky to get an inside edge</strong>"
"this time Lyon gets bounce. His best over in a long time. Pujara goes back, and it kicks at him. Lobs up but doesn't <strong>carry to backward short leg</strong>. First maiden of the innings"
"that seam does it for Hazlewood. Full, draws a drive, the ball seams back in, and hits the middle of middle. Not a pitch to be driving on. Promoting Jadeja was a good move, but he didn't play well. Australia, I think, didn't play a single drive against the quicks"
Hazlewood on target again. Hits him on the glove. Short of a length. Rahane wrings his hand
"length ball, driven on the up, falls short of mid-on, but this is not the shot to be playing here"
"on a length, on off, Rahane defends off the front foot"
"nicely played. Short of a length, outside off, steered past gully. Lyon misfields at the third man fence - his hand doesn't come down - but the foot behind him saves him. Lucky to save two runs there"
"seam back in off a length, and defends"
"byes straight away. Lyon fires one outside off. Pujara looks to pad it away, but the ball scoots through straight. It beats everything"
full toss. Pujara shimmies down to drive it square on the off side. Eight runs for India in two balls after tea. Every run is important here
"down the wicket, to the pitch of the ball, defends it back to Lyon"
defended off the front foot. That's what Lyon wants him to do
"sharp turn from short of a length, tucks it away. The deep fine leg has been brought in to backward square leg. No run"
forward-defensive to end the over
"length ball down the leg side, tucked away for a single to long leg"
"length ball, outside off, defended to short cover"
defends a length ball off the front foot
"short of a length - seems like it might have slipped out of his hand - short-arm jab to leg, and M Marsh makes a diving save at square leg"
"short of a length, middle and leg, worked away to long leg for one"
driven on the up. Not the thing to do on this pitch. Hit straight to mid-off
"on a length, just outside off, defended off the front foot"
"down the wicket, drives it to Lyon's right, who fields it in the follow-through and throws the ball back to make Pujara dive for safety"
"down the wicket, not to its pitch, has to defend"
"slightly short, and he goes back to punch this to deep midwicket for one. Lyon has to keep bringing him forward"
stays back to defend a length-ball offbreak
"stays back to a length ball, the <strong>ball kicks at him</strong>, and goes quickly over backward short leg. Warner gets a hand to it overhead but you can't call this a drop"
<strong>shooter</strong>. Nearly gets him. Dead in front. Rahane's bat just comes down in time. Off the cue it goes for one
"on a length, just outside off, defended off the front foot"
"short of a length, rising towards the chest, Pujara rides the bounce and keeps it down. Wants a run but is sent back"
"length ball, middle and leg, worked between square leg and midwicket for one"
<strong>shooter again</strong> but this time Rahane is lucky it is outside off stump. Beaten on the bottom edge
punched off the back foot gets a single to deep cover
"full. Rahane looking to sweep, sees the length late, and makes the last-second adjustment to keep this out defensively"
forward-defensive outside off. Lyon wants that
"swept off a length this time. To the left of Hazlewood at long leg, but they take only one. <strong>Lead over 50 now</strong>"
nicely pushed off the front foot. Straight of short midwicket. Gets a single
"pushes at a wide length ball defensively. Gets an inside edge onto the pad, and takes a single. Actually it is pad first but called a run"
"stays back for a length but it bounces at him, and he has to take the bottom hand off to keep it down"
"short of a length, stays a touch low. Rahane does well to defend"
"short of a length, gets the width on it, and Rahane cuts down hard on it. In front of deep point for four"
"on a length, pushed straight of mid-on for one"
<strong>shooter again</strong>. Again Pujara is lucky this is outside off and hasn't cut back in
"short of a length, middle and leg, worked to leg"
"on a length, outside off, Pujara defends off the front foot"
"tossed up outside off, defended off the front foot"
"<strong>turning too much</strong>. From a length from wide outside off, it comes in to hit him in front of leg"
"swept away off a length, gets a single to long leg"
"stabs at it in front of his body, and he is lucky this has gone straight of short leg and hasn't carried to short midwicket"
"too full, easy to smother the turn on that"
sharp turn and some dip from outside off. Hits him in the midriff but he has got outside the line
"short of a length, outside off, dabbed to gully on the bounce"
this one stays low but Rahane is equal to it. From short of a length and with the angle
"short of a length, angling in, pretty straight. Rahane gets across the line and works this to fine leg for one"
"goes for the yorker, bowls a half-volley on the pads, but Pujara can't beat short midwicket"
"full and straight, driven back to Starc"
"on a length, outside off, pushed with an open face. Gets a single"
"short of a length, punched to deep cover for one"
"looks to cut, the ball stays low, hits the under half"
"<strong>inside edge saves him</strong>. No turn for O'Keefe, and Rahane defends and just about gets the edge"
stays back to defend
"flighted on off, and he presses forward to smother the turn"
"another forward-defensive, not to its pitch, and is hit high on the bat"
"good length ball, outside off, from around the wicket, Pujara covers his stumps and leaves"
"a little shorter and outside off, he carves it to cover"
"looks for the short ball, targeting the body, but the line slides down leg. Pujara glances it fine"
"goes wide of the crease for a full, straight delivery at 143 kph. Rahane whips it to long leg. Lovely roll of the wrists"
"firm, straight bat meets a 143 kph fuller delivery on middle. Good batting"
"nicely done, and a good call for a single behind point. Rahane presses forward to a good length delivery outside off, but ensures he plays late and allow the ball to come to him. Angles the bat to pick the gap"
"that's tight. The pace is quicker, the length is full, the idea is to get Rahane lbw pad before bat. This time though its bat before pad"
"lunges forward, ever intent to push his pad outside the line of off stump as he defends a full ball on off"
"meets a tossed up delivery on off stump with a gentle, straight-faced bat"
"loops it up, a little wider as well, and Rahane drives a little more forcefully to cover"
"puts bat in front of pad to make sure a full delivery, sliding onto middle and leg is kept out"
"good work at cover, Warner diving to his left. Rahane gets an overpitched delivery outside off but his drive isn't quite strong enough"
"starts with a back of a length delivery on off stump, Pujara gets up on his toes to blunt it"
"that's a bit of legcutter, on middle and off, Pujara defends"
"into the pads, looking for that legcutter again, Pujara clips it to the short midwicket"
"<b>that's too much movement for the lbw shout</b>. It has everything else going for it - sharp cut off the pitch as the good length ball hits the seam. Keeps low as well, having hit a crack. Pujara is no match for it because it changes direction so so late. The bat is on off stump, he is struck on leg, would be going down"
"back of a length and outside off, dabs it into the covers"
"on leg stump again, Pujara's weight his forward, his bat is straight, and at the last second he rolls his wrists for a single in front of square leg"
