"and just like Australia in Pune, India are away with a boundary first ball of the Test. Renshaw edged that one, but here Rahul is more in control, driving a full and wide ball away through point. Slightly risky shot"
pulls the length back from that driving zone. Left alone outside off
"on a length, just outside off, Rahul leaves it alone. Bowled at 144ks"
"Starc goes full again, and Rahul drives again. Through extra cover he sends it for a couple. No swing so far"
digs this one in short. And he hits the top glove. Rahul not wearing an arm guard too. Rahul is a little surprised and fends at it. Lucky it has not popped up
"Starc looks for the one-two with a full sucker ball. Rahul drives with just his hands, gets a thick edge and it flies wide of gully for four more"
"Hazlewood on a length immediately. Around off, slight shape back in. Abhinav defends off the front foot"
perfect ball for a right-hand batsman. Starts outside leg for Abhinav and then swings further away. Wade puts a dive in to prevent byes
solid forward-defensive to a length ball. The ball rolls towards cover
"good leave. Hazlewood has been around off with the first and the third ball. This time he goes slightly wider, Abhinav pushes forward to cover his stumps, and then shoulders arms"
"on a length, starts around off, and then angles away. Left alone"
"this is a touch straight, and hits the pad as Abhinav looks to work it away to leg"
"short of a length, angles away after pitching outside off. Good carry for Starc. bowled at 144ks"
"that is a good ball. On a length, on off, holds its line slightly. Can't drive that, and can't leave that alone. Defended solidly by Rahul"
"short ball, into the hap, Rahul stabs at it with the bottom hand off. Gets a single to fine leg"
goes for the yorker first up. On off stump. Abhinav good enough to keep it out. A much better over from Starc so far
"and Abhinav has played all across a straight full toss. It looks to me like it is misis9ng leg, but the umpire has given him and India have not reviewed it. Back to the ball then: Starc is really good but this is a poor shot from Abhinav. Starc goes for the yorker, but ends up bowling a full toss on the pads. Abhinav doesn't play straight. He goes across it. Misses it. Hit in front of leg. It was more reviewable than anything India reviewed in Pune, and I say that without watching any replays. I stand corrected: the replays show it to be hitting the leg stump. Don't know how the projection made it swing, though. On a third look, the HawkEye is correct. The ball swung before it hit the pad. poor shot, though"
"there is the dummy. Show him the short leg, bowl the yorker. This one is outside off, though, and Pujara keeps it out"
"swing for Hazlewood. On a length, just outside off. Perfect delivery. Rahul defends from the crease"
defends a length ball back
"<strong>no third slip</strong> but wouldn't have carried to him. Lovely bowling. Short of a length, just outside off, then holds its line. Rahul stabs at it again, and the outside edge goes for four"
"full wide ball, Rahul drives away from the body, can't beat the deepish point. Wants a single but Pujara sends him back"
"short ball, outside off, a slightly ungainly leave as Rahul leaves his bat hanging. Decides really late to leave this"
"length ball outside off, left alone"
swing. Swing. This is a good sign for Australia. A length ball swinging back towards the top of off. Defended off the front foot
slightly short of a length. Left alone outside off
sucker ball outside off. Pujara doesn't go after it. Rahul would have
"lovely bowling. A beautiful bounding run, digs it in at 147ks, gets great carry from just short of a length. Just outside off, so Pujara drops his hands under it and watches it sail head high to Wade"
"Pujara is moving forward to the one pitched up. So that is a good sign for India. Not the most authoritative of drives, though. Can't beat mid-off"
<strong>hits the handle of the bat at 142ks</strong>. This is excellent fast bowling on a flat pitch. Pujara fends as Starc bowls this short one at his body. He is lucky it has not lobbed up. How many more overs does Starc have in his first spell?
Hazlewood meanwhile keeps pegging away. A length ball outside off. Slight shape away. Left alone
"lovely bowling. On a length, just outside off, holding its line. You have to defend it, and you have to do so without reaching its pitch. Rahul is squared up a touch"
"Hazlewood is dragging Rahul inch by inch towards off stump and then slips in a straight ball. Rahul defends this length ball, though"
"tries the short one but gets the line wrong. Down the leg side it goes, and Rahul watches it go through under his armpit"
"wide length ball, left alone"
goes fuller. Subtle changes of line and length. Rahul defends off the front foot
"length ball, starts outside off, and angles away through to the keeper"
goes for the lbw ball but slips it down leg. Wade has to dive to his left to prevent byes
another lbw ball goes too straight. Goes for a leg-bye as Pujara falls over on the flick. The ball is swinging
"short of a length, and Rahul stabs at it again. He is just playing the short balls more with hope than conviction. Manages to keep it down, but the ball has hit the shoulder of the bat and you can never be in control if it hits that high"
"<strong>goes for the yorker after the short one</strong>. Bowled at 141ks, hits the inside half of the bat on the full. It just swings late"
bouncer. proper bouncer. Wade collects it overhead after Rahul leaves it alone outside off
"on a length, on off, defends off the front foot. No turn"
Pujara down the wicket immediately. Drives to short cover
"on a length, slight straightening of the line. Defended off the front foot. Not to its pitch"
drives this one on the up. Away from the body. Gets a single to long-off
"down the wicket, not to the pitch of the ball, gets an inside edge on to the pad but the ball rolls back to him"
"full ball, driven right into the shin of silly mid-off. Gets a single off the ricochet"
"high full toss at 147ks, and swinging in late. Hits the inside half of the bat. Rolls to midwicket. A misunderstanding between the wickets, but all is fine"
"short of a length, down the leg side"
"on a length, swinging back in, defended solidly. This is right on the money"
"on a length, no shape back in. Angles away from just outside off. Left alone"
"short of a length, on off, defended to short leg"
yorker from Starc. Just outside off. Dug out by Rahul
"on a length,86ks, outside off. Holds its line. Left alone"
"closer to off, 89ks, defended back to him"
no turn this time. Pujara not to its pitch. Is hit on the inside edge
"flatter, shorter, punched to mid-on"
forward defensive
"flighted outside off, some dip there, and defended back to O'keefe after charging out"
"on a length, straight, worked to wide of square leg for a sharp single"
"on a length, aimed at top of off. Hits the inner half of the bat"
fuller ball. Pujara's feet are stuck and he drives uppishly towards short cover
forward in defence this time as Hazlewood stays on a length outside off
"<strong>edged</strong>. Just the slight holding of its line from a full length. Runs off the outside edge, along the ground, to gully"
"<strong>another edge</strong>. Lovely bowling. Goes wide on the crease, makes him play the angle, straightens the length ball, takes the edge, but it dies and rolls to point"
"<strong>huge lbw shout</strong>. Beaten on the inside edge. That's not good batting. He plays for the turn, and is hit in front of middle and leg. I think it was clipping leg. Not given. Missing, says the replay"
defended off the front foot
flatter skiddy delivery. Stays low. Kept out by Rahul
"flighted outside off, defended off the front foot"
"tosses it up again, and Rahul dances down the wicket to defend"
"nice loop and dip, middle and leg, driven uppishly towards cover. Inside out. That's an ambitious shot"
"short, into the ribs, Pujara not comfortable with it. He is stabbing at it. Hit on the rib for a leg-bye"
"full, outside off, defended from the crease"
"full, straight, going for the lbw ball, and Rahul is equal to it. Clips in front of midwicket"
full and straight. Rahul plays across the line. He is lucky to get a leading edge back to the bowler
"short of a length, seaming back into the ribs. Defended past short leg"
"he had to hit this one to relieve himself. Wide length ball, and Rahul throws his hands at it to drive it in front of point for four runs"
"slightly short of a length. Pujara waits for it, waits for it, and then turns it to leg for one"
"nice drift, middle and off, defended back to him"
"wider on the crease, 87ks, has Rahul jumping out of the wicket, but can only defend"
"full, on off, driven back to O'Keefe"
right forward to defend a flighted delivery
tries to skid one through. Bowled at 81ks. Rahul goes deep into the crease to defend
"full and straight, pushed to the right of O'Keefe at mid-on. Takes a single to the wrong side of the fielder. Good awareness"
"full and straight, Rahul again looks to play across, gets a bit of a leading edge back to Hazlewood"
"wide on the crease, angles a length ball in. Defended to mid-on"
"on a length outside off, defended to gully with an open face"
good full ball to tease him outside off. Slightly short of half-volley. Rahul appreciates that and leaves it alone
"good shot. Hazlewood goes wide on the crease but loses control of his length. Gives him a half-volley, which Rahul drives between the stumps and mid-on. They have earned the odd bad ball"
"slightly short of a length, and Pujara goes back to work it around the corner for one"
not to the pitch of the ball as he defends. Misunderstanding between the batsmen as Warner is chasing it at cover. They eventually get the easy single
down the wicket to drive this confidently to long-off
"<strong>dropped</strong>. They had the fielder there. The plan was there. Short leg for Rahul had been at silly mid-off. Rahul is out of his crease, not to the pitch of the ball, and pushes at it. Goes low to Handscomb's left. Difficult difficult grab. Gets a hand to it, but can't control it. Handscomb took blinders in Pune but this one travels too fast to him"
"oh nearly. Rahul not picking which way the ball is going nor reaching the pitch of it. This one slides in, hits the bottom edge as he goes back but doesn't go on to the stumps"
"plays in front of his body again. Uppish again, but gets a single to point this time"
dug in short. Not as much sting as they had earlier. Rahul works this to leg for one
"short of a length, wide outside off, left alone"
"errors creeping into Hazlewood's game, who is bowling his seventh over now. Tries the yorker but slips it down leg, and Pujara clips it away for four"
length ball but a touch too straight again. Worked past square leg for one
"straight, on a length, Rahul late in defence but the bat does come down just in nick of time"
"Hazlewood tries a full wide teaser with what should be the last ball of his spell, but Rahul steers this beautifully and to the left of deep point for four"
defended off the front foot
"Pujara waits for this length ball to work to leg, but they have plugged that single with a bakcward square leg now"
"down the wicket to take this on the half-volley, but can't beat midwicket"
forward defensive now
another forward defensive without reaching the pitch of the ball. You can trust this pitch and do it
"slightly flatter, punched to point"
"on a length, 126ks, slight extra bounce. Rahul is squared up in defence. Hit on the outer half of the bat"
slight low bounce from a length. Around off. Defended from the crease
"on a length, at the stumps, 124ks. Defended to leg"
"on a length, just outside off, 127ks. Defended off the front foot. Nothing to drive or pull or drive so far"
"misses the line, slides down leg, but they have a short midwicket in place to plug that single"
"slightly short of a length, and Rahul is always looking for runs. He dabs down on it and bounces it over gully for a single. Kohli might have come back for the secone, but you don't want to risk that with Pujara"
"half-volley, driven to sweeper cover for one"
"down the wicket, clips it to midwicket after reaching the pitch of the ball"
"on a length, just outside off, defended off the front foot"
"slight drift in, and he picks it up off the toes for a single to leg"
"round arm, from wide on the crease, on a length, no turn, and defended back to him"
"nice dip. On a length, straightens just outside off. Defended off the front foot"
"length ball outside off, 125ks, left alone"
"on a length, 128ks, Pujara comes forward to defend"
"short of a length, outside off, steered away for a single"
"stays on that length, just outside off, 128ks, defended from the crease"
"fuller, straighter, defended back to Marsh"
"hits the glove. Some extra bounce or just that Rahul has played forward to a ball that he should have stayed back to? He looks for a forward-defensive, and is surprised by the bounce. Takes the bottom hand off, and is hit on the glove"
flat delivery to start off with. Worked past shirt leg for one
extra bounce from a length outside off. Rahul is back as he defends
nice paddle sweep. Uses Lyon's pace to guide this length ball from middle and off. He has edged this but it is quite a safe shot with no leg gully in place
"Rahul not quite in control. Defends an offbreak, is hit high on the bat"
"flighted outside off, Rahul is right forward to smother the turn"
<strong>lbw shout as he plays the conventional sweep</strong> but Rahul has got himself outside the line. Umpire Llong says the same and Rahul gets a leg-bye
"on a length, outside off, easily negotiated"
"on a length, outside off, left alone"
"<strong>nearly gone</strong>. Short of a length, outside leg, looks like easy runs on the leg side but the ball stops on him. He is early into the flick, and lobs it off the glove. Doesn't carry to square leg"
"there is some swing still. From a length, and hits him high on the inside edge and onto the thigh pad"
"<strong>nearly played on</strong>. Sucker ball outside off, Rahul looks to drive, but is uncertain. Just plays it with his hands. No feet. The inside edge hits the pads"
"bouncer, just outside off, he sways out of its line"
"down the wicket, not to its pitch, defends it to short midwicket"
"Pujara leaves the crease again, and Lyon gets some drift this time to beat him in the air. The inside edge rolls along to short midwicket"
stays back to defend a length ball
"<strong>turn and bounce</strong> early in the match. Pujara not in control of it, but gets a single through backward short leg"
"<strong>natural variation this time</strong>. The offbreak that doesn't turn. Rahul is beaten on the outside edge. The ball stays low, and squeezes through Wade's leg"
"<strong>reverse sweep</strong>. Not in control. It flies off the back of the bat, and goes where leg slip would have been for a single. It hits the helmet too"
"on a length, on off, no swing. Defended from the crease"
"full and straight, slight shape back in. Defended back to him"
"short, into the ribs, he fends without control. Hit on the bat handle, and he is lucky this has not popped up. Big 15 minutes for Rahul. He looks really edgy"
"on a length, just outside off, solid in defence this time"
"short, outside off, 141ks, Rahul behind it in defence"
full toss. No swing this time. He drives this beautifully through cover
"Pujara not to the pitch of an offbreak outside off, but keeps it down in defence"
"flat offbreak, defended off the back foot"
punched off the back foot but Marsh's dive at short midwicket denies them the single
good bounce from Lyon as Pujara looks to work this off the back foot. Gets a single around the corner
"looks for the paddle sweep, the ball lobs up towards the vacant leg slip. No short fine either. So in that regard this top edge is a slightly safe shot"
"down the wicket, takes this on the half-volley, gets a single to long-on"
"ordinary shot from Pujara. Wide length ball, and Pujara just drives at it without feet. Lucky not to edge it"
"on a length, middle and off, hits the high part of the bat as Pujara defends"
"full, on off, Pujara defends from the crease"
"bouncer, at his body, at 140ks, Pujara ducks under it"
"good bouncer and good leave. The last one was pitched just outside leg, this one is on middle. Gets it higher too. Pujara gets low and sways away from its line. Drops the wrists too"
"short of a length, doesn't get too high, worked to long leg for one. That's Starc done for this session"
stays back to defend a length-ball offbreak. Plays it late
"down the wicket, beaten in the air, thrusts his pad forward, and the ball ricochets into his armpit off the top of the pad"
"flights this outside off, defended off the front foot"
"tossed up outside off again, Pujara right forward in defence. Hit on the inside half of the bat"
"Lyon has got Pujara just before lunch. This should be lunch. Pujara has not been very certain in picking the length today. He makes a forward press, and then sees the flat trajectory  and goes back. There is enough turn and bounce on this pitch for the ball to break back and take the inside edge onto the pad. Lobs up for an easy catch"
"stays back to an offbreak that doesn't turn. He adjusts late, gets an inside edge onto the pad. All happening"
yorker to begin with. Dug out to gully
"on a length, on off, defended with an open face to short cover"
"on a length, on off, defended with a slightly open face"
"<strong>stayed low</strong>. Short of a length, within the stumps, and almost shoots through. Rahul keeps it out. Does well"
"on a length, middle and off, hits the inside half of the bat"
"<b>stays low again</b>. Short of a length, outside leg, defended in front of the stumps"
too full from Lyon and Kohli drives him to long-on for one
down the wicket to reach the pitch of the ball and pushes it down to long-on for another single
"not driving length, and Kohli shuffles across to defend this to leg"
stays back to work an offbreak past the backward short leg. Not the safest of shots considering the leg slip is there
"nice flight and dip outside off, defended back to him"
nice dip again. Rahul defends watchfully outside off
this is the contest. Sarc bowls a yorker at 143ks. Just outside off. Kohli watchful in defence
full and outside off. Kohli drove at a similar ball and edged it in Pune. He drives again. This time he is hit on the inside half of the bat
"good leave. On a length, on off, and allowed to angle away. He covers the stumps when he does so"
"on a length, middle and off, defended off the back foot"
"poor shot. Extra shot and bounce does that to you. You are out of your comfort zone. This ball at 10ks slower, Kohli is never going to chase. This one he does. It is short, outside off, and rises higher than the chest. He looks to guide it. Almost as if giving slip practice. Misses"
what a reply from Kohli. Starc follows the short ball with a full one. Kohli is moving forward and meets it with a full face. Places it between cover and mid-off. It rattles along for four
"on a length, outside off, defended from the crease. Looking unsure in his footwork"
"<strong>glove</strong>. Again Rahul unsure with his feet. He is looking to always go forward but Lyon bowls a length that he knows he can't reach. Ends up pushing at it. The ball bounces and hits the glove, but it doesn't lob up"
"this time he goes back to a length ball, bounces in front of short leg, and takes the single as it goes over that man. That brings up a fifty. Not the prettiest but it can be a huge innings if he can double the score"
"nicely played. Kohli picks the length early, goes back and works this between forward short leg and backward short leg for one"
defended outside off
pushed wide of cover for a single. With Pujara this single wouldn't have been possible
"on a length, just outside off, hits the high part of his bat as he defends"
"full, outside off, driven to mid-off"
"length ball, outside off, he gets a stride in and shoulders arms"
"short of a length, no room, defended from the crease"
he has not looked comfortable against the short ball today. He stabs at this one. This is only hip high so he is able to tuck it away for one to long leg
"Starc tries to go behind Kohli's pad after having bowled outside off to him, but Kohli is equal to it and clips this straight ball away for a single"
"turn and bounce for Lyon. Kohli stays back, is beaten and is hit straight on the thigh pad. <strong>Just half a shout for a catch</strong>"
"lovely shot. Lyon asks Kohli is he wants to drive against the turn through the vacant cover region. Kohli says hell yeah. He stretches forward, and uses his wrists to keep this cover drive down"
"the line gets straighter, and Kohli defends to leg"
another defensive shot to leg
"what has Kohli done here? Out twice in a row when padding up. And this is a really really 'big batsman' review from Kohli. Kohli has just left alone an offbreak headed straight for the stumps. This is plumb as. Kohli has a chat with Rahul, and for some weird bizarre reason, 'the best batsman' in the team eats up a review. And he sees the replay on the big screen and walks off even without any confirmation. The crowd is hushed. You can hear a pin drop. Anyway here is what happened? Kohli went back to look to work this to leg, but then for some reason shouldered arms to one pitched just outside off and on a length. It was hitting middle and leg. He expected it to turn more than it did"
"tossed up outside off, pushed wide of point for a single"
"full, outside off, driven back to him"
left alone outside off
"length ball, into the pads, worked away to long leg"
"on a length, outside off, defended back to him"
"on a length, angling in, defended from the crease"
"on a length, outside off, defended off the front foot"
stays back to defend a length ball
"flighted outside off, pushed wide of mid-off for one"
stays back to defend a length ball. Lyon in amazing rhythm. Good overspin
"tossed up outside off, defended off the front foot"
"Rahane leaves the crease, is beaten in the flight, and defends well in front of his body"
"flatter, quicker, Rahane goes back to defend this to short leg"
"on a length, slight nibble back in, defended towards mid-on. Hits the toe end too"
<strong>height saves Rahul</strong>. Again that nibble back in from just short of a length. Hits the thigh pad after beating the inside edge
"slight swing back in, defended to short midwicket"
"full, outside off, pushed wide of mid-off for one"
"short of a length, outside off, left alone"
front-foot defensive to end the over
forward-defensive
stays back to defend a length ball
"again stays back, and is hit low on the bat as he defends"
extra bounce as he stays back to defend. He manages to keep it down
"<strong>big shout for lbw</strong> but big turn too. Rahane stretches forward, is beaten on the inside edge, but this one is turning too much. It has either hit him outside the line or is sliding down. Lyon tells Smith as much, and they don't review"
"sharp turn and bounce. Beats the inside edge, and lobs off the thigh pad. <strong>Half a shout</strong>"
"short of a length, on off, defended from the crease"
"on a length, stays a touch low, in front of off, and hits the bottom of the bat"
"full and straight, and they have a strong leg-side field to deny them the singles"
"short of a length, rising towards his chest. Rahul fends this down"
"<strong>no slips in place</strong>. Half intentional. Short of a length, nibbling back in, he opens the face but it also runs off the edge. Fine of gully it goes"
"short of a length, straight, stays a touch low, and is worked away past square leg for one"
<strong>no turn</strong>. Natural variation on that offbreak. Rahul does well to keep it down as it hits the outside half of the bat
"turning into middle and leg, worked past short leg, although uppishly"
"stays back to a length ball, <strong>which nearly shoots through</strong>. Hits the toe end of the bat"
"Rahane takes the calculated risk. He says he doesn't want Lyon to keep bowling in that zone. Jumps out of the crease, and lofts an offbreak towards deep midwicket"
"no turn on  this offbreak, and it runs off the outside edge as Rahane defends"
"short of a length, he goes back to punch this to deep midwicket for one"
"flat, on the pads, worked away for one"
"flat, middle and off, 86ks, turns away a touch. Defended from the crease"
"slows it down now, more importantly tosses it up. Defended away from the body, outside off"
"tossed up again, driven square without reaching the ball, keeps it down with the wrists"
moves across to defend this to that short mid-off
"flatter delivery, Rahul picks it and goes back in defence"
presses forward but then is stuck on the crease as Lyon keeps this flat. Manages to keep this down
"overpitched, driven against turn, but can't beat mid-off"
"shimmies down the wicket without reaching the pitch of the ball. He is getting beaten in the air, and that shot over midwicket has been blocked. Defended uncertainly"
"flatter, quicker, straighter, turns from off and middle and past the leg stump"
stays back to open the face on a quick delivery. Can't beat point
"on a length, on off, a lot of overpsin on it. Rahane defends from the crease"
"full, on off, defended back to O'Keefe"
stays back to defend a length ball
nicely tossed. Rahul defends off the front foot
"full again, pushed to the left of Warner at cover but they dare not risk a single there"
slight turn from just outside off. Stays back to defend
"slightly quicker, 87ks, just outside off, defended in front of the body"
"stays back to play a length ball. The ball gets big on him, but he rides the bounce well and places it well between the two short legs. Keeps it down, more importantly"
stays back to a fullish offbreak. Defends it but is hit on the inside half of the bat
