"Ashwin nearly drops it, but he is claiming this catch on the third attempt. A very lucky catch. Handscomb looks to clear midwicket against the turn again, but doesn't make a clean connection. Ashwin dives to his right, gets it in one hand, but the ball pops out as his elbow hits the ground. However, the ball lands one on his arm and not on the ground. Ashwin shows quickness then to quick retrieve it off his arm. Slight luck involved there but a good effort from Ashwin"
quick and flat. M Marsh defends it back
"flat length ball, on off, defended off the front foot"
"offbreak that doesn't turn, S Marsh closes the bat face at the last moment to take a single to leg"
"flat length ball offbreak, defends off the back foot"
"slightly fuller, and defended off the front foot"
"full, outside off, smothers the turn"
"slows this one, tosses this up, defended off the front foot"
"stays back as he sees a flatter delivery, and punches it back to Ashwin"
"full, outside off, defended back to Jadeja"
defends another length ball outside off
"flatter, angling in, punched to midwicket"
"a touch straight, and worked away off the pads for a single"
"flat, on a length, middle and off, holds its line, defended right back"
forward defensive to end the over
"wide length ball, left alone"
"offcutter at 142ks. That pitch has a lot of mischief in it. Length ball, outside off, jags away and beats the edge"
"short of a length, seams back in this team. Half an appeal for an lbw. Not given because it is high. Strange that India don't review. This is the 80th over"
"on a length, straight. Shaun plays it late, closing the face at the last moment for a single past midwicket"
Ishant is lucky here. This is a plum half-volley on the pads. He flicks it but can't beat short midwicket
"and the shooter finally gets a wicket. What drama this last over has been. This is just dead. Ishant bowls a full ball at the stumps, Mitch Marsh plays with a vertical bat, but the ball still scoots under the toe of his bat. This is dead plumn"
"full, on off, defended to short leg"
"full, middle and leg, driven to mid-on"
slight shimmy and he works this wide of mid-on for one
"shapes up for the sweep, sees the ball is not full enough and defends with an open face"
"turning into the pads, defended to leg"
and there is the sweep. Gets the length to sweep and takes a single to deep square leg
"short of a length, just outside off, defended"
wide length ball. Good carry. Left alone
"fuller, closer to off, testing Wade's judgement. Wade leaves it alone but this is a tight leave"
"makes him play this. On a length, 145ks, in his 18th over of the day, headed for off stump. Defended back to him"
"wider, fuller, teasing him. Wade doesn't play at it"
"short of a length, wide, 138ks, left alone. Bounces well in front of Saha"
"down the track, not to the pitch of the ball, but goes ahead with the chip shot. All he needs to do is clear mid-on, and he does that"
"again beaten in the flight, and this time he plays uppishly to short midwicket"
"full, outside off, defended"
"stays full, and Marsh defends back to Jadeja"
wider on the crease. Defended outside off again
"straighter, and this time he defends to short midwicket"
"<strong>edged away</strong>. Short of a length, outside off, cuts away after hitting the barren patch of the pitch. Bounces short of Saha, who dives to his left and gets a hand to it, but can't prevent four runs"
another quick offcutter but this time Wade doesn't play at it
"wide length ball, and another leave"
"<strong>inside edge</strong>. This one legcuts after hitting the pitch even though he is bowling seam-up. Wade pushes at it, and edges it onto his pad"
"nicely controlled by Wade and a good effort at slip. This one kicks at him and leaves him too. Wade gets his bottom hand off, and keeps it down with soft hands. It is travelling wide of slip but Kohli's dive there saves three runs"
"on a length, just outside off, defended with an open face, wide of cover, gets a single"
"length ball, angling in, defended solidly"
"short of a length, around off, holds its line against the angle, and he defends it"
"short of a length, outside off, he steers it, but can't beat the man at gully"
"fuller, wider, and Marsh doesn't go after it"
"<b>that's plumb, or is it?</b> Umesh Yadav finally gets one on target, and he has been given out. Marsh reviews it. Yadav bowls on a length, wide outside off, cuts back in a long way, and has to either impact outside off or miss leg because it has come back a long way. Replays show he has been struck outside the line of off. Great review by Marsh"
"on a length, angling in, clipped to leg but can't beat the diving short midwicket"
"short of a length, straight, worked away for an easy single"
"<strong>lbw appeal thwarted by the signal of no-ball</strong>. Short of a length, cuts off the pitch, beats his inside edge, and this would have been plumb because this has started from closer to off than the last one. Instead they get two runs in their ledger"
"walks down at him, and then leaves a length ball wide outside off"
"nicely played. Walks at him, moves towards the wide short ball, and steers it wide of gully for one"
"full, just outside off, defended from the crease"
"short of a length, outside off, Marsh opens the face a little and edges it too. Soft hands mean it doesn't carry. And also goes wide of first slip. Gets a single. <strong>Deficit under 10 now</strong>"
keeps moving forward and defends a length ball outside off
"full ball outside off, driven to mid-off"
<strong>shooter. Cuts back in too</strong>. Cuts him in halves. Lucky this is not straight
"short of a length, wide, left alone even as it cuts back in"
"on a length, angling in, defended off the back foot"
wide length ball. Left alone. Bounces well short of Saha
"short of a length, dabbed away to deep backward point for a single"
"<strong>big appeal for lbw</strong> but I think he has got an inside edge. It might also be hitting him outside off. India review it, and you can add one more to desperate reviews. Marsh pushes forward to a length ball. It doesn't turn and hits the inside edge. They don't even need Ultra Edge for this edge"
"middle and leg, no turn. Defended to leg"
"lovely shot. Down the wicket, push-drives this towards long-on, and Ishant does well to come around from long-off to keep them down to one"
as expected Wade gets sweeping. Paddles this from outside off for a single around the corner
"flighted outside off, driven with an open face for a single to deep cover"
"tossed up outside off, stretches forward to defend"
"<strong>soft hands</strong>. Short of a length, outside off, opens the face, has it bouncing well in front of slip"
"length ball, angling in, worked off the pads for a single"
"full, outside off, defended off the front foot"
"short of a length, cuts back in, takes the inside edge onto the thigh pad"
"full, just outside off, watchfully defended with an open face"
"wide on the crease, short of a length, angling it in, defended by Wade"
"slow, really slow, outside off, and left alone"
"at the stumps this time, defended solidly back to him"
"length ball, outside off, punched to point"
"flighted outside off, pushed to the left of silly point for a single. <strong>This is an exceptional fifty</strong>. Great concentration and application, and also intent. Gets a standing ovation from his balcony"
stays back to defend a flat ball
paddles one away for a single. Marsh wants the second but is rightly sent back. He puts in a dive. That dirt looks good on a shirt when you play such a gritty innings. Battle scars on the shirt
"length ball, seams in, defended back to him"
"on a length, outside off, he presses forward in defence"
"<strong>another offcutter at 137ks</strong>. Short of a length, outside off, jags away. Beats the edge"
"short of a length, into the pads, tucked away off the hip"
"full, holds its line against the angle. They get a single wide of cover. <strong>Scores are level</strong>"
"on a length, outside off, defended solidly"
"full, middle and leg, pushed to mid-on"
down the wicket to clip one off the toes for a single that <strong>puts Australia in lead</strong>
tucked away off the hip for a single
tired shortish delivery from Ashwin. Punched to deep midwicket for one
"tossed up outside leg, padded away"
kicks away another leg-side delivery
"short of a length, angling in, defended"
"wide length ball, left alone, and it flies head high to Saha"
"wide length ball, he goes for the drive, and has been hit on the inside half of the bat"
back to leaving alone length ball outside off
"lovely shot by Marsh. Short of a length, wide, and he steers it wide of gully. Jadeja moves to his right from deep point, and puts in a dive to save two runs"
"wide length ball, and left alone"
"flighted outside off, defended back to him"
"leaves the crease, plays this on half-volley and drives to cover"
"pushed through flatter, and Wade works it off the pads for a single"
four byes. This is not great bowling. Fired into the pads. The ball doesn't turn and stays low to beat Saha down the leg side. Arm ball gone wrong. Not an offbreak
"down the wicket, meets this on the half-volley, drives down the ground for a single to long-on. <strong>Lead over 10</strong>"
"<strong>India are reviewing for pad-glove</strong>. Ashwin has moved over the wicket. Wade pads one away into the rough. The ball hits the flap of the pad and then the chest and lobs up for a catch. Once again, embarrassingly for India, we don't even need the Ultra Edge to send the review back. So India out of challenges. India need a DRS coach"
"short of a length, outside leg, extra bounce, hits him on the thigh pad"
"length ball, outside off, angling away. Left alone"
"this one seams back in from outside off, but still not close enough to make him play"
"<strong>kicks off a length</strong>. Pitched outside leg, and hits him on the glove. He manages to keep it down for a single into the leg side"
"slightly fuller than good length, driven to mid-off"
"on a length, middle and off, angles away. Left alone"
Marsh looks to play this but is beaten. Doesn't matter because it is pitched outside leg
"looks to sweep, is beaten, but it is pitched outside leg"
defended to leg
"sharp turn from outside leg, squares him up, takes the edge and flies wide of slip. Marsh runs aggressively and puts in a swimming pool dive to complete the second"
"arm ball, outside leg, worked away for a single around the corner"
solid front-foot defensive to end the over
"short of a length, middle and off, left alone as it angles away"
"on a length, outside off, left alone"
"short, outside leg, looks to pull, early into the shot, and is hit in the rib cage. It stays low too"
"short of a length, straight, defended from the crease"
<strong>pitched outside leg</strong>. Big big lbw shout. No swing on it so this length ball had to pitch outside leg for it to be hitting the stumps. Given not out. India have no reviews left. Okay so replay shows it pitched in line but was missing off
"short of a length, outside off, gets a leg-bye. Interesting call from one of the two batsmen to turn down the second: 'Not now.'"
"full, turning into the pads, clipped away for a single"
defended from the crease
top-edges a paddle sweep. With no short fine leg in place this is a safe shot. <strong>Lead over 20 now</strong>
"on a length, on off, defended back to him"
"down the wicket, gets into a tangle as he clips this to midwicket. Wade is on the ground but makes it back by the time Kohli fields and thinks of throwing"
"too full, pushed down to long-on for one"
"full, straight, pushed towards mid-off"
"short of a length, on the pads, tucked away off the hip for one"
"short of a length, on off, steered away with the angle. <strong>That is fifty for the stand</strong>. What a timely intervention"
"full and straight, defended from the crease"
"on a length, angling away, opens the face, and takes a single off a Rahane misfield at gully"
"short of a length, wide, punched to deep point for one"
"overpitched, clips this half-volley to deep midwicket for one"
stays back to defend a length ball
"angling into the pads, worked with the turn to take a single"
"tossed up outside off, pushed towards cover for one"
"flat, straight, worked with the turn, around the corner"
down the wicket to chip one half-volley down to long-on
"full and straight, 139ks, defended back to him"
"soft dismissal. Shaun Marsh has done all the hard work, and has now just clipped a length ball straight to short midwicket. Slightly tired shot. He has been so careful with front foot shots today. This one just stops on him a touch and he fails to keep it down. Otherwise this has been a super innings. Great discipline and application"
"straight length ball, defended back to him"
"full, middle and off, defended to mid-off"
"<strong>dropped by Saha</strong>. Having said that, this is a catch the last India wicketkeeper wouldn't have gone for. Short of a length, middle and off, nips away, squares him away, takes the outside edge. Saha puts a dive in, gets his left hand to it, but it doesn't stick"
defends one off the back foot
"short and wide, cut away for one"
"short and wide again, punched to deep cover"
"short and wide again, this time he gets a bottom edge that goes for four between the legs for Saha"
"finally he pitches it up, driven to deep cover for one"
"Wade shapes up for a paddle sweep, he tosses it wide, and Wade has to pull out"
having said all that Nair beats him with a flat quick offbreak that doesn't turn
"on a length, middle and leg, pushed to mid-on"
"<strong>shooter</strong>. Length ball, middle and off, stays low, jags away, takes the toe end"
"driven on the up, but straight to mid-off"
"pulled away. Into the ribs, and Starc swivels with the pull. There is a man there at long leg. Had only about 10 feet to cover, but this was hit so hard it beat him"
"short of a length, straight, defended from the crease"
"<strong>Starc is lucky with this one</strong>. He looks to drive a length ball, which stops on him, and the hard hands mean it lobs towards extra cover. Jadeja picks it a little late, and it clears him. I have never seen Jadeja react so late to a catch"
defends one off the front foot
pads one away outside leg
stays back to defend a flat delivery
"slows it up, Wade defends outside leg"
"slightly quicker, Wade defends off the front foot. Not padding up even though it is pitched outside leg"
"<strong>wade plays at one again</strong>. Pitched outside leg, turns and kicks away, and goes off the glove for a single wide of slip"
"on a length, middle and off, he runs it towards point with a single"
"full, outside off, runs off the outside edge through the vacant point region"
"on a length, angling in, defended from the crease"
"short of a length, angling in, Wade defends from the crease"
"on a length, pretty straight, watchfully defended. He is playing like a man who wants to come back and bat tomorrow"
and solid in defence again
padded away to short leg as Ashwin bowls into the rough outside leg
"straighter now, makes him play. Starc defends towards mid-off"
and he is back to kicking it away outside leg
"arm ball, pushed through outside off. Another leave. Quite an ordinary last over. Starc will love it if he doesn't have to play at these balls"
"full, just outside leg, defended"
a solid forward-defensive to end a solid day for Australia
"and kicks off a length immediately. Wade has to take the glove off, and is hit high on the bat"
"wide length ball, left alone"
"length ball, a set of stumps wide outside off, left alone"
"wide length ball, another leave"
"well bowled. Gets closer to off, makes him play, and the ball then seams away against the angle. Beaten"
"on a length, closer to off, Wade shimmies down to defend it to point"
"tossed up outside leg, defended off the front foot"
pads this one away
"full, really full, makes him play. Starc misses it, and it goes between his pads"
"byes. Too far outside leg, Starc looks to kick it away, and it goes between his legs and past Saha. Actually not past Saha, through his legs too"
"outside leg again, sweeps this away for a single to deep backwards square"
"full, outside leg, but not too wide. Wade defends it back"
"length ball, into the pads, clipped away to deep midwicket for three runs. Off line here"
"gets his line back to outside off, and Wade defends"
"beaten again. You have to play at the angle once the length ball is close to off. Then it leaves him, and misses the edge"
"wider this time, and Wade shoulders arms"
"moves to off, knows his stumps are covered, and shoulders arms as soon as he sees the line is outside his eye line"
"closer to off, making him play. Wade does so and drives it back to Ishant"
"full, just outside leg, makes him play. Starc defends"
"tries the slog sweep this time, and is beaten. Hit on the thigh pad"
"shorter in length, and defended off the back foot"
"shapes up for the sweep, and the shot is beaten by excessive bounce. He is hit on his shoulder. And he is a tall man"
"full, outside leg, defended to square leg"
"half-volley, just outside leg, pushed to the right of mid-on for one"
Starc plays indecisively at a length ball just outside off. It hits the bottom half of the bat and bounces over the stumps
"down the leg side, and they get a leg-bye"
"length ball, straight, defended to leg"
"on a length, just outside off, makes him play. Defended to mid-on"
"bouncer, down the leg side. Left alone"
"short of a length, just outside off, defended watchfully"
pads one away outside leg
"short of a length, big turn. Starc gets behind it, and aborts any attacking throughts"
"arm ball outside off. Flat, so he goes back, and steers it between slip and gully for a couple"
"looks for the sweep this time, but is beaten and hit on the thigh pad"
"tries another sweep, misses again, and is hit on the pad. If he keeps missing, he is getting hit on the pad so this is not a high-risk shot. India need a short leg to prevent him from doing this. Because then he will be worried about bat-pad"
"<strong>gloved but no silly point in place</strong>. Starc looks to defend a length-ball offbreak that is pitched outside leg. It hits his glove, but falls safely"
"fullish this time, on off, and Wade defends off the front foot"
"that is lucky for Wade. He throws his arms at a length ball outside off, and the edge goes wide of the two slips. <strong>Lead over 60 now</strong>"
"length ball, outside off, allowed to angle through to Saha"
another leave outside off
"short of a length, pitched outside leg, easy runs, two of them past midwicket"
"wide full ball, and Saha does the rest"
"full, outside the leg, defended"
"more sharp turn from outside leg, and it goes for two byes. This one beats Saha to his left"
kicks one away outside leg
"<strong>desperate lbw appeal</strong>. Pitches outside leg, hits a crack, turns the other way, and cannot be given on that"
defends one outside leg
"another offbreak that hits a crack and goes the other way. Pitched outside leg, and Starc lets it hit his pad"
"flat, on a length, defended off the back foot"
"paddle sweep from the stumps, gets a single to fine leg"
"this one is short of a length. The fear of the Starc slog. Starc, meanwhile, punches it into the covers"
"fired in outside off. Wade goes back, and bunts it into the off side for a single. The fielder that would have been there had just moved to plug the paddle sweep"
fired in again. Starc pushes at it outside off. Gets two off a soft but thick outside edge. <strong>Lead over 70 now</strong>
"flat outside off. Starc looks to steer it, and is beaten"
"full, just outside off, and he smothers the turn"
"full and straight, defended back to Ashwin"
"into the pads this time, defended to leg"
down the wicket to look to drive to long-off but can't beat Ashwin
"less turn on this one, and Wade recovers well to defend in front of leg"
no turn. This should excite India but Wade gets his bat down at the last moment
"short of a length, outside off, pushed wide of mid-off for a single"
"<strong>that's a Cowan for Wade</strong>. Sharp turn from off. Hits the pad, and is missing leg"
stays back to defend a length ball
"slower in the air, middle and off, defended to leg"
"tossed up outside off, defended with an open face"
"beautiful shot. Down the wicket, reaches it on a half-volley, and push-drives it between Jadeja and mid-off. All along the ground"
<strong>Starc has reviewed this call immediately</strong>. Given out caught-behind when trying to steer a flat delivery from Ashwin. Beaten. Completely beaten. Nothing on the Ultra Edge. Ashwin can stop celebrating
"full, middle and leg, driven to long-on for one"
"flat, outside off, left alone"
hits the glove on the forward-defensive. Doesn't lob up
down the wicket to push it to long-off for one
"Jadeja missed one chance yesterday when he didn't pick the ball at extra cover, but he has pulled off  a beauty here. Starc slog-sweeps against the turn, Jadeja is at deep midwicket but not all the way back. So he has to judge it, run back, and take it overhead. They look easy on TV but when you have a 360-degree view for these, the way you judge the catch is key, and this is superbly judged"
hard hands on this forward defensive. Goes uppishly but well in front of short leg
pushed wide of cover for one. They don't take the second on the misfield
"full, just outside off, bunted into the leg side for a single"
"tossed up on, on off, O'Keefe moves forward to smother the turn"
forward to defend another length ball from Jadeja
"flat, short, pushed back"
"full, middle and leg, defended back"
misses out. Flat delivery down the leg side. Fails to get a touch on it
tossed up really high and full. Defended back to Ashwin
"short again, and Wade goes back to tuck it past midwicket for one. The number of short balls from Ashwin increasing. Happens with the number of overs he has been made to bow"
"<strong>offbreak that goes the other way</strong>. All down to the rough. This pitch is not getting any easier. Lands in the rough, goes against the desired spin, and beats the outside edge"
"half-volley this time, and push-driven past cover for two"
"<strong>that is close</strong>, given out lbw and Wade has reviewed it immediately. This has turned back sharply against his round-the-wicket angle, from a length and from outside off. Beats the inside edge, hits him in front of off, and would have gone on to hit leg. The decision stays, and Jadeja has his fourth"
"Jadeja is on a hat-trick. Well hang on, Lyon has reviewed it. This looks plumb to naked eye, but I think Lyon thinks he has hit it. Lyon goes for a sweep to a really full and straight ball. He is hit bang in front of middle, but he reckons he has hit the ball. Replays show, though, Lyon hits the pitch with his bat and not the ball. So the on-field call stays. That completes a five-for for the bowler who has bowled the least overs among the specialists"
"on a length, outside off, Hazlewood pushes it defensively for a single to cover"
"flat, quick, punched back to Jadeja"
"<strong>sharp turn</strong>. That's brutish. Length ball, beats the O'Keefe defence, and hits him on the shoulder. That 85 looks like a big lead when you see balls like these"
"flat, outside off, defended"
"full, middle and leg, defended back to him"
solid front-foot defensive from Hazlewood
"full, really full, Hazlewood has a go, and inside-edges it into his pad"
"on a length, outside leg, really slow, and defended back to him"
another forward-defensive from Hazlewood. Deciding against padding these away
defends off the front foot to end the over
"no turn. O'Keefe reacts off the pitch, and manages to keep it out"
too short as he looks for sharp pace. Punched to long-off for one
"on a length, middle and off, defended back to Jadeja"
"Jadeja gets a six-for. Hazlewood looks for the big swipe, and ends up skying it to long-on. Jadeja 6 for 63 in 21.4 overs. Every specialist bowler bowled more than him"
"Starc starts short of a length, and Rahul takes a single to long leg"
"short of a length, swings away, and a nervous poke from Abhinav. <strong>No edge</strong>"
that one goes away like a legcutter. This pitch is crooked. Just that it starts outside off and goes further away. They get a bye
"<strong>has an inside edge saved him</strong>? Yes it has. This is the perfect inswinger, headed for the lower half of the middle stump. Rahul plays straight and that is why he gets an inside edge. Oh there is swing too"
"Starc starts too straight, and this time Rahul glances it away for an easy boundary. How valuable those runs are"
"swing again, hits the inside half of the bat after pitching outside off. Rahul takes a single to wide of mid-on"
starts with a wide outswinger. Wade has to dive to his right to prevent byes
wide outside off again. Left alone. Collected head high by Wade. Takes off a length
"full and straight, and Rahul takes the opportunity to push-drive it between the bowler and mid-on. <strong>Deficit under 80</strong>"
"short of a length, just outside off, opens the face to gully"
"short of a length, straight, and he works it around the corner for one"
Abhinav is off the pair by flicking a straight length ball past midwicket for a couple
"no swing. On a length, outside off, left alone"
"kicks away from short of a length. Rahul does well to leave it alone. This is a quick delivery, and he has to react fast"
"<strong>play and miss</strong>. Loose drive outside off, the ball swings/seams back in to beat the inside edge. Wade is surprised by the bounce, and fumbles to concede a bye"
"yorker, but too wide to make him play. Also it shoots through to Wade, and he does well to get behind it and collect it cleanly"
"<strong>edged</strong>. Abhinav stays back to a length ball that moved away to take a thick edge. Rolls wide of gully, but M Marsh makes a diving save"
