"bouncer, into the ribs, Renshaw ducks and gets inside its line"
stays back to defend a length-ball offbreak
"looks to move forward, a sees a flatter trajectory, and stays back to use Ashwin's pace for a single past point"
"<strong>this is going to cause doubts</strong>. Length ball pitched well outside leg. Renshaw pads up, but the ball turns a mile, misses both his pads, and also misses the off stump"
"flatter, shorter, outside leg, punched away to deep square leg for one"
"too full, and Smith pinches a single to mid-on, where Umesh Yadav is slow to react"
"half-volley on the pads, and he has protection at cow corner to keep them down to one"
"dug in short, chest high, and fended down by Renshaw"
"short of a length, angling in, fended down. Ishant has tumbled over in his follow-through"
"into the ribs, he fends at it, fails to keep it down, but has played it wide of short leg"
<strong>shooter</strong>. Rolls through to Saha. Smith is done in but he is lucky this is outside off
"on a length, on off, Smith exaggerated in saying no and reacting to Ishant. Kohli at slip is in splits looking at the faces Ishant is making"
"stop the press: Ishant doesn't make a face at Smith in his follow-through. Smith defends this one solidly. This might look funny, but this is serious stuff. India are fighting today to keep the Border-Gavaskar Trophy in play"
"full, outside leg, kicked away by Renshaw"
"full, outside leg, defended back to him"
kicked away again
"looks to pad one away, the ball turns past front pad and hits the back pad and lobs to Rahane at slip"
"flat, into the pads, defended to short leg"
"on a length, on off, defends off the front foot"
"short of a length, outside off, punched to cover"
"full, just outside off, defended with soft hands"
"short of a length, and it sits in the surface and kicks at him. Smith has to abort at the last moment the punch he is looking to play. Keeps this down"
<strong>and now a shooter from a similar spot</strong>. Squeezes under his bat but well outside off
"on a length, outside off, defended from the crease"
"short of a length, outside off. Extra bounce and slow off the pitch. Smith manages to keep it down again"
"full, outside leg, within his reach. Driven to deep midwicket for one"
"offbreak, into the pads, lobs off the pad to backward short leg. Smith in two minds here. Perfect length"
"shimmies down, and pushes a flatter delivery back to Ashwin"
"<strong>Smith in two minds again</strong>. Not given out on lbw, but India have reviewed it. And this looks like a good review. Ashwin has bowled a flat topspinner here. The seam is almost upright. Smith has misjudged the length completely and gone to pull a ball that is not short enough. It pitches on off, hits him on middle and leg, and returns an umpire's call on the leg stump. Phew that is close. Smith gets to bat on. All is happening. I forgot to tell you Renshaw nearly ran himself out trying to come back for a second leg-bye"
"full, middle and leg, defended"
strides forward to smother the turn again
"short of a length, outside off, defended off the back foot"
"<strong>oh this is close</strong>. Length ball, hits the pitch, holds its line, stays low. Smith watching it close, and gets the bat down in time"
"stays low again, and Smith does well to get his bat down in time. Oh this pitch is getting more and more difficult every passing ball"
"short of a length, outside off. The bunce is reliable this time. Defends"
leg-cuts from short of a length. Smith squared up in defence
"<strong>how well has Smith played this?</strong>. This is a shooting offcutter. Not that Umesh intends to bowl it this way, but it hits a crack outside off and jags back in. Stays low for good measure. Smith is watching this very closely and plays it late and keeps it out"
"flat, short of a length, no turn, slight low bounce. Renshaw keeps it out"
defended off the front foot as he pitches it up
"flighted outside off, and left alone"
"flatter, but still on a length. Renshaw defends off the back foot"
tossed up outside off. Doesn't play at it
"flatter, short of a length, angling in, and defended to leg"
"on a length, outside off. Smith squared up in defence, but he is watching it very closely"
"full this time. He plays with soft hands, and steals a single to point who is deepish"
"that is an edge but should be some relief for Australia. On a length, middle and off, and he has to play at it. The angle takes the edge, which dies immediately and goes wide of slip for four"
<strong>another edge dies</strong>. Renshaw is squared up as this one cuts away off a length. Soft hands and low bounce mean it doesn't carry to first slip
"<strong>play and a miss</strong>. A length ball on off, and it jags away a touch. Renshaw plays at it, and is beaten"
"<strong>another educated edge</strong>. This is a full ball so Renshaw thinks he can drive down the ground, but the ball still moves away to hit the edge. Flies between the first slip and the wider slip. Wouldn't have carried to second slip anyway"
"half-volley, clipped to the right of Jadeja at mid-on, and takes the single"
"teasing him with a half-volley, asking Renshaw if he fancies a drive. He doesn't"
draws a forward defensive with a flighted offbreak
"gets closer to him, and makes Renshaw defend again"
"flatter, into the pads, defended down in front of short leg"
"full, middle and leg, hit uppishly to mid-on"
"full, on off, stays back to sort of flick it to mid-on"
"short of a length, at off, defended from the crease"
"on a length, outside off, stays a touch low. Smith is right behind it"
wide length ball. Smith plays it really late in defence
"full and straight, he flicks it to mid-on"
"on a length, jagging back in, and Smith is watchful in defence"
kicks one away outside leg but no batsman has been certain against that line today
"too full outside leg, and worked away to deep square leg for one"
"on a length, close to off. Defended back to him"
"down the wicket, beaten in the flight, flicks it uppishly towards short midwicket"
"flatter, fuller. Defended back to him"
"flat again. Stays a touch low, and he defends this to leg"
"full, on off, defended watchfully"
this one jags away from around off and kicks off too. Beats the edge. Renshaw does well to play the line and not follow it
"<strong>another edge goes for four</strong>. Dug in shirt, Renshaw looks to fend, gets an edge, which falls to the left of Kohli. He gets a hand to it, but doesn't dive forward. Was he up too early? Kohli almost upright at the time the ball meets the bat"
"superb delivery. On a length, on off, nips away, and beats him"
"on a length, on off, stays low, and Renshaw does well to keep this out"
Umesh goes for the full and straight lbw ball but Renshaw is equal to it and defends it back
"full, on the pads, worked away for an easy single"
"on a length, outside off, defended from the crease"
"full, outside off, smothers the turn"
"on a length, Renshaw stays back to defend"
"on a length, wide outside off, defended watchfully"
"swept from outside off, gets a single to deep square leg"
wide length ball. Easy leave
"on a length, jags away after pitching on middle and leg. Beats the edge"
"plays inside the line as this one jags away again. Too much movement, and Renshaw smiles back to Umesh"
"<strong>beaten again</strong>. Renshaw has to play the angle, and the ball holds its line outside off"
"full and straight, and because Renshaw is hanging back he is squared up a little. The ball hits the soft outside off, and rolls to the cordon"
"short of a length, angling in, defended from the crease"
"overpitched, but driven straight to short cover"
"down the wicket, and steals a single to Ishant at mid-on"
"looks for the paddle sweep, but is beaten. However, he has got well outside the line"
"commits to sweep early, exposes his stumps, and Jadeja aims at those stumps. Beats him and hits the glove. The lbw shout rightly negated"
defends a length ball
"shapes up for the sweep early, and does so. It is nearly a quick yorker, but he manages to place it past short leg"
"a length ball, angling in, defended"
"on a length, angling in towards off again. Renshaw defends from the crease"
"down the pads, flicked uppishly to deep square leg for one"
"on a length, just outside off, Smith defends with soft hands"
"stays low around that off stump, but Smith is watching them and playing them late"
"short of a length, outside off, punched to short cover"
"this is not good from Ishant. Renshaw hits a ball straight to him at mid-off, and steals a single"
"the natural variation from Jadeja does it. The pressure has worked. India have been at them all morning, and now they have broken through. Length ball, middle and leg, Smith plays a defensive shot, looking for some straightening of the line, but the ball slides on to hit the inside edge and the pad. Saha runs to his left and puts in a dive to catch it"
"full, outside off, defended back to him"
shimmies down to flick one to mid-on
and Marsh picks a single to that man who has just moved back at mid-on
"on a length, middle and leg, defended off the front foot"
"on a length, on off, defended back to him"
"on a length, outside off, 143ks, left alone"
"this one seams away from just outside off. He has to play the angle, and is hit on the outside half of the bat"
"tries the yorker, Marsh digs it out back to Yadav"
"tries the short one, down the leg side, goes under Marsh's armpit"
"full, on off, defended solidly"
"flighted outside off, defended"
"on a length, on off, no turn, hits the inside half of the bat"
"flatter, on off, and he stays back to defend"
"too straight, and clipped to fine leg for one"
"full, middle and leg, turns to take the <strong>outside edge</strong> which goes past gully. All along the ground"
"half-volley, driven to long-off for one"
"on a length, outside off, angles away, and left alone"
"on a length, straight, defended back to him"
"full, on off, hits the outside half of the bat and rolls along to gully"
"what a leave. On a length, middle and off, and goes by the fourth stump. The other three were covered, by the way"
"wide length ball, easy to leave it alone"
"short of a length, kicks at him, he works it fine for a single to end a gripping session"
"pitched up on middle and leg, pushed to mid-off"
"flighted outside leg, Renshaw kicks it away"
"short outside leg, worked past short leg for a single"
"full, outside leg, defended to short leg"
goes back to a length ball pitched outside leg. Worked to short leg
"quicker, outside leg, beats his flick, but they take a leg-bye"
"on a length, on the pads, defended back to him"
"good leave. On a length, on off, and allows it to angle through"
"full, on off, pushed back to him"
"on a length, straight at him, defended towards mid-on"
"<strong>pitched outside</strong>. This is a shooter, it is hitting the stumps, but it has pitched outside leg. That's why Umpire Illingworth says no. Ishant wants to ask the umpire if that is the reason he has not given him, but Illingworth says he is not going to tell them until they have made a call on the review. India decide to not review"
"full and wide, sucker ball, Marsh doesn't get drawn into playing it"
kicked away outside leg
"closer to him, makes him defends, beats him, hits the pad, but it is still pitched outside leg"
"short of a length, outside leg, worked around the corner, but doesn't take a single to short fine leg"
"flighted outside leg, and he pads it away"
"flatter, quicker, straighter, defended from the crease"
"pads away another offbreak pitched outside leg. this one, though, hits the edge of the pad and not flush on the middle. That means it has turned more than Renshaw expected"
"full, outside off, pushed to mid-off"
"bouncer, 139ks, down the leg side. Marsh lets it pass under his armpit"
"length ball, outside off, Marsh gets a stride in, and lets it go"
"short of a length, into the rib, Marsh fends, but manages to keep it down"
"on a length, a set of stumps outside off, and he leaves it alone"
there is the bluff. Pushes in the full and straight ball. Marsh defends on the crease
stays back to defend a straight length ball
full and wide outside leg. Kicked away by Renshaw
"fuller, closer, clipped to midwicket"
"overpitched, just outside leg, and driven to long-on for one. <strong>Australia trail by under 100</strong>"
"<strong>nearly a repeat of the Warner dismissal</strong>. This is shortish and outside leg. Marsh's first instinct is to leave it alone, but the ball turns alarmingly and bounces too. He has to defend, and then also kick the ball away because it is rolling back towards the stumps"
"fuller, on the pads, defended"
stays low from short of a length but Renshaw keeps it out
"short of a length, outside off, left alone"
"length ball, holds its line, hits the edge, and <strong>dies well before the wide slip</strong>"
"short of a length, outside off, left alone"
""
"length ball, angling in, hits the thigh pad after beating the inside edge"
"down the wicket, takes this flighted delivery on the full, defended to leg"
absentminded little defensive shot to a length ball outside leg. <strong>It falls in front of short leg</strong>
"outside leg, short, lets it hit the thigh pad"
"good bounce from outside leg, makes him go back and defend"
"fuller, flatter, and he has a square leg there to deny him a single"
shimmies down to place a length ball wide of mid-off for one
"dug in short, Marsh wants this to go under his armpit but the extra bounce means it hits him there"
"that's well played with no leg gully in place. Into the armpit again, and this time he gets inside the line and works it to fine leg"
"short of a length, at him, defended from the crease"
"wide length ball, left alone"
"on a length, a set of stumps wide, left alone"
"fuller, but still not close enough to make him play"
"length ball, outside leg, padded away"
"finally a boundary. The first since the 37th over. This is a touch too full and outside leg, so he sweeps this fine past the short fine leg"
"pulls the length back, gets it straighter, defended"
"four byes. The hundred is up. Marsh gets sweeping, and India are now having to think. Saha collects for the turn, but the ball doesn't turn and rolls along for four byes"
"down the wicket, defends after reaching the pitch of the ball"
"flatter, turns the other way, might have been the carrom ball. Punched to deep square leg for one"
"short of a length, angling in, defended"
"fuller, around off, defended from the crease"
"<strong>appeal for a catch at the wicket</strong>. marsh looks to pull, the ball is a little slow off the surface, and it misses everything as it bounces over the bat"
"short, down the leg side, and Marsh ducks it"
"authoritative. This short ball is waist high, and Marsh absolutely nails this pull. All along the ground and through square leg"
"on a length, outside off, left alone"
"half-volley outside off, driven straight to extra cover"
"gets straighter now, and draws a forward-defensive"
"nice dip, length ball, middle and leg, defended"
"shorter, flatter, into the pads, tucked away for one"
"tossed up outside off, he gets a stride in and leaves this alone"
down the wicket to defend a flighted delivery with bat and pad close together
"nice soft hands. On a length, angling in, he opens the face late, and guides it past the wide slip for a single"
"on a length, angling in, defended from the crease"
"wide length ball, easy leave"
"<strong>impact well outside the line</strong> on this lbw appeal. Angles this in from round the wicket, beats the bat but hits him outside the line. Not given"
"<strong>unplayable</strong>. This has hit a crack and gone the other away, against the angle. From short of a length, it jags away. Beats him by a week. Half a shout for catch, but they don't review. Rightly so. <b>Hang on</b>. This replay is interesting. This ball kissed the thumb on the way. Saha was the only one excited, but they decided against reviewing. There was day light between the bat and ball, but the ball just clipped the glove"
"length ball, angling in, clipped into the toes of short leg"
"on a length, stays low, defended in front of off"
tossed up wide outside off. Left alone
"some bounce from outside off, but Renshaw is not playing at those"
left alone well outside off
"shooter, squeezes under his defence, but he is lucky this is outside off"
"fuller outside off, and left alone"
"wide length ball, left alone"
"fuller, and he goes for the drive, but it scoots through under his bat. Variable bounce"
"on a length, angling in, kept out even as it stays low"
"wide length ball, left alone"
"full and straight. Except that it is a touch too straight, and he has been clipped away through midwicket for two"
"short of a length, waist high but sticks in the surface. Marsh has to defend because it doesn't come on"
"down the wicket, flicks this to mid-on. Got close to the ball"
"on a length, outside off, no turn, hits the inside half of the bat"
"intelligent batting. Hayden-esque. Skips down the wicket, and chip-flicks this over midwicket. He knows there is no fielder there so he doesn't have to hit it hard. Just clears the infielder"
"flighted outside off, defended"
"flat, into the pads, clipped away for a couple into the leg side. That brings up a special special fifty. He has had to face 183 balls for it. Close to four hours. His team-mates appreciate it with a big applause"
"overpitched, into the pads, misses out as he finds the man at midwicket with his flick"
"wide length ball, left alone"
"on a length, angling in, defended from the crease"
"offcutter at 143ks. Pitch up to mischief, but it starts too wide to make him play"
"short of a length, outside off, left alone"
"goes for the yorker, but goes too straight, and he clips it off his toes for three runs. These are crucial runs. India seem to be tiring now. Loose balls making frequenter appearances"
"shooter outside off, beats Renshaw's drive, but misses the stumps"
"less turn, around leg, stays back to defend"
"on a length, well outside leg, kicked away"
"fuller, closer to leg, flicked to short fine leg"
"full, just outside leg, defended back to him"
sharp turn from well outside leg. This has turned half the width of the pitch. Marsh does well to not follow
kicks this one away
down the wicket to defend a flat length ball
"skips down the wicket again, pushes one to mid-on"
"down the wicket again. Jadeja stays flat, and he defends this to leg"
"finally gets to the pitch of the ball after leaving the crease, and beats mid-on to take a single to cow corner"
"flatter, quicker, stays low. Marsh keeps this out"
"sharp turn, but Marsh's soft hands mean it stays down and goes for a single past short leg. <strong>Deficit under 70 now</strong>"
Marsh looks for a fine sweep as Aswhin stays outside leg. Saha collects as Marsh misses
"flatter, outside leg, Saha has to collect"
"flat length ball, well outside leg, hits his pad"
sharp turn and bounce from outside leg and he takes the bat out of the way and lets the ball hit his thigh
"fired down the leg side, Saha gets a touch on it, and short fine leg does the fielding"
"tries one on the stumps, and Marsh bunts it with the turn for a single to cover"
"no turn. Quick, on a length, outside off. <strong>Marsh plays for the turn and is beaten</strong>"
drop and run again. No man at cover. He just bunts this with an open face and sets off
stays back to defend a length ball
"down the wicket, beaten in the flight, but still pushes this wide of mid-on for one"
"on a length, turning in to middle and leg. Defended to leg"
stays back to defend a quick length ball
"lovely shot. Down the wicket to take this on the half-volley, and clips this wide of mid-on for one. They have a cow corner in place but for some reason Umesh puts in a dive at mid-on"
"outside leg, and Saha collects"
Marsh lets Saha make another collection
"fuller, closer to leg, and clipped away for a single to cow corner"
"down the wicket again, and again clips to cow corner for one. They are growing in confidence as India are losing a bit of their sting and accuracy"
swept away from full and outside leg. Beats the short fine leg to his right and gets a couple to deep backward square's left
"Australia are sensing it here. Renshaw down the wicket, reaches it on the half-volley, and goes inside-out over mid-off for the first six of the match"
"down the wicket again, and he is beaten in the flight and defends one"
"intelligent bowling and sharp stumping. He sees Renshaw advancing again, and fires one down the leg side. Renshaw looks to pad it away, but is beaten. Saha collects down the leg side. Actually the ball just sticks in the webbing. And he completes the stumping before Renshaw can get back. Renshaw is not happy with himself, but this has been a great innings. Great application through the innings, but has made a mistake just when he thought India were there for the taking"
"slow in the air, just outside off, defended"
moves forward to defend a length ball
"flatter, straighter, and defended to leg. But Handscomb in a bit of a tangle. Saha likes it"
"length ball, outside off, sharp turn. Left alone"
"on a length, outside off. Short of a length. But Marsh doesn't cut"
"short of a length, straight, punched to midwicket"
"on a length, outside off, defended to silly point"
"on a length, middle and off, solid defence"
"flighted outside off, defended wide of silly point for one"
"full, on off, flicked with the turn, but can't beat midwicket"
"length ball outside off, defended with an open face for a single in the vacant cover region"
"nice dip, middle and off, slight turn, hits the outside half of the bat as he defends"
shimmies down the wicket to defend after being beaten in the flight
"flighted outside off, he smothers the turn with a stride in"
"down the wicket, not quite to its pitch, but uses his wrists to push this to mid-on"
"short of a length, slow, stays low too, punched to mid-on"
"on a length, just outside off, hits the inside half of the bat as it doesn't turn"
shimmy down then wicket to reach the pitch of the ball. Defends
"<strong>quicker ball, and it jumps off a length</strong>. Hits the glove and the bat handle as Marsh gets the bottom hand off. Somehow the ball stays down"
"flighted outside off, and turns past his edge as he defends"
"fuller, straighter, and Marsh is right behind it"
"on a length, just outside off, hits him high on the bat as Handscomb defends"
down the wicket and drives past short cover for a single to get off the mark
"beaten in the flight as he skips out of the crease, is beaten on the inside edge and hit on the pad"
wide outside off. Sharp turn back but Marsh is not playing at it
"flatter, shorter, closer to the stumps, and he pushes this wide of mid-on for one"
"fullish, middle and leg, and clipped wide of mid-on. Against the turn"
"down the wicket immediately, drives wide of mid-on for a single to cow corner. <strong>Deficit under 50</strong>"
"flat, into the pads, beats the bat but is headed down leg"
"down the wicket, takes this on the half-volley, gets a single wide of mid-on"
leaves the crease again. Lets it hit his pad as he is beaten in the flight
"again outside his crease. Ashwin bowls on a length, wide outside off, Handscomb has to defend"
"paddle sweep from wide outside off, and gets a couple fine of fine leg. Handscomb has come out looking busy"
quick quick delivery from Jadeja. Turns past the inside edge and hits the pad
"stays quick again, defended to leg"
stays back to defend a length ball
"slightly fuller, pushed wide of short midwicket for a stolen single. This is good clear-minded running and great calling"
flat quick delivery. Defended off the back foot
"sharp turn from around off. Handscomb defends with soft hands, the ball hits the outside edge and dies wide of slip for a single"
down the wicket to drive a length ball to mid-off
"down the wicket, near the pitch of the ball, and lofts it to deep midwicket. That cow corner had come up and Handscomb picked on that gap"
this time Handscomb skips down to just chip it into the outfield for a single. <b>Deficit under 40</b>
"full, on off, defended"
down the wicket to drive this straight of mid-on for a single
"good batting and running. Handscomb down the wicket push this wide of mid-off for a single. As he sees mid-off is throwing at the wicket-keeper's end, he shouts 'your end' so that Marsh knows his is the danger end. And Marsh then races along"
"full and wide, left alone"
"full and wide, left alone"
"flat, outside off, defended off the back foot"
lovely chip shot. Not looking to hit too hard. Just skips down and chips this length ball against the turn and over midwicket. Just has to clear the infield here
"gets the flatter ball now, and punches it, but can't beat the man at cover"
slight indecision. Looks to push forward but ends up staying on the crease. Defends a length ball
"and now the loose balls coming out of Ashwin's hand. In his 33rd over now. Short, wide, and cut away for four. Australia have earned the right to these loose balls"
"on a length, outside off, defended"
"middle and off, short of a length, defended off the back foot"
"fuller, middle and off, defended off the front foot"
"full, on the pads, clips it away, but finds midwicket"
nicely played as Ashwin gets dip and turn. Marsh doesn't follow it with his hands and lets Saha make the collection
"full, on off, pushed to mid-on"
"down the wicket, defends one to short straight cover"
"fired in on a length outside off. Handscomb lets it be, and Saha has to make an awkward collection"
