"143 kph. Pad before bat? Inside edge? Nonetheless, Amla has been given by umpire Ravi. <strong>He reviews</strong>. Pad, before bat? Hits the pad definitely before bat. Comes down to HawkEye, and the ball strikes Amla outside off. One green, all that matters for Amla. Amla was walking off but then saw HawkEye."
"beaten on the outside edge. Slow outside off, the ball drops and beats the bat"
looks for the sweep but makes no contact. The ball pitches around off and spins well away.
"slow outside off, 89 kph, defended into the off side."
"popped away towards mid-on. On middle and leg, just a chip. Can't be playing against the spin on this surface."
"slow outside off, defended into the off side."
"tossed up outside off, defended to point. A maiden to start."
"good length outside off, left alone this time. The ball pitches and moves away."
"full on middle and leg, 138 kph, pushed away to mid-on"
"full and wide, overpitched, left alone."
"back of a length outside off, some extra bounce. Amla sways out of the line."
"full outside off, 136 kph, defended into the off side."
"good end. 137 kph, full and wide, swinging away, left alone."
short of a length and turning away outside off. Tapped to point off the back foot
<b>beats the outside edge.</b> Sharp turn away as he goes on the back foot to defend
"length on middle stump, gets low and paddles aerially to short fine leg"
"full on leg stump, flicked to short midwicket"
"good length on leg stump, gets on the back foot and taps to short fine"
back of a length and in at middle stump. Defended off the back foot
"back of a length on leg stump, clipped past square leg who has slipped as he shapes to chase this down"
"yorker just outside off, jammed back to the bowler"
good length and in at off stump. Defended on the front foot
<b>beaten outside off.</b> Length ball shapes away wide outside off and he wafts at it away from the body
shot. Overpitched and just outside off. No need of a big forward stride. Stands tall and punches it wide of mid-off
"short ball lifting up in the corridor, left alone"
"short of a length outside off, defended off the back foot"
"length on middle stump, gets on one knee and reaches out a long way before sweeping off the low half of the bat"
back of a length and fizzing away from the outside edge. He gets on the back foot and dead-bats it in front of slip
"length on off stump, blocked on the front foot"
"back of a length on off, defended off the back foot"
"back of a length on off, defended towards gully with soft hands"
overpitched outside off and a mistimed drive to mid-on off the front foot
"good length on off stump, blocked on the front foot"
"short and wide outside off, left alone"
full and in at middle stump. Defended on the front foot
"full on leg stump, nudged to midwicket off the front foot"
good length with some very late shape away in the corridor. Left alone
"good length on off stump, defended on the front foot"
"tossed up on off, blocked solidly on the front foot. 90kph that one"
92kph now. Length and wide outside off. Turns away and he leaves
short of a length outside off. Mistimed cut to point
"slider, good length and just outside off. Left alone"
"tossed up on off stump, driven back to the bowler"
oh lovely from Amla. Big extension of the arms after his trigger movement and the balance fully presented as he punches on the up through cover
"back of a length on leg stump, whipped to square leg"
good length and in at off stump. Defended on the front foot
"short of a length and wide outside off, left alone"
overpitched and down leg side. Reaches out and flicks to fine leg's left. Starc slides on his knees to stop
good length on off stump. Defended on the front foot
good length and in at leg stump. Flicked to short fine
"full on leg stump, flicked to deep square"
flat and back of a length at middle stump. Defended off the back foot
"good length on off stump, defended on the front foot"
"back of a length on leg stump, dabbed to deep square off the back foot"
<b>slider outside off</b> and Elgar leaves for the turn. Off stump exposed as he does this. Very close.
nicely bowled. Bit of wobble as he lands this on a good length in the corridor. Left alone
good length and in at middle stump. Defended on the front foot
"full and just outside off. A tad late on the drive, trickles out to mid-off"
bouncer on middle stump. Ducks under it
"good length outside off, left alone"
length and angled in to leg stump. Allows it come on and nudges it neatly past square leg. Starc puts in a slide after sprinting from fine leg again to stop this...<b>but his shoulder touches the boundary</b> as he does so. That will be amended to four runs
"full on leg stump, flicked to deep square"
"back of a length outside off, left alone"
"full outside off, leans in and drives straight to extra cover"
"back of a length at off stump, defended off the back foot"
"good length on leg stump, defended off the inside half of the bat"
"back of a length on middle stump, tapped to midwicket off the back foot"
full and in at off stump. Wathcfully pushed pitch-side off the front foot
"length on leg stump, nudged through square leg off the inside half of the bat. One-handed"
good length and late swing away in the corridor. Left alone
"good length on leg stump, defended into the leg side"
shot. No runs. Overpitched on middle stump and driven back firmly at the bowler with the full face
"bouncer across off stump, left alone"
"good length on off stump, defended off the back foot"
"full on off stump, defended on the front foot"
<b>leading edge</b> as he closes the face on this middle stump ball. Slow turn away again
"length outside off, left alone"
<b>withdraws the bat</b> as this beats the outside edge. Length ball turns away marginally as he looks to defend
"good length on middle stump, defended on the front foot"
"back of a length on off stump, punched back to the bowler off the back foot"
"full on leg stump, leading edge past gully as he looks to whip this. Length ball pitches outside leg and cuts away off the pitch"
"length on leg stump, in control as he taps to mid-on"
"low full toss wide outside off, tapped to mid-off"
"back of a length on middle stump, defended off the back foot"
"good length outside off, defended on the front foot"
short of a length and in at leg stump. Steered to short fine off the back foot
"length outside off, steps out and drives to long-on with the turn"
"good length on off stump, defended on the front foot"
"good length on off stump, plants the front leg forward and flicks through midwicket"
"short of a length outside off, jumps up as he shuffles outside to defend"
"good length outside off, defended on the front foot"
good length and swinging away outside off. Defended on the front foot
"short ball just outside off, left alone"
"back of a length in the corridor, defended off the back foot"
"yorker just outside off, jammed into the pitch on the front foot"
"short ball outside off, ducks under it"
struck on the pad as he looks to flick. It's a full ball on leg and it's going down
"good length outside off, struck on the pad and it pings to short leg where Bancroft dives one-handed to take it. But the appeal is turned down on both counts"
good length and turning in sharply from outside off. Bat-pad down the pitch
"back of a length outside off, tapped into the leg side off the back foot"
"length on middle stump, defended on the back foot"
"good length on off stump, defended from the crease"
"back of a length at off stump, defended off the back foot"
"a low full toss outside off, 139 kph, pushed towards wide mid-off for a run."
"full and wide outside off, left alone."
""
"full outside off, 137 kph, left alone"
"full delivery outside off, left alone"
""
"on the pads, too straight, nudged away to deep square leg for a run"
"short outside off, the ball turning back in, Amla is behind the line to defend."
"a shortish delivery around off, 89 kph, worked away towards short leg, the ball beats him for a run"
"slow around off, 88 kph, Elgar is right forward to defend."
"lots of flight, maybe too full, smothered away into the off side."
good start from Lyon. Elgar gets right forward to defend.
"full and wide, extracting just a hint of away movement. Left alone again."
"inside edge into the pad. Cummins begins to appeal, before bailing out of the stroke. Full and moving back in, a thick edge."
"a short delivery down leg, 140 kph, flies over the shoulder of Amla."
"well bowled. Back of a length outside off, the ball shapes away late, Amla leaves watchfully."
"on a length outside off, 143 kph, the ball is moving away, Amla plays it towards point. Just getting enough away movement."
"very quiet after the break, full outside off, a solid defensive block again."
"nice and full outside off, 90 kph. Elgar comes right over the ball to smother any spin"
"nice and full, another defensive block."
"short and wide, slow turn. Soooo much time for Elgar to go back and let that one go."
"extra bounce, 89 kph, flight outside off, Elgar takes one hand off the bat as he looks to defend. Splices away towards silly point, but no one there."
"very tidy lines, 95 kph, blocked."
"just popped over mid-on for a couple. Some flight around off, Elgar gets underneath the length and chips the ball over"
"very good lines, full outside off, not much movement. Amla is forward, looking to defend, off the outside half."
"drifts on the pads this time, 137 kph, nudged off the inside edge down to fine leg"
"full delivery outside off, the ball pitches and moves away to beat the edge."
"<strong>another beauty!</strong> Two in a row. Full on a fourth-stump channel. Elgar is beaten in the outside edge as he brings his bat down. He'll take that, instead of an edge."
"full and wide outside off, 142 kph, left alone"
"good end, full and straight, defended into the off side"
"flat outside off, the ball turning in. Amla lifts his hands to let that one go."
"shortish outside off, turning in, nudged to short leg"
"flat outside off, punched back to the bowler."
"slow outside off, nudged into the leg side."
picks the gap and will get four. It's shorter and wider. Amla rocks back and scythes a cut into the gap at cover
"shortish outside off, worked away towards midwicket, 91 kph"
"a shortish delivery down leg, 141 kph, nudged down towards the keeper's right. Amla sends Elgar back."
"full around middle and leg, 144 kph, pushed to mid-off. No fluency in Elgar's innings, but that's his way."
"144 kph, full and wide, the ball moving away. Elgar looks to drive, but the bat hits the ground and the ball misses the edge."
"good length down leg, 138 kph, defended"
"good length down leg, blocked again."
"full delivery outside off, Elgar withdraws his bat but the ball hits the bat first"
"too full outside off, Amla leans into a drive and finds a couple through cover."
"full delivery outside off, 133 kph, the ball moving in, left alone."
"full and moving back in, the ball coming back in, 133 kph, defended to mid-on"
"a good length delivery outside off, 134 kph, left alone"
"excellent lines, 133 kph, just outside off, Amla lets that one go."
"full outside off, 137 kph, the ball coming back in, skewed away towards midwicket"
"full and straight, Elgar is right behind the line to defend. Will he get some reverse swing?"
"full and straight, 138 kph, pushed to mid-on"
"on a length around off, 140 kph, the ball is starting to move back in, defended to cover"
"ooh yes, <strong>the ball is now moving back in!</strong> Full on middle and leg, very awkwardly defended."
"full and wide, left alone, 137 kph"
"another maiden, 137 kph, full on off, blocked to mid-off"
"132 kph, <strong>prodigious reverse swing!</strong> A full delivery is moving back in, Amla is beaten on the inside edge, struck on the pad."
"a full delivery outside off, 134 kph, the ball moves away and beats the bat."
"full and wide outside off, 134 kph, left alone. Elgar gritting it out."
"135 kph, a full delivery around off, comes back in, pushed to cover"
"finds some runs. Full and wide outside off, pushed away towards mid-off, Warner dives to his left but the ball goes through. He stops the four with a good chase"
"good length outside off, 136 kph, played into the off side"
"back of a length around middle, 143 kph, a thick inside edge towards square leg for one."
"the yorker, the one that's moving. Who else thinks that would have got a No. 11 out? Full on middle and leg, defended towards gully"
"142 kph, full outside off, driven towards wide mid-off for a run. Well-judged single."
"<strong>that's sensational! All reverse</strong>. The ball pitches and moves back in, Elgar wanted to leave but he somehow defends. That would have definitely got a No. 11"
"full and straight, more reverse swing. Elgar is behind the line, awkwardly but ably."
"too wide this time, full and wide, left alone."
"136 kph.<strong> Amla reviews immediately</strong>. Big inside edge. That's what Amla told Smith. Was it given out on the appeal? A loud, vociferous appeal from Hazlewood. The ball is full and wide, comes back in with the reverse. A thick inside edge into the pad. The crowd goes wild."
"full outside off, moving in, 131 kph, worked to midwicket. REVERSE SWING in all its glory."
"full outside off, 132 kph, this one holds its line, terrific bowling from Hazlewood. Left alone. Excellent from Amla too"
"too straight from Hazlewood, clipped away through backward square leg for a couple."
"edged, but wide of Smith at second slip. Full outside off, the ball holds its line, a thick outside edge towards the slip fielder, who half-stops it. <strong>Smith seems to have hurt a finger on his right hand</strong>. It landed well short."
"130 kph, good length around off, tapped towards slip."
"141 kph, down leg, nudged to midwicket"
"a full wide delivery elicits a drive. 143 kph, driven to short cover. Starc won't mind that shot at all."
"short delivery around off, 140 kph, off the leading edge into the off side."
"shortish delivery outside off, some inward movement, punched away to cover"
"shortish and wide outside off, another leave, 143 kph."
"short on middle, worked away in front of square, towards midwicket for one."
"full and moving in, nudged down to fine leg"
"full outside off, 132 kph, the ball pitches and moves away. Well left this time."
"full and moving back in this time. Awesome bowling. Too much swing though, The ball beats Elgar on the inside edge, hits him on the pad, but sliding down leg."
"full outside off, left alone"
"full around off, 132 kph, defended back"
"134 kph, full outside off, the ball comes back in, outside-halved away to point."
full and into the pads. Hurriedly flicked to square leg
"expansive drive on the up, away from the body. It's a soft ball, barely takes off after beating the infield. Amla ran his hands through this outside off to get it past mid-off"
<b>inswinging yorker at middle stump</b> is jammed out in a hurry. That bat's parallel to the floor when he finishes this. Whew.
"short and wide outside off, left alone"
"<B>beats the outside edge!</b> Oh man. Elgar looking for the one that comes in, pushing nervously at it with the stumps exposed. It lifts off the surface and goes past the outside edge"
"length on the pads, glanced to fine leg"
short of a length and swung into the hips. Dabs it to fine leg
"full outswinger, wide outside off. Left alone"
"full outswinger outside off, left alone"
<b>inswinger now</b> hooping in sharply from a good length. Looks to flick but can't get it past the keeper
full and in at leg stump. Blocked on the front foot
"another inswinger, wide of the crease. Length ball on leg and he shuffles and clips to fine leg"
"good length and into the pads. Stands tall, nudges with soft hands to square leg's right to <b>bring up his fifty</b>. A solid, gutsy knock from The Hash"
"overpitched, wide outswinger outside off. Left alone"
"short of a length in the corridor, nudged to gully on the bounce"
"good length, late inswing at off stump. Blocked on the front foot"
"short and wide outside off, left alone"
back of a length and straight through in the corridor. Left alone
length and swinging in from outside off. Left alone
short of a length and cutting in at off stump. Leaps to punch to extra cover
"good length on middle stump, dabbed to square leg's right with soft hands"
<b>jabs and is beaten.</b> Loose from Elgar. It's a length ball angled across off stump
full and just outside off. Left alone
good length and just outside off. Defended into the slip cordon off the outside half
short of a length and swung away outside off. Left alone
full and very wide outswinger. Left alone
good length and some shape away outside off. Left alone
"full and wide outside off, left alone"
"short ball outside off, takes it on with a hook. Beaten. He was swiping well under that"
"back of a length outside off, left alone"
short and very wide outside off. Early as he looks to cut. It rolls out to mid-off
"<b>outside edge through the slips!</b> That's fifty for Elgar, and there isn't a better representation of his innings than that. Full awayswinger outside off, chases it with his hands and it flies between second slip and gully"
"back of a length outside off, left alone"
"back of a length outside off, left alone"
good length and in at leg stump. Flicked to fine leg off the hips
back of a length and pushed down leg side. Can't get bat on the flick
short ball pitches outside leg and goes further down. Left alone
<b>ball of the match!</b> Elgar has done ridiculously well not to get out to this. Full ball starts outside off and swings back in fast. Suddenly it's a yorker headed for middle stump. Somehow gets bat on this without falling over. Plumb in front otherwise
"good length on off stump, defended on the front foot"
"bouncer outside off, left alone"
"good length and a hint of shape into off stump. He drops it in front of mid-off with soft hands and Amla calls through for a very risky single. He makes it, albeit with a struggle"
"back of a length just outside off, dabbed to gully with soft hands"
"full and swinging away from him. He pokes at it with an open face, almost reluctantly. Gets it to run wide of backward point"
"short of a length outside off, punched to cover off the back foot"
"good length on off stump, defended on the front foot"
"good length, some swing away from the corridor. Left alone"
good length at off stump and it spits up at him as he looks to defend on the front foot. Rams the inside shoulder of the bat and squeezes into the leg side
"<b>beaten</b> as he looks for yet another expansive drive against Marsh. Overpitched and moving away late outside off, the feet didn't bring him close to the ball"
good length with shape away. Left alone
"good length swinging away outside off, left alone"
"full on leg stump, flicked straight to square leg"
good length and late movement away from off stump. Defended off the outside half
"good length, hoops away outside off. Left alone"
"full and wide, left alone"
"full and wide outside off, withdraws from the shot after shaping to drive"
"yorker outside off, squeezed into the off side"
""
"full outside off, left alone"
"very full, aimed at the toes but just outside off, Elgar gets the bottom of the bat down and defends"
"full and at the stumps, defended on the front foot"
"back of a length outside off, defended off the back foot"
"short of a length outside off, dabbed through point off the back foot"
"full and wide outside off, he has a nibble and is beaten"
"short of a length on off, defended off the back foot"
"full and wide outside off, leans in and drives to cover"
full and at the stumps. Hurriedly keeps it out with a defensive
beats the bat after shaping to Amla. It rises on him too as he looks to play
onto the stumps and he flicks to deep square leg
draws him forward and he blocks solidly
pushed across off stump and he lets it go
full outside off with some movement in. Left alone
"full and swinging away, very wide. Left alone"
"full outside off, left alone"
"nice length, fuller than good. 137 kph, around off, a thick outside edge down to gully"
"on the pads, flicked away through midwicket for a couple. A dangerous shot with the ball reversing, but he's been there awhile."
"gone through Amla! A full delivery outside off, the ball has been reversing and this one does too! If Amla can't lay bat on it, it's going to be a tough time for the rest of South Africa. The point of release is wide of the crease, it looks destined for middle from that angle, but the ball straightens ever so late, beats the outside edge and uproots off stump! What a delivery. Too good even for Amla."
"strays down leg, 141 kph, de Villiers misses a flick."
"full and straight, a full-faced drive to mid-on. Superb start for Australia"
"<strong>beaten on the outside edge!</strong> A full delivery outside off, the ball pitches and moves away like an offbreak."
"a full delivery outside off, defended away. Top hand is soft on the bat handle."
"more away movement. Full outside off, moving away, defended into the off side."
"full delivery around off, defended"
"full outside off, a thick outside edge towards gully."
"edged and gone! That was too good. This has been a terrific spell of reverse swing bowling. A full delivery outside off, Elgar prods, the ball moves away like an offbreak, takes the outside edge and goes through to Paine. A very gritty 57, but Australia are right back in this one."
"driven through cover. And the crowd goes wild. Full and wide, AB leans into a drive, finds a big gap."
"a fullish delivery outside off, tapped away towards gully. The ball goes through Khawaja for a run, 143 kph. Don't think Starc will mind that, he's had success against Faf already this series."
walks across slightly and nudges the ball to square leg
"full and wide outside off, left alone."
"full outside off, driven to mid-on, 143 kph"
"goes short, down leg, not well directed. Easily negotiated."
"back of a length outside off, 134 kph, defended back from the crease"
"132 kph, back of a length on off, the ball wobbles past the inside edge and hits AB on the body via the inside edge."
"on middle and leg, goes past AB's inside edge and hits him on the body again."
"full outside off, moving back in, AB lifts his hands and lets that one go"
"good leave. It's the other one, the ball that moves away after pitching. Left alone"
"back of a length outside off, 133 kph, pushed to cover from the back foot. A maiden."
"short outside off, Faf looks to pull but the ball goes past. Trying to be positive, not a bad move at all."
"a full delivery outside off, defended to mid-off"
"swinging in, full and straight, clipped to square leg. Loud call of yes."
"a tad short, AB picks the length yesterday, stays back and swivel-pulls behind square for four. Shot."
"a full delivery outside off, defended back to the bowler. Right behind the line."
"around middle and off, nudged towards square leg. Six off the over."
"good length outside off, AB opens the bat face and plays to slip, as if an afterthought"
"a more confident, positive leave outside off"
"can't leave this, full, swinging back in, around off, defended"
"131 kph, on the pads, worked away behind square for a run."
"full and moving back in quite a bit, defended to mid-on"
"well left, goes wide of the crease, back of a length outside off, left alone"
"lovely shot, good stop too. Back of a length outside off, 136 kph, driven away to the left of cover. Bancroft dives away."
"full and moving away, no need to play at that. Hit to point."
"good length around off, AB is right behind the line"
"full delivery outside off, moving away again, but solidly blocked"
""
"excellent over, very well played too. Full outside off, the ball moving away. No need to play, he doesn't."
"a tad wide, Faf sees an opportunity to score and punches in front of point for a couple."
"full delivery outside off, 135 kph, defended"
"back of a length, seaming back in, pushed to cover"
"short delivery outside off, it's an opportunity. De Villiers carves the ball past gully for four. Interesting tactic because it can open avenues to score."
"overpitched outside off, driven away to mid-off"
"139 kph, movement. Hits AB on the pad, but sliding down, says the umpire. AB late on a flick."
"a full delivery outside off, pitching and moving away, defended to point"
"another full delivery outside off, Faf brings the bat down late to defend"
"a full delivery around off, 141 kph, popped off the inside half to square leg"
"<strong>Smith wants to review</strong>. That's a snorter of a bouncer from Cummins, superbly directed, right at the badge. He takes his eyes off the ball, the ball hits AB on the forearm, then the shoulder, then the helmet, then lobs to Smith at second slip. Australia think there is glove, but the ball is nowhere near the glove. So a wasted review, but it's the second best delivery of the session, after the Amla wicket one."
"a good length delivery outside off, 143 kph, moving away, right behind the line to defend"
"lovely bowling. AB will glad the over is done, gets a moment to regather his thoughts. A back of a length delivery outside off, the ball keeps moving away and beats the bat."
"short and wide outside off, Faf sees width and carves a cut to the cover point boundary. Lovely hit, can't be leaving those deliveries."
"full and straight, moving back in, nudged to midwicket"
"plumb in front! That looked out. It's that reverse again. But <strong>Faf asks for the review</strong>. It's much fuller than the previous ones, it finds a gap between bat and pad, hits Faf on the back pad in front of leg. Wonder if he was taken aback by how much movement Marsh got. Three reds on HawkEye, SA now in a bit of trouble"
"a length delivery outside off, blocked into the off side"
"a good leave. Full and wide outside off, left alone"
"full and straight, again attacking the pads, pushed to mid-on"
"a full delivery outside off, right behind the line is AB"
