"Radaba cranks it up to 142ks, pitches just outside leg and seams sharply to <strong>hit the back thigh</strong>"
"this is even better from Rabada. Ngidi enjoyed it more. This is like a <strong>fizzing offbreak. 143ks</strong>, starts outside off and cunningly swerves away wide outside off towards first slip. De Kock misjudges it but somehow gathers the ball"
"cracking over first-up from Rabada. Back of a length, pitches on leg or just outside leg, cuts away and bounces just over middle stump"
"Philander at the other end keeps plugging away outside off, no shot"
"starts way too wide outside off and nips away, Bancroft leaves confidently again. You've got to bring it closer to off and get it to bend away"
"floated full and outside off, Bancroft is quite happy to let these go"
"Philander attacks off stump with a full ball, nips away, squares up Bancroft. He pokes an outside edge to backward point"
back of a length and easily picked off the pads to the left of square-ish long leg
"back of a length and outside off, Bancroft shoulders arms again"
"<strong>pace like fire - 151ks</strong>. Really full on middle, driven back, Rabada throws himself to his left to stop the ball"
"lifter, angling away outside off, just <strong>145ks</strong>, Warner rocks his head out of the way"
"back of a length and zinging away outside off, 149ks, Warner leaves it"
"Warner gets off the mark after facing 10 balls from Rabada. This is a friendly offering on the hips, tickled away fine on the leg side for four"
"full and angling across off, beats the outside edge"
Warner jabs this short ball to cover and yells 'wait on'
"very full on middle, forward and driven up to mid-on"
"very full on off, defended"
"full on middle, presses forward and works it to short midwicket"
"full and nibbling away outside off, left alone"
back of a length and encouraging carry through to the keeper as Bancroft leaves it
Bancroft continues to show good awareness of his off stump and lets another one go outside off
"pretty full and angling away outside off, Warner plays outside the line and squirts an inside edge onto the pad. Did Rabada mock Warner there? He yells 'C'mon'. Cool off, Rabada"
"bouncer, flies over Warner's head, flies over a leaping de Kock"
"back of a length, starts outside off, snakes back in, but does not threaten off. Left alone"
"back of a length, 144ks, bounces in the channel, Bancroft thought about having a jab at it before pulling his bat inside the line"
"back of a length and zips back in from outside off, Bancroft is beaten for pace and <strong>cops a blow on the midriff</strong>. He doesn't flinch. Look at the red mark on his shirt"
Bancroft now finds some breathing space with a glance to fine leg
"good length and angling away outside off, Warner drags himself forward. He gets closer to the pitch and fluently drives it to mid-off, where Faf du Plessis lets the ball through his legs. Rabada isn't pleased one bit"
"full and nips away outside off, left alone"
"pitched further up and Philander brings this one back in at off stump, beats the inside edge and hits him high on the thigh. The lbw appeal is shot down - height seems to be an issue"
"this is the outswinger, Bancroft reads it and lets it go"
"pitched up at off stump, opens the face and deftly dabs through the gap at point"
"<strong>Philander's first ball to Warner in the second innings</strong>: pitched up on off, 'wait on' is the cry from Warner as he push-drives to mid-off off the front foot"
"really full on middle, Warner protects his castle and defends it"
"chest-hunting short ball on middle, Bancroft rides the bounce and fends it off past the right of short leg for three"
"really full on middle, shapes away late, an outside edge streaks away past the right of backward point. Fortunate edge and four for Warner"
tickled off the pads through backward square leg for a double. Warner tears back for the second. Given as leg byes
"Warner hangs back, rides the bounce of this shortish ball on middle. Drops it to the leg side and scampers through for a sharp single"
"back of a length and bounces outside off, nothing doing from Bancroft"
"full and outside off, Bancroft deploys a solid stride and drives to mid-off, where the fielder fumbles and concedes a single"
"good length and on off, Bancroft brings his bat down in line and blocks to cover"
"fuller than a good length and nibbles away outside off, Bancroft stretches out and finds the fielder in the infield with his textbook-style cover drive"
"full and curves back in, he plays around his front pad, head falls over, prodded to midwicket"
"nice and full outside off, Bancroft isn't tempted yet"
"good length, blocked on off stump"
"back of a length and put wide outside off, left alone, and that rounds out a maiden"
"speared full on middle, 144ks, Warner yells 'wait on' as he taps it straight to cover"
"...<strong>and Rabada wins the intense battle with a ripper that storms through the gate</strong>. Rabada hits that in-between length - neither driveable nor pullable - and gets the ball to move back in against the angle from outside off. He slices through the defences of the opener and tilts the off stump back. No shoulder brushes, no contact. More sedate celebrations from Rabada, if one could call that. He just screams in the face of the defeated Warner, but then again it's likely to attract unwanted attention. Cool off, Rabada"
"full and angling across off, prodded to midwicket"
pitched up and wide outside off - wider than a set of stumps - Khawaja simply reaches out for the ball with his hands and scoops a drive through cover-point
"full and angling away, seaming away close to off. So Khawaja pokes and is beaten on the outside edge"
"full and wide outside off, Khawaja goes after it and slices a drive through point for his second boundary"
"full and outside off, stretches forward and drives to mid-off"
"back of a length on top of off, defended back to the bowler"
"very full and straight, forward and pushed down to mid-on"
"Philander shortens his length and shifts his line wider outside off, left alone"
full and angling into a front-foot push to cover
"126ks legbreak, screams past the outside edge. Good length, angling in, then sharply moving past the outside edge"
"half-volley on middle and leg, Khawaja flicks it straight to square leg"
"full and angling away outside off, Khawaja loosens his grip and dabs it with soft hands to the cordon"
"lifter on leg stump, Khawaja ducks out of the way"
"back of a length and bouncing just outside off, Khawaja lets it go"
"pitched up on off, Khawaja has a short stride as he pushes it back to the bowler"
"back of a length and bounces over off stump, tight, tight leave from Khawaja"
"drifts, dips, and turns, creating distance between the bat and the pitch. Poked to the covers"
"slides in quicker on middle, blocked"
"shorter and spins away outside off, chopped to backward point, where there's another fumble"
"Maharaj goes up for an lbw appeal. Not given by umpire Dharmasena. This was pushed through flatter and quicker, Bancroft plays back and smashes and inside edge onto the pad"
"straight ball on middle, eased down the ground"
"slower through the air on off, forward and smothered. And that's drinks"
"turns and bounces outside off, <strong>bursts past the top edge</strong>"
"lured into the drive, but didn't get to the pitch. Drawn forward, he has a waft and is beaten"
"short of length on middle and leg, Bancroft is hustled for pace but manages to work this towards square leg"
"angles a length ball across Khawaja, who shoulders arms"
"extra bounce from length on off stump, Khawaja takes his bottom hand off the grip as he defends"
"shapes to drive to this delivery that swerves back in, but he's been <strong>saved by a thin inside edge</strong>"
""
"Maharaj holds this back outside off, patted to the covers"
"full and straight, Bancroft deploys a solid stride and drives a single down to long-on"
"breaks back in from wide of the crease, prodded in the air but wide of short leg"
"tossed on off, Khawaja stretches out and smothers it"
Khawaja attempts a  reverse-sweep from outside off. He can only toe-end it to slip
Bancroft rides the bounce of this short ball outside off and punches up to the covers
"full and veering down leg, deflected away fine on the leg side"
left alone outside off
"back of a length and angling across off, Khawaja leaves it be"
"much fuller and sliding across off at 133ks, left alone again"
"back of a length and angling away, finishes on a fourth-stump line. Khawaja simply pats it down to cover"
"tossed up and drifts in on middle, Bancroft presses forward and runs it to short midwicket's left"
"Delightfully done, Bancroft. Floated up on middle, he steps away outside leg, collapses his back leg and lifts it inside out over mid-off"
"pushed through on off stump, driven along the ground to long-off. Mid-off had been pushed back after that four"
clipped with the break to the left of forward short leg
"tossed up and full enough for the sweep or the reverse. Khawaja stretches out, rolls out his wrists, and guides the ball away through the vacant spaces at backward point. Excellent execution of the reverse sweep"
"flatter and turning in, Khawaja dinks it away behind square on the leg side and hares back for three. Given as leg byes"
"short on middle, Khawaja hops and fends it back"
"back of a length and angling away outside off, ignored"
"rising short ball on off, angling away from over the wicket, Khawaja hops, skips and fends it down again"
"back of a length and angling across off, ignored"
"back of a length and fizzing away outside off, Khawaja does not bother with it"
"full on off, hangs back and works the ball to mid-on"
"pushed through on off stump, clipped to the left of midwicket"
"slower through the air and drifts in, defended to the leg side off the inside edge"
"hung up in the air, drops, and turns sharply past the outside edge"
"full on middle, played back to the bowler"
"pushed through very full on the leg stump, Bancroft goes low, and paddles it very fine. Nobody there to cut if off"
"drifts in, turns, takes the outside edge and rolls to point"
"back of a length and angling away just outside off, Khawaja sits back and defends to the leg side"
"fuller on off stump, Khawaja blocks again"
"full and attacking the stumps, defended back to the bowler"
"short and shoved down leg, Khawaja does not chase after it"
"short and skidding on just outside off, Khawaja hops and drops it down"
"Ngidi finds the outside edge but it does not carry to AB at first slip. It bursts through the cordon for four. This was much, much fuller, angling away, and seaming away. Khawaja is opened up as he jabs at the ball and gets away with it"
"tossed up full on middle, driven back to Maharaj"
"drifts in on off, forward-defensive from Bancroft"
"dips at leg stump, creates distance between the bat and the pitch. Prodded to midwicket"
"tossed on off, hint of turn, Bancroft presses forward and smothers it"
"hung up in the air, drops outside off, steered off the face to backward point"
"turn and bounce outside off, no shot, maiden"
"good length and darted outside off, Khawaja presses forward and shoulders arms"
"full and wide, carved away behind point. He has to settle for one"
"What have you done, Bancroft? What a soft end to an otherwise solid innings. Floated full and outside off, Bancroft simply reaches out for the ball with his hands and brings his bat down at an awkward angle. An inside edge trickles back onto the base of off stump and the off bail gets dislodged. Bancroft sees off the new ball but doesn't cash in again"
"... and he sets to work with a <strong>first-ball four</strong>. Death, taxes, and Steven Smith jumping across off to whip balls to the leg-side boundaries. He shuffles across and twirls this middle-stump ball to the right of square leg"
"back of a length and outside off, punched to the covers"
"good length and outside off, no shot"
"lobbed up outside off, turns back in to take the inside edge but does not carry to short leg"
shorter and clipped off the hips to short midwicket
Khawaja steps out and clips it with the break to deep square
tossed up and drifts into the middle of Smith's front-foot defence
"Maharaj pulls his length back, starts on off, makes Smith play, and<strong> breaks past the outside edge</strong>"
"slid through much fuller on the stumps, kept out"
"full and holds its line outside off, ignored"
full and holds its line again but it's closer to off this time as Khawaja hangs his bat out and misses
full and wide - wider than a set of stumps outside off - left alone
"slightly back of a length, angling in from wide of the crease, Khawaja plays for the angle but it <strong>straightens away past the outside edge</strong>"
"and again! Much fuller, angling in just outside off and tailing away past the bat"
"short on leg stump, deflected to square leg"
"floated on off stump, Smith stays leg-side of the ball and pushes to cover"
"pushed through on off, defended"
"here comes Smith! He twinkles down the track and launches it inside-out over mid-off. Philander, who was at mid-off, has now been sent to the deep. Gorgeous timing from Smith"
"shorter and outside off, stabbed to cover"
"pitches on middle and leg, spins away, jabbed to point"
"shorter and spins away outside off, hit back to the bowler"
"on a length and kicks up, Khawaja looses his grip and gloves it to the cordon"
"just short of a good length, lifts and moves away as Khawaja hangs his bat out again"
"really full on off, Rabada catches Khawaja on the crease again. An outside edge streaks away past the cordon and down to third man"
"wide yorker, squeezes under Smith's bat"
"just short of a good length and outside off, played back to the bowler"
"full and snaking back in, Smith plays around his front pad, but this was heading down leg with the sharp angle"
"pushed through on middle, down the track and forced down to long-on"
glanced away behind square on the leg side
"floated up on off, forward defensive"
"<strong>Maharaj reels in the big fish</strong>. The big fish walks off, and Maharaj is mobbed by his team-mates. Maharaj loops a full ball up on middle and off and gets it to break away and bounce. Smith plays back and wafts at it. He feathers it behind and he knows it. De Kock rides the bounce and snags a sharp catch behind the stumps. Australia are still 62 runs behind"
whipped with the break to short midwicket off the back foot
starts outside off and rips back in to beat the inside edge and hit the thigh pad
"full and outside off, no shot"
"pitched up and outside off again, no lateral movement, left alone again"
"Khawaja shimmies out, Philander holds his own and probes away outside off. Left alone in the end"
"back of a length and outside off, left alone"
fast legbreak runs away outside off as Khawaja stabs at it and misses
"kicks up from a back of a length outside off, Khawaja goes after it but is beaten"
clipped with the break to square leg
"tossed outside off, Khawaja runs down the track and drills a drive against the break through extra cover"
"fuller and outside off, pushed into the covers"
"Khawaja skips out again, meets the pitch, takes a half-volley and creams it to the cover boundary"
"pitches a long way outside off and spins in, Khawaja kicks it away with his pad"
"skids on outside off and turns in quickly, Khawaja hurriedly prods it to midwicket"
"angles a full delivery on the stumps from wide of the crease, Marsh is overbalanced as he squeezes this back down the pitch"
"there's the poke and he's gone. This is a nothing shot from Marsh. He was neither going for a full-blooded drive nor was he intending to leave that. Credit to Rabada, pitched this up and got this to move away just a hint to drag him into the stroke, got the faintest of edges through to de Kock. Trouble, trouble for Australia"
"back of length delivery outside off, left alone"
right behind the line of this length ball as he defends.
right on top of the bounce as he defends with soft hands
"floated full outside off, left alone"
"back of length outside off, left alone"
leans forward and drives this incoming delivery to short mid-off
"invites the drive by pitching this up outside off, Khawaja leaves"
width and he's put that away easily. Rocked back and smashed the cut behind point. Quality stroke
"induces the edge. Khawaja is squared up as he hops back to defend, this one races past second slip to the third man boundary. Minimal feet movement"
"swerves back in from outside off, Khawaja leaves. This wasn't far from the off stump"
"touch ahead of length outside off, left alone"
ducks under this short ball. He's working up some pace
"angles in a short of length delivery on middle and leg, tucked to midwicket"
bunts this short of length delivery into the off side with soft hands
"probing length outside off again, left alone"
"leading edge as he hops across to defend, lands short of point."
steps out and whips this full delivery down to long-on
"fired full on off, Marsh lunges forward and blocks"
hint of turn but he's got the line well covered as he defends
stretches forward and defends this tossed up delivery with the bat well ahead of his pads
"drifts in a full ball on off stump, defended to cover"
"uppish but just wide of point. Ngidi runs around the ropes from deep cover to put in a dive and prevent the ball from crossing over. Top work, first to get to the ball, then to dive. All this for two runs."
excellent stop by Elgar at gully. Khawaja looked to punch this through point but got a thick edge.
shows the full face of the bat in defence of this incoming length ball
"down leg, this races away to the fine leg boundary. Easy pickings for Khawaja, who simply tickles this away. Too easy"
"length outsiee off, left alone."
squeezes the drive to backward point
stands tall and defends this back of length delivery outside off to cover
"drifts in a full delivery that he looks to squeeze out, but gets a bottom edge that bounces thorough to de Kock, who dives to his left to stop that"
rooted to the crease as he defends this 'in-between' length ball. Wasn't sure whether to go forward or back
rocks back and cuts this shot ball to deep point
gets outside the line of the stumps and blocks with the pad
"steps out, in doing so, gets himself outside the line as he smothers the spin with his pad"
"nicely-controlled reverse sweep, all along the ground to the third man boundary"
punches this length ball to Maharaj at cover
solid backfoot defense to this length ball on off stump
nips back in to thud into the thigh pad as he looks to work it to the leg side. They steal a legbye
"sliding into the pads, Khawaja hops across and whips this to the fine leg boundary. That's the second boundary in that region post tea. He's looking quite comfortable now"
"back of length delivery, gets this to lift off the surface, but it was angling away. Left alone"
lunges forward and drives to short mid-off.
"right into the blockhole, squeezed back to the bowler"
lunges forward and eases this with the spin to short cover
"drift and turn from leg stump, squirted towards point"
"nice line, held it back a touch to force Marsh to lunge forward, defended solidly"
"right into the blockhole again, defended"
eased with the spin to deep cover
"length ball that swerves away just a touch from outside off, left alone"
forces this off the backfoot to cover. Can't pick the gap
"nips back in to hit the top of the pad, but this was sliding down"
"back of length outside off, this one climbs on Marsh but he lets it go. Taken chest height by de Kock"
works this incoming length delivery into the leg side with soft hands
right behind the line of this length ball as he defends
"gets this full delivery to shape away from outside off, Khawaj's feet rooted to the crease as he pushes this to cover"
"good leave. This is a tight leave too. Angles a length ball back in from wide of the crease, wasn't far from the off stump"
beaten as he shapes to fetch a pull from way outside off.
"gets this to snake back in from wide of the crease, Khawaja shows the full face of the bat in defence"
defends this length ball from the crease to the off side
driven but straight to mid-of.
"drifts in a full ball on the stumps from around the wicket, defended back"
eased with the spin to short cover
rocks back and punches this length ball to cover
"drifts into middle and leg, Marsh lunges forward and smothers this"
sees some air on this but is happy to ease this back gently to short mid-off
"skids back in with the arm, Marsh steers this down to deep cover"
"shot of the evening. This was short and angling in, Marsh got inside the line and pummeled this pull over midwicket."
"floats this full on off stump, defended from the crease"
"angled in towards the stumps from wide of the crease, squirted to the off side."
"good stride forward, perfect balance as he defends this full delivery back"
"was it missing leg? Marsh is truck on the pad, fell over a touch as he looked to work this past midwicket. <b> Faf consults with his mates and reviews the decision. </b> Remember, this had to hit more than half of leg stump for it to be reversed. Ball tracking suggests this would've missed leg stump by a long way."
"short of length and way outside off, left alone"
turns this gently into the gap at midwicket to bring up his <b> 11th Test fifty </b>
cracked to the point boundary at the rate of knots. Transferred his weight back to give this a whack. Too short from  Maharaj
"drifts into middle and leg, he lunges forward and blocks"
"skids back in, keeps a touch low but Marsh defends somehow"
gets the bat well in front of the pad as he defends
drills this full delivery to mid-on
"length on off from around the stumps, defended towards point"
mistimes a drive to mid-off. Went for an expansive drive
"slides a full delivery down leg, Khawaja looks for the fine tickle but misses."
"full toss that bends back in, defended back towards the bowler, who can't put his right foot out. Faf stops it at mid-off"
superb one-handed stop at extra cover by Markram. This was driven firmly by Khawaja out of the rough
punches this length ball to extra cover
"short of length outside off from around the stumps, left alone. On the bounce to de Kock"
"gets this full ball to bend back in, hit the deck and then straighten. Khawaja is beaten. Fortunately for him, he played inside the line. Hint of reverse for Rabada"
right behind the line of this length ball as he bunts into the off side
"angles in a short ball into the body, Khawaja looks to hop back and whip that square but gets a glove on it as the ball rolls to the leg side. They scamper a run"
"full and swinging away from off stump, left alone"
hops back and defends this short of length delivery back towards Rabada
over the gully region. Cries of 'caaaatch' but there's no way someone would've got that. Reached out to drive this through cover. Handy runs
right back into the crease as he defends this short of length ball back towards the bowler
"slants this length ball into middle and leg, defended towards midwicket"
"full outside off, hint of reverse away, left alone"
"full and swinging away from outside off, an open invitation to drive, but Khawaja lets it go"
"full outside off, left alone"
"tails one back in a long way, Marsh looks to defend, deflects off his thigh pad to fine leg"
"floats this full on the stumps, Khawaja's feet rooted to the crease as he defends"
"short of length delivery way outside off, left alone"
"full outside off, but not enough to get him driving. Left alone"
<em>beauty from Rabada.</em> Got this to angle in and straighten to beat the outside edge as Khawaja pushed at that
"beaten for pace by this sharp bouncer, he shaped to pull but was in no position. Thudded into the glove and lobbed briefly but there was no one at short leg to snaffle that."
"dropped shorter and wider outside off, cut firmly to the off-side sweeper off the back foot"
"on a length, starts outside off and turns back in at his pads, Khawaja clips it with the turn to deep midwicket"
"darted very full on middle, so much so it winds up as a full-toss, worked to the leg side"
"skidder outside off, chopped off the back foot to backward point"
"flat and skids on outside off again, stabbed off the back foot wide of backward point this time"
Khawaja dares to foray down the track. Maharaj is wary of it and he duly pulls his length back. Khawaja wears it on the thigh pad and the ball loops into the lap of short leg
"short and outside off, Marsh gets right behind the line and blocks stoutly"
"pitched further up and just a shade outside off, he still can't breach through the defences of Marsh"
"back of a length and heading towards the top of off, Marsh's defensive technique intervenes again"
"back of a length, angling in and veers away a touch, <strong>catches the shoulder of the bat </strong>but does not carry to the cordon"
"back of a length and slanting in at off stump, prodded to backward point"
short and wide outside off - possibly wider than a set of stumps - Khawaja watches it through to de Kock
"pushed through the air, slides in on middle, blocked"
Marsh jumps back to meet this short ball outside off and forces to the covers
"on a length and spins away outside off, Marsh deploys a solid stride and blocks with the break to point"
"shorter and faster outside off, he goes on the back foot and punches the ball up to mid-off"
"fuller and outside off, driven through the line to cover"
"loopier and drifts in at off stump, Marsh covers up his castle and defends to the off side"
"back of a length and holds its line outside off, Khawaja swishes his bat out of the way"
"back of a length and outside off again, no shot again"
"shorter and outside off, nothing doing from Khawaja"
"Rabada keeps darting it short and wide, Khawaja keeps leaving it"
"back of a length in the channel, left alone yet again"
