"141 kph, de Villiers did not read that, but he is a classy-enough batsman to get bat on that. Full, swinging back in very late. A thick inside edge to square leg"
"excellent change in length, short outside off, gets underneath"
"full and wide outside off, the ball moving away, defended"
"on a length on off, clipped to midwicket"
"a short delivery drifts down leg, helped along down to fine leg for one."
"a full delivery outside off, AB is behind the line to block"
"good length outside off, carved away to deep point for one"
"back of a length on middle and leg, nudged to midwicket"
"gone! De Bruyn now given out lbw. And he does not review. SA are now six down. A full delivery seams back in, de Bruyn misses a drive, struck on the pad in front of middle. The ball moves back in like an offbreak. Umpire Dharmasena says that's out. Umpire's call, just clipping the side of leg stump."
"a full delivery outside off, jammed back."
"a full delivery outside off, driven to mid-off."
"full and wide, 140 kph, the ball moving away, left alone."
"full and wide, the ball moving away. A thick outside edge races away in the gap at gully. SA need all these runs and a lot, lot more."
"full around off, right behind the line is AB"
"smashed through midwicket. Cummins drops short, on off. He picks the length early and goes boom! In the gap at midwicket, rolls his wrists over the ball."
"a lovely drive through cover for two more. Full and wide, 140 kph, outside off, driven through cover for two."
"another stellar shot by a top batsman. Full on middle, drilled through mid-on for four. Full face of the bat."
"overpitched and wide outside off, caressed to cover from the crease"
"full outside off, 139 kph, behind the line is de Kock. SA need another inspiring contribution from him"
"full outside off, hit in front of deep point for one."
"back of a length around middle, clipped to square leg"
"comes back in again, 132 kph, hits de Villiers on the pad but well down leg"
"back of a length outside off, defended into the off side."
good length and swung in at middle stump. Pushed uppishly to mid-on off the front foot
"short of a length outside off, sliced to deep point on the up"
"good length and pushed wide across off stump, left alone"
full and hooping away from middle stump. Driven across the angle to mid-on
"bouncer angled across off stump, left alone"
"full on leg stump, flicked to deep square leg's right and it's deft enough for him to come back for the second"
"good length outside off, punched to sweeper's left off the front foot"
length ball angled into the hips and he pokes it past Paine off the glove
"full outside off, driven on the front foot"
"overpitched outside off stump, neatly driven to mid-off on the front foot"
"good length just outside off, nicely driven on the up past the non-striker. Mid-off dives to his left to stop"
"short and wide outside off and he spanks it off the middle, not too far to deep point's right"
shot. But straight to mid-on. This swings in a long way at leg stump and he drives with full balance and the full face offered
"overpitched outside off, driven to sweeper's right"
good length with late swing away from the corridor. Defended with soft hands
"back of a length just outside off, steered to deep point off the back foot"
"overpitched outside off, hint of swing in. But it's another well-timed drive from QDK. Straight to extra cover"
he's middling them every time. Full on off stump and it's driven straight to mid-off
full and pushed wide outside off. Sliced to backward point off the front foot
"full outside off, goes well forward and Smith at slip thinks he's looking to sweep. He takes a step into the leg side and finds out that AB has, in fact, brought out the reverse sweep"
"short of a length outside off, backs away and cuts to point"
"good length on leg stump, defended into the leg side"
"good length on off stump, defended on the front foot"
"full at off stump, defended into the covers"
yorker speared in at leg stump. Gets the front leg out of the way and keeps this out
another yorker at leg stump. Closes the face on this and gets it between his legs. Steals a single from Paine
"full outswinger outside off, drives solidly on the up, straight to short extra cover"
"<b>slices it past gully.</b> A low full toss, very wide outside off. He reaches out and ends up steering this, one-handed and aerially, to the backward point boundary"
<b>fifty for ABD.</b> Full control. Low full toss comes in at the stumps this time and he leans in to whip this through midwicket
<b>inside edge</b> and into the body as he looks to squeeze one through cover. It's a full ball outside off
struck on the pad as he pushes onto the back foot. But this slider has come in from middle stump
back of a length and turning away a touch from off stump. Leading edge as he looks to flick
"<B>what a ball, Lyon! Superb!</b> QDK can't do anything about this. The perfect pace, the perfect amount of flight and the perfect spot on the pitch as this drifts in and draws him forward. He's shown half of off stump and the ball finds it after spinning past the outside edge"
"good length on off stump, defended on the front foot"
short of a length and spinning in sharply from middle stump. Cops it on the thigh
good length on leg stump. Clipped to square leg off the back foot
full and in at off stump. Defended on the front foot
back of a length and swinging away late. Left alone
"full outside off, left alone"
"good length outside off, left alone"
"yorker on off stump. Jams it pitch side into the leg side. Calls no, then yes, <i>very</i> late and then says no again. Sloppy but safe in the end"
"back of a length on off stump, defended off the back foot"
"length outside off, blocked on the front foot"
"stunning placement. It's full on off stump, he gets down very early and watches it closely before swatting it to the square leg boundary"
"length on middle stump, defended off the back foot"
"good length on leg stump, pushed into the leg side off the front foot"
"length outside off, not to the pitch as he drives this to mid-off. Got in a tangle"
short of a length and spinning into and bouncing at the mid-riff. Cops it on the pad as he looks to glance
back of a length and shaping away outside off. Defended off the back foot
"back of a length outside off, left alone"
attempted yorker goes wrong. It's a full toss speared into his legs and he tickles it fine
"back of a length in the corridor, defended off the back foot"
"<b>oh yes!</b> Lovely! Smith brings the field in on the off side, so AB arches backwards against this short of a length ball, creates room for himself, and slices from under it to get it over gully"
"short of a length on middle stump, allows it to come on and drops it behind square on the leg side"
"good length outside off, left alone"
good length ball comes in late in the corridor. He covers the off stump and leaves. This came very close to the stumps
"short of a length outside off, mistimed punch off the back foot. Rolls out to mid-off and he decides late on the single"
good length and swinging in at middle stump. Defended on the front foot
"short of a length outside off, pushed to gully off the back foot"
"short of a length outside off, pushed to gully off the back foot"
"short and wide outside off, slapped straight to sweeper point"
full outside off and late movement away as he pushes with hard hands in front of his body. Angled bat so he gets a thick outside edge and this runs between gully and point
"good length outside off, left alone"
<b>beaten on the inside edge.</b> Full and angled in at off stump. He's expecting it to swing away but ti doesn't
"full outside off, driven straight to extra cover"
"good length on leg stump, nudged wide of mid-on with the bottom hand off the bat"
"full outside off, steered to gully off the outside half"
swings in from off stump and hits him on the thigh as he looks to shovel this into the leg side with no feet movement
"full inswinger on leg stump, clipped straight to short midwicket"
<b>swings through and gets it over point.</b> Starc baits him with a full and wide one. Philander makes no effort at finesse - slashes with no feet movement and gets it over
leans in this time. Length ball angled across off and he drives on the up to get it wide of deep point
full inswinger into the pads. Clipped to deep square's left
"full outside off, nicely driven to mid-off"
"short ball angled leg side, he ducks under it"
"<b>beats Philander</b> the way Philander beats everyone else. Length ball, in the corridor, zipping away marginally off the pitch and sneaking past the outside edge"
"full on off stump, pushed uppishly through cover off the front foot"
"<b>outside edge</b> but he's gone at this with soft hands. It lands short of where third slip would've been. There is no third slip. It's four. Another beauty from Hazlewood, moving away off the surface after drawing him forward"
good length and in at off stump. Defended on the front foot
back of a length and spitting up at on off stump line. Defended off the back foot
"good length on off stump, defended on the front foot"
"beaten. Angles in, climbs up after strengthening and he won't connect on the back foot defence"
"short of a length wide outside off, left alone"
"bouncer dropped too short, he ducks under it"
"good length on middle stump, blocked solidly on the front foot"
"nicely bowled, but he won't bite. Short ball just outside off. He leaves"
"short of a length on middle stump, gets on top of the bounce and drops it into the leg side with soft hands"
"back of a length on off stump, defended off the back foot"
"good length on leg stump, nudged to mid-on off the front foot"
"good length on middle stump, defended on the front foot"
"back of a length on leg stump, tapped into the leg side from the crease"
"full on leg stump, offers the full face and taps this to mid-on off the front foot"
he's away immediately. This is a leg-stump half-volley that AB flicks to long leg
"slants it full but way outside off, Philander doesn't bother looking at that"
"angles a full delivery outside off, Philander lets it go"
uppish drive that lands on the bounce to extra cover. This may have held up just a touch. Philander committed to the stroke quite early
right to the pitch of this half-volley as he drives to mid-off
gets onto his toes and tucks this gently into the leg side as they scamper a single
"that's a screamer to the cover boundary. Gentle and overpitched outside off, Philander leant into it and caressed it nicely. Head right over the ball"
"shortens his length and lands this around off, Philander inside edges a defensive stroke onto the pad."
"floats this wide, inviting Philander to have a slash but he lets it go"
"angles a full delivery on the stumps from wide of the crease, Philander shows the full face of the bat as he defends to mid-off"
hops back into the crease and defends back this short of length delivery
"draws the edge but this doesn't carry to the keeper, who dives full length to his right. Deflects off Mitch Marsh's hand at first slip to the third man boundary. Handy runs that Philander will take however they come."
"short of length delivery angling away, left alone"
"full outside off, left alone again"
"touch ahead of length and angling across, AB leaves"
"short of length delivery angling away, AB shapes to cut but decides against it in the end. Watched through to Tim Paine"
"<em>heart-in-the-mouth moment for AB briefly.</em> This is a full toss which he looks to hit over mid-off, fortunately didn't hit it well enough to carry. On the bounce to Warner."
"hint of width, AB flays this on the up to deep point. Will keep strike"
"takes off from a spot at length outside off, AB leaves and this bursts through Paine's hand to the boundary. Four byes. This got to Paine quicker than he thought. Should've been gathered"
tucks this towards midwicket for a quick single
"beautiful bowling. Full on off, this tails away just a touch to miss Philander's tentative poke"
"angles into middle and leg, Philader prods and gets a thick inside edge that races past square leg"
excellent leave. Full delivery that jags back in off the seam from fourth stump.
shows the full face of the bat to play a dead-defense
"hits the deck hard at length on middle, AB hops back and defends"
whipped off his hip to deep square leg
"pacy length ball that snakes back in to hit Philander on the thigh pad and onto the box. Ouch, that will pain."
"beats the inside edge on the drive. Philander lured to play that through cover but played down the wrong line, lost his shape."
"this is gorgeous! You'd pay good money to watch a cover drive like that. Right to the pitch of the ball, nice-high elbow as he presses forward to essay a delightful drive. This was asking to be hit and he did"
"slants a short of length ball across, left alone."
gets half a stride in forward to defend this length ball on off
"short on middle, AB is in position as he pulls this all along the ground to deep square leg"
"angling into the pads, hits Philander on the thigh pad as he looks to nudge this gently"
right back into the crease as he bunts this into the off side. <em>Could've so easily chopped on</em>
"angling into the pads, misses the flick."
hint of width on offer outside off but Philander is happy to leave
gets half forward and defends
length ball that rushes onto AB as he defends back
"short ball angling away, AB thought of the pull but let it go at the last moment"
hops back and turns this gently into the leg side as they jog the single
"off-cutter at length on middle and off, Philander is right behind the line in defence"
"excellent short ball angling away, Vern shows good technique in dropping his wrists and swaying out of the way"
gets a good stride forward and defends this length ball into the off side
text book forward defense to a full delivery angling in from wide of the crease
"angles in a full ball on middle, AB defends into the leg side"
"dispatched with disdain. Misses his length, turns into a middle-and-leg-stump half-volley which he flicks imperiously wide of mid-on. Vintage AB, superb balance. Delightful wrist work"
right behind the line as he defends
"plays this really, really late. Length outside off, AB takes a step across towards off stump, gets right on top of the bounce and pats it very delicately into the gap between slip and gully. So, so calculative, so very effective."
lunges forward and turns this back with the spin to Lyon
drifts away but Philander lunges forward and defends to the leg side with soft hands
right on top of the bounce as he wrists this behind square on the leg side
"tossed up on middle and leg, worked with the spin to short midwicket"
works this with the spin to deep square leg. Nice roll of the wrists
"fired full outside off, Philander deadbats"
oh ho-ho-ho. AB disdainfully pulls that off the frontfoot to the midwicket fence. Picking the length early was the key and he latched onto it in a jiffy. AB marches into the 90s
"half-volley on the pads, flicked deliciously to deep midwicket. There was two on that, but he decides against it this time. <em>Influenced by the run-out in the previous Test, perhaps?</em>"
"skiddy bouncer on middle, Philander ducks under it"
"jabs at this full delivery, manages to squirt this behind point. Down towards the small boundary, they come back for the second"
"thick edge, but does well to take his bottom hand off the grip, <em>lands short of second slip.</em>"
"shapes to play an on-drive, toe-ends it to short mid-on."
"bounce from the rough, spins back in to hit AB on the inside thigh as he looks to turn this to the leg side"
right on top of the bounce as he wrists this towards square leg
"sharp turn but from way outside off, Philander waits for the turn and then tucks this to square leg"
"drifts away across the batsman, AB drives firmly but straight to cover"
"too short, AB makes room and cuts to Starc at deep point"
"short, sitting up nicely and he pulls this to deep square leg"
"short ball but way over Philander's head, avoided easily"
plays outside the line of this delivery that angles in to hit him high on the thigh pad.
"big appeal again. Too much bounce? Smith ponders a review and decides against it. Philander plays all around this length ball angling in and is hit on top of the knee roll. <strong>This would've gone over?</strong>. Hawkeye suggests it would've clipped, so would've been umpire's call at best. So Australia wouldn't have lost a review even had they taken one."
gets half-forward and jabs this length ball into the off side
shows the full face of the bat in defence of this length ball on the stumps
drives to get a thick inside edge down to deep midwicket
stretches forward and defends this tossed up delivery that drifts in a long way
right on top of the bounce as he turns this wide of short leg
"not much turn, this just drifts away, AB lunges forward, covers the line and blocks"
right to the pitch of the ball as he defends this tossed up delivery on middle
goes back and across as he tucks this straight into the short leg fielder on the bounce
"shapes to play an expansive drive but he's deceived in flight, ends up pushing hard to mid-off"
<b> dropped at short leg by Bancroft. </b> This came off the splice of the bat as he looked to turn this gently. He did well to move to his left but couldn't get low enough.
gets half a stride in as he squirts this length ball into the off side
"this time, Bancroft makes no mistake at short leg. Cummins hits the deck hard, gets good bounce. Philander plays in front of the body as he's caught on the crease, came off the splice again but lobbed at a comfortable height. <B> Right at the stroke of the drinks interval </b>"
"full on off, he squirts this push into the off side to get off the mark"
"arches back and helps this short ball over the slips. What a way to bring up a hundred, his 22nd in Tests and his first since January, 2015. <b> This is his first century in 13 Tests </b> and he realises the value of it. Super, super knock"
shapes to pull but gets out of the way in the end. Paine does well to leap like a goalkeeper and stop that.
goes across and shows the full face of the bat in defence
"bounce from the rough but this is too short. It just shoots up to beat the batsman and keeper, four byes."
turns this with the spin to short midwicket
steps out to whip this away but this lobs off the pad to short leg
makes room and punches this length ball into the cover region
lunges forward to turn this past midwicket but the ball beats the inside edge to lob off the pad towards the bowler
"brain freeze from Maharaj, has it cost him? AB can't believe what he's just seen. This was nicely tossed up by Lyon, Maharaj is lured into this big, big heave with the spin. Didn't get to the pitch of the ball so didn't get the timing and power he would've liked. This would have still carried all the way if not for Khawaja's awareness. He kept his eyes on the ball, but may have miscalculated where the ropes were. As he caught the ball, his backfoot was in contact with the turf behind the ropes just before he lobbed the ball back up to catch it inside the field of play. Let-off technically. <b> Maharaj and SA will heave a sigh of relief </b>"
squirts this drive to deep point. AB refuses the single
tries to run it down but misses
"hops back and punches this length delivery into the gap at deep extra cover, Mitch Marsh comes around to stop that"
walks across the stumps and whips this length ball into the gap at deep midwicket. Excellent running
"disdainfully pulled in front of square to clear deep midwicket. Took a step outside off, but AB created the length by going deep back into the crease and put this away magically."
right behind the line of this length ball in defense
"punched into the gap at cover, AB back on strike. Easily done"
"slow turn from leg stump, tucked behind square for an easy single"
looks to whip this behind but is beaten by the turn
"on the shorter side, he goes back and across and turns this into the leg side"
lunges forward and defends to the leg side with soft hands
"another heave and he's nailed this. Saw the flight and couldn't hold back as he stepped out and launched this over wide long-on. Timed this sensationally, onto the roof. The ball bounces back into the stands."
squeezes this drive to cover
"lovely balance as he flicks this leg-stump half-volley to deep midwicket, refuses the single"
right on top of the bounce as he bunts this short of length delivery to the bowler
"crunching cover drive, but they don't take the run again. Down to sweeper cover"
"picked away towards Lyon, who dives around to stop that full-blooded flick at deep midwicket"
"too much width outside off, he runs it down to third man"
"short on middle, he moves to the leg side to make some room and gives this a proper whack. Walloped to the deep point fence"
"turns this to short fine, refuses the run though"
lunges forward and turns this wide of midwicket
"cut away but can't pick the gap, straight to backward point"
back and across as he turns this shortish delivery to square leg
"massive shout for lbw as AB is struck on the pad attempting a reverse paddle. <b> Given not out, Australia review immediately. </b> Was it turning too much? Would it have missed leg? Plenty of questions. This ball was nicely tossed up but lands on middle and leg, misses AB's paddle and hits him just below the knee roll. Hang on, there's a very very small spike, possibly off the glove. So they didn't even look at ball tracking. <b> Onfield decision of not out stays. </b> Australia have exhausted their reviews"
"angles a short ball into the stumps from around the wicket, Maharaj looks to duck but ends up having a swipe at it, beaten."
"delightful off-drive. This was floated full, Maharaj was quick to pounce on it. Intended to bowl a yorker, turned out to be a half-volley"
nails this short ball that he fetches from outside off to the deep midwicket fence. Enterprising batting that looks really fun when it comes off.
slashed away over point. Picked the bones out of this. <strong>The half-century stand is up too!</strong> Even AB enjoyed that cut.
"right into the blockhole on leg stump, kept out by Maharaj somehow. He was off balance"
"another rip-roaring yorker on the stumps, this time from around the wicket. Maharaj just about manages to get his bat down in time to keep that out"
"floats this full on off stump, defended from the crease"
right besides the line of this length ball as he defends.
scorcher of a drive but an excellent stop by Bancroft at cover
that's the end of Maharaj's cameo. Shapes to pull but this wasn't as short as he expected. Through with the swing as the ball crashed into the bails.
shows the full face of the bat and defends this full-length delivery
somehow manages to avoid this short ball as he ducks under it
dabs this incoming length delivery into the off side
"yorker-length delivery honing in towards the off stump, dug out by AB"
slashes this slightly full delivery outside off to deep point
"reaches out and cuts this short delivery to deep point, refuses the single"
"full but down leg, AB looks swing this behind square but misses"
"another full ball that is deliberately bowled down leg, AB swings and misses."
shapes to drive and gets a thick inside edge that squirts away past midwicket. Useful runs
solid thump down the ground but straight to mid-off
lobs off the shoulder to gully. Rip roaring bouncer this from Hazlewood. Ngidi doesn't show any pain but this must hurt. Smack into the right shoulder as he looked to duck under that
"shapes to help this down leg but somehow just gets some glove on it, wasn't far from Paine but AB decides to scamper the run. The throw is fired at the bowler's end where Warner fails to gather this cleanly and whip the bails off, because he was on the move."
"surely deliberate again? Fires this full and way down leg. AB can't do anything about it, Paine half-stops it. They scamper a bye. <em>Should've been called wide, me thinks</em>"
right behind the line of this full delivery as he defends. Huge round of applause from the crowd
"drilled over the bowler's head, Warner comes around and slides in a long-off before firing a throw. AB was willing Lungi on to get back and he just about manages to."
"backs away and carves this into the cover boundary. Sensational. Picked his spot to perfection. Opened up the off side, cleared the frontfoot and whacked it away"
"short outside of, AB wanted to ramp this over slip but couldn't"
"squirts this into the cover region and chances a second. Smith is superb to run in from deep cover, pick the ball up and fire a direct hit at the bowler's end. Ngidi had no chance. That's the end of that. AB walks off to a huge round of applause, South Africa have a big lead. He walks off unbeaten on 126. What a session of Test cricket we've had. <b> That's lunch on day three </b>"
"he launches his spell with a full awayswinger outside off, ignored in the channel"
"good length, pitches on a fourth-stump line and nibbles away outside off again, Bancroft does not bite"
"Philander shifts his line wider, bends away outside off, no shot again"
"pitched up and largely holds its line outside off, Bancroft does not bother with it again"
"full and attacking off stump now, Bancroft has to play at this. He inches forward, keeps the head over the ball, and defends it to the covers"
"Philander straightens his line and floats it too full, Bancroft drives it gently in the gap between mid-on and midwicket"
"red-hot stuff, he starts off with a <strong>bouncer</strong> on leg stump, aimed for the head, Warner ducks out of the way of harm"
"back of a length and skidding into the thigh, tucks up the opener for room, deflected to the leg side"
"back of a length and fizzing down leg at 140ks, Warner is a touch late onto his leg glance. Beaten"
