"fantastic start, full around off, attacking the stumps, the ball takes the outside half towards gully. Philander will keep making Bancroft play"
"on a length around off, pushed to mid-on from the crease. Again, forced to play"
"full and wide outside off, 128 kph, no need to play. Quinton's first action, he seems to have hurt his finger as he collects"
"beauty, pitches around off and because Bancroft has moved across, he feels he needs to play. He doesn't need to. <strong>Moves away and beats the edge</strong>."
"129 kph, <strong>big appeal</strong>. Philander appeals vociferously, but there was too much bounce. Good length around off, the ball moves away and beats the bat again, struck on the back thigh. High, says Faf."
"drifts down leg, 129 kph, looking for the one that tails back in. An ODI wide, but Bancroft will be happy this ain't an ODI."
"beauty! Play that, Dave. 135 kph, full delivery, pitches outside leg and darts away like an offbreak. Warner holds his bat in line, <b>the ball beats the bat</b>. A wide smile on Warner's face."
"138 kph, drifts down leg and Warner opens his account with a flick down to fine leg. One. Loud yelp of 'noo' for the second."
"a full delivery outside off, not much movement, easy enough for Bancroft to let go"
"full delivery outside off, seams back in, 137 kph, let go nicely. A confident leave, a very good stroke."
"full and straight, 137 kph, driven away to mid-on. Nice timing."
"full outside off, the ball seams back in, 137 kph, defended"
"he's always there. 129 kph, good length delivery outside off, the ball pitches and moves away to beat the bat. No chance for Warner. He didn't go chasing though."
"full on middle and leg, the ball comes back in, 128 kph, defended back this time."
"full on middle, nicely bowled, 128 kph, Warner strides forward to block."
"<strong>almost hits off stump! </strong>126 kph, full outside off, fourth-stump channel. Warner lets it go, nice judgement."
"around off on a length, 129 kph, defended to cover. A loud no"
"that's a bit too full and Warner punches a drive past mid-on for a couple. 127 kph, around middle, driven away past Faf. Some rain and so, a slow outfield."
"full and wide, too wide to even make Bancroft think about playing a stroke. Left alone."
"that's better, 139 kph outside off, and full. Asking Bancroft if he'd like to drive. He says not yet."
"143 kph, full outside off, the ball moves back in. Another leave."
"another positive leave. 136 kph, back of a length outside off, Bancroft knows where his off stump is so he lets that one go."
"140 kph, well bowled, on middle and leg, a thick inside edge towards backward square leg. That's a good line. Faf says in Afrikaans that it's a good length too."
"<strong>terrific bowling</strong>, 140 kph, full outside off, Warner wants to drive, as he usually does. But the ball pitches, moves away and beats the bat."
"back of a length around off, Bancroft stays back and pushes it back up the pitch, 129 kph."
"on the pads, 127 kph, Bancroft misses a flick, hit on the pad, ricochets away towards fine leg."
"126 kph, short and wide outside off, Warner opts to leave"
"well bowled, 127 kph, full and straight, Warner gets forward to block."
"that's short and wide, 126 kph, slashed away towards a short mid-off. Warner won't be happy with that, missing out on four runs."
"128 kph, another tight over, 128 kph, full and straight, off the pad into the leg side."
"a full delivery, seams away. Bancroft wants to lift his bat to leave, but the ball hits the withdrawing bat"
"a nice defensive block. 137 kph, full outside off, Bancroft comes forward and blocks to mid-off."
"another nice leave, full and wide, 142 kph, left alone"
"too straight this time, 137 kph, on middle and leg, driven away towards mid-on"
"<strong>opened up!</strong> 143 kph, on middle and leg, Bancroft looks to flick but the ball moves away, takes the leading edge towards point."
"139 kph, that's too straight. Bancroft misses a flick, off the pad down to fine leg. It's a maiden. Bancroft just seems to be missing many off his hips. Should have got bat on that."
"can't premeditate leaves against Philander. Full outside off, the ball cuts back in, goes between bat and pad as Bancroft brings his bat down late after wanting to leave"
"excellent bowling. Full outside off, the ball pitches, moves away and beats the bat."
"full around off, 126 kph, defended back to the bowler"
"that was in the driving slot but Bancroft misses. 126 kph, full and swinging outside away, the ball somehow beats Bancroft on the inside edge. Played for more swing than there was"
"127 kph, back of a length around off, defended into the mid-on region."
"another single off the last ball of the over. Full around middle, comes back in. Bancroft plays, gets an inside edge down to fine leg for one."
"short down leg, Bancroft lets that one go"
"good length around off, defended back up the pitch"
"that's too straight and clipped away through midwicket for the first boundary of the day. On the pads, big vacant regions."
"a good leave, back of a length outside off, 140 kph, left alone"
"back of a length outside off, moving away, left alone nicely"
"too wide, asking Bancroft to drive. Nothing doing. Another leave."
"on middle and leg, 126 kph, nudged away into the midwicket region."
"over the top of off? 128 kph, around off, the ball climbs and bounces over the stump. Good leave."
"full outside off, 128 kph, tapped away towards backward point for nothing."
"that's a bit too straight, 126 kph, around off, hit away towards cover"
"full and moving away, swing. 128 kph, no reason to play that. Good leave"
"too wide again, full and wide, left alone. A wasted delivery there."
"on the pads, Warner looks to flick, but can't make contact, hits the bat, a leading edge."
"drifts down leg this time, on the pads, strikes the pad down to fine leg for one"
"back of a length outside off, takes the outside half towards gully."
"132 kph, full delivery outside off, Bancroft plants his front foot forward and defends"
"full and swinging away, the ball pitches and moves away, another leave. Good discipline from Bancroft."
"full around off, 130 kph, blocked towards mid-off. Another maiden."
"a full delivery, swings back in, hits Warner on the pad but sliding well down leg!"
"excellent bowling, full and lulling Warner into a defensive prod. Then the ball pitches and moves away."
"back of a length on middle, hit back up the pitch"
"too straight again, drifts on the pads, hits Warner's thigh pad, then towards square leg"
"<strong>that's the one that seams back in.</strong> Another big appeal, high says Faf again. It pitches and comes back in, hits Bancroft on the back thigh. Looks very straight, but just a tad high."
"127 kph, full outside off, Bancroft plays the line, off the outside half towards gully."
"back of a length outside off, 130 kph, hit towards mid-off"
"full and angled away, good delivery. 131 kph, left alone. Fantastic discipline from these two."
"good half-stop from Philander. 136 kph, back of a length down leg, pulled away to square leg. Philander dives ti his right to prevent the ball from going through"
"full and wide outside off, too wide. Left"
"<strong>on the bounce to gully!</strong> Full on middle and leg, that line makes Warner flick, but there is some away movement. Takes the leading edge"
"another good half-stop. On the pads, 131 kph, Warner misses a flick, the ball ricochets off the pad towards de Kock, who dives to his right to save three."
"that's a good line, 126 kph, full outside off. Not on middle and leg. The ball comes back in, a solid block back."
"a thick inside edge, full on middle and leg, 129 kph, more inward movement. Off the inside edge into the pad"
"a good length delivery, 126 kph, a waft from Warner. Thick inside edge down to fine leg for one."
"zoning in on that off stump, full around off, pushed to mid-on"
"back of a length outside off, pitches and moves away, no stroke."
"full and wide outside off, keeps moving after pitching. Bancroft still not driving."
"full and wide outside off, 133 kph, left alone"
"full and wide outside off, Warner looks to drive but the ball hits the inside edge towards mid-on. That defensive mindset changing to attacking, but no timing"
"overpitched outside off, driven to mid-off. Too full."
"a full delivery outside off, 135 kph, pushed in front of mid-off for a single. Good run."
"too straight this time, nudged away into the gap at midwicket. Another boundary in that region for Bancroft."
"back of a length outside off, left alone."
short of a length on leg stump. Leaps to get on top and whip this to fine leg
short of a length and just outside off. Lots of time to spring onto the back foot and dab this in front of point
"overpitched on leg stump, Warner leans in and tickles it off his toes to give Maharaj a despairing chase. He loses to the ball. That's his first boundary"
"good length just outside off, tentative push forward to defend"
short of a length outside off and he nudges it past gully. Rabada hasn't got any movement this over
full and in at off stump. Gets too far across with the front foot and has to hurriedly open the face to poke this to extra cover
length and slanted across the corridor. Left alone
length on the pads. Deflected behind square as he looks to flick
"<B>wafts and is beaten.</b> Locked on the front foot again, this time against a bouncer outside off. Hardly has any room as he goes for the upper cut"
shot. Nicely in position this time as the length ball slants into him. Leans in and punches it past mid-on
overpitched and in on middle stump. Nudged wide of mid-on off the toe-end
drilled through the covers. Australia cashing in after the drinks break. Overpitched from Ngidi and wide outside off. Warner extends his arms and hits through the line
"length and in at leg stump, glanced to fine leg off the front foot"
the bleeding continues. Warner watches this skid off the surface outside off and slaps it on the up through cover
"<b>outside edge flies through the third slip region!</b> That fielder had just gone out to cover! Rabada gets this to move away off the surface, Warner hangs the bat out and gets a healthy edge that would've been to third slip's left"
length outside off and he leans in to push this through the now-vacant cover region
"superb hit. Through cover once again but this time with a lot more grace. Overpitched ball outside off, gets the weight into this nicely and holds the elbow high as he completes the shot"
"length and wide outside off, left alone"
<b>beaten.</b> Wobbles away from a full length after Bancroft is drawn in for a cover drive
<b>outside edge</b> between third slip and gully. Once more he isn't close to the ball with the forward press and is driving on the rise. There's movement away off the pitch as the blade comes down for the drive
good length and in the corridor. Solidly blocked on the front foot
good length and wide outside off. Left alone
"<b>what a ball!</b> That dream delivery for every fast bowler, outswinger, full and shaping away from middle stump. Bancroft closes the face too early on the flick and gets a leading edge that dribbles past gully"
length and in at leg stump. Punched to mid-on off the front foot
length and lifting up at a fifth stump line. Left alone
good length and angled into the corridor. Left alone
"sharp bouncer, but well left. Headed for his throat but he gets under it quickly"
"bouncer again, just outside off. Warner gets down on one knee to let it pass"
"good length on off stump, leans in and punches to mid-off"
and another. Length ball wide outside off. Warner brings out the axe and duly sends this to the extra cover boundary to ruin yet another over for South Africa
"short of a length outside off, cut straight to cover"
"back of a length on off stump, defended off the back foot"
"good length on off stump, blocked on the front foot"
"full on off stump, defended on the front foot"
short and wide outside off. Spanked to sweeper cover off the back foot
"overpitched on off stump, driven straight to extra cover"
thuds the thigh guard as he looks to whip through square leg. This is a length ball lifting into him
<b>beaten</b> on the outside edge. Bangs it in on a length again and nips it away off the surface. Loose attempt from the batsman
"length on middle stump, nudged to mid-on"
"short of a length just outside off, defended off the back foot"
looks for the yorker but misses. It's a full toss and he taps it to mid-on
back of a length and shaping away outside off. Left alone
"good length outside off, defended down the pitch"
back of a length and spinning into the pads. He tickles it past short fine
"good length on off stump, defended off the inside half"
"full outside off, defended on the front foot"
"full on off stump, driven straight to extra cover"
tossed up outside off and one more he can't breach extra cover with a firm drive
"<b>chases and misses.</b> Starting to offer some chances now, Bancroft. Length ball starts outside off and swings further away. He goes after it with a drive"
"pings the pad again, angling this in from a middle stump line. Bancroft late on the flick"
good length and in the corridor. Defended to cover
"length outside off, tapped wide of mid-off on the front foot"
short of a length just outside off. Defended off the back foot
good length on leg stump. Warner misses as he looks to flick
"full on off stump, driven back to the bowler"
"back of a length on middle stump, defended off the back foot"
"full on off stump, driven to long-off"
"good length on middle stump, solidly blocked on the front foot"
"tossed up on middle stump, flicked to long-on"
"good length outside off, defended on the front foot"
shifts his weight back and hammers this wide of square leg. It's aerial because he's through the shot early. Short ball on off stump and he doesn't swivel too much to hit it
<b>beaten</b> as he jabs at this on the front foot. It slants away from the corridor and past the outside edge
"overpitched on off stump, lunges forward in a rush and drills this between mid-off and non-striker"
"full on off stump, leans in and punches on the front foot. Mid-off dives to his left to stop this, but can't hold on cleanly. <b>That's fifty for Warner</b>"
<b>inside edge</b> and onto the back pad as this nips back in from outside off. He's looking to drive on the up. Shout for lbw is turned down as this trickles through the slip cordon after landing in front of Quinton de Kock's dive to the right
"full outside off, leans in and caresses it wide of mid-off"
"full on off stump, driven back to the bowler"
"short of a length outside off, pushed into the leg side off the back foot"
"good length outside off, defended on the front foot"
"full on leg stump, flicked to midwicket"
"classy. Length on middle stump, steps out to meet it at the pitch and clips it wide of mid-on with the angle"
"full on leg stump, driven to mid-on"
good length and swung away outside off. Left alone
"good length and wide outside off, left alone"
"length and shape away outside off, left alone"
"<b>got him!</b> If you sense vulnerability, you bring Vernon back! Bancroft over the last 20 minutes has been chasing deliveries outside off. Resisted thrice this over, but this one is fuller and moving away very late outside off. Draws him in, gets a thick edge and the keeper leaps to his right to take it"
"full outside off, left alone"
"another tidy end, full outside off. 125 kph, no stroke from Khawaja."
"lovely stop Faf. Overpitched outside off, drilled to cover. Past Amla. Faf runs across from mid-off to his right."
"flat outside off, slides on, left alone"
"flat and quick around off, 84 kph, right behind the line to defend"
"<strong>dropped!</strong> It doesn't stick! Slow outside off, flicked away to short leg. Doesn't even hit the hands, off the body. Markram the man."
"flight outside off, driven away to long-on"
"very tidy end, flat around off, Warner is behind the line to defend."
"drifts on the pads, 128 kph, down leg, off the pad to square leg. A leg bye."
"full on middle and leg, 130 kph, nudged away to square leg. They won't want to give him room"
"inside-edged into the pad. 127 kph, full and straight, the ball moving back in, thick edge"
"full around off, 132 kph, no movement there. Warner is behind the line to defend"
"128 kph, full outside off, defended into the off side."
"127 kph, full on middle and leg, a bit of a leading edge into the off side"
"flat and straight, nudged fine, past short fine leg for a couple"
"tossed up outside off, 83 kph, defended back."
"short and flat and quick, clipped to short fine leg"
"another fine stop from Faf. Overpitched outside off, driven away to Faf's right at mid-off. He has saved six runs since lunch."
"short and drifting down leg, nudged to short fine leg, 80 kph"
"another tidy over, 84 kph, clipped away to midwicket."
"extracting a hint of lateral movement! On a length, around middle and leg, clipped to square leg."
"full and wide outside off, 128 kph, left alone"
"<strong>holds its line!</strong> On a length outside off, 126 kph. Khawaja is careful of not leaving his off stump vulnerable so he plants his bat in line but the ball does not move. Beaten."
"<strong>edged and gone</strong>! And again, it's the replica of the previous delivery. Full outside off, he could have let that one go, but Philander is getting some inward movement. So Khawaja has to cover his off stump. He pushes at the ball, hoping the ball would move back. But it does not. The last ball followed the same modus operandi to beat the bat, this ball catches the outside edge. Amazing bowling from the Big Vern."
"full on off and middle, Smith walks right across, exposing all his stumps. Worked down to fine leg. Some oohs and aahs, settle down, he's in complete control, like he has been for the last 700 days."
"a tad wider outside off, slashed to deep point"
"81 kph, flight down leg, nudged away to midwicket"
runs down to the pitch and drives to cover.
"flat around off, pretty quick too, defended back."
"strays on the pads, somehow Warner misses a flick, struck on the pad."
"full on middle and leg, 87 kph, driven to mid-off for one. Good single."
"flat outside off, Smith goes right back and defends"
"127 kph, full on middle, blocked back."
"very tidy, around off, 131 kph, blocked"
"124 kph, back of a length outside off, punched from the back foot towards cover. The tall Ngidi gets down to his right, and half-stops it. Warner comes back for three."
"full outside off, the ball moving away. The Smith swat-leave."
"full and wide, moving further away, left alone. Not as exuberant a leave this time"
"full on middle and leg, 124 kph, worked to square leg, followed by a 'noooot nowww'"
"83 kph, flat around middle and leg, defended"
"lovely control, 85 kph, full on middle, kept out."
comes charging down and drives to cover
"flat around middle and leg, 89 kph, defended back."
he's had enough of plodding about against Maharaj. Comes charging down and launches a lofted drive over mid-off. Shot.
"strays down leg, worked away to short fine leg. Wondering why Warner isn't interested in sweeping just yet, with fine leg up. A fingerspinner wouldn't get much bounce too, negating the top edge."
"full and swinging away, left alone. This is a good strategy, let him leave and then you either stay there or bring it back in, like Dale Steyn to Steven Smith at this ground two years ago."
"good length around off, defended away to mid-on"
"a length delivery around off, Smith tries to work the ball to square leg but the ball moves away, off the leading edge."
"<b>a huuuge appeal.</b> A full delivery outside off, it comes back in prodigiously. Smith lets the ball go, it clips the side of the front pad as Smith offers no shot. HawkEye shows the ball is missing off stump."
"full around off, defended to mid-on"
"full delivery outside off, the ball moves away, defended back. A maiden from Vern, excellent bowling."
"flat and quick, on middle and leg, pushed back"
"overpitched on middle, 75 kph, another block."
"quick and straight, the leg side line seems to be working to Warner. Defended."
"very full around middle, 84 kph, smothered"
"comes down and shovels a flick to wide long-on. Rabada, as good an athlete as any in this team, stops two."
"shortish outside off, 87 kph, punched to cover from the back foot."
"short and wide outside off, slapped away to deep cover for two. That's a poor ball, he has to find his best soon to follow up a top spell from Vern."
"gone through Warner! 132 kph. A fantastic move from Faf. A full delivery on middle and leg, this one does not move. Warner plays for some, goes through his defense, beating him on the inside edge to hit the top of middle and off. A fine knock from Warner, but SA now have an opening."
"full, angled away, left alone"
"132 kph, a length delivery around middle, off the inside edge towards square leg."
"shortish outside off, 129 kph, left alone"
"back of a length on middle and leg, Marsh is on top of the bounce to defend."
"flat around off, slow too. 84 kph, right behind the line is Smith"
"nice and slow, but too full, defended"
a low full toss on the pads and Smith clips him away through midwicket with ease.
"better line, full outside off, 83 kph, defended"
"clipped away again, but bad timing, on the pads, nudged through midwicket. Amla labours after the ball"
"slow outside off, 79 kph, defended"
"fantastic bowling, full delivery outside off, the ball holds its line. Marsh lifts his hands to let that one go"
"back of a length on middle and leg, defended away towards mid-on"
"full and wide, angled away again, another nice leave."
"dug in, the bouncer down leg, Marsh thinks of pulling, bails out of the stroke late. Good change in length."
"good length and wide outside off, 129 kph, another leave"
"a maiden, 131 kph, on a length outside off, left alone by Marsh."
"that's a poor ball, short and wide, scythed away to deep point for one."
"flat outside off, 80 kph, goes through, nudged away into the leg side."
"overpitched outside off, smothered back."
"on the pads, worked away towards de Bruyn at square leg. He lets the ball go through."
"slow outside off, Smith gets forward to smother the ball back."
"too full there for Maharaj, full is fine if it's quicker. Too much time for Smith to get forward and push to long-on."
"good length delivery outside off, Smith goes back and pushes the ball to cover."
"130 kph, full around off, pushed to mid-on. A skip and jump and a not now to mid-on"
"back of a length outside off, 140 kph. Smith goes back and looks to punch the ball but the ball has been released from wider. The ball moves away <strong>and beats the bat</strong>. Stunning delivery"
"136 kph, full and wide outside off, no wafting this time, left alone."
"back of a length outside off, 130 kph, he is perched on the back foot, pushed to cover"
"back of a length around off, Smith gets across and shovels the ball into the gap at square leg for two. A manufactured stroke."
"full and straight, on middle and off, defended into the off side."
"very tidy, zoning in on off stump. That's how you earn respect of batsmen if you're mid 120s, around off, blocked"
"<strong>on the bounce to gully,</strong> 124 kph, around off, a thick outside edge towards gully, who dives to his right."
"beaten on the outside edge, 125 kph, on a length, the ball moves away prodigiously to beat the bat. All seam."
"full on middle, moves away again after pitching, pushed into the off side"
"holds its line, back of a length, 122 kph, defended to mid-off."
"full and just outside off stump. Drives halfway through his shuffle, off the back foot. Straight back to the bowler"
good length and in at off stump. Defended from the crease
slashed away. Short and wide from Ngidi and he climbs over this quickly to get it past backward point
full and in at off stump. Driven straight to mid-off
good length and just outside off. Shuffles and leaves. That moved away off the seam
"whipped to square leg, no fuss. Full ball speared in at off stump. He shuffles, allows it to come on late and picks it from about an inch in front of his back leg. Routine stuff"
full and wobbling at an off stump line. Defended on the front foot
"good length on off stump, watchfully pushed into the covers off the front foot"
good length on middle stump. Tapped wide of mid-on to steal a single
good length and just outside off. Defended on the front foot
"good length on leg stump, flicked to fine leg's left with soft hands"
"good length outside off, defended on the front foot"
<b>bottom edge</b> drops short of De Kock. Looks to cut this short ball outside off
<B>inside edge</b> to fine leg. Tentative forward press from Marsh as this slants across him
good length and in at middle stump. Tapped to midwicket from the crease
"length on off stump, nudged to midwicket off the back foot"
"short of a length outside off, punched to extra cover off the back foot"
"good length on off stump, solidly blocked on the back foot"
"short of a length on middle stump, whipped to deep square off the back foot"
"short and wide outside off, left alone"
"floated up slow on a good length, very wide outside off. Stabs at it away from the body"
"loopy again, length on middle stump. Steps out and bunts it to the bowler"
"full on off stump, driven to long-off"
tossed up slowly again and Marsh skips down the pitch to meet it on the full. Whips it to the midwicket boundary
short of a length and turning away from off stump. Punched to sweeper cover off the back foot
"good length and in at off stump, punched to midwicket off the back foot"
good length and big turn into the pads. Can't get bat on the attempted flick. It's deflected to short fine off the thigh guard
"good length outside off, tapped to midwicket off the back foot"
"length outside off, steps out and pushes into the leg side"
"tossed up on middle stump, steps out and drives to long-on"
