"full, inswinging attempted yorker, met on the full and tapped to mid-off with the full face"
"back of a length, slight angle into the corridor, sliced with a high elbow for a single to third man"
"some bounce, a mix-up, but Rahane is quickly through for the single and after Dhawan drops this angled bouncer behind point with soft hands"
"good length, no movement, slight width and left alone"
"136kph, length ball angled in at off stump, solidly defended off the back foot"
"good length at off stump, gets behind the line and opens the face to punch this past cover...it bobbles on the spongy outfield, doesn't go too far beyond the circle"
"back of a length at middle stump, spits up at Rahane who takes his bottom hand off and fends in front of his thigh guard. Trickles down to fine leg off the glove"
"back of a length, slanted across off stump, gets on top of the bounce and once more it's a soft-handed defence for a single in the point region"
"angled down leg side at a length, tucked off the hips to fine leg"
"full outside off stump, barely any feet from Dhawan as he looks for a big cover drive. Slow pitch, and he's through early. The bat turns in his hand and it dribbles gently to mid-off"
"big appeal, but big inside edge. This one swings in viciously from a length and strikes Dhawan in front of leg. Probably going down too"
"back of a length at off stump, defended off the back foot with an angled bat"
"shot. Marginally short and wide, and enough time for Rahane to hold his shape and get leg side of this before carving it behind point"
"back of a length at off stump, closes the face too early on the attempted glance, it falls pitch-side"
"good length, angled in at the pads,clipped straight to fine leg"
"<b>Dhawan has a single digit score</b> after nine 50-over innings for India. A tame shot. This is slightly short and climbing in the corridor. He arches back and looks to lift this over to the third man region - not clever, considering third man is in place. He finds him perfectly"
"back of a length at off stump, defended into the off side with the outside half of the bat"
"ooh, yes. More bounce. This is steep from back of a length, and would have had a fending Kohli in trouble if it weren't wide outside off and moving further away"
"good length outside off stump, nice forward stride to leave it alone"
"back of a length outside off stump, shape away, left alone again"
"back of a length, angled in at off stump, straightens slightly and squares him up as he defends into the off side"
"short and wide outside off, skids through quickly from under his attempted cut shot"
"well, he had to get a boundary there eventually. Good length, angled into Rahane's pads once more and this time he has reached out enough, and timed the closing of his wrists properly. Four past the keeper"
"some outswing, but too short and wide outside off stump. Rahane lets it go"
"back of a length at off stump, gets behind the line, pokes it into the off side, steals the single"
"another awkward bouncer, this one headed for Rahane's ribs. Takes his eyes off the ball along with the bottom hand off the bat, survives"
"good length, leg stump, plays this one later than the earlier ones and tucks it past square leg to pick up the double"
"shot. Inconsistent bowling, and he's made to pay. Short and wide now, Rahane quickly in position and it's a regal slap through point"
"good length, just outside off stump, left alone"
"good length at off stump, defended into the off side off the front foot"
"back of a length outside off stump, left alone, nice carry through"
"back of a length again, just outside off stump. Trying to draw that poke from Kohli, but he's happy to leave. For now."
"goes after it this time. Good length ball, swinging away outside off stump, but the stride is big and he drives this firmly to covers"
"back to short of a length, just outside off stump, Kohli chases again but it's a mistimed bunt into the off side"
"heave your sighs, West Indian fans. Follows up a nice set up outside off stump with a full toss at leg stump that is duly flicked to the square leg boundary"
"overpitched, middle stump, slight shuffle before looking to flick this. The timing is missing. Midwicket cleans up to his right"
"good length at off stump, defended off the back foot"
"good length outside off stump, Rahane leans in for the cover drive, then checks his shot. He wasn't to the pitch. Slices it to cover point"
"good length, angled in at off stump, solidly behind it to defend back down the pitch"
"back of a length at leg stump, clipped off the hips, straight to fine leg"
"good length, off stump, shuffle across, line covered, solidly defended"
"good length at middle stump, defended off the inside half of the bat, not fully in control, but fully safe in the end"
"nice. Back of a length, slight shape away from the corridor, left alone"
"full outside off stump, big stride to push this to mid-off. Then holds his shape and wonders whether that should have been driven"
"good length, off stump, dropped into the off side for a quick single"
"oh hurries him. Good line and length. So far. This jumps at Kohli as he looks to defend off the back foot, just outside off and climbs past the bat"
"<b>in the air</b> but Kyle Hope has overrun at backward point! Oh, that's some misjudgement. Holder gets another short one to climb outside off, Kohli fends at it aimlessly and gets it off the shoulder of the bat. Hope is too excited as this lobs up in the air and runs in too quickly; he's diving backwards and to his left in the end. It's a single to third man. Holder was certain he had got his counterpart"
"short and wide outside off stump, left alone"
"brace yourselves. Another bouncer in the corridor and this time Kohli goes for the hook. Comprehensively beaten. He's an annoyed man now, is Kohli"
"back of a length outside off stump, watchfully left alone"
"back of a length at middle stump, shuffles across and tucks this off his mid-riff to square leg. Rahane wants the run, but he's sent back. Gets in between the stumps and the throw on his way back, but it wasn't intentional"
"ah, he's camping on the back foot now and he gets a short ball at leg stump. On his toes quickly, and whips this fine with agile hands"
shot. Straight to mid-off. Leans in nicely on this full ball outside off stump
"back of a length at off stump, pushed into the off side with soft hands, good running"
"good length at off stump, pushed on the up to mid-off"
"back of a length at off stump, open-faced defence into the gully region"
"<b>oh good catch!</b> Kyle Hope has made amends! Back of a length outside off stump, he's on the front foot early and then he sees this lift up off the pitch. It's chest height and he pokes at it. Thick outside edge that hangs to the left of gully for a moment, before the fielder there, Hope, leaps one-handed to his left and gets rid of Kohli. Holder has his man"
"short ball at the ribs, middle stump-ish, he jumps up to tuck this behind square, can't get it past the keeper"
"good length, corridor, defended to point with an open face"
"<b>hello!</b> There's something in this pitch at the moment. This is slanted across off stump, back of a length. Yuvraj wants to defend off the back foot, but the bat is barely offered as this fizzes past the outside edge"
"good length, off stump, solidly defended into the off side"
"back of a length at middle stump, turned off his thigh to deep square"
"short ball, aimed for the throat, but not quite quick enough for this pitch. Yuvraj inside the line as he ducks this"
"good length at middle stump, flicked to deep square"
"short ball, has Rahane jumping, but it's too far wide outside off stump"
"full outside off stump, defended into the off side off the front foot"
"short and angled across the corridor, there's that bounce again, and it takes the ball past the attempted pull shot"
"back of a length, starts on leg stump, swings further down and past the flick"
"back of a length, just outside off stump, defended into the off side and Rahane responds"
"short ball outside off stump, Rahane is quick to get his arms out of the way. Has he decided to play the opening bowlers out? A change coming soon, surely"
"short and wide outside off stump, left alone"
"short ball aimed for off stump, Rahane is nervous as he defends this. The bat is up early and he's barely looking at it as he fends"
"back of a length outside off stump, watches it onto the bat and drops it in front of gully...who is quick to release but can't hit the stumps as Yuvraj tries to makes his ground"
"back of a length, pitches outside off, nips in and flies through to the keeper as Rahane lets it go"
"back of a length in the corridor, hits the bat hard as he defends off the back foot"
"good length, just outside off, tapped gently on the up into the covers"
"back of a length outside off stump, mistimed back foot punch, straight back to the bowler"
"goes for the cut after a long time, and gets a thick outside edge. This skidded through from back of a length. It's flat off the bat and lands before third man gets to it"
"good length at leg stump, whipped to deep square leg"
"tossed up at off stump, gets to the pitch, drives to long-off"
"back of a length, pushed through flat at middle stump, poked to midwicket"
"floated full outside off stump, a controlled drive to long-off"
"a flowing cover drive. Gets to the pitch outside off stump, extends the arms, gets it wide of sweeper cover. Sluggish outfield"
"good length at off stump, defended off the front foot"
"good length, flat, middle stump, flicked to midwicket"
"good length, angled down leg"
"<b>edge flies past the keeper.</b> Back of a length, climbing in the corridor as he slashes at this. A healthy outside edge, but there's no slip"
"back of a length outside off stump, a more controlled cut this time, squeezes it betwee point and cover point"
"short ball, corridor, drops the bat, lets it go"
"yikes. Sharp bounce. This is dug in short, but I don't think he expected it to get that high when delivered it. Rahane gets everything out of the way outside off, falls to the floor, as he leaves this"
"back of a length at off stump, defended off the back foot"
"good length, off stump, defended to point off the front foot"
"good length at middle stump, forward defence"
"good length, middle stump, tickled through square leg off the front foot"
"good length at off stump, pushed into the off side on the up"
"good length at off stump, stride forward, flicked through square leg"
"drifted in at leg stump, overpitched, punched to long-on"
"back of a length outside off, back foot punch straight to extra cover"
"length ball slanted away from the left-hander's off stump. Yuvraj plays with an open bat face, wide of gully"
"back of a length, close to off stump, stabbed down to third man"
"back of a length, angling across towards off stump, opens his bat face to push into the point region"
"short now, rising just over waist high, angling into the body. Rahane pulls to deep square leg"
"oh man. <b>No slip in place</b>, and this one goes through that vacant space at chest height. Back of a length, angling into the corridor. Again Yuvraj goes for that open-faced steer, and this one bounces a touch extra and flies off the edge"
"and again, that uncertain flirt outside off stump. Gets it to move away off the seam slightly from just back of a length, and it slides past the outside edge"
"flat, shortish, just outside off, pulled to deep midwicket"
"fullish on off stump, blocked to short extra-cover"
"length ball, drifts in from around the wicket and continues on with that angle. Plays for the turn in defence, the ball slides into the leg side off the inside half of the bat"
"back of a length, close to off stump, dabbed towards backward point"
"length ball, goes with the arm towards off stump, defended with soft hands into the off side - may have bounced a touch extra"
"loses his line a little, slides down the leg side"
"back to that off-stump line, Yuvraj defends from a half-forward position"
"shortish, angling into Rahane's body. Hops in the air, tucks it off his hip down to fine leg"
"back of a length outside off, stabbed to point"
"length ball in the corridor, Yuvraj trusts the angle from right-arm over and leaves it alone"
"shorter now, and he takes one good step back, and the angle gives him just the width he needs to roll his wrists over and cut to the left of backward point"
"full, just outside off stump. Yuvraj dives firmly and Lewis dives left at cover to stop it"
"slower ball, full outside off. Rahane leaves it alone"
sees some flight outside off and steps out to drive to long-off
"back of a length close to off stump, goes deep in his crease and punches to the right of backward point"
"full on off stump, blocked back to the bowler"
"angles into the pads this time, clipped through square leg"
"floated up just outside off, steered towards backward point"
"quicker and flatter, just outside off. Goes back, looks for the soft-hands single towards point, but the keeper dashes out to deny Rahane"
"short, sits up at chest height on off stump. Yuvraj barely moves, just swivels, meets it on top of the bounce, and pulls to the deep midwicket boundary"
"length ball close to off stump, defended firmly to cover"
"again that dangerous open-faced steer. Back of a length, slanting into the corridor, waits and steers to third man"
"another full slower ball outside off, another leave from Rahane. The ball rolls through to Shai Hope"
"another slower ball outside off, this time Rahane gets a big stride forward and punches to mid-off"
"ooh, good ball. Bangs it in short and angles it in from wide of the crease. Rahane bends down low at the knees, sways his upper body away from the line, and keeps his eye on the ball, looking to ramp it to third man. Can't put bat to ball, though"
"full on off and middle, driven to long-on"
"flat, angling into middle stump, goes back to clip through square leg"
"back of a length on middle stump, punches with a nice, straight bat to long-on"
"flighted and full on off stump, clipped to long-on"
"down the track now to the tossed-up ball on middle and off, looks to clip to long-on and short midwicket dives to get in the way"
"quicker now, on off stump, defended to short cover"
"quickish and full on off stump, blocked back to the bowler"
"back of a length on off stump, punched to extra-cover"
back of a length on off and middle. This time Rahane swings his front leg out of the way and pulls down to long-on
"tosses it up and gets it to dip onto a good length on leg stump. Beats the inside edge as he comes forward to defend, hits front pad. Probably sliding down leg. <b>Hang on, ball-tracking suggests it was hitting middle stump</b>. Didn't turn as much as I thought. Not much of an appeal at all"
"back of a length now, punched to midwicket"
"tossed up nicely on middle stump, gets a good stride forward to defend"
"down the track now, whips with the turn from off stump to the right of midwicket"
"tossed up full on off stump. Drives, looking to hit towards long-off, the bowler moves quickly to his right to intercept"
"on middle and off now, driven to long-on"
"back of a length, skids through quickly and hits Rahane's in front of middle stump as he tries to play across the line. Probably an inside-edge, again not much of an lbw appeal"
"fuller now, driven to long-on"
"top-edge, but that's in the gap. Sweeps from middle and leg, and it was a little too quick for him to get down fully. Ball bounces a touch extra. Into the gap to the right of short fine leg"
"shortish and flat on leg stump, punched to long-on"
"back of a length, tucks him up for room, punched to midwicket"
this one's more on off stump and he goes back and makes room to punch through cover
"full now, on leg stump, shows the full face to push to long-on"
"short, a bit of width, slapped to sweeper cover"
"length ball on leg stump, gets forward to clip into the square leg region"
"back of a length outside off, lets it come on and dabs to the right of short third man"
"down the track now, not quite to the pitch of this quickish ball, blocks it back to the bowler"
"flat on off stump, stays back to defend into the covers"
"a bit of flight outside off, comes out of his crease to drive to cover"
"shhortish, some width, chopped to short third man"
"quickish length ball just outside off, stays back to stab into the covers"
"flat, just outside off, looks to make room to cut but it isn't short enough. Bends low to chop into the cover point region"
"lbw appeal, much louder this time, as Yuvraj comes forward hesitantly to defend. Given not out, they've reviewed this time... Again Bishoo gets it to dip onto a lovely length - straightens just enough to clip the front pad before it hits Yuvraj's inside edge. He's only half forward. Pitches just inside the line, leg-stumpish, and ball-tracking says it's hitting off stump. Excellent delivery, not the greatest technique against spin, and Yuvraj has to go"
"good ball first up, flighted, just outside off. Dhoni isn't fully forward to drive, compensates with a roll of his bottom wrist to play that towards short extra-cover"
"quicker now, a little closer to off stump, jabbed towards short extra-cover again"
a bit more flight and he's out of his crease to push down to long-on
"back of a length, slides on with the angle towards off stump. Rahane wants to punch through cover point but he's cramped for room, plays it a short distance to the left of the bowler instead"
"back of a length, angling into middle and leg. Lets it come on and tucks it into the square leg region"
"short, angling into the ribs. Rahane jumps to ride the bounce and drops it down into the leg side with soft hands"
shortish on leg stump. Jumps across and flicks off his hip to long leg
"shortish again, angling into the body, Rahane works it down to long leg"
"a bit of bounce from just back of a length, angling into off stump. Dhoni drops his bottom hand while defending and it hits the bat handle, drops softly into the leg side"
"short outside off, Dhoni pulls to deep square leg"
"short outside off, chopped away to deep point"
"short and wide once more, slapped to sweeper cover"
down the track now and Bishoo bowls it full and fairly wide outside off. Dhoni jumps across and clips to midwicket
"short outside off, cut away to that man at deep point/sweeper cover again"
"seems to be his stock ball for the over, short and wide. This time it doesn't quite come on. Rahane slaps it straighter than previously and Lewis dives left from extra-cover to stop it"
"back of a length, closer to off stump, punched to long-off"
"shortish, angling in from wide of the crease and denying Rahane room to cut. Chops it down to backward point"
"shortish outside off, gets on his toes to dab it down to third man and bring up fifty"
"shortish on off stump, played down to midwicket with a turn of the wrists"
"short in the corridor, jumps to ride the bounce and stabs it into the gap between backward point and cover point. Prioritised placement over power there, deft use of the hands"
"shortish, angling into off stump, uses the angle to work it down to long leg"
"ooh, that's awkward from Dhoni. Short, rising ball in the fifth-stump channel, and Dhoni, for some reason, jumped across and closed his bat face to play into the on side. Thick outside edge runs away to the third man boundary. Looks like the ball jammed his right thumb into the handle"
"full, flat, wide of off, left alone"
"wide-ish, just back of a length, leans back to cut, gets a thick outside edge wide of the keeper"
"slower and fuller now, driven to long-off"
"back of a length on off stump, rocks back, makes room, and punches to cover point"
"ooh, sneaks through. Not short or wide enough to cut and it goes under his angled bat"
"back of a length outside off, stabbed to backward point"
"back of a length, angling down leg, hits Rahane's thigh pad as he misses the flick"
"back of a length, close to off stump, punched to extra-cover"
"short, angling into the body, swivels to pull to long leg"
"ooh, extra bounce outside off. Short, Rahane wanted to pull, and he half-aborted the shot as the ball rose above his shoulder"
"short again, this one doesn't get up much, only to hip height. Keeps his eye on it and plays a controlled pull down to long leg"
"digs it in again, this time it gets up to neck height. Angled into the body again and he's off his feet, drops his bottom hand, and keeps it down well enough despite fending a little awkwardly at it"
"ooh, Dhoni in a tangle again. Flat and full on off stump. Looks to jab into the covers without much of a front-foot stride. Goes with the angle and hits his inside edge, rolls into the leg side"
"not too much room to cut, stabbed to backward point"
this one's wider but he cuts straight to backward point
"full and flighted wide of off, left alone"
"a touch short outside off, chopped into the cover point region"
"back of a length outside off, punched to extra-cover"
"back of a length on off stump, jumps back and across to defend towards mid-on"
"short, rising to shoulder height, plays a half-pull, half defensive jab down to midwicket"
"straighter now, tucked off the hip to fine leg"
"getting a little predictable with his length here, and Rahane may have premeditated a little. Short, rising over off stump, and he cleared his front leg almost before Holder had delivered, and swivelled to pull, just about clears the forward square leg boundary. Hits the cushions on the full, actually"
looks for that ramp over the keeper this time. He likes that shot whenever it's short and rising outside off. Couldn't put bat on ball this time
"back of a length, close to off stump, punched back towards the bowler"
"short and wide, chopped straight to point"
"good length, slides through outside off stump and under Dhoni's attempted slice"
"back of a length, pushed through flat, mistimed back foot punch goes straight to extra cover"
"slides another one wide, this one is past the wide marker"
"back of a length outsdie off stump, reaches out and pokes this to extra cover"
"good length, fourth stump, thick outside edge as he looks to bludgeon this"
"back of a length outside off stump, finds a deep-ish extra cover with the back foot punch"
"short outside off stump, hurries him on the back foot, finds extra cover with the punch"
"drags this good length ball from outside off with a sweep, hits it straight to square leg"
"full at off stump, pushed back down the pitch"
"good length, flat at middle stump, puts his front leg across and clips this wide of mid-on"
"back of a length outside off stump, punched forcefully off the back foot, straight to long-off"
"good length ball, it's flat and he has to put a lot of effort to reach it after stepping out. Does so, barely, and turns it to deep square leg"
"jumps down the track, meets the good length ball at the pitch, drives to long-off"
and out comes the big swing. Not quickly enough. He's yorked outside off stump. Jams it into the pitch and back to the bowler
"slider, full and wide outside off stump, Dhoni shoulders arms, it was just inside the marker"
"short ball, slid through outside off stump, under-edges the cut into the off side"
"smash. Anticipates the wide line, gets on one knee and meets this as it pitches. Brings down the axe on it and bisects the non-striker and the stumps. Long-on didn't move"
"short at middle stump, thumped off the back foot to long-on"
"full and drifted away from off stump, driven straight to extra cover"
nicely placed. Another one drifted full outside off. This time he follows it with his hands and pokes it past backward point
"good length, drifting away from off stump, thick outside edge on the push, straight to backward point"
"length, middle stump, flicked straight to square leg"
"tossed up at middle stump, driven to long-on off the meat"
"full and flat outside off stump, driven to sweeper cover"
"good length, wrong'un outsdie off stump, driven on the up to long-off"
"dropped short outside off stump, clubbed, flat-batted past the bowler. That off side field is impenetrable so he goes straight"
<b>well there is the slog</b> and it's ended up being a top edge that neither midwicket - running back - nor long-on - running in - can get to. An old fashioned slog sweep gone wrong and in the end it's two caps and a ball on the floor
"back of a length at off stump, pushed to extra cover"
"<b>dropped.</b> Dhoni steps out, can't get to the pitch outside off stump. Swipes across the line and gets a leading edge that hangs agonisingly for backward point who dives to his left and can't hold on. Catchable."
"yorker outsdie off stump, jammed out to extra cover"
"steps out, takes it on the full outside off, flicks straight to midwicket"
"good length at off stump, watches it onto the bat, drops it into the off side, no run"
"full ball, drifted wide outside off stump, drilled straight to extra cover"
"hangs back in his delivery stride, watches the batsman come out and fires a low full toss at middle stump. Flicked to deep midwicket"
"overpitched at middle stump, a bit of a flourish with the backlift, but it's gentle push to long-on in the end"
"good length at middle stump, Rahane not to the pitch, reaches out with his back leg in the air. All that and then he finds midwicket with the flick"
"back of a length outside off stump, punched to sweeper cover who has finally gone out for Dhoni"
"back of a length outside off stump, steps out and slices it uppishly to sweeper cover"
"<b>oh come on.</b> He's completely foxed the batsman but it's been called a wide. Saw him coming, pushed a legspinner wide. Dhoni quickly retracted and went back into the crease"
"catch it...says no one. Full ball outside off stump, gets under it and creams it over the bowler's head"
"back of a length outside off stump, cut to find sweeper cover"
