"good length, fired in fast at leg stump, punched to deep midwicket's right off the back foot"
"76 kph, floated right up at leg stump, paddled - off the top edge - to fine leg's right"
"good length at off stump, defended into the off side"
"good length, middle stump, forward defence down the pitch"
"good length, off stump, defended off the back foot"
"nice...from the bowler anyway. Good length at off stump, draws him forward and gets an outside edge. Rahane gets down too slowly at backward point"
"aw, come on. Quick and short at middle stump, he's looking towards the square leg boundary as he swats across the line, and gets a leading edge that goes past the keeper"
"back of a length at off stump, defended into the off side"
again. This time the edge goes higher and swerves towards fine leg after starting at a first slip kind of line. It's four more over the keeper as he looks to pull this from off stump
"good length, fired down the leg side. He looks to flick and gets a pad on it. Through to Dhoni who appeals. Not out"
"back of a length at off stump, hurriedly defended into the off side"
"good length at off stump, back foot defence"
"good length at leg stump, forced off the back foot to square leg"
"good length at leg stump, tucked off the pads to deep square"
"full ball at middle stump, flicked to deep square leg"
"good length at off stump, looks to drop this into the off side for a quick single, hits it too well"
"good length at off stump, inside edge onto pad as he defends"
"short and slightly wide outside off stump. Gets it to bounce as well, but the cut is nicely controlled and placed well to sweeper cover's left"
"bouncer pitches outside off and dips in at the batsman, who sways backwards and leaves it alone"
<b>creamed.</b> That could well be the first controlled pull shot of the day. Short at off stump and he climbs into this off the front foot and slaps it through midwicket
"and he lets the next bouncer go, similar line to the last ball"
"glorious. Hardik bowls the full delivery, Powell is wary of the change up. Plants the front leg down to reach this outside off stump, and maintains the balance as he lifts this over mid-off"
"good length outside off stump, left alone. Why wouldn't he? 8 off the over already"
"back of a length, nips in and thuds into the thigh guard as he looks to defend, possibly via glove"
"good length, pushed flat at off stump, pushed back to the bowler off the back foot"
"back of a length outside off stump, spins it back in sharply, cramps him on the cut"
"good length, drifts away and pitches outside off, sheepish defence back to the bowler"
"good length at off stump, forward defence"
"good length, leg stump, pushed to square leg off the back foot"
"good length, leg stump, defended to midwicket"
"tossed up at middle stump, skewed drive off the inside half to midwicket"
"full toss at leg stump, flicked to midwicket's right...where Kohli puts in a mega-dive and releases the ball quickly after reaching it"
"good length at middle stump, defended aerially down the pitch"
"wrong'un, good length at middle stump. Goes for the big sweep, misses it and he's crouched as this hits him on the back in front of middle stump. Rules not out, no review taken"
"wrong'un, good length, off stump, beats him on the outside edge"
"good length at leg stump, driven to long-on"
"carrom ball, full outside off stump. Angled bat offered, leading edge found."
"another carrom ball, full at middle stump, poked nervously off the front foot"
"good length, pushed flat at leg stump and he catches his pads. Appeals loudly and isn't aware of the run out opportunity at the non-striker's end. Misses the throw. Batsman was short"
"good length at leg stump, shovelled behind square on the leg side"
"back of a length, flat at off stump, squeezed through cover point off the back foot with exposed stumps"
"full outside off stump, gets the front leg out of the way to try and hammer this through the off side, can't connect. Finds extra cover"
"wrong'un, but too short. Picked off middle stump, pushed to midwicket's right"
"full, leg stump and he misses the drive. Hits him on the back leg and the appeal is turned down. That was going down leg"
"good length at middle stump, defended off the inside half of the bat"
"<b>holes out.</b> The pressure was built, the time was ripe for a wrong'un, and pop it came. Good length, turning away from off stump, and climbing too steeply for that slog sweep. Hardik calls from long leg and deep midwicket allows him to get under it and pouch it comfortably"
"wrong'un, pitches outside leg stump and climbs from a length, awkwardly fended into the leg side"
"good length, pushed flat at middle stump. He walks across and plays this off middle stump, very late. Yuvraj forced to dive to his right at short fine"
"no messing around from Nurse. Gets a nice drifted full ball outside off, gets to the pitch and lifts it past mid-off"
"full, flat middle stump, pushed to midwicket"
"good length at off stump, forward defence"
"back of a length, down leg side"
"good length at off stump, sharp turn in, gets the inside half of the bat on the defence"
short and moving away from the right hander who slices it behind square on the off side
"<b>Umesh dives and holds on to his left.</b> That's a very very good catch. This is tossed up at middle stump and it dips at Nurse, who is only worried about sending this flying over the midwicket boundary. He can't reach the ball and gets it off the inside half of a turning bat. Umesh leaps to his left at square leg to hold on to this"
"back of a length, turns in to cramp Mohammed, punched back to the bowler"
"fuller, on leg stump, blocked to midwicket"
"on off stump now, slower, goes deep in his crease to dab into the cover point region"
"length ball pitching outside leg and turning back into the stumps, Bishoo plays back, looks to flick, and the ball hits him on the pad"
"back of a length, turns away from the left-hander's off stump, goes back to punch to deep point"
tossed up on off stump and Mohammed pushes to mid-off for the quick single
"flat, angling into the pads, clipped to the right of midwicket"
"oh, that's a beauty. Did it turn enough, though? Sliding down leg, I think. Loads of drift into the left-hander from around the wicket to strike pad. Didn't seem to straighten enough as he looked to drive to mid-off, played outside the line"
"not quite short enough to cut, plays and misses"
"tossed up now, defended back to the bowler"
"arm ball now, drifting in towards off stump, comes forward to defend and it hits the inside half of the bat"
a bit slower now and Bishoo sweeps it away to deep square leg
"tossed up outside off, shows the full face to drive down to long-off"
"short, rocks back and pulls in the air, but on the bounce, to long-on"
"shortish on off stump, chopped away to the left of sweeper cover"
"googly, doesn't really turn, goes with the angle towards off stump and he goes on the back foot to defend"
"oh no. Mohammed was looking good, and now he's out to a poor choice of shot. Looks to sweep from the stumps, and goes after one that's too full. It hits his front foot almost on the full. Yorked the boot. He's called for a review, but this just looked plumb on first viewing... No inside-edge. Pitches on middle, straightening to hit low on middle, and it's even plumber after ball-tracking has its say"
"googly, flighted nicely outside off. Comes forward to defend and the inside edge pops up into the vacant short leg region. Kuldeep finishes with 3-41. He took three in the previous game too"
"there's that swinging arm ball again. Plays back to a fairly full ball, blocks to midwicket"
"play and miss, looks to stab at one that's a little shorter outside off, but it wasn't short enough"
"gone, that's Ashwin's 150th in ODIs. An excellent delivery to bring up the milestone. Cummins was playing everything off the back foot, and Ashwin bowled that arm ball again. It was too full to be playing back to, and by the time the bat came down in defence, it had slid through and struck his back pad in front of middle stump"
"oh, good ball. A bit of away-drift late in its flight even though it was fairly flat, on off and middle. Came forward, defended slightly inside the line, and the ball rolled towards backward point off the outside half of the bat"
"back of a length, that arm ball again, swinging towards off stump. Nicely back and across to defend"
"tossed up slower, just outside off, stretches out and defends with soft hands"
"the man has a golden arm, and he strikes first ball to finish off this match. Nicely bowled, a bit of drift away from the right-hander, who plays inside the line while defending. Beats the outside edge but spins back just enough to hit off stump"
