"full on middle, but swinging down the leg side. The ball stays low too, and the keeper has to put in a dive"
"full on middle, and angling into his pads. Flicks it off his legs past the midwicket region with ease for the session's first boundary"
"full outside off, and he gets onto the front foot to play the drive. Hit straight to mid off"
"full outside off, and driven past the cover region. Work for Herath, who scampers across the ground to clean up. They'll take two"
"full on leg, and Bishoo clips it off his toes to the man at fine leg. They jog across for the single"
"back of a length on off, but angling down the leg side. Cramps the batsman up slightly, but he still manages to stay away from the ball"
"fuller outside off, and he goes for the drive. Takes the <b>outside edge</b> and flies past second slip. Races away for a boundary. If only there was a third slip..."
"bangs it in short, but there's really no bounce. Pitches on off, and angles down the leg side. The keeper collects on the bounce"
"length ball outside off, and Dowrich tries to defend off the back foot. Played down the wrong line, and the ball goes just past his outside edge. That'll keep Sri Lanka interested"
"full outside off, and Dowrich is happy to shoulder his arms. Safely sees the over out"
"full on off, and defended off the front foot"
"length ball outside off. Spinning slightly away, and Bishoo fends it with soft hands. Played to first slip"
"full, and outside off again. Bishoo keeps his hands soft, and blocks towards the offside"
"extra flight this time, and it lands on middle stump. Almost a yorker, and Bishoo digs it back to the bowler"
"full on off, and defended off the front foot to the man at cover point. Carefully played"
"gives it a rip, and it lands outside off. Bishoo takes a big stride forward and blocks it to cover point. <b>Maiden</b>"
"<b>big appeal for lbw!</b> But not given. It was a length ball outside off that jagged in sharply. The batsman was trapped in front of his crease, and the ball hit his back leg. <b>Sri Lanka are reviewing.</b> Hits him above the knee roll, and impact's umpire's call, and it's umpire's call on wickets as well. The batsman survives, but Sri Lanka retain the review."
"length ball on off, and going down the leg side. Dowrich shuffles towards the off side, but doesn't get contact off his bat"
"awry! Back of a length on middle, and going way down the leg side. The keeper does well to collect it"
"full, and just outside off. Forces Dowrich to play at it, and he drives it to the fielder at cover"
"full on off, and that's been comfortably clipped off his pads to deep backward square leg. Enough time to jog back for the second run"
"back of a length outside off, but angling into his body. Tries to work it towards square leg, but the ball hits his pads instead. They walk across for the run anyway"
"full on middle stump, and spinning into his body. Too much turn, infact. Goes down the leg side"
"full outside off, and this time he drives it down the ground. Straight to mid off"
"arm ball outside off, and the ball goes straight through. Dowrich is happy to let it go"
"tossed up outside off, and Dowrich blocks off the front foot"
"full just outside off, and he brings his front foot forward to block once again"
"Dowrich is clueless! Full outside off, and Dowrich tries to defend for the turn. It doesn's spin, and the ball zips just past his outside edge. Phew"
"length ball outside off, and Bishoo blocks it off the back foot. Off the bat's middle"
"back of a length outside off, and Bishoo backs away to make some room. Taps it to cover point and gets off strike"
"back of a length on off, but angling into his body. Too much angle, in fact. Goes down the leg side"
"length ball outside off, and that's been stylishly cut away. Plays it front of his body, but well stopped by short cover. Gets his hands to it, and saves three for certain"
"pitches on leg, and angling across Bishoo's body. He punches it to cover and scampers across for one"
"back of a length outside off, and he sticks his bat out. Cuts it to gully, and the fielder misfields! Lets it go through, with allows Dowrich to keep strike for the next over. Dilruwan the fielder"
"full just outside off, and defended with soft hands towards point. A comfortable run"
"full outside off, and turning away from the left-hander. He defends at it, but the ball takes the outside edge. Goes just past first slip"
"full outside off, and Bishoo comes forward to meet it on the full. Defended to cover"
"full on off and going straight through. Angling into his pads, and Bishoo does well to defend it towards the leg side"
"full just outside off, and defended towards the off side. Once again quick to get onto the front foot"
"full just outside off, and turning further away. Defended with the bat's angled face to point"
"length ball on off, and that's been whipped off the back foot to deep backward square. <B>Partnership of 52 now</b>"
"<b>just over mid off!</b> Full outside off, and Bishoo uses his feet to get to the pitch of the ball. Lifts it over the bowler, and Kumara - at mid off - reacts just a bit slowly. Goes over his outstretched hands"
"full just outside off, and this time he defends carefully off the front foot"
"length ball outside off, and he stays on the back foot. Blocked towards the off side"
"full on middle and leg, and Bishoo muscles this to the man at square leg. The fielder ensures Bishoo can't get off strike"
"flighted, and lands outside off. Turns sharply into his pads, but Bishoo manages to play it towards the leg side"
"full outside off, and spinning inwards. Driven to mid on"
""
"length ball outside off, and spinning away from him. This time he confidently cuts it past backward point for two more"
"full just outside off, and he blocks it off the front foot. This should frustrate the SL bowlers"
"pitches just outside off, and attempts to play the drive. Flays it past cover point instead"
"full on off, and Dowrich gets to the pitch of the delivery. Defends it back to Perera"
"so close! Full outside off, and spinning inwards. Bishoo tried to defend, but played it down the wrong line. Goes just past the bat's outside edge to the keeper"
"full outside off, and blocked off the front foot"
"length ball outside off, and spinning into Bishoo. He makes some room and then taps it with soft hands towards cover point"
"length ball on off, and Bishoo stays on the back foot. Taps it towards the off side"
"wide outside off, and Bishoo backs away before punching it back to Herath"
"full just on off, and Dowrich comes onto the front foot to see the over out. Defended back to the bowler"
"full on middle, and Bishoo goes deep into his crease. Flicks it towards deep backward square leg"
full on off and he comes forward to defend. Blocked back to Perera
"full on off, and turning away from Bishoo. He leans into a drive, and plays it towards cover"
"flighted, and lands on middle. Bishoo awkwardly defends towards the leg side. The ball didn't turn, and that's why he had to adjust his shot"
full on middle and going straight through. Bishoo blocks with ease
"extra flight this time, but Bishoo's up for the challenge. Drives it towards the non-striker on this occasion"
"full on off, and that's been swept hard! Roshen Silva - at short leg - takes a blow. Where's he hurt?! He's grimacing on the floor. Hits his left knee, ouch. A difficult chance, but Dowrich could've been out if Roshen managed to catch it.  <b>He's walking out with the help of the physio</b>"
"full just outside off, and driven straight back to the bowler"
"length ball on middle, and Dowrich goes onto the back foot. Punches it to mid on this time"
"full on off, and Dowrich gets inside the line of the ball. Defends it towards the non-striker"
"full just outside off, and Dowrich takes a big stride forward. Defends towards the off side"
"length ball outside off, and he goes to the back foot. Fended to mid off"
"full on off, and turning away from him. Bishoo manages to block it towards cover point though"
"flighted outside leg stump. Bishoo gets his front foot towards the pitch of the ball, and pushes it towards the bowler"
"full on leg, and turning across the batsman. Blocked off the front foot once again"
"full on middle, and defended towards the leg side this time. Always ensuring he plays with soft hands with slip and short leg lurking"
"length ball on leg stump, and that's been fended off the back foot. Soft hands again"
"flighted on off, and blocked off the front foot. Plays it to cover point this time"
"full just outside off, and spinning into his body. Defended"
stays low!  Full on middle and going down the leg side. Dowrich tries to flick it square but the ball hits his front pad. Impact outside leg
""
"length ball outside off, and Bishoo is forced to reach at it. Taps it towards point off the back foot"
"a lot of flight offered, but the ball's too wide outside off. Taps it off the back foot to deep point, and <b>West Indies reach 300!</b>"
"flighted on middle, and he punches it off the back foot to midwicket. Easily negated by Dowrich"
"length ball on leg, and turning across the left-hander. He backs away and flays it towards cover point"
"drops his length a bit more, and the ball generates some extra bounce! Bishoo opens his bat'sn face and cuts towards point"
"full on off, and Bishoo cuts it with the bat's angled face to deep point"
""
"full on middle, and that's been easily driven to long on for a walking single"
"full on middle and leg, and Bishoo takes a big stride forward. Defended towards mid on"
"full just outside off, and spinning into the batsman. Driven to mid off this time"
"full outside off, straightens after pitching. Carefully watches it, Dowrich, before blocking it with soft hands"
"tossed up outside off, and that's been caressed off the front foot. Straight to cover though"
"full on off, and blocked off the front foot by Dowrich"
"full on off again, and this time Dowrich's front-foot defense finds its way to long off"
"full just outside off, but Bishoo defends it firmly to cover. No turn from Herath this time"
"full just outside off, blocked off the front foot"
"full on off, and spinning into his pads. Tapped to mid on"
"full on middle, and Dowrich gets inside the line of the ball. Drives it to long on, and that's a lot of time for the batsman to take the single"
"full on middle stump, and angling into his pads. Nudges it off the bat's inside half to square leg. Short leg goes chasing after it, and that allows Bishoo to get off strike"
"full just outside off, and fended off the front foot to the bowler"
"full just outside off, and fended with the turn towards the leg side. Smothers it to the vacant region in front of short leg"
"wild shot from Bishoo! Short on leg, and he tries to pull it towards fine leg. Makes absolutely no contact"
"back of a length on leg, and angling across the batsman's body. Fended off the back foot towards short cover on this occasion"
"full on off, and swinging across the batsman. Takes a big stride forward and defends it to cover"
"length ball on off, and Bishoo simply sticks his bat out with the ball angling across him. Manages to under-cut it past short third man, and Lakmal has to give it a chase"
"full just on off, and that's been blocked off the back foot. Ensured he shuffled behind the line of the delivery"
"full outside off, and angling further away. Through to the keeper, and Bishoo's surprised that's not been called a wide"
"full on off, and fended off the front foot"
"full outside off, and turning into his pads. Blocked once more"
"length ball outside off, and that's been whipped off his pads to deep backward square leg. Played too well, so that means it's only a single"
"full just outside off, and that's been driven back to the bowler"
"full outside off, but spinning into Bishoo. Big stride forward, and blocked thereafter"
"full on leg stump, and that's been defended to the bowler once more. Easy peasy"
"full outside off, but the ball swings in sharply. Aimed at Dowrich's pads, but he manages to turn it towards the leg side"
"length ball outside off, but once again some inward movement. Stands tall and punches it to mid off"
"length ball outside off, but doesn't swing in this time. Tapped off the back foot to the vacant point region on this occasion"
"wayward! Short, but way down the leg side. Forces the keeper to go tumbling to his right"
"shouts of 'catch it', but lands short of gully. Short ball, and surprises Bishoo this time. He tried to play it towards point, but the ball found the top edge of Bishoo's bat. Lands short though"
"length ball on middle, and that's been blocked off the back foot. Sees the over out"
"length ball on off, and turning into Dowrich. Worked off his pads to the sweeper fiewlder on the leg side"
"full just outside off, and blocked off the front foot to the vacant cover region. The bowler scampers across, so no chance of a single"
""
"length ball outside off, and spinning further away. Mistimes his cut to point"
"full on leg stump, and Bishoo has to adjust his footwork. Awkwardly defended towards mid on"
"full on off, and Bishoo drives it back to the bowler. Well stopped by Perera"
"full on off, and he mistimes his drive to mid on. Enough time to take the run"
"short on leg stump, and he attempts the pull. Top-edges it to the fine-leg boundary"
"back of a length on leg stump, and this time Bishoo ducks under the line of the ball"
"full on leg, and this time it's been clipped to the sweeper fielder on the leg side for a run"
"length ball outside off, and this time Dowrich stays on the back foot. Blocked off the back foot"
"full outside off, and angling further away. No shot offered from Dowrich, and that sends the keeper tumbling to his right"
"full on leg stump, and Bishoo attempts to defend it straight. Inside-edged onto his pad, and then goes to the off side"
"full on leg stump, and defended to mid on off the front foot. Perera asking questions now..."
"full outside leg, and Bishoo's had enough. Goes for the release shot, and sweeps it to backward square"
"full outside off, but no spin this time. Dowrich stays on the back foot, pokes his bat at the ball, and then plays the late cut past first slip. More runs"
"flighted on off, and tapped to mid on off the front foot. Quickly intercepted by the fielder"
"full just outside off, and he gets to the pitch of the ball. Fends it towards the leg side"
"short on off, and Bishoo shoulders his arms. The ball goes past his helmet, and then swings wildly towards the leg side. Forces the keeper to dive"
"length ball on leg stump, and Bishoo flicks it towards the leg side. Not hit with any power"
"short again! And once again asking questions to Bishoo. Pitches on middle, and the batsman does well to sway his head out of the ball's line"
"back of a length on leg stump, and Bishoo's cramped for space. Taps it towards square leg though"
"short on leg stump, and Bishoo shuffles across to the off side. Exposes his leg stump, but the ball goes down the leg side"
"length ball on leg stump, and angling across Bishoo. Stays on the back foot and blocks it towards mid off. <B>Time for drinks</b>"
floaty slider outside off. Leans in and guides it to deep backward point's left off the outside half
length ball on leg stump. Pushes forward and gets it to short leg off the inside edge
"length on leg stump, sweeps off the inside edge to short fine"
tossed up at leg stump and a leading edge dies on Dilruwan as Bishoo looks to flick
"length on off stump, defended off the front foot"
<b>mix-up</b> but safe. Tossed up outside leg stump. He looks to whip it but gets a deflection off his front pad that dribbles in front of a flat-footed short fine leg. Bishoo responds late but makes it at the other end
bouncer down leg side. Takes it on with a hook but can't connect
length ball swinging away outside off. Plays it late and gets it to cover's right
"length ball at the stumps, taps to deep square's left"
"<b>top edge</b> lands just inside at the fine leg boundary. Bouncer again, hook shot again. But this one was closer to his shoulder and he managed to get bat on it as a result. Safely."
<b>brutal!</b> Kumara sends the next bouncer up at Bishoo's helmet and he won't even think of a hook this time. Couldn't if he tried. Awkwardly gets out of the way
short of a length but it looks like the last ball is still on Bishoo's mind. Looks to get out of the way and nervously defends
"short of a length on leg stump, tapped to short fine off the back foot"
"length on leg stump, defended into the leg side off the front foot"
"length ball down leg side, left alone"
"tossed up at leg stump, driven to long-on"
<b>clobbers this</b> but finds deep square. Nice loopy full ball outside leg and he has short leg scared with his sweep
allows this to come on and hit his back leg right in front of the stumps. Dickwella will appeal. That's pitching outside leg
"length ball outside off, backs away and fends to extra cover"
"<b>well played.</b> Bishoo with good improvisation as one climbs steeply at his ribs. His first instinct is still to get on the back foot, but this time he's looked to score. Dabs it fine"
"bouncer slanted across his back shoulder, left alone"
"short ball at off stump, comfortably dead-batted off the back foot"
"...I will leave them anyway, says Bishoo. Bouncer in the corridor, with the angle tilted in at him. Sways out of the line gracefully"
"short one at off stump, nicely behind this to defend"
"tossed up at leg stump, flicked to midwicket"
"length ball down leg side. Looks to sweep but can't connect. Dickwella has heard something as he takes the catch, but he's the only one appealing and it's turned down"
"length outside leg stump, deflected off the thigh, no shot offered"
<b>into the 90s</b> with an under-edged sweep. Length ball outside leg. Gets down and manages to tickle this past leg slip. <b>It's also the 100 for this stand</b>
"tossed up at leg stump, flicked to midwicket"
short ball down leg side. A loose attempt at a glance. Beaten
inswinger. At a length on middle stump. Solidly blocked on the front foot
"<B>beaten on the outside edge.</b> This is why Lakmal's average is 43. By far the best bowler in this team, always troubling the bat, never finding the edge. Jags this off the corridor, Bishoo jabs and misses"
"length at middle stump, defended back towards the bowler"
full ball swinging in from wide outside off. Left alone
"length ball slanted in at the pads. Looks to flick, caught on the thigh guard"
another indipper. Full and at the stumps. Bishoo with the annoying full face of the bat to keep it out
"tossed up at leg stump, driven to mid-on"
"length at the stumps, defended on the front foot"
"length and into the pads, flicked to fine leg"
"length on middle, driven to long-on"
"back of a length at the stumps, punched to midwicket"
"length on the pads, front foot stab to midwicket"
"<b>taken at gully!</b> Bishoo the victim of his own ambition. Short and wide ball from Lakmal, who is back over the wicket. No crazy movement, no extra bounce. Just an expansive stroke for which he is not fully in position. Static as he looks for the cut and it's sliced for a good catch. Superb innings from Bishoo. Five fifty-plus stands he's been involved in, in his last 14 innings. But a half-century continues to evade him in first-class cricket."
beauty. Length ball bending away in the corridor. He looks to defend on the front foot but can't get close
"short of a length outside off, lets it through"
"looks to bend one away from middle stump, it goes down leg side with the angle"
"<b>this is very very close.</b> Aleem Dar says not out. Height? Length ball slams him just above the knee roll, on first look. It's not a big forward stride. He's on front of leg stump. Sri Lanka review it. No edge on it...<b>umpire's call on hitting!</b> That was close. Clipping the top of leg, but Dar had to give that out for it to be out."
"short of a length at off stump, defended off the back foot"
""
"length at off, blocked on the front foot"
"arm ball skids into leg stump, whipped to long leg off the back foot"
"length on middle stump, defended on the front foot"
"length, off stump, soft-handed defence close to the body"
"drifted in outside off, slight grip off the surface. But comfortably blocked"
"length on middle stump, shapes away towards off and squares him up. But he manages to push it down the pitch"
"length ball outside off, defended from the crease"
"<b>has he got him?!</b> Big sound as Dowrich gets squared and one carries through to the keeper. Not out says Dar! Sri Lanka will review, for sure. Sensational ball, angled in and then shaping away late from the corridor. Turns out it's a sensational decision too. 'Well done, mate,' says third umpire Ian Gould. That has brushed the back thigh. Review lost."
"<b>another appeal</b>, this time for lbw. But this is fairly obvious. Climbs from a length and strikes him in front of leg as he tries to flick. Way too high"
"length ball down leg side, looks to flick, misses"
"length ball outside off, defended on the front foot"
"length on leg stump, blocked on the front foot"
"tossed up at middle stump, dead-batted"
"flighted, no drift, no turn. Front foot block"
"short of a length, low skidder outside off. Looks to cut, beaten"
"length ball on leg stump, nudged down the pitch off the front foot"
nicely bowled. Beats him in flight at a leg stump line as he pushes forward. Cops it on the front pad
length ball just outside off. Gets deep in the crease and drops this into the leg side with soft hands
good length ball swinging late outside off. Defended to gully off the outside half
"length ball on leg stump, clipped to midwicket from the crease"
"length ball down leg side, can't get bat on the flick"
short and very wide outside off. Left alone
"short of a length ball down leg side, past the inside edge as he flicks"
"<b>hello, spin! Where have you been?</b> That is BIG turn. Herath doesn't do that a lot. Slow drifter in at off stump, pitches and rips past the outside edge"
arm ball at off stump. Blocked late off the inside half
""
""
""
"full on off, and defended off the front foot towards cover"
"full outside off, and that's been confidently driven down the ground to mid off. No chance of a single"
"length ball outside off, and the the batsman shoulders his arms on this occasion. Through to the keeper"
length ball outside off once again. Dowrich just stands in his crease and sees the ball go past him
"length ball outside off, and angling into the batsman. Clipped off his pads to the vacant midwicket region. <b>Moves to 97</b>"
"full, but wide outside off. The ball's swinging further away and Roach goes chasing after it. Misses the drive and the ball goes through to Dickwella"
"length ball outside off, and Roach sticks his bat out. Taps it to cover point"
"length ball at the stumps. Blocked very late, into the leg side"
"tossed up at off stump, pushed back to the bowler"
"tossed up at off stump, tapped back to the bowler"
"floated up at off stump, driven neatly but short extra dives to his left to keep him on 97"
"length ball at leg stump, flicked to square leg, who is also there to keep him on 97"
"tossed up at off stump, driven back to the bowler"
<b>he's waited to bring this out.</b> Obviously. Full ball wide outside off. Leans in and caresses it through point
"length ball into the pads, looks to flick .Cops it on the pad and it trickles into the leg side. Appeal turned down, that's going down leg. Usually is for Gamage"
"length ball wide outside off, left alone"
"full inswinger, dangerously close to off stump. Roach happy to leave it"
"length outside off, left alone"
"overpitched ball outside off, left alone"
"length ball outside off, pokes it into the off side with the turn"
"nice and slow outside off, defended on the front foot"
"<b>uppish</b> but short of Herath. This is a good pace. Very slow, loopy on leg stump. He doesn't get to the pitch as he looks to drive. Closes the face early and it's off the leading edge. Herath leaps to his right but can only parry to mid-on"
"length on the stumps, blocked from the crease"
"<B>stabs uppishly</b> but there's no silly point. Loop, again. Very slow and Dowrich nowhere near the pitch as he defends with hard hands. It climbs on him and lobs safely into the off side"
"full on leg stump, flicked to midwicket"
"length ball at off stump, blocked into the pitch"
"length ball outside off, left alone"
"length ball outside off, walks into the forward defence, gets it out to point"
"yorker at off stump, jammed out to mid-off"
"short ball rising sharply outside off, left alone"
"<b>keeps low</b> but it's so wide outside off, the only person it bothers is Dickwella"
"tossed up at off stump, driven back to the bowler"
"length ball on off stump, plonks the front leg across and defends off the inside half"
"length ball outside off, dabbed into the off side"
"length outside off, blocked"
<b>top edge!</b> Lobs over the keeper and evades slip! Woeful shot from Dowrich. Pre-meditated sweep. He's not getting close to the pitch of Herath lately. Mathews gives chase on the leg side from slip
"<b>there it is!</b> Leaps off the floor, punches the air, strips off his helmet and he'll soon be with his proud team-mates. On the stroke of tea, Dowrich stabs a length ball on leg stump through square leg to become <b>West Indies' first wicketkeeper centurion against Sri Lanka.</b> This is also the slowest hundred by a West Indies wicketkeeper, but if you know context, you know that's not a worry at all. A top class innings, his second ton in Tests."
"full, and wide outside off. Driven crisply past the cover-point region to the man in the deep"
"wide outside off, and seaming away from Roach. Tries to drive but misses completely. <b>The WI batsmen look aggressive</b>"
"full outside off, and shaping just a bit away from Roach. He tries to push at it, but misses once more"
