"<b>swing.</b> Straight up, but a little too short to cause discomfort. Languid movement away and a watchful defence off the back foot from the batsman outside off"
some shape away again. Back of a length and dead-batted into the pitch with a closed face
nice line. Just short of a length with some shape away. Brathwaite comfortable again in getting behind and defending this
length ball on middle stump. Skids straight through and he stabs it into the leg side with soft hands
"<b>off the mark.</b> Brathwaite as watchful as ever. Allows this straight length ball to come on and hurriedly jabs it wide of mid-on, who is quite close in"
"good length and swing into the batsman, who has his front leg out of the way to tap this into the leg side"
<b>big inswinger</b> from outside off. Brathwaite hangs deep in the crease and turns it to fine leg with one land
"133.6kph, swing away from the left hander, who watches it nicely, gets nicely behind the line and drops it into the covers region with soft hands"
batsman aware of the shape this time. Has already shuffled back and across as this swings into his pads and he dabs it to leg gully
oh well done. Shape into the corridor and Brathwaite watches it very closely to ensure it's causing no harm to his stumps. Leaves it alone
"<b>jabs</b> it to leg gully's right. Big inswinger at a length again. He's shuffled a long way again. This strategy might work as long as the ball is new, it's doing too much to cause an lbw danger for now"
"length on the stumps, tapped away into the off side"
"<b>what a ball!</b> Followed by an excited appeal from Sri Lanka for caught behind. Lakmal angles it into the corridor. Brathwaite, watchful as always, fails to get far enough forward to get close to this as it jags away off the pitch Ends up getting beaten on the outside edge. Sri Lanka won't review. The sound was the ball brushing the back pad"
"<b>beaten again.</b> Short of a length outside off, plays inside the line once more and can't get close"
"behind this one. Probing away in the channel, is Lakmal. Brathwaite gets an angled bat on it this time"
"<b>got him!</b> Lakmal, you gorgeous fella. Completely shattered Brathwaite's mental resolve. He's been jumping around to tackle Gamage's inswinger and suddenly he has four going away from his batting box outside off. Tentative once more. Jabs at this one, the fullest of all the inswingers so far. There is bounce on it and the outside edge carries comfortably through"
short ball. Well down leg side. An easy leave
"short of a length on leg stump, some shape down. Tickles the pad on the way to the keeper as he looks to glance this"
big swing away. Is he controlling it? Hard to say. Starts outside off at a length and goes a long way away. Left aloe
"<b>sliced away</b> but with little control. Full outswinger from Gamage in the corridor. Smith's front foot stride is minuscule. The ball's aerial, but wide enough of point to beat him to his left"
<b>beaten.</b> Hangs the bat out with a half-stride that hasn't landed before the ball has. Fizzes past the outside edge
"full on off stump, looks to drive down the ground. That shy forward stride lets him down again. It's an inside edge into the leg side"
<b>jumps past the outside edge.</b> Not a lot of aerial movement this time. Slants across the corridor and flies past the outside edge
full outswinger starting too wide to make him play. Gratefully left alone
short of a length and swinging in. Defended off the back foot
"<b>can't get bat on it</b> as it swings in and traps him with his front foot plonked across his body. It's hitting him in front of leg though, that will be not out. A leg bye through square leg"
<b>in the air</b> but well short of point. That appears to have stuck in the pitch. Back of a length and just outside off. Leaps off the ground and stabs with hard hands
<b>clipped</b> past square leg. In control of the flick. Turns his bat at just the right moment to deflect this inswinger for two
oh well bowled. Big inswinger at off stump and he defends it very very late
<b>inside edge onto pad.</b> Powell shuffles to try and nudge it fine with the angle. It skids through too quickly
shot. Sweetly timed punch from Powell. In a bit of tangle with his front leg locked as it lands across off stump. But there is enough swing way for some room to be on offer and the ball is full enough for a proper drive past his partner
short of a length and swung away outside off. Left alone
good length and just outside off. Leaves it alone. Some bounce there
"good length, too wide to make him play. There is bounce. They are not troubling the batsmen with it!"
"once more, too wide. Length, swinging away, wide outside off. Puts in a nice front foot stride as he watches it go"
"length on the stumps. Gets the bat down late, gets it to fine leg off the thick inside edge"
short of a length inswinger at off stump. Defended off the back foot
"short of a length on the pads, stands tall and whips it behind square. Nicely timed. That length is giving them a lot of time. Good shot."
wide of the crease and a big inswinger in at the corridor. Offers a closed face and squirts this wide of mid-on. Herath performs the athletics there
<B>now we're talking.</b> Steep lift off the surface from Lakmal. Into the corridor from back of a length. Making him play because of the angle. His bat is inside the line though and that's beaten the outside edge
"<b>direct hit.</b> Chandimal from cover has sprinted across to his right and broken down the stumps at the striker's end. It was another inswinger, dabbed with soft hands into the off side. Smith does not ground his bat. Plonks it in lazily and just makes it. That would have been a disgusting way to go on your Test comeback. Some would say deserved. But he has survived. Nice work from Sri Lanka's captain."
short of a length and cramping him at off stump. Keeps it out after getting off his toes. Lakmal's front leg was a long way in front of the crease
short all shaping into the corridor. Loses balance as he taps away from the body and gets this to backward point
"outswinger dug in at a length, wide outside off, left alone"
<b>is there an edge?</b> No. Just past the outside edge. Nicely worked by Gamage. Floats this one up. It's still wide enough to be left but the trajectory draws Powell into trying a drive through the covers. Front foot non-existent and he's almost falling over by the end
"length ball outside off, left alone"
"short of a length, swinging away outside off, left alone"
"<b>looks to take leg stump</b> but this yorker doesn't swing as much as all the balls prior. Goes straight through, snaps the heels outside leg and deflects past the keeper"
"dropped short outside off, looks to punch off the back foot and gets it to extra cover off the toe end"
"good length, swinging down leg side. Can't get bat on the flick"
"short ball, wide outside off. Slashes at it and gets a thick outside edge down to the third man boundary. Just your everyday left-hander"
"length ball swung in at middle stump, defended into the leg side"
<b>beaten.</b> That steep lift off the surface once more. Angles in and he's looking to defend the inswinger when this jumps past the outside edge
"good length on the stumps, tapped to midwicket on the up"
short of a length on off stump. Nudged into the off side with soft hands for a well stolen single
<b>steps out and regrets it straight away.</b> It's short of a length and about to run past him outside off. He's forced to block with his body
"short of a length at off stump, punched to extra cover off the back foot"
arm ball. Skidding through at a length on off stump. Defended off the back foot
"steps out and dead-bats down the track. Drifts this in, slower than before on a length at middle stump."
whack. Playing with his length and cashes in on the short one. Skidding outside off and he rocks back to spank it in front of point
"short of a length outside off, pushes to backward point from the crease"
<b>raps him on the pad</b> but that appears to be both climbing over and swinging away from leg stump. He's on the back foot trying to glance this
"<b>inside edge</b> past the stumps. On the back foot to try and force this through cover, but this nips back in late"
length ball pushed way too wide. Left alone
"short of a length just outside off, defended off the back foot"
"full and very wide outside off, left alone"
"good length just outside off, dead-batted into the off side"
"short of a length on off stump, tapped to cover off the back foot"
"<b>ah there it is.</b> The first overexcited appeal from Dickwella of the tour. Length ball, steps out and cops it on the front pad well outside off. Dickwella the only man hitting high decibels in the whole continent"
"short of a length, stabbed to midwicket off the back foot"
"short ball outside off, chops it behind square on the off side with the open face"
"<b>Smith's gone!</b> Survived a close run out call earlier, won't do so this time. And once again, you've got to say, that's a lazy effort from him. But was it a good call in the first place? Powell nudged this to midwicket's left who sprinted and fired in a rocket throw right next to the stumps. Smith's stretch to get in lacks any thrust. he's short by an inch"
"lunges forward and jabs this away, rolls off a thick inside edge past short leg. Shouts of 'aaaaaiyooooo' from Dickwella"
leaves alone a length ball slanted across
"beauty! <strong>Squared up by the length</strong>, beaten by the zip. Length ball angling away, he went back and across to defend but saw this whizz past."
<strong>shot of the morning!</strong> Half-volley on the stumps and he presents the full face to lace this back past the bowler. Beautiful
"shortens his length, gets this to zip back in from middle, Powell's feet in the air as he awkwardly defends. Taken by surprise by the pace on this delivery"
"full and angling away, searching for the late inswing but there is none here, left alone"
"<strong>hit on the box, ouch!</strong> This hits length on middle and jags back in as Powell is hit right where it hurts as he played outside the line. He's down for the count. Nothing, absolutely nothing, the physio can do."
"gets this to nip back in from way outside off, left alone"
"gets this to move away off the seam, but this is starting from around the sixth stump. Hope is happy to leave"
hops back and across as he defends this length ball outside off. Little late on the stroke
"imperious! Picks the length early, swivels back and pulls him in front of square. <strong>Brings up 1000 Test runs with that</strong>"
"full and outside off, left alone"
"full, looks to have him driving, but Hope leaves alone"
"starts off with a wayward delivery down leg, <strong>Dickwella with a superman effort</strong>, threw himself to his right to stop one-handed"
beaten for pace on this length ball as it thuds into the pad and deflects into the leg side
"zippy length ball angling in from wide of the crease, defended with soft hands"
squirts this length ball to point. Hopped back and was on the move as he defended that. <strong>Working up good pace already</strong>
"yorker length on leg stump, late on the stroke, somehow managed to keep it out. Dug back to the bowler."
gets on top of the bounce and tucks this short ball on middle and leg to fine leg. The 50 is up for the West Indies
"late swing back in, Hope falls over and ends up yorking himself. Well taken by the keeper as ball deflects off the pad."
"length ball that hits the deck and straightens from outside off, watched through as he plays inside the line"
gets on top of the bounce and punches this short of length delivery into the off side
"punched back again, this <strong>kept a touch low.</strong>"
slapped away but can't beat the diving cover fielder. Lucky to get away with that short deivery.
"thick edge but he was playing it with soft hands, on the bounce to gully"
"pacy bouncer, but way over Powell's head, keeper leaps to stop that"
"squared up by the length ball that moves away a hint, safely negotiated though as he played with soft hands."
jabs this length ball on middle and leg to the off side. Played it with an angled bat face.
"works this off his hip, but lost his footing in doing so. Rolls to deep square leg. <strong>Could've so easily fallen onto the stumps</strong>"
plays inside the line as he hears this zippy length ball thud into the keeper's gloves
hops back and defends this incoming length ball towards cover.
goes back to defend this indrifter with soft hands
"steps out but Herath slows it down nicely, the ball spins back in to hit the pad."
gets a good stride in and smothers that
"rocks back and hammers this away through to the extra cover boundary. Herath went short, got punished."
"skids through after pitching, Powell played inside the line as this beat the edge."
"<strong>beauty!</strong> Draws him forward, gets this to dip on him and beat the forward prod."
"short and pulled away! Fetched it from outside off, hit in front of square. Lovely"
"short of length that nips away from outside off, left alone"
defends this incoming length ball with soft hands
"<strong>beaten on the drive!</strong> Nowhere near this, beaten for pace. The stroke was brought about perhaps because he'd been getting plenty of short stuff."
"gift and gleefully accepted! <strong>Full toss</strong> outside off, driven through cover point"
"angles back in but way down leg, keeper collects."
"steps out but nowhere near the pitch, looks to flick but gets a thick inside edge that <strong>uppishly flies past short leg</strong>"
lunges forward and defends this flighted delivery with soft hands
"flatter and fuller on the stumps from wide of the crease, defended from the crease"
"flatter in trajectory, just lands this outside off, defended"
"drops a touch short from wide of the crease, he makes room and crunches this into the gap at deep cover"
"short and spinning back in, goes back into the crease and whips this towards deep square leg"
right back into the crease as he defends this length ball to point
"slants one in from wide of the crease, defended back"
"overpitched and he laces this through extra cover. All class. Deserved to be hit, and he <strong>apologetically eased it away</strong> and in style"
"edged, past the diving gully fielder"
"overpitched on the pads, overbalanced and misses the flick, deflects off the pad to square leg"
"gets on top of the bounce and flays this short of length delivery towards sweeper cover, Lakmal runs around to his right to put out a tumbling stop, <strong>saved two runs</strong>"
goes back and across as he defends this tossed up delivery on length
lunges forward and smothers this flighted delivery
"flatter one on middle, worked to midwicket"
"rocks back to cut, not all that short, manages to get this away to deep point"
"not to the pitch, shaped to drive, mistimed to mid-off. <strong>Deceived in flight</strong>"
"goes back into the crease and whips this short ball to the midwicket boundary. Picked the length early and brought his wrists into picture, delightful execution."
"done in for pace! <strong>Kumara, you beauty.</strong> This is full, furiously fast and goes through his defences as he looked to flick. This swung in late to draw a thin inside edge to flatten the leg stump. Powell has done all the hard work and then thrown it away."
"starts off with a rip roaring bouncer, ducks under it"
full toss and punched away past mid-on. <strong>Couldn't have asked for a friendlier delivery</strong> to get off the mark
"too full on the pads, balance perfect as he flicks this into the gap at deep midwicket"
gets on top of the bounce and defends this short of length delivery with soft hands
"not for the first time he's played this pull today, not for the first time has the timing been magnificent. Short outside off, he gets into position quickly and pulls handsomely in front of square."
driven straight to cover point
"drifts in a tossed up delivery from around the stumps, defended back"
"draws him forward, induces the edge too, but rolls all along the ground to short third man, shaped to drive, checked his stroke"
"too full and flat outside off, opens up his broad shoulders and belts this through extra cover."
goes back into the crease and defends this tossed up delivery on length
punches this to mid-on
"hustled for pace as he looks to defend, the ball deflects off the thigh pad to fine leg"
stands tall and punches this length ball to cover
goes back and across as he defends with soft hands
"goes full from wide of the crease, defended with minimal footwork. Could land him in trouble."
"far too wide outside off, perhaps slipped out. Was he looking to bowl the effort ball? Keeper took it in front of first slip."
"uppish, but straight to cover"
plays inside to watch this length ball zip past to the keeper. <b> That's lunch on day one </b>
full and very wide. Left alone
"full and just outside off, driven on the up to mid-off"
"short of a length just outside off, defended off the back foot"
<b>chases and he's gone!</b> By far the most harmless delivery after lunch. Short and wide outside off. Hurries through a square drive off the back foot and gets a thick outside edge. But there might be hope for him. Gamage appears to have overstepped...<b>yes!</b> No-ball.
"length ball wide outside off, left alone"
"short of a length outside off, punched to mid-off off the back foot"
<b>shot!</b> What he was going for during the no-ball dismissal. This one is marginally shorter than that. A fraction more width too. He hammers it through cover point after climbing on top of this
"short of a length outside off, left alone"
good length and in at off stump. Defended off the back foot
short of a length and nipping away outside off. Left alone again
"length outside off, allows it to go through. No movement in the air anymore"
"some shape there. Even in the air. Scratch what I said last ball. This bends away, but too far away from him to force a shot"
"short of a length outside off, batsman denies service"
"floated in full at middle stump, squeezed out to mid-on off the front foot"
"another floater. Would have been clubbed through cover on the full if it was anywhere near the batsman. In the end, it's too far wide outside off to make him play"
"good length on off stump, defended off the back foot"
"<b>given lbw, reviewed straightaway.</b> This length ball keeps low as it skids back in at the batsman. He's off his feet as he's hitting it. I suspect he's struck outside the line of off...yes he has been. Also, there's a big inside edge. No wonder that was an instant review. The decision will be overturned. Kettleborough the umpire. That's the first sign of a ball not rising as much as expected. It's generally been steep bounce so far"
ooooohhh tempting. Floaty half-volley just outside off. Tries to draw him in but he resists the temptation and lets it go
another tempter. Short and very wide. Won't take it on with the cut
<b>oh well bowled.</b> Classic Lakmal. Belts it in back of a length just outside off and gets it to jag away despite the angle from his wide-of-the-crease release. Beats the outside edge comfortably
length ball angled in and straigthening at an off stump line. Defends into the covers with soft hands
length ball just outside off. This time the angle in is non-existent. Chase hangs his bat out and gets an inside edge onto pad
"this is top quality cricket. Lakmal zooms one into the corridor with all the usual ingredients - angle in, movement away, decent pace. But this one looks like it's landed on the seam and taken off. Chase has been defending those so far but makes the right decision to let this go. Superb viewing."
<b>the indipper</b> but no exaggerated movement on that. Chase defends with slight gap between bat and body outside off
outswinger. Draws him onto the front foot before he decides to leave it
"short of a length and rising outside off, left alone"
"<b>drives inside the line and is beaten.</b> Well bowled. Inswinger in the air, zips away off the pitch. Hope driving a long way outside off"
"shot, but can't beat the bowler's outstretched arm. Inswinger goes on with the angle this time to meet a crisp straight drive"
<b>sweet.</b> But that extra cover guy ruins everything. Hope beautifully leaning into this cover drive against an overpitched ball outside off. A dive to the right means this is a single only
full ball on the pads. Clipped to square leg
"<b>oh yes.</b> This is gorgeous. Arguably West Indies' best batsman, keeping the runs flowing amid some disciplined bowling. Leans into a full one and caresses it between extra cover and mid-off"
"length ball just outside off, tapped into the covers from the crease"
"<b>beaten.</b> Length ball angled in to the off stump, climbing past the outside edge. How do you play this guy out today?"
<b>outside edge</b> dribbles wide of gully. Length ball angled in and straightening. Looks to drive on the up with no front foot movement
"length ball in the corridor, defended off the back foot"
"length ball wide outside off, left alone"
"length ball outside off, left alone"
"full ball swinging away late outside off, respectfully tapped into the covers"
"length ball down leg side, left alone"
"inswinger, full and headed for middle stump until hope gets the inside half of his bat on it. Very close to the pad"
"short of a length just outside off, punched to extra cover from the crease"
"full on leg stump, allows it to come on. The front foot plant much less prominent this time so he can play it right under his eyes, very late. Gets it wide of mid-on"
good length just outside off. Defended on the front foot
"full ball outside off, driven on the up to point"
"short of a length just outside off, left alone"
length ball slanted in at middle stump. Defended on the front foot
"short of a length just outside off, tapped to cover off the back foot"
full and some shape away. Very wide outside off. Left alone
"full and wide outswinger. Chases after it and manages to get it off the blade. Not a convincing shot. Reaching out, half a stride. But he slices it past point"
"good length just outside off, swinging away. Left alone"
"tossed right up outside off, dead-batted into the pitch"
"short of a length outside off, punched to extra cover off the back foot"
"tossed up at off stump, driven to extra cover"
"arm ball. Into the pads, blocked on the front foot"
"tossed up on middle stump, pushed back to the bowler off the inside halffu"
"full on leg stump, clipped through midwicket"
<b>inswinging yorker.</b> He likes that ball. This one headed for off stump. Leans in and taps into the leg side
short of a length and slanting into the corridor. Gets the bat inside the line and allows this to pass
"<b>late swing away</b> but it's full enough for Chase to stab at it. Gets down on his back knee, slices it to the third man boundary"
"short of a length outside off, left alone"
"short of a length on middle stump, pushed through square leg"
"full outside off, check-drive to mid-off"
full and in at middle stump. Defended into the leg side off the inside half
"floated up at off stump, driven firmly to mid-off"
"length ball on leg stump, gets on the back foot and whips it through midwicket. That's <b>fifty between them</b>"
"short of a length on middle stump, gets on the back foot and taps to mid-off"
"arm ball, cramps him as he shapes to punch off the back foot through midwicket. Thick inside edge runs fine"
"tossed up wide outside off, driven firmly to extra cover"
"short of a length wide outside off, left alone"
yorker outside off. Jams it into the point region
"short of a length just outside off, defended off the back foot"
"<b>yes.</b> Once in a while, this guy lands one at 140kph that straightens away from a length. Chase looking to drive on the up can't get close to getting bat on it"
"short of a length on leg stump, flicked to deep square"
"good length wide outside off, left alone"
"tossed up outside off, he stretches forward and blocks"
goes back into the crease and stabs this away
lunges forward and works this with the spin back to the bowler
"sees the flight, look to whip this over midwicket but doesn't get the elevation, mistimes to the fielder there"
gets to the pitch of the ball and turns this to short midwicket
"goes back when he should've been well forward, somehow manages to work this to square leg."
"has he gloved this? Yes, he has. Aggression from Kumara and he's been rewarded. Banged this in short into the ribcage, Hope is hustled for pace and so is pushed back as he tries to nudge this away, but it kisses the glove on its way to keeper Dickwella, who grabs this on the second attempt."
"hops across and works this gently towards a limbering Lakmal, should've been two"
"floated full outside off, there for the drive, but he lets it go"
"touch fuller, just outside off again, Chase has a good look at this as he lets it go"
"gift of a full toss, just bunted to deep point"
"full on off, he hops across and defends."
"tossed up on middle and leg, defended with soft hands"
too much flight and gets the treatment. Chase is right to the pitch as he belts this through cover
"once again, tosses it up nicely, Chase eases this wide of cover for a quick single"
goes back and across as he whips this shortish delivery to backward square leg
goes back into the crease and turns this indrifter to short leg
"nice flight, lands this just a touch outside off, he lunges forward and blocks."
"angles in a short of length delivery that keeps a touch low, defended back"
"<b> that's whacked his thumb </b> as he looks to evade a short ball. Superb from Kumara, banged into the body. Chase looks to take his bottom hand off as he looks to get on top, boom! That's going to hurt"
"right into the blockhole on off, squeezed out"
"angled down leg, left alone. Keeper collects"
"short of length on off, he's right on top of the bounce as he defends."
