"<b>appeal, and given!</b> Full on middle, but sliding inwards. Traps him in front of middle and leg, and the umpire has no hesitation to give that out. Dowrich contemplates reviewing, but Powell asks him to make his way back. First breakthrough of the day"
"length ball on off, and defended off the back foot towards cover. Gets off the mark"
"back of a length on middle, and tapped off the back foot to midwicket. Calls nice and early for the single"
"back of a length outside off, and he rides the bounce to tap it towards the off side. Dribbles away to cover point"
"full on off, and Powell prods forward to block off the front foot"
"length ball, but wide outside off. He opens his bat's face and plays it to the vacant region near point. Takes off for the single"
"full on off, and Holder's in T20 mood. Gets his front leg out of the way and lifts it over mid off. Falls safely beyond the infielder and races away for four thereafter"
"full just outside off, and this time he chooses to play carefully. Comes forward and defends it to cover"
"full outside off, and he goes for the drive. Nice connection, but extra cover is now protected"
full just outside off. Powell leans into the front-foot defense
"short on middle, but that's honestly just a length ball for the tall Holder. Tries to pull, and mistimes it to fine leg"
"back of a length on middle, and tapped to the midwicket region. Fielder there, but they take the single anyway"
short! And this time with some extra pace. Holder ducks under this delivery
"back of a length on middle, and Holder walks across to the off side, before flicking it to deep midwicket"
"back of a length outside leg stump. Too wide, and goes down the leg side. Powell did try to play the ball, but he was nowhere near the ball"
"short on leg stump, and gets big on Powell before he even knew about it. Hits him near the throat area, but looks like Powell managed to dampen the blow with his glove"
full just outside off. Defended off the front foot to the cover region
"full on leg stump, and clipped off his legs to the sweeper fielder on the leg side"
"full on middle, but Powell comes down the ground. Drives through the ball's line - and past Herath - to long on"
"full outside off, and wide enough for Holder to throw his hands at it. Drives it square past point to the fielder in the deep. Work for the man"
"full on off stump, but blocked with soft hands off the front foot"
"full on off, and he comes skipping down the ground. Defends it back to the bowler"
"length ball on off, and angling into his body. Holder adjusts, and then turns it around the corner to deep midwicket"
"length ball on middle, and Powell rocks back. Punches it straight down the ground, but mid on's in place. Too sweet a shot to fetch no runs"
back of a length outside leg stump. Worked off his pads to fine leg for a walking single
"back of a length on middle, but easily tapped off the back foot to square leg. Gets off strike"
"hits his helmet! But he's okay. Short on leg, and Powell swivels to pull. Through his shot too early, so the ball hits his glove and then ricochets onto his grille"
"full on leg stump, and driven towards the on side. Finds short midwicket"
"full outside off, and Holder leans into the forward defense"
"length ball on off, and he covers his off-stump line. Then pumps it back to the bowler"
"full on off, and Holder tries to reverse sweep. Misses the shot, and the ball hits his front leg. Appeal for lbw, but Aleem Dar isn't interested. Holder's big stride perhaps saving him"
"length ball outside off, but the ball stays low. Holder carefully defends with soft hands"
"reverse sweep again, and this time he manages to get some bat. Manages to play it to the left of backward point, and the ball races away. Exquisitely played"
"full on middle, and defended towards the leg side. The ball rolls along to midwicket"
"back of a length outside off, and he tentatively cuts it. The ball rolls away to short third man, whose diving effort stops the ball"
"length ball outside off, and punched off the front foot. Finds short cover"
"full just outside off, and he meets the ball on the full. Pushed back to the bowler"
"length ball outside off, and punched through the covers. Packed infield there though"
full outside off again. Driven to short mid off
"full outside off, and caresses this drive through to cover. <b>Maiden</b>"
slightly tossed up outside off and Holder picks it up and smokes it over cow corner with a clean swing of the arms
"tossed up on a length, turned away to midwicket with the turn"
shuffles across to a length ball and blocks down the pitch
"pitched up outside off, Holder gets the front foot across and gets down on the back knee to sweep behind square; beats deep backward square diving to his right"
closes the face to a slider across off and gets a leading edge to point
comes slightly down the track and pats it away to deep square leg
"length outside off, opens the face slightly to knock through point"
"full outside off, blocked to cover"
beats him with a fulish length ball that nips away slightly outside off
"fullish, cuts in this time, Holder blocks off the front foot through the gap at cover"
full and clipped off the toes to midwicket
oh shot! Holder holds his pose on this elegant straight drive. Just stands tall and punches down the ground
gets down to paddle and finds short fine leg
"caught! Powell falls short of the century. Looked to come down the ground and flick this from off the toes but fails to keep it down. Just a tad aerial and Vandersay, the sub, dives forward to snaffle a good catch just in front of square"
"tossed up on middle,blocked"
"length on off, played to point with a slightly open face"
shuffles across and blocks a length ball down the pitch
"just back of a length, moves across and defends off the backfoot"
"pitched up on leg, blocked"
"flighted on the pads, clipped to short fine leg"
"flighted up on leg, driven down the ground for one"
"non-turning length ball outside off, beats the outside edge as he looks to block"
"full and flighted on the pads, blocked down the pitch"
gets opened up slightly by this length ball that shaves the outside edge and lands safely
"fullish length outside off, drilled towards mid-on"
"back of a length outside off, punched to sweeper cover"
"short of a length, shuffles across and blocks"
cuts in from a fullish length and shoots past the inside edge with Bishoo sticking the bat out away from his body
"full and curving in on off, blocked down the pitch"
"short of a length around off, blocked to cover off the backfoot"
"flighted up on leg, flicked to midwicket"
"full on the stumps, gets down for a reverse sweep to backward point"
advances down the ground and almost yorks himself as he digs it out to mid-off
"pitched up on middle and off, driven down the ground"
gets down for a big slog but doesn't quite middle it as the ball rolls away to deep square leg
"length, spinning in, tucked to fine leg"
"good length outside off, open the face to point"
"full outside off, blocked to cover"
"full outside off, driven to cover"
"good length outside off, open the face to point"
"back of a length outside off, stands tall and blocks to cover"
"shortish outside off, gets on top and steers through point"
"length on off, blocked to mid-off"
"flighted up on middle, flicked to the right of midwicket"
"length ball outside off, blocks it to cover"
"flighted up on off, driven back"
"full around off, flicks past mid-on diving to his right"
"non-turner outside off, pats it to cover"
"short outside off, Holder walks across but does well to stay away from it"
"full on the pads, clipped to long-on"
"short outside off, lashes it through backward of point to <b>bring up the 200</b>"
"short of a length around off, blocked off the backfoot"
"shortish, not much room outside off, slashes and misses"
"short of a length around off, stands tall and punches down the ground"
"that's plumb. Looks like it. Holder reviews after the umpire raises his finger. Might have pitched outside leg. No under-edge on that as he looks to reverse sweep. Sort of a half-hearted attempt at the shot. Pitching just in line and hitting off. Three reds, and that's the end of Holder"
pitches outside leg and hits the pad as he comes forward to block
"flighted up on middle, blocked"
"tossed up on leg, fends it away to the right of Herath"
"curves it in on the stumps, blocked"
"full slider on middle, defended into the covers"
"short and cutting away, lashes at it and gets beaten"
"full on middle, blocked"
"short of a length on off, stands tall and blocks"
"short of a length, angled in, tucked to deep fine leg"
pushed into the covers
"short of a length, keeps a little low, Bishoo shuffles across and blocks off the inside of the bat"
"tossed up on leg, turned to short leg"
"flighted on leg, pushed to the right of the bowler"
"flighted up on middle, blocked down the pitch"
"full on the stumps, blocked"
blocks off the front foot and gets a mild inside edge to the pad
"full on middle and leg, defended"
"full, curving in, drilled down the ground off the inside of the bat"
"short and wide, slashed out to deep point"
"short, left along as it climbs outside off"
"back of a length, nips away pretty sharply and late, withdraws his bat at the last moment"
"fullish length on off, pushed to cover"
"short of a length outside off, opens the face to deep backward point"
"length outside off, plonks the front foot forward and defends"
"slider, blocked off the inside of the bat to the on side"
"full and sliding in on off, blocked"
"full and curving in outside off, pushed into the off side"
"sliding on middle and leg, blocked towards short leg"
"flighted up outside off, left alone"
"full outside off, and angling into him. Pushed back to the bowler"
"full on middle, and he gets down to sweep. Misses, and hits his pad. Appeal for lbw turned down. Would've gone down leg"
"full outside off, and Bishoo goes for an extravagant drive. Drilled to cover"
"full on off, and he attempts the drive. Too close to his body for that shot, so Roach finds the outside edge of his bat. Trickles down to third man for a couple"
"tossed up on middle, and he goes for the leg-side slog. Inside-edged down to fine leg, though"
"flatter, and wide outside off. Mistimes his cut behind point, and Lakmal at third man goes chasing behind it. His diving effort, though, stops the boundary. Lead of 445 now"
"back of a length outside off, and going further away. He tries to slap it towards point, but the ball stays low. Goes to Dickwella on the bounce"
"back of a length on off, and this time it's closer to Bishoo. Times the cut perfectly, but finds deep point"
"<b>how did that miss middle stump?!</b> Shaping in after pitching, and Roach tries to slog it straight over Lakmal's head. The ball held it's line so the batsman played inside the ball's line. Goes over the top of middle"
"full on leg stump, and going further down. He tried the slower ball, but couldn't connect"
"yorker on leg, and he manages to get his bat down in time. Squeezed to fine leg for a single"
"short on middle, and he tries to slap it over point. Makes room for the shot as well, but the ball soars above his swinging bat"
"full on leg, and he's gone wildly at it. Smacks it behind square, but deep midwicket cleans up"
"full just outside off, and driven towards mid on. Except, the ball takes the inside edge, and goes to square leg"
"full, but wide outside off. Frees his arms to drive through cover, but finds the infielder"
"full on leg, and slogged towards the leg side. Wanted to go between deep backward square and deep midwicket, but finds the fielder instead"
"back of a length outside off. Bishoo makes room, and cuts it gently to deep point"
"full on leg, and drilled to long on off the front foot. They jog across for one"
"fiery start! Short outside off, and gets big on Mendis. He sticks his bat out but pulls it back in time. Nice carry to Dowrich"
"full outside off, but holds it's line thereafter. Mendis attempts to defend off the front foot but plays for the incoming ball. The delivery slides just past the outside of his bat"
"full on off, and driven back to Roach. Well held by the bowler on his followthrough"
"full, but wide outside off. Swinging further away, so Mendis chooses not to play at it"
"back of a length outside off, but comes in very sharply. Mendis attempts to defend off the back foot, but the ball hits his hip and bounces away to the slip cordon"
"full on leg, and clipped off his pads to the deep midwicket region. Enough time to jog back for the second"
"back of a length on middle, and slapped through the point region. The ball was angling away, so Perera manages to throw his hands at it"
"full on off, and in the slot to drive. Drilled through cover point, but Roston Chase manages to get his fingertips to it. Takes the pace off the ball and then retrieves it quickly"
"<b>glorious!</b> Full outside off, and proper followthrough of the bat as Perera drives through the delivery's line. Smacked just past mid off"
"length ball outside off, and angling into the batsman. Fended off the back foot to short cover"
"back of a length outside off, and comes sharply into the batsman. The ball goes between bat and pad and through to the keeper. <b>Huge no ball</b>"
"good length on middle, and clipped off his hips to the square-leg fielder. They jog across for one"
back of a length outside off. Mendis rides the bounce and blocks off the back foot
"length ball on middle, and angling down leg. He flicks it off his pads to fine leg"
"width offered outside off, and Mendis cuts it furiously past point. Races away to the boundary, and SL making full use of the hard new ball"
length ball outside off. Prods forward and defends towards cover
"length ball on middle, but the ball stays low! Goes down the leg side, and takes a tickle of the outside of his pad. The ball goes to fine leg thereafter"
"wild, wild bounce! That's jumped off a crack on the pitch. Lands on a length outside off, but the delivery lifts off thereafter. Dowrich had to go full-stretch to manage to hold on"
"full outside off, but the ball doesn't angle in. Holds it's line and goes past the bat's outside edge to the keeper"
yorker just outside off. He keeps his eyes on the ball and squeezes it away to point
"back of a length outside off. Too wide, and so Perera tries to drive at it. The ball goes over his bat though"
"<b>taken at first slip!</b> Are they checking for the no-ball? Nope. Back of a length outside off, but angling into Perera. He tries to work it towards the leg side, but the ball takes a leading edge and finds itself inside Smith's hands. One down, nine more to go."
"full on off, and driven square off the front foot. Finds the gap between point and cover, but Chase does well to parry it back from near the boundary"
"full on middle, and clipped off his toes to midwicket. They scamper across for one"
"<b>a beaut!</b> They're very confident that he's nicked it, but the umpire's not convinced. Huddle in the middle, and West Indies opt not to review. Interesting. The way they appealed, West Indies looked sure that was out. The ball was back of a length outside off, but straightened after pitching. Took some extra bounce and whizzed past the bat's outside edge. <b>Replays say that Mendis had edged it.</b> Oh dear, chance goes begging."
"length ball outside off, and defended off the back foot towards the off side"
length ball outside off and going straight through to the keeper. <b>Extras though</b>
"full on middle, and driven straight. Takes the bat's inside half, though, and therefore goes to deep midwicket. Chase cleans up"
"back of a length outside off, but Mendis tiptoes and cuts it past the two infielders on the off side. Runs away to the point boundary"
"back of a length outside off again, but Mendis repeats his slapshot off the back foot. Not hit as well this time, but still allows them to take a couple"
"good length outside off, and angling into Mendis this time. Fended with soft hands"
"full on off, and he comes forward to defend it back to Roach"
"full on leg stump, but going further down. The batsman misses the clip off his toes, and Dowrich jumps to his left to collect the ball"
"full just outside off, and Chandimal prods forward to block. Played back to the bowler"
"full outside off, and the ball tails in late. Drives it square off the front foot, and fielder at point goes chasing after it"
"good length outside off, and he rides the bounce to defend off the backfoot. Firmly played"
"back of a length on middle, and flicked off his hips to deep backward square. It's a dangerous second run, but the throw is not on top of the stumps. Otherwise, he was run-out."
"full on off, and blocked towards mid on. Says 'no' to the single"
"length ball on leg, and clipped away fine down to the fine-leg boundary. A loose ball from Holder"
"back of a length outside off, and Mendis tiptoes to defend it towards the leg side"
"length ball outside off, and seaming a bit away. Mendis tried to play for the ball coming in, so the delivery goes past the bat's outside edge"
"good length on off, and he goes onto the back foot. Defended towards the off side"
"full on off, and that's been whipped away to the leg side. Well stopped by square leg though"
"full on off, and finishes up on middle. Defended towards the leg-side on this occasion"
"back of a length on middle, and comfortably flicked off his hips to the fielder at fine leg"
"back of a length on middle, and this time Mendis gets under the ball. Ducks as the delivery goes down the leg side"
"length ball on middle, and he wriggles it towards the leg side from near his chest"
"full just outside off, and that's been driven towards mid off. short cover scrambles to his right, and stops the ball from going through"
"full on leg, and going further down. The batsman shoulders his arms, but Dowrich is very quick to jump to his left and pocket the ball. Good keeping"
"full outside off, and going straight through"
"length ball outside off, but seaming away after pitching. Squares the batsman up but doesn't find the outside edge"
"back of a length outside off, and fended off the back foot"
"full outside off, and angling further away. Left alone"
"full on leg stump, tapped towards the leg side by Mendis this time"
"full on off, and straightening after pitching. Mendis takes a small step forward, and blocks towards mid on. Carefully played"
"full outside off, and driven off the front foot. Got to the pitch early, but can't time it as well. Dribbles away to cover"
"back of a length outside off, and too wide from Cummins. Chandimal rocks back, and then punches this in front of cover. Finds the gap, and the ball runs away to the cover boundary"
"short and wide outside off, Chandimal goes for the uppercut, but the ball goes over his bat. Dowrich has to adjust as well due to the extra swerve, and the ball goes through his gloves. <B>Dowrich's in pain.</b> Looked like that hit the top of his finger on the left hand. Ouch"
"short again, but aimed on middle stump. Mendis uncomfortably defends off the back foot"
"length ball on off, but coming into the batsman. He shuffles to the off side and then taps it to midwicket"
"length ball on off, but the delivery stays low. Blocked off the back foot on this occasion"
"slower ball to end the over. Back of a length, but Mendis rides the bounce to defend it with soft hands towards the of side. <B>Drinks as well.</b>"
"short of a length, angled in, gets opened up as he tries to flick it"
"short of a length outside off, shuffles across and defends off the backfoot"
"short of a length, curving in from the fourth-stump line, Chandimal shoulders arms"
fails to get on top of a short of a length delivery and gets hit on the pad as it angles into him
"full on middle and leg, blocked back"
"short of a length on off, stands tall and blocks from the crease"
"full, drifts down the leg side as Mendis fails to put it away with a glance"
"short of a length, shuffles across and blocks down the pitch"
shuffles across and gets on top before nudging this shortish one to short leg
""
"short of a length, flicks past the right of short leg"
pushes him back with a short ball that Mathews jumps and blocks
"length, angled in, flicked to deep midwicket"
closes the face to this short of a length delivery and gets a leading edge to point
"full, nips away from the fourth-stump channel, left alone"
length ball that swings away sharply and Mendis lets it go
"short of a length, tries to flick and misses as the ball goes down the leg side"
"good length,breaks away off the deck around the fifth-stump channel and Mendis shoulders arms"
"short on off, but the ball doesn't bounce as much. Mathews half-ducks, and so the ball hits the outside of his right shoulder"
"back of a length outside off, and it's been tapped with soft hands to cover. They're off for a quick single, so the fielder has a shy at the stumps. He misses, and Powell (backing up) takes evasive action because of the bounce. The ball races away for overthrows as Roach can't collect in the deep"
"full on off, and he shuffles across to the off side. Gets inside the line of the ball, and defended to mid on"
back of a length outside off. Mendis rides the bounce and blocks off the back foot
"full on off, and the cover drive comes off the bat's inside half. Trickles down to Roach at deep midwicket"
"full outside off, but the ball stays very low. Goes to Dowrich on the bounce, and he gets his on his hand once again"
"full outside off, and Mathews gets on to the front foot to drive towards mid on"
"length ball outside off, and the delivery takes some extra bounce off the surface. Nice carry through into Dowrich's gloves"
"length ball outside off, and Mathews keeps his eyes on the ball. Defends with really soft hands off the back foot. Ensures the ball stays along the ground"
"fuller, and outside off. The ball shapes a bit away from Mathews, and he chooses to shoulder his arms"
"full outside off again. On that fifth-stump channel, and Mathews lets it go once more"
"almost a yorker on off stump. Tails in slightly too, so Mathews must play at it. Does well to dig it back towards the non-striker"
sticks his bat out at a shortish one that gets a little big and shoots past the outside edge
"shortish and angled in at pace, shuffles across and blocks without fuss"
good stuff from Cummins. Lures him forward with a wide fuller one and gets it to shape away late to have him beaten
"short of a length on off, opens the face to point"
"full on off, shuffles across and blocks"
does the smart thing and shoulders arms to this wide one
jumps to a shortish one and it keeps a little low but he manages to keep it out. Holder's overstepped
"muted appeal for caught behind. Shortish and angled in, gets him into a bit of a tangle, Mathews tries to glance and the ball perhaps grazed the thigh pad. No bat for sure"
"short of a length, nips away late and Mathews lets it go"
short and angled in too much. Goes down the leg side
"just back of a length, nips away, blocked from the crease"
"short ball, arches out of the way"
"short ball that pitches around off and cuts away to square him up and catch the thumb. Time for the magic spray to do its, umm, magic, I guess?"
"huge shout for leg before. Looks mighty close. Nothing from the umpire. Roach is literally pleading with the umpire. Surely they're gonna review this. Yup, Holder sends this upstairs. Short of a length that cuts in and hits him on the front pad. Mathews was jumping to deal with that, so the bounce could save him here. Yup, going over. Review lost."
"back of a length outside off, tapped to cover-point"
"length outside off, blocked down the pitch"
"full on middle, clipped away to midwicket"
"short of a length, shuffles across and blocks"
gets on top of a short of a length delivery and blocks
"tossed up outside off and breaks away off the rough, left alone"
"sliding fuller one on leg, blocked"
"pitched up on middle and leg, blocked"
stays back to a length ball and blocks
"short of a length, makes some room to punch and finds point"
"full on middle and off, blocked to the off side"
"tossed up outside off, blocked"
"flighted outside off, defended down the pitch"
"lots of flight outside off, driven to cover"
"length, spins in, stays back and turns it away to midwicket"
"tossed up on middle and leg, flicked to the on side"
"flighted outside off, clumsy effort at midwicket as Mendis flicks and gets a brace"
"length on middle, blocked down the pitch"
slides on with the arm and goes off the inside edge through square leg
"non-turning back of a length delivery, makes room and slaps it through backward point"
"tossed up on middle, blocked"
"full on off, front-foot defence into the covers"
"non-turning length ball, puts his head down and blocks"
back of a length delivery that rises very late. Mathews swings out of the way but the ball almost hits the head of Devon Smith at first slip
""
"short of a length, cuts in, Mathews stands tall and blocks"
""
"short of a length, stands tall and punches to cover"
""
"pitched up on off, blocked"
"short and wide, cut to sweeper cover"
"pitched up on off, blocked"
"full toss, sliding into middle and leg, flicked behind square"
"pitched up around off, blocked"
""
"length ball that holds its line, left alone"
"short of a length, defended off the backfoot"
"length ball, gets slightly squared up as he looks to defend"
"short of a length, blocked off the backfoot"
"back of a length on off, shuffles across and defends"
"length ball on off, shuffles across to blocks"
"pitched up on off, blocked"
advances down the ground and gets right to the pitch before hammering it wide of mid-off
"pitched up on off, comes forward and blocks"
"sliding fuller ball on leg, clipped to fine leg"
"length ball, clipped to backward square leg"
sees the fight and advances down the ground and drills this straight down the ground
