"full on middle, and Chandimal drives to midwicket. Hit well, but finds the fielder"
"good length on leg stump, and that's been nudged to midwicket. No run"
"good length on leg, but angling across Dickwella. Played off the back foot to cover point"
"length ball, but outside leg stump. Dickwella misses a wristy flick, and the ball goes through to Dowrich"
"good length on leg stump. Tapped off the back foot to square leg, and they take off for a quick single"
"<b>sweeet!</b> Perfect straight drive. Full on off, and Chandimal has all the time in the world. Small stride forward and pushed past the bowler's left. Mid off has no chance either"
"back of a length on off, and comes in sharply. Hits Chandimal near his gut, and he needs a moment to recover. Ouch. <b>The physio has a look</b> but Chandimal's good to continue"
"length ball outside off, and seaming away from Dickwella. Left alone"
"length ball outside off, and Dickwella stays on the back foot. Plays it towards cover, and has enough time to scamper across for one"
"<b>leading edge!</b> But goes along the ground to point. Length ball on off, and straightens after pitching. Chandimal offers the defense, but the ball comes off the bat's outside half"
"appeal for lbw, but turned down. Full on middle, and angling down the leg side. Chandimal misses the flick, and it hits his front leg. Reckon that's going down leg"
"length ball, but outside off stump. Chandimal's more than happy to see it through to the keeper"
"length ball on middle, but going down the leg side. Chandimal easily whips it off his hips to fine leg for a single. He'll keep strike"
"length ball on middle stump, and going down leg. Tries to work it towards square leg, but comes off the pad's top half. Goes through towards square leg"
"length ball outside off, and this time Dickwella's punch comes off the bat's bottom half. Goes through to second slip"
"full on off, and Dickwella drives it behind square. Takes an awkward bounce, and hits Chase near his neck. Hope he's fine"
"length ball on middle, and going away from Dickwella. Offers his bat's full face as it comes off the outside half. Through to point"
"length ball on middle stump, and Dickwella gets behind the line of the ball. Punches it to Holder, who misfields. But mid on is backing up"
"quicker ball, but this time it's down the leg side. Dickwella tries to play it down down the leg side, but it comes off his back thigh. Races away to fine leg for a boundary. <b>Drinks as well</b>"
"short of a length ball on off stump, blocked on the back foot"
"<b>keeps it out!</b> Not sure that's reverse, but it bends in nastily. Full and in at middle stump. Chandimal falls over and stabs this into the midwicket region"
"short of a length outside off, tapped into the covers from the crease"
"short ball slanted across off stump, left alone"
<b>beaten.</b> Climbs off a length and Dickwella looks to feel for it away from the body
"length on off stump, defended on the front foot"
"short of a length on off stump, dead-batted into the covers"
"length ball fired down leg side, left alone"
short of a length and zipping away in the corridor. Defended off the back foot
"short of a length at off stump, defended off the back foot"
"length ball on off stump, defended from the crease"
tickled away. Poor line from Cummins. Onto the pads at back of a length. Plenty of time for him to pick up four at fine leg
"short ball outside off, stabbed through cover off the back foot"
"short of a length on off stump, defended with soft hands"
"short of a length outside off, left alone"
"good length on off stump, blocked on the front foot"
nicely guided. Short ball outside off and he taps it past gully using the face of his bat
"length ball wide outside off, left alone"
"length ball swinging away late, left alone"
"length and far down leg side. Looks to whip it away, can't get bat on it"
"length on the pads, whipped away through square leg"
"bouncer first up, sliding down leg and easily let go"
"length ball outside off, inside edge as he looks to push it on the up through the covers"
"short of a length at off stump, pushed to point with an open face"
<b>beaten.</b> This skids through quickly as Dickwella looks to stab at it
"length ball wide outside off, left alone"
"<b>beaten.</b> Lots of room on this short ball and he looks to spank it through cover, but it's slipped through from underneath"
"length ball shaping away in the corridor, left alone"
"bouncer very wide outside off, left alone"
"length ball outside off, punched on the up to extra cover"
"length ball at leg stump, flicked to fine leg"
"length ball just outside off, pushed into the off side"
"short of a length on leg stump, tapped through midwicket off the back foot"
"short of a length on middle stump, defended into the leg side"
"length ball fired down leg side, left alone"
"short ball outside off, left alone"
pinches a single. Good quality batting. Gets right behind the line and deftly drops this in front of point
"length ball on middle stump, clips it wide of mid-on with soft hands"
"length ball on middle stump, pushed down the pitch off the back foot"
<b>pick-up shot</b> that Dickwella usually plays a lot more of. Can't remember one before this in this innings. Lifts it off a length and gets it to fine leg on the bounce
"length ball on off stump, blocked on the front foot"
"short of a length at off stump, tapped into the off side"
"full on off stump, pushed to mid-off from the crease"
"floats up a full toss outside off, it's punched to long-on"
"slider at a length on off stump, pushed back down the pitch"
"slower, tossed up at off stump and marginal turn away. Comfortably blocked on the front foot"
"full on off stump, driven back to the bowler"
"length ball on leg stump, flicked to midwicket"
"slider at off stump, defended on the front foot off the inside half"
"short of a length ball in at leg stump, flicked through the open square leg area"
<b>slaps it over.</b> Fully in control. Short and wide outside off and Chandimal moves his weight backwards to lift it over point on the up
"<b>glorious.</b> Slowly taking control of the match, SL's captain. Length ball outside off. He hasn't gotten close t the pitch, but the hands have come down late as he caresses it wide of extra cover, to his right"
"length ball on off stump, defended off the back foot"
"length ball wide outside off, left alone"
"length ball outside off, left alone"
"lobbed up at middle stump and once more, Dickwella hits it on the full. Gets down and laps it to long leg's left"
"length ball on middle stump, punched back to the bowler"
short ball turning in at the stumps. Backs away and slices to cover's left
<b>beaten in flight</b> but he manages to adjust. Steps out and pushes to extra cover. Some turn for Bishoo.
"length on off stump, pushed to extra cover on the up"
"short ball on off stump, backs away and cuts straight to extra cover"
"full and slanted in at off stump from around the wicket, driven firmly to mid-off"
"<b>lovely!</b> It's not a very fast pitch, so this punch on the up is not easy to do. Length ball outside off, gets nicely in line with a stride forward and opens the face at the last moment after offering the full face. Gets it wide of mid-off"
"full at off stump, driven uppishly to mid-off"
"short ball down leg side, looks to pull and can't get bat on it"
"length ball outside off, punched to cover on the up"
"<b>jags back in</b> to the batsman's surprise. It's slanting away from off before landing. He gets an inside edge, rooted to the crease. It's also a no-ball though..."
"overpitched outside off, watchful tap to short extra cover"
"length outside off, pushed into the covers with the turn"
well the bowler hasn't managed to spin one into Dickwella so far. Another full toss. Picked from outside off for a single at long leg with a lap sweep
"length on off, defended on the front foot"
extra bounce. Length ball lifts up as he leans in to defend
"short of a length on off stump, punched to sweeper cover off the back foot"
"length ball turning in at off stump, defended into the covers"
<b>poor shot.</b> That is poor from Chandimal. Probably the last over before lunch. It's a short and very wide ball outside off. He's looking to go over point with a cut but ends up playing well away from his body and slicing it feebly for the fielder there
"full ball speared in at middle stump, leans in and hurriedly nudges it through the open mid-on region"
"length ball at off stump, defended from the crease"
"brave leave. Length ball slanted into the corridor, he shuffles and withdraws. That was close to the stumps"
nicely timed. Length ball into the body and he offers the full face again to tap it through mid-on
length ball headed for the top of off. Blocked watchfully from the crease
"half-tracker on off, and Dickwella backs away to cut it past the cover point region. Runs straight away"
"length ball outside off, but spinning into his body. Turned off his hips to the fielder at short leg"
"length ball on off, and spinning inwards. Clipped towards square leg"
"slower through the air, length ball outside off. Tentatively fended away off the back foot"
length ball on off and turned off his pads to the leg side. Cramping Dickwella for space
"outside off once again, and Dickwella comes forward. Blocked off the front foot"
"<b>dropped!</b> The look on Chase's face says it all. Full and wide outside off, and Perera goes for the extravagant drive. Chase - at point - comes forward, but the ball keeps dipping, and it pops out of his hands. Gabriel ain't pleased"
"full outside off, and this time Perera ensures he stays wary. Shoulders his arms"
"length ball outside off, and Perera takes a big stride forward to cover his line. Then lets the ball go through to the keeper"
"<b>caressed through cover!</b> Overpitched outside off, and that's been driven off the front foot. Played squarer than he would've liked, perhaps, but no one's at the deep either"
"length ball on off, and he comes forward to fend it with soft hands. Played towards the non-striker"
""
"full outside off, and Dickwella defends with soft hands. Angling into him from around the wicket"
"extra flight, and lands full on middle. Gets his front foot out of the way and drives towards the non-striker"
"full just outside off, and tapped towards cover. Calls nice and early for a single"
"length ball outside off, and he's got room to free his arms. Gets his front leg towards the on-side and punches through the covers. Man in the deep though"
"flatter, and lands on off. Dickwella goes onto the back foot, and blocks"
"full on middle, but sharply turning across Dickwella. Comes off his pads as the ball goes towards legslip"
"back of a length outside off, and takes some extra bounce. Perera lets it go through to Dowrich"
"full on leg stump, but Perera misses out on the flick through midwicket. Hits his front leg"
"full on off, but Perera drives down the wrong line. It takes the inside edge and goes towards midwicket instead. Enough time to take the single"
"full on off, and angling further away. Driven away from his body, but mistimed to wide mid off"
"full outside leg stump, and Dickwella tries to whip it behind square. Misses, and it hits his pad. Forces Dowrich to dive to his right and stop the ball from going for four. But <b>he's overstepped.</b> Again."
"lucky! Almost chopped on. Length ball outside off, which he tries to punch towards cover. Through his shot too early so the ball whizzes past leg stump instead. Man in the deep though"
"short! Pitches outside off, and swings after passing Perera. He ducks"
"length ball outside off, but turns in sharply. Dickwella skips towards the leg side, and carves it inside out towards cover"
"full on middle, and he attempts the sweep. Hits his front leg, and pops into Holder's hands at leg slip"
"length ball outside off, and this time he stays on the back foot. Punched past the non-striker to long on"
"full outside off, and blocked off the front foot"
"full outside off again, and fended back to Bishoo off the front foot"
"full outside off, and spinning away from Perera. Gets onto the front foot and defends towards short cover"
"back of a length outside off, Dickwella tiptoes and works it towards midwicket. No chance of a run"
"bends his back to generate some extra pace. Lands on a length outside off, but Dickwella is happy to just continue blocking. Played off the back foot this time"
"length ball outside off, but angling in sharply into Dickwella's pads. He nudges it off his pads to the leg side, but straight to midwicket"
"full outside off, and Dickwella takes a couple of steps forward. Blocked through to mid off on this occasion"
"angling into his pads, and Dickwella manages to rotate the strike. Rides the bounce and works it behind square off his hips. Fine leg cleans up"
"seaming delivery outside off, which goes further away from Perera. Left alone"
"<b>proper mix-up!</b> And great presence of mind from mid on to run Dickwella out. Lazy, lazy cricket. He punches this ball to mid on with soft hands, but Perera has his eyes on the ball. That forces Dickwella to check his run, but eventually both batsmen go for the single. Meanwhile, mid on picks the ball up and hit the non-striker's stumps on the full. Dickwella's a proper metre or two away from the crease. Poor cricket"
"full outside off, and Perera takes a big stride forward. Defended towards cover"
"full just outside off, and spinning further away. Blocked towards the off side"
"full outside off, and glanced with the bat's open face to point. Short third man goes chasing after it, and his sliding effort saves an extra run"
"full outside off, and spinning into Herath. Blocked"
"full, but wide outside off. Herath walks across to the off side and taps it to point. He's halfway down the wicket but Perera hasn't responded. Could be a run-out, but Chase's throw is all over the place! Nowhere near the keeper. <b>Sri Lanka living dangerously</b>"
"full on middle, and that's been worked off his pads to fine leg. They walk across for the single"
"length ball outside off, and he opens his bat's face. Runs it down to third man and there's enough time to take the second"
"back of a length on middle, and Herath tries to pull. Hits his bat's handle instead"
"back of a length outside off, and Herath tries to pull uppishly. Off the bat's top half, but the ball lands safely at square leg. Gets off strike"
"short stuff! Gets big on Perera and he awkwardly defends off the back foot. Gets his bat in front of his face, and the ball hits his glove. Ouch"
"back of a length outside off, but swings sharply inwards after crossing Perera. Dowrich goes tumbling to his left to stop the ball from leaking through. Fiery"
"reverse sweep! Full outside off, and he paddles this past the short third man fielder. Chase for the man"
"full on off, and turning into Herath. Tries to flick it towards the leg side, but the ball hits his front leg"
"full outside off, and Herath defends carefully off the front foot"
"full outside off, and he tries to sweep. Misses, and it hits his pad, but impact's definitely outside off"
"full on off, and he attempts to flick towards square leg. Misses"
"tossed up outside off, and Herath gets onto the front foot. Proper stride to get to the length of the delivery and then defended back to Bishoo"
"length ball on middle, but angling into Perera. Goes down the leg side in the end"
"full, but wide outside off. The ball's seaming further away, and Perera shoulders his arms"
"good length on middle, and worked off his hips to the man at fine leg. They walk across for the run. Umpire Dar says that it came off his pads"
"short outside leg stump, and goes down the leg side. Perera doesn't even bother ducking"
"back of a length on off, but angling across Herath. He tries to punch off the back foot, but can't get bat to ball"
"back of a length on middle, and Herath punches it with the bat's open face to point. No run on offer"
"full just outside off, and blocked off the front foot. Played back to Bishoo"
"length ball on off, and spinning away from the batsman. Played off the back foot to point"
"full just outside off, and blocked off the bat's open face to cover point"
"full on off, and he comes down the wicket. Defends but the ball ricochets to the keeper. Dowrich can't hold on, and that saves the batsman. Otherwise he would've been stumped"
"full just outside off, and blocked off the front foot"
"length ball outside off, and Perera goes deep in his crease to try and punch it past cover. Finds the fielder there though"
"soft! One short ball too many, and this time Herath perishes. Gets big on him, but Herath chooses to pull anyway. Off the bat's top half, and goes straight down midwicket's throat"
"short once again. Lands on middle, but goes down the leg side. Lakmal ducks anyway"
"gets off the mark with a whip off his pads to fine leg. The ball's angling in, so it's comfortably played down the leg side"
"good length on middle, and mistimes a shot to square leg. Tried to use his wrists to work it towards square leg, but it comes off his pads instead"
"length ball on off, but coming right into the batsman's pads. Misses the front-foot defense, and the ball hits his front leg. Appeal for lbw, but turned down by the umpire. Holder considers reviewing, but doesn't after consulting the keeper"
"back of a length outside off, and seaming further away. Left alone"
"outside off, and spinning away from Lakmal. Punched off the back foot to cover point"
"flighted, and lands full just outside off. Defended off the front foot"
"full on off, and Lakmal comes forward once more to meet the ball on the full. Blocked towards the non-striker"
"full just outside off, and Lakmal attempts to drive. Played back to Bishoo"
"flatter, and lands on middle. Lakmal goes back and then muscles this to the sweeper fielder on the leg side. <B>Sri Lanka reach 150</b>"
"full, but wide outside off. Perera keeps his eyes on the ball and taps it towards cover point"
"length ball into the pads, pushed into the ground in front of short leg"
"well bowled. Bouncer up at his eyes, Lakmal sways away"
"<b>lobs up</b> off the thigh guard and falls safely to short leg's left. I thought there was inside edge on that as Lakmal tried to flick it, but none of the fielders seemed excited"
slash and miss. Short and wide outside off. Lakmal a little apprehensive going for the cut. Plays from under it
not apprehensive this time. But another slash and miss. This is a length ball climbing steeply outside off and he chucks his hands at it
"short of a length outside off, chopped into the turf and towards point"
<b>lovely strike.</b. So clean. Dilruwan gets to the pitch of this flighted ball on off and swipes across the turn to get it nicely over the wide long-on boundary
"length ball outside off, dead-batted into the pitch off the front foot"
"length on off stump, slight turn away. Defended on the front foot"
"short of a length slider on off, defended off the back foot"
"<b>got him!</b> Bishoo cramps Dilruwan this time. It's a legbreak that slides on quickly, towards middle from a leg stump line. Dilruwan plants his front leg across the stumps and therefore can't get the bat down straight. Ends up playing for too much turn and this flies off the inside edge to short leg via his pad"
"tossed up at off stump, blocked on the front foot"
"<b>makes it 40 extras.</b> A shocking outswinger, pitching at the edge outside off and swinging to go past second slip"
"short of a length on off stump, defended off the back foot"
"short of a length at off stump, hurried as he looks to play the pull. Trickles out to midwicket"
"<b>top edge carries for six</b> from over the keeper. Lakmal won't try to hang around. Bouncer at his ribs and he wants to clobber it, half on the front foot, with a pull."
"connects cleanly on the pull this time. It's a short one on his hips, he swivels and gets it to fine leg's left"
"short ball wide outside off, left alone"
"good length on off, defended solidly from the crease"
"short of a length on middle stump, goes on the back foot and whips through midwicket"
"length on off, blocked on the front foot"
short ball again. Looks to punch through midwicket off the back foot but short leg gets in the way and deflects this towards mid-on
"length on off stump, front foot defence"
"full outside off, driven to long-off"
yorker on off stump. Manages to squeeze it out to point
<b>shot!</b> A bit of KP in that! Short of a length ball slanted into his middle stump. He gets the legs out of the way and disdainfully swats this past mid-on
"length ball slanted in at middle stump. Clears the front leg again, nearly falls over on the back foot. Somehow manages to keep it out"
<b>finds mid-on.</b> Goes for another pull as the short ball comes in at his ribs. It's too quick. He gets it off the high part of the bat and lobs it for Bishoo
"short ball on middle stump, defended off the back foot"
"thuds him on the elbow guard. Short one at leg stump, he fends awkwardly at it"
"short one at middle. Looks to pull, under-edges into the midwicket region"
"floated up at off stump, defended into the off side"
"length on off stump, pushed into the off side with the turn"
"slider at off stump, blocked on the front foot"
"short of a length outside off, nudged to point on the up"
"length on off stump, defended on the front foot"
"full on off stump, keeps it out with the full face"
"<b>top edge</b> over the slips. Goes short, he looks to pull, he gets it to third man. Very simple."
"short ball outside off, takes it on with a pull, can't connect"
"length ball outside off, pushes with hard hands to mid-off"
bouncer slanted into his body. He backs away to try and find some room. But can't connect on his heave
well this is futile. Bangs another in short and is humiliated by the No. 11 who does superbly to create room this time and hammer it past the non-striker with a pull. It's a no-ball too.
<b>Dowrich runs back and holds on.</b> Another short ball. Another attempted pull. It's a top edge that gives the keeper some 10 yards of sprinting to do. He gets under it and holds on. They've checked for no-ball and he's just managed to get his heel behind the line
"length ball on middle, and it stays <b>low</b>! Forced to adjust his shot, and clips it towards backward square leg"
"full just outside off, and this time it curves away from the right-hander. Left alone"
"length ball just outside off, and straightens after pitching. He gets inside the line of the ball and blocks off the front foot"
"on the fourth-stump line outside off, and he comes a bit forward to defend with soft hands"
"back of a length on off, and squares the batsman up. Defends it eventually off the back foot"
"back of a length outside off, and swinging away. Shoulders his arms on this occasion"
"length ball on off, and going away from the batsman. Cuts it off the back foot, and manages to pierce the gap between point and cover point"
"starts off on leg stump, but the ball swings away towards off. Pushed off the back foot to cover this time"
"back of a length on off, and Smith goes for the pull. The ball's swinging away, so he can only slice it. In the air, but the ball goes over the slip cordon. Smith'll feel lucky"
back of a length on middle. Smith goes onto the back foot and plays it with soft hands from near his chest. The ball rolls back to the bowler
"full on off, but angling across the batsman. Shoulders his arms. Uneven bounce once again as it stays low while going through to Dickwella"
"full on off, and shaping nicely away from the batsman. Covers his off-stump line and shoulders his arms thereafter"
"back of a length outside off, but aimed at off stump. Brathwaite shuffles across and fends off the back foot"
"extra bounce! Snaring delivery that whizzes past the batsman's helmet. Brathwaite contemplated defending it, but then drops his hands to let the ball go through"
"back of a length outside off, and that's been pushed off the back foot to the cover region. Finds the gap at extra cover that lets them rotate the strike. Played this from his toes"
"back of a length on leg stump, and this is only 123kph. He's through his pull too early, so the ball hits his waist instead. It trickles down to fine leg"
"short! Pitches on off, and loops over the ducking batsman's head"
"back of a length outside off, but aimed at the batsman's body. Rides the bounce and blocks off the back foot. Soft hands keep the ball on the floor"
"full on middle, but swinging wildly across the batsman's body. He lets it go through to the keeper"
"yorker on off stump that Smith blocks back to the bowler. It started from leg stump, but the swing takes the ball in front of off"
"full outside off, and going away from the left-hander. Takes a big stride forward but then lets it go"
"full on off, but shaping away from the batsman. Covers his off-stump by shuffling across and then shoulders his arms"
full on off and going away from the batsman. Lets it go once again
"length ball on middle that ends up outside off. Smith attempts to free his arms, but his cut finds the infielder at cover point. <b>Maiden</b>"
"full just outside off, but the ball stays <b>low</b>. Defended from in front of off stump"
"length ball outside off, but shaping further away. He loaded up for the cut shot, but chooses not to play it. Through to Dickwella"
"length ball outside off, and this time it straightens after landing. Punched off the back foot, but can't breach the gap at cover"
"length ball outside off, and Brathwaite shoulders his arms after covering his off stump"
short to test Brathwaite. He ducks under the line of the ball this time
"length ball outside off, and slightly shaping away. Brathwaite's in no mood to engage with it"
"good length ball on off stump, and Smith rocks back to punch it towards mid off. Diving effort from the fielder stops the single"
