"full and outside off, eases it down to long-off"
goes back to flick to the right of midwicket
nudges to midwicket
drives serenely to long-off
stays back to flick a shortish delivery to midwicket
sweeps the length ball on leg stump to deep square leg
pulls the slower short ball to the left of deep square leg
"fuller delivery outside off, he drives through point"
"slower ball, lands at about a yorker length outside off, Rohit jabs it to point"
"looks for the front-foot pull again but this time Hasan's short ball gets to him too quickly, going off the splice of the bat to mid-on"
"full and outside off, he sneaks it past point to third man"
drills a full delivery back at the bowler
single to the right of midwicket. Rohit doing this clinically
closes the bat face and gets an outside edge that wanders down to third man
<b>winning runs</b>! Comes off a leading edge with Rayudu looking for midwicket but finding mid-off
