"full, angled in on off, gets forward and crunches it to cover, where Chahal flings himself full-length to his right and makes a <b>brilliant save</b>"
"very full, angled into off, this is very accurate bowling, dug out to point"
"slower length ball, waits for it and slaps it but can't find his gap. Jadeja is impenetrable at point"
brilliant bowlng. Angles a yorker into his middle stump and it's pushed out to the man at cover. Great over from Bumrah. Pakistan's progress has been seriously stalled here
"tries to take it away from the batsman and slants it well across his off-stump, just inside"
"again, gets him to reach out, and Nawaz stabs it out through point"
"this one's closer to off, punched through the gap between cover and point"
"comes forward to a fuller one on leg stump, but it turns and finds the outside of the bat before running away to point"
"lovely bowling. Full, quick, and sharp outside off, reaches out for a cut and misses"
"throws his arms at a wide shorter one, slaps it over the in-field. Had to reach out again, so off the bottom of the bat, but enough to carry over the deep extra cover boundary"
"yorker outside off, backs away and squeezes it out to third man"
gets some width and slaps it away just wide of extra cover. Sharp single
"extremely full on off, sharp angle into the right-hander, dug out off the inside of the bat to midwicket"
"very, very full, so hard to get underneath those, stays stapled to the crease and makes no contact as the ball goes to Dhoni"
"he's like a machine programmed to delivery only yorkers. This one's around leg and tucks him up completely, nothing the batsman can do about it"
"and finishes the over up with another one, Nawaz manages to push this one out to mid-off for a quick one"
Bhuvneshwar takes over from where Bumrah left and fires a yorker on middle that's dug out straight down the ground. India giving nothing away at the death
sees the batsman backing away and follows him with a yorker that's dug out to the right of the bowler
"walks away early, presumable looking to paddle him away but Bhuvi fires a wide full toss and Nawaz is forced to change plans and slap it to long-off"
gets down for a sweep but this fuller one skips down the leg side
"extremely full, angled in towards middle and off, drills it away to backward point where Jadeja moves to his right in a jiffy and stops it"
"full, very full outside off, makes an effort to get behind the line but can only knock it down to long-off"
"rare error from Bhuvi, gets the yorker wrong and offers up a full toss that goes unpunished. Miscued to deep midwicket for just one"
"follows up the good work from the previous over, another yorker that finds the inside of the bat and goes away to square leg"
"fullish, lots of room, shovels with lot of bottom-hand power to mid-off who is slightly back. <b>Direct hit would've been curtains</b>"
top-class bowling at the death. He's so accurate. Shadab stays leg side and desperately swings and swings hard. Gets an inside edge onto the back pad before it deflects onto the stumps. Have India choked Pakistan out of this game here?
"how does he keep doing this? Another yorker, angled in sharply, worked away to deep fine leg off the inside part of the bat"
squeezes another fuller one to point
"very very full, angled in and tucking him up, worked away to square leg off the inside of the bat. Just one"
"cautious against the Amir inswinger, Rohit defends with soft hands, and doesn't want to quite press too far across either"
"enjoys the pace on the ball as he watches it arrive beside him, cutting behind point. He's standing outside of his crease to negate Amir's sideways movement"
"<b>oooh</b>, there's the ball, pitching in line with the stumps and shaping just a touch into the right-hander. Rohit - by keeping his front foot from moving too far across - meets it with the middle of his bat"
opens the face as he ushers a good length ball in line with the stumps to the luxurious surrounds of deep third man
angles into the left-hander and Dhawan has an easy time flicking to deep square leg. Loud roars from the fans as India get a couple of runs
"<b>falls short</B> of Shadab at point! That would have been an epic blow to India's chances, losing their captain in the first over. Might have worried Rohit too if he fell to Amir again, not least because he absolutely cracks this short of a length ball behind square on the off side"
"oooh, he's lucky. Starts with a wide half-volley but it's so far outside off that Dhawan's ends up miscuing the drive to point"
"<b<yorker</b>, with hints of tail into the right-hander. Good on Rohit to keep his backlift low and jam the bat down"
"<B>beauty</B>! Rohit covers the swing into the right-hander, but he's not prepared for the ball pitching and going on with the left-armer's angle. Snarls past his outside edge. Absolutely snarls"
three fielders hunt down a defensive push into the covers. Pakistan are switched on. It happens when watching an 18-year old quick give it his all
"<b>another yorker</b>, this time outside off, Rohit is equal to it again"
covers the line of a length ball on middle.
comes in at a good height outside off for Dhawan to ease to backward point
"takes a risk to get his runs - walking across his stumps, tempting lbw, but Dhawan doesn't expose his front foot, instead making sure he is nice and balanced to play the flick to the left of mid-on"
punches the back of a length ball to cover
"nice and full, hunting Dhawan's off stump, but a straight bat protects it ferociously"
"excellent placement! He's brilliant square of the off side and here he takes a pretty decent ball - back of a length, in line with perhaps fifth stump - and coaxes it through the gap to the left of point."
"now to third man, showing off his cut shot, waiting until the ball practically passes him to find the gap. Skillful batting. Probing bowling. Engrossing cricket."
"forces him back with a short ball on middle and off stump, Dhawan pats it to cover"
"epic timing again! He reads the line so early, the ball angling into his pads, and after that it was all a matter of getting into position, staying balanced and finding the gap to the left of mid-on"
"<b>inside edge</b> as Dhawan gets sucked in the slipstream of his own aggression. A tad slower in pace from Afridi, dangled temptingly wide of off stump. The left-hander flays at it and nearly ends up bowled"
"short of a length and outside off, he ships it off to point with all the necessary stamps"
"imperious cover drive from Dhawan, hitting on the up, proving this is a batting beauty, at least with the new ball under lights. Good on Imam to cover the ball at, well, cover"
"another ambitious shot from Dhawan - he's definitely feeling it. For now though, he has to settle for an inside edge back at the bowler. Not quite full enough for the cover drive"
away-swing for the right-armer. Hasan Ali introduces himself with a 140 kph delivery outside off and for half a second Rohit thought about playing it
"the Indian captain at his very best! He is perhaps their best player of the short ball - the ability to pick the length early and then shift his weight back, it's almost primal, sowed into his very being. And he shows it all off here with soul-crippling pull shot, if you're a fast bowler"
"back of a length and outside off, Rohit stands up tall and knocks it down"
"angled into off stump, Rohit covers the line and nudges it into the leg side"
"shortish and outside off, punches to deep point"
"full and outside off, he drives to cover"
closes the bat face after letting the back of a length ball come to him and finds square leg lurking
"you can't bowl there! It's dreadfully short - rising only up to his hips - and it's also on leg stump. Rohit finishes yawning, reading a book, messaging a friend and then pulls it over long leg to put it out of its misery"
"nice and full now, drawing Rohit forward with a block to the right of cover"
"<b>dropped</b> by Imam at cover! After three drops in the last gave, Pakistan still insist on breaking their young fast bowler's spirit. Rohit is surprised by a good length ball stopping on him and his on the up drive sits up for an easy chest-high catch. And yet.."
"fullish on off stump, blocks"
careful about not letting that bat push too far ahead of his body after that chance earlier in the over. Good defence from Rohit
"beautiful, beautiful shot. Just makes use of Hasan's pace and angle to hang back and open the face to place it square of the fielder at deep fine leg"
"length ball, slanted across on middle from over the wicket, defended back"
"pushes at a full ball with hard hands, Hasan's angles are sharp and he doesn't cover for it enough, gets an <b>outside edge through the empty cordon</b>"
"short of good length, tries to tuck it away into the leg side and gets a <b>leading edge into the off side</b> as it straightens"
"length ball outside off, stands tall and punches to cover"
works a fullish delivery with the angle towards midwicket
"length ball, angled in towards off, defended back"
"length ball, angles in from wide of the crease towards off, Dhawan punches off the backfoot to point"
"shortish outside off, stands tall and waits for it to come on before steering it away to deep backward point"
"shovelled over covers. Can't be offering so much room, especially to a batsman who tends to read lengths so early and gets in position. Just frees his arms to smash it over the in-field"
"much better, fuller of a good length and straight on middle and leg, Rohit quietly defends back"
"short of good length around middle, gets a bit of extra bounce, Rohit drops it into the surface as he tries to get on top of it"
comes forward and turns a length ball away to midwicket
"slides it across to Dhawan's off-stump, and he clips it to mid-on off the front foot"
gets down to sweep but manages no contact as the ball skips down the leg side
"stays back to a length ball and wears it on the pad as he tries to whip it away. Pitched outside leg, and hitting outside leg as well"
"teases by getting the backfoot out and then moving back, Nawaz fires it wide and Dhawan cuts to backward point"
"Dhawan's trying to force something here, gets down and sweeps without getting enough room, just makes enough contact to tickle it away to short fine where Shaheen makes a diving stop"
stays back to a length ball and blocks to cover
"good length on off, defended to point"
"just back of a length, slower at 122ks, stays back and punches to point"
"oh, shot! Walks across early towards off and just walks into a forward press and push down the ground, between long-on and long-off. Laser-guided"
"again, walks across towards off, but this time gets an accurate straight length ball that he keeps out on the front foot"
"short of a length on off, stands tall and stabs it to point"
"beautifully played.. he's playing some stunning shots here, and this one's as good as any he's played tonight. Walks across early towards off to get behind the line and just pushes it easily past long-on's left. Another pristine boundary. India take the first Powerplay"
"short of good length, spinning away outside off, whipped off the backfoot to long-on"
"slants across a fuller one, Dhawan presses forward and knocks it between cover and point"
"length ball, turns away outside off, stays put in the crease and blocks to cover"
"pitched up on leg, gets the front leg out and pushes quietly to <b>cover who fumbles a simple stop and leaks a single</b>"
gets the front foot out and drives past Nawaz's left to long-on
"sllder into the pads, pushed out into the off side off the outside of the bat"
"short, extra bounce outside off as Dhawan <b>tries to cut and misses</b>"
"floated up on off, driven to long-on for one"
"length, sliding into leg and Rohit tucks to square leg with the turn"
shifts back to a fuller length and blocks
"back of a length, goes on with the arm outside off, punched past extra cover"
short but doesn't sit up as well for Dhawan who goes too hard on the pull and mistimes it to deep midwicket
"full, pushed across off, Dhawan pushes into the cover and puts pressure on Shadab for a rapid single"
"pitched up and curving in on middle, pushed to cover"
drills a fuller one back to Nawaz
"full on middle, eased down to long-off"
"fuller of a length, leg-side lines, turned away to midwicket"
gets the front foot across and clips to midwicket
spins away as he pushes forward and gets an outside edge to short third man
clips a fuller one off the pads to backward square leg
"full on middle and off, defended back"
flicks a fuller one off the pads to deep midwicket
advances and drills down to long-on off the inner half
lets it spin before turning it away to backward square off the backfoot. Diving save by the fielder there
"spins away from a fuller length and finds the outside edge of Rohit's bat as he comes forward, pulled back at third man"
"full, sliding into leg, blocked"
"pitched up on middle, driven to wide long-off"
"slid across on off, pushed into cover for a very quick single"
"full on leg, eased with the angle down to long-on"
threatens to move down and then comes back into position before blocking
"pushes it through on off stump, trying not to turn the ball, Rohit plays it late and well"
attempts a late cut to a googly - a well disguised one at that - and gets an inside edge. Poor Shadab has his hands on his head as it wanders away towards the covers
"drifts into the pads and turns further inward, striking Dhawan on the back foot. Half an appeal from Shadab. No chance he's getting that"
calmly taps it behind square leg
"<b>extra bounce</b> which Rohit deals with well, hanging back, using soft hands to find midwicket"
leans into a lovely drive away to deep cover
beautiful shot! Gets down low to sweep a fairly rapid delivery on middle stump - which tends to be one of the more dangerous ones to play that shot - but Rohit pulls it off with class
drops it to the left of cover for an easy single
"skips out to meet the flatter delivery on leg stump, and realising he doesn't have room for the big shot, defends"
smoothly pushes the half-volley on leg stump to long-on
"looks to swindle a single behind point, opening the face as he defends the ball, but short third man denies Rohit the chance"
"sees a poor ball outside off, gleefully rocks back and carves it away behind point. Sensible batting from the India captain"
lovely flight - and drift away from the left-hander - Dhawan is wary of the threat as he defends with soft hands
"feigns a move to leg stump, which might have made Shadab stray on the pads. Dhawan happily picks up his single at square leg"
"premeditates a lap sweep and sets off for a single, but Amir at short fine leg cuts the angle well"
"teases Rohit outside off, daring him to go for the big booming cover drive. Rohit stares at it suspiciously - not unlike my mum when I used to tell her I'd finished all my homework - and then lets it go"
"length ball outside off, he steers it to sweeper cover"
"shapes to sweep - but then stays upright seeing the ball at quicker pace and flatter trajectory - pulling the ball towards the square leg boundary. Desperate dive from Shaheen at the boundary, but it's not quite enough to deny <b>Dhawan his fifty</b>"
lovely high elbow as Rohit punches the short ball outside off through to sweeper cover
"vicious! This is one of Pakistan's best wicket-takers but he looks tamer than a hologram, bowling a silly short ball and getting hammered straight of midwicket"
slower ball is Hasan's reply and Dhawan calmly turns it behind square leg
"<B>strikes him on the back pad</b> with the back of a length ball skidding through to Rohit. He weathers an appeal for lbw, but it is too high"
"full on middle, Rohit works it through midwicket"
"looks for a cut shot, but gets an outside edge that scurries away to deep third man"
deflects behind square leg to bring up India's hundred. He has to do it the hard way though with his front foot planted across all his stumps
"low full toss, which Rohit is happy to put away to long-on"
fierce again! Dhawan steps out of his crease - daring personified - gets to the pitch of a legbreak drifting across him and thumps it straight down the ground. Good ball turned into a half-volley by good footwork
quicker and flatter - as Dhawan expects it to be - and he flicks behind square leg
"shimmy down the pitch again, and turns the googly, with the turn, through midwicket"
drags his length short and Dhawan is quick on the cut
"fluent hit through extra cover, taking full advantage of the opportunity to lunge at a wide ball outside off"
"shortish and outside off, cuts to point"
"length ball on middle, Rohit defends"
"a wild swing at a slower ball outside off and he's beaten. Scratch that, he's made to look like a rusty old gate"
"fullish on off stump, Rohit gets his bearings right and blocks it out properly"
chops down on a shortish delivery outside off and finds a single to deep third man
allows the ball to come to him and slants it away to deep third man
another eat-your-heart-out pull shot! And that's been Pakistan's problem. Good ball followed by a poor one and India have been alert to nearly all of them
"here's the slower short ball and though Dhawan is set up for the pull shot, he pulls out of it"
"quick single with Babar right on the edge of the circle at mid-on. Splendid batting from Dhawan, playing with soft hands just so he can pinch the run"
"<b>gets back-to-back fifties</b> with a simple flick off the pads, a little way to the left of square leg on the boundary. Fine batting. Pakistan really shouldn't have dropped him in the sixth over..."
"full and outside off, spears it through the covers"
<b>inside edge</b> as he looks to drive on the up but the ball is a little too short for such shenanigans. Does get a single through midwicket though
"bouncer from round the stumps, Dhawan sways away"
<B>offcutter beats Dhawan</b> as it grips the pitch and straightens from the angle round the stumps
"more short-pitched bowling, but with it climbing over his left shoulder, Dhawan does the right thing and leaves"
"<b>another snorter</b> - and it's the offcutter again. Pitching in the in-between length so Dhawan can't come forward or back. It turns as well, squaring him up and beating the edge"
"short and outside off, smears it to cover point"
"a simple defensive shot, and India find a way to profit off it. Good work from Rohit, playing it softly, beating point on his left and then once that happens, he kicks into over drive, taking the second run as well"
"slower short ball, which Rohit adjusts to and pulls to deep square leg"
"low full toss on middle, Dhawan turns it to midwicket"
"short ball on off stump, Dhawan uses the depth of the crease well"
punches to the left of cover
"launches the short ball to the square leg boundary! Effortless hit from Dhawan, making Amir pay for a terrible ball. It's short. It's sliding down leg. All it's missing is a please hit me sticker"
"length ball on off, defended back"
"fuller this time, width available outside off, ad he pushes it out through extra cover"
"length ball, angled in and straightens around off, plays late to point"
"short ball, doesn't manage to get entirely on top of it, pulled a couple of bounces to deep midwicket"
carves a fuller one away through the gap at cover
"too easy. Banged in short, no pace on this surface, Dhawan finds all the time he needs to rock back and pull behind square for another four"
advances and gets a high full toss that's turned gently away to midwicket where <b>Fakhar dives and throws wide and Malik backing up shoddily lets it go</b>
"short ball, Rohit picks it in a moment, shifts back, transfers weight onto the backfoot, and pulls imperiously over deep midwicket"
tries to open the face and run it down to third man and gets <b>beaten</b>
"fetches a sweep from outside off and miscues it off the top-edge. Luckily for him, it lands in the vacant spaces behind square leg"
defends a length ball back to the bowler
"shot! That is just so beautiful, it's the kind you can watch over and over without blinking an eye. Just reaches out slightly to a fuller one outside off and drives with authority through the covers. These are trademark Rohit shots"
advances down the ground and drills this down the ground
"fuller of a length, turns away outside off, blocked"
"length ball, slid into the leg side.. this is shoddy bowling. Feeding them helpful angles. Rohit gets down and crunches a sweep through backward square leg"
stays back and blocks back
"full outside off, pushed to point"
moves back and across to a shortish one and jabs it back
shifts back and punches a shortish one to extra cover
advances down the ground and crunches a full toss to long-off
pushes a fuller one down the pitch
"rocks back to a short one, they're giving both batsmen so much time with these shoddy lengths. Slapped over deep midwicket"
"<b>dropped. Again! </b> Another short ball, Rohit pulls this really, really hard. Little time to react, but got to cling on to those"
front-foot defence to point
"short of a length, straightens on middle, happily skips back and slaps through the covers. They're not even trying hard now!"
"back of a length on middle, turns it away to midwicket"
"full, slid across off, comes forward and blocks"
"full on leg, clipped off the pads to square leg"
hangs back and punches it down to long-on
"pushed across on off, drilled down to long-off"
"pitched up outside off, eased down to wide long-on"
drives a full toss down to long-on
"cut off the backfoot, ideal length and enough width, all he had to do was find the gap, and he picks the inviting ones between cover and point"
"length outside off, defended to point"
clips a fuller one off the pads to deep midwicket
"googly that spins into him from a length, picks it and punches down to long-on"
"length, pitching outside leg, nudged into the on side"
"leg side length ball, swivels around and swats it down to fine leg"
"short, angled into him, transfers the weight onto the backfoot and pulls through backward square leg. Both batsmen in a race to the three-figure mark now"
hangs back and opens the face to third man
"full outside off, goes a little too hard at it and mistimes it to mid-off"
"short, wide, jumps and flays an uppercut through backward point. Onto 98 now"
"length, pitching outside leg, tucked to square leg"
spins away as he closes the face and takes the <b>leading edge towards short third man</b>
"pitched up outside off, eases it down to long-off <b>to move to 99</b>"
defended into the on side
"full, pushed across off, defended"
clipped off the pads to deep midwicket. Rohit keeps the strike
<b>brings up 7000 runs in ODI cricket</b> by opening the face for a neat dab to deep backward point
<b>there's the hundred</b>.. Dhawan wins the race. Gets a dolly of a fuller delivery and just takes a good stride forward to send it screaming past the right of extra cover
"full around off, drills it hard off the inside of the bat to mid-on"
"miiiiles outta here! Full, slow and in the arc outside off, slogged muscularly over the large deep midwicket boundary"
predictably drags it back and finds point with the cut
"that's been put away with disdain. Short and loads of width outside off, slaps it with brute force past the left of mid-off"
"full, slanted into him from around the wicket, nudged into the leg side"
gets some width and plays it late to point
"oh, dear! A run out! That was probably the only way India were going to lose a wicket tonight. Walks off to a rousing ovation from the crowd. As for the end, Rohit tapped this to point and yelled out a no. Dhawan was always up for the run, sprints all the way up towards the other end. Rohit was never keen. Too late to recover. Disappointing end to a top knock"
pushes a fuller one down to long-off
"back of a length, shuffles across and blocks to cover"
defends a length ball on the front foot
a straightforward clip off the pads to deep square leg
opens the face and steers a short ball to point
firm push to mid-on
slices a shortish delivery on and around off stump to deep third man. Good work with the wrists
turns a length ball on middle to deep square leg. And so we wait.
that's his trademark. Reads that the short ball is outside off and that third man is wide on the boundary. So he presents the angled face and lets the pace of the bowler do his work for him
"tosses it up from round the stumps, Rohit gets forward to block"
"<b>hundred for the India captain</b> and he works that extra bit harder to get to it, tapping the good length ball to deep square leg and immediately sensing he can get the two runs he needs. Great fitness. Class batting. And now, for only the <a href='http://stats.espncricinfo.com/ci/engine/stats/index.html?batting_positionmax1=2;batting_positionmin1=1;batting_positionval1=batting_position;class=2;filter=advanced;groupby=innings;orderby=start;orderbyad=reverse;qualmin1=2;qualval1=hundreds;team=6;template=results;type=batting' target='_blank'>seventh time</a>  in all ODIs, both of India's openers have hit a century in the same game"
"full and outside off, drives through cover"
clips a full delivery towards midwicket
drives the full delivery outside off to extra cover
taps a flighted ball back to Malik
gets up off his toes to blunt a slower short ball on middle
"good length on middle, he blocks to mid-off"
slogs across the line - which is really really odd - but he still gets runs with Shadab misfielding at midwicket - which is also really really odd
gets inside the line of a short ball on off stump and pulls it to long leg
"<b>front-foot pull</b> and it soars into the crowd behind square leg! Rohit is insane with this shot. For half a second it seems like he's hurried, that the ball gets big on him, that maybe he's even top-edged it. But it's only as the ball keeps climbing in the air do you realise the timing he's got on the ball."
blocks to cover
