"gets some swing straight away, nips into left-hander from a back of a length, but a little too sharply as it skips down the leg side"
"<b>direct hit at the striker's end.. but he's in, well in</b>. Short of good length, gets on top of it and tucks just wide of midwicket for a very quick single"
"fullish length, angled a long way across the left-hander, left alone"
"accurate length ball on off, covers the stumps and blocks down the pitch"
"strays away again, short of good length and leg sidish, Fakhar Zaman tries to whip it away off the pads but the ball deflects off the front thigh down to fine leg"
"short of good length, angled across around the fifth-stump channel, stands tall and punches into the covers"
"just back of a length, a lot more accurate, on middle and off, covers the stumps and blocks into the on side"
"short of good length, pitches outside leg stump, defended solidly back down the pitch"
"short around leg stump, swings around a tad too early with the pull and gets a glove onto the body"
"short of good length, pitches outside leg and comes on at middle with the angle, defended"
"shortish, offers him some width outside off, and Fakhar stands tall and punches to the covers"
looks to flick across the line and gets hit on the pad off the inside edge after this one pitches outside leg
"back of a length, tucks him up around the leg-stump line, defends down the ground towards mid-off"
"short of good length from over the wicket, shuffles across and turns it away to midwicket"
waits for this length ball and closes the face to whip it away to midwicket
"short of good length around the leg-stump channel, moves across and tucks it behind square on the leg side"
swings loosely at a wide length ball without making any effort to get close to it and gets <b>beaten</b>
"length on middle and leg, waits back and defends solidly"
"full, wide, leans into a drive to the right of extra cover"
"leg-side length ball, shifts across and works it to midwicket"
"short, nips across him with extra bounce, Fakhar loosely punches away from the body and <b>gets beaten</b>. Even Dhoni is caught off guard by how that carried"
defends a length ball back to the bowler
"short, wide, opens up and scythes it past point leaping to his right"
"short of good length on off, defended towards extra cover"
short ball that <b>straightens</b> down the middle stump channel and cuts him in half to go past the inside edge to the keeper
slashes at a length ball and finds cover
stays back to a length ball and punches into the covers. <b>Dots building up</b>
"full, angled across towards off, stays a bit legside of it and pushes it out to mid-off"
"throws his hands at a wide length ball, <b>no feet</b>, gets an outside edge down to third man where Kedar Jadhav just about stops it in front of the boundary"
"length ball on off, waits and punches to extra cover"
"back of a length, gets back and drops it in front of mid-off for a very quick run"
"length ball, angled across on middle and off, defended"
gets some width with that angle and he punches it to the right of mid-off for one
"good length on middle and off, defended down the pitch"
"Imam finds the gap.. and it was an easy ball to put away. Full, angled across off, gets the front foot across and places it square of the wicket on the off side"
"short of a length, holds its line outside off as Imam shoulders arms"
"shortish, slanted across, and the angle on this one's even sharper, leaves it confidently"
"length ball on middle, stays back and turns it away to midwicket"
"tries to whip it across the line but this one's too straight and offers him no room, <b>strikes the pad and rolls away into the off side</b>"
pushes away from the body at a wide fuller ball and doesn't find the middle as he drills it away to mid-off who is slightly back
shuffles across to a length ball and defends it back
tries to opens the face really late but gets undone by the late movement as it leaves the bat and goes to Dhoni
"length on middle, turns it away towards midwicket"
"pitched up on middle and leg, pushed back"
"slides on with the arm around off, Fakhar pushes forward and finds the outside edge through the third man region"
turns a fuller one away into the on side
"spins in from a leg-stump line, turned away off the pads to short fine leg"
"pitched up around off, gets the front foot across and pats it away to midwicket"
"nicely done. Draws him forward and finds the pad as he tries to flick it. Appeal for leg before turned down, but <b>Rohit asks for the review immediately</b>. Nicely flighted outside off, Imam comes forward and plays across the line, the ball spins past the inside edge, but has it spun too much? Nope, just about enough to hit the top of middle and leg. Great review"
"pushes a fuller one from outside off to the right of extra cover, <b>doesn't find the middle</b>"
"length ball on off, shuffles across and blocks back down the pitch"
"stays on the backfoot and loosely defends a short of a length delivery, gets an inside edge onto the boot"
"short of a length, nips away late outside off, opens up and punches off the middle to cover"
"short, wide, slaps at it but the ball sneaks in pretty late and he gets <b>beaten</b>"
"length ball on the fourth-stump channel, shuffles to cover his stumps ad blocks"
"pitched up on middle, pushed down wide of long-on with the spin"
shifts back to a length ball that slides into middle and leg and blocks
"full, slides into leg with the arm, pushed to mid-on"
"lots of flight on leg, makes space and drives wide of long-off"
"gets down to sweep from outside off, but it spins in and lobs up past leg slip off the glove and into the forearm"
"googly, cut in front of middle stump"
"introduces himself with loads of flight on middle, Zaman says pleased to meet you too with a push to long-on"
invites the drive once again - the ball lobbing up like a fruitcake over Babar's eyeline. He crunches a drive but it goes only as far as cover
keeps a middle stump line this time and Babar works it to midwicket
<B>dip and turn</b> which secures the inside edge as Babar steps forward to block outside off. Kuldeep imagines a time when he had a backward short leg and this became an easy catch
taps a slow one - the googly - on his pads to long-on
"plenty of width, but Babar still isn't able to capitalise. Fluent drive, but only as far as cover"
"drifts it over to off stump, and with very little room to work with, Fakhar is happy to defend it"
"well flighted on middle and leg, Fakhar drills it to long-on"
"head over the ball, strong front foot stride, then the toe turning away from the ball so he can flick the ball to long-on"
"whips down the ground, with the turn"
"pulls his length back - and the ball holds in the pitch just a touch as well. Babar, though, defuses it to cover"
finds the single at long-off.
keeps the front foot away from interfering with a sumptuous on-drive
<b>slog sweep</b> and it goes miles! He has to reach out to meet the ball off the middle of the bat - but Fakhar doesn't care if he goes off balance. He still has this magical ability to generate power. And Kuldeep watches the ball sails over midwicket
"direct hit at the striker's end from Jadeja, but Babar appears to be home. Yep. Well judged single from Fakhar, dropping the ball with soft hands at cover"
"follows the ball, looking for a leg glance, which can be risky with leg gully in play. The turn is too much"
"googly, pitching on leg stump, asking Babar to close the face and pop a leading edge. All of that happens - except Babar uses soft hands so it doesn't travel very far"
rocks back against a googly pitched short and hammers it to cover
waits on the legbreak on middle and leg and nudges it away quietly to midwicket
"pushes it through, asking Fakhar to bring his bat - a straight one - down quick on leg stump"
drags his length short and Fakhar has a simple escape route to long leg
stays legside of the tossed up ball and drives smartly to long-off
a gentle little love tap to long-off.
"firm push past the left of cover, and that wakes the crowd up. They've clearly forgotten India have a man in the deep there. Hehehe."
"stays back despite the flight on this ball, but on a slow pitch, he can take that liberty. Neat little flick to long leg and good running gets them a couple."
a whirl of the wrists as Babar sends a leg break on leg stump to think about life at long-on
"gets the freedom to swing and swing he does - another slog sweep, another boundary. Fakhar is reading the line of the bowler very very well."
"<b>he's sprawled all over the pitch and he's also out lbw</b>! Fakhar loses his balance as he strides out, tempted by yet another loopy treat from Kuldeep. The studs on his front foot fail him and he takes a proper tumble, and more or less falls on top of the ball. All in front of middle and leg stump - which gives umpire Tucker the leeway to get that forefinger up. <b>Replays by the way indicate Fakhar managed a glove on the ball</b> before it hit his body and had he reviewed, he might have saved himself."
lunges forward and blocks the tossed up legbreak outside off
goes back and works it through to deep square leg
"googly, on off stump, Babar keeps it out"
"quicker and flatter on middle, he defends"
steers a good length ball towards point
"a near yorker on off stump, Sarfraz eases it to the sweeper"
the million-dollar drive to deep cover. Babar is gorgeous when he is in full flow
"<b>Babar's run-out</b> and it's the price of a little bit of greed from his captain. Sarfraz taps an innocuous delivery away to point and looks for a single. He takes a few steps out, which then signals Babar to get his skates on. Eventually, Sarfraz realises he'll never make it and sends his young gun back. But the fielder Chahal has spotted the opportunity and sends a stinging throw to Jadeja, who does the rest"
works it towards midwicket
flicks to deep square leg
full face of the bat - almost an apologetic one as he concentrates on putting the run-out from his mind.
"good length and outside off, he defends it well"
welcomes the ball on his pads with a stinging clip to long leg. Ouch!
he looks a little tentative against Bumrah's pace and his angle from wide of the crease. Has enough composure to push the short ball into the covers though
"and reads the slower ball well. Rock-solid defence from Malik, the hero from the other night. He'll have to do something equally outrageous today to bring Pakistan back into the contest"
"full and outside off, he drives to long-off"
"good length, outside off, Malik pushes it past the left of cover"
"leaps back, and away from the ball on middle stump, so he can punch it through cover point"
"quicker delivery, looking for it to go on with the arm. Malik uses the crease well and late cuts to short third man"
drives to extra cover
a firm drive to long-off
keeps him pinned to the crease with a short ball on off stump. Malik uses soft hands to bunt it to point
<b>uppish</b> but the flick shot is placed in the arid land of square leg. Not a soul there
"good work from Jadeja at point, diving away to his right to stop a cut shot that Sarfraz was hoping to get a single out of"
more frustration for Sarfraz as he sees his Rohit moving quickly to his left to stop a well timed on-drive
right up there from Bumrah and the batsman pushes towards cover
"bouncer to finish the over, Sarfraz lets it through to the keeper"
lunges forward and drives to the right of extra cover
"a touch short, allowing Sarfraz to go back and punch to long-off"
"superb cricket! There aren't very times Jadeja bowls short - but here he does and Malik takes full toll. Lovely footwork to push back, and the presence of mind to delay his shot so he can place it behind point"
"full on middle, defends"
shifts back to the quicker ball on middle and blocks it
solid defence to short cover
"tossed up outside off and spinning in, punched back"
"flat length ball that spins the other way, backs away and cuts to sweeper cover"
"full outside off, eased down to long-on"
"pitched up on middle, driven down to long-on"
"floated up on leg stump, turned away into the on side"
shifts back to a length ball and tucks it away with the turn to deep miwicket
"backs away and tries to force a cut, <b>nearly shaves the edge</b>"
"length, spins towards off, defended"
drives a fuller ball down to long-off
"full on middle and off, driven to long-off"
"back of a length, straightens down middle, punched off the backfoot to long-on"
advances down the ground to meet the pitch of a length ball and wristily whips it through the vacant deep midwicket boundary. Top shot
shifts back and tucks a length ball to deep midwicket
""
"pitched up on middle, turns it away to midwicket"
defends a googly off the front foot
tries to stay back and flick and wears it on the pad
shifts back to a back of a length ball and punches crisply to midwicket
"length, spins away on off, defended"
shifts back to a length ball and punches to point
"gets down to sweep, and may have got a bit of an edge onto the pad as it goes away to short fine"
"full, curving in on middle, defended"
"loose ball, gives him a world of room outside off, Malik latches on and thrashes it through backward of point"
"pitched up on middle, eased down to long-off"
punches a googly off the backfoot into the off side
"floats one up on middle and off, driven to long-off"
shifts back and blocks a back of a length ball towards mid-on
gets down on one knee and crunches a sweep from around off to deep square leg
"short, a bit of room, makes some for himself and slashes it out to cover"
"full on off, defended back"
"length, slid into off, backs away and chips it over the extra cover region"
"length on middle, flicked out to midwicket"
"short, spinning away, hangs back and opens the face to third man, DK gives it chase and pulls it back"
steps forward and drives to mid-off who dives and stops
comes forward and blocks to cover
"back of a length on off, blocked into cover"
"flat length ball, punched to midwicket"
"pitched up around leg, clipped through square leg"
"fires it full and flat, pushed down the ground towards long-on"
clipped off the pads just wide of midwicket for a quick one
"full outside off, fired with a very low arm angle, clipped away to the on side"
"pushes a fuller one back.. Good, tight start for Jadhav"
"pitched up on middle, driven to long-off"
plants the front foot forward and punches a length ball away to sweeper cover
"full, slides into leg, defended back"
"length, spins away, brings the bat out late to defend to point"
"legside fuller ball, inviting him to hit, and Malik says thank you before going down on one knee and slog it over square leg"
"pitched up on off, driven to wide long-off"
"flat length ball, punched down to long-on"
"pitched up on middle and leg, driven down to long-on"
no feet movement as he defends this fuller one in front of off
"full on off, eased down to long-on"
drills a fuller one to long-off
"another fuller ball, fired straight outside off, drilled away to long-on"
presses forward to a length ball and defends
drives a fuller one to long-off
"pitched up on middle and leg, blocked"
thinks of coming down the track but Chahal shortens the length and he cuts with the turn through cover and point
"leg-side fuller ball, eased down to long-on"
cut from a little close to the body and finds point
drills a flighted delivery to long-on
"sneaks in the round-armed delivery - but manages to keep it on middle stump. Sarfraz knows he can't play across the line, lest he open himself up for lbw. Single to long-on."
swings hard at a short ball - but it just doesn't rise up high enough for Malik to get under. Jadhav says his lack of bounce is key to his bowling
"creams it to the cover boundary! Sarfraz gives a withering stare at the ball, after having bullied it away with a straight bat and a lot of power"
leans into it and gets a single at deep cover
"and more runs! Malik is a genius at assessing the middle overs, and spin bowling. Here he picks the short ball, makes a little room and carves it behind point where all the sexy gaps are"
backs away and prepares the ball for takeoff over cover. But mission control bamboozles him with a googly and the inside edge goes to long-on instead
"thrusts his hands at a quicker, flatter delivery on middle and sends it to midwicket"
gets forward to block in front of off stump
"lobs it up wide of off stump, but Malik is content to hug the crease and spear the ball through cover point. Good running as well. Both of em are sweating buckets, but the're not missing run-scoring opportunities"
big stride forward to deflect a legbreak on middle to midwicket
eases it through the covers to retain strike
"searches for a single behind point, but the open face doesn't do him any good, steering the ball straight to the fielder. Might wanna return that at the store"
"angling into off stump, and nearly strikes the pad first before bat. Malik though is aware of the danger, and also avoids it by pushing his bat forward just enough"
spots the short ball - good variation from Bhuvi - and pulls to deep square leg
dives to his left and stops a boundary - splendid work from Jadeja. Sarfraz certainly likes pace on the ball
"full on off stump, defends stoutly"
manages to keep away from the lbw trap by doing the one thing he needs to - especially after falling over a straight ball - putting his bat out and turning the ball away to midwicket
the good length ball doesn't come on to the bat and Sarfraz's drive on the up ends up an inside edge
pushes towards extra cover
<b>inside edge again</b> as Sarfraz sweeps a ball that doesn't really give him any room to do so. Plus Jadeja's rapid pace makes that shot even more dangerous
another smoooooooooooth drive to deep cover
defends a full delivery on leg stump
takes guard outside leg stump - which tempts Jadeja to bowl wide of off - which is exactly what Sarfraz wants as he cuts to the sweeper cover
"little late cut, but can't beat Jadeja at point"
"direct hit from long-off running up, but Malik has made it through, thanks to the early call for a single. Plus he was on the front foot, driving the ball"
"he's at the ball before it arrives, outside off, and ends up directing it to midwicket when his intention was to push it to long-off"
"lovely work from Sarfraz, waits on the short ball outside off and guides it to deep third man."
"<b>fifty for Malik</b>, the second one in two games, and he gets there with a no-fuss flick through midwicket. Dubai rises to salute a fine batsman. His work isn't done yet though. Malik isn't just Pakistan's best accumulator, he's their best finisher too"
"good length outside off, punches to cover. <b>That's drinks</b>"
thrusts his hands at the ball outside off and guides it neatly to the left of cover
beautiful shot - it looks like Sarfraz's confidence is flooding back. These are the shots he played against Herath in the dying light in Sharjah in that epic Test. Backing away from the ball and launching it over extra cover
slices it through cover
"quicker delivery on middle, Malik blocks it"
pushes his bat in front of his body for a single ot long-on
"steps out of his crease but Jadeja gets the warning sign and responds to it well, shortening his length and pushing it wider outside off. The Pakistan captain ends up defending a ball he clearly wanted to attack"
<b>googly</b> which Malik adjusts to only at the very last second. Soft hands helps Malik as he finds a single at cover
"the legbreak now, drifting outside off, drawing Sarfraz to flick around his front pad."
"googly again - pitching outside leg, allowing Sarfraz an easy single with a sweep shot"
eases a loopy delivery outside off to cover
"good length on middle, he keeps it out"
"wanders back into his crease, meets the googly with a roll of the wrists and finds a quick single behind square leg. Excellent batting against spin. He's using the advantage given to him by a slow pitch, and he's doing so by moving his feet and reading the length of the ball early and decisively"
feral roar from the crowd as Malik  sends it out of the park. Once again it's the footwork - and to come down the track against Jadeja is never easy. Having done that though he launches the 99 kph delivery straight over the bowler's head. Magic
taps it towards point
"he's stepping out too - but he goes slogging at the ball, dragging it from outside off to deep midwicket"
steps away from the quicker delivery on leg stump and chops it towards point
"looks for a single after blocking a flatter delivery on middle, but Sarfraz don't want it"
eases it to the sweeper cover
"too short from Kuldeep and Malik hammers it away to deep square leg. Supreme fitness from the two Pakistani batsmen, picking up a couple having batted for hours in the horrid heat."
"the wrong 'un, tossed up on leg stump, Malik does well not to play against the turn, as the line is asking him to do"
"another googly, which Malik calmly puts in front of point for a single"
three on the trot that turn the other way and Sarfraz - having made room well before Kuldeep released the ball - cuts it away through point
"that's tame! He's been slowly amping up his strike-rate, calmly going for the big shots, making India fret, making Pakistan hope. And he throws it all away with a little poke to cover. The wristspinner works his magic and Sarfraz walks away, throwing his head back in disgust. He was looking to clear the infield but just doesn't get enough elevation"
"tosses it up on middle, Malik defends"
a little bit of swing into the right-hander - <b>reverse?</b>. Malik blocks it well
"slower ball outside off, Malik dabs it to deep third man"
exploits the width on offer with a tap to deep third man
"more curl into the right-hander and a <b>direct hit would have had Malik!</b>. For once he's off his bearings, poking the ball to point, where India's best fielder is, and looking for a run that isn't there. Jadeja has one stump to aim at but it proves too difficult even for him"
"taps a short ball to the left of midwicket and manages another quick single. Oooooh, this is tight too. The tension's building again"
"good length on middle, he pushes it down the ground"
"fullish length on leg stump, stays back and blocks"
"length ball that comes on straight, tucked to midwicket for another <b>very tight single</b>. Kuldeep doesn't collect the ball cleanly but probably needed a direct hit. Pakistan living on the edge"
turns it away to short fine leg
"pitched up on leg, pushed out towards mid-on"
"spins in from a length, tucked away to the left of square leg who moves across and cuts it off"
"back of a length, a wrong'un that spins away outside off, punched back"
"heaves this fuller ball over the in-field on the leg side. Had to fetch it from outside off, so doesn't quite middle it, but good enough for a four through cow corner. Right through the gap"
"length outside off, reaches out late for a touch down to third man"
"length on off, sitting up nicely for Asif who frees his arms and slaps it straight over long-on. Game on in Dubai"
"tries to take this away from the batsman but overcompensates with the length, it's too full, and Asif simply reaches out and drills it away square of the wicket on the off side"
"now he switches back to a length ball but he's giving Asif too much width outside off. These are ripe for the hitting, well inside his swinging arc, and shovelled over long-on. Big over"
"<b>direct hit needed, India miss again</b>. Just taps a short of a length delivery to point, and takes flight. And it's Jadeja, that most electric of fielders, who has shy. Not quite his day"
shifts back to a length and nudges it to the square leg region
clips a fuller one off the pads to the left of deep square leg and pushes back for the second
waits on the backfoot and taps a wrong'un to midwicket
"floats it up wide outside off, takes it away from him, Asif gets down and has a big swing but can't reach out enough"
worked away to deep square leg from the crease
"gets forward and pushes a fuller one, slanted across his off-stump, into the covers"
uses the angle to turn a length ball away to deep midwicket
"ah, well done! Extremely full from Bumrah, chokes him with lack of room as well, Asif squeezes it out between the legs to deep fine leg"
"very full again, can't do much to get underneath those, drilled away through the covers"
"has he nudged that away to the keeper? Yup, he has. Malik walks off. No review. Huge, huge wicket. At a crucial juncture. Not quite the end Malik would've imagined. A length ball, angled into Malik, who looks for a nice little help-along to fine leg, finds the edge instead, and Dhoni gets down to his left behind the stumps to snaffle it"
tries ti flick and the ball raps the pad instead before skipping away into the leg side. Would've missed leg with that angle
"angles a yorker into him, squeezed away to deep backward square for one"
goes back to a length ball and punches to long-on
gets the front foot across and guides a sweep to deep backward square leg
"gets down for a reverse sweep, has to fetch it from outside his leg stump, miscues it off the top-edge, Kuldeep runs back from backward point and it <b>drops in front of him</b>. They push back for the third, and Shadab puts in the dive that takes him over the line as Dhoni breaks the stumps"
stays back and whips this down to long-on
"swings wildly for a big slog, misses the line completely. Zero room offered by Chahal, dead straight and accurate on middle, it's the googly, so doesn't give him the room he needs to connect with that shot and flattens middle stump. They check for the front foot, <b>he's landed it just inside. 50th ODI wicket for Chahal</b>"
tucks away a length ball to midwicket
"length ball, sharp angle into him, results in an inside edge as he chops it into the ground and past the stumps"
"short, angled across, waits and opens the face to drop it to point for a quick one"
