"short ball, Buttler hooks... <b>sends it soaring into the stands!</b> Properly blapped over deep backward square leg, sixth six of the morning for England!"
"short of a length and punched neatly through cover, there's a couple more to the sweeper"
"length, 124kph, slower ball from Nortje, driven in front of deep cover again"
"dug in, smashed on the pull, gets it in front of deep square leg but it won't go all the way - <b>that's the England 350 up</b>"
"short and cracked on the pull again, Malan does well to stop it on the rope, because that was <i>travelling</i>"
tossed up on the pads and flicked to short fine leg
leans out and prods back to the bowler
"tossed up into the rough, Sibley attempts a French cricket-style sweep and fails to connect"
"pushed through, again he nurdles it around the corner to short fine  leg"
"length on the pads, Sibley nudges this fine and gets it past the diving Rabada for four! <b>England's lead passes 400</b>"
Sibley sticks out his front leg and pads the ball away
"goes across, attempted scoop... <b>tickled to the keeper!</b> Buttler walks and Nortje has a third, no sense of England slowing down. Just came off the face on its way through over the stumps"
"short of a length outside off, 141kph/88mph and steered through point"
"banged in short outside off, Sibley clambers down the fire escape"
"fuller, 142kph/88mph, pushed square on the off side coming across"
"hammered in halfway down, over the keeper, too... that would have probably cleared two Sam Currans"
"short of a length, 140kph/87mph and angling across as Curran sways out of the way"
speared in and worked for a single
"floated up full, Curran latches on to the drive, <b>sends this rasping to the cover boundary!</b> More tap for Maharaj"
"pushed through, defended going back no off stump"
"length ball, played with the spin towards midwicket"
"tossed up, worked off the pads square on the leg side for one more"
"continues to pitch into the rough outside leg, tapped away"
"short ball, <b>swung away hard through backward square!</b> Curran swats four more"
"oof, struck on the gloves, <b>pongo from nowhere!</b> Jammed into the fingers of the top hand as it whirred towards his ear"
"round the wicket, hits a length and tucked to the leg side"
"shortish outside off, 123kph/76mph and slapped on the cut through backward point for a couple"
"full of a length outside off and dragged through mid-on, there's some lackadaisical fielding which encourages Curran to think about two, but it's not on"
"length ball, skidding a touch low, Sibley defends - and that will be <b>lunch</b>"
"over the wicket, slides past the outside edge, beaten. Tight lines"
"advances to the pitch, blotted back to the bowler. An exploratory foray"
"rocks back to pounce on the long-hop, the fruits of mixing it up, but he's only gone and <strong>wellied it straight to midwicket!</strong> A long trudge back to the pavilion, as Maharaj gets a bonus wicket to massage his bruised figures"
"down on one knee for the lap, gathered at backward square"
"turning past the leg stump, no contact"
"swept firmly, excellent contact, and an even better stop from Petersen at backward square, flinging himself one-handed to his left"
"angled into the legs, Sibley hops across the line to defend"
"bottom-handed punch out to deep point, one more to the total"
"banged in short, Broad hops back and across, dabs a single into the covers"
blotted back down the track to the bowler
firmly punched to mid-on
"outside off, nudged to point with an angled bat"
"another urgent flurry of limbs, as Broad stoops with the gangly dissonance of a giraffe at a watering hole, and slaps firmly behind square"
"faster and flatter, fended away in defence"
"wider line, another gallumphing slap-mow across the line, can't reach this one"
"zipping through once more,  outside off, with some extra bounce too"
hitting the rough outside Broad's off stump once more
"slipping past leg, slightly off line once again"
"punched, in the air, close to Rabada's outstretched left hand, but eludes it"
"flicked off the legs out to midwicket, as Stokes in the pavilion mimics a revolting slog across the line. That's the intent they are after!"
"banged in short and wide, flinched in the air, through the sparsely populated cordon"
"short and snappy, Broad yawns into a pull across the line, but is only about a light-year off the pace"
"tucked up on the legs, rapping the glove and pushed down, past the lurking presence of Elgar at short leg"
<B>sniffing leather again!</B> Broad hops back and across as the ball batters the splice and loops up into the off side. Root holds his head in his hands in the dressing room. Itchy fingers from the skipper yet?
"<strong>reverse sweep!</strong> Tremendously executed, hauled from the rough outside leg, and slapped through backward point"
"conventional sweep this time, well played behind square, but intercepted this time"
"spannered through long-on, as Broad unleashes his erratic levers on a slog-pull"
"swept off the pads, a delicate deflection on a tight leg-stump line, but short fine leg is well placed"
"another reverse sweep, Sibley keeps on engineering the gaps, this time into the covers"
"battered out to no-man's land, and<b> there's the declaration!</b> Root has seen enough, England have got plenty, South Africa have the best part of five sessions to survive, or score 438"
"a leg-stump loosener, and <B>flipped gleefully off the pads to the rope!</B> That'll cheer him up"
"tighter line, but still shaping to leg with no obvious sign of swing. Dabbed square"
"<B>that's the spot!</B> Outside off, shaping in, left alone as the ball <I>grazes</I> past the off stump! There are two types of leave..."
... and that's the right type of leave as well! Extra kick off the deck as Malan shows his intimate knowledge of his off stump
"a fraction wider, trampoline bounce from a full length, left alone"
"excellent line, excellent leave. Six of those an over, and Anderson will be in business"
"round the wicket, full and wide, and <strong>eased through the gap in the covers!</strong> Broad emulates Anderson with a first-ball freebie"
"three slips lurk as Broad tightens his line from round the wicket, Buttler takes with a tumble"
nudged off the pads for the strike-rotating single
"<B>massive appeal!</B> This looks utterly plumb, but for the slight suspicion of an inside edge ... England <B>review</B> ... what will the replays reveal? Nope, nothing there, <B>or is there?</B> Yes, imperceptible on the first replay, but there's a clear spike on ultra-edge! On we go"
tapped into the off side
"tip and run into the off side, good intent in between the alarms"
"punched off the back foot, into the covers"
"shoulders arms, through to the keeper. Good carry from Anderson, but not a lot of swing"
"off-stump heatseeker, firmly forward in defence"
"tucked off the toes, out to deep midwicket, as Anderson strays a touch straighter"
"fuller length, tailing onto the toes, solidly blocked on the front foot"
"through to the keeper, more leaping bounce on a wider line. Solid enough so far from South Africa"
"through to the keeper once again, as Broad bangs out a length from round the wicket"
skimming in towards the pads as Elgar is squared up in defence
"firmly forward into the covers, Elgar meeting the angle into his stumps with technical competence"
"pressed into the covers, and finds the gap"
"more pleasing contact on the front foot, picks the single into the off side once more"
solid in defence again
nudged into the covers for another single
"England are up in unison as <strong>Buttler dives to scoop up the edge! </strong>But is there any bat involved? Nope, it's front pad onto back pad-flap, which created the deviation. Excellent decision!"
"shaping away outside off, and through to the keeper"
"tighter line on off stump, more leap off the seam as Buttler gathers again"
stretching onto the front foot to defend to cover
"wider on the crease, shaping back into the stumps, another well-judged leave"
"round the wicket, and angled into the pads. Blocked"
worked off the legs to short midwicket
"head over the ball, blocking out the angles as Broad probes away on that awkward inducking off-stump line"
firmly forward to defend to cover
"on the back foot once more, nudged around the corner to short leg"
"tapped to the off side, firm in defence."
"back of a length, tight off-stump line, plugged to the off side"
"leaning onto the front foot, single into the covers"
"shaping across the left-hander, and tucked out to point"
"solid strike, back down the line of the ball, Bess makes good ground at mid-off to cut off the single"
"angled bat, tapped into the covers"
"flinched off the legs, a scampered single to mid-on, could have been tight, but well enough judged in the end!"
"round the wicket, hits a good length on off stump and Elgar crabs across to defend"
"length ball, slightly wide at 135kph/83mph and left alone"
"short, 138kph/86mph and Elgar pulls it in the air, bouncing away towards fine leg"
"over the wicket, back of a length, Malan comes across on off stump"
"back of a length on off, 134kph/83mph and defended softly"
"finds the spot, <b>this jumps nastily at Malan</b>, who takes it on the gloves as he hangs back in the crease"
"full and flighted, pitching around off and defended half forward"
"bit of dip and drift, spinning to clip the leading edge as Elgar works across the line"
"lobbed up on the stumps, punched down the ground to long-on"
"over the wicket to the right-hander, Malan plays back as the ball scuttles on"
"tossed up, wide of off stump and this is dabbed into a gap at cover point"
"quicker ball, spinning through as Elgar drops back and thinks twice about cutting"
"tight lines around off stump, Malan shows it a dogged straight bat"
pushed into a gap at cover for one
"dug in from round the wicket, this gets big on Elgar as he stays back, rides it towards square leg"
"length ball, 134kph/83mph and getting a touch straight, fended behind square"
"over the wicket to Elgar now, 137kph and rising on a fourth-stump line, Elgar blocks resolutely"
lets this one zip through outside off
pushed through on the stumps and tucked to leg
"floated up, Malan is forward and clips one to long-on"
"angled in with the arm from round the wicket, Elgar blocks"
"tossed up a little wider, defended on the front foot"
quicker and straighter and tapped away
"tossed up, straightening a little on off stump as Elgar props forward and blocks once again"
"trundles in and aims for the crack outside off, Malan plunges forward to defend"
"full, bit of a floaty half-volley, 132kph/82mph and Malan is forward, skims a drive through the covers for a few more"
"full on the pads, <b>Elgar crunches it past the dive of mid-on</b>... good effort by Broad but he couldn't get a hand on it and that'll run away for four!"
"fullish again, this nips back on off stump, clips the inside edge before rapping the back thigh and ricocheting to safety"
"full length on middle and off, 137kph and looking to dart away, Elgar reaches out to defend"
on the stumps and tucked to the on side coming across
floated up and defended propping forwards
"flat on the stumps, tucked towards square leg"
"quicker delivery, skipping on as Malan goes back and blocks on off stump"
"outside off, not much turn and Malan uses the crease well to dab a couple through backward point"
"floated up full, chops it down towards mid-on"
flatter on the stumps and tucked away through square leg for a comfortable single
"tight stuff from Anderson, defended getting into line"
"good length, top of off and prodded away square"
"diligent lines, 137kph/85mph and pushed defensively back down the track"
"touch back of a length, left alone outside off"
"still a little short in the channel, again he can leave it alone"
"pitched up, 136kph/84mph and Malan is forwards, defending as the ball hits high up near the splice"
"floated up wide of off stump, left alone"
"pushed in closer to the stumps, slows his pace up as Elgar comes forward to block"
"touch quicker, bit of turn on off stump, opens the face in defence"
"goes wide, quicker ball and Elgar has a flirty push at it, steered towards backward point"
"angled in straight, Elgar clips to the on side and Bess goes across to field"
"floated up full outside off, tapped away"
"banging away on a length around off, Malan blocks"
"comes across to defend again, absolutely no width on offer"
"testing length, 134kph/83mph just outside off and nibbling off the pitch, Malan thought about playing at it before making a late decision to shoulder arms. Well judged"
"fired in with the arm, tapped down in front of the stumps"
"fullish around off, 139kph/87mph and blocked... looks like Anderson is working with the wobble seam here"
pitched up a touch wide of off stump and Malan is able to get forward and leave
"floated up full on off stump, punched to cover"
tapped into the covers coming forwards
"flighted, outside off and Elgar lets it spin through"
"pushed a little straighter, this comes off the inside edge as Elgar props out"
"flighted, around off stump and defended stoutly"
full and drifting leg side as Elgar moves into line and flicks through square leg
"round the wicket to start with, pitched up and left alone in the channel"
"comes across and covers off stump, left alone"
"fired in straighter, 127kph/79mph and blocked by Malan"
"tight leave, <b>zipping through just past off stump!</b> Good length and Malan was playing for the one going away, I think"
"fuller, around off stump, 129kph/80mph and defended coming across"
pitched up and blocked into the covers
"starts with a drag down from round the wicket, Elgar swats it away on the pull as short leg does the turtle"
"floated up from over the wicket, dabbed towards short third man"
"flighted, slow and loopy and drifting on to leg stump, Malan seems to overbalance and is fortunate that the ball flicks his pad and diverts past the waiting Buttler"
"ooh, extra bounce from the rough, <b>raps Elgar on the thumb!</b> That draws some interest from the crowd"
"tossed up and spinning in, again beats Elgar's forward prod and deflects wide of slip off the body! Definitely some purchase for the legspinner"
"gives it some air, wide of off and pitching the rough as Elgar attempts to sweep and takes it on the front pad"
"Curran buzzing away on a length outside off, left alone"
"angled in and then straightening a fraction, Malan leaves again"
"in the channel, again wide enough to leave"
"probing, 132kph/82mph a foot or so outside off, Malan is across and shoulders arms again"
"slightly shorter, angled in and holding its line, no stroke"
"defended coming forwards on off... but Curran has overstepped. Called by Dharmasena this time, although it looked tight on the replay"
"pitched up, worked for a single to the leg side"
tossed up and clipped towards midwicket
"flighted, this spins a touch on off stump and Denly appeals, Malan was forward with bat stuck resolutely next to pad... Not sure which is struck first, but Reiffel wasn't interested"
punched towards mid-off coming forwards
"fullish, around off stump, clamps down on it"
pushed through and stroked for one into the cover region
"back round the wicket, tossed up and scooting out of the rough as Elgar gets into line and defends"
"angled across the right-hander from round the wicket, Malan stays back and opens the face to run one behind point"
"slightly round-arm, pitching outside off and tapped away"
sliding on and defended watchfully
flat trajectory on off stump and Elgar pokes it down
"darted full outside off, reaches out and swipes through the off side, giving Pope at silly point reason to hop about"
"fired in and blocked, safely sees out the over - and that's <b>tea</b>"
"big turn from outside off, and thumps the pad"
"pressed with caution into the gap at cover, and they hustle back for two"
"<B>ripping turn and bounce!</B> Did that flick the glove? Buttler flung himself leg-wards but couldn't locate the ball. Nope, that's arm-guard, but vicious all the same!"
flapped off the hip and Elgar escapes the strike. Right-handers better placed to combat the leggie...
"over the wicket, back of a length, patted into the covers, and South Africa have their first <B>opening stand of 50 for 17 Test innings</B>"
"tapped into the covers, finds the gap again"
"worked out to the leg side, gaps galore behind square"
"outside off, through to the keeper"
pressed into the off side
"banged in short, fizzing down the leg side (and no it's not Root cranking it up, it is actually Curran bowling...)"
"nurdled off the legs, out to square leg"
"knee-high full toss, pumped to short cover"
"solid block back down the track, half-forward in a defensive stance"
"rip once again, flicking the front pad as Elgar leans forward, and it loops behind square"
"hurried into a defensive block down the ground, Denly can't gather with a tumble and Elgar escapes the strike"
solidly forward to block back to the bowler
"rocks back to punch into the covers, no turn from the straight and narrow"
"round the wicket again, but sliding into the hip, tucked to backward square"
"half an appeal as Denly loops one onto the toe, but outside the line. This is probing bowling from the part-timer. Who may be something of a full-timer as this innings progresses"
whittled off the pads to backward square
clipped legwards once again
"shoulders arms as Curran finds some extra zip from back of a length, round the wicket to bend the ball back into the right-hander"
forward and left alone
"squared up on a leg-stump line, over the wicket, tailing across the right-hander, and kisses an outside edge into the cordon. All along the ground"
"good lift again, tight line through to the keeper as Malan leaves alone"
"squeezed off an inside edge, out to safety at midwicket. Life is a lot more peaceful with the right-hander on strike..."
"tossed up on a middle and off line, and blocked on the front foot"
"fourth-stump line, Malan has a look and leaves alone"
"looped up and dips on the crease-line, defended with a bend of the knee"
"flicked off the legs, a sharp single to mid-on as Bess swoops in"
"big turn again, but Elgar is equal to the angles, walking inside the line to nudge behind square"
"tailing into the pads, tucked to the on side"
"sturdy in defence, bat propping down an off-stump line as Curran wobbles on a full length. Midwicket gathers"
"back of a length, tight line, solid block into the covers"
eased up to mid-on
firm in defence on an off-stump line
"squared up on the back foot, solid over from Curran who has located a waspish length"
"leaning back to chop to cover, as Denly comes round to the right-hander"
"a rare loose ball from Denly, a low full-toss, <strong>clubbed with lots of bottom hand through long-on</strong>"
"back of a length, pressed round the corner as Malan strides deep into his crease"
hustled to short cover
"<strong>a yawning launch down the ground!</strong> Elgar doesn't time it as the ball plugs at long-on, but there was intent in his stroke as he used his feet to reach the pitch!"
"<B>huge appeal!</B> Massive delay as the umpire weighs it up, but the finger's gone up finally and <B>Elgar reviews!</B> He was stretching forward, thrusting his bat at the line of the spinning ball, and it was seriously adjacent as ball passed bat. <B>Now then!</B> There's a tiny disruption on Ultra-Edge ... so small that it could have been static... but it's sufficient for the on-field decision to be upheld!"
"blotted into the covers, on the back foot"
across the stumps with a defensive push to mid-on
"angling across the right-hander, a bit of movement as Malan leans forward"
"shoulders arms outside off, and through to the keeper"
"angled bat, out to cover"
nurdled off the legs
pressed into the covers off the back foot
"toiling away, straightening on a middle and leg line"
"dips into the toes, fenced to the leg side as Denly rues one that got away"
"lots of air, dipping outside off, defended on one knee with a full face"
"back of a length, appreciable turn from off stump as Hamza defends with an open face to gully"
"head over the ball, big stride to the pitch"
"through to the keeper, good carry once again"
"rising towards the gloves, just a hint of extra bounce from that mythical crack outside off, poked to point"
"on the back foot, blocked to cover"
pushed to midwicket as Broad tightens his line
fenced into the covers
"rolls his fingers on a fuller length, short cover tidies up a compact drive"
fully forward and pushed into silly point's midriff
"back of a length, just enough width to free the arms, slapped out to cover"
another one slips a touch short as Hamza clatters a cut through the covers
squeezed from a fuller length to midwicket
eased along the ground to deep cover
looped up and clipped to the leg side
deep in the crease to defend
"banged in short, through to the keeper as Hamza drops his hands below the eyeline"
"solid on the back foot, repelling Broad's tight line and length"
"angled bat, down through third man, and <B>that's raced to the rope</B>. No third man, as you'd expect with runs to play with"
fended down to third man
looking for the single to point but wisely sent back as England's fielders swooped in unison
solid in defence
leaning forward to block as Bess locks into his off-stump length
pressed to cover with a bend of the knee
"stretching in defence, full face of the bat, short leg pounces"
"good from Bess, demanding a straight-batted response with a probing line outside off"
a touch more turn as Hamza is hurried on the back foot
stretching forward and pushed to the on-side
tucked to the leg side as Broad drags Malan forward to defend again
"banged in short, through to the keeper"
"back on the straight and narrow, Malan blocks on the front foot again"
"outside off, a hint of variable bounce as this one skids a touch after pitching. No stroke offered"
forward and defended into the covers
"leaning forward, head over the ball"
"whipped off the pads, in front of square"
"clipped behind square, working with the turn"
"a touch of width, pumped through the covers"
"sliding back and across, well placed out to deep cover with a full face of the bat, and excellent aware running"
"stabbed back to the bowler, still probing on that sweet spot outside off"
"banged in short, no stroke offered"
"short again, zinging through to the keeper"
"very full, and <B>squared up as Malan aims through the leg side</B>. Nearly a leading edge, as Malan chastises himself"
"outside off, no stroke offered"
pressed to the off side
"tip and run, out to point, that's good decisive running, and slowly but surely, South Africa are eating into this mountainous requirement"
looped onto a good length again
flicked with bottom hand off the pads to midwicket
"full faced, and gathered low in the covers"
"back and across, crashed fiercely out to deep cover"
"high elbow, poked back to the bowler"
"sliding into the pads, another gentle tap off the pads and more runs to the cause."
"back of a length, leaping off the deck and blocked off the back foot. That's a massive no-ball, six inches over, and rightly called for once"
tight line and defended back to the bowler
through to the keeper from round the wicket
"back of a length, arrow-straight line. Defended back down the pitch"
"outside off, shoulders arms once more"
"very tight line, extra lift from a full length"
"head over the ball, firmly pushed back to the bowler"
stretching forward
attempted pull as Bess slides one past the leg stump
"probing away, Hamza looking watchful out there"
"solid line and length again, pushed to mid-off"
"shimmies at the crease, and opens the face to steer into the off side"
"big turn, and <B>straight past the legs to bring up the 100</B>"
"touch short on middle and leg, Malan jabs into a gap leg side and comes hurtling back for two"
"back of length around off stump, tapped down defensively"
"take that! <b>Malan wears one on the chest!</b> Banged into the pitch, 139kph/87mph and it just keeps coming at the batsman, who picks it up late and decides to stand and take the impact"
"length, steered down into the off side"
"length around off stump, pushed back down the track"
"full and straight, <b>146kph/90mph</b> and whipped away through square leg for one more... takes him to the brink of a debut fifty"
"tossed up on the stumps, clipped through mid-on - <b>that's his half-century</b>, a doughty knock and warmly applauded from the SA balcony. Raise of the bat from Malan, but he knows his job's not done"
Hamza flicks with the spin through midwicket
"tossed up, Malan is forward and jabs defensively, squirted through the leg side off the inside edge"
"flighted, spinning in as he presses out with bats next to pad in defence"
"quicker delivery, met coming forwards and steered into a gap at cover"
"floated up around off stump, tapped towards mid-off"
"dug in, flying through around shoulder height, as Malan ducks it"
"short ball, 141kph/88mph and whistling past as Malan makes sure to hunker down in the crease"
"back of a length, tapped down into off side"
"fiery bumper, 142kph over middle and leg stump, well-directed but Malan is quickly down"
"length ball, 140kph/87mph and prodded into the covers"
"over the wicket to finish, another chest-high bouncer that Malan sways out the way of"
"gives it a twirl, drifting in and blocked on off stump"
"bit of width, Hamza drops back and steers a cut through the off side"
"flighted, outside off, defended on the front foot"
"round the wicket, pushed through and almost yorks him, Malan getting it caught beneath his bootstraps coming down"
lobbed up around off stump and punched back
pushed through a little straighter and nudged behind square on the leg side
shortish on the body and tucked down to leg
"back of a length in the channel outside off stump, left alone"
"back of a length, 140kph/87mph and Malan stabs it down into the off side"
