"good line and length, he defends to mid-on"
"back of a length and on off-stump, he taps it away to the off side"
"back of a length, he's rushed but manages to defend to the leg side"
"length ball, angling in slightly and he turns it down to square leg"
"back of a length, he works it away to the leg side"
"full and outside leg, Root plays a superb reverse sweep down to third man"
"he attempts a similar short but more square, the ball springs out of the rough and beats him, striking keeper Quinton de Kock in the chest"
worked away to the off side
"on middle stump, he defends to the on side and short leg gathers"
defended off the front foot to the off side
on off-stump and he defends back down the pitch
"short ball, 140kph/87mph around off stump and pulled flat and hard through midwicket to the sweeper for one"
"back of a length, 141kph/88mph and Sibley defends coming across"
"bangs away in the channel, nothing doing"
"back of a length over off stump, defended to the on side"
touch short and blobbed into the off side
"back of a length angling in, tucked away to the leg side"
"ooh, that's probably not the best-advised shot, going back to the spinner and dabbing towards slip"
tossed up outside leg and Root can't get it away sweeping
pushed throughg and defended on leg stump
"very full and drifting leg side, <b>Root only has to get a tickle on his sweep</b>, runs away fine for four!"
"flighted, outside the line of leg and Root sticks out his front pad"
tossed up and padded away
shortish and <b>punched in compact style through the covers!</b> Sibley showing off with his off-side scoring options now
"dug in, snorting ball just outside off, has Sibley limboing for his life"
pushed in straighter on a good length and defended
"back of length, 134kph/83mph and he rides it for another clip into the covers... cut off this time"
"short and wide, 140kph/87mph and dabbed through backward point, that's running away into a gap for two... <b>first Test match fifty for Dom Sibley</b>, just a wave of the bat and back to the furnace"
"in the channel, short of a length and left alone"
"over the wicket and into the leg-stump rough, Root brings out the reverse-sweep for a couple"
"prodded into a gap, bit more proactivity about England so far"
"flighted, outside off, leans out to squash it with his pad"
pushed through quicker on the stumps and Root plays off the back foot
"tossed up, attempts to reverse-sweep again, this time plays over the top of it"
"pushed through leg side and Root attempts an orthodox sweep this time, the ball spins back into the keeper's legs"
pitched up around off stump and met coming forwards
"fullish, 126kph/78mph and punched to mid-on"
pitched up and driven softly into the covers
"draws him forward, 125kph/77mph and this is nothing more than a defensive push but he angles the bat down and steers four to third man"
"<b>whumped through midwicket!</b> Too full, too straight and Sibley likes it there, belting past the man on the edge of the square for a crisp boundary"
pitched up and prodded into the covers on the front foot
Root looking for the reverse-stroke but the ball is pushed wide
punched down the ground to long-off
"flighted, dipping into the rough patches outside leg, Sibley uses his pad to kick it away"
"pushed through leg side, tickled around the corner for one more"
"round the wicket now, short extra cover in... Root is forward and strokes in front of square"
"full, drifting in with the arm, Root is down quickly to sweep it away for one to deep backward square leg"
fullish and driven towards mid-on
"ooh, this jumps at Root, misbehaves from that awkward spot, jams into the splice, bottom hand quickly coming off the bat"
"length outside off, 128kph/79mph and steered towards point"
"fullish, Root takes a couple of steps out, defends with head bowed over his blade"
angled in on a length and tapped away
"pitched up, Root pings a drive and the straight catcher dives across on to the cut strip to field"
"pushed through down the leg side, Sibley sticks out his front leg... did that divert off the pad? Reiffel signals byes, but Faf is yelling at him from slip that it flicked the leg and therefore shouldn't have counted as runs (not playing a shot)"
"tossed up and spinning in, looped up to the off side"
drops short and Sibley works this into a gap leg side
"round the wicket, tossed up on off stump, prodded into the covers and they scamper through"
"flat trajectory on the pads, pitching outside leg and Sibley covers up"
lobbed up and this time he's forward to nurdle one into a gap at midwicket
"length ball, sliding in with the arm, Sibley shows it a straight bat"
"tight lines, 122kph/76mph and tucked to leg"
"fuller on the stumps, flipped off his pads square on the leg side"
"length ball, aiming for the crack outside off, Sibley leans out and steers towards point"
"full, targeting the stumps, whipped away through midwicket"
"leans out, punched in front of point"
"wheeling away outside leg stump, padded away"
plants the front foot once again
"this one turns, takes the leading edge as Sibley works to leg, <b>but it lands in front of Hamza at point!</b> The ball then spun back sharply and past him for runs"
"pushed through, Maharaj makes a half-hearted appeal for lbw... but pitched outside leg"
tossed up and driven into the ground back to the bowler
"pushed down leg side, this one skips away for more runs"
"straight lines, Root nudges it into the leg side"
"pitched up outside off, 128kph/79mph and defended coming forwards"
"length in the corridor of jiggery-pokery, lets this one go"
"skidding through, 124kph/77mph and again there's no need for him to play at it"
"comes across, tapped into the covers"
"shouts of 'catch!' as Sibley punches towards mid-on, but falls well short"
"pushed through, just misses the footmarks and Root pads it away"
"dragged down, Root goes back and times it off his pads, <b>haring away to the midwicket rope!</b> Just a little short-arm punch but he picks up four"
"flatter delivery, worked behind square on the leg side"
"flighted, dipping outside off, Sibley thrusts forward with his front leg"
"round the wicket, tossed up and spinning a touch, defended"
"drops short again, this time Sibley cashes in - rattled through point on the cut! England cruising now, <b>the lead up above 200</b>"
"length on off stump, 122kph/75mph and Root taps it down"
"angled in on off stump, gun-barrel straight and this is blocked"
"wicket-to-wicket stuff, Root covers his stumps and defends"
"slightly back of a length, drops into the crease and punches it away"
shortish and clipped off the hip for a single
"length ball on off stump, 125kph/77mph and pushed back down the track"
"pushed through, spins a touch out of the rough and hits Root on the knee roll playing back"
tossed up and defended to the on side
"fetch that, <b>a Steven Smith-esque paddle behind square</b>, gets a good chunk of bat on it and sends the ball fine for four!"
"flighted, Root is forward and swats one more through the leg side"
"wheels away, pitching into the rough outside leg, defended coming forwards"
"pushed through a little wider, Sibley is forward on off stump and defends"
"pitched up and driven, Sibley is scrambling to get back into his ground... not sure if Pretorius got a hand on it"
"fuller and worked to leg, well fielded in the midwicket region and Root is sent back"
"full, 124kph/77mph and punched back"
Root props on to the front foot and blocks
"more wicket-to-wicket parsimony, tapped back"
"on the stumps and worked to leg, midwicket cuts it off once again - completes a maiden over"
"short, 119kph/74mph loosener, jabbed though backward square leg for a single"
goes back and dabs one more behind point
"good length a foot or so outside off, left alone"
"pinned, Philander asks the question... maybe high? Looked like it rapped him on the thigh pad, stuck on the crease but the ball probably going over"
"<b>that's a risky leave...!</b> Must have been a cat's whisker from clipping the top of off stump! Philander and de Kock are disbelieving, but Sibley remains unperturbed"
"length ball, angled in and he gets bat on it in defence this time"
pitched up and met on the front foot
"full length, 122kph/76mph and clipped back down the track, van der Dussen dives across from his straight catching position to cut it off"
"full outside off, Root is forward to steer a drive, <b>squirted delicately through point!</b> Just opened the face, and it outran Maharaj to the rope"
"length, top of off stump, defended square"
shortish and dabbed into the covers for a quick single
jumps from a length to hit high up the bat with Sibley propping forward
comes across and pokes this into the point region
"pitched up, Root drives back down the track"
"length, skidding on at 125kph/77mph and blocked going back and across"
plugging away and Root again comes across to tap the ball square
"fired in, 129kph/80mph and worked off the legs past midwicket"
"tight lines, defended on off stump"
"length ball, on off stump and he prods to mid-off"
"good length, in line and defended back down the pitch"
"full toss and whipped away towards fine leg, Rabada racing around from square can't get near it"
"on a length, just outside off and prodded just backward of point"
"length ball, targeting off-stump and blocked back down the pitch"
"good length, in the channel and defended to the off side"
"on a length and on off stump, fended towards cover"
"good length, targeting off and whipped away to the leg side"
"on a length, outside off and prodded to point"
"good length, on off again and blocked back towards the bowler"
just back of a length and fended towards point
"length ball, outside off, worked away to the off-side and Root takes his tally against South Africa past 1000 runs"
"moving away from him, he whacks it through the covers"
blocked back down the pitch to the on side
defended to the leg side
worked away towards point
"on middle stump, he turns it away towards square leg"
"drifting in onto middle stump, he defends back to the bowler"
"back of a length and outside off, he fends to the off side"
"similar line and length, he presses it away just in front of gully, who steps forward to cut it off"
"fuller, going just past off, he connects and sends it to point"
"honing in on off stump, he flicks it away to the leg side"
"shorter ball, has him on the hop but he manages to smother the ball back into the pitch"
"outside off, he fences it away towards the covers"
"drifting in on off stump, he turns it away to the leg side"
"targeting middle and off, he blocks back down the pitch"
a fraction outside off and he prods it away towards cover
fuller and he presses it back down into the ground in defence
on middled stump and blanked towards mid-on
defended back down the pitch
"angling in slightly from an off-stump line, he defends towards the bowler"
"decent length, on off-stump, a well-judged prod to a gap off-side and they have time to grab a run"
turned away to the leg side in defence
"wide on the crease, on middle stump, Sibley tucks it away towards midwicket"
"wide on the crease again, targeting off stump, Sibley taps it down to mid-on and calls for a rapid single, they have time - just"
worked away to mid-off
dabbed away to the leg side
outside off and pressed back to the bowler
"outside off, he drives that down to long-off"
defended towards midwicket
"drifting onto off stump, he fends it away to the off side"
"full, and he presses it away back down the pitch"
"on off stump, he works it away towards point"
"on leg stump, he flips it away towards square leg"
"shorter ball, Root swivels and pulls it square"
"short ball, 149kph / 93mph, it whizzes past Sibley's face as he moves across to off-stump and goes over de Kock who's leaping high with arms way above his head"
that one bounced around hip-height and Sibley flips it away just in front of square
yorker and he manages to fend it away towards mid-on
"drifting outside off, he tucks a sweep down towards fine leg"
"lunging foward, he sweeps again, this time squarer and firmer, all the way to <b>bring up his fifty</b> in style!"
outside off and he blocks back to the bowler
fenced away to he off side
worked down towards mid-off
"on middle stump, he steps forward and smothers it into the off side"
"around the wicket, on leg stump and he tucks it away to the leg side"
"shorter ball and he takes evasive action, folding himself in half to get under it, not easy at his dimensions"
leg side and prodded away in the direction of square leg
worked away just forward of square
"back of a length, pulled to square leg but there's a fidler running round to meet it"
"going down the leg side with some bounce, he dives beneath it"
"length ball, just outside off and he prods it towards point"
"outside off, he carves it away to backward point"
defended to the off side
outside-off line he sends it towards point
"outside off, fenced just wide of the point region and Rassie van der Dussen gives chase, effectively"
blocked on the front foot back to the bowler
"wide of leg, he pulls out the reverse sweep"
outside off and defended to the off side
worked away in the direction of fine leg
"floating delivery, turned to midwicket"
it dribbles towards short fine leg
fended to the off side
"length ball, on off-stump and defended on the front foot"
"good length, on off-stump and he blocks back to the bowler"
pressed away to the leg side
"on a length and he hits that crack, it draws the edge as it moves away <b>and Root is gone!</b> Very important wicket for South Africa as Faf du Plessis gobbles up the catch at slip"
defended just in front of point
that one sprang up and sailed high over everyone
"full and on middle, he defends to the leg side"
"short and angling in, he does well to dart underneath that one"
he defends towards mid-off
"length ball, outside off and he is watchful as he leaves"
"on leg stump and angling in slightly, he dabs it back down into the pitch"
"short, just outside leg and lifting, South Africa appealing for caught behind! It's not given ... but they call for a review. Replays show <b>contact with the glove!</b> It looked like it might have grazed his armpit but there was a definite spike of noise as it passed the glove and he's gone for a pair."
"line and length outside off, a solid blob of bat on ball to start the morning"
"shoulders arms outside off stump, and no stroke offered"
"firmly onto the front foot, and poked into the covers"
"solid in defence once more, probing away outside off"
"shorter and sharper, Sibley leans inside the line of a lifter through to the keeper"
"rising from back of a length, shaping away, comfortably left"
"round the wicket, a hint of turn from the rough outside the left-hander's off stump"
down on one knee and sweeping behind square
"defensive line into the pads, tucked off the legs"
"no stroke offered, as the ball flicks the pad and skitters to the rope. Dead ball called"
"down the leg side, passing the pads once more"
"back and across, punched with a high elbow to the on side"
"round the wicket, back of a length, blocked on an off-stump line"
"shaping into the pads, Stokes attempts a flick off the legs but can't connect"
"head over the ball, blocked back down the track"
"wide on the crease from round the wicket, tailing into the left-hander who blocks with intent on the front foot"
"punched on the up, width from back of a length. Can't beat mid-off"
<strong>punked through midwicket!</strong> That's an extraordinarily dismissive stroke. Just a forearm jab as Pretorius's lack of pace is thoroughly exploited. Lose your length by a foot and pay the price
padded away as Maharaj tests Sibley's patience on that leg-stump line
"back and across, into line and blocked round the corner"
tidy length again and Sibley can do little about that
"flicked off the toes, opportunistic from Sibley, and bringing both a leading edge and lbw into play as he squirts one past leg slip"
padded away once more as this one kicks from just outside leg
firm in defence. Just the two runs in that over
"<B>gadzooks!</B> This is dismissive! Stokes has all the time in the world, getting right underneath a full-length wobbler, and dumped with power and disdain high over the bowler's head!"
"<B>reverse clobber past gully!</B> Extraordinary power, range and precision. Pretorius has nowhere to hide right now!"
"decent length from round the wicket, and this time Stokes props forward in defence"
"dipping into the toes, and clipped to midwicket"
"full face of the bat, pumping through the line once more, and midwicket tumbles to gather"
"leans on another push through the on-side. If that over hasn't hastened the new ball, who knows what will"
down on one knee and paddled round the corner
"<B>out comes the proposal!</B> One on one knee, outside off, a massive flourish, high over cow corner. Tonk-tastic!"
flashed into the leg side once again. Stokes is in a mood this morning!
"<B>yee-har!</B> More twirly lengths outside off, and Stokes has another monstrous heave to nothing. Misses this time, much to Maharaj's relief"
"hops across the stumps, some hint of turn as Stokes' intentions are undermined"
solid in defence to see out the over
line and length on off stump. Sibley strides forward to defend
"lifting away from the right-hander, outside off, and left alone"
"curling away on a full length, and through to the keeper"
"head over the ball, leaning onto the front foot, blocked back down the track"
"defended with the bottom hand leaving the handle, evidence of Philander's extra nip with that new ball, off that awkward crack"
"nipping away, through to the keeper, no stroke this time. Sibley content to bide his time for now"
"standing tall on the back foot, punched to mid-on"
"round the wicket and defended, line and length shaping in towards the off stump"
""
"<B>a flirt outside off!</B> Sibley is a bit nonplussed by this change of approach, bringing the stumps into play and demanding a decision"
blotted into the covers
a bottom-handed shovel into the leg side. Slightly ungainly response to an attacking line
"<strong>a filthy hack off a good length!</strong> Well, why not... he didn't let one medium-pacer settle, why bother with the other? Tidied at deep midwicket"
"patted into the gap, much straighter lines from the straight-laced Sibley. One closer ..."
"inswinging attempted yorker, and <B>pummelled off the toes through the gap at square leg!</B> Reminiscent of his field bisector in the World Cup final. You remember the one..."
"pumped into the off side, up comes the 300 as Stokes crosses for the second"
"banged in short, and wide. That's dross from such an experienced bowler, but he's clearly rattled by the lack of respect being offered by Stokes, who rises onto his toes to <strong>clobber through  backward point</strong>"
"advancing down the track, Philander sees him coming and fires it out wide. Under-edged to the keeper"
"leaning onto the front foot, and blocked"
"firm in defence, as Maharaj attacks the top of off once more from round the wicket"
"short and wide, but Sibley misses out.... an attempted chop through point, but not timed"
"on the hips, back of a length, so offering the opportunity to shuffle across the stumps and work another couple into the leg side. Into the 90s..."
defensive line into the pads once more. Nudged away with no stroke
using the pad once more to negate the leg-side line
"back of a length, no liberties from even the liberated Stokes, who hops back and across in defence"
"<strong>a murderous wallop high into the leg side!</strong> A massive top-edge ... who wants this? Not Malan, that's for sure. He's best placed at fine leg, but de Kock with the gloves calls for it, sprints, dives... <strong>and drops it!</strong> The rebound thumping him in the face for good measure!"
a knee-high full-toss outside off? Oh go on then! <B>Panned through mid-on!</B>
"a round-house wipe into the leg side, to keep the strike"
"<B>finds the gap!</B> Cheers from the England supporters as Sibley finds a rare opportunity to pierce the covers with a bottom-handed jab. Nearly a four, but clawed in well on the edge of the rope. In fact, it's been over-turned on review"
stretching onto the front for a solid block back down the pitch. Enough progress for one over!
"turning into the legs from over the wicket, flinched behind square"
patted away off the toes
dabbed behind square as Maharaj slides a touch short from over the wicket. One more to Sibley's bid
"<strong>reverse sweep</strong>, sweetly timed, Rabada slides round to gather but they hustle back for two"
punched off the pads to the on side. Stokes moves to within one of his own landmark
"over the wicket, fired into the pads, no stroke offered there"
"hauled behind square, and there it is! <strong>Stokes has a ninja-quick fifty,</strong> and England's morning has been nigh on perfect so far"
blotted back down the pitch as Rabada targets line and length
"firm in defence, nothing shall rush Sibley at this critical personal juncture"
"line and length, and blocked back to the bowler"
"outside off, through to the keeper, no stroke"
"<B>edged, but clean through the vacant third slip!</B> Yikes... that was South Africa's best ball of the morning... but it's taken Sibley to 99 ..."
"width, flashed through backward point"
"advancing to the pitch, tucked down the track, Stokes wasn't sure if the single was on, but they jog it easily enough in the end. Sibley on strike ..."
"padded away, with a leg slip in situ for extra jeopardy"
skims off the pad as Sibley pads up again
"<B>swept, nailed, century!</B> Supremely struck, pounded out of the rough, timed to perfection through backward square, and off comes the helmet! That's a moment to treasure. Quite possibly his first sweep of the Test too, trusting his eye and the set-up of the field. Well played young man!"
padded away off a leg-stump line
pushed with vertical lines back through the ball
"extra zip outside off, Sibley hauls his gloves out of harm's way"
"hits the splice, extra nip from a good length. Point gathers on the bounce"
"on the legs, nurdled round the corner for another single"
"rising up on the toes, clubbed with intent down to long-on"
"shoulders arms once more, that will be <B>drinks</B>. What a morning it's been for England!"
"pushed through outside off, Stokes has a mighty heave across the line and fails to connect"
"dragged down, <b>crashed through midwicket!</b> That's a blunderbuss pull between two men back for four!"
"saunters out, free-wheeling swing through the line, <b>smooshed over the rope at long-on!</b> Clicking into Beast Mode again"
"<b>brings out the reverse-slog</b>, smashed through point for four... Reminiscent of Headingley last summer and the mauling he gave Lyon"
speared in towards the toes and he can only dig this out for one down the ground
"tossed up outside leg and Sibley continues to pootle along, padding the ball away"
"shortish outside off, Stokes throws the hands and fails to connect"
"fullish length, maybe a cutter and this is punched through the covers"
"length ball, 143kph/89mph and clipped through cover to the sweeper for one"
"short ball, angled across outside off and Stokes is up off his toes to swat down through mid-on"
"back of a length outside off, Sibley leaves alone"
"good pace, 140kph/87mph in the channel, again he's happy to leave alone"
"but he won't be getting to 100 today... <b>slapped to long-on</b>, Stokes' fun is over! Didn't get the elevation, hit hard but van der Dussen held it well as he came across. Stokes shakes his head in frustration, and that may provide some respite for SA after a damaging 75 minutes"
"pushed through outside leg stump, kicked away"
"floated up, Pope brings out the reverse-sweep and gets his first run away through point"
fired in and worked behind square on the leg side
"flat outside leg, Pope pads it away"
"flighted, very wide of leg stump and Pope clips square... through Rabada's misfield and they get one, to ironic cheers from the crowd"
"shortish on off stump, Pope defends"
goes back and guides a single behind point
shuffles across and nudges one more off his body
"back of a length, 139kph/87mph and tapped down into the covers"
"<b>dragged on!</b> We'll be seeing Buttler soon enough, then... maybe kept low as Pope tried to force it off the back foot, and could only manage a thick under-edge into leg stump"
shuffles across and taps it down to the leg side
"floated up outside leg, goes for a sweep but can't get it away"
pushed through and jabbed back down the track
"flighted, Buttler attempts to sweep again and this comes off the pad, there's an easy single into the leg side"
"floated up full on the legs, worked towards short fine leg"
flat delivery on off stump and pushed towards cover
"plopped on a length and Buttler goes back, pats it down"
"punched into the on side, they trot through"
shortish and worked down to the on side
"yowzer, what a shot! <b>Driven flat over long-off</b>, a dismissive blow against the fastest bowler in the match! Pinged out of the middle as he stepped forward"
"banged in, 140 clicks and steered through point for one"
"digs in the bouncer, 143kph/89mph but too high for the umpire's liking"
"back of a length and clipped off the body, midwicket comes across"
"touch short, 142kph and defended square on the off side"
"drops a touch short, Buttler taps it away going back on leg stump"
pushed through and worked for a single through backward square leg
"where did that come from....?! <b>slog-swept into the crowd at deep midwicket!</b> Really nailed the shot, too. Go Sibbers!"
"fired in, defended going back, inside-edged into pads"
"tossed up, brings out the sweep again, <b>skelped hard and flat through backward square!</b> Sibley showing us his plumage after several hours of quietly pecking away at bird feed"
"flat on leg stump, kicked away this time"
"shortish on the stumps, Buttler taps it back"
