"on a good length and largely holds its line outside off, 132.1ks, Crawley is happy to watch it through to Pant behind the stumps"
"oooooh! Ishant goes much fuller and brings this back into Crawley and thinks he has pinged his pad. Ishant reckons that there's no bat involved, and asks Kohli to challenge the on-field not-out decision. <b>Bends back in to thump the front pad <i>just</i> above the knee-roll</b> as Crawley doesn't cover for the inswing at all. But, ball-tracking suggests that it would have bounced over the stumps. Umpire Menon's call is vindicated"
"pitched up and Ishant explores the channel again outside off, Crawley doesn't bite"
"on a length and bends back in at off, Crawley yanks his bottom hand off the bat and blocks out this inswinger"
"back of a length and curving away outside off, too wide to draw a stroke from Crawley"
"Ishant ventures another inswinger, <strong>finds some extra bounce</strong> to test Crawley further and rap him on the glove. The batsman loosens his grip once again and fends it off to the leg side to close out a rather eventful first over"
"full, threatens to angle in but straightens away a wee bit outside off, Sibley uses soft hands and runs it away in the gap at point for a double. England get off the mark"
"much fuller and Siraj brings this back into Sibley from outside off, no shot"
"<strong>Siraj zips past the outside edge</strong>. Sibley searches for the one that would come in, but this swings away after opening up the batsman and running past his edge"
"inswinger, shortish and on the hips, deflected away fine past the left of Pant for four leg byes"
"fullish and slanting in at off, Sibley gets right behind the line and plays it back to Siraj"
on a length and blocked stoutly on off stump once again
banged in outside off and thuds into the gloves of Pant outside off as this is left alone
"short, wide, finishes wider than a set of stumps outside off, yet Crawley goes searching for it. <strong>Swishes and misses outside off</strong>"
"very full and slanting in at off or on a fourth-stump line, Crawley isn't fully forward for the drive, winds up squirting it past the left of Ishant"
"length-ball inswinger, this is squirted again, to the leg side"
"on a length and outside off, encouraging carry to Pant again, as another delivery is left alone in the channel"
"another length-ball inswinger, confidently clipped to square leg with the swing"
"back of a length and flung outside off, ignored in the channel again"
"very full and seams back in at off stump, squirted back to the bowler as Crawley prods from the crease"
"on a length and homing in towards of stump, Crawley jabs at it and defends as the bottom hand flies off the bat"
"shortish and on off stump, defensively jabbed into the covers"
"driven on the up and carves in front of Axar. Full and wide, Crawley has to reach out for it, <strong>squirting it in front of point</strong>"
"fractionally overpitched and outside off, in the slot for the drive, but Crawley is pinned to the crease again, sending a <strong>thick inside edge down to long leg</strong>"
"back of a length and slanting in at off, blocked into the covers"
"on a length, threatens to come back in, but seemingly straightens away outside off. Crawley plays inside the line and allows himself to get beaten. Can't do much against this delivery that nips away like a quick legcutter"
"back of a length and zipping through outside off, nice take from Pant, left alone"
"wide of the crease, angling back in, swinging in from outside off, <strong>good leave from Crawley</strong> as it bounces over off and middle stumps"
shorter and outside off as Pant almost takes it on front of his face. Excellent carry through to the keeper. Nothing doing from Crawley
"back of a length and outside off, Crawley hangs back and dinks the ball up to point"
"pushed through outside off, holds its line, defended solidly off the front foot"
"<strong>oh, hello, another straight ball pings the stumps</strong>! The new red ball slides in from left-arm around, as opposed to turning away. Sibley plays for turn and is beaten on the inside edge....Okay, replays indicate that ball grazed the inside edge and then disturbed the stumps"
"<strong>arm ball, fizzes in at almost 99ks,</strong> Axar hits the pad even before YJB brings his bat down the wrong line. This seemed to be heading down leg"
"tossed outside off, forward, and driven into the covers"
"flat dart on off, round-arm release, Bairstow plays from the crease and squirts it to the leg side"
"another round-arm dart, 88ks, defended back to Axar. The left-arm fingerspinner starts with a wicket-maiden at his home ground"
"short and skids back in, <strong>Ishant has Crawley hopping, skipping</strong> and hastily fending off to the leg side"
back of a length and flung wide of off - finishes wider than a set of stumps outside off - ignored
"full and outside off, Bairstow covers his off stump and shoulders arms to it"
"dipping full-toss - nearly a yorker - squeezes under the swinging bat, hits the pitch, and loops up to Pant. Lovely take from Pant and he tumbles onto the ground. Then <strong>there's <em>that</em> Shawn Michaels-like kip up</strong>. Visual delight"
"nice and full, swinging down the leg, away from the reach of Bairstow's leg-side flick"
"even fuller and Ishant brings this one back sharply to have Bairstow falling over. Struck on the pad, but seems to be heading down leg/bouncing over the stumps anyway"
"<strong>confident drive from Crawley</strong>. He dashes down the track, meets a full delivery early and drills it straight of mid-off for the first boundary of this innings"
pretty full and angling into a defence on middle stump
"Crawley uses his feet, does so early, Axar held this back from a round-arm release. Check-pushed into the covers"
"down the track again, Axar shortens his length, has the advancing batsman jabbing towards midwicket"
"<strong>Feebly chipped straight into the lap of mid-off</strong>. Two in two for local lad Axar. Pushed through on off stump, Crawley ventures down the track once again, looks to mess with Axar's lines and lengths with a loft. But, he can't get close enough to the pitch of the ball. Miscues it to Siraj. It's quite difficult to sweep or step out to Axar"
"arm ball, fizzes in at 89ks, and bounces at off, <strong>Root safely diffuses it to the off side</strong>"
"Ishant tests Bairstow with a bumper outside off, he simply lets it pass to Pant"
"short and finishes wider than a set of stumps outside off, left alone"
"on a length and outside off, Ishant has Bairstow reaching out for the ball and <strong>stabbing it off the outer half</strong> between point and gully. He gets off the mark off his 12th delivery"
"moves away like a quick legcutter outside off, <strong>Bairstow spars at it and is beaten on the outside edge</strong>"
"full and homing in towards off, forward and prodded into the covers"
"back of a length and ducks back in sharply, Bairstow aims to clip it squarer through midwicket, but the ball takes the inside edge and runs away to fine leg"
"shorter and zipping into middle, round-arm release, flapped off the back foot to midwicket"
"slower through the air and slides in at off stump, prodded to the leg side via an inside edge"
"pushed through at off stump, 91ks, confidently blocked on the front foot"
"full on the stumps, tap and run to the right of Ashwin at mid-on"
"<strong>inside-edged in the air to the right of short leg</strong>. Full and zipping into middle, prodded away past that close-in fielder"
"tossed up slower and higher on middle, played back to the right of the bowler"
"kicks from a back of a length and moves away like a legcutter, Root stabs at it, plays well away from the body, and the ball bounces past the outside edge"
"back of a length and nips away outside off, Root tightens up and lets this one go"
similar ball as Siraj sustains that shape away from the right-hander. Root belatedly tucks his bat inside the line and lets it go
"back of a length and skidding in at off stump, Root jumps back and defends it right under his eyes"
"back of a length and ducks back in sharply, catches Root in a tangle and pings him above his thigh pad near the trouser pocket"
"lifter on middle, 137ks, Root takes it on with a hook and gets it fine past Pant for four. Not fully in control, but Root manages to find the fence"
"slides into middle, length ball, Bairstow closes the bat-face and defensively works the ball to midwicket"
Axar slows this up and shortens his length outside off. Some turn to boot. Bairstow checks his shot and <strong>slices a cut to the right of Rahane at lone slip</strong>
"pushed through flatter and faster on off, blocked off the front foot"
"down the track, Axar drags his length back and attacks the stumps, quietly played back to the spinner"
"round-arm dart on off stump, played back to Axar once again"
"95.3ks, full dart on off stump, Bairstow stretches out to smother it"
"<B>pinned on the crease and Root is gone!</B> Disaster for England, their skipper has been nailed by the inswinger! Stone dead as Siraj curls it into his rooted back-foot block, and he doesn't even review. That is a body blow for England's hopes of a competitive first innings"
"<B>an edge first ball, as Stokes tries to leave!</B> A fat snick, always heading down, but keeping the three slips interested"
"outswinger to the left-hander, curling away and left with more decisive intent this time"
blotted on a leg-stump line as Stokes falls into a forward push
"squared up and a fat outside edge squirts from leg through point, finds enough of a gap for the single"
"a zippy bouncer, skimming through to Pant as Stokes sways inside the line"
"pop from a good length, Bairstow rides the bounce and jabs it down to the off side"
flicked off the legs to the on side
"fizzier pace, and Bairstow is forward again to defend"
"head right over the ball, striding to the pitch to block"
"a touch more width, Bairstow is happy to let that go as Pant rides the bounce"
"<B>he didn't leave that one!</B> Zipping through on a fourth-stump line, Bairstow slashes into a cut/drive and misses everything"
"pushed through to the keeper as Stokes lets alone... oops, a no-ball"
"<B>edged and eludes second slip!</B> Crumbs, that was a genuine nick, Stokes caught on the crease, and pushing at the angle across his body, was always dipping on Rohit as he plunged to his left"
"blocked from the crease, angled bat taking the ball down into the cordon again"
"back of a length, shape from leg to off, Stokes is watchful on the back foot, playing it under his eye line"
"short-arm pull, clawed from just back of a length with enough meat to whistle through the leg side"
"<B>two fours in a row</B>, this one is more edgy, but they all count, good soft hands from Stokes, taking the ball down through the cordon, safe as you like"
"pushing forward to block the fuller length, a productive over for England and Stokes. Wonder if Ashwin has caught his skipper's eye yet?"
"back of a length, tucked off the hip to the diving short backward square"
"a gallop to the pitch, and a swish off the pads, never quite made it to the pitch of the ball but found the man on the 45 again"
"short backward square in business again, flinching a leg-stump line round the corner"
"<B>rocking back and cut away well!</B> That one seemed to skid on, but this time Bairstow was playing for that very ball, and timed it well off the top of middle stump, through point"
"pressed down the pitch, and back to the bowler"
leaning forward and blocked once more
"a bit of swing after the ball is safely past the bat, a wide enough line for Stokes to ignore"
"round the wicket, looking to shape into the left-hander, and blocked to the off side"
"solid block from back of a length, waiting for the ball to come on to the bat"
"outside of, and through to the keeper, this round-the-wicket line isn't quite getting Stokes to play as Siraj might have hoped"
"tighter to the pads this time, a comfortable clip off the legs and that's England's 50. Progress of sorts"
"onto the front foot, and half-driven into the off side"
"back of a length, over the wicket, dabbed down into the off side off the back foot"
"stretching forward to the off-stump line, blocked"
"<B>swept, and top-edged?</B> Yep, balloons over the close catchers, off the glove, but safe enough behind the bat on the leg side"
stabbed back down the track
"another arm-ball, drifting into the right-hander, who plays it solidly enough this time"
"<B>too short and wide</B>, and Bairstow accepts the rare freebie with glee, a slap behind point for Axar's sins"
"round the wicket, banged in short, down the leg side"
"better length, tucked to the leg side off the back foot"
"squeezed off the legs, very fine to fine leg, a bit of shape for Ishant, but sliding past the leg stump on the angle"
"width, and <B>Bairstow boshes another cut over third man!</B> Happy to get under the stroke as Ishant extracts more lift from the deck. Curious tactics from India, given England's spin shambles last week..."
"over the wicket now, fenced through backward square"
"back of a length, round the wicket to the left hander, no stroke as the ball skips through to the keeper"
"tight line from over the wicket, Bairstow rocks back to nudge to the on side"
"loop and flight, very full as the ball hangs in the air, Bairstow is watchful on the back foot"
"plinked off the toes, out to deep midwicket, as Bairstow plays from deep in the crease again"
"on the back foot, lots of noise from round the bat as Stokes blocks cautiously"
"<B>dumped over long-off!</B> A step to the pitch, a loose swing of the arms, and clean as you like into the stands!"
"watchful from Stokes, this one is a bit flatter but he kneels into a cautious block to the off side"
"<B>short and wide, slammed through point!</B> These are free runs for England, hard to fathom really."
"that's better from Ishant, tighter initial line and shape off the deck, slamming the pad-flap on the back foot"
"wider line but a fuller length, Bairstow launches into a drive but can't connect properly"
"outside off, no stroke this time"
"back of a length, Bairstow gets up on his toes to push into the off side"
"tight to off stump, a bit of shape back into the right-hander as he shoulders arms. Half an appeal for lbw as Pant thinks that's skimmed the pad, but no danger of it hitting the stumps"
"round the wicket, loopy full length, drawing Stokes forward to block"
"rising on the back foot this time, and riding the extra bounce as Ashwin attacks the splice"
"pressed with firm wrists into the off side, disrupting the close field like a flock of pigeons"
"stretching to the pitch, cat and mouse stuff, pushed to cover"
"on the back foot again, vertical bat, very cautious in defence"
"maiden over as Stokes squares up to fend this one off as well, probing line and length from Ashwin"
"<B>confusion on the quick single, and there's an appeal for run-out!</B> Bairstow hurtled off for the nudge to square leg, got sent back, and just about made it home as the throw was slightly wayward from Pujara"
flicked to the on-side
pressed with hard hands back down the line of the ball
"leaning forward, and pushed through the line"
"a bit of sharper turn there as Bairstow is forward again, but not quite spitting like the last Test"
pressed back down the ptich again
"round the wicket, probing an off-stump line as Stokes leans forward"
"nudged back to the bowler, slip and silly point in attendance"
"a fraction shorter, clipped off the hip to midwicket"
"right forward, head over the ball, defending the middle-and-leg line this time"
zips through a touch quicker as Stokes leaves alone. Extra bounce as the ball straightens outside off
"<B>big turn and drift</B> and Stokes is dragged into a rampant swipe through the line! Misses everything, but that was a moral victory for the bowler. And another maiden"
"on the back foot, jabbed to mid-on, and Bairstow gallops into the single as Pant, I think, provides the soundtrack... 'oooheeeoohhheieieiei!' Think he liked that one"
"nudged into the gap, another single to the cause"
"round the wicket, dipping on a full length, stabbed to silly point off the front foot"
"no stroke offered outside off, Bairstow draws his bat behind his back for good measure"
"on the back foot, blocking the leg stump line, with a bit of extra bounce from the over-spin"
"flipped to the on-side, can't find the gap but he does get to the break intact"
"slides on outside off as opposed to spinning away or drifting in, no shot"
"tossed up on a fifth-stump line, patted back to Ashwin off the front foot"
"back of a length and on off stump, Stokes is right behind the line to defend to point"
"a bit too full and outside off, quicker through the air, smoothly driven through the line to deep cover"
"pitches around middle and spinning down leg, left alone by YJB"
"floated up on a fourth-stump line, YJB moves forward and blocks it back to Ashwin"
"good length on middle, blocked to mid-off with a straight bat"
"fuller and slanting away outside off, Stokes shoulders arms"
"back of a length and straightens along an off-stump line, Stokes, having jumped across off, keeps it out"
"shorter and slanting away outside off, Stokes stands up tall and forces it away in the gap at point. Pujara chases it down and cuts it off to a double"
"on a length and sliding in at off stump, Stokes covers up in defence"
"too full on the pads, clipped away to deep square leg where Axar collects the ball"
"pitched up and outside off, driven firmly through the line, silly point in the way as Gill cops a blow on his knuckles"
Stokes goes back and forces this shorter offbreak to mid-on
"flighted and spins away outside off, reaches out and dabs to point"
"tossed on off, Stokes stretches out to smother any spin"
"sliding in at off, full, 93ks, blocked on off stump"
"Ashwin and Pant reckon pad first, <b>the spinner asks Kohli to challenge the on-field not-out decision</b>. Full and slides in from around the wicket, Stokes plays around his front pad, and it indeed hit the pad first. Impact seems outside off and umpire Sharma's on-field not-out decision is vindicated in the end. So, India lose a review"
"<strong>inducker from Siraj at 146.4ks, and this time umpire Menon raises his finger</strong>. Umesh-like delivery. Given out lbw. YJB has a chat with his partner and calls for a review. On a length and swerves back in quite sharply, thumps a crease-bound YJB on the back leg in front of middle. No bat. It would have clipped the bails and it's enough for umpire Menon's call to be upheld. Siraj cranked it up, got it to skid quickly off the pitch and defeated Bairstow there. Bairstow shakes his head and looks perplexed - perhaps he thought he was given out caught behind"
"back of a length and zipping through outside off, no shot"
on a length and zipping into the front-foot defence of Pope on off
"full and outside off, reaches out and glides to point"
"shortish and shoved down leg, away from the reach of the flick"
"full and homing in at off, 139ks, blocked on off stump"
"looped up on middle stump, no real turn or drift, blocked back off the front foot"
"shorter and slower on off, allowing Stokes to jab into the covers off the back foot"
"length-ball slider on off, 93ks, defended back to Ashwin"
Stokes opens the face and guides this from a middle-stump line to backward point
"tossed up and outside off, run away to backward point again. There's a cover-point in place for the drive/push"
"flighted and outside off, patted to the right of cover-point"
"nice and full outside off, Pope is halfway forward as he squirts a drive through the covers"
"back of a length and slanting into middle, whisked away to mid-on"
"another effort ball from Siraj, this is a bumper, wobbles away after the batsman ducks under it. It then bounces out of Pant's gloves even as he leaps to his right"
"shorter and angling across off, defensively pushed to the covers"
"hint of extra bounce from a length, Stokes loosens his grip and fends it to the off side"
Stokes works a single to mid-on and keeps strike
"tossed up, angling across, spinning and bouncing outside off, left alone"
"flighted on middle, Stokes stretches out in defence"
"shot! Stokes dashes down the track, gets close to the pitch and drives with the wrists to the left of mid-on. Good use of the feet and even better execution"
"pushed through on middle, defended"
"Ashwin drags his length back, so Stokes goes back to defend"
"fuller and loopier outside off, Stokes is forward to dead-bat it away"
"on a length and skids on outside off, Pope throws his hands at the ball and skews an inside edge to mid-on"
"shorter and sliding into middle, Pope closes the bat-face and secures a single to mid-on"
"shorter and outside off, fended back to Siraj"
"shorter and outside off, punchily played back to the bowler"
"pretty full and slanting down leg from around the wicket, Stokes can't get any bat on the flick"
"on a length and holds its line outside off, patted to the covers"
"floated up on off, defended off the front foot"
"tossed up and dips at off even as Pope lunges forward, Ashwin snares the inside edge which dribbles away to the leg side"
"tossed up and straightens along a middle-stump line, Stokes opens the face and squirts it to the covers"
"shorter and just a shade outside off, chopped to cover off the back foot. Not enough room for Stokes to free his arms"
"looped up on off, dead-batted away"
Stokes is right back to defend this length-ball offbreak
"on a length and outside off, Pope reaches out, throws his bat at ball and flays a drive to extra-cover"
"good length and outside off, similar line and length but Pope elects to let this go in the channel"
"much fuller and outside off, <strong>Siraj cranks it up to 141ks</strong>, belted on the up to extra-cover"
"good length and sliding in at off stump, Pope covers up and blocks to cover"
"wide of the crease, full and holds its line outside off, 139ks, push-driven up to mid-off"
"banged in short and outside off, 134ks. Pope is caught in two minds: whether to pull or let it pass. He does a bit of this, bit of that, and bottom-edges it away"
"fired into the legs, too full, squeezed out. The ball hits the ground before lobbing into the hands of short leg. It has been referred to the TV umpire and it's not out of course"
"full and straight, clipped to midwicket"
<strong>turn and bounce for Axar!</strong> Starts on middle and ripping down the leg side. Left alone by Stokes. The ball bounces out of Pant's gloves
prodded into the covers off the front foot
"more turn and bounce for Axar! 92ks, drifts in and fizzes away outside off. Pope belatedly tucks his bat inside the line"
"<strong>biiiiig bounce for Axar again in the channel</strong>, not as much turn this time. Pope does well to simply watch it settle into the gloves of Pant"
"shot, Stokes! He holds his pose and admires this straight drive. Not a half-volley, fullish on middle, Stokes moves forward, shows the full face of the bat and eases it away to the left of Siraj and right of mid-on"
"back of a length and <strong> skidding into middle at 140ks</strong>, stabbed out to cover"
"shorter on middle and leg, <strong>140ks again</strong>, defended back to the left of Siraj"
"bumper down leg,<strong> Siraj bends his back and spears it at 141ks,</strong> but Stokes ducks under it and avoids it"
"dug in short and outside off, slanting away further, 138ks. Stokes leaps off his feet, has a crack at this, but only connects with a whole lot of thin air"
"follows all those short stuff with a full delivery aiming for off, Stokes' forward-defensive intervenes"
"full and just a shade outside off, round-arm release, tapped to the covers off the front foot"
down the track and crunched down to long-off as Pope gets off the strike
"back of a length and spins back in at middle, Stokes uses the depth of the crease, punching a single down to long-on"
"on a length and sliding in from a round-arm release, blocked on off stump"
"looped up outside off, a bit of spin for Axar, whisked to point with an open bat-face"
"fuller and outside off, forward and squeezed to point again"
<strong>turn and bounce right away</strong>! On a length and kicks away outside off past the outside edge
"shorter and spins away outside off, Stokes allows the ball to spin and punches through point"
"pushed through outside off, slides on outside off, nothing doing from Stokes"
"darted on off stump, pushed back to the right of Washington"
"fuller and outside off, Stokes gets closer to the pitch and runs it away towards point"
"<strong>edged and eludes lone slip.</strong> Washington dangles it up outside off and gets it break away. Drags Stokes into a drive, and finds the edge, but it skips away from the reach of Rahane, I think, at first slip"
"pushed through flat and quick outside off, Pope lunges forward and bunts it to the covers"
down the track and blocked into the leg side
"round-arm dart, full on off, down the track and defended back to Axar"
"back of a length and flat on off, defended off the back foot"
"shortish and outside off, spins away further, Pope leans back and chops it away behind point. Carves it to the left of the fielder and finds the fence"
"floated up on off, much fuller, dead-batted away"
"<B>big turn for Sundar</B> Round the wicket, shaping in, biting away for Pant to take high to his left"
"head over the ball, blocked with resolve on the front foot"
"more turn, and splice-hassling bounce from Sundar's high action. Stokes plays inside the line"
"<B>Stokes is lured into a wipe out of the rough!</b> Taking the same approach as in the first Test, maybe, looking to hoon over the leg side"
prodded to the off side
"<B>there goes the mighty hoon!</B> That was telegraphed, Stokes sizing up the big turn and thinking, time to plant the dog and flog it, rather than die wondering in defence. That was nailed over wide long-on"
