"shorter and holds its line just a shade outside off, jabbed into the covers off the back foot"
"on a length and on a fifth-sixth stump line outside off, Rohit presses forward, opens the bat-face, and dinks it to point"
"pitched up and outside off, tight line and length, Anderson has Rohit reaching for the ball and carving a drive to point"
"good length and Anderson gets it to skid back into Rohit. He seems to have eked out an inside edge onto the pad, did he? Root decides against reviewing the on-field not-out decision"
"short of a length and angling into middle, 126ks, Pujara has all the time in the middle to negotiate it"
"pitched up and holding its line outside off, nothing doing from Pujara"
"full and hung up outside off, Pujara doesn't bite again"
"back of a length and wobbling away outside off, 132ks, Pujara dabs it to gully"
"back of a length and climbing outside off, no shot from Pujara"
back of a length and Stokes brings this back into Pujara and attacks the stumps. The batsman stands tall and punches up to short midwicket
<strong>Anderson continues to threaten Rohit</strong> with his skiddy inswinger. Beats the inside edge and hits him high on the thigh
"on a length and nips back in at off once again, Rohit closes his bat-face and secures a single in front of midwicket"
"back of a length and climbing outside off, Pujara lifts his bat over his shoulder and ignores it"
"full and on off stump, Pujara moves forward to defensively bunt it to cover"
"full and wobbles away outside off, it moves after passing the batsman who had ignored it in the channel"
"back of a length and wide of off, left alone once again by Pujara"
"nice and full, threatens to angle in, but wobbles away late outside off. Rohit judges it well and shoulders arms"
"on a length, angling in towards off, and straightening, takes the shoulder of the bat and rolls down to gully"
"shorter and skidding into middle and leg, Rohit hops and clips a single to the right of short midwicket"
wide of the crease and Stokes flings a near yorker-length delivery down the leg side. Pujara can't get any bat on ball
"lifter outside off, keeps climbing in the channel. Pujara drops his gloves and sways his upper body out of the way. Well bowled and equally well negotiated"
"another short one in the channel, Pujara lets this go too"
"short and sliding in at off stump, played back to Anderson"
"pitched up and angling into off stump, draws Rohit forward into a push to mid-on"
"short and outside off, nothing doing from Rohit"
back of a length and moves back into the gloves of Foakes after passing Rohit who had ignored it in the channel
"back of a length and outside off, Rohit shows restraint in shouldering arms once again"
"nice and full on off, Rohit shows the full face of the bat and pushes it back to Anderson. <strong>Sixth maiden for Anderson and first this morning</strong>"
"nice and full, jagging into middle, dinked behind square on the leg side. <s>First runs for Pujara on the second morning</s>. Okay, called leg-byes"
"floaty full-toss outside off. Oh hello, Stokes gets away with it as Rohit can only stab it up to extra-cover"
"another wide full-toss, Rohit latches onto it and <strong>crunnnnnnnnnches it between point and extra-cover</strong>. Stokes releases the pressure built up by Anderson"
"full and veering into the pads, deflected away through square leg"
"dug in short on off, fended back to Stokes off the back foot"
"back of a length and slanting into the top of off, blocked back once again"
"short and climbing outside off, left alone"
"length delivery holding its line outside off, left alone once again"
"much fuller and outside off, Rohit shoulders arms"
"pitched up and just a shade outside off, played back to Anderson"
back of a length and wobbles away outside off. Anderson probes away. Rohit leaves it and wears him down
another leave to close out the over as Anderson plugs away in the channel. Seventh maiden for Anderson in his ninth over
"shorter and outside off, Pujara ignores this"
"bouncer outside off, springs off the deck. Pujara isn't perturbed by it. He sways his upper body out of the way. Good cricket"
"back of a length and outside off, jabbed into the covers"
"similar line and length, defensively dropped into the covers"
"back of a length and wobbles away outside off, Pujara elects to ignore it in the channel"
"short and outside off, this seemed to spring off the deck as well. Pujara lets it sail through to Foakes"
"good length and curling in towards off stump, solidly blocked to midwicket on the front foot"
"pitched up and just a shade outside off, Rohit checks his drive and scoops it in front of mid-off"
"on a length and outside off, Rohit is forward to steer it towards backward point"
"full and swinging in at off stump, pushed to mid-on off the front foot"
"shorter and outside off, no shot"
"Anderson plugs away outside off, Rohit keeps leaving such deliveries in the channel"
"flung down the leg side, <strong>Leach expects Pujara to run down the track</strong>. Left alone. Foakes, having moved to his left, gathers it cleanly"
"dragged down outside off, flayed away to sweeper cover off the back foot"
"full and drifting into middle, Rohit plays it back to the right of Leach"
"top ball from Leach! Threatens to drift it towards off, but grips and turns past the outside edge"
"fuller and straighter in lines, clipped to the right of mid-on"
"pushed through quicker, more turn for Leach. Starts on middle and breaks away delightfully. Pujara plays with soft hands and edges it, but <strong>Foakes can't close his gloves around the ball</strong>. The ball flicks the keeper's gloves and bounces on its way to first slip."
"on a length and outside off, tapped into the off side off the front foot"
"dug in short and angling into the body, Rohit rides the bounce and pulls with control to deep square leg"
on a length and nips back in to graze the thigh pad and roll away to the leg side
"back of a length and jags back in at off, cramps Rohit for room. Stabbed to mid-on off the inner half"
"fullish and outside off, Rohit moves forward and guides it with an open bat-face to the right of backward point"
"bumper outside off, Rohit shelves the hook and lets it pass"
"sliding in at off, 89.4ks, Pujara uses his feet, gets too close to the pitch and defends quietly. Leach reckons pad first, but doesn't go for a review. Might have been bat first - inside-edged onto the pad"
"skidding into the pads, 90.4ks, turned through square leg"
"on a length and outside off, no shot from Rohit"
"Rohit steps out, gets close to the pitch, and whisks a single to mid-on"
"darted shorter and spins away outside off, Pujara leans back and defensively drops the ball to cover"
"another lbw appeal. Leach reckons it's pad first once again. This time the <strong>spinner wins an lbw appeal from Menon</strong>. Faster and flatter, sliding in towards off and middle from left-arm around. Pujara prods forward, but Ultra Edge confirms it's indeed pad first before Pujara nicked it. Pujara calls for a review, thinking he had hit the ball first. The tracker returns three reds and Pujara is gone. Another excellent decision from Menon. So, Leach gets Pujara once again"
"outside off on a full length, through to the keeper"
"pressed onto the back foot, and blocked into the covers"
"attempted leave, and stabbed down into the cordon as Stokes finds a bit of wobble on a very full length"
through to the keeper
"very full length, fourth-stump line, Rohit no-hits as Foakes gathers"
"wider line this time, very full once more, a leave-alone to complete another tight over"
"on the back foot, spinning away, patted into the covers"
"head right over the ball on the front foot, blocked on a middle-and-leg line"
"leaning right out of the crease to smother the spin, poked to cover"
"lovely tight lines from Leach, drawing Kohli forward on off stump"
"stabbed down into the crease, Kohli coming forward as a default"
shoulders arms as this one rips past Kohli's upraised gloves. Tidy work
"pushed out towards point, Rohit reaching for the full length, hands away from the body"
"back of a length, and hauled out to deep square leg with a cross-batted ping"
tucked off the legs to short midwicket
"banged in short, and <B>there's the breakthrough!</B> Wow, that's a vast moment in this match ... Kohli is drawn into a loose defensive waft as the ball gets big on him outside off, and Foakes snaffles the skipper for a duck! India have trudged along at barely a run an over, and it's given England the chance to pile on the pressure now"
full and threatening the front pad as Rahane plays forward to cover the fractional inward movement
"head over the ball, blotted into the off side"
pushed into the covers for the single
on the back foot and patted away
"back and across, into line to block back to the bowler"
hustled on the front foot as Leach dangles that one on a fractionally fuller length. Good bowling
"hint of turn from back of a length, Rahane rocks back and stabs a push into the covers"
"dipping on middle and leg, and blocked down the wicket"
"banged into the deck, just back of a length, pushed to point"
"flinched into the cordon as Stokes finds the edge again, albeit from an open face. Bounces well short of third slip"
"more hard lines from Stokes, just back of a length again, finding a disruptive area of the pitch at the moment as gully gathers"
"big hooping outswinger, too wide to bother with on this occasion"
"leaning onto the front foot, and blocked back to the bowler"
"wider on the crease to finish another maiden over, spearing a fuller length in towards Rahane's diligent front-foot block"
"skipping to the pitch, and dipping with a bit of tricksy drift. Strikes the pad but Rohit is a long way down"
"<B>aggression now from Rohit!</B> He's sensing a need to change the narrative here, and does so superbly, with a lofted thump through the covers, hitting on the up through the line"
"back on his stumps this time, opening the face to dab to backward poine"
"<strong>so close!</strong> A good leave in the end, but this one doesn't turn as Rohit leaves alone, and it misses off by a whisker"
"<B>huge turn and bounce!</B> Foakes does very well to gather at head height from a very full length, and even manages to whip off the bails, but never a danger of a stumping"
"forward, head over the ball, tucked to the on side"
"on the legs, tickled round the corner"
"rolls his fingers on a full length, looked like a cutter as it jagged back past a defensive raise of the bat"
"banged in short, and <strong>not remotely comfortably played! </strong> In fact, that's pinged Rohit <B>clean on the helmet!</B>. The ball bobbles down to backward square, but Stokes is really cranking it up in this spell. Nowhere near the pull shot, and out comes the physio"
"very full, and pushed through on a wider line. No stroke"
fired past the pads
"back of a length, off-stump line, fenced out to point"
"round the wicket, looped onto a good length, and blocked into the off side"
"back of a length, nudged to backward point with an open face, and a well-stolen single"
<B>a rare drag-down from Leach and Rahane doesn't miss out!</B> Flogged off the back foot through deep midwicket. That's cathartic
"pounded into the covers, but an excellent half-stop limits the damage"
"a skip to the pitch, and pushed to cover with bat and pad together"
stretching forward to push back to the bowler. Tidier finish to the over from Leach
"<B>over-pitched from Stokes, and clattered through the covers!</B> Slightly too wide for that full length, and nailed on the drive"
"drags his length back, Rahane hops into line to push to cover"
"<B>spooned into the leg side</B> as Stokes bangs it in short again. Midwicket would have been interested, but it is over his leg as it plugs in the deep"
"fuller length, and wider line. No stroke"
"hits the deck hard with a bit of nip back into the batsman, Rahane wears it on the gloves as he flinches to the leg side"
"<B>big hooping inswing!</B> That came from nowhere, as Rohit pokes back through the line, and squeezes a closed-face drive back past the bowler. Anderson will be interested by that delivery..."
"fuller length, attacking the pads, blocked back down the track"
"<B>pulled and not far from midwicket!</B> It scoots through to the boundary, but Sibley nearly got a hand to that first..."
"back on a length, head over the ball to defend"
"fully forward, and blocked back to the bowler"
"sturdy in defence, leaning into the forward stride"
"lots of air on this one, dipping into the toes and clipped airily to short midwicket"
"lots of air, and looped onto a good length outside off. Decent sighter"
tucked to the leg side
"twirled onto a good length, nudged off the legs to Pope under the lid"
"well bowled again, just threatening to grip from outside off as Bess tosses it up"
"<B>swept, there are two men back, but he's bissecting them both!</B> Bounces just inside the rope, good result for Rohit, but that was a bit chancy, didn't get complete hold of it"
"turn and bounce, as this flicks Rohit's arm-pit and deflects to the leg side. Lots going on in that over"
"<B>snorter to start!</B> A wicked full-length outswinger, curls past Rahane, who is turned into an S as it goes by"
"straightens on a wicket-to-wicket line, Rahane is cautiously forward to block"
"inswinger this time, only a gentle one, but signs that the ball is talking. Clipped to backward square and they hustle back for two"
"outside off, and through to the keeper"
drawn forward and punched into the covers
"<B>flicked in the air, just over the infield!</B> Two men turn to chase at midwicket, as Anderson unleashes another inswinger"
nudged out to square leg
"nudged with the spin, to the leg side again"
pushing forward on the front foot
"back of a length, a bit of extra bounce as Rahane works to leg"
"<B>full toss and nothing chancy about that one!</B> A freebie from Bess, patted through the covers like a nice friendly doggy"
"on the pads, nurdled to the leg side, will there be time for one more over?"
"tight line, outside off, dabbed to point"
"sliding down the leg side, shaping into the legs but over-cooking it"
poked off the legs to short midwicket
"on the front foot, pushed to mid-off"
"<B>edged and Stokes scoops it up at second slip!</B> A huge finish to a fine session from England, back of a length, a hint of movement away from a tentative bat, Rahane pushes at it fafefully and India lose their fourth!"
"nice and full outside off, Pant elects to shoulder arms"
"on a length and sliding into the thigh pad, Rohit offers no stroke"
"slower through the air on off stump, played back off the front foot"
"looped up on middle, driven with the spin to the right of midwicket"
"drag-down from Bess and spinning down the leg side, Rohit aims to haul it away over midwicket....but doesn't connect in the end. Foakes is defeated down the leg side as well. No chance for the keeper"
"full on off, forward and bunted down to long-on"
"floated up on off stump, Pant bends forward in defence"
"on a length and bending back in at off stump, played back to Anderson"
"back of a length and skidding in at a fourth-stump line, Rohit hangs back and defends it back once again"
"shorter and on off stump, Rohit shuffles across off, flapping it to midwicket"
"pitched up and just a shade outside off, nicely driven through the line, but straight to mid-off"
"on a length and Anderson brings another one back into Rohit, snags an inside edge which dribbles to the leg side"
"full and holding its line outside off, blocked to the left of Anderson"
"Pant dashes out of the crease, and pushes a full-toss down to mid-on"
"short and spins back in at off, Rohit jumps back and punches towards short midwicket"
"Bess errs in length. Dishes out a full-toss outside off, Rohit feats on it and belts it through the covers for four"
"tossed up, slower and fuller, spins in at off, Rohit shuffles across and plays it back to the bowler"
"sliding in at off, faster and flatter, Rohit pokes it away and keeps it out"
"darted on a back of a length and finishes on the hips, tickled to short fine leg"
"back of a length and wobbling away outside off, Pant feels for the ball and is beaten in the channel"
"on a length and straightens away outside off, Pant plays inside the line of it and is beaten on the outside"
"<strong>Pant edges it...and threads the cordon</strong>. Full, much closer to off, draws a iffy waft from Pant, but he plays with soft hands, and gets away"
"back of a length and nipping away outside off, Pant drags his bat inside the line and watches it settle into the gloves of Foakes"
"on a length on off, Pant gets halfway forward and defends it"
"full and wobbles away outside off, Pant swishes his bat out of the way and lets it pass"
"shorter and spinning into middle, Rohit uses the depth of his crease and hauls a pull to deep midwicket"
"loopier and fuller on middle, Pant jabs it back to Bess"
"slower through the air and drifts into leg stump, blocked"
"full and just a shade outside off, pushed back to Bess"
"Pant steps out, takes a full-toss, and strokes it back to Bess"
"shorter and skids on towards off stump, Pant leans back and has enough time to chop it towards the off-side sweeper"
"short at the body from round the wicket, Pant fends it off to point"
"fuller and sliding in towards off stump, Pant works it away towards the midwicket region"
"good length on off, Pant moves forward, opens the face, and dinks it to the covers"
"back of a length and around off stump, played up to point"
"back of a length and wobbling through the channel outside off, Pant drags his bat inside the line and lets it go"
"wide of the crease, angling into Pant's front-foot defence on off stump"
"tossed up outside off, but's too full from Bess. He overpitches it, Rohit stays leg-side of the line, and drills it away between cover and mid-off"
"Bess drags his length back and shoves it down the leg side, left alone"
"flighted on middle stump, calmly bunted down to long-on off the front foot"
"<strong>turn and bounce outside off</strong>, run away to point off the back foot"
"fuller on off stump, squeezed back to Bess"
"Pant runs down the track and hacks it towards mid-off. 'Caaaatch' is the cry, but the ball doesn't quite carry to that infielder"
"on a length and just a shade outside off, the ball doesn't quite come on nicely, check-driven to mid-off"
"short and wide outside off, doesn't bounce as much as Rohit expected it to. But he still adjusts to it and <strong>unleashes a jabbing punch through the covers</strong>. He goes airborne and hits it in the gap between point and cover"
"short of a length and outside off, Rohit rises on top of the bounce and flays it to cover"
"back of a length and outside off, Rohit elects to let this pass in the channel"
"on a length and homing into off stump, blocked to mid-on"
"back of a length and on a fifth-stump line, punchily played to the covers"
"Pant steps out, meets a full-toss, and pushes a single to mid-off"
"tossed up slower and higher, spinning into off, <strong>prodded off the inner half but to the left of short leg</strong>"
"back of a length and spinning into middle and leg, glanced to backward square leg"
"full on middle, Rohit stretches out and whisks a single to wide long-on"
"mighty full on the stumps, Pant jams it out to mid-on"
"Rohit feigns to step out, Bess pulls his length back and finds turn, defended quietly to the right of short leg"
"good length, Pant moves forward and blocks on off stump as the ball dribbles away to mid-on"
"fullish and outside off, Pant moves forward again, opens the bat-face, and steers it to point"
"pitched up and outside off, Pant is forward again, lunging out and slapping Anderson between point and covers for four. Pant is left overbalanced, but still finds enough power to ping the fence"
back of a length and comes back in after passing Pant who had ignored it in the channel
"full on the stumps, clipped straight to midwicket off the front foot"
"a bit too full and outside off, Pant drives and can't get it past mid-off"
"on a length and spins into middle, defended to short leg"
picked off through the vacant spaces at midwicket
Pant rolls out a reverse-sweep first ball from Root. He stretches out and drills it away through point. A tumbling save in the deep robs Pant of a boundary
"sliding into middle stump, forward and blocked into the covers"
"<strong>launched over mid-off for six!</strong> Pant charges down the track, gets close enough to the pitch, and hits it over the top"
"darted flat on middle and leg, Pant responds with a tight front-foot defence"
"on a length and outside off, Rohit runs it to gully with soft hands"
"on a length and wobbles away outside off, patted to cover"
"shortish on middle, played back to Stokes off the back foot"
"fullish and just a shade outside off, Rohit opens the face and guides it to cover"
"short and sliding into middle, Rohit jumps back, aims leg side, but ends up spooning a leading edge in front of cover. This pitch seems two-paced, but Rohit has dealt with it well enough"
"<strong>No fifty for Rohit as the returning Stokes traps him</strong>. Rohit calls for a review. Good length, starts outside off and jags back in viciously to beat the inside edge and ping him on the back leg in line with off. The tracker returns umpire's call on impact (marginal call on off) and it would have trimmed the bails, enough for the on-field out decision from Menon to be upheld. Rohit had looked to go leg side, but the ball skidded back in to pin him in front. Stokes is putting in a great shift on a near-40 degree day"
"round the wicket, darted in on a leg-stump line, and blocked"
"decent delivery, angled in from round the wicket again, pitching middle and straightening into a block to point"
"back of a length, outside off, poked though point for a well-acclaimed single"
"dipping on an off-stump line, and blocked again"
"tight lines to Ashwin, who crouches forward with bat and pad tight together"
"this one grips from just back of a length, Ashwin rides the turn to deflect to short backward square"
"round the wicket, dipping into the pads, and finds the gap at midwicket with a gentle steer"
"back of a length, pops into the splice as Ashwin plays back"
"fired down the leg side, Foakes tumbles to gather"
"loose from Stokes, a wide full-toss, and Ashwin just pats that through point with an open face. Easy pickings"
"outside off, full length, no stroke"
"banged in short, and Ashwin wears this on the gloves as he hops back into line. <strong>And that's hurt him</strong>... off comes the glove, it's his bowling hand too... but he's flexing it as the physio takes a look, so I think he'll be okay. Good aggression once more from Stokes though. He's putting in a shift"
"round the wicket, tight lines and dipping on a good length. Blocked on the front foot"
"skids on a touch, but not with the venom of Axar's standard wicket ball. Nevertheless Ashwin has to adjust late to save his stumps/pads"
nudged to the on-side
"tidy line and length from Leach, dipping on off stump, and punched off the back foot to point"
attempted cut but too close for the shot. Smart take from Foakes
stretching forward and blocked to the off side
"round the wicket, thumped in short, Pant swivels into a compact pull to midwicket"
"<B>another snorter from Stokes, and Ashwin is caught behind!</B> But he's <B>reviewing</B>. So similar to the Kohli delivery, banged in short, kicking through to attack the splice as he raised his gloves in defence... but that's <B>missed the bat and flicked the shoulder!</B> That's what DRS is for. A big moment"
"<B>fenced uncertainly through the cordon!</B> Fuller length from Stokes, and Ashwin, feet anchored in the crease, throws his hands and is lucky to escape"
punched with more conviction into the covers
"wider on the crease, angled into the stumps, pushed to point"
"in the channel outside off, scuttles through as Ashwin leaves alone"
"advancing to the pitch immediately, thumps the pad, deflects for the single, and they get overthrows as well as the shy goes awry. The Pant-Leach tussle gets lively immediately!"
"tucked off the legs, there's a man on the 45 too and he tidies up"
"<B>big spin, back into the inside edge</B>, but Foakes tumbles and can't reach it. Pant was right back on his stumps that time"
"spin again, into the hip and flicked to the leg side. Pant is playing within himself at the moment"
stabbed to backward point with a big stride and an open face
skidding on as Ashwin plays from deep in his crease. A probing over
"reaching for the wide one, on a full length, and thumped to short cover"
"very full, but shaping past Pant's legs"
"back of a length from round the wicket, open-faced steer down to third man"
"very full length, dipping into the pads on a leg-stump line, clipped to square leg"
"banged in short, and swinging away, Ashwin plays inside the line"
another short ball sails through
"over the wicket, pitching outside off, and turning into a back-foot block"
"whipped across the line, from outside off, hitting with the spin to midwicket"
tossed up from around the wicket and solidly blocked to mid-off
"open face, dabbed through point for another single"
"<B>exceptional timing off the back foot</B> Leach finds some turn but is fractionally short of a length, Pant rocks back and meets the spin into his stroke with a wonderful high-elbowed drive through wide long-off"
"flicked off the back foot, and Pope sprawls well but can't make the ground at short leg"
"on the back foot, and blocked to the leg side"
"hanging back in the crease, and dangling the bat outside off, poked to point"
"back of a length, Ashwin squares up on the back foot and pushes into the covers"
"now then, this is intriguing. We've gone upstairs for a <B>run out</B>... nah, not even close. Bairstow sliding in square leg and under-arming onto the stumps, but Pant put in a good dive and make it well"
