"poked off the back foot, into the on side"
"reaching forward, right over the ball, bat pushing through the line"
"jabbed to the on-side and <B>Pope hurtles for the quick single!</B> Direct hit with the shy, and the umpires are checking, but Pope seemed safely home. Very good early and decisive call"
"on the back foot, jabbed down to the leg side"
"nudged to the on side again, working with the turn"
"round the wicket, fuller length, bringing the stumps and pads into play as Stokes slides back to defend"
tapped for another single to keep the strike rotating
more turn and bounce as Stokes shoulders arms
"a wider line, flatter spin, Stokes ignores"
"leaning forward to defend, too full for the slog sweep that time so he presents a full face of the bat"
"chopped off the back foot, riding the extra bounce as Sundar drags his length back. In the air for a time, but bissects the close catchers as Siraj tumbles to field at backward point"
"out of the crease, good use of the feet from Pope who was trapped on the crease twice in the last Test. Tucked to midwicket and they opt against the tight single"
"round the wicket, blocked on the back foot, pushed to the leg side"
padded away to the leg side
fired down the leg side as Axar aims to cramp Stokes' arc
"sweep from Stokes, but the over-spin down the leg side eludes his intentions. Pant gathers well"
"off-stump line this time, and firm in defence on the front foot"
"<B>reverse sweep and that's Stokes' fifty!</B> Nailed through backward point, picked up on the length well and this has been an excellent return to form from a vital cog in England's middle order"
"round the wicket, poked to the leg side, short leg gathers"
"straightening on an off-stump line, Pope stretches into a solid block"
"a shuffle to the pitch of the ball, sharp feet again from Pope, midwicket gathers"
pressed into the off-side with a kneel into position
"round the wicket, another sashay out of the crease, and an easy-paced single to long-on"
"shaping down the leg side, and a grimace from Pant as he can't gather cleanly. Was it a chance? Don't think so..."
"swept, well enough, out to the leg side for another single"
"on the back foot, stabbed to the on side"
"round the wicket, cramping Stokes on the legs, as he slides back and blocks to leg"
"another reverse sweep, expertly placed out to deep point. This time the sweeper sweeps round to sweep up the sweep"
"on the back foot, and clobbered to deep point"
"leaning over the ball, blocked back down the pitch"
"quicker delivery, Stokes hops back and nudges into the gap at midwicket. Sharp on the first run, but can't turn it into a second"
"back round the wicket, Pope is committed to the front foot once more and presses urgently to cover"
"more light footwork, and punched to mid-off"
"round the wicket, no spin, sliding into the pads, and <B>Stokes is sent on his way!</B> He was beginning to look solid, but the arm ball strikes! Pope confirms that that's pretty adjacent, and Stokes flings his head back as he begins to march off"
"turn from off to leg, Lawrence splices down at short leg, <B>and that hits him on the boot!</B> A missed chance, he was standing up too soon!"
"pushed out to cover, a bit of a leading edge as Lawrence tries to find his range"
"outside off, through to the keeper"
solid block on the front foot
"back of a length, tight line, firm push to point"
"round the wicket, back-foot defence. A lot riding on Pope now, who has found some composure in this innings"
kneeling forward to defend once more
"pressed back up the pitch, another tight over is done"
high-elbowed prod to the on-side
"a wild slog-sweep, the ball's not quite there, and deflects clean off the knee-roll to leg slip"
shuffling to the pitch as Sundar pushes this across the right-hander. Defended
"pressed to mid-on, an easy single with the fielder set back"
blotted back down the track
a shuffle of feet and pushed back down the pitch
"round the wicket, holds its line and kisses a fat edge out to point"
"<B>clubbed through the line, over long-on!</B> That's good intent from Lawrence, more or less to the pitch of the ball, and good conviction through the stroke"
"<B>pounded with fast wrists through the covers!</B> A good double-whammy, seizing the fuller length and drilling it along the turf"
"a touch of width and more good contact, this time on the cut, but straight at point"
"pushed onto the back-foot, and nudged to the on-side"
"big appeal again as Axar slips the non-spinner into that gaping knee-roll, but that one is doing too much to hit leg"
"pressed round the corner, as England complete a full 50-over stretch ... small steps and all that"
tucked into the off side
"flinched off the hips, two men in close positions on the leg side are on alert"
"round the wicket, Pope advances to the pitch and pokes back at the bowler"
"drilled with lots of bottom hand, but the bowler gathers in his followthrough"
more scampering feet as Pope commits to the front foot to defend. This is confident defensive work so far
pressed into the covers for another single
"attempted sweep, turns into the pads but going over the stumps"
back to Plan A as Pope skips to the pitch to defend again
"more dancing feet, and a flick to midwicket. No way through there"
"opens the face outside off this time, and steals a brace of runs down through third man"
"two steps to the pitch once more, and a push to mid-off. And seeing as he's come so far already, he might as well carry on for the single"
"drilled along the deck, intercepted with a tumble in the covers"
"sliding onto the back foot, blocked to the off side"
chipped back at the bowler as Lawrence too advances to the pitch
"on the back foot, blocking on a fourth-stump line, into the leg side"
"skiddier delivery, punched off the back foot into the covers"
"stretching to the pitch once again, and defended"
"tight line and length, poked to cover"
"back of a length, chopped to third man as Pope rides the bounce well"
"shoulders arms outside off, fourth stump line"
"in the channel outside off, stalemate ensues. Ishant probing away, looking for the one that bends back into the timbers"
"tighter line, Lawrence is equal to it on the front foot, and blocks again"
"outside off, no appreciable movement, Lawrence offers a 'hello sailor' flick of the heel as he let this pass by"
"big turn, and thumped on the pad! Pope is far enough forward, and outside the line, to negate the appeal"
poked back down the track
"swept, out to deep square leg, picked up from an off-stump line"
"head over the ball, blocked back down the pitch"
nurdled to the on-side
"driven with intent, quickly to the pitch, and one hand comes off the bat as Pope lasers it to short cover"
"fizzing past the leg stump, Pant can't gather cleanly and they steal the bye"
"right up to the toes, searching for that swing, blotted to the on-side"
"very full, and blocked down into the crease"
"dipping on a full length, tucked to the on side"
"rolls the fingers on a full-length delivery, Lawrence is cautious in defence"
"<B>glorious finish to the session!</B> A pumped straight drive, clean through long-on. Beautiful timing, right under the nose on point of impact, and that's given Lawrence something to savour over his crumpets"
"back of a length and on a fourth-fifth stump line outside off, calmly defended back to the bowler"
"full and outside off, in the slot for the drive, but Pope doesn't really get his front foot moving. Instead, the hands do the job, swishing the ball to mid-off"
"full and on a fourth-stump line, Pope inches forward and prods it to the covers"
"wide of the crease, back of a length and holds its line outside off, tip and run to cover-point"
"<strong>edged and squirted away to the right of gully.</strong> Fullish and well wide of off, Lawrence goes searching for it and jabs an outside edge past Rohit"
"back of a length and slanting in at off, Lawrence goes back and across as he whisks it to mid-on"
"too full on middle, this non-turner is bunted down to long-on in fuss-free fashion"
"another non-turner, shorter and outside off, allowing Lawrence to jump deep in the crease and force the ball through the covers. Back-foot punch in the gap. Played, Dan"
"length-ball offbreak, finishes just a shade outside off, blocked back to Ashwin"
"<strong>Ashwin pleads for an lbw</strong>, he drops to his knee in his followthrough, but not given. Kohli decides against a review. Looks like Ashwin has hit the pad outside the line. Yes, indeed, Lawrence gets outside the line and misses this offbreak"
"shorter and outside off, chopped off the back foot to backward point"
"shorter on middle, negotiated off the back foot"
"good length on middle and leg, quietly tucked through square leg"
"bumper from Siraj, the batsman ducks under it. The ball balloons over Pant. He leaps and gathers it superbly. Too high and so that's a wide"
"full on the stumps, defended solidly enough"
"full and holds its line outside off, ignored"
"short and skidding back in at the top of off, jabbed back off the back foot"
"on a length and on off, Lawrence gets halfway forward as he blocks to cover"
"a bit too full and outside off, Lawrence reads the length well despite being tested by the short stuff. He moves forward and drives through the line, beating Siraj to his left and mid-off to his right. Beautiful stroke"
"on a length and turns into off and middle, blocked to short midwicket off the back foot"
down the track and quietly jabbed to the covers
"Ashwin drags it short and wide of off after seeing Pope advance down the track. Pope now uses the depth of the crease, and cracks a cut to the left of backward point for four. Good batting"
"nice and full, dip and turn for Ashwin, Pope seems to have got an inside edge onto the pad"
"on a length and drifts away outside off, run away past slip with ultra-soft hands"
"chipped with the spin through midwicket, there's protection in the outfield"
down the track and pushed back to the right of the bowler
"Lawrence skips out again, gets across the stumps and wears it on the thigh pad"
"tossed up outside off, spins and bounces sharply outside edge. Hits the seam and rags away past the bat"
"shorter and outside off, Lawrence rides the bounce and late-cuts to backward point"
"arm ball, sliding into the hips, knocked defensively to the left of short leg"
whipped off the back foot towards short midwicket
"dangled up outside off, spins in nicely, Pope stretches out and wears it on the front pad outside the line of off"
"looks like an under-cutter from Ashwin, <strong>skids past the outside edge</strong>"
"<strong>Ashwin gets Pope for the third straight time</strong>! Pops it to short leg. Bat-pad and then lobs to the right of short leg, where Gill snaffles it. Pope dares to step out to Ashwin once again. The bowler held this back, gave it more air, dipped at Pope. He still has a crack at it, having stepped down the track, and chips an inside edge which loops off the back pad to the close-in fielder"
full toss to get off the mark
""
""
""
pressed into the off side
"angled bat in defence, pushed to the off side"
tucked off the pads to the leg side
"turn from back of a length, Foakes is half-drawn into a poke but the ball zips past his edge"
"solid in defence once more, pushed back down the wicket, a maiden as Axar returns"
"back foot block, fended off a middle-stump line"
"length ball, sharp spin, Lawrence nudges towards midwicket"
fenced to the on side
""
"full on fourth stump, whipped down to long-on"
"sharp spin from a length, Foakes defends into the off side"
"Lawrence uses his feet, aims leg side, but is rapped on the pad, having got outside the line of the stumps"
"tossed up at off stump, blocked back to Axar"
"drifting down the leg side, away from the reach of the batsman"
""
""
""
stretching to the pitch to block
"nudged to the on-side, hitting around the front pad"
"open face, poked to point"
"<B>big fat edge and there goes another!</B> Rahane at slip, keeping low to scoop up the chance, as Ashwin slides the floater off the edge of a lunging blade from Foakes, who was set up by a big turner the previous ball and done all in by the next!"
"out of the crease for an exploratory defensive poke, into the off side"
"driven, dipping on a full length, into the covers"
"looped up outside off. Lawrence punches it to the left of short cover. Kohli gets a hand to the ball, deflecting it towards wide long-off"
"pulls his length back and attacks the stumps more, Lawrence goes back to block"
"steps down the pitch as Axar tosses it up on middle and leg, he nudges it towards midwicket"
"lovely, measured batting from Lawrence. He sees the length short. He shifts his weight beside the ball and calmly slices it to the right of backward point"
"defends a flatter, good length ball on leg stump"
<b>extra bounce</b> and it appears the ball has ricocheted off short leg's boot and into the keeper's hands! <b>The soft signal is out</b>. Lawrence is on his back foot because he has to be. But the ball kicks up off a length and strikes his bat very very high. He does all he can to try and keep the ball down and replays suggest he miiiiiiiiiiight just have done it. A zoomed up shot of short leg's boot seems to show the ball has bounced juuuuuuuuust in front of him and only then popped up towards Rishabh Pant. Still the third umpire is asking for more angles. He wants to be perfectly certain. This is quite tight. And the decision is NOT OUT. The right call.
shapes to cut a good length ball just outside off but misses
presses forward to block a tossed up delivery on off stump.
steps out to whip a full one on his pads through square leg
gets stuck on his crease because he doesn't know how the ball is going to turn and then only reads it off the pitch to flick it to short leg
"<b>ooooh, this goes the other way</b>! A flighted delivery pitching on off stump holds its line and Bess gets squared up as he defends, getting an outside edge which bounces past slip's right"
"another ball that seems to bounce a little more than the batsman expects, Lawrence standing up to his full height and defusing the ball through square leg"
"rocks back, goes deep in his crease and pulls this length ball over deep backward square for four"
"full, and worked towards the vacant midwicket region for a quick single"
"good length, just outside off. Angling into the stumps. Worked off the back foot towards the leg side"
"fuller, on middle. Enough time for Bess to go deep inside the crease. Nudged off the pads to the leg side"
"fullish, on off. He lunges forward and defends"
full on off. Skips down the ground and flicks to midwicket. Finds the fielder though
"<B>the umpire's on the floor!</b> Tossed up outside off, and he comes down the ground before absolutely hammering a drive straight back for four. Ashwin stuck his right hand out, and he got a finger to it, but no stopping that"
"full, on off stump. Closes the bat's face and nudges it to midwicket"
"extra air, lands outside off stump. Drives down the ground to long on for a jogging single"
"full, on off. Closes the bat's face and works it leg side"
full just outside off. Turning into his pads. Bat-padded off the front foot
"fullish, just outside off. He skips down the ground, and taps it away to the off side"
<B>easy for Pant</b> as Lawrence runs down the deck again. This time he's nowhere near the pitch of the ball. A bit of turn away and the keeper does the rest. Tries another big sloggish attempt to reach his fifty...this time he's caught napping by a length ball from Patel
"over the stumps to Leach. Length ball outside off. Goes onto the back foot, and nudged to short third man"
"full, on middle, from around the stumps. Big stride forward and blocked with the bat"
<B>umpire Menon says out for lbw but Bess reviews</b>. This was a length ball landing on off and angling into his pads. Ball goes past Bess' inside edge and hits the front leg as he defends down the wrong line. Ball tracking says that's crashing into leg stump with the around-the-stumps angle from the bowler. Axar one away from a five-for
"full, just outside off. Turning in from over the stumps to the left-hander. Defended"
"full on off. Turning in, He sticks his front leg out, pads it away"
"length ball, outside off from around the stumps. Turns away, left alone"
full on leg. Defended off the front foot and the ball squirts away to square leg
"fullish, on off stump. Defended off the front foot"
"full, on off. Tapped towards cover, but they choose not to run"
"over the stumps now. Full on leg, and the defensive shot goes towards square leg. Leach is off for one, and Anderson is late to get off the blocks. Fielder has a shy at the bowler's end, and Anderson was gone if that hit"
"full, just outside off stump. Defended with the bat's open face to the off side"
"good length, outside off. Rocks back, shuffles across, and fends off the back foot"
"good length, outside off. <B>Punched off the back foot</b> to the gap at cover point. They come back for a double"
full on off stump. Defended inside-out towards cover
"<B>the audacity! Reverse swept</b> for four. Full on leg stump, and angling across Anderson. He is quick to choose the shot, and caressed to the conventional third-man region"
past the outside edge! Tries to defend with no footwork
"fullish, on leg stump. Wants to defend leg side. Leading edge takes it to short cover instead"
"<B>edged</b> but one bounce to the cordon. Full, on off, and he played with soft hands"
"extra air, full on leg stump. Nudged past short leg... England move to 199"
"<B>beautiful</b> delivery. Full, from over the stumps. Lands on middle, and turns past the bat to Pant"
<B>first 200+ score for England since the first innings of the first Test</b> as this freebie from Ashwin - a full toss - is clobbered through the covers for four
"full, on middle. Defended"
"full, on middle. Defended, playing for the angle instead of the turn. Soft hands again"
"good length, on off. Turning into the stumps. Defended off the back foot"
"<B>edged</b> past the cordon to short third man. Short-ish ball, and he tried to cut it"
"full, just outside off stump. Defended with soft hands off the front foot"
"full, just outside off stump. Defended with soft hands once again"
"full on off, and Leach looks to defend off the front foot. Inside-edged onto his pads"
"full, on middle. Tentatively defended, and the inside edge flies past short leg"
"full, on off. Reaches at it, with the bat's open face. Ball dribbles away to short third man"
"full on leg stump. Defended, awkwardly, off the front foot"
"good length, on leg stump. Defended off the back foot. Full face of the bat"
"good length ball, lands outside leg. Leach misses the flick. Hits his pad"
"<B>England all out? Leach reviews</b>. Ashwin comes over the stumps this time, and gets something to happen first ball. Fullish on off, and angling in. Leach has bat and pad together, but the ball has hit the pad first before hitting the blade. Ball tracking says hitting in front of middle, and crashing into middle and leg. <B>England all out for 205</b>"
"swing from the outset, on a full length as well, as Gill blocks on the back foot. Anderson was a touch short last week, defending his figures rather than attacking the game..."
"tight line, hint of shape once more, Gill squares up in defence, right in front of his stumps"
"<B>thumped on the pad and up goes the finger!</B> Gill reviews, but that looked pretty adjacent, middle and leg line, straightening into the knee-roll... no bat involved, so here comes Ball Tracker ... <B>clipping the top of leg, and the decision stands!</B> Gill is gone for a duck, and England have their incision!"
"sturdy in defence, blocking from deep in the crease"
"standing tall on the back foot, blocked down into the crease"
through to the keeper on a very full length outside off. That is the start that England so desperately needed
"a bit of a loosener, but Stokes gets away with it, as Rohit leans into the over-pitch and finds short cover"
"wider line but a better length, Rohit strides across to cover the movement and leaves alone"
"back of a length, hitting the deck but not getting up too alarmingly. Met at the top of the bounce with a compact block"
"back of a length, enough width to free the hands, and flashed through the cordon, in the air for a while, but pretty much played for, wide of third slip. <B>India are up and running</B>"
"tighter line, on the legs, nudged to square leg"
"short and sharp, but wide of off stump, Rohit threatens to swing into a pull but that's outside his arc"
"full length again, wobbling through the air as Pujara defends in front of off"
"leaning into a defensive push on a wider line, angled into the covers"
"left alone as Anderson skims one through wide of off stump, doesn't get up much"
"curls back into the right hander, but from back of a length, Pujara lifts his gloves out of harm's way"
"line and length, drawing the respectful block on the front foot"
"back of a length, tucked in on off stump, defended down into the crease to complete another maiden over"
poked into the off side
"attacking the top of off with a tighter line, Rohit gets behind the line to defend"
"blocked on the back foot again, as Rohit slides back and across to defend"
"wider on the crease, exacerbating the angle into the right-hander, but Rohit adjusts to poke to the off side"
"angled into the legs, a solid clip off the pads but midwicket gathers"
"tailing into the pads, on an off-stump line, decent final delivery to dot up the maiden. England have started brightly with their makeshift new-ball attack"
"good carry as Anderson bends his back on an off-stump line, Pujara shoulders arms"
another leave-alone outside off
"tailing into the front leg, as Pujara covers the off stump with a vertical bat"
"head over the ball, stretching to meet the full length"
blotted to the on-side
"outside off, skitters through to the keeper, no stroke offered"
"spin from the outset, wide of off stump as Rohit leaves alone"
"decent line, straightening on off stump and stabbed off the back foot to cover"
"more turn, but a fraction too short to trouble Rohit on the back foot, who opens the face to pinch a single through point"
"whipped off the toes, out through midwicket, a touch of air lures Rohit to the pitch, and a decent chase and slide limits the damage"
"back of a length, chopped hard to point, Leach got away with one there"
"advancing to the pitch, and poked out to cover"
"tucked to the leg side, as Anderson probes away on a full length, a hint of shape back into the right-hander"
"shuts the door on a tight off-stump line, firm in defence back down the pitch"
"outside off, full length again, no stroke offered"
"flogged on the up, a touch expansive as Rohit loses his bottom hand as the ball hits high on the splice. A touch more lift off the deck that ball"
"softer hands, and pressed out to point with more restraint"
"on the back foot, and blocked back down the track"
"clipped through midwicket, just a touch over-pitched and Pujara seizes on the chance to get out of his crease"
"leaning forward, a full face of the bat, pushed to the off side"
"solid in defence, head over the ball, a shuffle to the pitch of the ball once more"
"looped up, and dipping on a middle-and-leg line, Pujara meets it with a full face to mid-on"
"on the back foot, turning from middle to off, and poked to point"
"big spin, but <B>expertly pillaged by Pujara!</B> Waiting on the back foot, until the ball was almost past his crease then jabbing out the blade to pick off the late cut through third man"
"full length, solid block"
"a hint of shape back into the right-hander, met under the eyeline with soft hands into the covers"
left alone outside off
"blocked on the back foot, rising in defence"
"much fuller length, driven with timing rather than power, and Anderson does well to snaffle that in his followthrough"
"outside off, Anderson joins the dots for his <B>fifth consecutive maiden</B>. How many more dare England give their only seamer? I guess one more before the close won't hurt"
"stab of the bat, and that's gone very fine past short leg. An inside edge as Pujara gallops to the pitch, but safe enough"
"on the back foot, opening the face to steer into the covers"
"punched on the up to deep point, another single to the cause"
"a bit of drift for Leach, and soft hands keep the ball down as Rohit fences through the cordon"
"stepping to the pitch, with fairy-liquid-soft hands. Pushed into the off side"
"prodded into the covers, solid once more"
"looped onto a full length, pressed very firmly through long-on, and a <B>no-ball to boot!</B> Welcome back Dom ..."
"urgh, a pretty horrid half-tracker, but Rohit's pull can't quite make full contact, the sweeper tidies up"
"fenced towards short leg, and <B>nearly!</B> Short of the ever-alert Pope as he dives to his right"
opens the face for a jab through point
"turn from an off-stump line, half an appeal for ... not sure what really"
"another half-tracker, sliding down the leg side, but Rohit opts not to chance his arm, and he gets away with one"
"better ball to finish, much tighter line, solidly pressed back down the pitch"
nudged to the on side
"on the back foot, open face, poked to cover"
"outside off, back of a length, slapped through the covers with decent placement. Pujara making full use of his crease to capitalise on the bowler error"
"stretching forward, poked down towards the cordon"
fenced to the off side
"lots of air, and skips on into the pads, decent finish to an intriguing day's cricket"
"nice and full, swings in towards off stump, gentle swing. Rohit sizes it up, inches forward, and pushes it through the midwicket region. First runs off Anderson this innings"
"Anderson drags his length back, sustains the inswing, <strong>Rohit simply pads up to it</strong> and wears it above his back thigh. This was surely bouncing over the stumps"
